video_id,title,publishedAt,channelId,channelTitle,categoryId,trending_date,tags,view_count,likes,dislikes,comment_count,thumbnail_link,comments_disabled,ratings_disabled,description
"YZMgi4HjYHQ","Je coache GregMMA de @karatebushido pour son combat face à Locicero","2023-07-27T11:53:33Z","UCS1qLfKuH3j2q7mUk1jg85Q","stephane malassagne","23","23.02.08","Comédie|Humour|GregMMA|Coaching|Combat","765202","31828","0","1982","https://i.ytimg.com/vi/YZMgi4HjYHQ/default.jpg","False","False","Rejoins moi sur Instagram: https://instagram.com/stephanemalassagne?igshid=MjEwN2IyYWYwYw==Le 28 juillet 2023 Greg MMA Bouchelaghem va faire son grand retour à la compétition après presque 17 ans d’absence en affrontant l’italien Locicero ! Pour l’occasion il a fait appel au coach Stéphane Malassagne, alias “ le démarreur ” qui va lui apprendre de nouvelles méthodes d’entraînement. Réalisation : Gabriel Guerra Taveira https://instagram.com/ohgamin_?igshid=Y2I2MzMwZWM3ZA==Chef Op : Ludovic Maudet https://instagram.com/ludo_maudet?igshid=MzRlODBiNWFlZA==Son : Paul Claeys https://instagram.com/p.claeys?igshid=MzRlODBiNWFlZA==Mixage : Arthaud Versaveaud  https://instagram.com/arthaudversaveaud?igshid=MzRlODBiNWFlZA==Régie : Jodan dadinho https://instagram.com/jordan_dadinho?igshid=MzRlODBiNWFlZA== Assistante : Benedicte Poumarede Avec : Greg bouchelagem : https://instagram.com/gregmma?igshid=MzRlODBiNWFlZA==Titouan GrosjeanDucateau: https://instagram.com/titouan.grosjeanducateau?igshid=Y2I2MzMwZWM3ZA==Lucas Fontayne : https://instagram.com/lucasfontayne?igshid=Y2I2MzMwZWM3ZA==Alexis Bossey : https://instagram.com/alexisbossey?igshid=MzRlODBiNWFlZA==Un grand Merci à : Johann Vayriot : https://instagram.com/johannvayriot?igshid=MzRlODBiNWFlZA==Yohann Albo : https://instagram.com/yohannalbo?igshid=MzRlODBiNWFlZA==Maccabi Paris : https://instagram.com/maccabiparis?igshid=MzRlODBiNWFlZA=="
"6mArdgoBIgk","On Cambriole quelques Maisons, mais en VR","2023-07-28T12:47:42Z","UC4g44az5Aco8hUSkYraVx8Q","Makse","20","23.02.08","Makse|Break In|Gameplay|fr|VR|Valve Index|The Break-in","97996","3897","0","116","https://i.ytimg.com/vi/6mArdgoBIgk/default.jpg","False","False","Makse et Zeny pratiquent l'odieux larcin en VR sur The Break-InJe stream ici régulièrement : https://www.twitch.tv/makse_tvViens sur mon Discord : https://discord.gg/JKcbsYPJVs"
"LN2FGLy7Ru4","ILS ONT REFAIT GRANNY EN HD ET C'EST ENCORE PIRE !","2023-07-28T16:52:01Z","UChrdeOqH8JaOiMvDEYGreKA","SEROTHS","24","23.02.08","Seroths|seroth|jeu video|gaming|rhino","112207","8112","0","336","https://i.ytimg.com/vi/LN2FGLy7Ru4/default.jpg","False","False","Gameplay de Granny RemakeAchète tout tes jeux moins chers avec mon lien juste ici - https://www.instant-gaming.com/fr/?igr=serothsigJe suis en live quasi tout les jours vers 13h sur Twitch - https://twitch.tv/serothsDeviens un Rhino et bénéficie d'avantages exclusifs :https://www.youtube.com/channel/UChrdeOqH8JaOiMvDEYGreKA/joinTout mes réseaux sociaux pour rester au courant - https://linktr.ee/serothsSoutiens la chaine en achetant mes T-Shirt ici : https://seroths.store"
"cJ1NChrtbqk","3 SERIALS KILLERS QU’ON NE RETROUVERA PROBABLEMENT JAMAIS 🔪","2023-07-27T17:48:55Z","UC9cMapj2zFk0LR4fiRx2HlA","Horror Trash","22","23.02.08","[none]","437669","24463","0","804","https://i.ytimg.com/vi/cJ1NChrtbqk/default.jpg","False","False","Le New york Times l’appelait : La ville des Calamités. Ensevelie sous les ordures, empestant les égouts, Avec près de 3 millions de personnes vivant dans des bidonvilles.. plusieurs dizaines, voire centaines de milliers dans la rue.. Dans les années 90, Calcutta, c’était une ville remplie de désespoir. Les circonstances étaient réunies, pour voir apparaître… Un monstre !▼▼ RÉSEAUX SOCIAUX ▼▼💃  TikTok https://www.tiktok.com/@trasheurs📷 Instagram https://www.instagram.com/trasheurs.v...😂 Facebook https://www.facebook.com/trasheurs.vi...👻 Discord https://discord.gg/Ctgy3xtp9h"
"-7a5vlDGSDQ","Ruud Battles Fils; Zverev, Musetti Play | Hamburg 2023 Quarter-Final Highlights","2023-07-28T19:28:28Z","UCbcxFkd6B9xUU54InHv4Tig","Tennis TV","17","23.02.08","Tennis|Sport|Sports|ATP|ATP Tour|Hot Shots|Highlights|Tennis TV|sports highlights|tennis highlights|highlight reel|tennis videos|best tennis videos|atp tennis videos|tennis live|tennis streams|tennis streaming|atp streams|Hamburg Highlights|Casper Ruud|Ruud|Ruud Highlights|Daniel Altmaier|Zhizhen Zhang|Zhang Highlights|Arthur Fils|Fils|Fils Ruud|Ruud Fils Highlights|Hamburg Quarter-Finals","233126","3029","0","675","https://i.ytimg.com/vi/-7a5vlDGSDQ/default.jpg","False","False","SUBSCRIBE to our channel for the best ATP tennis videos and tennis highlights: https://www.youtube.com/tennistv?sub_confirmation=1Watch official ATP tennis streams from every tournament: http://tnn.is/YouTubeTennis TV is the OFFICIAL live streaming service of the ATP Tour.Tennis TV features live streaming and video on demand of ATP tennis matches in full on PC, Mac, mobile & tablet apps on iOS & Android. Download the app to stream on your device: http://tnn.is/YouTubePlus Tennis TV is also available to stream tennis on your TV on Apple TV, Roku, Amazon Fire TV, Samsung Smart TV, LG Smart TV, Android TV, Xbox One as well as AirPlay and Chromecast.Get help on Tennis TV with our virtual assistant: https://tnn.is/help-youtubeBuy Tennis TV merchandise in our store: https://tnn.is/store-youtubeWatch the ATP Tour via your local TV broadcaster: https://go.watchtenn.is/atp?p=yt&source=ttvTo enquire about licensing ATP Tour footage contact IMG Replay: http://imgreplay.com/client/atp_media#tennis #tennistv #sports"
"6GATRApPww8","Burna Boy - Big 7 [Official Music Video]","2023-07-27T23:00:10Z","UCEzDdNqNkT-7rSfSGSr1hWg","Burna Boy","10","23.02.08","burna boy|burner boy|burnaboy|Damini Ogulu|Atlantic Records|reggae|reggae dancehall|Nigerian|Lagos|sekkle down|heaven's gate|nigerian music|ye song|ye ye|love damini|new albm|last last|burna|love|damini|afrobeats|big 7|i told them","4105213","115724","0","8635","https://i.ytimg.com/vi/6GATRApPww8/default.jpg","False","False","Burna Boy - Big 7Stream/Download: https://Burna.lnk.to/Big7Pre-save ‘I Told Them…’ dropping 8/25https://Burna.lnk.to/IToldThemLabel: Atlantic Records / Bad HabitVP Marketing: Brianna HarrisonVideo Commissioner: Kareem JohnsonDirector: Benny BoomProducer: Melissa LlewellynCinematographer: Parris Stewart1st AD: John Mingalone2nd AD : Jules CortezEditor / EFX: KeatsColorist: Arianna Shining StarSubscribe for more official content from Burna Boy: https://Atlantic.lnk.to/BurnaBoySubscribeFollow Burna BoyWebsite : https://Burna.lnk.to/OfficialInstagram: https://Burna.lnk.to/InstagramTwitter: https://Burna.lnk.to/TwitterFacebook: https://Burna.lnk.to/Facebook TikTok: https://Burna.lnk.to/TikTok Triller: https://Burna.lnk.to/TrillerListen to Burna BoyYouTube: https://Burna.lnk.to/YouTubeSoundcloud: https://Burna.lnk.to/SoundCloudApple Music: https://Burna.lnk.to/AppleSpotify: https://Burna.lnk.to/SpotifyDeezer: https://Burna.lnk.to/DeezerBoomplay: https://Burna.lnk.to/BoomplayThe official YouTube channel of Atlantic Records artist Burna Boy. Subscribe for the latest music videos, performances, and more.#BurnaBoy #Big7 #IToldThem"
"qnEy6NmeT8E","HIGHLIGHTS | Scotland v Italy | The Famous Grouse Nations Series","2023-07-29T17:19:07Z","UCycrxh2r7VKKxP-rfa9-cfw","Scottish Rugby","17","23.02.08","Scottish Rugby|Scotland Rugby|Scotland|Rugby","157098","879","0","112","https://i.ytimg.com/vi/qnEy6NmeT8E/default.jpg","False","False","See highlights from Scotland's opening fixture of the The Famous Grouse Nations Series 2023.🏴󠁧󠁢󠁳󠁣󠁴󠁿 Join The Conversation: https://www.scottishrugby.org/Instagram: https://www.instagram.com/scotlandteam/TikTok: https://www.tiktok.com/@scottishrugbyTwitter: https://twitter.com/scotlandteamFacebook: https://www.facebook.com/scottishrugbyLinkedIn: https://www.linkedin.com/company/scot...Sign-up for our newsletter today to receive the latest updates from Scottish Rugby straight to your inbox: https://www.scottishrugby.org/newslet...The Official Scottish Rugby Podcast brings fans exclusive behind the scenes interviews and information, news and discussion from the home of Scottish Rugby: https://www.scottishrugby.org/the-off...#Scotland #Rugby"
"gxeyC1cPJsA","TREASURE - 'BONA BONA' M/V","2023-07-28T09:00:09Z","UCx9hXYOCvUYwrprEqe4ZQHA","TREASURE (트레저)","24","23.02.08","YG Entertainment|YG|와이지|K-pop|트레져|트레저|TREASURE|CHOI HYUN SUK|JIHOON|YOSHI|JUNKYU|YOON JAE HYUK|ASAHI|DOYOUNG|HARUTO|PARK JEONG WOO|SO JUNG HWAN|최현석|지훈|요시|준규|윤재혁|아사히|도영|하루토|박정우|소정환|TREASURE MOVE|T5 MOVE|MOVE|트레저 무브|T5|T5 무브|REBOOT|트레저 REBOOT|트레저 리부트|트레저 정규2집|TREASURE REBOOT|TREASURE 리부트|BONA BONA|I WANT YOUR LOVE|RUN|MOVE (T5)|G.O.A.T|멍청이|STUPID|어른|THE WAY TO|WONDERLAND|B.O.M.B|LOVESICK","20121343","602689","0","222937","https://i.ytimg.com/vi/gxeyC1cPJsA/default.jpg","False","False","TREASURE – BONA BONA낮에 타는 태양새벽의 별 같아내 세상 속엔 네가매일 떠오르니까Baby don’t cry 꽉 잡아 여길 떠나너와 내가 영원할 곳으로Cuz I can’t stop 도망가자 여긴 폭탄우릴 파괴하는 것들뿐이야You are magic in my mind정해진 운명은 없다고 하지만수만 번 생각해 봐도눈을 뜨고 태어났을 때부터 난Born to born to born to love yaYeah yeahBorn to born to born to love yaOhBorn to born to born to love ya홀린 듯이뒤꽁무니쫓아가지홀린 듯이더 빠져 DeepFollow your lips네 맘에 문 열어 Door파고들어 너의 CoreForever ever all long갈 수 있게AbracadabraBorn to love ya 널 원해 전부 다거절은 거절해 난너 말고 아무것도 안 담아네 품에 난 갇혀감싸줘 Xs and Os널 반복되는 매 생마다Born to love ya 찾았어Again & again 돌고 돌아서마침표 팍넌 내 마지막영원히 놓지 않아No doubt눈이 번쩍 뜨여졌어 너란 보석너를 갖고 싶어 훔쳤으니까나를 던져 너를 건져Come closer우리 사랑의 시작일 뿐이야You are magic in my mind정해진 운명은 없다고 하지만수만 번 생각해 봐도눈을 뜨고 태어났을 때부터 난Born to born to born to love yaYeah yeahBorn to born to born to love yaOhBorn to born to born to love ya아침 해가 뜰 때까지Let’s speed it up let’s speed it up달아나 지구 끝까지Let’s speed it up let’s speed it up둘만의 섬으로 가자다른 사람은 안 돼 Baby you’re all that I needNo넌 내 삶의 Climax뜨거워져 Burning in love하얗게 불태워 You’re my adrenaline넌 내 삶의 Climax뜨거워져 Burning in love하얗게 불태워 You’re my adrenalineBorn to born to born toOh oh oh oh ohLove ya love ya love yaOh oh oh oh oh oh oh ohBorn to born to born toOh oh oh oh ohLove ya love ya love yaOh oh oh oh oh oh oh ohBorn to born to born to love ya#TREASURE #트레저 #2NDFULLALBUM #REBOOT #MV #BONABONA #OUTNOW #YGAvailable @ https://treasure.lnk.to/REBOOT_More about TREASURE @https://yg-treasure.comhttps://www.youtube.com/OfficialTreasurehttps://www.facebook.com/OfficialTreasurehttps://www.twitter.com/ygtreasuremakerhttps://www.instagram.com/yg_treasure_official"
"rrYenMOo8Rg","Qualifying Highlights | 2023 Belgian Grand Prix","2023-07-28T17:00:49Z","UCB_qr75-ydFVKSF9Dmo6izg","FORMULA 1","17","23.02.08","F1|Formula One|Formula 1|Sports|Sport|Action|GP|Grand Prix|Auto Racing|Motor Racing","4194819","77978","0","3451","https://i.ytimg.com/vi/rrYenMOo8Rg/default.jpg","False","False","Catch up with all the action from Spa as the rain cleared and the track got faster and faster. For more F1® videos, visit https://www.Formula1.comFollow F1®:https://www.instagram.com/F1https://www.facebook.com/Formula1/https://www.twitter.com/F1https://www.twitch.tv/formula1https://www.tiktok.com/@f1#F1 #BelgianGP"
"bUNOOEmdLMI","Ce MINI PC Gamer va TUER les CONSOLES !","2023-07-28T17:35:33Z","UCU8_onYYhNxwGUB3hA34C4Q","FrenchHardware","20","23.02.08","HardwareFR|hardware|FrenchHardware|pc|gamer|ordinateur|High-Tech|informatique|AffairesPC|FrenchHardware.fr|pc gamer|pc gamer pas cher|setup|setup gaming|config pc|pc pas cher|FlowUP|Mini Pc|Mini Pc gamer|Mini Pc minisforum|Pc va tuer la console|Ps5 vs Pc|Test mini Pc gamer rtx 3070|Ce mini Pc gamer va tuer les consoles","168143","10675","0","476","https://i.ytimg.com/vi/bUNOOEmdLMI/default.jpg","False","False","Un mini Pc gamer Amazon pas cher, plus petit et plus puissant qu’une PS5 ca existe vraiment ? Le tueur et la fin des consoles ?📧 Email Pro (uniquement) : Contactpro@frenchhardware.beNotre chaine secondaire Hardware : https://bit.ly/3mqMzdbLien du MINI PC : https://amzn.to/47b7My0GVGmall BON DE RÉDUCTION DE 35% : FHVIPWindows10 pro key(12€):https://bit.ly/Win10FHVIPWindows10 home(11€):https://bit.ly/homeFHVIPWindows11 pro(18€):https://bit.ly/Win11FHVIPOffice 2016(21€):https://bit.ly/2016FHVIPOffice 2019(38€):https://bit.ly/2019FHVIPOffice 2021(44€):https://bit.ly/2021FHVIPNos PC FLOWUP : https://www.flowup.shop/PC 1200€ : https://bit.ly/3NNiGz2PC 1500€ : https://bit.ly/3P6rIbpPC 1750€ : https://bit.ly/3RgXswfPC 2600€ : https://bit.ly/3bSLI2QNotre site (Configs, TOP, Comparateur, etc) : https://frenchhardware.fr/Retrouvez nous  :► Instagram : bit.ly/2Sa1w4f► Twitter : bit.ly/3l0o1or►TIKTOK : https://www.tiktok.com/@fhdwofficiel?lang=fr► Facebook : bit.ly/3kYmnnq► Snapchat : FrenchHardware► Discord : https://discord.gg/mWSm2JZf9v"
"MLhUI0yIHoo","Finir Pokemon Soleil avec un Froussardine (sans talent)","2023-07-28T15:00:14Z","UCnq2HPktfr8t_oiUepe8ThQ","Vetea TV","20","23.02.08","pokemon|pokemon challenge|vetea tv|finir pokemon avec|vetea|veteatv|finir pokemon avec un seul pokemon|froussardine|pokemon soleil|pokemon lune|wishiwashi","57902","4503","0","370","https://i.ytimg.com/vi/MLhUI0yIHoo/default.jpg","False","False","Salut Youtube !On se retrouve enfin pour une vidéo un peu longue sur un pokémon ridicule, minuscule et parfaitement naze pour mon grand comeback.Je ne sais pas encore combien de temps je mettrais pour les prochaines vidéos mais pour le moment j'suis chaud !🎨 Merci à Sachem pour ses logos, les perso et pour la bannière, allez voir son Instagram !https://www.instagram.com/sachemart/🤖 Mon p'tit Discord pour me faire des propositions, pour papoter un peu et pour avoir des nouvelles sur la chaîne : https://discord.gg/XvUCfVex77Si vous voulez me soutenir financièrement :💰 Mon p'tit nouveau Tipeee (rip utip) : https://fr.tipeee.com/veteatv/👾 Mon p'tit Twitch : https://www.twitch.tv/vetealive🐦 Mon p'tit Twitter (je poste rarement mais je suis toujours dans le coin) : https://twitter.com/VeteaDarkzepSi vous avez aimé la vidéo, faites ce que vous voulez, si vous l'avez vu, c'est déjà cool !"
"5EAGar53fJg","Je reproduis les MEILLEURS bonbons Tiktok ! (Freeze dried candy)","2023-07-28T15:03:49Z","UCxU8qpzG9COIWpurBVF8a2w","RAVEN","22","23.02.08","fun|laugh|rire|wtf|reaction|raven|insane|des barres","72784","5062","0","2081","https://i.ytimg.com/vi/5EAGar53fJg/default.jpg","False","False","Téléchargez gratuitement Recoverit pour récupérer vos données perdues facilement : https://bit.ly/3Kharw1💡Wondershare Recoverit peut récupérer intégralement vos fichiers, vidéos, photos, audios et emails, etc. supprimés ou perdus, essayez-le dès maintenant !Miniature: Raven.Contactez moi :Contact me : ►📬 E-mail         ¤ : ravenofficiel0@gmail.com ►📸 instagram  ¤ : raven_video ►👻 snapchat    ¤ : playinguitar9"
"qU3WmRKT-2U","Didi B, Franglish - S’envolement (clip officiel)","2023-07-27T18:00:09Z","UClzKdPhr7GrMtFFVcgpMiLg","Didi B","10","23.02.08","[none]","648752","44218","0","2070","https://i.ytimg.com/vi/qU3WmRKT-2U/default.jpg","False","False","Didi B feat Franglish Available : https://orcd.co/senvolementMusic : Seny au piano, Max à la guitareDirector : Fanatik ProdMix : Rémy BellaicheMaster : Masterdisk à ParisConnect With Didi B :http://www.instagram.com/didibofficialhttp://www.facebook.com/didibhttp://www.twitter.com/didibofficialMusic Video by Didi B performing S’envolement.©️2023 New Mindset / RepatAgency"
"JRQtkLhqNug","JE TESTE ENFIN LE FRUIT du POISON sur BLOX FRUITS !! (Blox Fruits #57)","2023-07-29T09:07:17Z","UCHQaihsDwfNQu88oyLqob6g","GUIZMOW 2","20","23.02.08","havocado|gang beasts|koco|blackbird|guizmow|guizmo|gugu|gizmo|multigaming|fun|funny moment|funny|gaming|roblox|cache cache|furious|jumper|prison|évasion|braquage|redkill|niveau|rapide|gros|race|clicker|course|voler|robux|pirate|blox fruits|leopard|sea 3|dough|fruit|blox|blox fruit|donut|crb|lined|katakuri|V2|chocoh|big mom|amour|love|event|sabo|combat|style|dragon|anniversaire|doflamingo|barbe noire|meilleur|crocodile|zoan|phoenix|lumière|magma|glace|rare|bouddha|light|controle","89765","4657","0","924","https://i.ytimg.com/vi/JRQtkLhqNug/default.jpg","False","False","Chaîne MULTIGAMING : https://www.youtube.com/watch?v=sFwEoun3INARejoins mon Discord : https://discord.gg/XPRkP5ea39- Contact Pro : guizmow@rachimedia.com JE TESTE ENFIN LE FRUIT du POISON sur BLOX FRUITS !! (Blox Fruits #57)SUR FORTNITE - CODE : GUGU #EpicPartnerRejoins le DISCORD : https://discord.gg/SUkyJyg7Q5Chaîne Musique : https://www.youtube.com/channel/UCDDb...- TikTok : https://www.tiktok.com/@guizmowyt- Instagram : https://www.instagram.com/guizmowyt/- Twitter : https://twitter.com/GUIZMOWwLes copains :  @KOCO @BlackBird !  @Shadobass"
"9nQzgjSiGZM","FINEM - LUTEM","2023-07-28T16:00:09Z","UCpCfNtApknusB5GCP17F-Tw","FINEM","10","23.02.08","finem|lutem|finem lutem|don xhoni|alban skenderaj dafina zeqiri|noizy dhurata dora|dhurata dora|mozzik kida|fifi young zerka|capital t|azet|mariglen hazizaj|yll limani dafina zeqiri|golden ag fatmira breqani|elai|stresi|dafina zeqiri|elvana gjata|tayna|mozzik|ledri vula|ervis behari|olsi bylyku ronela hajati|kepi i vipave|fjolla morina|pushime on top|getoar selimi|hite te reja shqip 2023|muzike e re 2023|hit","1373391","35409","0","643","https://i.ytimg.com/vi/9nQzgjSiGZM/default.jpg","False","False","𝗙𝗢𝗟𝗘 𝗣𝗨𝗕𝗟𝗜𝗦𝗛𝗜𝗡𝗚 - https://www.smarturl.it/FolePublishing____________________________𝗙𝗜𝗡𝗘𝗠 - 𝗟𝗨𝗧𝗘𝗠____________________________✔️ Did you subscribe to 𝗙𝗜𝗡𝗘𝗠's Official channel? 👇🏼►  http://smarturl.it/SubscribeFINEM👉🏼 Turn on the 🔔 to be notified for all the new songs.🎧 Listen on Spotify / Download on iTunes 👇🏼► https://fole.fanlink.to/FINEMLUTEM____________________________🎵 Produced by: 𝗕𝗜𝗚 𝗕𝗔𝗡𝗚🎵 Lyrics by: 𝗙𝗜𝗡𝗘𝗠🎥 Video by: 𝗖𝗔𝗣𝗧𝗨𝗥𝗘𝗛𝗢𝗢𝗗 𝗙𝗜𝗟𝗠𝗦✔️ Published by : 𝗙𝗢𝗟𝗘 𝗣𝗨𝗕𝗟𝗜𝗦𝗛𝗜𝗡𝗚____________________________🎤 Connect with 𝗙𝗜𝗡𝗘𝗠 :Instagram ► https://www.instagram.com/itsfinem🎵 Connect with 𝗕𝗜𝗚 𝗕𝗔𝗡𝗚 :Instagram ► https://www.instagram.com/bigbangbeats🎥 Connect with 𝗖𝗔𝗣𝗧𝗨𝗥𝗘𝗛𝗢𝗢𝗗 𝗙𝗜𝗟𝗠𝗦 :Instagram ► https://www.instagram.com/capturehood✔️ Connect with 𝗙𝗢𝗟𝗘 𝗣𝗨𝗕𝗟𝗜𝗦𝗛𝗜𝗡𝗚 :Instagram ► https://www.smarturl.it/FolePublishing____________________________🎧 Listen to 𝗔𝗹𝗯𝗮𝗻𝗶𝗮𝗻 𝗛𝗶𝘁𝘀 playlists on Spotify► https://spoti.fi/2S0JJwF► https://spoti.fi/3bBJKik____________________________℗ & © FINEM & FOLE PUBLISHING. All Rights Reserved.#Finem #Lutem #Folé"
"94SSJISSvvk","760","2023-07-27T22:01:00Z","UCDVkSalI27I-LYlbF7U9FYA","Timal - Topic","10","23.02.08","Timal|760","61889","2548","0","85","https://i.ytimg.com/vi/94SSJISSvvk/default.jpg","False","False","Provided to YouTube by Universal Music Group760 · Timal760℗ 2023 Caliente RecordsReleased on: 2023-07-28Producer: HRNNAuthor: TimalComposer: SerkComposer: HRNNAuto-generated by YouTube."
"E1u0aYfSbD4","Ousmane Dembélé au PSG ? La BOMBE du jour ! - La Quotidienne #1354","2023-07-28T16:21:26Z","UCjRqDyF6BnpE7_FW9TuMZlw","Téléfoot","17","23.02.08","telefoot|football|tf1","214376","5461","0","308","https://i.ytimg.com/vi/E1u0aYfSbD4/default.jpg","False","False","Dembélé vers le PSG, Mahrez s'engage en Arabie Saoudite, Paris battu par Osaka : voici le programme de votre dernière Quotidienne de la saison ! Vous l'avez demandé, la voici : la playlist de la Quotidienne est disponible sur Spotify et Deezer ! ➡️ Spotify : https://tinyurl.com/2p9s9a7x➡️ Deezer : https://tinyurl.com/57w7ys34"
"Y2NbRJP3FAU","BEENDO Z - NE DIS PAS NON","2023-07-28T10:00:34Z","UCeawg2VPd52mMhja_6pgq1g","BEENDO Z","10","23.02.08","[none]","206108","8154","0","444","https://i.ytimg.com/vi/Y2NbRJP3FAU/default.jpg","False","False","📟SINGLE DISPONIBLE SUR TOUTES LES PLATEFORMES DE STREAMING: https://beendo-z.lnk.to/NDPNᛋBEENDO Z - NE DIS PAS NONᛋMES RÉSEAUX SOCIAUX:INSTAGRAM: https://bit.ly/igbeendoSNAPCHAT: https://bit.ly/scbeendoTWITTER: https://bit.ly/twitterbeendoTIKTOK: https://bit.ly/tiktokbeendoSTORE : https://beendoz.com➡ CRÉDITSREALISATION: LACREMEBEATMAKER: FULLTRAP & PC & RAY DA PRINCEGUETTE MUSIC © 2023"
"vmIzboUvYRs","Calvin Harris, Sam Smith - Desire (Official Lyric Video)","2023-07-28T04:00:36Z","UCaHNFIob5Ixv74f5on3lvIw","CalvinHarrisVEVO","10","23.02.08","calvin harris|calvin harris sam smith desire|calvin harris sam smith promises|calvin harris ellie goulding miracle|sam smith|calvin harris summer|calvin harris feel so close|calvin harris live|calvin harris sam smith desire live|calvin harris ushuaia ibiza|calvin harris ibiza|sam smith unholy|sam smith live|sam smith 2023|calvin harris 2023|new calvin harris song|take me away|calvin|harris","502956","17596","0","839","https://i.ytimg.com/vi/vmIzboUvYRs/default.jpg","False","False","Calvin Harris & Sam Smith - Desire (Official Lyric Video)Listen/Download: https://CalvinHarris.lnk.to/Desire  ---------- Follow Calvin Harris: TikTok: https://www.tiktok.com/@calvinharrisInstagram: https://www.instagram.com/calvinharris/Twitter: https://twitter.com/CalvinHarrisFacebook: https://www.facebook.com/calvinharrisWebsite: http://calvinharris.com/ Follow Sam Smith:Website http://samsmith.world/WebsiteIDFacebook http://samsmith.world/FacebookID Instagram http://samsmith.world/InstagramID Twitter http://samsmith.world/TwitterIDTikTok http://samsmith.world/TikTokID---------- Calvin Harris & Sam Smith - Desire (Lyrics)  I want you to hold me,Don’t let me goBe the one and only,Take all controlStay with me forever,At least for the nightEven when you leave me,Lead me to the lightYou are my desire,And just the thought of you is keeping me awakeYou take me higher,Take me away(Repeat)Take me awayPromise you won’t wake me,Before you leaveLeave me in a daydream,Just you and meStay with me forever,At least for the nightEven when you leave me,Lead me to the lightYou are my desireAnd just the thought of you is keeping me awakeYou take me higher,Take me away(Repeat)Take me away#CalvinHarris #SamSmith #Desire"
"pQjwUIsV6EA","EMY'TIC Episode 2 : Ça part en date !","2023-07-27T14:55:13Z","UCuZ6w38DjAZwQj0PlNZT5sQ","Emy LTR","24","23.02.08","couple|amour|love|date|dating|rencontre|tv|realite|show|emission","129260","9314","0","180","https://i.ytimg.com/vi/pQjwUIsV6EA/default.jpg","False","False","Re, les copains !La deuxième et dernière partie de cette folle aventure est enfin là !Un grand merci aux copains Meetic qui ont rendu possible ce concept incroyable ! D'ailleurs, si tu veux télécharger l'app, c’est par là : iOS : http://tinsy.me/fBEV5x ; Android : http://tinsy.me/5D3kJ8. :mains_cœur:Qui seront les matchs gagnants, et surtout comment vont se passer les dates de chacun ?! Ça matche ou pas ?À vous de nous dire si nous avons réussi notre grande quête de l’amour :)J’espère de tout mon cœur que ce format vous aura plu !Merci à tous nos très chouettes prétendant.e.s, à mes ami.e.s de m’avoir laissé gérer leur vie sentimentale l’histoire d’une journée, et bien sûr à ma merveilleuse acolyte Audrey Pirault !Merci également au Chef Paul du Labo Culinaire de nous avoir si gentiment accueillis !Si tu veux suivre les copines, c’est juste ici :Audrey Pirault : https://www.instagram.com/audrey.pirautAmbre Larrazet : https://www.instagram.com/ambre_larrazet"
"sYhGBvWRW0Q","POUR OU CONTRE ? Avec Chris !","2023-07-27T16:00:40Z","UCk203NKbyqud8JclTWUWtBg","Emma Graziano","23","23.02.08","emma|graziano|fun|délire|rire|humour|vlog|chris|tiktok|sora|Olympe|Vs|Pour ou contre|Duel","147475","19755","0","636","https://i.ytimg.com/vi/sYhGBvWRW0Q/default.jpg","False","False","Hello ☀️Venez sur insta suivre mes petites aventures ! Insta : https://instagram.com/emma.graziano?igshid=MzRlODBiNWFlZA==La chaîne de Chris : https://youtu.be/LGiyQvM-GOc"
