video_id,title,publishedAt,channelId,channelTitle,categoryId,trending_date,tags,view_count,likes,dislikes,comment_count,thumbnail_link,comments_disabled,ratings_disabled,description
"7QiLe4pTHAE","Pokémon Presents | 8.8.2023","2023-08-08T13:00:10Z","UCFctpiB_Hnlk3ejWfHqSm6Q","The Official Pokémon YouTube channel","20","23.09.08","Pokémon|Pokémon Presents","1975154","68721","0","6885","https://i.ytimg.com/vi/7QiLe4pTHAE/default.jpg","False","False","What did you think of today’s Pokémon Presents, Trainers? 👀"
"z7usG2oKONE","Overwatch 2: Invasion | Official Trailer | New Support Hero, Flashpoint, and More","2023-08-08T15:59:32Z","UClOf1XXinvZsy4wKPAkro2A","PlayOverwatch","20","23.09.08","Overwatch 2|Overwatch","711467","39149","0","3435","https://i.ytimg.com/vi/z7usG2oKONE/default.jpg","False","False","An all-new adventure begins.Experience the next chapter of the Overwatch saga in Invasion Story Missions, unleash solar power as the newest Support Hero Illari, fight for control of two new maps in the new permanent game mode Flashpoint, and so much more.New ways to play await in Overwatch 2: Invasion, launching Aug 10 at 12pm PT. _Follow #Overwatch2 for the latest news:Instagram: https://www.instagram.com/playoverwatchTikTok: https://www.tiktok.com/@overwatchTwitter: http://www.twitter.com/playoverwatch Facebook: http://www.facebook.com/playoverwatch"
"Kr57ax0OWMk","How This Bizarre Virus Killed 500 Million People","2023-08-08T13:59:49Z","UCsXVk37bltHxD1rDPwtNM8Q","Kurzgesagt – In a Nutshell","27","23.09.08","[none]","1670409","102072","0","6143","https://i.ytimg.com/vi/Kr57ax0OWMk/default.jpg","False","False","Sources & further reading: https://sites.google.com/view/sources-smallpox/This video was made possible through a grant by Open Philanthropy.Check out '500 Million, But Not A Single One More' by Rational Animations here: https://youtu.be/ljmifo4Klss?si=uo5YKgXY5ghquPTsContinue learning about the fascinating world of biology with our Human Cell Poster, exclusively available here: https://shop.kgs.link/human-cellFew of the monsters that evolution created have been so successful at hurting us as the variola virus, responsible for smallpox. The carnage it caused was so terrible and merciless that it compelled humankind, for the first time, to act truly globally. It was one of the greatest wins of our species over the ancient powers of nature, all made possible by… cows.OUR CHANNELS▀▀▀▀▀▀▀▀▀▀▀▀▀▀▀▀▀▀▀▀▀▀▀▀▀▀German:        https://kgs.link/youtubeDESpanish:        https://kgs.link/youtubeESFrench:          https://kgs.link/youtubeFRPortuguese:  https://kgs.link/youtubePTArabic:           https://kgs.link/youtubeARHindi:             https://kgs.link/youtubeHIJapanese:     https://kgs.link/youtubeJAKorean:          https://kgs.link/youtubeKOHOW CAN YOU SUPPORT US?▀▀▀▀▀▀▀▀▀▀▀▀▀▀▀▀▀▀▀▀▀▀▀▀▀▀This is how we make our living and it would be a pleasure if you support us!Get Products designed with ❤ https://shop-us.kurzgesagt.org  Join the Patreon Bird Army 🐧  https://kgs.link/patreon  DISCUSSIONS & SOCIAL MEDIA▀▀▀▀▀▀▀▀▀▀▀▀▀▀▀▀▀▀▀▀▀▀▀▀▀▀TikTok:           https://kgs.link/tiktokReddit:            https://kgs.link/redditInstagram:     https://kgs.link/instagramTwitter:           https://kgs.link/twitterFacebook:      https://kgs.link/facebookDiscord:          https://kgs.link/discordNewsletter:    https://kgs.link/newsletterOUR VOICE▀▀▀▀▀▀▀▀▀▀▀▀▀▀▀▀▀▀▀▀▀▀▀▀▀▀The Kurzgesagt voice is from Steve Taylor:  https://kgs.link/youtube-voiceOUR MUSIC ♬♪▀▀▀▀▀▀▀▀▀▀▀▀▀▀▀▀▀▀▀▀▀▀▀▀▀▀700+ minutes of Kurzgesagt Soundtracks by Epic Mountain:Spotify:            https://kgs.link/music-spotifySoundcloud:   https://kgs.link/music-soundcloudBandcamp:     https://kgs.link/music-bandcampYoutube:          https://kgs.link/music-youtubeFacebook:       https://kgs.link/music-facebookThe Soundtrack of this video:Soundcloud: https://bit.ly/47i0zfDBandcamp: https://bit.ly/3YupIiXIf you want to help us caption this video, please send subtitles to subtitle@kurzgesagt.orgYou can find info on what subtitle files work on YouTube here:https://support.google.com/youtube/answer/2734698?hl=en-GB&ref_topic=7296214Thank you!🐦🐧🐤 PATREON BIRD ARMY 🐤🐧🐦▀▀▀▀▀▀▀▀▀▀▀▀▀▀▀▀▀▀▀▀▀▀▀▀▀▀Many Thanks to our wonderful Patreons (from http://kgs.link/patreon) who support us every month and made this video possible:Mason & Sophia Green, KEZACO, Mitchell Grenier, Merlin, Sage, Morry Kolman, Riomura_Dev, Nidhoegger, Julian Nowak, Rayyrawr, Arthur Robillard, Christian, Raphael Seffers, Sim Slim, David Manzanarez, cicero4, Domenic Rigling, AlZe, Jonas Brodesser, Peter Roth, Tobias, Nuno Serén, Adam W, David Bank, Charles Brown, Winston White, Dustin Davis, Hassan Taher, Eduardo Omerović C., Juan Arturo Drew P., Glacier, marin, Jae Darl, Scott & Sora, Andoriol, Piero Acevedo, Isimo, West Stringfellow, Driaon, Simon Goller, Tom Bonarewitz, Amelie Büttner, Ma. Jimena, Kury Sama, Marco Grotemeyer, Bao Truong, Chrispy, Nigggo, Sivarama Pokala, jonas meinberg, Cheese, David Walsh, Jan, Philipp Laube, Sinje Brandt, Lit, Paul, Junipal Witt, Rhodii Rodiles, Jamarr Mays, Andre Vianna, Flemming H., Nick Elvis, Snake4you, Midokin, Mario Tutzer, MetroTM, CheezeNuggies, Mäddin, Nils Scholz, Samsa, Kaine Shadory, TNT TV  Gaming, Kevin Kaufmann, Florian Arndt"
"zf2yTMBfEj8","My Friendly Neighborhood (FULL GAME)","2023-08-07T19:06:59Z","UCYzPXprvl5Y-Sf0g4vX-m6g","jacksepticeye","20","23.09.08","jacksepticeye","1338740","62329","0","3263","https://i.ytimg.com/vi/zf2yTMBfEj8/default.jpg","False","False","Here's all of My Friendly Neighborhood in one video. The full game for your viewing pleasureBuy MY coffee: https://topofthemornincoffee.com/Get the game: https://store.steampowered.com/app/1574260/My_Friendly_Neighborhood/Edited By: https://www.twitch.tv/bitofalice"
"3TQTV7LGgvM","Puerto Rico vs USA SHOWCASE | FULL GAME HIGHLIGHTS | August 7, 2023","2023-08-08T04:23:36Z","UCWJ2lWNubArHWmf3FIHbfcQ","NBA","17","23.09.08","Basketball|G League|NBA","2269785","30705","0","2453","https://i.ytimg.com/vi/3TQTV7LGgvM/default.jpg","False","False","Never miss a moment with the latest news, trending stories and highlights to bring you closer to your favorite players and teams.Download now: https://app.link.nba.com/APP22After outscoring Puerto Rico, 67-31, in the 2nd half, USA won their first exhibition game, 117-74. Anthony Edwards (15 points, 4 assists) and Cameron Johnson (15 points, 6 rebounds) combined for 30 points for USA, while Tyrese Haliburton added 7 points, 4 rebounds, and 12 assists in the victory. Tremont Waters led all scorers with 17 points for Puerto Rico."
"E3XKx4KKCXU","Dead by Daylight | Alien | Official Trailer","2023-08-08T15:00:10Z","UCaSgsFdGbwjfdawl3rOXiwQ","Dead by Daylight","20","23.09.08","dead by daylight|dbd|behaviour interactive|bhvr|slasher game|survival horror","708324","57068","0","4000","https://i.ytimg.com/vi/E3XKx4KKCXU/default.jpg","False","False","In space, no one can hear you scream.  But this is not space. Dead by Daylight: Alien. August 29th.  Learn more: https://dbd.game/3s42cxiDead by Daylight is a multiplayer action/horror game where one player takes on the role of a brutal Killer and the other four play as Survivors. As a Killer your goal is to sacrifice as many Survivors as possible. As Survivors your goal is to work together to evade, escape, and most importantly – stay alive.      PLAY DEAD BY DAYLIGHT: https://buythegame.deadbydaylight.com/   Join the official forum:  https://forums.bhvr.com/dead-by-daylight/ Like and follow us on our official Social Media Channels:     - Facebook:  https://facebook.com/DeadByDaylight- Twitter:  https://twitter.com/DeadbyDaylight- Instagram:  https://www.instagram.com/deadbydaylight/- TikTok: https://www.tiktok.com/@deadbydaylight Music by Michel F. April #DbD"
"NNXi3GaaeMY","Americas' Secret Top Tier Animal","2023-08-08T16:45:35Z","UCHsRtomD4twRf5WVHHk-cMw","TierZoo","27","23.09.08","[none]","639083","56176","0","2069","https://i.ytimg.com/vi/NNXi3GaaeMY/default.jpg","False","False","Watch my next video early: https://nebula.tv/videos/tierzoo-are-rhinos-opGet Nebula for $30 a year at https://go.nebula.tv/tierzooMusic:01. Eyewitness Acoustic Cover - Ludi02. Black Ops 2 Theme03. F- Zero - Mute City 04. Old RuneScape Soundtrack- The Trade Parade05. Eyewitness OutroSource Footage from: Getty ImagesPond5ShutterStockKruger Latest SightingsEditing/VFX: twitter.com/PSMotionGraphic"
"CUN8pdgA0m8","Action Bronson: Tiny Desk Concert","2023-08-08T09:00:13Z","UC4eYXhJI4-7wSWc8UNRwD4A","NPR Music","10","23.09.08","NPR|NPR Music|National Public Radio|Live|Performance|tiny desk|tiny desk concert|tony desk|tiny concert","568829","34945","0","2202","https://i.ytimg.com/vi/CUN8pdgA0m8/default.jpg","False","False","Bobby Carter | August 8, 2023There are times during Action Bronson's Tiny Desk when his vocals momentarily drift. We instruct our guests to face the directional microphones so that our recorders clearly pick up the voices. Action warned us of the improbability of that happening before we started filming and sure enough, the Flushing, Queens emcee strolled off mic a couple of times, did an about face here and there and even took a knee mid-show. By the time we got to Latin Grammys, he looked over to our engineer Josh Rogosin and said, I told you I couldn't stand still. How do you play music still? He's got a point.Action's band Human Growth Hormone reinterprets his records so funky, it's nearly impossible not to move, yet the small imperfections during the set tickled me. Bam Bam, primarily known as a rapper, has turned his passion for food, clothing, sneakers, wrestling, writing, fitness and painting into bonafide professions. Never veering too far away from the booth, he's consistently dropped projects since 2011. After working out in the green room, Mr. Baklava walked to the Desk, greeting nearly every person in the room with a handshake, and proceeded to perform highlights from Mr. Wonderful, Lamb Over Rice, White Bronco, and Only For Dolphins. Bronson was born to entertain us.SET LISTDmtriLive from the MoonLatin GrammysTerryBaby BlueMUSICIANSAction Bronson: vocals, effectsMatt Yung Mehico Carrillo: keys, saxophoneNicholas Coleman: bassWahkiba 9Ether Julion: drumsRed Walrus: percussionJulian Love: guitarTINY DESK TEAMProducer: Bobby CarterDirector/Editor: Maia SternAudio Engineer: Josh RogosinCreative Director: Bob BoilenVideographers: Maia Stern, Joshua Bryant, Kara Frame, Alanté SereneAudio Assistant: Josephine NyounaiProduction Assistant: Ashley PointerPhotographer: Catie DullTiny Desk Team: Suraya Mohamed, Hazel CillsVP, Visuals and Music: Keith JenkinsSenior VP, Programming: Anya Grundmann#tinydesk #nprmusic #actionbronson"
"AEUffI4nAIM","Kafka Trailer — A Dramatic Irony | Honkai: Star Rail","2023-08-08T04:01:43Z","UC2PeMPA8PAOp-bynLoCeMLA","Honkai: Star Rail","24","23.09.08","[none]","2059617","165153","0","7037","https://i.ytimg.com/vi/AEUffI4nAIM/default.jpg","False","False","Her expertise lies in creating fear, even if she herself remains ignorant of the very concept.Download Nowhttps://hoyo.link/3GCFBDALEnglish Voice:Kafka — Cheryl TexieraFollow us to get the latest info.HoYoLAB: https://www.hoyolab.com/accountCenter/postList?id=172534910Facebook: https://www.facebook.com/HonkaiStarRail/Twitter: https://twitter.com/honkaistarrailDiscord: https://discord.gg/honkaistarrailInstagram: https://www.instagram.com/honkaistarrail/TikTok: https://www.tiktok.com/@honkaistarrail_officialReddit: https://www.reddit.com/r/HonkaiStarRail/Subscribe to our YouTube feed to receive notifications of future content!#HonkaiStarRail #Kafka"
"bzpNNK98U_k","Yo Gotti - Pop My Shit","2023-08-08T17:00:07Z","UChm23DfNn1O-yH_z8mD638A","yogottiVEVO","10","23.09.08","Gotti|Pop|Shit|Inevitable|Productions|Rap/Hip-Hop","341767","7587","0","702","https://i.ytimg.com/vi/bzpNNK98U_k/default.jpg","False","False","Yo Gotti - “I Showed U So” is available at: https://YoGotti.lnk.to/IShowedUSo Yo Gotti online:https://twitter.com/YoGottihttps://www.instagram.com/yogottihttps://soundcloud.com/yogottikomhttps://www.facebook.com/yogotti #YoGotti#IShowedUSo#CMGTheLabel"
"zKBtLtB9M20","JAKE PAUL VS NATE DIAZ Fight Highlights","2023-08-06T07:21:39Z","UCurvRE5fGcdUgCYWgh-BDsg","DAZN Boxing","17","23.09.08","jake paul vs nate diaz|jake paul nate diaz|jake paul face to face|nate diaz face to face|jake paul vs nate diaz ariel helwani|jake paul vs nate diaz fight|jake paul nate diaz fight|jake paul boxing|nate diaz boxing|dazn|dazn boxing|boxing|ariel helwani|face to face|face to face dazn|boxing interview|boxing face off|paul diaz|paul vs diaz","9615290","115348","0","30951","https://i.ytimg.com/vi/zKBtLtB9M20/default.jpg","False","False","Jake Paul comes away with a victory over MMA legend Nate Diaz in a 10-round cruiserweight bout via unanimous decision.Subscribe to our YouTube channel 👉  http://bit.ly/DAZNBoxingYouTubeSubscribe to the DAZN X Series YouTube channel 👉 https://bit.ly/XSeriesYouTube Download the DAZN app now 👉  http://bit.ly/DAZNYoutubeFollow DAZN Boxing On Social Media 👇Twitter: https://www.twitter.com/DAZNBoxingInstagram: https://www.instagram.com/DAZNBoxingFacebook: https://www.facebook.com/DAZNThe DAZN Boxing Show ► https://bit.ly/3EQ70HNDAZN Rewind ► https://bit.ly/32iAaRT#DAZN #DAZNBoxing #Boxing #PaulDiaz"
"9CqG9bWjUCw","ANIME HOUSE OVA | VILLAINS VS GEAR 5","2023-08-07T22:52:56Z","UC4G10tk3AHFuyMIuD3rHOBA","RDCworld1","1","23.09.08","[none]","720826","99501","0","6690","https://i.ytimg.com/vi/9CqG9bWjUCw/default.jpg","False","False","🌎RDC's SOCIALS🌎Mark - @SupremeDreams_1Aff - @AffiongLeland - @23_Is_LelandDylan - @DylanPatel4_Desmond - @l0v3andPeac3Benjamin - @Ive_Ben_JamminJohn - @PlayThatJohnEARLY RELEASES DROPPING HERE: https://www.rdcuniverse.com/FREE 7-DAY TRIAL🌎 REAL DREAMS CHANGE THE WORLD 🌎🗣️ TWITTER: https://twitter.com/RDCworld1📷 IG: https://www.instagram.com/rdcworld1/👔 MERCH: https://rdcworld1.com🎮 GAMING CHANNEL: https://www.youtube.com/@RDCWorldGaming👾 TWITCH: https://www.twitch.tv/rdcgaming🎙️ PODCAST: https://linktr.ee/rdcworld💜 DISCORD: https://discord.gg/rdcworld1☁️ DREAM CON: https://www.dreamconvention.com🎵 SOUNDCLOUD: https://soundcloud.com/rdcworld"
"DTrtxWOuE_k","Titanic II - JonTron","2023-08-07T20:01:50Z","UCdJdEguB1F1CiYe7OEi3SBg","JonTronShow","23","23.09.08","jontron|jontronshow|titanic|titanic 2|clive palmer","1157576","87211","0","6676","https://i.ytimg.com/vi/DTrtxWOuE_k/default.jpg","False","False","✅ Install Raid for Free Mobile and PC: https://clik.cc/KBZ79 🎉 Use the Promo Code JTSKIN before October 7th to get both the Epic Champion Stag Knight and my Custom Skin!You can redeem the Promo Code either via this site https://plarium.com/en/redeem/raid-shadow-legends/, or inside RAID: Shadow Legends itself if you are playing via an Android device or on Plarium Play.--Follow JonTron Here:Instagram: http://www.Instagram.com/jontronshowTwitter: http://www.Twitter.com/jontronshowBusiness Inquiries:jontron(at)ellifyagency.com--Crew:Jon Jafari - Director/Producer/WriterSergio Torres - Director of Photography/Line Producer/CreativeAndrew Reynoso - Key Grip/Creative/EditorLewis Bown - Editor/Writer/CreativeMaria Alexandria - Art/Special Effects + Makeup/Costumes/Creative"
"ITIcmA4Zwa8","Modern Warfare III is Coming","2023-08-07T16:00:10Z","UC9YydG57epLqxA9cTzZXSeQ","Call of Duty","20","23.09.08","call of duty|cod|activision|Warzone|COD|video game|gaming|online gaming|multiplayer|game|fps|blizzard|xbox|playstation|pc|maps|new call of duty games|modern warfare|games|call of duty updates|new releases|teaser|trailer|Modern Warfare III|Modern Warfare III announcement|Call of Duty: Modern Warfare III|Call of Duty MW3|Call of Duty Modern Warfare 3|Modern Warfare 3 Confirmation|Modern Warfare III (2023)|Makarov|Task Force 141|modern warfare 3","944985","43124","0","7620","https://i.ytimg.com/vi/ITIcmA4Zwa8/default.jpg","False","False","The ultimate threat awaits #MW3 Follow #CallofDuty for the latest intel:Twitter: http://twitter.com/CallofDutyInstagram: http://instagram.com/callofdutyFacebook: http://facebook.com/CallofDutyTikTok: http://www.tiktok.com/@callofduty #ModernWarfare3"
"7o4rkBGZ3EI","Twins Swap Birthday Gift Exchange - Merrell Twins","2023-08-08T16:00:54Z","UCwtnkRZcvL4bfopzJ-Von8Q","merrelltwins","23","23.09.08","Merrell Twins|Twins|Merrell|Veronica Merrell|Vanessa Merrell|Twin|Comedy|Family Friendly|birthday|twin swap|twins swap|gifts|birthday gifts|gift exchange","226119","13676","0","831","https://i.ytimg.com/vi/7o4rkBGZ3EI/default.jpg","False","False","It’s our birthdays again!! We did another bday gift swap! There was a little confusion but… we think it turned out well! Thanks for all the bday wishes!! ❤️🥳SUBSCRIBE TO OUR CHANNEL ▶ http://bit.ly/2dSP9Fg MERRELL TWINS LIVE ▶ https://www.youtube.com/merrelltwinsliveOUR MERCH ▶ https://fanjoy.co/collections/merrell-twinsFOLLOW US ON SOCIAL MEDIAMERRELL TWINSTIKTOK:▶ @merrelltwinsINSTAGRAM:▶ http://instagram.com/MerrellTwinsTWITTER: ▶https://twitter.com/MerrellTwinsFACEBOOK: https://www.facebook.com/MerrellTwinsWEBSITE: www.merrelltwins.com VANESSA MERRELLINSTAGRAM: ▶http://instagram.com/vanessamerrellTWITTER: ▶https://twitter.com/VanessaMerrellTIKTOK: @vanessamerrell VERONICA MERRELLINSTAGRAM:▶http://instagram.com/veronicamerrellTWITTER: ▶https://twitter.com/veronicamerrellTIKTOK: @veronicamerrell MORE VIDEOSTESTING VIRAL TIK TOK HACKShttps://youtu.be/ec9uZSXqBfYOUR ROOM TOURhttps://youtu.be/ihMYnsipT5EGUACAMOLE SONGhttps://youtu.be/y8tAO3Ov8gsNORMAL PEOPLE vs INFLUENCERShttps://youtu.be/CCi_H6s5ZKETHE THIRD WHEELhttps://youtu.be/uHYI42E8TKYTHAT ONE FRIENDhttps://youtu.be/aeOpNraDKy8Merrell Twins Exposed ep1https://youtu.be/mWXurqWRA742 Sets of Twins Drive Thru Prankhttps://youtu.be/p15SVRulr58Fans Write our Videohttps://youtu.be/WI0LYRZErjUThe Break Uphttps://youtu.be/MyS8AjVj9FQIF FOOD BABIES WERE REALhttps://youtu.be/joMRNv0SlYETHIS COULD BE YOUhttps://youtu.be/U9v_bUMqFHgWe’re identical twin sisters who have been consistently making videos since 2013. We post videos showcasing our range in both comedy and music such as original comedy sketches, original scripted series, original songs, original music videos, gaming videos, weekly live streams, weekly gaming livestreams, twin swaps, twin sister vs twin sister, popular song parodies, popular song covers, original funny songs, 24 hour challenges, popular challenges, popular trends, lifestyle, fashion, and much more!"
"Ro4KbCpcXZM","Total War: WARHAMMER III - Shadows of Change Announce Trailer","2023-08-08T13:59:07Z","UCugJq15BiB-c1NDYPHiznWQ","Total War","20","23.09.08","Total War|warhammer|total war warhammer|rome total war|warhammer 2 total war|total war rome 2|medieval total war|medieval total war 2|three kingdoms total war|total war gameplay|shogun 2 total war|total war saga|total war warhammer gameplay|3 kingdoms|new|gameplay|trailer|warhammer 3|total war warhammer 3","287524","17052","0","1530","https://i.ytimg.com/vi/Ro4KbCpcXZM/default.jpg","False","False","A dragon, a witch and a trickster walk into a bar... 🟢🔵🟣We're excited to announce that Shadows of Change arrives in Total War: WARHAMMER III alongside Update 4.0 on August 31st!📰 Read more: https://www.totalwar.com/blog/tww3_soc_thechangeling/ PRE-ORDER SHADOWS OF CHANGE NOW AND RECEIVE 10% DISCOUNT! - https://store.warhammer.totalwar.com/Play now with PC Game Pass: https://www.microsoft.com/store/productid/9NGGB0GZPB9DBuy it on the Microsoft Store: https://www.microsoft.com/store/productid/9mwc735wd9ckPurchase on Steam: https://store.steampowered.com/app/1142710/Total_War_WARHAMMER_III/Purchase on Epic: https://www.epicgames.com/store/en-US/p/total-war-warhammer-3Any questions? Check out the FAQ: https://www.totalwar.com/blog/total-war-warhammer-iii-faq/━━━━━━━━━━━━━━━━━#TotalWar #WARHAMMER #ShadowsOfChangeFollow us on social media:➤ https://discord.gg/totalwar➤ http://www.facebook.com/totalwar➤ http://www.twitter.com/totalwar➤ http://www.instagram.com/totalwarofficial➤ http://www.twitch.tv/totalwarVideo type: Cinematic TrailerWhat does this mean? Full info here: ➤ http://wiki.totalwar.com/w/About_our_trailers"
"SfedlOne4EQ","I Challenged Phil Mickelson To A 9 Hole Match | Bryson DeChambeau","2023-08-07T20:22:52Z","UCCxF55adGXOscJ3L8qdKnrQ","Bryson DeChambeau","17","23.09.08","I Challenged Phil Mickelson To A 9 Hole Match | Bryson DeChambeau|bryson dechambeau|phil mickelson|9 hole match|i challenged phil mickelson to a match|golf match|professional golf match|liv golf|pga tour|good good|gm golf|garret clark|the great golf match of all time|bryson dechambeau vs phil mickelson|bryson dechambeau shoots a 58|lowest golf round ever","800175","25699","0","2430","https://i.ytimg.com/vi/SfedlOne4EQ/default.jpg","False","False","I Challenged Phil Mickelson To A 9 Hole Match...Follow the Crushers: https://www.youtube.com/channel/UCfT0i7NMpl0lgjkSE2-8P4whttps://www.instagram.com/crushers_gc/Follow the HyFlyers: https://www.youtube.com/channel/UC3jFoA7_6BTV90hsRSVHoawhttps://www.instagram.com/hyflyers_gc/Phil Mickelson: https://www.instagram.com/philmickelson/Anirban Lahiri: https://www.instagram.com/banstaa/Cameron Tringale: https://www.instagram.com/camtring/Connect With Me: Instagram | https://www.instagram.com/brysondechambeau/TikTok | https://www.tiktok.com/@brysondechambeau?lang=enTwitter | https://twitter.com/b_dechambeauWebsite | https://brysondechambeau.com/Shop | https://shop.brysondechambeau.comVideography & Editing: https://www.instagram.com/akacollective/"
"SHx4xVhfS3w","Empty World | Quick D","2023-08-08T14:00:08Z","UCEOXxzW2vU0P-0THehuIIeg","Captain Disillusion","24","23.09.08","VFX|visual effects|animation|explanation|tiktok|viral|humor|scifi","581434","85586","0","3272","https://i.ytimg.com/vi/SHx4xVhfS3w/default.jpg","False","False","Please consider supporting my videos on https://www.patreon.com/CaptainDisillusionCaptain Disillusion examines the simple VFX techniques used by empty world genre TikTokers.Executive Producers:Aaron ZachariuszBlake PartridgeDan KuehlingDarion DodgeDellboyHeather A.JasperJoe WallnerKate GerryKevin McCoyKshitij N. ShettyMason VuongNathaniel DsouzaRoberto VellucciRoger Graf"
"qXv-r5y5gC0","Easily 3 Star Clashiversary Challenge #2 (Clash of Clans)","2023-08-08T08:00:22Z","UC85aYbNSFjsJdxfpxgQr8tA","Judo Sloth Gaming","20","23.09.08","clash of clans|coc|clash of clans gameplay|clash of clans attacks|clash of clans strategy|judo sloth|clashiversary challenge 2|clashiversary challenge #2|clashiversary challenge 2023|11th clashiversary|clashiversary 2023|clash of clans new event attack|coc new event attack|3 star clashiversary challenge|clashiversary challenge guide|clashiversary attack|clashiversary event|how to beat clashiversary challenge|barbarian king challenge|future king","625150","22011","0","702","https://i.ytimg.com/vi/qXv-r5y5gC0/default.jpg","False","False","The Clash of Clans 2023 Clashiversary Event continues with Challenge 2. This strategy keeps the deployment easy to manage but I really like the design of this one due to the amount of options to take it down; great job to Zolokotroko. The Challenge showcases the Future King Skin which is now available in the shop alongside the Future Scenery. Best of luck with your 3 stars!VOTE FOR JUDO: https://esportsawards.com/vote/Suggested Video:I Broke Clash of Clans: https://youtu.be/8i4hz2i0BF8Join 'The Dojo' to gain Exclusive Perks by becoming a Member of the Judo Sloth Gaming YT Channel: https://www.youtube.com/judosloth/joinThank you for using Code 'Judo' in Clash of Clans to support me: https://bit.ly/CodeJudoMy Clash of Clans PlaylistsClash Explained: https://bit.ly/ClashExplainedBase Upgrading Advice: https://bit.ly/UpgradeBaseTip for Everything Series: https://bit.ly/TipsForEverythingWatch my Livestreams on Twitch and Facebook:TWITCH ► https://www.twitch.tv/judo_slothFACEBOOK ► https://www.facebook.com/JudoSlothFollow me on Social Media:TIKTOK ► https://www.tiktok.com/@judosloth.gamingTWITTER ► https://twitter.com/JudoSlothINSTAGRAM ► https://www.instagram.com/judoslothDISCORD ► https://discord.gg/JudoSloth#ClashOfClans #Clashiversary #ClashOfClansEvent► Judo Sloth Gaming is a mobile gaming channel focused on Clash of Clans. You will see a variety of videos focused on being Educational but Entertaining! You will find Informational Guides on Everything in CoC. Attack Strategies, 3 Star Attacks, Farming or Upgrade Advice, Lets Play and Update News - you'll want to Subscribe to see it all. Clash On!"
"l9CRQ1KkdLc","Using CHEATS To Beat Fortnite","2023-08-07T03:34:17Z","UCw1SQ6QRRtfAhrN_cjkrOgA","LazarBeam","20","23.09.08","[none]","2759714","135136","0","7256","https://i.ytimg.com/vi/l9CRQ1KkdLc/default.jpg","False","False","Boss Battles Map - 3451-3711-0789🎥SECOND CHANNEL - https://www.youtube.com/user/CrushSlash🐤TWITTER - https://twitter.com/lazarbeam📷INSTAGRAM - https://instagram.com/lazarbeamyt"
