video_id,title,publishedAt,channelId,channelTitle,categoryId,trending_date,tags,view_count,likes,dislikes,comment_count,thumbnail_link,comments_disabled,ratings_disabled,description
"bTbTMb6VmIE","스키비디 토일렛 4분 요약 [Skibidi Toilet 4 Minutes Summary]","2023-08-04T09:00:22Z","UCaaZFxjlHI3T_I-uFbldIGA","소맥거핀","1","23.09.08","게임 만화|병맛|웃긴|만화|소맥거핀|애니메이션|게임 애니메이션|웃긴 만화|병맛 만화|소맥거핀 애니메이션|소맥거핀 만화|영화/애니메이션|게임|코미디|소맥|somacguffin|somacguffin animation|animation|meme|Skibidi Toilet|SkibidiToilet|Skibidi|스키비디 토일렛|스키비디","5316696","86621","0","2660","https://i.ytimg.com/vi/bTbTMb6VmIE/default.jpg","False","False","스키비디 토일렛 에피소드 1~50까지 요약해봤습니다I summarized the episodes 1 to 50.소맥거핀 스튜디오!소맥거핀, 찬스, 디누, 조유난, 려무, 데미, 김말리비즈니스 문의 -  somacguffin@sandbox.co.krSkibidi Toilet 4 Minutes Summary#소맥거핀 #skibiditoilet #animation #skibidi"
"p_DcvVfaKHE","ENG│너무 매운 떡볶이와 아이스크림 푸딩. 삼색전과 곰 츄러스 만들기. 친구 옷 수선해주고 토마토 탕후루 먹는 자취브이로그","2023-08-05T10:59:55Z","UCPaApoLkmPqxCeZF7gjoc3w","planD플랜디","22","23.09.08","[none]","735077","22385","0","549","https://i.ytimg.com/vi/p_DcvVfaKHE/default.jpg","False","False","이 영상은 상하목장의 유료광고가 포함되어 있습니다🍨 상하목장 아이스크림 기간한정 히든딜 🍨-히든딜 링크 : https://bit.ly/3Kot2Xg  -히든딜 기간 : 8/5 20시 ~ 8/20 까지-히든딜 제품 : 상하목장 아이스크림 2입 + 라판자넬라 크래커-히든딜 가격 : 19,900원 (할인율 42.6%, 기존 고객 대비 추가 4,000원 할인) #상하목장 #상하목장아이스크림 #밀크아이스크림안녕하세요 여러분이번 영상은 오랜만에 베이킹 하고 디저트도 만드는 일상을 담았어요 🍮아이스크림 푸딩과 토마토 탕후루 모두 재밌고 맛있었습니다 🐻여전히 자전거로 장도 보고 있는데 그래도 조금씩 실력이 늘고 있는 것 같아요ㅎㅎ그럼 이번에도 편히 봐주세요✨🥪영상에 나온것들🍲삼색전 │ 김치수제비 │ 아이스크림 떡쌈후추올리브 아이스크림 │ 엽떡 밀키트 │ 깻잎 풍선튀김주먹밥 │ 츄러스 믹스 │ 곰돌이 츄러스 │ 아이스크림 츄러스옷 수선 │ 치마길이 줄이기 │  토마토 탕후루타꼬야끼팬 탕후루 │ 팽이버섯 김말이  │ 게살 덮밥아이스크림 푸딩하늘색 상의 │ 로라로라_MARINE COLLAR STRIPE파란 가방│ 엄마표 뜨개질 가방떡쌈│ 미지떡쌈컨텐츠 제작의 마무리는 컨텐츠플라이! 글로벌 진출을 위한 최고의 파트너,CONTENTSFLY에서 제작되었습니다.https://www.contentsfly.com"
"3BXMafUgzu0","지금 지능 그대로 10살로 돌아가보기 11탄","2023-08-05T03:45:01Z","UCUOQddfF7LwZBPglW3nEzPQ","꿀팁한입","1","23.09.08","#10살로돌아가보기|#지금지능그대로|#병맛애니|yt:cc=on","345600","7015","0","705","https://i.ytimg.com/vi/3BXMafUgzu0/default.jpg","False","False",""
"iFPXM5OnkAw","드디어, 엄마가 됐어요👶🏻","2023-08-03T10:30:13Z","UCu4X3ZAoq6nToNJNNoQuICA","혜진쓰 Hyejin's","22","23.09.08","혜진쓰|혜진쓰 브이로그|Hyejin's|Vlog|부부일상|혜진|헤이지니 임신|만삭|만삭 임산부|임산부 만삭 브이로그|임산부 만삭|출산|출산 브이로그|만삭 출산|헤이지니 토토|혜진쓰 토토|토토|혜진쓰 출산","1405113","27638","0","3983","https://i.ytimg.com/vi/iFPXM5OnkAw/default.jpg","False","False","7월 27일 혜진이와 충충이는 토토와 함께 세 가족이 되었답니다🐰임밍아웃부터 토토가 태어나기까지 10개월동안 함께 축하해주고 기뻐해준 혜충이들 고마워요❤지금은 병원에서 퇴원해 토토와 함께 조리원에서 건강하게 잘 지내고 있어요!곧 조리원 일상도 개봉박두🥳🎶BGM🎶오늘의 일기 - Get Ready / sweet potato / let's toast! / Orange Sunrise  / comic bookhttps://youtu.be/6383HXw3PsIhttps://youtu.be/5bzkxJpS2J4https://youtu.be/Xl2lgQTP34Ehttps://youtu.be/hLeETQYWyWohttps://youtu.be/9jOee9_5_qk브금대통령 - 조별 과제 / 능구렁이 남편https://youtu.be/wLuWmPrJkSkhttps://youtu.be/ends4k6pyZM샛별 - 모여주라 동물의 숲https://youtu.be/9CdA8CdixU8"
"s4tpuhdDVis","혜안 요즘 배그하기 어려운 이유","2023-08-06T02:51:00Z","UC8CIM3d3zDYMk-3T5aAz0yw","혜안","20","23.09.08","혜안|공감","500587","13290","0","793","https://i.ytimg.com/vi/s4tpuhdDVis/default.jpg","False","False","쉬운 건 없습니다[업로드] 금,토,일,월 [문의메일] zxcv34276@gmail.com[인스타그램] @hxxax_#혜안 #배틀그라운드 #랜덤듀오Music by 브그밍 little rascal – https://youtu.be/pOgGO8Ey5w0Music provided by 브금대통령Track : 그렇게 어른이 되고 - https://youtu.be/ui-gF5s8vbE Track : 펭귄의 비행 - https://youtu.be/ZW_msPN4GJwTrack : 여름밤의 꿈 - https://youtu.be/hC29Vt9u6T0Music by 달콤사운즈‘붕어빵’ - https://youtu.be/7K-SxX-XRrYMusic composed by 브금공방코믹 12 - https://youtu.be/hR15XjJNJw8Music provided by 공유마당, CC BY장현조 – 숨바꼭질2Music provided by DJ곡쓴이Sunshine - https://youtu.be/Igy_8a9Hv14"
"Nb21RCOsQwM","이 맛있는 요리법 이제야 알았네요~  👍👍너무 맛있어서 일주일에 단호박 3통 먹었어요. 단호박요리 3가지 강쉪","2023-08-03T07:00:07Z","UCrxSR4OGbJBVjYxp4xjWgZQ","강쉪","26","23.09.08","korea food cooking|korea cooking|korea recipe|korea food recipe|receta de cocina de comida coreana|韓国料理レシピ|resep masakan korea food|สูตรทำอาหารเกาหลี|công thức nấu ăn hàn quốc|Рецепт приготовления корейской кухни|강쉪|단호박범벅|단호박샐러드|단호박스프|단호박냉스프|단호박구이|단호박오븐구이|단호박요리","387519","4003","0","42","https://i.ytimg.com/vi/Nb21RCOsQwM/default.jpg","False","False","{ 단호박 요리 3가지 }[단호박(범벅) 샐러드] 4인분단호박 1통(껍질벗기기 전) 1.2kg, 양파 1/4개, 파프리카 1/2개,호박씨 4스푼, 건포도 4스푼, 양념: 소금 3꼬집, 후추 약간, 플레인요거트 수북하게 4스푼,올리고당 1스푼, 올리브오일 3스푼, 식초 1/2스푼[ 단호박 베이컨 구이 ] 4인분 04:20단호박 반개(껍질 벗기기 전) 600g, 베이컨 5줄, 브로콜리 반개(다듬기 전) 130g토마토 8개, 통마늘 4개,  올리브오일 5스푼, 소금 3꼬집, 후추 약간,소스: 마요네즈 크게 4스푼, 홀그레인 머스터드 1스푼,레몬 제스트 1개, 레몬즙: 1/2개, [단호박 냉스프] 4인분 07:53단호박 반개(껍질 벗기기 전) 600g, 우유500ml, 물250ml,소금 6꼬집(중간에 간보고), 후추 약간가니쉬: 플레인요거트 약간, 호박씨 약간, 건포도 약간,고수잎약간, 올리브유 약간 (모든것은 기호에 따라) =================================시청해주셔서 감사합니다.💕  자세한 레시피는 👉강쉪 블로그 에서 확인하세요~https://blog.naver.com/beherit00🍎강쉪의 건강하고 맛있는 100% 생사과즙 맛보장! https://smartstore.naver.com/kangchef/products/4788609582🍳영상에 사용한 엔드그레인 도마 https://smartstore.naver.com/heidel/products/7406754057▶비지니스 문의: beherit00@naver.com ▬▬▬▬▬▬▬▬▬▬▬▬▬▬▬▬▬▬▬▬▬▬▬▬▬▬▬▬▬"
"dlW-G5DmiFE","고추 맛있게 만드는 방법! 다른 반찬이 필요가 없어집니다👍 평생 요긴하게 써 먹는 고추요리","2023-08-03T00:00:23Z","UCKrhyP3raTJQ38m-US2uMjg","엄마의손맛","26","23.09.08","고추|고추요리|고추장아찌|고추장아찌담는법|고추장아찌 황금레시피|고추장아찌 맛있게 담그는법|고추장아찌담그는법|반찬 레시피 추천|엄마의손맛|엄마의손맛요리|korean food","348218","1802","0","34","https://i.ytimg.com/vi/dlW-G5DmiFE/default.jpg","False","False","👇 눌러서 레시피 보기✔️ 자막이 필요하신 경우엔 유튜브 자막기능을 켜주세요.🥬 재료풋고추 450g, 청양고추 200g, 양파 4개🧂 양념진간장 400mL, 물 1L, 식초 300mL, 맛술 200mL, 설탕 1컵반, 매실청 150mL✔️ 계량은 가정에서 사용하시는 숟가락과 종이컵이면 충분합니다.✔️ 모든 식재료는 깨끗하게 손질해서 준비합니다.⭕ 엄마의손맛은 유튜브와 네이버TV 채널에서만 보실 수 있습니다. ❌ 이 영상을 무단 도용하거나 재편집 및 업로드 하는 것을 금지합니다.📺 네이버TV 채널🟰 https://tv.naver.com/momstaste🛒 엄마가 쓰는 칼 🟰 https://smartstore.naver.com/cookmarket/products/5379031797🟰 https://smartstore.naver.com/cookmarket/products/6032749296"
"JW7QAvSfURM","[ENG/JPN] 콘서트 연습 시작부터 쉽지 않네💦 13년째 티격태격 대는 인피니트 | 아이돌 인간극장","2023-08-03T12:00:07Z","UCru-NhkqWnxg7-b5Q579YfA","아이돌 인간극장","10","23.09.08","KBS|KBSKPOP|StudioK|케이비에스|케이팝|스튜디오케이|스튜디오K|아이돌 인간극장|아이돌 인생극장|아인극|인간극장|아이돌인간극장|하이퍼 페이크 리얼리티|인피니트|INFINITE|인피니트 콘서트|인스피릿|성규|tjdrb|엘|추격자|내꺼하자|New Emotions|newemotions|뉴이모션스|남우현|성종|성열|동우|sungyoo|인피니트 컴퍼니","407231","19236","0","1342","https://i.ytimg.com/vi/JW7QAvSfURM/default.jpg","False","False","#INFINITE #New_Emotions #아이돌인간극장‘인피니트 컴퍼니’라더니 대표님 사진만 가득한 사무실과추억 82 하다가 또 싸울 뻔한 화목한 인피니트의 하루 대공개🔥대본 없는 리얼(?) 다큐 [아이돌 인간극장]에 오신 여러분모두 환영합니다🎉Everyone, welcome to real (?) documentary no script [Idol Human Theater]🎉 More from #KBSKPOPTwitter:      https://twitter.com/idolhumandocu🎥제작 : STUDIO K📩비즈니스 문의 : officialstudiokk@gmail.com"
"9SrS3SvNRyE","52도의 선선한 날씨가 예상됩니다.","2023-08-03T09:00:10Z","UC1x03ziDHPct2xTikLyfMDA","킥서비스","23","23.09.08","2033|2032|2033년|2032년|2023년|유튜브|킥서비스|숏박스|피식대학|싱글벙글|엄지렐라|개그맨|개그우먼|박진호|정진하|폭염|더위|기록적인|날씨|무더위|여름|크록스|쉬케치|띱|김해준|찌드래곤|스낵타운|뇌절|웃긴|스케치코미디|스케치|미래|미래개그|ㅋㅋㅋㅋ|ㅋㅋㅋㅋㅋ|ㅋㅋㅋ|ㅋㅋ|ㅋ|2030|2030년|퀵서비스|엄지윤|이창호|이호창|엄란드|별놈들|나선욱|장영호|문돼","1452887","17905","0","1293","https://i.ytimg.com/vi/9SrS3SvNRyE/default.jpg","False","False","#2033 #킥서비스 #폭염킥킥이 여러분 알로하:)'2033 폭염' 편을 업로드하였습니다.진짜.. 이번편만큼은 이렇게 안되길 간절히 기도하면서실제 폭염을 온몸으로 받아내보았습니다.재밌게 보시구,킥킥이 분들은 덜 더운 하루 보내세요!! 오늘 출연은,유튜브 별놈들의 '장영호' 님이 도와주셨습니다.영호 감사~ 합니다~ https://www.youtube.com/watch?v=GuRM-iyts2A&t=53s"
"28WEkKDnvf0","[#복면가왕] 텐트 취침 싫다고 잉잉 울던 '아빠어디가' 민국이,,  슴살이 되어 돌아왔슴다😭 아빠도 깜~~빡 속은 《복면가왕》 깜짝 무대!ㅣ#김민국 MBC230730방송","2023-08-01T06:28:17Z","UCiwQRG2sCcfjKkgxMEdJGPg","엠뚜루마뚜루 : MBC 공식 종합 채널","23","23.09.08","복면가왕|민국이|성주|김성주|김민국|아빠어디가|아어가|텐트 취침|깜짝카메라|후|윤후|준수|10준수|민율이|복가|무대 레전드|민국이 노래","6165706","47776","0","3671","https://i.ytimg.com/vi/28WEkKDnvf0/default.jpg","False","False","[복면가왕] 일요일 저녁 6시 20분 방송!MBC의 따끈따끈한 영상을 내 맘대로 편하게 즐기는 채널🌀 엠뚜루마뚜루 구독하기👉https://www.youtube.com/c/엠뚜루마뚜루#복면가왕#엠뚜루마뚜루* [복면가왕] 풀버전 보러가기✔ WAVVE : https://www.wavve.com/player/vod?programid=M_1000790100000100000&page=1✔ iMBC : http://playvod.imbc.com/templete/VodList?bid=1000790100000100000"
"uiFiX9SVGMo","인피니트(INFINITE)의 킬링보이스를 라이브로! – 내꺼하자, 추격자, 파라다이스, New Emotions, Man In Love, 그 해 여름, Tell Me | 딩고뮤직","2023-08-01T10:00:08Z","UCtCiO5t2voB14CmZKTkIzPQ","딩고 뮤직 / dingo music","10","23.09.08","딩고뮤직|dingo|dingomusic|music|kpop|live|멜론|세로라이브|최신가요|top100|아이돌|라이브|음악|딩고|Infinite|인피니트|김성규|장동우|남우현|이성열|김명수|엘|이성종|NewEmotions|컴백|13주년|5년|앨범","2158744","127111","0","15532","https://i.ytimg.com/vi/uiFiX9SVGMo/default.jpg","False","False","함께한 그리고 계속 함께할 인피니트🫰🏻5년 만에 돌아온 신곡 ‘New Emotions’도 많은 사랑 부탁드립니다💛[선곡리스트]00:00 오프닝00:40 다시 돌아와01:26 내꺼하자03:05 파라다이스 (Paradise)04:40 Can U Smile (Broadcasting Ver.)05:37 Tic Toc07:01 Nothing’s Over08:12 Man In Love (남자가 사랑할때)09:19 Cover Girl10:23 Julia11:48 그 해 여름12:59 BTD (Before The Dawn)14:09 추격자 15:29 Bad17:04 태풍 (The Eye)17:51 Tell Me18:56 New Emotions 🆕20:36 함께▶딩고뮤직 (Dingo Music) : http://bit.ly/Dingo__Music▶딩고프리스타일 (Dingo Freestyle) : http://bit.ly/Dingo__Freestyle▶일소라 (일반인들의 소름돋는 라이브) : http://bit.ly/ilsoracontact : musicbiz@makeus.com#인피니트 #INFINITE #킬링보이스#김성규 #장동우 #남우현 #이성열 #김명수 #엘 #이성종#Comeback #Begin #New_Emotions #KillingVoice #딩고뮤직 #DingoMusic"
"TYDiwpVZZC8","[SUB] 권은비 덱스 다시 만나다! 그런데 팔당오징어에 술 한 잔을 곁들인… 🔥🦑🔥 | 선넘는 맵찔이 Ep. 3","2023-08-02T08:59:55Z","UCVIS3TPjIOypcwPA6iiQjZw","스튜디오 어서오고","24","23.09.08","#선넘는맵찔이|#권은비|#덱스|#팔당오징어|#먹방|#매운맛|#선넘는_맵찔이|#kwon_eunbi|#eunbi|#선넘비|#아이즈원|#izone|#술먹방|#dex|#워터밤|#waterbomb","1489532","22789","0","2053","https://i.ytimg.com/vi/TYDiwpVZZC8/default.jpg","False","False","맵찔이 은비가 팔당오징어를 먹을 수 있을리 없잖아! 무리무리! (무리가 아니었다?!)소문난 매운맛 팔당오징어와 함께하는 맵고수 친구 덱스와의 술자리!어쩌면 매운 안주를 먹을 때 맵찔이에게 가장 필요한 건 대신 먹어줄 친구일지도...? 🥰#선넘는맵찔이 #권은비  #덱스  #팔당오징어 #먹방 #매운맛 #kwon_eunbi  #eunbi  #선넘비 #술먹방 #선넘는_맵찔이 #아이즈원 #izone -----------------------------------------------권은비🐰의 전지적 맵찔 시점 🔥매운맛 탐험기🔥매주 수요일 저녁 6시 선넘는 맵찔이👅*본 콘텐츠와 무관한 내용의 댓글과 출연자에 대한 무분별한 욕설, 비난 및 조롱 등 악의적인 댓글은 무통보 삭제될 수 있습니다.CONTACT | studio.usog@gmail.com-----------------------------------------------"
"oMDkL1f1r4c","신세계의 신이 된 남자ㅣ22-23 PL 엘링 홀란드 모든 골 모음","2023-08-05T01:15:04Z","UCkFGfvN6AAhoBVSqju0CgmA","SPOTV 오리지널","17","23.09.08","홀란드 골모음|맨시티 홀란드|홀란드|엘링 홀란드|PL|맨시티|프리미어리그|득점왕","365848","3966","0","917","https://i.ytimg.com/vi/oMDkL1f1r4c/default.jpg","False","False","#PL #맨시티 #홀란드프리미어리그 개막 D-7 ⚽SPOTV표 황금레시피, SPOTV Originals!"
"lTkduj1vW7g","브브걸 (BBGIRLS) 'ONE MORE TIME' OFFICIAL MV","2023-08-03T09:00:28Z","UCLvhr40dgoBcV4XBlOhauNw","워너뮤직코리아 (Warner Music Korea)","10","23.09.08","[none]","1406096","0","0","5063","https://i.ytimg.com/vi/lTkduj1vW7g/default.jpg","False","False","브브걸 (BBGIRLS) 'ONE MORE TIME' OFFICIAL MV『브브걸 (BBGIRLS) Official SNS』BBGIRLShttps://bio.to/BBGIRLSYouTubehttps://www.youtube.com/@weare_bbgirlsInstagramhttps://www.instagram.com/weare_bbgirls/Twitterhttps://twitter.com/weare_bbgirlsTikTokhttps://www.tiktok.com/@weare_bbgirlsFacebookhttps://www.facebook.com/weare.bbgirls/#브브걸 #BBGIRLS #ONEMORETIME"
"CNMOib_rVU0","[자연인] 519-2 이렇게 푸짐하게 하신다구요? 제작진까지 호강시켜 버리는 통 큰 자연인","2023-08-04T08:17:36Z","UCLtOnhCSyMjJHVrHu8C0niQ","나는 자연인이다","24","23.09.08","자연인|레전드|나는 자연인이다|자연인이다|자연|이승윤|윤택|mbn|통큰|제작진|촬영중단|촬영중지|수박|계곡|보쌈|돼지고기|스태프|먹방|음식","397243","3078","0","119","https://i.ytimg.com/vi/CNMOib_rVU0/default.jpg","False","False","🎁멤버십 가입해서 최신 회차 + 보고 싶은 자연인 풀영상으로 보자!🎁https://www.youtube.com/channel/UCLtOnhCSyMjJHVrHu8C0niQ/join나는 자연인이다 519회 2022.09.14.#나는자연인이다 #자연인 #레전드 #MBN #이승윤 #윤택✅ 나는 자연인이다 채널 구독하기: https://www.youtube.com/c/나는자연인이다mbn"
"yeCJ_MjsTYo","JEON SOMI (전소미) - ‘Fxxked Up’","2023-08-02T09:00:43Z","UCg8ZzloDPTrOiGztK0C9txQ","THEBLACKLABEL","10","23.09.08","KPOP|K-POP|SOMI|Jeon Somi|전소미|소미|blackpink|yg entertainment|music video|YG|pop|r&b|music|what you waiting for|single|birthday|theblacklabel|sm entertainment|jyp entertainment|bts|big hit entertainment|dance|hip hop|dumb dumb|DUMB DUMB|DUMBDUMB|dumbdumb|덤덤|전소미 덤덤|덤덤 전소미|JEON|IOI|아이오아이|프로듀서101SOMI|XOXO|엑소엑소|엑스오엑스오|XOXOCHALLENGE|THEBLACKLABEL|JEONSOMI_XOXO|IAMSOMI|아이엠소미|TEASER|Anymore|전소미 Anymore|애니모어|GAMEPLAN|게임플랜|FastForward|FF|패스트포워트|M/V|MusicVideo|MV|뮤직비디오|개별로","2910479","0","0","2951","https://i.ytimg.com/vi/yeCJ_MjsTYo/default.jpg","False","False","JEON SOMI (전소미) - ‘Fxxked Up’JEON SOMI EP ALBUM [GAME PLAN]https://JEONSOMI.bio.to/GAMEPLANMore about JEON SOMI @https://www.instagram.com/somsomi0309/https://www.facebook.com/somsomi.officialhttps://twitter.com/somi_official_https://www.tiktok.com/@somi_official_#JEONSOMI #전소미 #GAMEPLAN #개별로 #FxxkedUp#JEONSOMI_GAMEPLAN_20230807#THEBLACKLABEL #더블랙레이블"
"5IRP1YQmG1Y","너 합격","2023-08-02T12:30:03Z","UCBkyj16n2snkRg1BAzpovXQ","우왁굳의 게임방송","20","23.09.08","우왁굳|우왕굳|우왁굳의게임방송|왁두|종합게임|리그오브레전드|스팀게임|쿠소게임|인디게임|비디오게임|레이싱게임|레이스게임|오버워치|배틀그라운드|배그|vr|마인크래프트|마크|vrchat|vr챗|노가리|Minecraft","802708","18931","0","1730","https://i.ytimg.com/vi/5IRP1YQmG1Y/default.jpg","False","False","너 합격[서브채널]● 왁타버스 : https://www.youtube.com/@waktaverse ● 왁타버스 ZERO : https://www.youtube.com/@wakzero ● 우왁굳의 돚거 : https://www.youtube.com/@wakthief [MORE]● TWITCH 생방송 : https://www.twitch.tv/woowakgood ● 우왁굳 팬카페 - 왁물원 : https://cafe.naver.com/steamindiegame ● 카카오톡 팬치의 일상 : https://e.kakao.com/t/panzee-the-cute-chimpanzee● 카카오톡 왁모티콘 1 : https://e.kakao.com/t/woowakgood-so-good● 카카오톡 왁모티콘 2 : https://e.kakao.com/t/woowakgood-so-good-ver-2[SNS]● 우왁굳 인스타그램 : https://www.instagram.com/instawakgood ● 웰시코기메시 인스타그램 : https://www.instagram.com/welshcorgimessi● 트위터 : https://www.twitter.com/jinjjawakgood 광고 문의 : marketing@parable-asia.com개인 문의 : ecvhao@naver.com"
"3-yJxaxLSBg","한국에서 온 물건에 춤추는 남편 & 우리 집에 침입한 불청객","2023-08-03T23:00:02Z","UCXdEu0yCFd0qBFiDvh6FDBg","[스페인]산들무지개","22","23.09.08","스페인 고산|스페인 남편|한국 아내|한국인 아내|외국인 배우자|외국인 남편|외국인 아내|국제부부|국제 부부|국제 커플|국제커플|국제 가족|국제가족|다문화 가정|다문화 가족|다문화가족|다문화가정|스페인 생활|스페인 가족|가족|한국 스페인 가족|한국 여자|한국인 엄마|해외생활|외국생활|한국 엄마|스페인 남자|스페인 국제가족|한국 스페인 커플|스페인|남편|일상|한국 스페인|쌍둥이|중딩|스페인 네 모녀|스페인 아빠|외국인남편|스페인 일상|한국인과 사는 외국인|전원생활|시골집|외국 시골집|가족 브이로그|새집|이사|집 수리|집수리|지중해|여름|더위|수영장|물|지하수|간이수영장|풀장|한여름|수조|수리|파스타 샐러드|음료|한국 조카|한국인|손님|여름방학|선물|한국 물건|츄리닝|티셔츠|양념|떡볶이|소스|라면|온 선물|사냥개|불청객|쥐구멍|감자샐러드|한국 선물|한국선물|한국물건|밥","200597","11353","0","322","https://i.ytimg.com/vi/3-yJxaxLSBg/default.jpg","False","False","한국 조카의 방문으로 아이들의 여름 방학은 더 풍요로워진 듯해요. ^^우리 부부는 하루하루 고쳐야 할 것을 발견하고, 묵묵히 그 일을 해나가는 일상을 보내고 있습니다.  오늘도 즐겁게 봐주시고 항상 건강 유의하시고, 행복하세요! 🤗💕💖* 영상 내 편집 중 실수로 단어 오류, 맞춤법, 띄어쓰기 등 틀린 게 있을 수 있으니 넓은 마음으로 이해해주시면 고맙겠습니다. 또한, 어린이가 출연했다고 댓글이 제한될 수 있다는 점도 알려드립니다. 산들무지개의 제2채널 https://youtube.com/c/GrimiDrimi산들무지개의 커뮤니티 링크https://www.youtube.com/channel/UCXdEu0yCFd0qBFiDvh6FDBg/community산들무지개 블로그 http://spainmusa.com산들무지개의 인스타그램https://www.instagram.com/spainmusa산들무지개 문의 이-메일 spainmusaa@gmail.com산들무지개의 책, [우리 가족, 숲에서 살기로 했습니다](김산들, 시공사)http://www.yes24.com/Product/Goods/69121838e-bookhttp://www.yes24.com/Product/goods/72257013그밖에 많은 온라인 서점 및 오프 서점에서 판매되고 있습니다.* 산들무지개의 영상 저작권은 산들무지개에게 있습니다. 모든 영상의 다운로드, 재업로드, 재편집, 복사 배포 등은 할 수 없음을 알려드립니다.* BGM https://www.epidemicsound.com/referral/b5g15j/Like the music? Find my playlist with the music I've used here:https://share.epidemicsound.com/b5g15j/?playlist=ejafsijbr6q1lnuavtdyo5kbbc3t8o5sAnd, if you sign up to Epidemic Sound through the playlist link, you'll get 1 month for free!"
"5C4vdj_94Y0","(홍쓴이네의) 여름이었다","2023-08-04T09:27:56Z","UC2E-9AQ-kwOFlvvXLfY6V8Q","홍현희 제이쓴의 홍쓴TV","24","23.09.08","똥별이|슈퍼맨이 돌아왔다|슈돌 똥별이|제이쓴|홍현희|제이쓴 똥별이|준범이","516235","12166","0","475","https://i.ytimg.com/vi/5C4vdj_94Y0/default.jpg","False","False","여름 너무 덥다!!!!!!!#홍쓴이네 #똥별이"
"YimNkd4TaKc","학교 선배님의 딸이 여기에.... (Feat. 오마이걸)","2023-08-03T09:09:11Z","UCoe-0EVDJnjlSoPK8ygcGwQ","김종국 GYM JONG KOOK","17","23.09.08","김종국|짐종국|런닝맨|미우새|헬스|운동|유재석|하하|이광수|송지효|스포츠|김동현|UFC","813278","12898","0","877","https://i.ytimg.com/vi/YimNkd4TaKc/default.jpg","False","False","생기발랄한 아이돌 오마이걸이 짐종국에 찾아왔습니다!한순간도 텐션이 줄지 않는 오마이걸의 운동과 식단 토크 신기한 개인기(?)도 볼 수 있습니다 ㅎ나름 운동에 진심인 다양한 사연들이 나옵니다공감 되시면 한 번씩 도전해 보시길 추천드립니다! 정신없었지만 즐거웠습니다! ㅎ웃으면서 즐거운 하루 마무리하세요! ---------fmPROJECT, PRIZM에서 상시판매 중! (1년 수익금 기부)https://prizm.app.link/QAKi5qwc4yb#김종국 #짐종국 #오마이걸"
"YnnzRr_KyGY","[5-6화 하이라이트] 엄마의 썸남이 내 아빠라고?! | 남남","2023-08-01T14:20:00Z","UCXmRJfZ3atLVLDiO5Ufycvw","스튜디오지니","24","23.09.08","[none]","1076670","5531","0","333","https://i.ytimg.com/vi/YnnzRr_KyGY/default.jpg","False","False","살인사건 용의자인 줄 알았던 사람이엄마의 썸남이 첫사랑이자 내 아빠였다고?!📺 Genie TV Original [남남]은ENA 채널 매주 월,화 밤 10시 본방송!스트리밍은 Genie TVGenie TV 모바일에서도 이어 보세요~!#GenieTV #지니TV #ENA #지니TV모바일#남남 #전혜진 #최수영 #안재욱 #박성훈"
