video_id,title,publishedAt,channelId,channelTitle,categoryId,trending_date,tags,view_count,likes,dislikes,comment_count,thumbnail_link,comments_disabled,ratings_disabled,description
"WcAAur2_ySo","വെള്ള വസ്ത്രം ധരിച്ച് പേടിപ്പിക്കുന്നുവെന്ന് നാട്ടുകാർ; കേസെടുക്കാൻ വകുപ്പില്ലെന്ന് പോലീസ്","2023-08-01T10:41:59Z","UCwXrBBZnIh2ER4lal6WbAHw","Mathrubhumi News","25","23.02.08","Kerala News Live|Kerala news|Kochi|Malayalam News|Malayalam News Live|Mathrubhumi Live|Police|Super Prime time|kerala headlines|kerala news|kerala news live|latest news|live news|live news malayalam|local kerala news|malayalam breaking news|malayalam news live|mathrubhumi|mathrubhumi live|mathrubhumi news|mathrubhumi news live","737533","7290","0","1521","https://i.ytimg.com/vi/WcAAur2_ySo/default.jpg","False","False","പോലീസിന് തലവേദനയായി രാത്രിയിൽ വെള്ള വസ്ത്രം ധരിച്ച്, മൂക്കിന് മുകളിലൂടെ ഒരു തുണി കെട്ടി പുറത്തിറങ്ങുന്ന സ്ത്രീ.#Police #Kochi ..മാറുന്ന ലോകത്ത് കൂടുതൽ മാറ്റങ്ങളോടെ. പുതിയ വേഗത്തിൽ. പുതിയ ലുക്കിൽ.മാതൃഭൂമി ന്യൂസ്. #MathrubhumiNews.Watch Mathrubhumi News Live at https://youtu.be/DhujH-qBWx0#MalayalamNews #MalayalamLatestNews #KeralaNews #MathrubhumiNews #Mathrubhumi #Malayalamnewslive #Malayalamlivenews #Latestmalayalamnews #Breakingnews #Breakingnewskerala #BreakingnewsliveConnect with Mathrubhumi News:Visit Mathrubhumi News's Website: http://www.mathrubhumi.com/tv/Find Mathrubhumi News on Facebook: https://www.fb.com/mbnewsin/-----------------------------------------------------Mathrubhumi News (മലയാളം: മാതൃഭൂമി ന്യൂസ്) is a 24-hour Malayalam television news channel and is one of Kerala's most viewed TV channels. Owing to its varied presentation style and reliable content, Mathrubhumi News has become the fastest-growing news channel in Kerala. More than just a news channel, Mathrubhumi News features a host of programs that relate to various aspects of life in Kerala. Some of the frontline shows of the channel are: - Wake Up Kerala, the Best Morning Show in Malayalam television.- Njangalkum Parayanund, youth-centric viewers sourced discussion around the pressing topic of the day.- Super Prime Time, the most discussed debate show during prime time in Kerala.- Vakradrishti and Dhim Tharikida Thom, unmatchable satire shows.- Spark@3, the show on issues that light up the day.- World Wide, a weekly round-up of all the important news from around the globe.Happy viewing!Mathrubhumi News is an initiative by The Mathrubhumi Printing & Publishing Co. Ltd.Mathrubhumi News. All rights reserved ©."
"IE4z3ryUGe4","APARAJITA ଅପରାଜିତା -Full EP -457- Mega Serial - Raj Rajesh, Subhashree,KK,Priya - Sidharrth TV","2023-07-31T13:30:05Z","UCbBWncD3X_dfXwxmj4KwJnA","Sidharrth TV","24","23.02.08","sidharth tv|sidharthtv|sidharth tv channel|sidharth odia tv channel|sidharthtv odia|sidharth odia video|siddharth tv|sidharth tv mega serial|sidharth tv reality show|mun bi namita agrawal hebi 2|mangula kanya|sampurna laxmi|sidharrth tv|debadasi|manjula kanya full episode|aparajita full episode|mangula kanya full episode|raja sundari gala episode|raja sundari|padyantari|odishara nua swara senior|mekanik didi|mechanic didi full episode|aparajita 457","794209","15666","0","226","https://i.ytimg.com/vi/IE4z3ryUGe4/default.jpg","False","False","ସିଦ୍ଧାର୍ଥ  TV ଏବେ ସମସ୍ତ DTH ଏବଂ Cabel ରେ ଉପଲବ୍ଧ : Dish TV -1311,Tata Play -1757, Airtel -600, Sun Direct -657, D2H -1311.Also watch other 3 channels of SIDHARTH TV NETWORK :Sidharth Bhakti : Dish -1395, Airtel -616, Sun Direct -491,Tata Play -1796, D2H -1395Sidharth Gold : Dish TV -1333, Airtel-602,Sun Direct-658,D2H-1333Jay Jagannath : Dish-1397,Sun Direct-490,Airtel -     , D2H-1397SUBSCRIBE us for Mega Serial, Reality Shows every day:  YouTube : http://www.youtube.com/c/SidharthTVInstagram : https://www.instagram.com/sidharthtvofficial/Facebook : https://www.facebook.com/SidharthTVofficial/Twitter : https://twitter.com/sidharth_tvSubscribe our other Television Channels :Sidharth Bhakti : https://bit.ly/3ybqxAJSidharth Gold : https://bit.ly/3a1P4Ac Jay Jagannath : https://bit.ly/3aa1lTa#SidharthTV #SidharthBhakti #SidharthGold #SidharthMusic #NamitaAgrawal #SitaramAgrawal #jayjagannath"
"xOgHrQmGCHY","നിങ്ങൾ കാത്തിരുന്ന വീഡിയോ.പത്ത് വർഷമായി ഒരു മയിലിന് വേണ്ടി ജീവിക്കുന്ന ഉമ്മ.","2023-07-29T15:00:53Z","UCG9PPXjYNfPe4_a_PQb51Ng","Base world","22","23.02.08","base world|peacock|sad life|emotional video|sad|grandmother|Fatima","197060","8104","0","195","https://i.ytimg.com/vi/xOgHrQmGCHY/default.jpg","False","False","#peacock#മയിൽ#sadlife#girl#wildlife#fathima#grandmother പത്തുവർഷമായി ഒരു മൈലിന് ഭക്ഷണം കൊടുത്തു ജീവിക്കുന്ന ഫാത്തിമ ഉമ്മയുടെ കഥയാണ് നമ്മുടെ വീഡിയോയിൽ കാണിച്ചിരിക്കുന്നത് ജീവിതത്തിൽ ഒരുപാട് പ്രാരാബ്ദങ്ങൾ ഉള്ള ഈ ഉമ്മ ഇന്ന് പെൺമക്കളുടെ കൂടെയാണ് ജീവിതം ദിവസവും രാവിലെയും വൈകുന്നേരവും വന്നു ഉമ്മയുടെ കയ്യിൽ നിന്നും മയിൽ ഭക്ഷണം കഴിച്ചു പോകുന്നു ഇതൊരു കൗതുക കാഴ്ചയായി ജനങ്ങൾ കാണുന്ന ത്"
"Rli2D8ZalO4","Barsatein: रेयांश के सामने अपनी बेगुनाही कैसे साबित करेगी आराधना? #sbs","2023-08-01T11:36:03Z","UCCaJ-4eia53A8FcZD-KwaeA","Saas Bahu aur Saazish","24","23.02.08","saas bahu aur saazish|saas bahu aur saazish todays episode|serial updates saas bahu aur saazish|saas bahu aur saazish entertainment news|entertainment news|tv serials news|tv soaps updates|saas bahu aur saazish abp news","158641","1593","0","33","https://i.ytimg.com/vi/Rli2D8ZalO4/default.jpg","False","False","#barsatein #sbs #saasbahuaursaazish #kushaltondon #shivangijoshi #aditiarorasawant Watch Saas Bahu aur Saazish (SBS) on ABP News daily at 2:30 PM to know what's happening in Indian television and bollywood industry with Aditi Arora Sawant. Presenting you the latest updates and daily dose of entertainment in the form of star cast interviews, gossips, updates of reality shows, behind the scenes, twist in serials. Join the non stop entertainment with Saas Bahu aur Saazish for all the cool and juicy news.For your daily dose of Entertainment, you can subscribe to our channel on YouTube: https://www.youtube.com/user/sbsabpnewsABP Hindi: http://abpnews.abplive.in/ABP English: http://www.abplive.in/Download ABP App for Apple: https://itunes.apple.com/in/app/abp-live-abp-news-abp-ananda/id811114904?mt=8Download ABP App for Android: https://play.google.com/store/apps/details?id=com.winit.starnews.hin&hl=enSocial Media Handles:Twitter : https://twitter.com/SBSABPNewsFacebook : https://www.facebook.com/saasbahuaursaazishGoogle+ : https://plus.google.com/u/2/+sbsabpnewsInstagram : https://www.instagram.com/sbsabpnews/"
"NAG6hy4Z4gQ","Minecraft 100 Days Only Sands (हिंदी)","2023-07-30T09:06:51Z","UCZRuefnmW9ngPuLp1vryBpw","4x4 gaming","20","23.02.08","I survived|Hardcore|Minecraft|Hardcore Minecraft|I survived 100 days|100 days Minecraft|100 Days|I survived 100 days survival desert|Deserted Island|Survival Island 100 days|Survival Series|Hardcore Minecraft 100 days|Hardcore Survival hardcore|Survival|minecraft desert|minecraft hardcore in hindi|100 days one block|100 days in minecraft|4x4gaming|minecraft desert story|cameraman|toilate|skibidi toilet 50|DaFuq!?Boom!|dawn of war|warhammer","265266","18385","0","545","https://i.ytimg.com/vi/NAG6hy4Z4gQ/default.jpg","False","False","Hello guys this video is only for entertainment which I survive100 days in Minecraft hardcore in Desert onlyI have face so much difficulty but I survive, Hardcore mode in Minecraft is the hardest difficulty of the game, so why not try and survive 100 days in Hardcore Minecraft! I survived 100 days in Minecraft hardcore and this is what happened! please enjoy and LIKE share SUBSCRIBE also thank you so much for your reading.DISCORD CONNECT- https://discord.gg/atxvam4INSTAGRAM face revel- 4x4 gaming- https://www.instagram.com/4x4gaming/►Modpack- update on Discord Tomorrow.. ------------------------------------------------------------------                        NOTEThere is no copyright infringement intended for the song or picture. If you have an issue with me posting this video please contact me through by one of my social networks or YouTube private messaging system. Once I have received your message and determined you are the proper owner of this content I will have it removed.------------------------------------------------------------------@Techno Gamerz @Sourav Joshi Vlogs @GamerFleet @Total Gaming @ProBoiz 95 @EpicDipic @BlackClue Gaming @Mythpat @Dynamo Gaming @Minecraft @YesSmartyPie @Dante Hindustani Shorts @Lam 2.0 @Chapati Hindustani Gamer @Hindustan Gamer Loggy @Anshu Bisht @Dash Empire @Mc addon @Under Minutes @Krypton Ka Beta @Carry Depie @Bebu @AndreoBee @Frostbite Gaming @Dante Hindustani @MrGamerJay 100 days in  camera man toiletsminecraft,minecraft 100 days,i survived 100 days in hardcore minecraft,i survived 100 days in minecraft,i survived 100 days,100 days hardcore,100 days minecraft,minecraft,minecraft hardcore,hardcore minecraft,100 days as a wither,100 days as a minecraft wither dragon,i survived 100 days minecraft,minecraft hardcore 100 days,i spent 100 days in hardcore minecraft,100 days as a wither in hardcore minecraft minecraft minecraft 100 days 100 days in minecraft 100 days no swearing no cursing maizen dragon minecraft dragon family friendly minecraft hardcore minecraft mod minecraft mods spotlight bronzo modded ender dragon kid friendly 100 days hardcore mod beckbrojack mods how to train your dragon minecraft dragons minecraft funny trolling traps glitch troll minecraft how to train your dragon playthrough secret minigame pranks maps mini game nico and cash challenge showcase map cash and nico nico minecraft dragon mod roleplay aphmau cash crazy mini-game 100 days minecraft i survived 100 days hardcore minecraft aphmau minecraft warden moose clean minecraft videos aphmau ender dragon beckbro 100 days dragon proboiz 95 minecraft map best minecraft mods dragon minecraft minecraft animation maxcraft minecraft hardcore series surviving 99 years as ender dragon in minecraft mob battle custom i. m. noob i survived 100 days in minecraft ab is noob moments minecraft update beckbrojack minecraft 100 days challenge minecraft custom map 100 days as a lava dragon minecraft academy academy minecraft custom mod minecraft challenge aphmau playing as dragon minecraft roleplay ryguyrocky aphmau dragon minecraft night fury ryguyrocky 100 kid fozo kids minecraft hardcore 100 days school dragon mod top minecraft wiz x wizx viz x trending thug boi max 99 years as a dragon monster school animation ender dragon story surviving 99 years as ender dragon 99 years as ender dragon sighting surviving 99 years as herobrine surviving 99 years as enderman in minecraft birth to death loud dude surviving 99 years as monster school minecraft herobrine aphmau dragon orphan aphmau playing as a dragon in minecraft aphmau orphan dragon minecraft aphmau orphan dragon aphmau baby ender dragon monster school 100 dragons"
"g3xUUqtBWgY","TMC MLA Humayun Kabir Threatens To Float New Party, Kunal Ghosh Reacts  | Sangbad Pratidin","2023-07-29T13:23:21Z","UCLPCvTftdZpZQSM-mckfqXQ","Sangbad Pratidin","25","23.02.08","Bengali News|Bangla News|Sangbad Pratidin|Humayun Kabir|Humayun MLA|TMC|Debra|West Medinipur|District News|Bengal News|humayun kabir|Humayun Kabir latest news|humayun kabir latest update|Humayun Kabir News Today|Humayun Kabir Form News Team","270124","1849","0","509","https://i.ytimg.com/vi/g3xUUqtBWgY/default.jpg","False","False","TMC state leadership has issued a show cause notice against Humayun Kabir. TMC MLA Humayun Kabir threatens to float new party, Kunal Ghosh Reacts.#humayunkabir #tmcmla #tmc #kunalghosh #bengalinews #banglakhobor #sangbadpratidin ````````````````````````````````````````````````````````````````````````````````````````````````````````````For More Information :Visit our Website: https://www.sangbadpratidin.in/Like us on Facebook: https://www.facebook.com/sangbadpratidin.in/Follow us on Twitter: https://twitter.com/SangbadPratidinFollow us Instagram: https://www.instagram.com/sangbadpratidin/"
"VRLcVIC6IAY","JAILER - Hukum Lyrical (Telugu) | Superstar Rajinikanth | Sun Pictures | Anirudh | Nelson","2023-07-30T05:30:09Z","UCN2KBcMDJyCWB57K7i_Z10g","Gemini TV","24","23.02.08","Hukum|Telugu Hukum|Hukum Lyric Video|jailer|jailer songs|hukum telugu|hukum telugu lyrical|superstar rajinikanth|rajinikanth|anirudh|nelson|sun pictures|jailer movie songs|jailer movie song hukum|hukum song|hukum lyrical|hukum lyrical video|hukum video song|kaavaali|kaavaalaa|kaavaalaa lyrical video|lyric video|telugu song|telugu movie songs|new telugu songs|new movie telugu songs|gemini tv|new movie|new movie jailer songs|jailer telugu songs","465536","29483","0","1012","https://i.ytimg.com/vi/VRLcVIC6IAY/default.jpg","False","False","Watch the official lyric video of Hukum Telugu song from the movie Jailer. Starring Superstar Rajinikanth, Directed by Nelson & Music by Anirudh.#HukumLyricVideo #Jailer #SuperstarRajinikanth #SunPictures #Nelson #Anirudh #jailersecondsingleSingle #rajinikanth #TeluguHukum -----------------------------------------------------------------------------------Listen to the Hukum telugu songs on your favorite music service:Spotify - https://bit.ly/45qefU7Apple Music - https://bit.ly/3YexddOWYNK - https://bit.ly/3rKTEuRJioSaavn - https://bit.ly/3Yd0rJUDeezer - https://bit.ly/3rNL66KGaana - bit.ly/3OkKflgAmazon Prime Music - https://bit.ly/47fHtXqHungama - bit.ly/3DABy1o----------------------------------------------------------------------------------Song Credits:Song Title : Hukum Album / Movie : JailerComposed by Anirudh RavichanderLyrics - BhaskarabhatlaVocals - Dinker Kalvala & ChorusComposed, Arranged & Programmed by Anirudh Ravichander Electric Guitar by Keba JeremiahBacking Vocals by Sai Charan Bhaskaruni, Aditya Iyengar, Arun KaundinyaKeyboard, Synth & Rhythm Programmed by Anirudh RavichanderRhythm Produced by Shashank VijayAdditional Rhythm Programmed by KalyanAdditional Keyboard Programmed by IC, Arish-Pradeep PJMusic Advisor - AnanthakrrishnanCreative Consultant - Sajith SatyaVocals Supervision - Sri KrishnaRecorded at Albuquerque Records, Chennai. Engineered by Srinivasan M, Shivakiran SRecorded at Sruthi Audio labs,Hyderabad.Engineered by Srinath KomanduriMixed & Mastered Vinay Sridhar & Srinivasan M at Albuquerque Records, ChennaiAssisted by Jishnu Vijayan & Rajesh KannanMusic Cordinator - Velavan BMovie Credits:Star Cast: Rajnikanth, Mohan Lal, Jackie Shroff, Shiva Rajkumar, Sunil, Ramya Krishnan, Vinayakan, Mirna Menon, Tamannah, Vasanth Ravi, Naga Babu, Yogi Babu, Jaffer Sadiq, Kishore, Billy Muralee, Sugunthan, Karate Karthi, Mithun, Arshad, Marimuthu, Rithvik, Saravanan, Aranthaangi Nisha, Mahanadi Shankar & others.Produced by Sun PicturesWritten And Directed By NelsonAn Anirudh MusicalDOP: Vijay Kartik KannanEditor: R.NirmalArt: Drk KiranAction: Stun SivaCostume Designers: Pallavi Singh, Muthul HafeezSound Mix: Suren.GSound Design: Suren.G - S.AlagiakoothanColorist: Andreas BruecklDI Lab: Prime Focus LtdVFX: Supervisor AjayMakeup: C.HarinathStills: V.SittrarasuPublicity Design: Kabilan ChelliahPRO: Riaz K.AhmedProduction Controller: D Ramesh KuchirayarExecutive Producer: Raja Sridhar"
"lfrR-F6wyTM","श्री कृष्ण ने शकुनि को क्या समझाया था? | Mahabharat Scene | B R Chopra | Pen Bhakti","2023-07-30T12:30:23Z","UCHKGDg0GJKBsA9mFraDOLHA","Pen  Bhakti","10","23.02.08","श्री कृष्ण ने शकुनि को क्या समझाया था?|इंद्रप्रस्थ देखकर दुर्योधन को ईर्ष्या क्यों हुई थी?|सहदेव और शकुनि का युद्ध|भीम का विकर्ण और कर्ण से युद्ध|श्री कृष्ण ने युद्ध के विषय में किसे बताया था?|कर्ण की पराजय कैसे हुई थी?|गुरु को कौन सा अधिकार नहीं था?|Mahabharat Scene|b r chopra|pen bhakti|महाभारत|best scene|mahabharat pen bhakti|mahabharat b r chopra all episodes|arjun vs krishna conversation|karna vs bheem|karna vs bheem fight scene","193101","1405","0","52","https://i.ytimg.com/vi/lfrR-F6wyTM/default.jpg","False","False","श्री कृष्ण ने शकुनि को क्या समझाया था? | Mahabharat Scene | B R Chopra | Pen BhaktiMahabharat is an Indian television series based on the Hindu epic.#mahabharat #krishna #penbhakti #brchopraWatch only on PEN Bhakti Channel and Don't forget to share & subscribe.Produced & Directed By – B.R. ChopraMusic Composer – Raj KamalScript – Rahi Masoom RazaPresented By - PEN StudiosSubscribe Pen Bhakti :- https://bit.ly/3Bg535sPlease do visit, for the latest updates:- https://www.facebook.com/BhajanSangrah/www.facebook.com/penbhaktiwww.instagram.com/penbhakti 👉 Log On To Our Official Website : https://penstudios.in/"
"aNON03z_R08","Will You Be My Wife | Latest Malayalam Short Film | Kutti Stories","2023-07-30T12:30:10Z","UCanttLaYGlGci5J4TA-8GAA","Kutti Stories","24","23.02.08","Will You Be My Wife|will you be my wife short film|malayalam short film|latest malayalam short film|malayalam romantic short film|malayalam new short film|malayalam love short film|malayalam latest short film|Latest love short films|romantic short film|short film malayalam|new short film malayalam latest|malayalam short film 2023|short film malayalam comedy|new malayalam short film|romantic short film malayalam|short film malayalam 2023","310949","14110","0","245","https://i.ytimg.com/vi/aNON03z_R08/default.jpg","False","False","For advertisements and collaborations : info@kuttistories.in➺ Subscribe Now : https://avenir.to/SubscribeKuttiStories➺ Like On Facebook : https://avenir.to/LikeKuttiStories➺ Follow On Instagram : https://avenir.to/FollowKuttiStories➺ Follow On Twitter : https://avenir.to/FollowKutti-Stories✨ ANTI-PIRACY WARNING ✨This content is Copyrighted to 𝐊𝐮𝐭𝐭𝐢 𝐒𝐭𝐨𝐫𝐢𝐞𝐬. Any unauthorized reproduction, redistribution or re-upload is strictly prohibited. Legal action will be taken against those who violate the copyright of the same"
"VYlM2xlUNYM","Ethirneechal - Promo | 01 Aug 2023 | Sun TV Serial | Tamil Serial","2023-07-31T16:45:09Z","UCBnxEdpoZwstJqC1yZpOjRA","Sun TV","24","23.02.08","Ethirneechal|Ethirneechal serial|Ethirneechal promo|Ethirneechal today|Ethirneechal serial today|Ethirneechal sun tv serial|Sun TV Serial|Sun TV Serials|sun tv tamil serial|SunTV Serial Today|sun tv serial today|Sun tv full episodes|Sun tv tamil full episodes|Sun tv tamil shows|sun tv shows|Tamil Serials|tamil serials sun tv|Tamil Serial episodes","1554087","18151","0","585","https://i.ytimg.com/vi/VYlM2xlUNYM/default.jpg","False","False","Watch the Latest Promo of popular Tamil Serial #Ethirneechal that airs on Sun TV.Watch all your favourite serials exclusively ONLY on Sun NXT for FREE. *Free only for Indian Users.Download here:Android - http://bit.ly/SunNxtAdroidiOS: India - http://bit.ly/sunNXTWatch on the web - https://www.sunnxt.com/Urged by her father, Janani is always a high achiever. But her marriage into a patriarchal family dashes her dream of a career. Thus begins Janani's arduous journey towards empowering her family's oppressed women to unleash their power.#EthirneechalPromo #EthirneechalSerial #Ethirneechal #SunTVSerial #SunTVDon't forget to SUBSCRIBE to the Sun TV YouTube 👉 http://bit.ly/suntvsubscribe---------------------------------------------------------Watch more:Movie Clips on SUN NXT - https://bit.ly/3gc1dPIShows from Sun Music - http://bit.ly/2YS5eBiComedy Shows from AdithyaTV - http://bit.ly/2K6VaiZNews from Sun News - http://bit.ly/2Yyvgsi---------------------------------------------------------SUN NXT: Watch the latest movies in DOLBY DIGITAL PLUS, 4000+ Movies in HD, 30+ Live TV Channels, TV Shows, TV Serials & Digital Exclusives on SUN NXT anywhere anytime.---------------------------------------------------------Follow us on Social Media for Latest Updates:Facebook: https://www.facebook.com/SunTVTwitter: https://twitter.com/SunTVInstagram: https://www.instagram.com/suntv---------------------------------------------------------#SuntvSerial #TamilSerialPromo #SunTVshows #NewTamilSerials #SunTV #SunTVserials #SunTVProgram #SunNXT #LatestTamilSerials #SuntvSerialPromo #SuntvSerialEpisodes #SunTVpromos #TamilSerialPromos #TamilTVserials #TamilSerialEpisodes---------------------------------------------------------"
"i1Xk6J0yQ4c","நல்ல வேளை ஒன்னும் ஆகல 🙂  | Aaha Kalyanam | Episode Preview","2023-07-31T14:33:28Z","UCvrhwpnp2DHYQ1CbXby9ypQ","Vijay Television","24","23.02.08","[none]","812391","8495","0","37","https://i.ytimg.com/vi/i1Xk6J0yQ4c/default.jpg","False","False","ஆஹா கல்யாணம் - திங்கள் முதல் வெள்ளி வரை இரவு 7 மணிக்கு நம்ம விஜய் டிவி ல.. Click here to watch the full Episodes - https://www.hotstar.com/in/tv/aaha-kalyanam/1260135554 #AahaKalyanam #VijayTelevision"
"IVFTzMk6dIU","മക്കൾക്ക് മുന്നിൽ വിതുമ്പി യൂസഫലി,ഉമ്മൻചാണ്ടിക്ക് വേണ്ടി കുട്ടികൾക്കൊരു വലിയ സമ്മാനവും #YusuffAliMA","2023-07-29T12:04:43Z","UC6YiqAwty6hxgeeGDEEfxew","Stories by Iype Vallikadan","22","23.02.08","[none]","274652","3554","0","245","https://i.ytimg.com/vi/IVFTzMk6dIU/default.jpg","False","False","മക്കൾക്ക് മുന്നിൽ വിതുമ്പി യൂസഫലി...,ഉമ്മൻചാണ്ടിക്ക് വേണ്ടി കുട്ടികൾക്കൊരു വലിയ സമ്മാനവും ! #oommenchandi #YusuffAliMA #LuLuGroup #iypevallikadan #achuoommen #chandioommen #puthuappalli #yusuffali #kottayam  #puthupallypally #ummenchandi #iype #mariaoommen #Oommenchandysir"
"wAGk8MyJNJ4","Itlu Nee Prematho || Part - 2 || Soniya Singh || Pavan Sidhu || Infinitum Media","2023-07-30T11:30:18Z","UCruMs8kL2fHjxNIymX53VSw","Vayyari Bhama","24","23.02.08","itlu nee prematho|itlu nee prematho part 2|itlu nee prematho short film|soniya singh|pavan sidhu|soniya singh pavan sidhu short film|soniya singh ppavan sidhu|sonia singh short films telugu latest|pavan sidhu short films telugu|latest telugu short films 2023|telugu short films|telugu short films 2023|telugu new short film 2023 latest|telugu love short films latest|telugu short films love new|vayyari bhama channel|short films telugu 2023 latest|infinitum media","117978","4524","0","113","https://i.ytimg.com/vi/wAGk8MyJNJ4/default.jpg","False","False","Itlu Nee Prematho  is a Telugu Romcom Mini Seris featuring Soniya Singh & Pavan Sidhu as leads.Disclaimer: We do not intend to promote investment/gambling of any kind.  Viewer discretion is advised. If your current residence is from Andhra, Assam, Odisha, Telangana, Nagaland, and Sikkim, you are advised to not participate.This activity promotes a game and doesn’t intend to promote any kind of betting/gambling.For Brand Inquiries & Collaborations Email us at brands@infinitumnetwork.inCast: Soniya Singh, Pavan Sidhu, Anthony Soma, Raj Krish.Produced by Vandana BandaruWritten & Directed by Anthony SomaBrands Manager: Bhargav.TCinematography: Kala PavanEditing: Sai Baba, Venkatesh CHPoster Designer: Nikhil ChotuSound Engineer: Venkat, Bhaskar.Executive Producer: Chandu JC#ItluNeePrematho #SoniyaSingh #PavanSidhu #InfinitumMedia Presented by Infinitum Network Solutions.Khiladi is an online gaming app. We do not promote online  betting/gambling. Viewer discretion is advised. Please play at your own risk."
