video_id,title,publishedAt,channelId,channelTitle,categoryId,trending_date,tags,view_count,likes,dislikes,comment_count,thumbnail_link,comments_disabled,ratings_disabled,description
"gNHRhATATHs","[하이라이트]  드라마보다 더 드라마 같은 ((4번 타자 이대호))의 ((4연타석 홈런)) 경이롭다..✨ (vs 부산고 2차전) | 최강야구 | JTBC 230807 방송","2023-08-07T15:39:03Z","UCFL1sCAksD6_7JIZwwHcwjQ","JTBC Entertainment","24","23.09.08","최강야구|최강몬스터즈|박용택|유희관|정성훈|정근우|송승준|이택근|장원삼|정의윤|서동욱|이홍구|김문호|이대은|김선우|정용검|오주원|최수현|김성근|이대호|신재영|원성준|선성권|정현수|박재욱|이광길|황영묵|부산고2차전|몬스터즈부산고|부산고야구부|유태웅|고영우|최강야구하이라이트|하이라이트|야구하이라이트|최강몬스터즈하이라이트|Oh J","1823998","15743","0","3466","https://i.ytimg.com/vi/gNHRhATATHs/default.jpg","False","False","[하이라이트]  드라마보다 더 드라마 같은 ((4번 타자 이대호))의 ((4연타석 홈런)) 경이롭다..✨ (vs 부산고 2차전)#최강야구 #최강몬스터즈 #이대호 #경기하이라이트📌 공홈에서 리플레이 : https://tv.jtbc.co.kr/ckmonsters📌 #티빙에서스트리밍 : https://tving.onelink.me/xHqC/1vihef6r"
"4QaX-osbsgI","[SUB] 공유, 이동욱, 그리고 조세호 | EP.1 조세호 | 살롱드립2","2023-08-08T09:00:09Z","UC-uIpGINZDL-VIHQQzJW8jw","TEO 테오","24","23.09.08","김태호|teo|지구마불|ena|곽튜브|빠니보틀|원지|세계여행|예능|tvN|댄스가수유랑단|댄스가수 유랑단|이효리|엄정화|김완선|보아|화사|마마무|Kpop|KimWansun|UhmJunghwa|LeeHyori|BoA|HwaSa|게스트|아이돌|음악|music|stage|idol|k-pop|티비엔|살롱드립|테오유튜브|유튜브|노래|무대|star|super star|k-dol|케이팝|kpop|k-music|차정숙|닥터 차정숙|장도연|토크쇼|토크 예능|salon drip|조세호|핑계고|러브라인|억울|손석구|공유|이동욱|조남지대|남창희|유재석|양세찬|이진호|이용진|박나래|코미디빅리그|침착맨|장항준","439528","7479","0","617","https://i.ytimg.com/vi/4QaX-osbsgI/default.jpg","False","False","미니멀리즘을 추구하지만 토크만큼은 무~겁게 돌아온 [살롱 드립 2]!첫 번째 게스트는~?코미디 학사 졸업, 프로 불참러, 구 양배추, 토크 불도저 등 수많은 수식어가 있으나오늘은 CEO로 온 조세호!최장기 오프닝 인사로 토크 시동 드릉드릉하고기억ㄴrㄴ1..?☆ 도연과의 추억여행부터 CEO가 된 근황까지~!토크로 크게 혼내준 살롱드립시즌투 조세호 편 대반상고♥️[살롱 드립 2] 매주 화요일 오후 6시 테오 유튜브에서 공개#살롱드립2 #season2 #SalonDrip #장도연 #TEO #테오*본 영상과 무관한 내용의 댓글과 출연자에 대한 무분별한 욕설, 비난 및 조롱 등 악의적인 댓글은 무통보 삭제될 수 있습니다."
"DyTsVjaDCqs","덱스와 두근두근 인도 산골도시 산책 【쇼트트립】","2023-08-07T03:00:07Z","UCNhofiqfw5nl-NeDJkXtPvw","빠니보틀 Pani Bottle","19","23.09.08","덱스|Dex|테계일주2|태어난 김에 세계일주2|태어난 김에 세계일주|테세기","1643425","32747","0","2473","https://i.ytimg.com/vi/DyTsVjaDCqs/default.jpg","False","False","코피야 가라--------------------------------------카메라Gopro11Galaxy S21 Ultra--------------------------------------배경음악Jahzzar - Mr Bleachhttps://www.youtube.com/watch?v=qKkxwfUvh2s"
"eCBn6LdfFgg","[7-8화 하이라이트] 엄마랑 여행 가는데 엄마가 썸남 데려옴;| 남남","2023-08-08T14:20:00Z","UCXmRJfZ3atLVLDiO5Ufycvw","스튜디오지니","24","23.09.08","[none]","325249","2320","0","183","https://i.ytimg.com/vi/eCBn6LdfFgg/default.jpg","False","False","은미와 오붓하게 여행을 가기로 한 진희하지만 은미는 진홍을 데리고 나타나는데..과연 그곳에서 어떤 일이 벌어질까?!📺 지니 TV 오리지널 [남남]은ENA 채널 매주 월,화 밤 10시 본방송!스트리밍은 Genie TVGenie TV 모바일에서도 이어 보세요~!#GenieTV #지니TV #ENA #지니TV모바일#남남 #전혜진 #최수영 #안재욱 #박성훈"
"jMuOcUqCq5U","아리가또 보이즈 2화","2023-08-08T12:04:47Z","UCnFFOjljp1_sacTz7PfIIyg","LeoJ Makeup","24","23.09.08","레오제이 일본|아리가또 보이즈2화|아가리또 보이즈|레오제이 큐영|레오제이 찐친 브이로그|레오제이 브이로그|레오제이 여행|레오제이 친구 브이로그|레오제이|레오제이 온천|레오제이 료칸호텔","409927","7806","0","523","https://i.ytimg.com/vi/jMuOcUqCq5U/default.jpg","False","False","#레오제이 #일본여행 🇯🇵 #아리가또보이즈2화- 오래 기다리셨습니다.-*여행정보는 곧 업로드됩니다*"
"_GgIt2EFHV8","JEON SOMI (전소미) - ‘Fast Forward’ M/V","2023-08-07T09:00:12Z","UCg8ZzloDPTrOiGztK0C9txQ","THEBLACKLABEL","10","23.09.08","KPOP|K-POP|SOMI|Jeon Somi|전소미|소미|blackpink|yg entertainment|music video|YG|pop|r&b|music|what you waiting for|single|birthday|theblacklabel|sm entertainment|jyp entertainment|bts|big hit entertainment|dance|hip hop|dumb dumb|DUMB DUMB|DUMBDUMB|dumbdumb|덤덤|전소미 덤덤|덤덤 전소미|JEON|IOI|아이오아이|프로듀서101SOMI|XOXO|엑소엑소|엑스오엑스오|XOXOCHALLENGE|THEBLACKLABEL|JEONSOMI_XOXO|IAMSOMI|아이엠소미|TEASER|Anymore|전소미 Anymore|애니모어|GAMEPLAN|게임플랜|FastForward|FF|패스트포워트|M/V|MusicVideo|MV|뮤직비디오|YGX|어때|스맨파","22482963","0","0","16211","https://i.ytimg.com/vi/_GgIt2EFHV8/default.jpg","False","False","JEON SOMI (전소미) - ‘Fast Forward’ M/VI’m your future lover타락한 밤 너의 ruler영화 속 달콤한 promise믿지 않아 let’s be honest, yeah 틀린 건 없어 when it feels so right닿지 않아도 이미 느끼잖아나쁠 건 없어 when it feels so right네 위를 봐 I’m your goddess How many lovers do I go through to find youHow many heartbreaks I take just to get to you How many lovers do I go through to find youHow many how many how many Fast ForwardGirl you the one stop Got it all Diamond-kissed Head to toe Sunshine Got the glow Need you bad Never go One stop Domino That’s how quick You made me fall So in love yeah That’s so us How many lovers do I go through to find youHow many heartbreaks I take just to get to you How many lovers do I go through to find youHow many how many how many Fast Forward(How many how many how many)(How many how many how many)흔들린 pendulum너를 부를 때이 뒤틀린 시간 속 넌 내 눈앞에Now think of the one you want Picturing my face And I’ll be the one you onI’ll be the one you onI’ll be the one you wantI can hear you sayFast Forward(yeah yeah yeah yeah)Fast Forward(yeah yeah yeah yeah)Fast ForwardChoreography DirectorJAEWOOK LEE, SADECK WAFF, BABY ZOOChoreographerSADECK WAFF, KIEL TUTIN, BABY ZOO, AYA SATOJEON SOMI EP ALBUM [GAME PLAN]https://JEONSOMI.bio.to/GAMEPLANMore about JEON SOMI @https://www.instagram.com/somsomi0309/https://www.facebook.com/somsomi.officialhttps://twitter.com/somi_official_https://www.tiktok.com/@somi_official_#JEONSOMI #전소미 #FastForward #GAMEPLAN #JEONSOMI_GAMEPLAN_20230807#THEBLACKLABEL #더블랙레이블"
"krYXIx5YcOY","에어컨 껐다 켜? 계속 켜?…이거 모르면 '요금 폭탄' / KBS 뉴스7 대전 세종 충남 [뉴스더하기] - 08월 07일 (월)","2023-08-07T11:02:03Z","UCGNza5Bq2fQFYquMgd9CeHg","KBS대전 뉴스","25","23.09.08","format:리포트|genre:경제|location:KBS|person:KBS 지역국|series:뉴스7(대전)|source:영상|type:방송|뉴스7(대전)","1091302","8261","0","1355","https://i.ytimg.com/vi/krYXIx5YcOY/default.jpg","False","False","'뉴스더하기' 김현수입니다. 연일 35도 안팎의 낮 기온에 폭염 경보도 이어지고 있습니다. 대구와 대전에서는 찜통더위에 도로 중앙분리대가 녹아 넘어지기도 했는데요. 집 밖은 위험하다면서 냉방이 되는 실내에 머물며 무더위를 피하는 분들도 많죠. 한 설문조사 결과에서는 폭염 속 가구당 에어컨 사용 시간이 하루 평균 8시간 가까이 됐고요. 11시간에서 20시간 이상 에어컨을 켠다는 응답도 5명 중 1명꼴이었습니다.하지만 걱정되는 건 전기요금이죠. 지난해부터 올해 상반기까지 전기요금이 5차례에 걸쳐 오르기도 했습니다. 올여름 기준, 하루 평균 7~8시간 정도 에어컨을 사용하면 전기요금은 얼마나 나올까요? 한국전력에 따르면 벽걸이 에어컨이 약 7만 5천 원, 스탠드형 에어컨은 10만 3천 원 정도입니다. 일반적인 4인 가구 기준 평소 대비 2배 전후로 요금이 나오는 건데요. 여름철 에어컨을 시원하게 사용하면서 전기요금은 줄이는 방법,  일단 제습 모드를 사용하면 전기요금을 줄일 수 있다는 이야기도 있는데요. 사실일까요?[현민선/한국에너지공단 홍보실 대리 : '냉동공조인증센터'라는 시험기관에 확인해 본 결과 '제습' 모드와 '냉방' 모드가 전력을 소모하는 데는 크게 차이가 없는 걸로 확인이 된다고 합니다. 가정의 상황에 따라서 선풍기를 같이 사용하는 것도 도움이 될 수도 있고…. 실제로 선풍기를 함께 사용하면 에어컨만 틀었을 때보다 실내 온도가 20% 정도 더 빠르게 낮아진다고 하는데요.또 '인버터형', '정속형' 이렇게 에어컨 기종에 따라서도 전기 절약 방법이 다릅니다. '인버터형' 에어컨이라면 희망 온도를 설정하고 계속 켜두는 게 좋고요. '인버터형'이 아닌 '정속형' 이라면 시원해졌을 때 잠시 전원을 껐다가, 더워졌을 때 다시 켜는 게 좋은데요. 다만 둘 다 희망 온도는 26도로 맞춰 놓는 게 좋습니다. 저도 사용하는 에어컨을 확인해 보니 '정속형'이었고요. 그래서 실내 온도가 26도가 되면 에어컨을 껐다가 더워지면 다시 켜 주고 있습니다. 우리 집 에어컨이 어떤 에어컨인지 확인은 어떻게 할까요? 먼저 '인터버형' 에어컨은 비교적 최근에 출시됐는데요. 그렇다고 최신형 에어컨이 무조건 '인버터형' 에어컨은 아닙니다. 에어컨 본체에 '인버터형'이라고 표시가 돼 있기도 하고요. 그렇지 않다면, 에어컨 소비 전력 정보를 확인하면 됩니다.만약 소비 전력이 최소, 정격, 최대 이렇게 구분이 돼 있다면 '인버터형'이고요. 구분 없이 하나로 표기돼 있으면 '정속형'입니다. 우리 집 에어컨은 어떤 에어컨인지 확인해 보시고 절약 사용법을 적용하는 게 좋겠습니다. 한편, 정부는 오늘과 내일 전력 수요가 최고점에 이를 것으로 전망하고 있는데요. 아직 전력 공급 능력은 충분하다고 발표했지만, 폭염 경보 위기가 '심각' 단계까지 올라오면서 방심할 수 없다는 입장입니다.[조성진/에너지경제연구원 전력정책연구팀장 : (전력) 공급 여력은 충분히 남아 있다. 이렇게 생각을 하고, 다만 예측하지 못한 폭염이 앞으로 올 수 있지 않습니까? 아니면 지금 발전기들이 많이 돌아가고 있는데 예기치 못한 고장이 발생할 수도 있습니다.] 올해 온열질환 사망자 5명 중 1명은 실내에서 발생했습니다. 적당한 실내 냉방은 필요한 건데요. 찜통더위 속 똑똑한 냉방으로 건강도 지키고 에너지도 절약할 수 있도록, 에어컨 절약 사용법 기억해 두시면 좋겠습니다.지금까지 '뉴스더하기'였습니다.#폭염경보 #에어컨 #전기요금 #한국전력 #냉방"
"wl7bEq9Bm_4","홍보맨이 찍다ㅣNewJeans(뉴진스) 'ETA'","2023-08-08T09:00:39Z","UCWiS4vemV0wcxuxYPx9Z62g","충주시","29","23.09.08","충주|충주시|공무원|홍보맨|뉴진스|NewJeans|ETA|애플|Apple|iPhone|아이폰|광고|아이폰 광고|갤럭시|김선태|애플 광고|돌고래유괴단","772082","19541","0","2771","https://i.ytimg.com/vi/wl7bEq9Bm_4/default.jpg","False","False","충주시민사진관 홍보 영상▶ 매주 화 오후 6시 공개#충주 #뉴진스 #홍보맨"
"DUo9LKTCy9U","[BE ORIGINAL] JEON SOMI(전소미) 'Fast Forward' (4K)","2023-08-08T14:00:15Z","UCEIi7zFR_wE23jFncVtd6-A","STUDIO CHOOM [스튜디오 춤]","24","23.09.08","M2|엠투|스튜디오 춤|스춤|Studio choom|COVERS|커버스|DANCE THE X|댄스 더 엑스|댄스|DANCE|비 오리지널|BE ORIGINAL|커버|COVER|Artist Of The Month|AOTM|Drop the dance|드롭더댄스|Mix & Max|믹스앤맥스|믹앤맥|전소미|소미|전소미 컴백|somi|jeon somi|fast forward|somi fast forward|전소미 fast forward|소미 fast forward|테크토닉","1026901","93327","0","1915","https://i.ytimg.com/vi/DUo9LKTCy9U/default.jpg","False","False","[BE ORIGINAL] JEON SOMI 'Fast Forward'[비 오리지널] 전소미 'Fast Forward'인간 바비 전소미가 말아주는 레전드 퍼포!(0:57) 테크토닉의 지배자, 군림자, 춤의 신⏩#JEONSOMI #전소미 #BEORIGINALStream various performance video on #STUDIOCHOOM!👉SUBSCRIBE👈YouTube: https://www.youtube.com/STUDIOCHOOMFacebook:  https://www.facebook.com/StudioCHOOMInstagram: https://www.instagram.com/studio_choom/Naver TV: https://tv.naver.com/cjenm.STUDIOCHOOM"
"ed_jNw3_IOo","〈붕괴: 스타레일〉 카프카 캐릭터 PV——「드라마틱 아이러니」","2023-08-08T04:00:35Z","UCH33CJMcI0XZUpIhWRHiUuw","붕괴: 스타레일","24","23.09.08","[none]","236198","8358","0","1643","https://i.ytimg.com/vi/ed_jNw3_IOo/default.jpg","False","False","「공포」는 그녀의 전문이다. 설령 그녀가 「공포」를 전혀 모른다고 할지라도.바로 다운로드https://hoyo.link/3GCFBDAL한국어 CV: 카프카——사문영팔로우하고 최신 소식을 확인하세요공식 홈페이지: https://hsr.hoyoverse.com/ko-krHoYoLAB: https://www.hoyolab.com/accountCenter/postList?id=172534910공식 트위터: https://twitter.com/honkaisr_kr공식 카페: https://cafe.naver.com/honkaistarrail공식 카카오톡: http://pf.kakao.com/_SKlsxjDiscord: https://discord.gg/honkaistarrailReddit: https://www.reddit.com/r/HonkaiStarRail/'붕괴: 스타레일' 유튜브를 구독하고 콘텐츠에 대한 알림을 받아보세요!#HonkaiStarRail #스타레일"
"vyWhUm0qJsY","김가은의 든든한 가족 등장😎 이지혜에게 매운맛 보여주기🔥 | 킹더랜드 15회 | JTBC 230805 방송","2023-08-05T14:52:24Z","UCkbJc8jMcTXwhtmN5VMwfXg","JTBC Drama","24","23.09.08","이준호|임윤아|킹더랜드|JTBC토일드라마|김가은|이지혜|안세하|JTBC킹더랜드|킹더랜드15회|JTBC드라마|토일드라마|JTBC주말드라마|주말드라마|이준호임윤아|이준호킹더랜드|임윤아킹더랜드|이준호드라마|임윤아드라마|준호윤아혐관|혐관맛집|혐관로맨스|배우김가은|강다을|킹더랜드강다을|김가은킹더랜드|김가은이준호|구원강다을|케미|구원천사랑친구|천사랑친구|육남매|2PM","913728","4482","0","199","https://i.ytimg.com/vi/vyWhUm0qJsY/default.jpg","False","False","강다을(김가은)의 든든한 가족 등장😎 도라희(이지혜)에게 매운맛 보여주기🔥#킹더랜드 #이준호 #임윤아📌 공홈에서 리플레이 : http://tv.jtbc.co.kr/kingtheland📌 #티빙에서스트리밍 : https://tving.onelink.me/xHqC/1vihef6r"
"68ShTNAwrLc","이찬원(Lee Chan Won) '트위스트고고' official MV","2023-08-07T02:01:00Z","UC4UnP3v-iaFaLdtKwp84Pmw","이찬원","10","23.09.08","[none]","349177","21665","0","4373","https://i.ytimg.com/vi/68ShTNAwrLc/default.jpg","False","False","이찬원(Lee Chan Won) '트위스트고고' official MV#이찬원 #LeeChanWon#ONE #트위스트고고 #MV"
"tZYsvAoSNxQ","RIIZE 라이즈 'Siren' Performance Video","2023-08-06T15:00:43Z","UCEf_Bc-KVd7onSeifS3py9g","SMTOWN","10","23.09.08","RIIZE|라이즈|Siren|performance|performance video|choreography|퍼포|퍼포 비디오|신인|SM|보이그룹|SUNGCHAN|SHOTARO|WONBIN|SOHEE|EUNSEOK|SEUNGHAN|ANTON|성찬|쇼타로|원빈|소희|은석|승한|앤톤|싸이렌|RISEandREALIZE|new boy group|boy group|debut|데뷔","1668888","177990","0","10980","https://i.ytimg.com/vi/tZYsvAoSNxQ/default.jpg","False","False","RIIZE's 1st single Get A Guitar will be released on September 4th, 6PM (KST).💿Pre-save & Pre-order https://RIIZE.lnk.to/GetAGuitarSubscribe to RIIZE Official YouTube Channel!https://www.youtube.com/@RIIZE_official?sub_confirmation=1RIIZE official https://youtube.com/@RIIZE_officialhttps://www.riizeofficial.com   https://www.instagram.com/riize_officialhttps://twitter.com/riize_officialhttps://www.facebook.com/RIIZE.officialhttps://www.tiktok.com/@riize_officialhttps://weibo.com/riize#RIIZE #라이즈 #RISEandREALIZE  #GetAGuitar #RIIZE_GetAGuitar #Siren"
"RE37C81aO0Y","집은 돌아와서 쉬고 싶은 곳이어야 해요. 62세 주부의 정리정돈 습관 | 전국살림자랑","2023-08-09T02:00:19Z","UCo-_fR_rfERWOGdVQDbr_Og","정리마켓","26","23.09.08","정리마켓|정리|살림|정리정돈|살림왕|전국살림자랑|주택리모델링|주택인테리어|그릇정리|수납|수납아이디어|정리아이템|수납아이템|정리아이디어|인테리어|정리고수|정리하는이유|곤도마리에|수다스러운방|일본정리전문가|디자이너집|정리습관|살림습관|주부|주부살림|살림유튜버|주부유튜버|주방정리|주방꿀템|주방수납","130398","2868","0","442","https://i.ytimg.com/vi/RE37C81aO0Y/default.jpg","False","False","*[무료 나눔 이벤트 참여 방법 안내]*곤도 마리에 신간 소설 「수다스러운 방」 50분 선정 무료 나눔을 진행합니다.📮  [작성 양식] *중요*      도서 무료 나눔 신청합니다      설레는 물건:      설레지 않는 물건:     위의 양식에 맞춰 댓글을 작성해주세요!     (그렇지 않은 경우, 검색이 되지 않아 선정에 불이익이 있을 수 있습니다.)     📮 우리 집에 있는 ‘설레는 물건‘과 ‘설레지 않는 물건’에 대해 이야기를 적어주세요.    본 영상 댓글에 작성(커뮤니티 댓글 X)📮 당첨자 발표는 커뮤니티를 통해 8.17(목)에 발표하도록 하겠습니다.-------------------------------------------안녕하세요,정리마켓🏠 코디네이터 정코입니다!@soonidiary 전국살림자랑의 14번째 주인공과 함께하는 살림 탐방!몇 년 전, 디자이너 일을 그만 두고 주부로 살아가는 권은순 님입니다.기발한 정리 아이디어와 꿀팁들이 많이 숨어있으니 끝까지 시청부탁드립니다💕#전국살림자랑 #살림 #주부※필독※🚨전국살림자랑 출연 신청 안내사항🚨0. 자신 있는 살림 분야(정리, 요리, 청소, 세탁, 인테리어 등)1. 우리 집 사진 혹은 영상 첨부 필수2. 소정의 출연료 제공3. 나이, 성별 무관4. 살림에 대한 전반적인 이야기, 완벽하지 않아도 괜찮습니다.📮 사연신청방법1. 살고 계신 지역2. 주거 형태(아파트, 주택, 빌라, 원룸 등)3. 가구 인원 수4. 본인만의 특별한 스토리를 적어주세요.(사진 혹은 영상과 함께)5. 스토리를 재밌게 적어주시면 선정에 도움이 됩니다!⏰타임라인 /Time Stamp[00:00] 하이라이트[00:46] 오늘의 주인공[01:09] 주방[10:57] 무료 나눔 이벤트![11:21] 세탁실[13:49] 욕실[14:58] 옷방[16:31] 거실[18:04] 인터뷰[20:50] 출연 신청 안내"
"Yx0BDQ0ynx8","이찬원(Lee Chan Won) '트위스트고고' 응원법","2023-08-08T09:00:31Z","UC4UnP3v-iaFaLdtKwp84Pmw","이찬원","10","23.09.08","[none]","115783","14002","0","1395","https://i.ytimg.com/vi/Yx0BDQ0ynx8/default.jpg","False","False","이찬원(Lee Chan Won) '트위스트고고' 응원법#이찬원 #LeeChanWon#트위스트고고 #응원법"
"pBJoDDpsiOI","[🤰🏻vlog] 입덧때문에 힘든 것 치고는 매우 잘먹고 있는 임부의 하루하루","2023-08-07T11:00:44Z","UC6KwCU8Y8Uw4h_Q0ptLZkqw","해쭈 [HAEJOO]","22","23.09.08","해쭈|가좍|쁘큐보이|카야|새삼이|브이로그|호주|foodtrip|foodie|australia|mukbang|먹방브이로그|먹방|해쭈먹방|cooking|요리|고매요리","750535","26439","0","1608","https://i.ytimg.com/vi/pBJoDDpsiOI/default.jpg","False","False","-비지니스 문의는 이쪽으로 👉🏽 haejoo@sandboxnetwork.net감성가득 인스타그램 👉🏽  https://instagram.com/hae_jooooo_미지의 그곳 해쭈 팬카페 👉🏽  https://m.cafe.naver.com/australiahaeju"
"MLr0LyVXjpM","대만 타이동 여행 VLOG","2023-08-07T09:00:12Z","UC1Rz7a_DWtsE9cQwSyElE0Q","인생84","22","23.09.08","기안84|기안팔사|기안|김희민|희민|웹툰작가|복학왕|패션왕|나혼자산다|침착맨|말년을건강하게|이말년|주호민|엠드로메다|대만|타이베이|타이페이|타이동|여행|태어난김에세계일주|태세계|태세계2|열기구|취두부|먹방|브이로그|여행브이로그","656162","14164","0","1180","https://i.ytimg.com/vi/MLr0LyVXjpM/default.jpg","False","False","#기안84IG - @khmnim1513Biz E-Mail - backho2301@gmail.com"
"X3tNk4piCo4","[#아씨두리안 14-2] 전부 운명이야.. 돌쇠(김민준)와 깊어지는 사랑에 결국 모든 것을 밝힌 두리안(박주미)! #하이라이트 #TV조선조이 (TV CHOSUN 230806 방송)","2023-08-08T11:00:25Z","UCYeeEwH_s9yD9HQe4e2JuBw","TVCHOSUN JOY","24","23.09.08","빨간 풍선|빨간풍선|TV조선 드라마|토일드라마|서지혜|홍수현|이성재|이상우|정유민|정보석|이보희|최대철|설정환|윤주상|윤미라|김혜선|이상숙|오은서|조연호|고나희|금수저|흙수저|수저론|계급론|불륜|친구 남편|친구 아내|빨간 풍선 다시보기|마녀는 살아있다|마녀는살아있다|마녀|드라마|K-Drama|Drama|이유리|이민영|윤소이|드라마 다시보기|마녀는 살아있다 다시보기|드라마 몰아보기|드라마 정주행|정상훈|이영란|김예겸|김영재|성병숙|이혼|40대|불혹|황혼 이혼|보험금|생명보험|로또|연민정|불륜녀|악녀|장보리|왔다 장보리|취미 생활|바람|유책|이혼 유책|이혼 조정|이혼 변호|TV Chosun|티조|티조 드라마|상간녀|애로부부|연애의참견|실제 상황|경찰서|유책 배우자|유책 사유|상간|내연녀|내연남|블랙코미디|축출 이혼|빨간맛|결사곡|타임루프|시간여행|로맨스|막장|며느리|시어머니|사랑|막장드라마|ㅈ","194363","1568","0","83","https://i.ytimg.com/vi/X3tNk4piCo4/default.jpg","False","False","#아씨두리안 #박주미 #최명길 #김민준 #한다감 #전노민 #윤혜영 #지영산 #윤정후 #이다연 🎪 구독과 좋아요 🎪TV CHOSUN JOY 구독하기 ☞ https://bit.ly/3hpEUr1​TV CHOSUN : https://www.youtube.com/user/TVchosun"
"w1YuAJFlVRs","THE BOYZ(더보이즈) ‘LIP GLOSS’ MV","2023-08-07T09:00:02Z","UCkJ1rbOrsyPfBuHNfnLPm-Q","THE BOYZ","10","23.09.08","크래커엔터테인먼트|Cre.ker Entertainment|크래커|Creker|THE BOYZ|더보이즈|BOY GROUP|IDOL|IDOL GROUP|아이돌그룹|BOY|일상캠|리얼리티|상연|제이콥|영훈|현재|주연|케빈|주학년|선우|에릭|SANGYEON|JACOB|YOUNGHOON|HYUNJAE|JUYEON|KEVIN|JUHAKNYEON|NEW|SUNWOO|ERIC|EXO|BTS|TWICE|TXT|BLACKPINK|K-POP|D.D.D|WHITE|REVEAL|THE STEALER|THRILL RIDE|스릴라이드|IST|IST ENTERTAINMENT|아이에스티|아이에스티엔터테인먼트|위스퍼|WHISPER|ROAR|로어|LIPGLOSS|립글로즈|PHANTASY|판타지","9944661","120756","0","9948","https://i.ytimg.com/vi/w1YuAJFlVRs/default.jpg","False","False","THE BOYZ ‘LIP GLOSS’ on iTunes : https://apple.co/44YAxMF✔ More information about THE BOYZhttp://www.theboyz.krhttps://www.youtube.com/c/THEBOYZofficialhttps://weverse.onelink.me/qt3S/f766oroahttps://twitter.com/IST_THEBOYZ?s=20https://www.instagram.com/official_theboyzhttps://www.facebook.com/officialTHEBOYZhttp://cafe.daum.net/officialTHEBOYZCopyrights 2023 ⓒ IST Entertainment. All Rights Reserved.#THEBOYZ #더보이즈 #LIPGLOSS"
"8DsfvDivEqE","한국에 처음 온 17세 뉴욕소녀의 애창곡 임영웅 ♪사랑은 늘 도망가♪ l 태군노래자랑","2023-08-07T06:50:33Z","UCNE1pYj5_Hmnaz1xnnJi_dQ","LG헬로비전 헬로tv","24","23.09.08","태군노래자랑|박군|나태주|노래자랑대회|노래방기계|일반인노래자랑|라이브|노래대회|박군사단|태주날개|잘부탁드립니다|수은등|낭만에대하여|사랑은늘도망가|배띄워라|영원한친구|나의것|송가인|임영웅","177296","2645","0","121","https://i.ytimg.com/vi/8DsfvDivEqE/default.jpg","False","False","어디든 찾아가는 야외노래방😎태.군.노.래.자.랑😎🎙매주 수요일 저녁 5시 본방사수 꼭꼭🎙Hello tv VOD, 티빙, 웨이브, 왓챠에서 보실 수 있습니다💛좋아요 댓글 구독 알림설정💚구독👉https://www.youtube.com/@Hellotv_Official#태군노래자랑 #박군 #나태주 #정선 #강원춘천 #노래자랑대회 #노래방기계 #일반인노래자랑 #라이브 #노래대회 #박군사단 #태주날개 #잘부탁드립니다 #수은등 #낭만에대하여 #사랑은늘도망가 #배띄워라 #영원한친구 #나의것 #송가인 #임영웅"
