video_id,title,publishedAt,channelId,channelTitle,categoryId,trending_date,tags,view_count,likes,dislikes,comment_count,thumbnail_link,comments_disabled,ratings_disabled,description
"AQEc4BwX6dk","Jawan: Zinda Banda Song |Shah Rukh Khan |Atlee |Anirudh |Nayanthara |Vijay Sethupathi |Deepika","2023-07-31T07:19:08Z","UCq-Fj5jknLsUf-MWSy4_brA","T-Series","10","23.02.08","hindi songs 2023|hindi songs new|bollywood songs 2023|bollywood movies 2023|tseries|tseries songs|bollywood dance songs|zinda banda|shahrukh khan|deepika padukone|vijay sethupathi|nayanthara|irshad kamil|anirudh ravichander|jawan|zinda banda song|jawan song|new dance song 2023|deepika padukone songs|shahrukh khan new song|shahrukh khan new movie|latest songs 2023|srk news|jawan movie song|bollywood new movie 2023|hindi songs dance|dance songs hindi","41430975","818447","0","69007","https://i.ytimg.com/vi/AQEc4BwX6dk/default.jpg","False","False","Come, join the celebration & dance to the beats of Zinda Banda, the first song from the highly-awaited film Jawan directed by Atlee. The film stars Shah Rukh Khan, Vijay Sethupathi, Nayanthara, and Deepika Padukone (in a special appearance) and is set to release in cinemas on 7th September 2023 in Hindi, Tamil, and Telugu!♪Full Song Available on♪ JioSaavn: https://bit.ly/47edDlSSpotify: https://bit.ly/3q81hv7Hungama: https://bit.ly/3OAsIH7Apple Music: https://bit.ly/3rVyme1Amazon Prime Music: https://bit.ly/452dO2xWynk: https://bit.ly/3QjMDLJResso: https://bit.ly/3Oyy85FYouTube Music: https://bit.ly/43LSe0IMovie Credits:Starring Shah Rukh Khan, Nayanthara, Vijay Sethupathi and Deepika Padukone (in a special appearance)Directed by - AtleeProduced by - Gauri KhanCo-Produced by - Gaurav VermaDOP - GK VishnuEditor - RubenProduction Designer - T MuthurajMusic Credits:Language : HindiSong Title : Zinda BandaAlbum / Movie : JawanComposed by Anirudh Ravichander Couplet by Wasim Barelvi – उसूलों पर जहाँ आँच आए टकराना ज़रूरी है जो ज़िंदा हो तो फिर ज़िंदा नज़र आना ज़रूरी हैLyrics - Irshad KamilVocals - Anirudh Ravichander Dialogues - Shah Rukh Khan♫Song Credits♫Composed, Arranged & Programmed by Anirudh RavichanderElectric Guitar - Keba JeremiahShehnai - BaleshOpening Female Vocals - Mangli, Supervised by Sri KrishnaBacking Vocals by Anirudh RavichanderKeyboard, Synth & Rhythm Programmed by Anirudh RavichanderCore Rhythm Produced by KalyanAdditional Rhythm Programmed by Shashank VijayAdditional Keyboard Programmed by IC, Arish-Pradeep PJMusic Advisor - AnanthakrrishnanCreative Consultant - Sajith SatyaMusic Supervisor - Harish Ram L HChoreography (Zinda Banda) - Shobi PaulrajRecorded at Albuquerque Records, ChennaiEngineered by Srinivasan M, Shivakiran SMixed by Vinay Sridhar & Srinivasan M at Albuquerque Records, ChennaiMastered by Luca Pretolesi at Studio DMI, Las Vegas Assisted by Alistair Pintus Music Co-ordinator - Velavan BMusic Label : T-Series________________________________Enjoy & stay connected with us!👉 Subscribe to T-Series: http://bit.ly/TSeriesYouTube👉 Like us on Facebook: https://www.facebook.com/tseriesmusic👉 Follow us on Twitter: https://twitter.com/tseries👉 Follow us on Instagram: http://bit.ly/InstagramTseries"
"dlC1tNsr-n8","DREAM GIRL 2 -OFFICIAL TRAILER | Ayushmann K | Ananya P | Ektaa K | Raaj S | In Cinemas |25th August","2023-08-01T13:31:36Z","UCSHLoG-bXj1aVA2T5y8t84A","BalajiMotionPictures","24","23.02.08","[none]","17695789","210542","0","7797","https://i.ytimg.com/vi/dlC1tNsr-n8/default.jpg","False","False","Dream Girl ki duniya mein get ready for a rib-tickling kahaani of your sapnon ki rani! 🤩😆#DreamGirl2Trailer Out Now! #25AugustHogaMast#DreamGirl2 in Cinemas on 25th August.Tab tak ke liye follow kariyega apni Pooja ko on Instagram and Twitter - Instagram - https://instagram.com/pooja___dreamgirlTwitter - https://twitter.com/Pooja_DreamGirl Karam, a small-town boy from Mathura, is struggling every day to pay his father's debt, who has borrowed money from nearly everyone on the planet. On the other hand, he is deeply in love with Pari, whose father has kept the conditions to marry her. To make ends meet, Karam dons as Pooja, which creates wild chaos and a comedy of errors. Dream Girl 2 is a rib-tickling and hilariously entertaining story with a compelling ensemble including Annu Kapoor, Paresh Rawal, Vijay Raaz, Rajpal Yadav, Asrani Saab, Manoj Joshi, Abhishek Banerjee, Seema Pahwa, Manjot Singh, Ranjan Raj among many others. Produced by Shobha Kapoor, Ektaa R Kapoor’s Balaji Telefilms, Dream Girl 2 releases on August 25, 2023.Starcast: Ayushmann Khurrana as Karam, Ananya Panday as Pari, Annu Kapoor as Jagjeet Singh, Paresh Rawal as Abu Saleem, Vijay Raaz as Sona Bhai, Rajpal Yadav as Shoukiya, Asrani Saab as Yusuf Ali Salim Khan, Manoj Joshi as Jaipal Srivastav, Abhishek Banerjee as Shahrukh, Seema Pahwa as Jumani, Manjot Singh as Smiley Dhillon, Ranjan Raj as Tiger PandeyProduced by: Shobha Kapoor, Ektaa R Kapoor Written & Directed by: Raaj Shaandilyaa"
"3FN16DnRVFY","Mujhe Pyaar Hua Tha Last Episode | Digitally Presented by Surf Excel & Glow & Lovely (Eng Sub)","2023-07-31T19:29:54Z","UC4JCksJF76g_MdzPVBJoC3Q","ARY Digital HD","24","23.02.08","ary|ary digital|पाकिस्तानी ड्रामा|top pakistani drama|pakistani drama Mujhe Pyaar Hua Tha Last Episode 32|Mujhe Pyaar Hua Tha last episode episode 32 pakistani drama|ary digital drama Mujhey Pyar Hua Tha Last ep 32|Mujhe Pyaar Hua Tha episode 32 ary digital|Mujhe Pyaar Hua Tha new EP 32|Mujhe Pyaar Hua tha Episode 32 31st July 2023|Pakistani Drama Mujhe Pyaar Hua tha|New Drama Mujhe Pyaar hua tha|mujhe pyar hua tha|hania drama|wahaj ali|new drama wahaj ali","7277160","202622","0","10436","https://i.ytimg.com/vi/3FN16DnRVFY/default.jpg","False","False","Mujhe Pyaar Hua Tha Last Episode 32 | Digitally Presented by Surf Excel & Glow & Lovely | ARY DigitalSubscribe NOW: https://www.youtube.com/arydigitalasia 🔔To watch all the episodes of Mujhe Pyaar Hua Tha: https://bit.ly/3juZpcbDownload ARY ZAP: https://l.ead.me/bb9zI1Mujhe Pyaar Hua Tha; What You Want & What Your Destiny WantsMujhe Pyaar Hua Tha is a love triangle between Maheer, Saad, and Areeb. Saad has always been in love with his cousin Maheer but when he fails to confess it to her, life takes a different turnWritten By: Sidra Sehar ImranDirected By: Badar MehmoodCast:Hania Aamir as MaheerZaviyar Naumaan as AreebWahaj Ali as SaadShahood Alvi Salma HassanAngeline MalikNoor-ul-HassanShaheen KhanMalaikahAmbar KhanSabeena SyedAyesha MirzaWashma Fatima.#mujhepyaarhuatha #haniaaamir #wahajali #zaviyarnaumaan #shahoodalvi  #arydigital The most watched and loved Pakistani Entertainment channel is now on SoundCloud! Follow us here and listen to your favorite OSTs now! ♫ https://m.soundcloud.com/arydigitalhdPakistani Drama Industry's biggest Platform, ARY Digital, is the Hub of exceptional and uninterrupted entertainment. You can watch quality dramas with relatable stories, Original Sound Tracks, Telefilms, and a lot more impressive content in HD. Subscribe to the YouTube channel of ARY Digital to be entertained by the content you always wanted to watch."
"dug56u8NN7g","Marvel Studios’ Loki Season 2 | Official Trailer | Disney+","2023-07-31T13:00:24Z","UCvC4D8onUfXzvjTOM-dBfEA","Marvel Entertainment","24","23.02.08","marvel|comics","10087278","452251","0","17855","https://i.ytimg.com/vi/dug56u8NN7g/default.jpg","False","False","It’s almost time. ⏰ Watch the brand-new trailer for Marvel Studios’ Loki Season 2, an Original series, streaming October 6 on Disney+.► Watch Marvel on Disney+: https://bit.ly/2XyBSIW► Subscribe to Marvel on YouTube: http://bit.ly/WeO3YJFollow Marvel on Twitter: ‪https://twitter.com/marvelLike Marvel on Facebook: ‪https://www.facebook.com/marvelWatch Marvel on Twitch: https://www.twitch.tv/marvelReward your Marvel fandom by joining Marvel Insider!Earn points, then redeem for awesome rewards.Terms and conditions apply. Learn more at https://www.marvel.com/insider?Osocial=YT&CID=MarvelInsiderFor even more news, stay tuned to:Tumblr: ‪http://marvelentertainment.tumblr.com/Instagram: https://www.instagram.com/marvelPinterest: ‪http://pinterest.com/marvelofficialReddit: http://reddit.com/u/marvel-official"
"fPH0MFjCrEQ","Finally Met Abhishek in Bigg Boss","2023-08-01T10:00:30Z","UCHDQOZjxuSm0-LgLQtMeCqw","Dimple Malhan Vlogs","22","23.02.08","Dimple malhan vlogs|Family vlogs|Triggered insaan|Wanderer’s live|Wanderer’s hub|Nischay Malhan shorts|Fukra insaan|Fukra insaan live","2500001","184178","0","4625","https://i.ytimg.com/vi/fPH0MFjCrEQ/default.jpg","False","False",""
"doRfROqGnBY","Pakistan से लौटकर Jetha पहुँचा Gokuldham Society| Taarak Mehta Ka Ooltah Chashmah|Jetha Chale Pardes","2023-07-31T05:30:07Z","UCBIT1FSJW6yTlzqK-31FDWg","LIV Comedy","23","23.02.08","Ooltah Chashmah|liv comedy channel|funny serial|taarak mehta ka ooltah chashmah|comedy funny show|taarak mehta ka ulta chashma|tarak mehta ka ooltah chashma|taarak full episode|liv comedy tmkoc|full comedy|comedy videos|best of comedy videos|best comedy videos|tarak mehta ka ulta chashma|best tarak mehta episode|haste raho tmkoc|તારક મહેતા કા ઉલ્ટા ચશ્મા|જેઠાલાલ|tmkoc full episode|popatlal|jethalal|taarak mehta episode|taarak mehta new episode|TMKOC","1986876","24839","0","1117","https://i.ytimg.com/vi/doRfROqGnBY/default.jpg","False","False","Click here  to Subscribe to the LIV Comedy channel: https://www.youtube.com/channel/UCpEhnqL0y41EpW2TvWAHD7Q?sub_confirmation=1Jethalal finally returns to Gokuldham society after having a horrible experience in Pakistan. Everyone comes to receive Jethalal at the airport. Later, 'Mahila Mandal' surprises everyone by keeping the dinner ready. Every member of Gokuldham enjoyed the food to its fullest as Jethalal returned to India safely without being harmed. Stay tuned to get your daily dose of laughter. Show Name : Taarak Mehta Ka Ooltah ChashmahStar Cast: Kush Shah, Dilip Joshi, Disha Vakani, Amit BhattEpisode No: 810Produced By: Asit Kumar Modi, Neela Asit Modi#comedy2023 #comedy #jethalal #taarakmehtakaooltahchashmah #livcomedy #तारकमेहताकाउल्टाचश्मा Click here  to Subscribe to the LIV Comedy channel: https://www.youtube.com/channel/UCpEhnqL0y41EpW2TvWAHD7Q?sub_confirmation=1About The Show:----------------------------Taarak Mehta Ka Ooltah Chashmah is a comedy show inspired by the famous humorous column 'Duniya Ne Undha Chashmah' written by the eminent Gujarati writer Mr. Tarak Mehta. This show revolves around the Gada Family which consists of uneducated businessmen Jethalal Champaklal Gada, Jethalal’s Wife Daya & their naughty Son Tipendra Gada living in 'Gokuldham Co-operative Society' and covers topical issues which are socially relevant. In case of a problem and emergency, Jethalal Gada often rushes to Taarak Mehta to seek his help and guidance as he finds a philosopher in him. The housing society residents help each other find solutions when facing common, real-life challenges and getting involved in sticky situations.Watch the specially curated series of  Jetha Chale Pardes:https://studio.youtube.com/playlist/PLSXTaG1fT0cT4U6LYEpQxHKoKk9GAjQpZ/editPakistan से लौटकर Jetha पहुँचा Gokuldham Society| Taarak Mehta Ka Ooltah Chashmah|Jetha Chale Pardes"
"S9BcGKcCqAM","#Video - भांग के स्वाद | #Khesari Lal Yadav | शिल्पी राज | Bhang Ke Swad | Bolbam Bhojpuri Song 2023","2023-07-31T00:30:14Z","UC22nIfOTM7KLIQuFGMKzQbg","Wave Music","10","23.02.08","Bhang ke swad|Bhang ke swad khesari lal song|bhang ke swad|bhang ke swaad|khesari lal yadav new song|khesari lal bolbam song|khesari lal new song|bhang wala gana khesari lal yadav|khesari lal yadav|khesari lal shilpi raj song|bhang ke swad shilpi raj|bhang ke swad song|bhang ke swad bolbam song|bhang ke swad wave music|bhang ke swad new song|khesari lal ke gana|khesari lal bhang wala gana|khesari lal bhang ke swad|भांग के स्वाद|khesari lal new bolbam song","2593285","162136","0","28134","https://i.ytimg.com/vi/S9BcGKcCqAM/default.jpg","False","False","Subscribe करें  :- http://goo.gl/ip2lbkआप सब इस गाने का Reels बनाए - Make Your Reels :- https://www.instagram.com/reels/audio/1419164955482309/Album - भांग के स्वादSong - Bhang Ke SwadSinger - Khesari Lal Yadav, Shilpi RajActress - Toshi DwivediLyrics - Abhinav Pratap Singh Music Director - Priyanshu SinghComposer - Rahul RoyVideo Director -  Aashish SatyarthiDop - Santosh YadavChoreographer - SunnyEditor - Parvin YadavDi - Rohit SinghCompany/ Label - Wave Music Digital Marketing - Lokdhun Whatsapp - 9718776677VG - 32789♪ Instagram Reels : https://www.instagram.com/reels/audio/1419164955482309/♪ Spotify : ♪ Wynk : https://wynk.in/u/yyuzRemwy♪ Gaana : ♪ Jio Saavn :♪ Resso : ♪ YouTube Music♪ Apple Music : https://music.youtube.com/watch?v=Vrq3bVK_J60&feature=share♪ Hungama : ♪ Amazon Prime Music :Connected with us !👉 Follow us on Instagram :- https://www.instagram.com/wavemusic/👉 Like us on Facebook :- https://www.facebook.com/WaveMusicIndiaofficialLyrics - आरे भांग लेल भांग लेलबाटे सावन में मांग लेलना देह ना कांवर हिली आरे बहुते पावर मिलीएकर टेस्ट के ना तनी अंदाजा बा हो, अंदाजा बा हो 2Male(लागता मिलावल एमे गांजा बा हो)ताहरा भांग के स्वाद में त माजा बा हो, बड़ी ताजा बा हो(ताहरा भांग के स्वाद में त माजा बा हो, बड़ी ताजा बा हो)अंतरा 1Femaleबोलबम के हाला बा खाली  शिवाला बा,लागल कांवरिया के जाम बा, लेले दु पुड़िया सस्ते ही दाम बाMaleतहरा भांगिया के बहुत डिमांड बाटे(हो ब्रांड बाटे, हो ब्रांड बाटे)Femaleजे भी खईलस ऊ मस्ती में राजा बा हो, आरे राजा बा होMale (लागता मिलावल एमे गांजा बा हो)ताहरा भांग के स्वाद में त माजा बा हो, बड़ी ताजा बा हो(ताहरा भांग के स्वाद में त माजा बा हो, बड़ी ताजा बा हो)अंतरा 2Femaleसभे करत सेवन बा, पहिला पसन बाई दवाई ह करी ना हरजी, सुन अभिनव हो आई एनर्जीलड़का//सभे मस्ती में जात बाबाधाम बाटे(महादेव जी से पावत इनाम बाटे)Femaleखेसारी राहुल लहरावत गेरुआ धाजा बा हो, आरे धाजा बा होMale(लागता मिलावल एमे गांजा बा हो)ताहरा भांग के स्वाद में त माजा बा हो, बड़ी ताजा बा हो(ताहरा भांग के स्वाद में त माजा बा हो, बड़ी ताजा बा हो)#bhangkeswad #khesarilalyadav #shilpiraj"
"RBPVaBAQE-w","Systumm | The UK07 Rider X Elvish Yadav | Official Music Video | Sangam Vigyaanik | Dushyant Bhatli","2023-08-01T10:14:01Z","UC4GSblxbWPSa1uk5SG3MYIw","The UK07 Rider","10","23.02.08","sourav joshi|sourav joshi vlogs|piyush joshi vlogs|piyush joshi gaming|family videos|family vlogs|daily vlogger|daily vlogging|daily vlogs|travel vlogs|playing with family|family vlog|next music video shoot|music video shoot|travel videos|UK07 Rider|The Uk07 Rider|Babu Bhaiya|new superbike|delivery|Supra India|Mk4|New Supercar|Dubai Vlogs|Dubai|Systum|Elvish Yadav|Big Boss|Elvish yadav Fight|Salman Khan Elvish|Fight|Big Boss Ott2","2218269","507534","0","49680","https://i.ytimg.com/vi/RBPVaBAQE-w/default.jpg","False","False","Artist/Music- Sangam VigyaanikLyrics- Dushyant Bhatli & Sangam Vigyaanik Instagram - https://instagram.com/sangam_vigyaanik?igshid=NTc4MTIwNjQ2YQ==Instagram - https://instagram.com/official_dushyantbhatli?igshid=MzRlODBiNWFlZA==Video creditsDirected by - Aryan PanwarAD - Umesh Singh koranga Editor - Aryan PanwarColorist- Umesh Singh korangaGraphic designer Shubham NegiProduction management memoreal films Production & UK films & ProductionGiveaway Channel Video - https://youtu.be/1iRJ0QGvYMIMusic 30 Days Free Subscriptionhttp://share.epidemicsound.com/uko7ri...​Instagramhttps://www.instagram.com/anurag_dobhal​Facebook-https://www.facebook.com/theuko7rider​​For Business And Collaborationanuragdobhaluk@gmail.comxPeace xdxdxdxdxd.....What do i use to film?Laptop- https://amzn.to/33Hj1xA​​​​​​​​​Canon 80D  - https://amzn.to/33U7dsd​​​​​​​​​Canon Lens 10-18 mm  - https://amzn.to/2JdjDlb​​​​​​​​​Sony A7III - https://amzn.to/2UBVr11​​​​​​​​​Sony Lens Sigma 16mm - https://amzn.to/2JdjFJP​​​​​​​​​Sony Lens Sigma 50mm - https://amzn.to/2xpJKmw​​​​​​​​​Rode Micro - https://amzn.to/3akCozg​​​​​​​​​Ring Light with Silver Light Stand Lighting Kit Dimmable 42W 3200-5600K - https://amzn.to/33GzwKu​​​​​​​​​One Plus 6t - https://amzn.to/3bpmN1s​​​​​​​​​Gorilla pod - https://amzn.to/3aj2HFP​​​​​​​​​Tripod- https://amzn.to/2Ui40z6​​​​​​​​​Wired headphones- https://amzn.to/2xpZRQF​​​​​​​​​KTM Accessories - https://amzn.to/2UgmUqf​​​​​​​​​Copyright Disclaimer Under Section 107 of the Copyright Act 1976, allowance is made for fair use for purposes such as criticism, comment, news reporting, teaching, scholarship, and research. Fair use is a use permitted by copyright statute that might otherwise be infringing. Non-profit, educational or personal use tips the balance in favor of fair use."
"utaky5y5Xvg","Broad's Fairytale Ending! | Highlights - England v Australia Day 5 | LV= Insurance Test 2023","2023-07-31T18:31:08Z","UCz1D0n02BR3t51KuBOPmfTQ","England & Wales Cricket Board","17","23.02.08","Australia|England|England vs. Australia","4713356","89154","0","5195","https://i.ytimg.com/vi/utaky5y5Xvg/default.jpg","False","False","Go to ecb.co.uk to join We Are England Cricket Supporters for free and get priority access to tickets and much more!Watch match highlights from the Day 5 of the LV= Insurance Test between England and Australia at The Kia Oval."
"O27I_g_xqLI","LEO - Glimpse of Antony Das | Thalapathy Vijay | Lokesh Kanagaraj | Anirudh Ravichander","2023-07-29T10:30:02Z","UCn4rEMqKtwBQ6-oEwbd4PcA","Sony Music South","10","23.02.08","Sony Music South|Sony Music|Latest Song|Tamil song|Tamil Latest Song|Tamil Latest Songs 2023|Latest songs in Tamil|Songs in Tamil|Latest Tamil Movies|Tamil Movie Songs|Latest Video Songs Tamil|latest Tamil Love Songs|Latest Tamil Hit Songs|New Tamil Songs|LEO|vijay|thalapathy song|leo sonngs|anirudh songs|Lokesh Kanagaraj|Thalapathy Vijay|Naa Ready|naan ready","9957349","699245","0","18883","https://i.ytimg.com/vi/O27I_g_xqLI/default.jpg","False","False","Movie : LeoStarring - Thalapathy Vijay, Sanjay Dutt, Trisha, Arjun, Gautham Vasudev Menon, Mysskin, Mansoor Ali Khan, Priya AnandWritten & Directed by Lokesh KanagarajMusic : Anirudh RavichanderProducer : Lalit KumarCo Producer : Jagadish PalanisamyBanner : Seven Screen StudioDirector of Photography : Manoj ParamahamsaAction : Anbariv Editor : Philomin Raj Art Direction : N. Sathees Kumar Choreography : DineshCostume designers - Pallavi Singh, Eka Lakhani, Praveen RajaDialogue Writer : Lokesh Kanagaraj, Rathna Kumar, Deeraj VaidyPRO :  Riaz K Ahmed  Publicity Designer : Gopi PrasannaaSound Designer : SYNC Cinema Sound Mixing : Kannan Ganapat Production Controller : KTS SwaminathanExecutive Producer : Ramkumar BalasubramanianAssociate Director : Santhosh Krishnan, Sathya, Immanuel Prakash, Rohith SuryaColorist : Glen Castinho   Assistant Colorist : Nesikaa RajakumaranDI ; IGENEColorist ; Glen Castinho, Siva SankarMusic Label - Sony Music Entertainment India Pvt. Ltd.© 2023 Sony Music Entertainment India Pvt. Ltd.Subscribe Now: http://bit.ly/SonyMusicSouthVevoSubscribe Now: http://bit.ly/SonyMusicSouthYTFollow us: https://www.instagram.com/sonymusic_south/Follow us: Twitter: https://twitter.com/SonyMusicSouthLike us: Facebook: https://www.facebook.com/SonyMusicSouth"
