video_id,title,publishedAt,channelId,channelTitle,categoryId,trending_date,tags,view_count,likes,dislikes,comment_count,thumbnail_link,comments_disabled,ratings_disabled,description
"andZAenBIyI","1️⃣ 너무 예뻐서 무조건 살 겁니다. 갤럭시 Z 플립5&폴드5 실물로 본 느낌은?","2023-07-26T12:00:02Z","UCdUcjkyZtf-1WJyPPiETF1g","ITSub잇섭","28","23.09.08","플립5|폴드5|플립5 실물|폴드5 실물|갤럭시 플립5|갤럭시 폴드5|플립5 잇섭|폴드5 잇섭|잇섭 갤럭시|잇섭 폴드5|잇섭 플립5|플립5 색깔|폴드5 색깔|삼성 언팩|삼성 언팩 2023|갤럭시 2023|galaxy z fold 5|galaxy z flip 5|flip 5|fold 5|flip 5 hands on|fold 5 hands on|flip 5 review|fold 5 review|samsung|samsung unpacked","2222942","18295","0","2776","https://i.ytimg.com/vi/andZAenBIyI/default.jpg","False","False","자, 많은 분들이 기다리신 삼성의 하반기 플래그십. 플립5와 폴드5가 드디어 공개되었습니다. 이번에는 엄청나게 큰 변화는 아니지만 꽤 소소한 완성도를 다듬는데 집중한 모델인데, 짧지만 현장에서 느껴본 소감을 정리해봤습니다!(영상에 오류가 있어 재업로드 하였습니다.)🔋 info.새로운 스마트폰 : Galaxy Z Flip5, Fold5⏲️ Timestamps.00:00 용섭이00:17 오프닝00:53 갤럭시 Z 플립5 디자인 & 커버 디스플레이03:23 무게 & 힌지 & 카메라06:04 프로세서 & 램 & USB 3.006:32 발열제어 & 배터리 & 주름06:59 갤럭시 Z 폴드5 디자인07:28 무게 & 디스플레이07:49 프로세서 & 램 & UDC08:29 듀얼 레일 힌지09:36 카메라10:03 플렉스모드10:34 발열제어10:54 S펜🎵 Music.ES_Fast Forward, Pause STEMS INSTRUMENTS - Rebecca MardalES_HEIST MUSIC - NIGHTCAP👕 Merch.지금 입고있는 옷? : https://abit.ly/blackcowlabs📧 Business contacts. itsub@itud.io#갤럭시Z플립5 #갤럭시Z폴드5 #첫인상"
"0KZm-1YY-4Q","빵빵이의 생일파티 ~!","2023-07-25T14:41:47Z","UCI2T1_bAtgnKKzfhw3Qib9w","빵빵이의 일상","23","23.09.08","빵빵이|이주용|병맛|개그|코미디|애니메이션","3141836","57991","0","3095","https://i.ytimg.com/vi/0KZm-1YY-4Q/default.jpg","False","False","기획/대본: 이주용, 장예빈애니메이션: 이주용, 허영현, 하현준, 김민석, 윤준식배경/3D: 추헌주"
"ePtEMcJvzsY","[ENG] 코미디언의 꼬리를 무는 이야기 | EP.05 신봉선 (해피투게더, 놀면뭐하니, 뭉쳐야뜬다, 이경규 때문에 운 썰, 반려견 양갱이와의 이별, 유재석)","2023-07-30T02:00:23Z","UCJmcPVY4dC0e3L5_eemKtlg","미선임파서블 MISUN:IMPOSSIBLE","24","23.09.08","박미선|미선임파서블|박미선유튜브|코미디언|예능인|꿀잼|나는박미선|코꼬무|신봉선|놀면뭐하니|여행의맛|꼰대희|해피투게더|유재석|장동민|김대희|개그맨|개그우먼|반려견|무지개다리|거짓말탐지기|이경규|조혜련|뭉뜬리턴즈|노사연|코미디언의꼬리를무는이야기|꼬꼬무|개그콘서트|무한걸스|짱구|짱구는못말려|봉미선|봉선|여행|토크|아이유|아이유 닮은","133846","2362","0","240","https://i.ytimg.com/vi/ePtEMcJvzsY/default.jpg","False","False","누가 진짜 엄마인가....!?한 아이를 둘러싼 세 엄마의 갈등!? 😱코미디언의 꼬리를 무는 이야기출연   박미선, 신봉선 @미선임파서블 MISUN:IMPOSSIBLE   구독🔥#신봉선 #박미선 #코꼬무 #코미디언 #미선임파서블"
"b4i8UbF8z-U","[VLOG] 웃음 넘치는 소소한 행복🧡 카페도 잘 가는 130일 아기 (제주살이 남편꼬시기, 또 염색, 일본여행 준비)","2023-07-28T12:00:29Z","UCYDyvqaGX6WxH77N04sj6mg","리쥬라이크 LIJULIKE","22","23.09.08","브이로그|커플vlog|부부|유혜주","843025","10754","0","354","https://i.ytimg.com/vi/b4i8UbF8z-U/default.jpg","False","False","instagram : @r_yuhyejuYouTube & Instagram 문의lijulike@crbhoney.kr"
"8aQfjuIbNEM","쥐콩만한 와이프가 운전해도 괜찮은 전기차","2023-07-28T08:30:02Z","UCdpbqw5DPdBfaeByMF2Re0g","UPSub없섭","28","23.09.08","잇섭|없섭|itsub|upsub|bmw|bmw ix1|ix1|ix1 출고|ix1 리뷰|bmw 전기차|여자 전기차|초보 전기차|전기차 초보운전|여자 차|전기차 추천|잇섭 전기차|없섭 전기차|없섭 ix1|ix1 없섭|ix1 시승기","781186","7127","0","1015","https://i.ytimg.com/vi/8aQfjuIbNEM/default.jpg","False","False","결혼 후 혼자 양가 왕복 운전해보니 죽을 뻔 해서 운전연습 시키는 중입니다.전기차 입문용으로 한 번 빌려서 타봤는데 며칠 째 찾아보는 중;; *이 영상은 'BMW'의 유료광고를 포함하고 있습니다. #BMW #iX1"
"dFVIviR2cw8","우왁굳: 뒤질래 진짜?","2023-07-29T00:20:05Z","UCV9WL7sW6_KjanYkUUaIDfQ","고세구 GOSEGU","22","23.09.08","#고세구|#우왁굳|#이세돌|#왁타버스|#WAKTAVERSE|#우왁굳의 게임방송|#우왁굳 고세구|#이세돌 고세구|#Vtuber|#vtuber|#virtual|#VR|#vr|#vrchat|버튜버|バーチャルyoutuber|キズナアイ|バーチャルユーチューバー|Youtuber thực tế|#트위치|#아이네|#릴파|#징버거|#주르르|#비챤|#노가리|#겨울봄|#메타버스|#metaverse|#LOCKDOWN|#락다운|#마법소녀이세계아이돌|#마법소녀|#anotherworld|#어나더월드","344212","10228","0","837","https://i.ytimg.com/vi/dFVIviR2cw8/default.jpg","False","False","#이세돌 #이세계아이돌 #고세구 의도한건 아니었슴다... ㅋㅋㅋㅋㅋㅋㅋㅋㅋ-왁물원 링크https://cafe.naver.com/steamindiegame-고세구 비즈니스 메일segugo.zip@gmail.com-캐릭터 출처作者名：「こまど」Twitter:@komado_booth(캐릭터 제작자님의 허가를 얻어 활동하고 있습니다)"
"e-4jrISQRhw","[안방1열 풀캠4K] 정국 'Seven (feat. Latto)' (Jung Kook FullCam)│@SBS Inkigayo 230730","2023-07-30T08:12:27Z","UCS_hnpJLQTvBkqALgapi_4g","스브스케이팝 X INKIGAYO","24","23.09.08","Inkigayo|인기가요직캠|안방1열직캠|스브스케이팝|스브스 직캠|인기가요|인가|음방|음악방송|정국|방탄소년단|정국 세븐|정국 솔로|정국 솔로 데뷔|정국 솔로 노래|빅히트 엔터테인먼트|하이브|정국 뮤직비디오|Jung Kook|Seven|정국 Seven|정국 한소희|BTS|정국 인기가요|방탄소년단 인기가요|정국 솔로 무대|정국 인기가요 무대|정국 직캠|전정국","1364525","137526","0","4814","https://i.ytimg.com/vi/e-4jrISQRhw/default.jpg","False","False","[안방1열 풀캠4K] 정국 'Seven (feat. Latto)' (Jung Kook FullCam)│@SBS Inkigayo 230730#인기가요 #정국 #JungKook #BTS #Seven--------------------------------------------------------------------------------------☞ MORE ＂SBS KPOP＂Twitter : https://twitter.com/kpop_sbsFacebook : https://www.facebook.com/sbskpopInstagram : https://instagram.com/sbskpop_official"
"A7TYMNqF-tY","[GOING SEVENTEEN] EP.86 부밀리가 떴다 #2 (BOOmily Outing #2)","2023-07-26T11:58:08Z","UCfkXDY7vwkcJ8ddFGz8KusA","SEVENTEEN","10","23.09.08","에스쿱스|정한|조슈아|호시|원우|우지|디에잇|민규|도겸|승관|버논|디노|SCOUPS|JEONGHAN|JOSHUA|JUN|HOSHI|WONWOO|WOOZI|THE 8|MINGYU|DK|SEUNGKWAN|VERNON|DINO|세븐틴|SEVENTEEN|セブチ","2530669","154735","0","3747","https://i.ytimg.com/vi/A7TYMNqF-tY/default.jpg","False","False","[GOING SEVENTEEN] EP.86 부밀리가 떴다 #2 (BOOmily Outing #2)호시 하고싶은 거 다 해오늘은 호시가 '부밀리가 떴다'의 요~리사🐯그리고 호시를 바라보는 불안한 눈동자들👀과연 부밀리는 맛있는 저녁을 먹을 수 있을까❓🤣HOSHI, you can do whatever you want!Today, HOSHI is the chef for “BOOmily Outing” 🐯And there are many worried eyes watching HOSHI 👀Will BOOmily manage to have a tasty dinner❓🤣#SEVENTEEN #세븐틴#GOING_SVT"
"1H1YCLIKuik","미국 정부 UFO 회수해 역설계했다...수십 년 숨겨 / YTN 사이언스","2023-07-27T08:23:47Z","UCUkuuoNkyVBFWojFW-SPmTw","YTN 사이언스 투데이","28","23.09.08","UFO|미국UFO|UFP|뉴스|YTN|YTN사이언스|과학|이슈|정보","971668","7907","0","3949","https://i.ytimg.com/vi/1H1YCLIKuik/default.jpg","False","False","[앵커]미국 정부가 미확인비행물체인 UFO를 회수해 분해하고 이를 모방해 역설계하는 프로그램을 진행하고도 수십 년 동안 숨겨왔다는 내부고발이 나왔습니다.미국 하원 UFO 청문회에서 나온 주장입니다.류제웅 기자가 전해드립니다.[기자]미 하원은 지난해부터 50여 년 만에 다시 미확인비행현상(UFP)의 진상을 규명하기 위한 청문회를 열고 있습니다.여러 주장과 증거들이 제시되고 있습니다.이번에는 전직 군 관계자들이 나섰습니다.[리안 그래브스/ 전직 해군 중위 : 미확인비행현상은 하늘에 존재하지만 너무나 적게 보고됩니다. 목격하는 게 드문 일이 아니고 일상적인 일입니다.]초기밀 프로그램 관련 정보를 다뤘던 전직 공군 소령은 여기서 더 나아가 정부가 UFO와 외계인 유해를 갖고 있으면서도 숨기고 있다고 주장했습니다.[데이비드 그러쉬 / 전 미 공군 소령 : 내가 임무를 수행하면서 수십 년에 걸쳐 미확인비행현상 추락을 회수해 역설계한 프로그램이 있다는 걸 알았습니다.]또 미국 정부는 1930년대부터 외계 존재의 활동을 인지하고 있었을 것이라고 주장했습니다.그러면서 내부고발자로서 괴롭힘을 당하고 있다고도 했습니다.[팀 버쳇 / 미 하원의원(공화당) : 관련 증언으로 인해 보복을 당한 적이 있나요?][데이비드 그러쉬 / 전 미 공군 소령 : 매우 잔인하고 불행한 것이었습니다. 그들은 나를 직업적으로 또는 개인적 방법으로 모두 괴롭혔습니다.]미 국방부는 성명을 내고 그러쉬의 이 같은 UFO 관련 주장을 뒷받침할만한 그 어떤 정보도 찾지 못했다고 일축했습니다.하지만 버쳇 의원 등은 정부가 정보를 숨기고 있다는 주장을 지지하면서 이번 폭로는 시작에 불과하고 앞으로 더 많은 사람들이 나설 것이라며 진상 규명 의지를 밝혔습니다.YTN 류제웅입니다.YTN 류제웅 (jwryoo@ytn.co.kr)#UFO #미국UFO #UFP #뉴스 #정보 [YTN 사이언스 기사원문] https://science.ytn.co.kr/program/view.php?mcd=0082&hcd=&key=202307271628351437[프로그램 제작 문의] legbiz@ytn.co.kr"
"W4rs-76SgRA","ITZY CAKE Performance Video (4K)","2023-07-31T15:00:20Z","UCDhM2k2Cua-JdobAh5moMFg","ITZY","24","23.09.08","JYP Entertainment|JYP|ITZY|있지|イッチ|예지|리아|류진|채령|유나|YEJI|LIA|RYUJIN|CHAERYEONG|YUNA|イェジ|リア|リュジン|チェリョン|ユナ|อิทจี|เยจี|ลีอา|รยูจิน|แชรยอง|ยูนา|ITZY VIDEOS|ITZY LOCO|ITZY BEHIND|MV|ITZY MV|ITZY MUSIC VIEDOS|Teaser|ITZY Teaser|ITZY VLOG|VLOG|IT'z Different|IT'z ICY|IT'z ME|Not Shy|GUESS WHO|CRAZY IN LOVE|DALLA DALLA|ICY|WANNABE|마.피.아.IN THE MORNING|LOCO|SNEAKERS|있지있지|있있|CHESHIRE|체셔|KILLMYDOUBT|BETONME|NoneofMyBusiness|CAKE","1471705","124065","0","3203","https://i.ytimg.com/vi/W4rs-76SgRA/default.jpg","False","False","ITZY CAKE Performance Video (4K)🎧 TITLE http://kko.to/eoMjL0dgJy💿 ALBUM http://ITZY.lnk.to/KILLMYDOUBT[ITZY Official]▶ https://www.youtube.com/c/ITZY▶ https://www.instagram.com/itzy.all.in.us▶ https://www.tiktok.com/@itzyofficial▶ http://www.twitter.com/ITZYOfficial▶ http://www.facebook.com/OfficialITZY▶ https://www.weibo.com/u/7462077750?is▶ http://ITZY.jype.com▶ http://fans.jype.com/ITZY#ITZY #ITZY_KILLMYDOUBT #ITZY_CAKE Copyrights 2023 ⓒ JYP Entertainment. All Rights Reserved"
"a0nth0ty1DY","집들이는 서프라이즈를 위한 장치였을 뿐! 임신소식 알리기 👼🏼","2023-07-26T11:40:07Z","UC6KwCU8Y8Uw4h_Q0ptLZkqw","해쭈 [HAEJOO]","22","23.09.08","해쭈|가좍|쁘큐보이|카야|새삼이|브이로그|호주|foodtrip|foodie|australia|mukbang|먹방브이로그|먹방|해쭈먹방|cooking|요리|고매요리","1075051","43627","0","2239","https://i.ytimg.com/vi/a0nth0ty1DY/default.jpg","False","False","-비지니스 문의는 이쪽으로 👉🏽 haejoo@sandboxnetwork.net감성가득 인스타그램 👉🏽  https://instagram.com/hae_jooooo_미지의 그곳 해쭈 팬카페 👉🏽  https://m.cafe.naver.com/australiahaeju"
"pMmtxvxHh6s","덱스의 속살","2023-07-26T09:00:35Z","UC1Rz7a_DWtsE9cQwSyElE0Q","인생84","22","23.09.08","기안84|기안팔사|기안|김희민|희민|웹툰작가|복학왕|패션왕|나혼자산다|침착맨|말년을건강하게|이말년|주호민|엠드로메다|덱스|dex|다큐멘터리|브이로그|vlog|mma|운동|훈련|체육관|udt|유디티","1343660","26425","0","2640","https://i.ytimg.com/vi/pMmtxvxHh6s/default.jpg","False","False","The 미식 비빔면 좌표👉https://link.coupang.com/a/4XR0u기안84님처럼 차돌박이에 싸먹으면 맛이 두 배!! 지금 바로 쫄깃한 면과 매콤새콤한 양념장을 맛 보세요 #기안84IG - @khmnim1513Biz E-Mail - backho2301@gmail.com"
"lXO656QvHQM","내 가장 친한 베프가 악마였다고..!?","2023-07-29T09:00:24Z","UCRuSxVu4iqTK5kCh90ntAgA","총몇명","1","23.09.08","총몇명|유승찬|민모리|총몇명스토리|공포|악마|스릴러|루시퍼","1100019","23040","0","1199","https://i.ytimg.com/vi/lXO656QvHQM/default.jpg","False","False","총몇명입니다! 지옥의 왕은 8부작이며,아래 일정에 따라 2주 간격으로 업로드됩니다.[ 7월 29일 토요일 1화 ~ 8월 5일 토요일 2화 ] [ 8월 26일 토요일 3화 ~ 9월 2일 토요일 4화 ] [ 9월 23일 토요일 5화 ~ 9월 30일 추석특집 몰아보기] [10월 7일 6화 ~ 10월 14일 7화 ~ 10월 21일 8화] 단, 후반부인 6, 7, 8화는 3주간 연속 업로드 예정입니다!오늘도 시청해주셔서 감사드립니다! 주말 잘 보내세요~!!![총몇명 스튜디오]총감독 : 총몇명 / 부감독 : 콜드제로 / 제작진행 : 지카모토 / 스토리보드 : 조예 / 작화 : 예은 / 편집 : 도혜&스노유진 / 배경 : 희경 / 기획 : 총몇명, 센, Belli / 사운드 : 총몇명, 세인러문, 콜드제로"
"c0dE8v50WDQ","[먹방브이로그]갈수록 더 폭주하는 다이어트 부작용 치팅_찐최종 (엽떡마라떡볶이, 2단 케이크, 점보도시락라면, 쿠키슈, 양념돼지갈비, 아이스크림 )","2023-07-29T03:00:15Z","UCJ8B-zT_okLpHRlFaTPLeYg","주먹커플 Jumuk Couple","22","23.09.08","먹방|먹방브이로그|주먹커플|vlog|치팅|mukbang|mukbangvlog|폭식|커플먹방|브이로그|신혼브이로그|엽떡마라떡볶이|점보도시락라면|Diet vlog|급찐급빠|다이어트치팅|쿠키슈|케이크","209997","2712","0","224","https://i.ytimg.com/vi/c0dE8v50WDQ/default.jpg","False","False","여러분 벌써 4주 째 치팅이네요,, 언제 이렇게 먹었을까요갈수록 양은 늘어나고 입은 더 터지는 거 같곸ㅋㅋㅋㅋㅋ치팅_최종치팅_진짜 최종치팅_이게 찐 최종치팅_찐찐찐막최종종종종이런 느낌이랄까?이러다 다시 되돌아갈 것 같아서 이번 주는 디톡스를 하며,,다음 주 영상은 잠시 쉬어가도록 할게요ㅠㅠㅠㅠ다다음주는 어떤 영상으로 찾아올지 저도 모르겠어요ㅋㅋㅋㅋ다이어트?? 치팅?? ,,   다덜 궁금해하시면서,,,  영상 재밌게 봐주세용♥(아 근데 청년피자에 씨푸드콘이라며 옥수수엣지로 된 신메뉴 나왔다고 디엠 폭주하는데이거는 진짜 못참겠는데,,,,신상 그만 나와ㅠㅠㅠㅠ)설정 2160 높은 화질로 보시는걸 권장드려용🕕TIMELINE00:01 운동 인생 최초 토할 뻔하고 디저트 픽업01:48 '엽떡' 마라 떡볶이, 꿔바로우, 엽봉08:10 '퍼프슈' 체리, 레몬, 티라미슈, 블루베리 쿠키슈12:03 부모님과 외식 '민속촌'13:32 광주 '티라미뚜' 상하목장 아이스크림, 2단 과일케이크20:22 점보 도시락 라면25:44 끝날 때까지 끝난 게 아니다....📌[Instagram]윤지 https://www.instagram.com/__yzzzi희중 https://www.instagram.com/shin_h_j.27[Contact]  : starzia225@gmail.com🎵Music provided by 브금대통령Artist : 오늘의 일기Link : https://youtu.be/zUBJ7agRonA"
"8P6RAmheGmk","[SUB] 그런 날 있잖아 이동욱이 보고 싶은.. 그런 날│Ep.10 이동욱 | 살롱드립☕","2023-07-25T09:00:08Z","UC-uIpGINZDL-VIHQQzJW8jw","TEO 테오","24","23.09.08","김태호|teo|지구마불|ena|곽튜브|빠니보틀|원지|세계여행|예능|tvN|댄스가수유랑단|댄스가수 유랑단|이효리|엄정화|김완선|보아|화사|마마무|Kpop|KimWansun|UhmJunghwa|LeeHyori|BoA|HwaSa|게스트|아이돌|음악|music|stage|idol|k-pop|티비엔|살롱드립|테오유튜브|유튜브|노래|무대|star|super star|k-dol|케이팝|kpop|k-music|차정숙|닥터 차정숙|장도연|토크쇼|토크 예능|salon drip|이동욱|배우|배우 이동욱|Lee DongWook|Dongwook|k-drama|도깨비|Guardian: The Lonely And Great God|공유|이동욱은 토크가 하고 싶어서|핑계고|유재석","1948945","53375","0","2680","https://i.ytimg.com/vi/8P6RAmheGmk/default.jpg","False","False","살롱드립 시즌 1의 마지막 손님!기다렸잖아요...이 케미...❤️ 유튜브가 선택한 사람, 인급동의 남자!배우 이동욱이 함께 합니다.살롱드립은 8월 8일, 시즌2로 새롭게 찾아옵니다.다음주는 특별판으로 만나요~!#살롱드립 #salondrip #장도연 #이동욱 #TEO @teo.universe"
"JHoFq0FW5h0","토토 등장(D-1) 출산 하루 전 마지막 영상🐰","2023-07-29T05:00:07Z","UCu4X3ZAoq6nToNJNNoQuICA","혜진쓰 Hyejin's","22","23.09.08","혜진쓰|혜진쓰 브이로그|Hyejin's|Vlog|부부일상|혜진|헤이지니 임신|만삭|만삭 임산부|만삭 브이로그|임산부 만삭 브이로그|임산부 만삭|출산|출산 브이로그|만삭 출산|헤이지니 토토|혜진쓰 토토|토토","722744","11247","0","1521","https://i.ytimg.com/vi/JHoFq0FW5h0/default.jpg","False","False","안녕 혜충이들🙋🏻‍♀️ 바쁜 일상에 치이다 출산 하루 전날 드디어 맘마존과 출산 가방을 무사히 잘 쌌어요😂 생각보다 챙길 게 많더라구요?! 필요한 것들 조금씩 챙기다 어느새 빵빵해진 캐리어를 보니 너무 뿌듯~🧳👏🏻그리고 짜잔 토토가 드디어 세상에 나왔답니다!다들 토토가 많이 궁금하실텐데 다음 영상은 저와 충충이, 둘이 아닌 토토와 함께 셋이 찍은 영상으로 돌아올테니 기대해주세요 👨‍👩‍👧🤍🎶BGM🎶오늘의 일기 - 귀엽고 발랄한 분위기 음악 모음 / Day off / Get Ready / Egg Tart / brunch / Sweetie / sweet potato / lovely day / let's toast! / Orange Sunrise / lemon pound cakehttps://youtu.be/_YdFyzU8ryAhttps://youtu.be/x8Mf5IBHbBohttps://youtu.be/Xl2lgQTP34Ehttps://youtu.be/0JoTcJ-q_pEhttps://youtu.be/SveXz24M6nIhttps://youtu.be/z1UubcsAFUkhttps://youtu.be/a1AUbm1NVUAhttps://youtu.be/NFem2l-vdpshttps://youtu.be/6383HXw3PsIhttps://youtu.be/rUDg0xy-Ais브금대통령 - 조별 과제 / 야식 https://youtu.be/wLuWmPrJkSkhttps://youtu.be/d6JidyweBCI"
"QFBdiKl-SYA","[ENG][아형✪하이라이트] '몽환 유아'가 되고 싶었지만 아기 동자가 찰떡인 승희👶✨ 웃음과 감동까지 다 챙긴 오마이걸❣ | 아는 형님 | JTBC 230729 방송","2023-07-29T13:33:11Z","UCOHM2N1YQdb-cHWxJxwBMLQ","아는형님 Knowingbros","24","23.09.08","아는 형님|형님|형님 학교|오마이걸|미미|승희|아린|유아|효정|유빈|강호동|이수근|서장훈|김희철|민경훈|김영철|이상민|이진호|아이돌예능|여자아이돌예능|오마이걸아는형님|여름특집|간판스타|오마이걸간판|오마이걸하이라이트|오마이걸토크|미미아는형님|승희아는형님|아린아는형님|유아아는형님|효정아는형님|유빈아는형님|미미예능감|승희예능감|아린예능감|IVE","209557","2818","0","192","https://i.ytimg.com/vi/QFBdiKl-SYA/default.jpg","False","False","[아형✪하이라이트]  '몽환 유아'가 되고 싶었지만 아기 동자가 찰떡인 승희👶✨ 웃음과 감동까지 다 챙긴 오마이걸❣#아는형님 #하이라이트 #오마이걸아는형님 #오마이걸00:00 인트로00:45 우두머리 '효정'의 간판스타 주장05:16 요즘 예능 대세 '미미'의 간판스타 주장08:21 몽환은 나✌  '유아'의 간판스타 주장11:27 원조 예능 간판  '승희'의 간판스타 주장13:25 이제 비니 NO!  '유빈'의 간판스타 주장16:30 '걸'에 가장 가까운 막내  '아린'의 간판스타 주장19:31 (눈물 주의) 오마이걸의 ＂고.미.사＂23:32 [지난 회 다시보기] 미미의 제주도 사투리📣📌 공홈에서 리플레이 : https://tv.jtbc.co.kr/jtbcbros📌 #티빙에서스트리밍 : https://tving.onelink.me/xHqC/1vihef6r〈아는 형님〉은 매주 토요일 저녁 8시 50분 본.방.사.수!"
"DV2lPxIAoBs","[하이라이트] 제로즈의 소원을💖 들어주러 나타난 지니베이스원의 주간아 모먼트📁 l #주간아이돌 l EP.623","2023-07-27T08:00:12Z","UCPde4guD9yFBRzkxk2PatoA","ALL THE K-POP","24","23.09.08","ZEROBASEONE|제베원|제베원 하이라이트|ZB1 하이라이트|하이라이트|제베원 인 블룸|ZEROBASEONEIn Bloom|ZB1제베원 춤|ZEROBASEONE dance|은광|미주|김규빈|김지웅|김태래|리키|박건욱|석매튜|성한빈|장하오|한유진|제베원 주간아|제베원 주간아이돌|주간아이돌|제베원 예능|ZEROBASEONE variety|ZEROBASEONE weekly idol|하이라이트 주간아이돌","243029","9780","0","325","https://i.ytimg.com/vi/DV2lPxIAoBs/default.jpg","False","False","제로즈의 소원을 들어주러🧞 주간아에 나타난 제로베이스원‍✨웃음터지는 제로베이스원만의 일화와제베원의 모든 것이 알고싶은 제로즈들을 위한 신체측정시간멋짐도 놓칠 수 없는 제베원의 댄스까지!웃음과 멋짐을 동시에 꽃처럼 피어낸 제로베이스원의 주간아 하이라이트🌼00:00 제베원 숙소에서는 이런일이?! 웃음터지는 리키의 샤워비하인드🚿01:10 알람 전쟁 발생🚨02:16 서로를 어떻게 저장한다고? 제베원의 멤버 저장 방법03:52 모든게 궁금한 제로즈를 위한 신체측정 시간07:19 리더자부심 뿜뿜! 한빈의 멤버 맞추기✨10:18 ＂주간아에 F4🌸의 등장이라.. 이거 참 흥미로운 걸?＂11:45 바이올린🎻 천재 하오의 ＜고백의 밤🎶＞13:26 주간아에서만 볼 수 있는 NEW버전 ＂누나 사랑해요💖＂14:48 누나들의 마음을❤ 얻을 필살기! 제베원의 누너예 챌린지15:55 한빈이는 무대를 찢어...💘 성한빈의 ＜I Like That＞ 댄스🕺17:04 막둥이가 이렇게 커도 되는건가요..🤭 한유진의 ＜MOVE＞ 댄스18:01 ＂신발이 막 날라다녀요＂ In Bloom 2배속 댄스#하이라이트 #주간아이돌 #ZEROBASEONE #제로베이스원 #ZB1제작 올더케이팝 / 신현진★All about KPOP! Subscribe now★https://bit.ly/3NJTqeGGlobal No.1 KPOP IDOL CHANNEL, ALL THE K-POP! Copyrightⓒ MBC PLUS, All Rights Reserved. ------------------------------------------------------* twitter : https://twitter.com/ALLTHEKPOP * facebook : http://facebook.com/allthekpop.idol * tiktok : https://www.tiktok.com/@allthekpop_official"
"MSQhnXRdECs","[아이유의 팔레트🎨] 뉴진스의 컬러 스위치요 (With 뉴진스) Ep.21","2023-07-24T09:00:12Z","UC3SyT4_WLHzN7JmHQwKQZww","이지금 [IU Official]","24","23.09.08","IU|아이유|이담|EDAM|이지금|dlwlrma|아이유tv|아티비|아이유티비|아이유의팔레트|팔레트|뉴진스|NewJeans|컬러스위치|Color Switc|ETA|Super Shy|Cool With You|Get Up|ASAP|Celebrity|해린|혜인|다니엘|하니|민지","4326076","212763","0","11067","https://i.ytimg.com/vi/MSQhnXRdECs/default.jpg","False","False","[IU's Palette]  NewJeans' Color Switch (With NewJeans) Ep.21[아이유의 팔레트] 뉴진스의 컬러 스위치요 (With 뉴진스) Ep.21#아이유 #뉴진스 #팔레트"
"6aLrGGXLmfI","30년 째 헬스 다니는 중이예요 자기관리 최고인 90세 할머니의 건강 비결 '이것'┃장수가족 건강의 비밀┃알고e즘","2023-07-27T05:00:02Z","UCl_tB4AqPkkxuYcJQHz6dMw","EBSCulture (EBS 교양)","24","23.09.08","EBS|EBS culture|EBS 교양|교양|문화|culture|장수가족 건강의 비밀|헬스|건강|운동|할머니|장수|장수의비밀|가족|손자|며느리|아들|딸|사위|손녀|할아버지|생일|생신|헬스장|유산소|근력|트레이너|식초|약|관리|잔치|독일","1763510","12680","0","910","https://i.ytimg.com/vi/6aLrGGXLmfI/default.jpg","False","False","서울 영등포구. 한강 옆에 조용히 자리한 동네에 박희서 할머니가 살고 계신다. 90세라는 고령의 나이에도 불구하고 하루도 운동을 거르지 않는 할머니. 일주일에 여섯 번, 할머니가 매일 가는 곳이 있었으니, 바로 스포츠 센터! 자전거 타기 등의 유산소 운동은 물론 근력운동까지 2시간씩 운동을 하신다. 땀을 흘리며 운동을 하고 난 뒤, 어디론가 바쁘게 가는 할머니. 함께 사는 첫째 아들 내외를 비롯해 6남매 중 4남매가 모두 한 동네에 모여 살기 때문인데... 보고 싶을 때마다 가족을 만날 수 있어 행복하다는 박희서 할머니의 활기찬 하루를 따라가 본다.📺방송정보📌프로그램명: 장수가족 건강의 비밀 - 헬스 할머니의 가족은 나의 힘!📌방송일자: 2013년 2월 12일#헬스 #건강 #운동 #할머니 #장수 #가족 #생일 #헬스장 #유산소 #근력 #식초"
