video_id,title,publishedAt,channelId,channelTitle,categoryId,trending_date,tags,view_count,likes,dislikes,comment_count,thumbnail_link,comments_disabled,ratings_disabled,description
"2Q6lI-gtA8M","I Survived 100 Days as CAMERA MAN in HARDCORE Minecraft!","2023-08-05T01:30:01Z","UCYPYEhWUvvKFgmgkLACagXA","MaxCraft","20","23.09.08","[none]","2133606","27484","0","1707","https://i.ytimg.com/vi/2Q6lI-gtA8M/default.jpg","False","False","Download Honkai Impact 3rd here: https://hoyo.link/849RtBAdHoYoverse is making its grand appearance at gamescom! Join them from AUG 23 to AUG 27 for an incredible experience at theirBooth Events, where you can enjoy free giveaways. Explore their fantastic Merch collection, engage with talented cosplayers, and don't miss the chance to try out the captivating game demo! See you there!► SUBSCRIBE to the Channel! https://www.youtube.com/channel/UCYPYEhWUvvKFgmgkLACagXA?sub_confirmation=1Max is born into the world of Skibidi Toilet as a Cameraman! Now, alongside the TV Woman, Max has to take on the armies of the evil toilet forces! Over the course of 100 days, watch as Max becomes stronger and stronger, getting mind-blowing upgrades and unlocking new forms, soon even getting to control a Titan Cameraman! Get ready to cut the song short as the cameras fight back!Map Credit:City-17 [Grand Project] |HALF-LIFE 2| https://www.planetminecraft.com/project/city17-grand-project-half-life-2-map/Mods utilized:MrCrayfish's Gun Mod - https://www.curseforge.com/minecraft/mc-mods/mrcrayfishs-gun-modMrCrayfish's Furniture Mod - https://www.curseforge.com/minecraft/mc-mods/mrcrayfish-furniture-modMrCrayfish's More Furniture Mod - https://www.curseforge.com/minecraft/mc-mods/mrcrayfish-more-furniture-modTrajan's Tanks (Forge) - https://www.curseforge.com/minecraft/mc-mods/trajans-tanksMrCrayfish's Vehicle Mod - https://www.curseforge.com/minecraft/mc-mods/mrcrayfishs-vehicle-modXK Deco - https://www.curseforge.com/minecraft/mc-mods/xks-decorationMahou Tsukai - https://www.curseforge.com/minecraft/mc-mods/mahou-tsukaiApex Guns - https://www.curseforge.com/minecraft/mc-mods/apex-gunsMo' Guns - https://www.curseforge.com/minecraft/mc-mods/mogunsTimeless and Classics Guns - https://www.curseforge.com/minecraft/mc-mods/timeless-and-classic-guns-tac Epic Fight Mod - https://www.curseforge.com/minecraft/mc-mods/epic-fight-modAdditional Lights - https://www.curseforge.com/minecraft/mc-mods/additional-lights Alex’s Mobs - https://www.curseforge.com/minecraft/mc-mods/alexs-mobs Citadel - https://www.curseforge.com/minecraft/mc-mods/citadel Angel Ring - https://www.curseforge.com/minecraft/mc-mods/angel-ring Curios API - https://www.curseforge.com/minecraft/mc-mods/curiosCyclic - https://www.curseforge.com/minecraft/mc-mods/cyclic BetterAnimalsPlus - https://www.curseforge.com/minecraft/mc-mods/betteranimalsplus Architectury API - https://www.curseforge.com/minecraft/mc-mods/architectury-api BMorph -  https://www.curseforge.com/minecraft/mc-mods/budschies-morph-mod Carry On - https://www.curseforge.com/minecraft/mc-mods/carry-on Catalogue - https://www.curseforge.com/minecraft/mc-mods/catalogueCMD Cam - https://www.curseforge.com/minecraft/mc-mods/cmdcam Creative Core - https://www.curseforge.com/minecraft/mc-mods/creativecore Configured - https://www.curseforge.com/minecraft/mc-mods/configured Custom NPCs - https://www.curseforge.com/minecraft/mc-mods/custom-npcs Dynamic Surroundings - https://www.curseforge.com/minecraft/mc-mods/dynamic-surroundings Effortless Building - https://www.curseforge.com/minecraft/mc-mods/effortless-building Fakename - https://www.curseforge.com/minecraft/mc-mods/fakename Flyspeedmod - https://www.curseforge.com/minecraft/mc-mods/fly-speed-modifier-mod/files Hide Armor - https://www.curseforge.com/minecraft/mc-mods/hide-armor Just Enough Items - https://www.curseforge.com/minecraft/mc-mods/jei LuckyTNT - https://www.curseforge.com/minecraft/mc-mods/luckytnt Mob Battle - https://www.curseforge.com/minecraft/mc-mods/mob-battle-mod MorePlayerModels - https://www.curseforge.com/minecraft/mc-mods/more-player-models OptiFine - https://optifine.net/adloadx?f=OptiFine_1.16.5_HD_U_G7.jar&x=59c3 Pehkui - https://www.curseforge.com/minecraft/mc-mods/pehkui/ Shrink - https://www.curseforge.com/minecraft/mc-mods/shrink_ Supplementaries - https://www.curseforge.com/minecraft/mc-mods/supplementaries Security Craft - https://www.curseforge.com/minecraft/mc-mods/security-craftSelene - https://www.curseforge.com/minecraft/mc-mods/selene The Mighty Architect - https://www.curseforge.com/minecraft/mc-mods/the-mighty-architect Warp - https://www.curseforge.com/minecraft/mc-mods/the-warp-mod Wings - https://www.curseforge.com/minecraft/mc-mods/wings World Edit - https://www.curseforge.com/minecraft/mc-mods/worldeditSuggested rating: TV-PGThis video contains material not suitable for younger audiences.*This video is Sponsored by Honkai Impact 3rd*"
"EBjYtV5zvQE","The Insane Plot Armor of Cats","2023-08-04T20:15:00Z","UC5Yo88QF-chdugJbAnB2tUw","Casual Geographic","27","23.09.08","video|sharing|camera phone|video phone|free|upload","1800302","147668","0","10506","https://i.ytimg.com/vi/EBjYtV5zvQE/default.jpg","False","False","Long story short, cats are broken. Also please don't throw your cat out a window, “zero fall damage” was an exaggerationCheck out my new book Here: https://a.co/d/enrdHKKIf you'd like to watch videos early, get bonus content and support this channel, consider joining my Patreon: https://www.patreon.com/HoodNatureMusic from:Watching the Clouds- Lakey InspiredSong of Storms- Smash Bros. UltimateDocumentary music- bdProductionsSnowman- Smash Bros. UltimateBattle in the Base- Smash Bros. UltimateWith Mila's Divine Intervention- Smash Bros. UltimateThe Dark World- A Link to the PastRatchet & Clank- MetropolisClips used:Mia saves owner from cancer: https://youtu.be/Mw_edAM3ISI?si=YmhVMlL7wmns3eOc"
"bdyoqyzijnc","The Real Reason Why Jimmy Uso Betrayed Jey Uso at WWE SummerSlam","2023-08-06T05:22:05Z","UC3bcU_s3idk9sIjXkp5KZ_Q","Pllana Productions","17","23.09.08","wwe|summerslam|roman reigns|jey uso|wwe smackdown|jimmy uso|jey|jimmy|the usos|wrestle|wrestling|summerslam wwe|wwe summerslam|the real reason|The Real Reason Why Jimmy Uso Betrayed Jey Uso|The Real Reason Why Jimmy Uso Betrayed Jey Uso at WWE SummerSlam|Why Jimmy Uso Betrayed Jey Uso","230477","5472","0","1160","https://i.ytimg.com/vi/bdyoqyzijnc/default.jpg","False","False","The Real Reason Why Jimmy Uso Betrayed Jey Uso at WWE SummerSlamSummerSlam just came to a shocking end. Roman Reigns retained his WWE championship, but I don’t think anybody expected it happen like this. After a hard-fought battle, it looked like main event Jey Uso was going to win the world championship. It seemed like a perfect ending to The Bloodline story. After a big-time splash, Jey went for the pin. The referee nearly counted three until a man with a hoodie pulled Jey Uso out of the ring. We come to find out that it’s his brother. Jimmy Uso returned and cost his brother the championship match. He then hit him with a superkick and sent him back in the ring to take one final spear that ended the match. Roman Reigns even looked shocked, so this wasn’t planned by him or Paul Heyman. Jimmy Uso came out to screw over his brother for a certain reason. What is that reason? Well, here’s the real reason why Jimmy Uso returned to betray his brother.#WWE #SummerSlam Can we REACH 5000 likes?►Help Me Reach 500K Subscribers - http://goo.gl/e0xMwh►My Twitter - https://twitter.com/valonpllana►My Instagram - https://instagram.com/valon.pllanaFor copyright purposes, please email: business.pllana@gmail.com*Copyright Disclaimer Under Section 107 of the Copyright Act 1976, allowance is made for fair use for purposes such as criticism, comment, news reporting, teaching, scholarship, and research. Fair use is a use permitted by copyright statute that might otherwise be infringing. Non-profit, educational or personal use tips the balance in favor of fair use. No copyright infringement intended. ALL RIGHTS BELONG TO THEIR RESPECTIVE OWNERS*"
"Y70uWkm68Lo","Kevin Gates - I Don't Apologize (Official Music Video)","2023-08-04T04:00:08Z","UCj2GTFekdV3EUsTVN8oaEqA","kevingatesTV","10","23.09.08","kevin gates|kevin|gates|BWA|bad for me|dreka|beyonce|thinking with my dick|thinking with my d|super general freestyle|khaza|Kevin Gates lyrics|Brittany Renner|Kevin Gates interview|Kevin Gates freestyle|Kevin Gates new album|big gangsta|dear god|Kevin Gates intro|Kevin Gates wife|Kevin Gates girlfriend|Kevin Gates performance|Breakfast|kevin gates nasty|i got breakfast for you|do it again|louisiana|kevin gates post|baton rouge|I Dont Apologize","1407819","67700","0","2814","https://i.ytimg.com/vi/Y70uWkm68Lo/default.jpg","False","False","Kevin Gates - I Don't ApologizeStream ‘I Don't Apologize’ Now!https://www.kevingates.lnk.to/idontapologizeSee Kevin live!https://www.kvngates.com/tourGet your merchandise here! http://smarturl.it/kevingates.storeSubscribe for more official content from Kevin Gates:https://kevingates.lnk.to/SubscribeFollow Kevin GatesTikTok: https://www.tiktok.com/t/ZTdKJ3VWWInstagram: http://instagram.com/iamkevingatesTwitter: http://twitter.com/iamkevingatesFacebook: https://facebook.com/kvngatesSoundcloud: https://soundcloud.com/kevingatesWebsite: http://www.kvngates.comThe official YouTube channel of Atlantic Records artist Kevin Gates. Subscribe for the latest music videos, performances, and more.#KevinGates #Idontapologize #OnlyTheGenerals"
"PCzCqqVGQYE","F1 Car vs World's FASTEST Hypercars: DRAG RACE","2023-08-05T08:05:42Z","UCUhFaUpnq31m6TNX2VKVSVA","carwow","2","23.09.08","carwow|mat watson|car review|new car review|car review 2023|new car 2023|red bull|red bull racing|red bull f1|red bull f1 car|red bull racing f1|rimac|rimac nevera|nevera|rimac nevera drag race|rimac nevera race|mcmurtry|spéirling|mcmurtry drag race|f1 car drag race|red bull f1 car drag race|f1 car v road car|quickest electric car|most powerful electric car|red bull racing drag race|liam lawson|max verstappen|rimac drag race|mcmurtry drag racing","3753131","159230","0","10443","https://i.ytimg.com/vi/PCzCqqVGQYE/default.jpg","False","False","Thanks to everyone for joining us for this race: - Red Bull: @redbullracing - Rimac: https://www.instagram.com/rimac_automobili/- McMurtry: https://www.instagram.com/mcmurtryautomotive/Get ready for the most exciting drag race in carwow history! We’ve got the World Championship-winning Red Bull RB8 going up against the 1,914hp Rimac Nevera and the Goodwood Hillclimb record-holding McMurtry Spéirling!So let’s see how these marvellous machines compare. Starting with the Rimac, it’s equipped with four electric motors that can produce an eye-watering 1,914hp and 2,360Nm of torque. It’s packing a 120kWh battery pack, so as a result it’s pretty heavy, tipping the scales at around 2,300kg. And as you can imagine, all of that power doesn’t come cheap, with the Nevera costing around £2,000,000! Alongside it we have the McMurtry. This single-seater EV is a whole lot lighter than the Rimac, weighing in at just 1,000kg. It’s also equipped with two electric motors that produce around 1,000hp, while also packing an incredible fan system that helps to generate 2,000kg of downforce! As a result, it can shoot off from the line like nothing you’ve ever seen before! But there’s a catch - it’s limited to a top speed of only 150mph...Then finally we have the F1 car, driven by Red Bull’s reserve driver, Liam Lawson. He’s driving Sebastian Vettel’s Championship-winning RB8, which is equipped with a 2.4-litre V8 that can produce 800hp. It’s easily the lightest car here, at around 700kg, and all power is sent to the rear wheels only. So it’s an absolutely incredible line-up, but will electric power triumph?! Or will the F1 car prove victorious? There’s only one way to find out for sure… LET’S RACE!McMurtry Spéirling review & 1/4-mile: https://bit.ly/-McMurtry-Speirling-ReviewSell your car with carwow: https://bit.ly/Buy-Sell-WOW"
"YaGj6oT7OJ8","New York Jets vs. Cleveland Browns Game Highlights | 2023 Hall of Fame Game","2023-08-04T03:41:41Z","UCDVYQ4Zhbm3S2dlz7P1GBDg","NFL","17","23.09.08","Cleveland Browns|New York Jets|New York Jets vs. Cleveland Browns","2011344","25772","0","2687","https://i.ytimg.com/vi/YaGj6oT7OJ8/default.jpg","False","False","New York Jets vs. Cleveland Browns - Highlights | 2023 Preseason HOF Game 0, 08/04/2023Check out our other channels:NFL Mundo https://www.youtube.com/mundonflNFL Brasil https://www.youtube.com/c/NFLBrasilOficialNFL UK https://www.youtube.com/channel/UCVe0dAja_vZCmvfHXjtdRQA NFL Fantasy Football https://www.youtube.com/nflfantasyfootballNFL Play Football https://www.youtube.com/playfootballNFL Throwback http://www.youtube.com/nflvaultNFL Films http://www.youtube.com/nflfilmsNFL Network http://www.youtube.com/nflnetwork#NFL #Football #AmericanFootball"
"yDEoOgaav6c","Cash Has 1,000,000 Hearts in Minecraft","2023-08-06T15:00:46Z","UC0eLBYhxW9HC0P9PXQ73mpQ","Cash","24","23.09.08","Cash|Nico|Nico and Cash|Cash and Nico|Minecraft|Minecraft mod|family friendly|kid friendly|Cash Has 1000000 Hearts in Minecraft","1090679","12914","0","899","https://i.ytimg.com/vi/yDEoOgaav6c/default.jpg","False","False","Today, Cash has 1,000,000 Hearts in Minecraft! And he's going to have to find a way to get rid of them all!Socials: https://solo.to/cashtv#Minecraft #MinecraftMod #Cash #NicoAndCash"
"Hs1-RmL8L2w","I Was In A Mr. Beast Video??","2023-08-04T22:52:25Z","UCGRryxFxjXbVAtBPE9EbyMg","Joe Bartolozzi","24","23.09.08","joebartolozzi|react","874744","38394","0","1889","https://i.ytimg.com/vi/Hs1-RmL8L2w/default.jpg","False","False","OG Vid: @MrBeast ☆Socials:➥ Gaming Channel: https://www.youtube.com/@JoeBartGames➥Twitch: https://www.twitch.tv/joe_bartolozzi➥Instagram: https://www.instagram.com/joe.bartolozzi/?hl=en➥TikTok:https://www.tiktok.com/@joe.bartolozzi?lang=en ➥Twitter: https://twitter.com/joebartolozzi_?lang=en☆Discord:➥ https://discord.gg/VsgvK459NZi"
"S_XmtrEEfhE","We Built The World's Largest Blender","2023-08-04T22:00:24Z","UC5f5IV0Bf79YLp_p9nfInRA","How Ridiculous","17","23.09.08","how ridiculous|rexy|44club","1749943","57037","0","4135","https://i.ytimg.com/vi/S_XmtrEEfhE/default.jpg","False","False","Buy Blended Stuff ➤ http://bit.ly/HRMerchStoreBusiness Inquiries ➤ howridiculous@delkatalents.comMemberships ➤  Get bonus YouTube videos, Q&A livestreams, merch discount codes + more! http://bit.ly/HRmembershipsFollow us:Instagram ➤ https://www.instagram.com/howridiculousFacebook ➤ https://www.facebook.com/howridiculousTikTok     ➤ https://www.TikTok.com/@howridiculousTwitter     ➤ https://www.twitter.com/howridiculousDiscord   ➤ https://discord.gg/MWmqCEvjeJWhat's the 44 Club? https://howridiculous.org/pages/44-clubMusic used with permission and licensed to How Ridiculous by Dream Records LLC | Sync RoyaltyWe are passionate about seeing children released from poverty and we would love you to consider sponsoring a child with Compassion: http://cmpsn.co/howridiculous"
"gjeHKIZA3Tw","The Earth Alone - Part 2","2023-08-05T15:00:09Z","UCQF0f62JXnfFSxKDmN8SDUg","SolarBalls","27","23.09.08","solarballs|solarball|planetball|planetballs|cosmos|scifi|sci fi|space|galaxy|solar system|animation|fun|comedy|space animation|cartoon|shut up cartoons planets|shut up planet cartoon|spaceball|spaceballs|space balls|earth|moon|earth without a moon|what if the moon leaves|what if the moon disappears|moon disappears","575327","23960","0","4002","https://i.ytimg.com/vi/gjeHKIZA3Tw/default.jpg","False","False","The Earth is now completely alone! Can it still sustain life? Will the Earthlings survive long enough?PART 1: https://www.youtube.com/watch?v=-tz6qlFQ21cWatch The Entire SolarBalls Show (for free!): https://www.youtube.com/watch?v=NtnMVC9fnQA&list=PL5w2zEEHyu9diwutPVgkzEuARUt_sGkRM🏆 Get early access to episodes, perks, & support the future of SolarBalls on Patreon! 🏆➔ https://www.patreon.com/SolarBalls🌎 Become a Space Adventurer by buying your space gear! 🌎➔ https://solarballs.storeWelcome to SolarBalls! Your planetball / spaceballs channel filled with fun, entertaining animations that also help you learn about the solar system, and the universe. If you like space animations and comedy - then this channel is for you!To partner with us to VO SolarBalls in your own language, click:shorturl.at/ikS19And... If you're a fellow YouTuber, needing production help, check our our agency: https://www.nowcreatives.com/services#solarballs #planetball #planetballs #spaceballs #countryball #countryballs #polandball #polandballs #space #spaceball #spacex #nasa #starwars #startrek #scifi #sun #solarsystem #cartoon"
"fqia2YHB1Uw","We 3D Printed Our Farts: A Journey Through Human Creativity","2023-08-05T10:00:24Z","UCbochVIwBCzJb9I2lLGXGjQ","Rhett & Link","24","23.09.08","rhett and link|rhettandlink|rhett & link|rhett&link|rhett|rett|mclaughlin|link|linc|neal|good mythical morning|goodmythicalmorning|mythical|mythicality|comedy|duo|commercial|kings|music|videos|skits|weekly|vlogs","373419","31821","0","2764","https://i.ytimg.com/vi/fqia2YHB1Uw/default.jpg","False","False","What happens when we write a song and then pass it through a chain of different talented artists…and even our own bodies? Some uniquely human and delightfully weird stuff. Chef: Diego Argoti https//www.instagram.com/eatpoltergeistPainter: Colby Meagle-Dunn (https://www.colbyann.art)Musician: Brian Kennedy (https://www.BrianKennnedy.me)Dancer: Aliya Kerim and Post Malone as “Post Malone” (https://www.postmalone.com)Watch the behind the scenes on the Mythical Society!We Try To Fart (available for 3rd Degree) https://www.mythicalsociety.com/content/we-try-to-fartYou can 3D print Rhett & Link’s (f)art! Get the free file at https://mythical.com/collections/new-arrivals/products/3d-fart-fileSubscribe to Rhett & Link: https://www.youtube.com/rhettandlink?sub_confirmation=1Click the bell icon so you'll know when we add a new video!If you enjoyed this video, chances are you’ll love our weekly podcast, Ear Biscuits: https://applepodcasts.com/earbiscuitsWatch Good Mythical Morning, our daily comedy show, every weekday at http://youtube.com/goodmythicalmorningCheck out Sporked, Mythical's new website dedicated to helping you find the best food on the shelves! - http://www.sporked.comGet a copy of our novel, The Lost Causes of Bleak Creek @ http://www.bleakcreek.comPick up official Rhett & Link, GMM, and Mythical merch at https://mythical.comand https://www.amazon.com/mythicalJoin the Mythical Society: https://www.mythicalsociety.comFollow Mythical:Instagram: https://instagram.com/mythicalFacebook: https://facebook.com/mythicalTwitter: https://twitter.com/mythicalWebsite: https://mythical.comFollow Us:Rhett's Instagram: https://www.instagram.com/rhettmcRhett's Twitter: https://twitter.com/rhettmcLink's Instagram: https://www.instagram.com/linknealLink's Twitter: https://twitter.com/linknealCheck Out Our Other Mythical Channels:Good Mythical Morning: https://youtube.com/goodmythicalmorningMythical Kitchen: https://youtube.com/mythicalkitchenGood Mythical MORE: https://youtube.com/goodmythicalmoreWant to send us something? https://mythical.com/contactSnail Mail:PO Box 6578Burbank, CA 91510"
"bt9IxsaRgtM","Day 2 Individuals & Teams — 2023 CrossFit Games","2023-08-04T22:41:33Z","UCRs1pHnES3QDdh43xbjOmzw","CrossFit Games","17","23.09.08","Functional Fitness|Fitness|Functional|CrossFit|The CrossFit Games|The Sport of Fitness|Forging Elite Fitness|Sports","1425487","5670","0","213","https://i.ytimg.com/vi/bt9IxsaRgtM/default.jpg","False","False","Welcome to Day 2 of the 2023 NOBULL CrossFit Games!Chapters00:00-00:38 Intro00:38-2:45 Pre-Show 02:45-21:01 Team Test 3 Heat 121:01-40:13 Team Test 3 Heat 240:13-1:00:15 Team Test 3 Heat 31:00:15-1:36:53 Team Test 3 Heat 41:36:53-1:58:23 Individual Men Test 4 Heat 11:58:23-2:26:51 Individual Men Test 4 Heat 22:26:51-2:48:36 Individual Women Test 4 Heat 12:48:36-3:30:28 Individual Women Test 4 Heat 23:30:28-4:47:00 Team Test 4 Heat 14:47:00-4:57:57 Individual Men Test 5 Heat 14:57:57-5:08:51 Individual Men Test 5 Heat 25:08:51-5:18:38 Individual Men Test 5 Heat 35:18:38-5:42:19 Individual Men Test 5 Heat 45:42:19-5:53:18 Individual Women Test 5 Heat 15:53:18-6:04:19 Individual Women Test 5 Heat 26:04:19-6:14:45 Individual Women Test 5 Heat 36:14:45-6:42:10 Individual Women Test  Heat 46:42:10-7:01:36 Team Test 5 Heat 17:01:36-7:21:35 Team Test 5 Heat 27:21:35-7:41:32 Team Test 5 Heat 37:41:32-8:03:44 Team Test 5 Heat 4—The CrossFit Games are the ultimate proving grounds for the Fittest Man and Fittest Woman on Earth™ and are world-renowned as the definitive test of fitness. Every year since 2007, fans from around the world have attended the multi-day sporting event, streamed the competition online, or watched on ESPN, CBS, or a wide range of international broadcasts. The international field of play has included athletes from more than 120 countries. The CrossFit Games starts in the qualifying round with 300,000+ athletes competing around the world. Throughout the season the field is whittled down to just 560 athletes.Visit our homepage at → https://cf.games/learnAbout the Games: https://cf.games/about-the-gamesCrossFit is a lifestyle characterized by safe, effective exercise and sound nutrition. Learn more  → https://www.crossfit.com/what-is-crossfit/Find a CrossFit affiliate near you: https://map.crossfit.com/ How to start CrossFit → https://www.crossfit.com/get-startedFind a Gym → https://map.crossfit.com/#CrossFitGames #CrossFit"
