video_id,title,publishedAt,channelId,channelTitle,categoryId,trending_date,tags,view_count,likes,dislikes,comment_count,thumbnail_link,comments_disabled,ratings_disabled,description
"4Q_yqwSEdew","Ehraam-e-Junoon Episode 28 Teaser - 1st Aug 2023 - HAR PAL GEO","2023-08-01T16:45:00Z","UCe9JSDmyqNgA_l2BzGHq1Ug","HAR PAL GEO","24","23.02.08","geo dramas|latest pakistani drama|top pakistani dramas|drama 2023|pakistani drama|latest promo|har pal geo|latest teaser|pakistani dramas|pakistani drama ost|ost drama 2023|पाकिस्तानी सीरियल|पाकिस्तानी ड्रामा|Imran Abbas|Neelam Muneer|Nimra Khan|Mahmood Aslam|Ismat Zaidi|Maira Khan|Zainab Qayoom|Ehraam-e-Junoon Episode 28 Teaser|Ehraam-e-Junoon Ost|Ehraam-e-Junoon 28 Teasser|Episode 28 Ehraam-e-Junoon|Ehraam-e-Junoon|1st Aug 2023|#Ep28","2636029","50048","0","1502","https://i.ytimg.com/vi/4Q_yqwSEdew/default.jpg","False","False","Thanks for watching Har Pal Geo. Please click here https://bit.ly/3rCBCYN to Subscribe and hit the bell icon to enjoy Top Pakistani Dramas and satisfy all your entertainment needs. Do you know Har Pal Geo is now available in the US? Share the News. Spread the word.Ehraam-e-Junoon Episode 28 Teaser - 1st Aug 2023 - HAR PAL GEOEhraam-e-Junoon follows the story of a young and immensely beautiful girl named Shanzay, who is filled with pride and stubbornness due to her upper-class upbringing. Shanzay believes that money can buy everything, including happiness. Despite her high standards, Shanzay is yet to find a man who can impress her until she meets Shayan at an event. Shayan is a handsome young man from a middle-class family, who takes up a job as a pizza delivery boy to make ends meet. Shanzay who is immediately drawn to Shayan wants to provide him with a better lifestyle however, Shayan keeps his distance and refuses to accept any of Shanzay’s advances.As the story unfolds, Shanzay and Shayan's paths cross again and again, and Shanzay begins to question her beliefs about love and money. Will Shayan be the one to break through Shanzay's walls of pride and stubbornness, or will she continue to chase after superficial things?The drama serial Ehraam-e-Junoon promises to take viewers on a rollercoaster ride of emotions as it explores the themes of love, pride, and class differences.Writer: Jahanzeb QamarDirector: Syed Ramish RizviProducers: Abdullah Kadwani & Asad QureshiProduction House: 7th Sky EntertainmentCast :Imran Abbas as ShaniNeelam Muneer as ShanzayNimra Khan as SajeelaMahmood Aslam as KamranIsmat Zaidi as KulsoomMaira Khan as NadiyaZainab Qayoom as SamiyaSaqib Sameer as KhawarAadi Khan as JugnuBirjees Farooqui as FarzanaFarah Nadeem as ShakeelaKinza Bukhari as ShaziaMirza Rizwan as Faiq#EhraameJunoon #NeelamMuneer #ImranAbbas"
"tGbKhMg0ijA","AMRIT MAAN - JOURNEY (Official Video) | Mxrci | Latest Punjabi Song 2023 | New Punjabi Song 2023","2023-07-31T04:30:09Z","UCOsyDsO5tIt-VZ1iwjdQmew","Speed Records","10","23.02.08","punjabi|bhangra|punjabi music|punjabi bhangra music|punjabi latest songs|punjabi romantic songs|punjabi sad songs|latest punjabi songs 2023|punjab|desi|speed records|Punjabi Songs|All hit punjabi songs|New punjabi songs 2023|Hit punjabi song|latest punjabi songs mp3 download|journey|journey amrit maan|amrit maan new songs 2023|amrit maan son|amrit maan hit|journey full|global warning album song|global warning all|global warning full|amrit maan new song","2438228","38236","0","1586","https://i.ytimg.com/vi/tGbKhMg0ijA/default.jpg","False","False","Speed Records presents the official video of Journey song from the EP Global Warning sung by Amrit Maan. This heartfelt song depicts his profound respect and love for his parents and the overpowering commitments in his life.  This song gives us an insight into the struggles he faces in his life. An optimistic perspective on the situations encourages him to find solace in life by believing in the Almighty and true companionship.Stream / Download fromApple music - https://tinyurl.com/4uw9xtariTunes - https://tinyurl.com/yk4fbxn5Wynk - https://tinyurl.com/yny3y8m4JioSaavn - https://tinyurl.com/3c7psw4aAmazon - https://tinyurl.com/yc2rt56ySpotify - https://tinyurl.com/5ehh6kwmYouTube music - https://tinyurl.com/af9u4crsResso - https://tinyurl.com/32u9ktshEP - GLOBAL WARNINGSong - JOURNEYSinger / Lyrics / Composer - AMRIT MAANMusic - MxrciCast - Jas Heer, Darshan Sharma, Rehmat Chahal, Sehaj ChahalDirector - Harry ChahalEditor - Guri Bhangu         Color Grading - Onkar SinghMakeup - ShimmerandglosSpecial Thanks - Jay Vincent, Peter Chahal. Tezy Marhar, Mandy Chahal, Gurpal Aujla, Ali A Film by - True Roots ProductionsYouTube Promotions - Pro MediaLabel - Speed RecordsLike || Share || Spread || Love   Enjoy & stay connected with us!► Subscribe to Speed Records : http://bit.ly/SpeedRecords► Like us on Facebook: https://www.facebook.com/SpeedRecords► Follow us on Twitter: https://twitter.com/Speed_Records► Follow us on Instagram: https://instagram.com/speedrecords► Follow on Snapchat : https://www.snapchat.com/add/speedrecordsOldSchoolTieIndia - https://www.youtube.com/channel/UCX6Xc3BjHWAWSTYkoPwxMxSpeed Records HaryanviYoutube: https://bit.ly/2kSrhZKInstagram: https://www.instagram.com/speedharyanviofficial punjabi, bhangra, punjabi music, punjabi bhangra music, punjabi latest songs, punjabi romantic songs, punjabi sad songs, latest punjabi songs 2023, punjab, desi, speed records, Punjabi Songs, All hit punjabi songs, New punjabi songs 2023, All new punjabi songs 2023, All new latest punjabi songs 2023, Hit punjabi song, download latest punjabi songs 2023, latest punjabi songs mp3 download, Speed Records Bhojpuri - Youtube: https://bit.ly/2y8HSezInstagram: https://bit.ly/2xM2WYLSnapchat: https://www.snapchat.com/add/speedbhojpuriOops TV -Oops TV Facebook Link - https://m.facebook.com/oopstvfun/Poon Poon - Snapchat - https://www.snapchat.com/add/poonpoon0001Youtube - http://bitly.com/2hwYOnxFacebook - https://www.facebook.com/officialpoonpoonInstagram - https://instagram.com/poonpoonofficial"
"SFqnYaF6XiU","Escaping Hunters By Fastest Way to Travel in Minecraft","2023-08-01T07:30:08Z","UCxm-rmArnUkNc-Lpf5s6X8g","Adi-Spot","20","23.02.08","Adispot|Adi-Spot|adispot|adispoot|proboiz|technogamerz minecraft","156111","5813","0","144","https://i.ytimg.com/vi/SFqnYaF6XiU/default.jpg","False","False","Escaping Hunters By Fastest Way to Travel in Minecraft▬▬▬▬▬▬▬▬▬▬▬▬▬Special Thanks to :@Mc_Flame Kartik (Hunter 1) Gauri  (Hunter 2)Inspired By : @Snappy and @SilverismeDropper Map https://www.planetminecraft.com/proje...The Map in the video is not for public use ...The Fastest  Way To Travel In Minecraft Shown in video Was concept of ender peal cannon (Void Cannon) by Xcom6000 in SciCarft server The Ender Peal Cannon Shown in video can Give u instant speed of 1000 Blocks Per Secound But It only works with Chunk loaders and in Rare Circumstances... ▬▬▬▬▬▬▬▬▬▬▬▬▬Social Media :Instagram -https://www.instagram.com/adispotxdDiscord - https://discord.gg/adispot▬▬▬▬▬▬▬▬▬▬▬▬▬For business Enquiry :aditya77yt@gmail.com▬▬▬▬▬▬▬▬▬▬▬▬▬Fastest Way to Travel in MinecraftBest Way to Travel in MinecraftMInecraft TravelMinecraft Best way to Travel#minecaft #minecrafthindi"
"PcYOKFFEm2Q","ମାଲ୍ୟଗିରି | Malyagiri | First Glimpse | Odia Movie | Babushaan | Amlan | Sivani | Suryamayee","2023-07-30T05:41:10Z","UC1EuA9aHCO81CRoJiAW5L2A","Amara Muzik Odia","10","23.02.08","Amara Muzik|latest songs|Orissa songs|Ollywood|odia music|amara music|odia|amar music|new odia song 2023|new song odia 2023|odia song 2023|amara odia|Amara Odisha|odia film|Malyagiri|Malyagiri odia movie|Malyagiri new odia movie|odia movie malyagiri|Malyagiri first glimpse|Malyagiri movie|Babushaan mohanty new movie|Babushaan mohanty odia movie|Malyagiri babushaan mohanty|Amlan das new movie|Babushaan mohanty|ମାଲ୍ୟଗିରି|Malyagiri odia full film","396017","25320","0","2222","https://i.ytimg.com/vi/PcYOKFFEm2Q/default.jpg","False","False","#AmaraMuzikOdia #ମାଲ୍ୟଗିରି #Malyagiri #OdiaMovie #BabushaanMohanty He is rogue, he is dangerous. Dont mess with him. Wishing Happy Birthday to our very own SUPERSTAR Babushaan Mohanty.  Malyagiri is directed by Prithvi Raj Pattnaik and Produced by Rinku Rinu Jena.Amara Muzik is the official music label of Malyagiri.Credits Movie Name : Malyagiri Starring : Babushaan Mohanty, Amlan Das, Sivani Sangita and SuryamayeeDirector : Prithvi Raj PattnaikMusic : Gaurav Anand Teaser BGM : Abhishek Panigrahi Movie BGM : Nabs and Saroj Mixing and Mastering :  Somesh SatpathyDirector Of Photography : Rudrakanta SinghSound Design : Abhishek Tripathy Editor : Manas Kumar SahooColorist: Biswajit Swain (Gugu)DI Studio: FilmXMotion Gfx: Biswanath PadhiAccoustic Rhythm : Maa Dakhinakali Band ( Dhenkanal) Vocal Phrases : Manas Sahoo, Somesh, Gaurav and Matru Foley and Sound Design : Abhishek TripathyProducer : Rinku Rinu Jena CO - Producer : Pranati Gochhayat and Babushaan MohantyProduction House : Raindrop Pictures and Keeves EntertainementMusic Label : Amara Muzik 🔔 Get alerts when we release any new video. TURN ON THE BELL ICON on the channel! 🔔SUBSCRIBE to Amara Muzik channel for Odia Songs and movie videoshttp://bit.ly/2am9M9EContact Us:info@amaramuzik.inConnect with us on ♦ Facebook: https://www.facebook.com/AmaraMuzik♦ Instagram: https://www.instagram.com/amaramuzik♦ Twitter: https://twitter.com/AmaraMuzik​© Amara Muzik 2023* ANTI-PIRACY WARNING *This content is Copyright to Amara Muzik. Any unauthorized reproduction, redistribution or re-upload is strictly prohibited of this material. Legal action will be taken against those who violate the copyright of the following material presented!Odia | Odia Movie | Ollywood | Odisha | Amara Muzik | Amara Muzik Odia | Amara Odisha | Odia Full Film | Amara Odia | ମାଲ୍ୟଗିରି | Malyagiri | Odia Movie Malyagiri | Malyagiri Odia Movie | Malyagiri Babushaan Mohanty | Babushaan Mohanty New Movie | Amlan Das New Movie | Sivani Sangita New Movie | Babushaan Mohanty Odia Movie | Malyagiri New Odia Movie | Malyagiri First Glimpse | Odia Movie Glimpse | Happy Birthday Babushaan Mohanty | Babushaan Mohanty"
"koZWf_VVNLw","Living Like *BARBIE* for 24 Hours 😱 Gone Wrong 🤯 *OMG* Public Reaction","2023-08-01T09:13:00Z","UCoS4iknAwZoOXylPJfoVo8Q","Nilanjana Dhar","24","23.02.08","nilanjana dhar|nil and situ vlogs|nil hearts","117124","9936","0","842","https://i.ytimg.com/vi/koZWf_VVNLw/default.jpg","False","False","#partnership #barbie Don't forget to order your Mamaearth Rosemary Range (Led by Oil) Use my code  nilanjana2023 ” to get 20% Off only on Mamaearth site and App. The product also available on Flipkart, Amazon & Nykaa.Mamaearth - https://bit.ly/3rOQgzj(Use code  nilanjana2023  to get 20% Off)Amazon - https://amzn.to/3YbkRmPFlipkart - https://bit.ly/3DzOBAbNykaa - https://bit.ly/3YdHgjcPurplle - https://bit.ly/3DxYWNdbut if you purchase from their website, they will link your order to a tree they plant...𝐅𝐨𝐫 𝐁𝐮𝐬i𝐧𝐞𝐬𝐬 ✉- tbfofficial.team@gmail.com"
"nONOKnHCflk","JHOOTHA KAUN | Comedy Family Challlenge | Lie Detector Test | Ruchi and Piyush","2023-07-29T08:30:15Z","UC0H6I4rKiHmtceSdTCM-DKQ","Ruchi and Piyush","24","23.02.08","ruchi and piyush show|comedy family|hindi family short movie|Ruchi and Piyush new video|Ruchi and Piyush 2022|Hindi sitcom|Ruchi and Pihu show|Indian family drama","1267029","26013","0","3212","https://i.ytimg.com/vi/nONOKnHCflk/default.jpg","False","False","Aaj ho sabka jooth pakada jaayega!  😲Aaj hum kar Lie Detector family challenge! 👨‍👩‍👧‍👧Jo bolega jhooth usko lagega zor ka jatka! ⚡Toh iss mazedaar video ko end tak zaroor dekhna! 🤗We make family-friendly content, that the whole family can watch and enjoy together.Hope you will support us and share the videos with your loved ones and dear ones.Our Family channel - https://goo.gl/EHTnu3Pihoozz - https://www.youtube.com/@pihoozzRuchi and Piyush - https://bit.ly/2K3cd5OYou can follow us here :Website - https://bit.ly/3EgX4rrIG - https://www.instagram.com/ruchiandpiyush/We are always open to suggestions...Copyright @ Ruchi and Piyush Any unauthorized reproduction of this content (videos/small clips/pictures) in any form will result in immediate action against the concerned video/channel.#ruchiandpiyush"
"YcQewjh16fM","Birthday Gift for Shradha Ma'am - a NEW Personal Channel  | Click here :@shradhaKD","2023-08-01T17:24:28Z","UCmXZxX_qexEZxhb5_vQKPCw","Aman Dhattarwal","24","23.02.08","cbse","181911","12273","0","592","https://i.ytimg.com/vi/YcQewjh16fM/default.jpg","False","False","New Channel of Shradha Ma'am : https://www.youtube.com/channel/UC1XBh-m27kkgwLAwu_SRJBg?sub_confirmation=1Instagram ❤️:https://www.instagram.com/amandhattarwal/"
"5tiMiWRqpgg","शिव चालीसा Shiv Chalisa Full with Lyrics | Lakhbir Singh Lakha | Shiv Bhajan | Bhakti Song | Chalisa","2023-07-31T01:30:08Z","UCdsQsaeI8pQZtgrMmbjGUug","Nova Spiritual India","10","23.02.08","mahadev songs|bholenath song|shiv song|bhole baba song|mahadev song|shiva songs|bhole song|bole baba new song|shiv ji song|bolenath songs|siva song|shiv shankar song|mahadev|shiv bhajan|shiv songs|shiv bhakti song|bhola baba song|shankar song|mahadev bhajan|shankar bhagwan song|bhakti song|shiv chalisa|shiv chalisa with lyrics|shiv chalisa in hindi|shiv chalisa with lyrics in hindi|शिव चालीसा|shiva chalisa|shiv chalisha|mahadev chalisa","134467","1668","0","161","https://i.ytimg.com/vi/5tiMiWRqpgg/default.jpg","False","False","शिव चालीसा Shiv Chalisa Full with Lyrics | Lakhbir Singh Lakha | Shiv Bhajan | Bhakti Song | Chalisa🔔 आप सभी भक्तों से अनुरोध है कि आप @SpiritualIndia चैनल को सब्सक्राइब करें व भजनो का आनंद ले व अन्य भक्तों के साथ Share करें व Like जरूर करेंhttp://bit.ly/NovaSpiritualIndia📱 Listen to Your Favourite Bhakti Songs in Audio & Video, Download the Mobile AppAndroid: http://bit.ly/BhajanBhaktiAppPopular Shiva Videos🙏🏻 Shiv Rudrashtakam - https://youtu.be/pytnhdLUXuU🙏🏻 Shiv Panchakshar Stotra - https://youtu.be/xFvfdjw2eno🙏🏻 Shiv Stuti - Isha Girisha Naresha Paresha - https://youtu.be/ORGCcT2AvOM🙏🏻 Sampurna Mahamrityunjay Mantra - https://youtu.be/BClyRGp692Q🙏🏻 Lingashtakam - https://youtu.be/vlIR42OuP70🙏🏻 Om Namah Shivaya Dhun by Anuradha Paudwal - https://youtu.be/o07HO2w2at4🙏🏻 Shiv Gatha - https://youtu.be/ZNJmFvbmlkICredits:Title: Shiv ChalisaSinger: Lakhbir Singh LakhaConcept: Ashwani PanwarEdit & Gfx : Mind ProLabel: Music NovaSong Lyrics:जय गणेश गिरिजा सुवन मंगल मूल सुजानJai Ganesh Girija Suvan Mangal Mul Sujaanकहत अयोध्यादास तुम देहु अभय वरदानKehat Ayodhyadas Tum Deu Abhay Vardanजय गिरिजा पति दीन दयालाJai Girijapati Deendayalaसदा करत सन्तन प्रतिपालाSada Karat Santan Pratipalaभाल चन्द्रमा सोहत नीकेBhaal Chandrama Sohat Niikeकानन कुण्डल नागफनी के Kaanan Kundal Naagphani Keअंग गौर शिर गंग बहायेAng Gaur Shir Gang Bahayeमुण्डमाल तन छार लगायेMundmaal Tan Chaar Lagayeवस्त्र खाल बाघम्बर सोहेVastra Khaal Baghambar Soheछवि को देख नाग मुनि मोहेChhavi Ko Dekh Naag Muni Moheमैना मातु की ह्वै दुलारीMaina Matu Ki Have Dulariबाम अंग सोहत छवि न्यारीBaam Ang Sohat Chhavi Nyariकर त्रिशूल सोहत छवि भारीKar Trishul Sohat Chhavi Bhariकरत सदा शत्रुन क्षयकारीKarat Sada Shatrun Shayakariनन्दि गणेश सोहै तहँ कैसेNandii Ganesha Sohain Tah Kaiseसागर मध्य कमल हैं जैसेSagar Madhya Kamal Hai Jaiseकार्तिक श्याम और गणराऊKartik Sham Aur Ganrauया छवि को कहि जात न काऊYa Chhavi Ko Kahi Jaat Na Kauदेवन जबहीं जाय पुकाराDevan Jabhi Jaye Pukaraतब ही दुख प्रभु आप निवाराTabhi Dukh Prabhu Aap Nivaraकिया उपद्रव तारक भारीKiya Upadrav Tarak Bhariदेवन सब मिलि तुमहिं जुहारीDevan Sab Mili Tumhi Juhariतुरत षडानन आप पठायउTurat Shadenan Aap Pathayuलवनिमेष महँ मारि गिरायउLava Nimesh Maha Mari Girayuआप जलंधर असुर संहाराAap Jalandhar Asur Sanharaसुयश तुम्हार विदित संसाराSuyesh Tumhaar Vidit Sansaraत्रिपुरासुर सन युद्ध मचाईTripurasur San Yudh Machayiसबहिं कृपा कर लीन बचाईSabhi Kripa Kar Leen Bachayiकिया तपहिं भागीरथ भारीKiya Taphi Bhagirath Bhariपुरब प्रतिज्ञा तसु पुरारी Purab Pratigya Tasu Purariदानिन महं तुम सम कोउ नाहींDaanin Mahe Tum Sam Kou Nahiसेवक अस्तुति करत सदाहींSevak Astuti Karat SadahiVed Mahi Mahima Tav GayiAkath Anadi Bhed Nahi PaayiPrakati Udadhi Manthan Te JwalaJarat Surasur Bhaye VihalaKinhe Daya Tahan Kari SahayiNeelkanth Tab Naam KahayiPujan Ramchandra Jab KinhaJeet Ke Lank Vibhishan DeenhaSahas Kamal Mein Ho Rahe DhaariKinhe Pariksha Tabhi PurariEk Kamal Prabhu Rakheu JoyiKamal Nayan Pujan Chahe SoyiKathin Bhakti Dekhi Prabhu ShankarBhaye Prasan Diye Ichchita VarJai Jai Jai Anant AvinashiKarat Kripa Sab Ke Ghat VasiDusht Sakal Nit Mohi SataveBhramat Raho Mohi Chain Na AaveTrahi Trahi Main Nath PukaroYehi Avasar Mohi Aan UbaroLe Trishul Shatrun Ko MaroSankat Te Mohi Aan UbaroMaatu Pita Bhrata Sab HoiSankat Mein Puchat Nahi KoiSwami Ek Hai Aas TumhariAaye Harhu Mum Sankat BhariDhan Nirdhan Ko Det SadahiJo Koi Janche So Phal PahiAstuti Kehi Vidhi Karo TumhariShamahu Nath Ab Chuk HamariShankar Ko Sankat Ke NashanMangal Karan Vighna VinashanYogi Yati Muni Dhyan LagaveNarad Sharad Shish NavaveinNamo Namo Jai Namo ShivayeSur Brahmadik Paar Na PayeJo Yeh Path Kare Mann LayiTa Par Hot Hai Shambhu SahayiRaniyan Jo Koi Ho AdhikariPath Kare So Pavan HariPutra Hon Kar Ichcha KoyiNishchay Shiv Parsad Tehi HoyiPandit Trayodashi Ko LaaveDhyaan Purvak Hom KaraveTrayodashi Vrat Kare HameshaTann Nahi Take Rahe KaleshaDhup Deep Naivedhya ChadhaveShankar Sammukh Path SunaveJanam Janam Ke Paap NasaveAntdham Shivapur Mein PaveKahat Ayodhya Aas TumhariJaani Sakal Dukh Harhu HamariNitya Nem Kar PratahiPath Karo ChalisTum Meri ManokamanaPurna Karo JagdishJoin Us⦿ YouTube: http://bit.ly/NovaSpiritualIndia⦿ Facebook: https://www.facebook.com/NovaSpiritualIndia⦿ Instagram: https://www.instagram.com/nova.spiritual.india⦿ Android App: http://bit.ly/BhajanBhaktiApp⦿ Website:  https://www.medianova.in#ShivChalisa #LakhbirSinghLakha #ShivBhajan"
"zov6ue0oyrE","Ye to Craziest Meetup Hogaya","2023-07-31T10:30:30Z","UCHDQOZjxuSm0-LgLQtMeCqw","Dimple Malhan Vlogs","22","23.02.08","Dimple malhan vlogs|Family vlogs|Triggered insaan|Nischay Malhan shorts|Fukra insaan|Wanderer’s hub|Wanderer’s live|Bigg boss|dimplemalhanvlogs|dimple malhan|fukra insaan|big boss|bigboss ott|fukrainsaan bigboss|nischay|nischay malhan|live insaan|abhishek malhan|vlogs|family vlogs|wandrers hub|salman khan|bigboss salman khan|dimple malhan vlog|Salman khan weekend ka var|weekend ka var|fukrainsaan salman khan|fukrainsaan weekendkavar","2997704","206532","0","7059","https://i.ytimg.com/vi/zov6ue0oyrE/default.jpg","False","False","Ye to Craziest Meetup Hogaya"
"q_s-N1dEnYo","Sabke Liye Gifts 🎁 Khush Hogye","2023-07-31T02:30:19Z","UCjvgGbPPn-FgYeguc5nxG4A","Sourav Joshi Vlogs","22","23.02.08","dubai vlogs|traveling to dubai|sourav joshi|sourav joshi vlogs|travel vlogs|family vlogs|toys|action figers|spider man|piyush joshi|piyush joshi vlogs|thar vlog|offroading with thar|Highway Pe Accident|fortuner ka accident|fortuner accident video|highway accident|highway accident video","4052030","313349","0","9148","https://i.ytimg.com/vi/q_s-N1dEnYo/default.jpg","False","False","http://www.instagram.com/the_shoe_factory00Follow me on Instagram- https://www.instagram.com/souravjoshivlogs/?hl=en I hope you enjoyed this videohit likes.And do subscribe to my channelThank you so much for watchinggod bless you all.lots of  ❤️( For Collaboration - officialsouravjoshivlogs@gmail.com"
"P1BSEd1Wr8I","Ehraam-e-Junoon Episode 26 - [Eng Sub] - Digitally Presented by Jhalak Beauty Cream - 31st July 2023","2023-07-31T16:00:11Z","UCe9JSDmyqNgA_l2BzGHq1Ug","HAR PAL GEO","24","23.02.08","geo dramas|latest pakistani drama|top pakistani dramas|drama 2023|pakistani drama|latest promo|har pal geo|latest teaser|pakistani dramas|pakistani drama ost|ost drama 2023|पाकिस्तानी सीरियल|पाकिस्तानी ड्रामा|Imran Abbas|Neelam Muneer|Nimra Khan|Mahmood Aslam|Ismat Zaidi|Maira Khan|Zainab Qayoom|Saqib Sameer|Ehraam-e-Junoon Episode 26|Ehraam-e-Junoon Ost|Ehraam-e-Junoon 26|Ehraam-e-Junoon|31st July 2023|#Ep26|ahram e junoon episode 26","8325848","165955","0","4814","https://i.ytimg.com/vi/P1BSEd1Wr8I/default.jpg","False","False","Thanks for watching Har Pal Geo. Please click here https://bit.ly/3rCBCYN to Subscribe and hit the bell icon to enjoy Top Pakistani Dramas and satisfy all your entertainment needs. Do you know Har Pal Geo is now available in the US? Share the News. Spread the word.Ehraam-e-Junoon Episode 26 - [Eng Sub] - Neelam Muneer - Imran Abbas - Digitally Presented by Jhalak Beauty Cream - 31st July 2023 - HAR PAL GEOEhraam-e-Junoon Digitally Digitally Presented by Jhalak Beauty CreamEhraam-e-Junoon follows the story of a young and immensely beautiful girl named Shanzay, who is filled with pride and stubbornness due to her upper-class upbringing. Shanzay believes that money can buy everything, including happiness. Despite her high standards, Shanzay is yet to find a man who can impress her until she meets Shayan at an event. Shayan is a handsome young man from a middle-class family, who takes up a job as a pizza delivery boy to make ends meet. Shanzay who is immediately drawn to Shayan wants to provide him with a better lifestyle however, Shayan keeps his distance and refuses to accept any of Shanzay’s advances.As the story unfolds, Shanzay and Shayan's paths cross again and again, and Shanzay begins to question her beliefs about love and money. Will Shayan be the one to break through Shanzay's walls of pride and stubbornness, or will she continue to chase after superficial things?The drama serial Ehraam-e-Junoon promises to take viewers on a rollercoaster ride of emotions as it explores the themes of love, pride, and class differences.Writer: Jahanzeb QamarDirector: Syed Ramish RizviProducers: Abdullah Kadwani & Asad QureshiProduction House: 7th Sky EntertainmentCast :Imran Abbas as ShaniNeelam Muneer as ShanzayNimra Khan as SajeelaMahmood Aslam as KamranIsmat Zaidi as KulsoomMaira Khan as NadiyaZainab Qayoom as SamiyaSaqib Sameer as KhawarAadi Khan as JugnuBirjees Farooqui as FarzanaFarah Nadeem as ShakeelaKinza Bukhari as ShaziaMirza Rizwan as Faiq#EhraameJunoon #NeelamMuneer #ImranAbbas#JhalakBeautyCream"
"BQttRPJ3-Sk","Cham Cham | @HOMMIEDILLIWALA  | Full Song","2023-08-01T06:53:22Z","UC1KonH1j8WMhc5cT6Bp7NtA","Yo Yo Honey Singh","10","23.02.08","honey singh|yo yo honey singh|bollywood|rap|punjabi rap. hindi rap|most watched artist|latest songs|latest bollywood songs|latest punjabi songs|latest hindi songs|bring me back|bebo|hommie dilliwala|2023|chamcham|new hindi song|cham cham song|New|hip hop india|hommie dilliwala new song|hip-hop song|hommie dilliwala cham cham|viral dance video|new punjabi song|hommie dilliwala latest|underdog|underground hip hop","166784","31382","0","2511","https://i.ytimg.com/vi/BQttRPJ3-Sk/default.jpg","False","False","Yo Yo Honey Singh brings to you one more dedication to our hood ( WEST DILLI) #ChamCham  by @hommiedilliwala Singer: Hommie Dilliwala Music: Hommie Dilliwala Lyrics: Hommie DilliwalaMix & Master: Hommie DilliwalaDirected by Manil Kandwal DOP: Vaibhav YadavDigital Strategy & Marketing : Rajdeep Mayer - RDM MediaDistribution : Ingrooves IndiaLine Producer: Raj Rahul, Manoj biduriAssit. Line Producer: Sarthak NautiyalStills On Set: Anshuman PokhriyalBTS: Sarthak Nautiyal Stylist: Akanksha neogi & Sandra KuriakoseHair: ArslanMakeup: Shristhi Dancers: Lil A, Avinash, Vivek Nainwal Special Thanks to Dhruv.MovProject Management: Nikunj Khanna"
