video_id,title,publishedAt,channelId,channelTitle,categoryId,trending_date,tags,view_count,likes,dislikes,comment_count,thumbnail_link,comments_disabled,ratings_disabled,description
"rCdiqO0IVDs","Stray Kids『Super Bowl -Japanese ver.-』Music Video Teaser","2023-08-07T15:00:44Z","UCXhj2pPWvONXmvgHX5wllCA","Stray Kids Japan Official YouTube","10","23.09.08","Stray Kids|SKZ|ストレイキッズ|スキズ|스트레이키즈|스키즈|k-pop","798948","182296","0","4817","https://i.ytimg.com/vi/rCdiqO0IVDs/default.jpg","False","False","■2023年9月6日(水) ReleaseJAPAN 1st EP『Social Path (feat. LiSA) / Super Bowl -Japanese ver.-』特設サイト：https://www.straykidsjapan.com/japan_1st_ep/ご予約はこちら：https://straykids.lnk.to/KEIy08■Stray Kids Japan Official Site : https://www.straykidsjapan.com■Twitter : Japan Official Twitter : https://twitter.com/stray_kids_jp■Instagram : Japan Official Instagram : https://www.instagram.com/straykids_official_jp/■TikTok : Japan Official TikTok : https://www.tiktok.com/@straykids_japan■Stray Kids Japan Official YouTube : https://www.youtube.com/channel/UCXhj2pPWvONXmvgHX5wllCA■Stray Kids Japan Official FANCLUB : https://skz-stayjapan.com/s/n104/page/about_main■2023年9月6日(水) ReleaseJAPAN 1st EP『Social Path (feat. LiSA) / Super Bowl -Japanese ver.-』初回生産限定盤A : CD＋Blu-ray ￥3,500 / ESCL-5870～5871＊24P PHOTO BOOK (Type A)＊オリジナルジャケット・トールケースサイズデジパック仕様＊シリアルナンバー2口封入＊フォトカードA封入 (メンバー別全16種より2枚ランダム封入)＊オリジナルステッカーA (メンバー別全8種より1枚ランダム封入)＊Blu-ray 収録内容・Jacket Shooting Making Movie・「Social Path (feat. LiSA) 」 Recording Making Movie・「Super Bowl -Japanese ver.-」 Music Video・「Super Bowl -Japanese ver.-」 Music Video Making Movie・「THE SOUND」 Music Video・「THE SOUND」 Music Video Making Movie初回生産限定盤B : CD＋スペシャルZINE ￥2,500 / ESCL-5872～5873＊20P PHOTO BOOK (Type B)＊オリジナルジャケット・トールケースサイズデジパック仕様＊シリアルナンバー1口封入＊フォトカードB封入 (メンバー別全8種より1枚ランダム封入)＊オリジナルステッカーB (メンバー別全8種より1枚ランダム封入)＊スペシャルZINE (20P ※メンバー手書きメッセージ付)通常盤 (初回仕様) : CD Only ￥1,600 / ESCL-5874＊フォトカードC封入 (メンバー別全8種より1枚ランダム封入)　※初回仕様のみ封入＊シリアルナンバー1口封入　※初回仕様のみ封入【FANCLUB会員限定盤】　8形態※Stray Kids OFFICIAL FANCLUB「STAY JAPAN」または「STAY JAPAN MOBILE」会員限定(完全受注生産限定商品となります)※各形態Blu-rayの収録内容が異なります。FANCLUB会員限定盤 (Bang Chan盤) : CD＋Blu-ray ￥2,300 (税込) / ESC8-150～151＊スペシャル両面フォトカード封入(バンチャン絵柄全2種より1枚ランダム封入)＊ブックレットサイズオリジナルカード封入(バンチャン絵柄３枚封入)＊Blu-ray 収録内容・＜Special Video ｢There｣ From Stray Kids in JAPAN＞・＜Special Video ｢There｣ From Stray Kids in JAPAN＞ Making Movie (Bang Chan ver.)FANCLUB会員限定盤 (Lee Know盤) : CD＋Blu-ray ￥2,300 (税込) / ESC8-152～153＊スペシャル両面フォトカード封入(リノ絵柄全2種より1枚ランダム封入)＊ブックレットサイズオリジナルカード封入(リノ絵柄３枚封入)＊Blu-ray 収録内容・＜Special Video ｢There｣ From Stray Kids in JAPAN＞・＜Special Video ｢There｣ From Stray Kids in JAPAN＞ Making Movie (Lee Know ver.)FANCLUB会員限定盤 (Changbin盤) : CD＋Blu-ray ￥2,300 (税込) / ESC8-154～155＊スペシャル両面フォトカード封入(チャンビン絵柄全2種より1枚ランダム封入)＊ブックレットサイズオリジナルカード封入(チャンビン絵柄３枚封入)＊Blu-ray 収録内容・＜Special Video ｢There｣ From Stray Kids in JAPAN＞・＜Special Video ｢There｣ From Stray Kids in JAPAN＞ Making Movie (Changbin ver.)FANCLUB会員限定盤 (Hyunjin盤) : CD＋Blu-ray ￥2,300 (税込) / ESC8-156～157＊スペシャル両面フォトカード封入(ヒョンジン絵柄全2種より1枚ランダム封入)＊ブックレットサイズオリジナルカード封入(ヒョンジン絵柄３枚封入)＊Blu-ray 収録内容・＜Special Video ｢There｣ From Stray Kids in JAPAN＞・＜Special Video ｢There｣ From Stray Kids in JAPAN＞ Making Movie (Hyunjin ver.)FANCLUB会員限定盤 (HAN盤) : CD＋Blu-ray ￥2,300 (税込) / ESC8-158～159＊スペシャル両面フォトカード封入(ハン絵柄全2種より1枚ランダム封入)＊ブックレットサイズオリジナルカード封入(ハン絵柄３枚封入)＊Blu-ray 収録内容・＜Special Video ｢There｣ From Stray Kids in JAPAN＞・＜Special Video ｢There｣ From Stray Kids in JAPAN＞ Making Movie (HAN ver.)FANCLUB会員限定盤 (Felix盤) : CD＋Blu-ray ￥2,300 (税込) / ESC8-160～161＊スペシャル両面フォトカード封入(フィリックス絵柄全2種より1枚ランダム封入)＊ブックレットサイズオリジナルカード封入(フィリックス絵柄３枚封入)＊Blu-ray 収録内容・＜Special Video ｢There｣ From Stray Kids in JAPAN＞・＜Special Video ｢There｣ From Stray Kids in JAPAN＞ Making Movie (Felix ver.)FANCLUB会員限定盤 (Seungmin盤) : CD＋Blu-ray ￥2,300 (税込) / ESC8-162～163＊スペシャル両面フォトカード封入(スンミン絵柄全2種より1枚ランダム封入)＊ブックレットサイズオリジナルカード封入(スンミン絵柄３枚封入)＊Blu-ray 収録内容・＜Special Video ｢There｣ From Stray Kids in JAPAN＞・＜Special Video ｢There｣ From Stray Kids in JAPAN＞ Making Movie (Seungimin ver.)FANCLUB会員限定盤 (I.N盤) : CD＋Blu-ray ￥2,300 (税込) / ESC8-164～165＊スペシャル両面フォトカード封入(アイエン絵柄全2種より1枚ランダム封入)＊ブックレットサイズオリジナルカード封入(アイエン絵柄３枚封入)＊Blu-ray 収録内容・＜Special Video ｢There｣ From Stray Kids in JAPAN＞・＜Special Video ｢There｣ From Stray Kids in JAPAN＞ Making Movie (I.N ver.)【収録曲 (全形態共通)】1. Social Path (feat. LiSA)2. Super Bowl - Japanese ver. -3. Butterflies4. Social Path (feat. LiSA) (Instrumental)5. Butterflies (Instrumental)■Stray Kids 5-STAR Dome Tour 2023＜日時/会場＞8月16日(水) 福岡PayPayドームOPEN 16:30 / START 18:308月17日(木) 福岡PayPayドームOPEN 12:30 / START 14:309月2日(土) バンテリンドーム ナゴヤOPEN 16:30 / START 18:309月3日(日) バンテリンドーム ナゴヤOPEN 15:00 / START 17:009月9日(土) 京セラドーム大阪OPEN 15:00 / START 17:009月10日(日) 京セラドーム大阪OPEN 15:00 / START 17:0010月28日(土) 東京ドームOPEN 15:30 / START 17:3010月29日(日) 東京ドームOPEN 15:00 / START 17:00Stray Kids 5-STAR Dome Tour 2023 特設サイトhttps://www.straykidsjapan.com/5stardometour/#StrayKids#スキズ#スキズ_1st_EP#JAPAN_1st_EP#SKZ_SocialPath_featLiSA#SKZ_SuperBowl"
"s8fn8WX6SZM","I Took a Month Break From YouTube... And Nobody Noticed","2023-08-06T20:11:23Z","UCIVSqoHCUN1XdEpiVItxfoQ","aCookieGod","20","23.09.08","acookiegod|a cookie god|a cookie god minecraft|cookie minecraft|minecraft cookie|minecraft cookie god|cookie god|acookiegod series|acookiegod hardcore|minecraft hardcore|hardcore minecraft|minecraft|i took a month break from youtube... and nobody noticed|my month break from youtube|im taking a break from youtube","1274640","58494","0","6063","https://i.ytimg.com/vi/s8fn8WX6SZM/default.jpg","False","False","My Month Break From YouTubethank you for always supporting me even though this isn't your typical minecraft hardcore video, you are awesome :,)----------------------------------------------------------------follow me or no cookies for life• twitter: https://twitter.com/aCookieGod• instagram: https://www.instagram.com/aCookieGod/• discord: https://discord.gg/cookiearmy• twitch: https://www.twitch.tv/cookie• cookie merch: https://acookiegod.shop/----------------------------------------------------------------This MINECRAFT HARDCORE SERIES is inspired by Wadzee, MumboJumbo, Grian, and sandiction! Instead of being the Hermitcraft SMP, this series is similar to a MINECRAFT CHALLENGE video because it is HARDCORE MINECRAFT! This is similar to my 100 DAYS in MINECRAFT HARDCORE but better! :)I Took a Month Break From YouTube... And Nobody Noticed#minecraft #hardcore #but"
"IZckpzAVsqQ","RT TV Reacts to GEAR 5 Luffy! One Piece 1071","2023-08-06T20:45:00Z","UCa9T0y46uK5FzJT-8tLBFeQ","RT TV","24","23.09.08","ONE PIECE|one piece|one piece new episode|one piece luffy|anime|anime reaction|rt tv|STRAW HATS|Kaido|ONE PIECE WANO|luffy vs kaido|Kaido vs luffy|gear 5 luffy|gear 5 luffy reaction|one piece 1071 reaction|op 1071|luffy gear 5 vs kaido|gear 5|one piece reaction|one piece gear 5 reaction|gear 5 mashup reaction|rttv one piece","308448","11814","0","1122","https://i.ytimg.com/vi/IZckpzAVsqQ/default.jpg","False","False","One Piece 1071 ReactionWatch Full & Uncut Reaction to One Piece Episodes here:https://www.patreon.com/rttv_#OnePiece #RTTVWatch More RT TV:Attack on Titan | RT TV https://youtube.com/playlist?list=PL4......KPOP | RT TV: https://youtube.com/playlist?list=PL4...... Cardi B | RT TV: https://youtube.com/playlist?list=PL4......Popular Videos | RT TV: https://youtube.com/playlist?list=PL4......Follow RT TV: Instagram: https://www.instagram.com/_rttv_/​​​​...Twitter: https://twitter.com/RoundTableRT​​​​​...Follow Robcityrt: Instagram: https://www.instagram.com/robcityrt/​...Twitter: https://twitter.com/Robcityrt​​​​​​​​...Follow Patricrt:Instagram: https://www.instagram.com/patricrt/​​...Twitter: https://twitter.com/Patricrt​​​​​​​​​...Follow Wellz_RT: Instagram: https://www.instagram.com/wellz_rt/​​...Twitter: https://twitter.com/Wellz_rt​​​​​​​​​...Follow DCRT: Instagram: https://www.instagram.com/dcz_worldrt...Twitter: https://twitter.com/_dc_rt​​​​​​​​​​​...Follow Wilkins_RT: Instagram: https://www.instagram.com/wilkins_rt/...Twitter: https://twitter.com/Wilkins_rt​​​​​​​...RT TV, TV STATION GIVING Y’ALL EVERY ASPECT OF MEDIA HOMETOWN : RHODE ISLAND Whats Good You Are Now Rockin' With RT TV  Your Only Stop For Everything Happening From New Music , Reactions, News, Challenges, Fashion AND Playlists ! We Appreciate The RT TV Gang / Family Getting Us To 1,000,000 Subs!! Keep Hitting That Subscribe Button and Become Part Of This Notification Gang So You Can Get Alerts For ALL Our New Content!"
"nYF1VirTUYM","JAKE PAUL TAKES DOWN NATE DIAZ 🔥 | Paul vs Diaz Winner Announcement","2023-08-06T05:46:55Z","UCurvRE5fGcdUgCYWgh-BDsg","DAZN Boxing","17","23.09.08","dazn|boxing|highlights|full fight|ko|knockout|top 10|The DAZN Boxing Show|Pelea|Boxeo|Pugile|dazn boxing","1145634","5844","0","2392","https://i.ytimg.com/vi/nYF1VirTUYM/default.jpg","False","False","Jake Paul gets his hand raised with a 10-round, unanimous decision victory over MMA legend Nate Diaz. #PaulDiazSubscribe to our YouTube channel 👉  http://bit.ly/DAZNBoxingYouTubeSubscribe to the DAZN X Series YouTube channel 👉 https://bit.ly/XSeriesYouTube Download the DAZN app now 👉  http://bit.ly/DAZNYoutubeFollow DAZN Boxing On Social Media 👇Twitter: https://www.twitter.com/DAZNBoxingInstagram: https://www.instagram.com/DAZNBoxingFacebook: https://www.facebook.com/DAZNThe DAZN Boxing Show ► https://bit.ly/3EQ70HNDAZN Rewind ► https://bit.ly/32iAaRT#DAZN #DAZNBoxing #Boxing"
"Iv9fx084WnQ","Mortal Kombat 1 Official Reptile, Ashrah, and Havik Reveal Trailer","2023-08-06T23:26:14Z","UCbu2SsF-Or3Rsn3NxqODImw","GameSpot","20","23.09.08","[none]","506627","12381","0","1486","https://i.ytimg.com/vi/Iv9fx084WnQ/default.jpg","False","False","When banished, one can seek redemption or embrace chaos. Check out Reptile, Ashrah, and Havik gameplay in this latest Mortal Kombat 1 trailer.Mortal Kombat 1 releases on September 19th on PlayStation, Xbox, Nintendo Switch and PC.#mortalkombat #mk #gaming"
"rvPLhGl1rJU","Simone Biles -  Floor Exercise  - 2023 Core Hydration Classic -  Senior Women Session 2","2023-08-06T02:07:14Z","UCNCY2HGNRiXPqWejJDaWY8w","USA Gymnastics","17","23.09.08","USA|Gymnastics|Sports|National Team|Routine|Training|Gymnastics Tricks|USA Gymnastics|Gymnast|Gymnastics Tips|Athlete|Motivation|Lessons|Amazing|Gold Medal|Professional|Qualifying","932726","3590","0","359","https://i.ytimg.com/vi/rvPLhGl1rJU/default.jpg","False","False","Score: 14.900 (D: 6.8, E: 8.100)August 5, 2023 - NOW Arena - Chicago, Ill.SUBSCRIBE to the USA Gymnastics YouTube Channel: http://bit.ly/1DOeeZjYou can check out all event PLAYLISTS here: http://bit.ly/1EJjcoAFollow USA Gymnastics on Social Media:- Facebook: http://on.fb.me/1DCkP8V- Twitter: http://bit.ly/1vTcz3n- Instagram: http://bit.ly/1ajqWV0"
"E8bofmx8ELU","Nate Diaz talks Jake Paul defeat: This is not a real fight, this is a boxing competition","2023-08-06T06:41:21Z","UC789h3eqw0H1HqGmIsI26OA","TheMacLife","17","23.09.08","Conor McGregor|UFC|Dana White|MMAFighting|MMAJunkie|TheMacLife|Mac Life|UFC weigh in|ESPN MMA|Jorge Masvidal|Conor McGregor interview|UFC weigh ins|dana white press conference|conor mcgregor highlights|McGregor Poirier|jake paul|Nick Diaz|jon jones|eddie hearn|tyson fury|logan paul|Nate Diaz|Khamzat Chimaev|khamzat|Adesanya|UFC press|Khamzat Diaz|Jon Jones ciryl gane|ciryl gane jon jones|jones gane|jon jones highlights|ufc 285","1683705","15168","0","6618","https://i.ytimg.com/vi/E8bofmx8ELU/default.jpg","False","False","Nate Diaz vs. Jake Paul Post-Fight Press Conference. Check out Nate Diaz at his post fight press conference after losing to Jake Paul.MERCH: https://themaclife.teespring.com/VISIT: http://www.themaclife.comFOLLOW: http://instagram.com/themaclifeofficialFOLLOW: https://twitter.com/TheMaclifeLIKE: http://facebook.com/themaclife"
"34lLUgmrUDo","D&D Story: BREAKING the characters AND PLAYERS","2023-08-06T20:49:24Z","UCfPUcG3oCmXEYgdFuwlFh8w","Dingo Doodles","24","23.09.08","Dungeons and dragons|dnd|animation|foolsgold|animated storytime","242264","31642","0","3811","https://i.ytimg.com/vi/34lLUgmrUDo/default.jpg","False","False","OBOJIMA!!: https://shorturl.at/bpNT6Support us maybe? If you wanna:BACKERKIT: https://bit.ly/3IwZxk4 PLUSHIES: https://bit.ly/3B4cwqy FOOL'S GOLD DISCORD: https://bit.ly/3SCX9Mf FOOL’S GOLD SHIRTS: https://bit.ly/3wxxCMI --------------------------DOWNLOAD FREE DATING SIM DEMO:Itch.io: http://bit.ly/3I3lVTp  Steam: http://bit.ly/3RzXPTl Newsletter: http://bit.ly/3DJ8Uvm  Website: https://cryodon.games/ --------------------------Yes we play 3.5 D&D :D (FG Book in 5e)SOCIAL MEDIA:Felix Twitter:   @FelixIrnich https://twitter.com/FelixIrnich  My Social Media: Twitter: https://twitter.com/DingoDoodles  Tumblr: http://dingodoodles.tumblr.com/  Instagram: https://www.instagram.com/dingosdoodles/ ---------------------------Copyright Free music:1) 'Solace' by Scott Buckley - released under CC-BY 4.0. www.scottbuckley.com.au 2) 'Within Our Nature' by Scott Buckley - released under CC-BY 4.0. www.scottbuckley.com.au 3) 'Hiraeth' by Scott Buckley - released under CC-BY 4.0. www.scottbuckley.com.au 4) 'Reawakening' by Scott Buckley - released under CC-BY 4.0. www.scottbuckley.com.au ----------------------------WELL now you all know what I have been leading up to for all this time…5 years….5 years of knowing this is where it would go…and how it’s truly the end of an era. Hope you all…enjoyed it? Look man there’s a lot of emotions here but I’m happy I could share them with you all. To be honest this entire episode feels like one big love letter to my friends. I really am lucky to have them in my life. Thanks for watching :’3 Stay safe out there!"
"tZYsvAoSNxQ","RIIZE 라이즈 'Siren' Performance Video","2023-08-06T15:00:43Z","UCEf_Bc-KVd7onSeifS3py9g","SMTOWN","10","23.09.08","RIIZE|라이즈|Siren|performance|performance video|choreography|퍼포|퍼포 비디오|신인|SM|보이그룹|SUNGCHAN|SHOTARO|WONBIN|SOHEE|EUNSEOK|SEUNGHAN|ANTON|성찬|쇼타로|원빈|소희|은석|승한|앤톤|싸이렌|RISEandREALIZE|new boy group|boy group|debut|데뷔","1668888","177986","0","10980","https://i.ytimg.com/vi/tZYsvAoSNxQ/default.jpg","False","False","RIIZE's 1st single Get A Guitar will be released on September 4th, 6PM (KST).💿Pre-save & Pre-order https://RIIZE.lnk.to/GetAGuitarSubscribe to RIIZE Official YouTube Channel!https://www.youtube.com/@RIIZE_official?sub_confirmation=1RIIZE official https://youtube.com/@RIIZE_officialhttps://www.riizeofficial.com   https://www.instagram.com/riize_officialhttps://twitter.com/riize_officialhttps://www.facebook.com/RIIZE.officialhttps://www.tiktok.com/@riize_officialhttps://weibo.com/riize#RIIZE #라이즈 #RISEandREALIZE  #GetAGuitar #RIIZE_GetAGuitar #Siren"
"dRWyBwX-WHA","We Can't Fit a Nursery in Our Cabin","2023-08-06T15:00:06Z","UC4laAHbk8VSgmvB47tsd2XQ","Eamon & Bec","19","23.09.08","eamon and bec|emon and bec|bec and eamon|cabin|cabin in the woods|eamon and bec cabin build|cabin renovation|cabin renovation before and after|nursery build|nursery tour|eamon and bec baby|nursery room tour|nursery room ideas|murphy bed|murphy bed diy|murphy bed build|gender reveal|finding out the gender of the baby","542477","30595","0","2069","https://i.ytimg.com/vi/dRWyBwX-WHA/default.jpg","False","False","Now that Bec is halfway through her pregnancy it's time to start thinking about where our little baby will live at our tiny cabin in the woods 🥰 Head to our link to get 5 travel packs and a FREE one-year supply of vitamin D3K2 drops with your first purchase of AG1 https://drinkag1.com/eamonandbecBack in 2020, we bought this rundown cabin in the Canadian wilderness to make a family home and create a cozy home base. We are so proud of how far we've come with this (mostly) DIY project and couldn't be happier to be raising a beautiful new baby out here in the woods. Is there honestly anything better than being in nature, getting your toes in the dirt and swimming in Canadian fresh water lakes? The only dilemma is that this cabin is barely big enough for the the 3 of us.... where will we find a spot for baby's stuff?0:00 nursery build ideas2:44 gathering supplies4:23 murphy bed DIY9:41 thank you Adam 😱12:57 building a change table LOL16:59 building a murphy bed23:40 the girl's build the crib 💪 26:20 bump date 19 weeks27:45 will this fit!??!32:58 room reveal Thanks for watching our DIY nursery room build! See you Sunday for our gender reveal announcement :):)"
"FsHWZ3L4118","I Made Minecraft Fun Again","2023-08-06T14:24:31Z","UCPLMPHT-d8GZOqL_AHJFdQQ","Parrot","20","23.09.08","Minecraft|Minecraft SMP|SMP|Minecraft Server|LifeSteal SMP|School Minecraft Server|School SMP|School Parrot|Parrot|ParrotX2|Dream SMP|TommyInnit|LifeSteal|parrot lifesteal smp|Spoke|minecraft survival|minecraft hardcore|minecraft challenge|minecraft server|HermitCraft|MumboJumbo|Grian|why i broke 100+ bedrock|Here's Why I Made 12240 Minecraft Cakes|Minecraft Hunt|LifeSteal Season 3|1 Heart Minecraft|LifeSteal Season 4|Why I Removed the World","691524","39428","0","2996","https://i.ytimg.com/vi/FsHWZ3L4118/default.jpg","False","False","What Makes Minecraft Fun? I've asked myself this question for a while, and I still haven't figured out the answer. But, I'm gonna change that. I'm not leaving Minecraft until I Make Minecraft Fun Again. Discord: https://discord.gg/VeVDgNgv8VLike ParrotX2 and his LifeSteal SMP Series where he broke bedrock or blew up 2000 TNT. Not Tubbo / TommyInnit / or any other Dream SMP member. This is a new and original Minecraft idea like HermitCraft or LastLife with Grian and MumboJumbo. Survival is harder than Hardcore Minecraft because PVP is on. A Minecraft video made by Parrot or ParrotX2 on other platforms! Enjoy! Thanks to Slatcho for the help editing: https://linktr.ee/slatcho?utm_source=linktree_admin_share"
"sDEUU-3_rec","Guess The Secret NBA Player","2023-08-05T21:03:00Z","UCQIUhhcmXsu6cN6n3y9-Pww","Jesser","17","23.09.08","jesser|guess the pro|guess the|guess that|guess the pro basketball player|guess that pro|basketball player|basketball|fake vs pro|guess that nba player|guess the beta squad|guess that jubilee|guess the nba player|guess the secret nba player|nba","1602041","66881","0","1415","https://i.ytimg.com/vi/sDEUU-3_rec/default.jpg","False","False","6 basketball players are all claiming to be in the NBA, but only one is telling the truth... Can you figure out who the secret NBA player is?Be sure to follow @OBLHoops on all social media platforms! #RulerOfTheCourtGuess The Pro Basketball Player IRL► https://youtu.be/kQOE7xb8pqwI Spent 100 Hours with NBA Players► https://youtu.be/6K_ECacjL6IBucketsquad Apparel - https://bucketsquad.com/★ Follow me on social media @Jesser ★●Instagram https://instagram.com/jesser●Twitter https://twitter.com/jesser#BucketSquad"
"PHxKhpFUOuo","Starship Super Heavy Static Fire","2023-08-06T19:15:02Z","UCtI0Hodo5o5dUb67FeUjDeA","SpaceX","28","23.09.08","SpaceX|Space|Starship|Super Heavy|Mars|Starbase","530848","28874","0","1479","https://i.ytimg.com/vi/PHxKhpFUOuo/default.jpg","False","False","Live views of Starship Super Heavy Booster 9 static fire. Stream will begin a few minutes before ignition. As is the case with all developmental testing, this schedule is dynamic and likely to change, so be sure to stay tuned to our social media channels for updates."
"5LMe9llN_9s","Reigns vs. Uso - Tribal Combat for Undisputed WWE Universal Championship: SummerSlam 2023 Highlights","2023-08-06T05:22:08Z","UCJ5v_MCY6GNUBTO8-D3XoAg","WWE","17","23.09.08","Jey Uso|Jimmy Uso|Roman Reigns|Solo Sikoa|The Bloodline|superstars|world wrestling entertainment|wrestle|wrestler|wrestling|wwe|wwe 2023|مصارعه|कुश्ती|डब्लू डब्लू ई|पहलवान|मैच|व्यावसायिक कुश्ती|सुपरस्टार|SummerSlam 2023|WWE SummerSlam|ss|ss 2023|SummerSlam peacock|SummerSlam wwe network|SummerSlam match|SummerSlam highlight|SummerSlam clip|SummerSlam watch|summerslam detroit|Tribal combat|Roman Reigns vs Jey Uso","2937947","56499","0","3662","https://i.ytimg.com/vi/5LMe9llN_9s/default.jpg","False","False","The Tribal Chiefdom is on the line as “The Tribal Chief” Roman Reigns defends the Undisputed WWE Universal Championship against “The Real Chief” Jey Uso in Tribal Combat, presented by Rocket Mortgage and C4. Catch WWE action on Peacock, WWE Network, FOX, USA Network, Sony India, and more. #SummerSlamStream WWE on Peacock https://pck.tv/3ZTjVE7 in the U.S. and on WWE Network http://wwe.yt/wwenetwork everywhere else---------------------------------------------------------------------Follow WWE for more exciting action! - Subscribe to WWE on YouTube: http://wwe.yt/---------------------------------------------------------------------Check out WWE.com for news and updates: http://goo.gl/akf0J4Watch WWE on Sony in India: http://www.wwe.com/SonySportsNetworkWatch WWE on Disney+ Hotstar in Indonesia: http://www.wwe.com/hotstarWatch WWE on Shahid: http://www.wwe.com/yt-shahidFind the latest Superstar gear at WWEShop: http://shop.wwe.com---------------------------------------------Check out these other channels!---------------------------------------------UpUpDownDown: https://www.youtube.com/upupdowndownCeltic Warrior Workouts: https://www.youtube.com/@CelticWarriorWorkoutsWWE Music: https://www.youtube.com/wwemusic------------------------------------WWE on Social Media------------------------------------Twitter: https://twitter.com/wweFacebook: https://www.facebook.com/wweInstagram: https://www.instagram.com/wwe/TikTok: https://www.tiktok.com/@wweGiphy: https://giphy.com/wwe------------------------------------"
"cvYOqjOfnhI","Backyard Tour//Zealands 3rd Bday//Thoughts On Divorce","2023-08-06T14:10:29Z","UC4-CH0epzZpD_ARhxCx6LaQ","The LaBrant Fam","22","23.09.08","cole and sav|the labrant fam|labrant fam|the labrant family|youtube the labrant fam|everleigh|cole labrant|posie|savannah|tik tok|family|zealand|sunday","282348","10336","0","0","https://i.ytimg.com/vi/cvYOqjOfnhI/default.jpg","True","False","LaBrant Family July 2023 Vlog Update"
"X4VH98VeYO0","I Built The Most Over The Top Beacon In Minecraft Hardcore","2023-08-05T15:53:55Z","UC_GDu2QH3kp6vJlgEYyqjUA","Kolanii","20","23.09.08","Minecraft|Kolanii|Hardcore|Emerald Beacon|I Built The Most Over The Top Beacon In Minecraft Hardcore","1836070","90160","0","5483","https://i.ytimg.com/vi/X4VH98VeYO0/default.jpg","False","False","I finally have a house in a game about building housesWatch more videos: https://www.youtube.com/c/Kolanii/videosWatch the last video: https://www.youtube.com/watch?v=oQaHPZ4c1QEFollow Me: X: https://twitter.com/kolaniiyt​​Reddit: https://www.reddit.com/user/KolaniiYT​​​I Built The Most Over The Top Beacon In Minecraft Hardcore"
