video_id,title,publishedAt,channelId,channelTitle,categoryId,trending_date,tags,view_count,likes,dislikes,comment_count,thumbnail_link,comments_disabled,ratings_disabled,description
"IvnFb0ti1SA","ON OFFRE 100.000€ DE VOYAGE AUX SQUEEZOS ❤️","2023-07-31T16:16:46Z","UCWeg2Pkate69NFdBeuRFTAw","SQUEEZIE","24","23.02.08","[none]","3291070","309342","0","6990","https://i.ytimg.com/vi/IvnFb0ti1SA/default.jpg","False","False","Merci à Revolut d'avoir sponsorisé cette vidéo. Téléchargez REVOLUT gratuitement pour obtenir 20 euros et participer au tirage au sort pour gagner 1000 euros : https://revolut.onelink.me/z4lF/squeezieOn se retrouve le 26 Août ☀️Retrouvez le shop de Maryne ici : https://www.instagram.com/karmadirladada/?igshid=MzRlODBiNWFlZA%3D%3DRéalisateur : Théo MeunierCadreurs : Lucas Stoll, Augustin TarrouStagiaire image : Cyril GruletIngénieur du Son : Antoine Caracci (KR Sound)Maquilleuse : Kim DesnoyersChef monteur : Clément BirckelMonteurs : Yannick DinayChargée de post-production : Amandine Stagiaire de post-production : Shina BeaufourProductrice Exécutive UNFOLD : Clara Lesage Directrice des productions : Julie PelosoChargée de production : Marie DelvalléeAssistante de production : Valentine PejouxStagiaires de production : Marie Zeller, Marine GuarriguesAdministratrice de production : Tiphaine DemarcheMerci à :Laeticia, Laura, Calvyn, Damien, Jeremy, Julia, Carine, Maryne (@karmadirladada) , Lou, Nicolas, Gregory, Hugo, Assia & HyacinthePLANIPRESSE / KR SOUND / KASA LOGISTIQUE UNFOLD PRODUCTION / 2023"
"FmHZ3o6bdUM","La maison est incroyable ! Fin de l’aventure Bizeneuille ❤️","2023-07-30T08:12:24Z","UCDPK_MTu3uTUFJXRVcTJcEw","Mcfly et Carlito","24","23.02.08","mcfly|carlito|golden moustache|fatshow|badass|dab|j'effectue|le|et|on|appelle|des|gens|au|hasard","3325822","244617","0","5981","https://i.ytimg.com/vi/FmHZ3o6bdUM/default.jpg","False","False","3 ans après l’achat, nous découvrons enfin la maison de Bizeneuille terminée et elle est folle. Le projet le plus long de la chaîne, le plus coûteux, le plus compliqué, mais peut être le plus mémorable. On ne sait même plus comment remercier toutes les équipes qui ont bossé dessus depuis le début, notaire, prod, architectes, ouvriers évidemment etc. mais c’était un travail de titan tant d’un point de technique que juridique ou de gestion globale.Ceci signe notre dernière vidéo du Dimanche, on sera de retour en Septembre avec une nouvelle DA, hâte de vous montrer ça.Merci à  Displate, Mr.Bricolage , Boulanger et Emma nos fidèles partenaires qui nous ont suivis pendant cette aventure de 2 ans. Des promos sur les Displates ici avec le code BIZENEUILLE : https://displate.com/bizeneuille Retrouvez le timelaps ainsi que tous les éléments MrBricolage ici : http://bit.ly/47cEtebLe time laps est dispo ici : https://www.youtube.com/watch?v=v5BGBHpIj5MTous les éléments de la maison fournis par Boulanger  pour vous faire livrer les mêmes ici :  http://www.b.fr/Equipement-Bizeneuille-10% supplémentaire chez Emma pour dormir comme un bébé par ici  avec le code BIZENEUILLE : https://shop.emma.fr/mzJOkCn104Les travaux de la maison ont été réalisés par : Architectes - Camille Delaplace et Laura Montanaro - Teepee ArchitectsArtisan tout corps d'état / Coordination - Rodolpe Secretin - Renova9  ( aka THE GOAT )Ingénieur - Fabrice Djonkep - LCV IngénierieMaçon - Eric Simonutti  - Sarl SimonuttiCharpentier Couvreur - Erwan Mollet  - Sarl CH Couverture Plombier - Patrick Romane - ROMANE ITS ET RENOVATIONElectricien - Samuel Nunfio - teepeeworks Carreleur - Stéphane Dias - SARL DIAS CARRELEURElectricien - Mickaël Baptista - BaptimikaTravaux de menuiserie métallique et serrurerie - Sauveur Carreda -  SARL SFB carredaMenuisiers bois - Jhonatan Ospina, Jeyson Ospina, Diego Rodas - teepeeworksGestion notariale : Maître Pierre-Alain Conil - Cabinet MOREL d'ARLEUXChef OPV-  Florent SabatierOPV Bizeneuille - Daniel MasséChef Opérateur Son - Martin BonamiRégisseur - Yvan BarrayProductrice Exécutive - Clara LesageChargé de production - Louis Rossignol Administratrice de production - Tiphaine DémarcheChargée de projet Fatbros 2.0 - Camille BlondeauAssistante Fatbros 2.0 - Chloé WolfChef monteur - Florian HautekietAssistant Monteur - Jérôme FilletteMixage - Martin BonamiMinia - Moodmaker - Antoine BehaeghelSéquence Planète Rap : Réal - Lucas Peron @lucasppeL’équipe de fou géré par Julio : avecLauCarréRocket, Flacoo, Martel, Adrien Dezeusse, Marvin, Naël , Marc ,YANNOMELIXO vous avez géré les gars. Fanfare - Pascal Raynaud et toute la fanfare municipale de CommentryDanse portugaise - ESTRELAS DO NORTE MONTLUCON pour leurs danses Chant -  Williams & ManisoulBarbecue   Ch Couverture – Erwan Mollet, Arnaud Petitjean & Mathieu BeyrandPresta sur place - Locason MontluçonRemerciements particuliers  : Daniel Collinet et la mairie de BizeneuilleMaitre Pierre-Alain Conil La Croix-Rouge française / Camille Laiguiller et Ingrid FontaineFred Musa / Skyrock LauCarré et son équipeMr.Bricolage de Montluçon ( Mme la gérante vous êtes mieux que tout le monde )Stephanie Sauvaget et Fabrice Jaer les goats de l’immobilier de l’allierLa gare de Vierzon 00:00 Intro8:14  Le jeu eu du klaxon13:20  Mac&Talk 20:00 Arrivée à Bizeneuille22:32 Découverte de la maison39:42 Le café des voisins44:34 Présentation des artisans47:21 Remise des clés55:07 La fête de BizeneuilleRejoignez notre discord officiel : https://discord.gg/mcflyetcarlitoINSTAGRAM★ https://www.instagram.com/rafcarlito★ https://www.instagram.com/levraimcflyTIKTOK@mcflyetcarlitoTWITTER ✔ https://twitter.com/levraimcfly✔ https://twitter.com/raphael_carlier** Règles de l’espace commentaires :- Ecrire dans un français correct (surtout pour Carlito ça)- Écrivez de façon respectueuse - Pas de pubs, de spams du genre « me manque un abonné pour devenir stylé » ou encore « 3500 vues sans passer par Youvues, bravo ! »"
"oYmF4XKSjqk","LE JEU DE LA CONFIANCE ! #4 (avec Théodort)","2023-07-30T09:15:34Z","UCo3i0nUzZjjLuM7VjAVz4zA","Michou","24","23.02.08","[none]","2719617","200395","0","3162","https://i.ytimg.com/vi/oYmF4XKSjqk/default.jpg","False","False","Salut ! Abonne-toi !💜 Follow moi sur Twitch pour ne pas louper les lives : https://www.twitch.tv/michou👨‍💻 Si tu veux voir les rediffs de mes lives mais avec du montage : https://www.youtube.com/@MichouOff💙 Mon Twitter : https://twitter.com/Michoucroute_📸 Mon Insta : https://www.instagram.com/michou/👾 Mon Discord : https://unosial.to/michou/discord👦 Mon Compte Secondaire d'actu : https://michouoff.start.page/et tu connais, code créateur michoucroute dans la boutique Epic Games ;)📧 Adresse mail pro : michou.video.officiel@gmail.comPRODUCTION :• MothaibaPOST-PRODUCTION :• Chef monteur : Bogdan (Wekyt)• Assistant dérusheur/monteur : Alexandre• Mixage et Sound design : Sami • Miniature, assets et étalonnage : Meganini• Animation 2D : Timothey et Spartate• Motion design : Majin"
"vPvCOk8ZQ7s","Clash to the Future | Clash of Clans 11th Anniversary","2023-08-01T08:00:22Z","UCD1Em4q90ZUK2R5HKesszJg","Clash of Clans","20","23.02.08","clash of clans|COC|Clash of Clans Gameplay|Clash of Clans Strategy|Clash of Clans Animation|Clash of Clans Commercial|Clash of Clans Attacks|Clash of Clans Town Hall|Hog Rider|PEKKA|Clan Wars|season challenges|clan war leagues|clash on|clan game|clan games|clash-a-rama|clasharama|clashiversary|11th clashiversary|future warden|future queen|future king|future champion|clash of clans new skins|clash of clans future skins","1502183","39120","0","1570","https://i.ytimg.com/vi/vPvCOk8ZQ7s/default.jpg","False","False","Celebrate 11 years of epic battles, countless Wars & the future of Clash with these Clashiversary skins & challenges!Follow us on our Socials!Twitter ► https://twitter.com/ClashofClans/Instagram ► https://www.instagram.com/clashofclans Facebook ► https://www.facebook.com/ClashofClans TikTok ► https://www.tiktok.com/@clashofclansAttack. Defend. Strategize. Download for free for mobile devices. http://supr.cl/ThisArmyFrom rage-­filled Barbarians with glorious mustaches to pyromaniac wizards, raise your own army and lead your clan to victory! Build your village to fend off raiders, battle against millions of players worldwide, and forge a powerful clan with others to destroy enemy clans.PLEASE NOTE! Clash of Clans is free to download and play, however some game items can also be purchased for real money Also, under our Terms of Service and Privacy Policy, you must be at least 13 years of age to play or download Clash of Clans.A network connection is also required.FEATURES- Build your village into an unbeatable fortress - Raise your own army of Barbarians, Archers, Hog Riders, Wizards, Dragons and other mighty fighters- Battle with players worldwide and take their Trophies- Join together with other players to form the ultimate Clan- Fight against rival Clans in epic Clan Wars - Build 18 unique units with multiple levels of upgrades- Discover your favorite attacking army from countless combinations of troops, spells, Heroes and Clan reinforcements - Defend your village with a multitude of Cannons, Towers, Mortars, Bombs, Traps and Walls- Fight against the Goblin King in a campaign through the realmChief, are you having problems? Visit https://help.supercellsupport.com/clash-of-clans/en/Privacy Policy:https://supercell.com/en/privacy-policy/Terms of Service:https://supercell.com/en/terms-of-service/Parent’s Guide:https://supercell.com/en/parents/#clashofclans #clashiversary #clashtothefuture"
"yDfVDq92Jbk","QUI DE NOUS DEUX ? (en couple...) ft. @TiboInShape","2023-07-31T16:25:07Z","UCIPbzkl1kZ_9Gyuph_FGvzg","Juju Fitcats","24","23.02.08","jujufitcats|tiboinshape|jujufitcats tiboinshape|qui de nous deux|qui de nous deux en couple|jujufitcats tiboinshape qui de nous deux en couple|jujufitcats tiboinshape qui de nous deux|qui de nous deux tag youtube|jujufitcats tiboinshape couple|jujufitcats tiboinshape mariage|jujufitcats tiboinshape tag youtube","362848","25434","0","1029","https://i.ytimg.com/vi/yDfVDq92Jbk/default.jpg","False","False","#quidenousdeux #tiboinshape Qui de nous deux ? (en couple...) ft. @TiboInShape Mon livre SANS FILTRE dispo en précommande ➤ https://bit.ly/3CVv2QFMusique Belle Au Naturel sur toutes les plateformes de streaming ➤ https://smarturl.it/BelleAuNaturelABONNEZ-VOUS A MA CHAÎNE ➤ http://bit.ly/2x0Brfp​​​​​​​​​​​ ➤ DEVENEZ LE MEILLEUR FITCAT !Collection BELLE AU NATUREL ➤ https://jujufitcats.comN'hésitez pas à me suivre sur mes différents réseaux sociaux :- Instagram ➤ https://www.instagram.com/jujufitcats...- Twitter ➤ https://twitter.com/jujufitcats/​​​​​...- Facebook ➤ https://www.facebook.com/jujufitcatsa....- Snapchat ➤ @jujufitcats- TiK TOK ➤ @jujufitcatsMa boîte postale :JUJU FITCATSBP 6005691470 LIMOURSMon adresse e-mail (contacts pros uniquement) ➤ jujufitcatspro@gmail.comMonteur : Lorenzo Urban Miniature : Ornella ZucchiniMusiques : Benoît Ghio Si vous êtes arrivés jusqu'ici, écrivez MAAANGEEER ! dans les commentaires !"
"ezoNXRzOkqQ","The Matriarch (un nouveau Among Us ?) - Rediffusion Squeezie du 26/07","2023-07-31T16:00:33Z","UC7_THngP20pzk5VRHNKDvtg","Squeezie - Rediffusions","20","23.02.08","squeezie rediff|squeezie rediffusion|squeezie matriarch|squeezie matriarche|squeezie soeur|squeezie among us","300790","11628","0","262","https://i.ytimg.com/vi/ezoNXRzOkqQ/default.jpg","False","False","💜 Follow mon Twitch pour ne pas rater mon prochain live : https://twitch.tv/squeezie🔔 ABONNE-TOI : https://bit.ly/3vASgeb🎮 Retrouve tous les best-of sur ma chaîne Gaming : https://bit.ly/2NLgbSC🔥 Télécharge l'extension Squeezie pour ne rater aucun live : https://extensionsqueezie.fr―――⁍ Twitch : https://twitch.tv/squeezie⁍ Twitter : https://twitter.com/xSqueeZie⁍ Twitter² : https://twitter.com/SqueezieTV⁍ Discord : https://discord.gg/Squeezie―――0:00:00 Explications0:02:49 Gameplay"
"RtScC13AgPU","Je jette le PC à Unchained dans la PISCINE ! (rage extrême)","2023-07-31T17:48:32Z","UC2mw5nP_FMpIN8NefBo4gAg","BriceBBrice","24","23.02.08","brice|bricebbrice|unchained|theo|dhm|prank|piscine","223421","9006","0","346","https://i.ytimg.com/vi/RtScC13AgPU/default.jpg","False","False","Salut à tous !On se retrouve pour une nouvelle vidéo ou je prank unchained !Je jette le PC à Unchained dans la PISCINE ! (rage extrême)Avec @Unchainedytb @DHMOFF @Theo18300 Mail contact : brice@drizztagency.frUn maximum de like les gars ! 👍N'oubliez pas ! CODE CRÉATEUR : BRICE📷 Insta : bricebrc_🎮 Discord : https://discordapp.com/invite/e9NZegm🐦 Twitter : https://twitter.com/BriceBBrice_👻 Snap : bricebbrice"
"VEBwLTcpOGE","J’AI ACHETÉ UN VRAI BUNKER (on survit dedans pendant 24H)","2023-07-30T15:25:00Z","UCgvqvBoSHB1ctlyyhoHrGwQ","Amixem","23","23.02.08","amixem|humour|delire","2386500","143778","0","2124","https://i.ytimg.com/vi/VEBwLTcpOGE/default.jpg","False","False","On aménage et on survit dans un bunker pendant 24h, avant qu'un nuage radioactif ne nous atteigne, avec Étienne et Yvan !Collaboration commerciale. Profitez de -10% de réduction sur tout le site avec le code AMIXEM pendant 48h : https://url.rhinoshield.fr/amixem___rhinoshieldLe journal de bord : https://youtu.be/-lGaMe75R5YMa boutique SPACEFOX.shop ! : http://bit.ly/3KskVsUSUIS MOI ICI C'EST BIEN AUSSI : → INSTAGRAM : http://bit.ly/amixeminsta→ TIKTOK : https://bit.ly/AmixemTikTok→ TWITTER :  http://bit.ly/AmixemTwitter→ TWITCH AMIXEM :  http://bit.ly/AmixemTwitch→ SNAPCHAT : amixemsnapResponsable de production : Solène CHUPINChargé de production : Thibaut TROTINRéalisateur plateau : Yann GOYChef opérateur : Théo SAUVIONCadrage : Aloïs MATHEY, Théo SAUVION, Yann GOYMonteur : Arthur DesprèsMiniature : Venosqe⚠ L’abus d’alcool est dangereux pour la santé et à consommer avec modération."
"0bIRwBpBcZQ","ITZY “CAKE” M/V @ITZY","2023-07-31T08:58:09Z","UCaO6TYtlC8U5ttz62hTrZgg","JYP Entertainment","10","23.02.08","JYP Entertainment|JYP|ITZY|있지|イッチ|예지|리아|류진|채령|유나|YEJI|LIA|RYUJIN|CHAERYEONG|YUNA|イェジ|リア|リュジン|チェリョン|ユナ|อิทจี|เยจี|ลีอา|รยูจิน|แชรยอง|ยูนา|ITZY VIDEOS|ITZY LOCO|ITZY BEHIND|MV|ITZY MV|ITZY MUSIC VIEDOS|Teaser|ITZY Teaser|ITZY VLOG|VLOG|IT'z Different|IT'z ICY|IT'z ME|Not Shy|GUESS WHO|CRAZY IN LOVE|DALLA DALLA|ICY|WANNABE|마.피.아.IN THE MORNING|LOCO|SNEAKERS|있지있지|있있|CHESHIRE|체셔|KILLMYDOUBT|BETONME|NoneofMyBusiness|CAKE","7279975","550498","0","61451","https://i.ytimg.com/vi/0bIRwBpBcZQ/default.jpg","False","False","ITZY “CAKE” M/V🎧 TITLE http://kko.to/eoMjL0dgJy💿 ALBUM http://ITZY.lnk.to/KILLMYDOUBT[ITZY Official]▶ https://www.youtube.com/c/ITZY▶ https://www.instagram.com/itzy.all.in.us▶ https://www.tiktok.com/@itzyofficial▶ http://www.twitter.com/ITZYOfficial▶ http://www.facebook.com/OfficialITZY▶ https://www.weibo.com/u/7462077750?is▶ http://ITZY.jype.com▶ http://fans.jype.com/ITZY#ITZY #ITZY_KILLMYDOUBT #ITZY_CAKECopyrights 2023 ⓒ JYP Entertainment. All Rights Reserved"
"Y95OY9nhY9Q","Vous me laissez un message, je réponds !","2023-07-31T16:00:31Z","UCf8Z5wgAN1LU0pReRluNgGg","Cedric Doumbe","17","23.02.08","[none]","115941","5391","0","492","https://i.ytimg.com/vi/Y95OY9nhY9Q/default.jpg","False","False","Heyyy, découvre mon nouveau partenaire Holy ! https://fr.weareholy.com/Cedric/youtube Des boissons énergisantes saines et des Ice tea sans sucre aux goûts et arômes naturels. Je te donne mes codes poto Cédric pour 10% de réduction et Cédric5 pour 5€ de réduction lors de ta 1ère commande !---------Vidéo produite et réalisée par Adjime https://adjime.fr---------Les meilleurs partenaires : Pour choper la collection CEDRIC DOUMBÉ sur Zelys : https://www.zelystore.com/collections…-30% sur tout le site avec le code : Doumbe30 Les meilleurs parfums purs et originaux avec EL NABILhttps://www.el-nabil.com-40% avec le code CEDRIC40 Manger bon et diet avec SEAZONhttps://www.seazon.fr-30% Sur ta première commande avec le code : CedricDoumbe30 Envie de travailler avec le meilleur (sponsors et médias) : workwithcedricdoumbe@gmail.com📷 : instagram.com/cedricdoumbe🐤 : twitter.com/cedricdoumbe👻 : snapchat.com/add/doumced"
"dug56u8NN7g","Marvel Studios’ Loki Season 2 | Official Trailer | Disney+","2023-07-31T13:00:24Z","UCvC4D8onUfXzvjTOM-dBfEA","Marvel Entertainment","24","23.02.08","marvel|comics","10087278","452248","0","17855","https://i.ytimg.com/vi/dug56u8NN7g/default.jpg","False","False","It’s almost time. ⏰ Watch the brand-new trailer for Marvel Studios’ Loki Season 2, an Original series, streaming October 6 on Disney+.► Watch Marvel on Disney+: https://bit.ly/2XyBSIW► Subscribe to Marvel on YouTube: http://bit.ly/WeO3YJFollow Marvel on Twitter: ‪https://twitter.com/marvelLike Marvel on Facebook: ‪https://www.facebook.com/marvelWatch Marvel on Twitch: https://www.twitch.tv/marvelReward your Marvel fandom by joining Marvel Insider!Earn points, then redeem for awesome rewards.Terms and conditions apply. Learn more at https://www.marvel.com/insider?Osocial=YT&CID=MarvelInsiderFor even more news, stay tuned to:Tumblr: ‪http://marvelentertainment.tumblr.com/Instagram: https://www.instagram.com/marvelPinterest: ‪http://pinterest.com/marvelofficialReddit: http://reddit.com/u/marvel-official"
"Dt7VKcs7nKA","L'Histoire secrète (et pas jolie) du Loup Garou de Thiercelieux","2023-07-31T15:30:04Z","UCJoMLNZ-8V3ufnvWKXVzPew","CKanKonJoue","22","23.02.08","[none]","51408","2092","0","96","https://i.ytimg.com/vi/Dt7VKcs7nKA/default.jpg","False","False","Aujourd'hui nous vous faisons découvrir le jeu de société Loup Garou de Thiercelieux. Sachez que cette vidéo est faites en toute indépendance, sans partenariat avec la marque ou les créateurs du jeu.Le jeu et ses extensions sont disponibles dans tous les magasins de jeux proches de chez vous et en ligne.Suivez le compte Instagram, il s'y passe des choses :https://www.instagram.com/ckankonjoue_/Rendez-vous très prochainement pour un nouveau jeu de société ! Abonnez-vous pour ne pas le rater :)Contact pro uniquement : bureau@sherlockm.com"
"s2AP8rqhPiE","Chine : la disparition des milliardaires | ARTE Reportage","2023-07-30T10:00:41Z","UCwI-JbGNsojunnHbFAc0M4Q","ARTE","25","23.02.08","ARTE|Autre|TV|ARTE Reportage|ARTE Documentaire|Chine|Extermination|extermination chine|disparitions|disparition|disparition patrons d'entreprise|reportage|presse chinoise|censure|censure chinoise|PCC|partie communiste chinois|patrons d'entreprises|patrons|entreprises|milliardaires|argent|purge|campagne de purge","544778","4601","0","959","https://i.ytimg.com/vi/s2AP8rqhPiE/default.jpg","False","False","Emblèmes de la Chine nouvelle qui réussit, les millionnaires patrons d'entreprise sont la nouvelle cible d'une vaste campagne de purge qui semble avoir été décidée au plus haut niveau du régime chinois. Selon la presse économique occidentale, plusieurs dizaines de patrons, certains dirigeants les plus grandes entreprises du pays, auraient disparu depuis deux ans. Certaines ONG avancent le chiffre de 400 millionnaires évanouis. Évidemment, aucune donnée officielle n’existe. Nous avions commencé ce reportage avec Hu Kexin. Après avoir fait fortune dans les produits ménagers et agricoles, il a décidé de devenir l'empereur de la boulangerie en Chine.Il a acheté des milliers d'hectares de terres en France afin de produire une farine de qualité et recruté des formateurs français pour ses futurs boulangers chinois. Et puis, un beau jour, M. Hu s’est évaporé. Officiellement, il était désormais très occupé. Dans la presse chinoise, rien n’a filtré sur son sort. Ses partenaires français n'ont plus de ses nouvelles... À New York, dans son appartement à 40 millions de dollars surplombant Central Park, Guo Wangui se présente comme un survivant. Une bonne partie de sa famille a été assassinée en Chine. Il organise désormais la résistance des milliardaires depuis son exil américain. Grâce à son immense fortune, il finance une chaîne YouTube pour prévenir ses frères de richesse et dénoncer le Parti communiste chinois : Le PCC a voulu créer des riches pour développer le pays. Mais maintenant, il a peur de nous, peur du pouvoir que peut donner l'argent, alors il nous fait disparaître. Qui sont ces riches chinois qui disparaissent ?Reportage de 2019Disponible jusqu'au 28/05/2026#ARTE #Chine #économie Abonnez-vous à la chaîne ARTE https://www.youtube.com/channel/UCwI-JbGNsojunnHbFAc0M4Q/?sub_confirmation=1Suivez-nous sur les réseaux !Facebook : http://www.facebook.com/artetvTwitter : http://www.twitter.com/artefrInstagram : https://www.instagram.com/artefr"
"07vgYcfmm48","J'AI PLEURÉ TOUTES LES LARMES DE MON COEUR  - @DarkoCTTG  DIT TOUT À FAUSTINE","2023-07-30T17:00:00Z","UC2FEnXAwwITrsmgNKN-4egA","Safe Zone","24","23.02.08","[none]","240442","8958","0","208","https://i.ytimg.com/vi/07vgYcfmm48/default.jpg","False","False","SAFE ZONE - Faustine rencontre  @DarkoCTTG Pour la première fois, Faustine Bollaert reçoit Darko dans sa Safe Zone. À travers des objets symboliques, le jeune homme se livre comme jamais auparavant.D’origine serbe, Darko est un YouTubeur français découvert dans l'émission de télé-réalité Secret Story.De Mister Camping à ses un million d’abonnés, Darko revient sur son parcours fulgurant. Et le moins que l’on puisse dire, c’est que vous allez être profondément surpris en découvrant les objets qu’il a ramenés à Faustine.Il se confie sans détour sur la pression des réseaux sociaux, sur les limites qu’il a du mal à s’imposer et surtout sur son amour pour ses followers.Vous allez découvrir Darko comme vous ne l’avez jamais vu auparavant. Et sans aucun tabou, il dit absolument tout à Faustine.#safezone #france #interview 00:00 -  Introduction 07:03 - Darko : sa transformation physique 09:17 - Darko : son passage dans Secret Story 15:11 - Darko : son trophée YouTube17:28 - Darko : son objet mystère21:28 - L'enfance de Darko27:14 - Darko : la perte de son meilleur ami32:14 - Darko : sa première vidéo après Secret Story33:36 - Darko : son envie de plaire35:07 - Darko : son devoir d'exemplarité 36:55 - Darko : son engagement contre le harcèlement37:45 - Darko et son concept Vomis ou dis la vérité39:51 - Darko : Louis, son meilleur ami et manager43:39 - Julien : un ancien candidat de Secret Story45:37 - Darko et l'argent 47:16 - Darko : la pression des réseaux sociaux50:29 - Darko et sa relation avec ses abonnés52:25 - Conclusion Retrouvez notre programme :Sur instagram : https://instagram.com/safezone_off?igshid=MzRlODBiNWFlZA==Sur Tiktok : https://www.tiktok.com/@safezone_off?_t=8dlaZomOBTe&_r=1Retrouvez @DarkoCTTGRemerciements à Maisons du Monde pour le décor et à Apple pour l’Ipad"
"VFeOV3D48Ps","Episode 222 : 10 astuces de mer** en cuisine","2023-07-30T14:00:28Z","UCCThUYykrz0TLuPbOVByrcw","Noholito","23","23.02.08","[none]","308768","21020","0","865","https://i.ytimg.com/vi/VFeOV3D48Ps/default.jpg","False","False","J'espère que cet épisode vous aura plu.28 ans d'angoisse : https://amzn.to/3WNEK1h29 ans d'amours chaotiques : https://amzn.to/3jrERkCIls sont disponibles partout ailleurs (Fnac, Leclerc, Cultura etc)J'ai regroupé sur ce lien, tous les objets que j'utilise au quotidien ou pour mes vidéos YouTube : https://www.amazon.fr/shop/noholit_oPour me suivre sur mes réseaux sociaux :Insta : Noholit_oTiktok, Facebook, Twitter : Noholito Snap : jamesou33Pour les vidéos vlog voyage :  Caméra Sony Alpha 7 IV : https://amzn.to/3tNVFnTMicro Sony ICD-TX660 : https://amzn.to/3ERIUikIphone 14 pro max : https://amzn.to/3i1IxZODji Mini 3 Pro : https://amzn.to/3Or3zgHGoPro HERO10 : https://amzn.to/3VeH3JVPour les vidéos chez moi : Caméra Sony Alpha 7 IV : https://amzn.to/3tNVFnTMicro Sony ICD-TX660 : https://amzn.to/3ERIUikLumière : https://amzn.to/3EQulM7Trépieds pour la lumière : https://amzn.to/3goTt37"
"jhpD6x5VOrY","J'ai troll un Noob avec le Léviathan sur Minecraft..","2023-07-30T17:00:34Z","UCDB1PaqiausfXbVI2Jjk0iQ","Ninjaxx","20","23.02.08","minecraft|minecraft ninjaxx|ninjaxx|ninjax","462940","24915","0","1118","https://i.ytimg.com/vi/jhpD6x5VOrY/default.jpg","False","False","✿ Twitch : https://www.twitch.tv/ninjaxxuNino Mssclick : @NinoMssClick ✿ Twitter : https://twitter.com/Ninjaxxu✿ Discord : https://discord.gg/tewqdCH"
"KfrQRR-cyuA","Timmy Trumpet | Tomorrowland 2023","2023-07-31T18:12:18Z","UCsN8M73DMWa8SPp5o_0IAQQ","Tomorrowland","10","23.02.08","tomorrowland|belgium|boom|edm|festival|music","188916","6392","0","346","https://i.ytimg.com/vi/KfrQRR-cyuA/default.jpg","False","False","A magical destination high on the horizon, where the People of Tomorrow will witness the rise of a magnificent tale in the history of Tomorrowland's Great Library: ADSCENDO. Live Today, Love Tomorrow, Unite Forever.www.tomorrowland.com"
