video_id,title,publishedAt,channelId,channelTitle,categoryId,trending_date,tags,view_count,likes,dislikes,comment_count,thumbnail_link,comments_disabled,ratings_disabled,description
"T4zqkjXdYT0","Project L: Yasuo, The Unforgiven - Champion Reveal","2023-08-04T14:00:19Z","UCJEGvSZnQ1pkVfHO8s5G8hA","Riot Games","24","23.09.08","Project l|duo play|riot games|league of legends|fighting games|2v2|tag team fighting game|yasuo|darius|ekko|ahri|evo|evo 2023","889553","47589","0","3393","https://i.ytimg.com/vi/T4zqkjXdYT0/default.jpg","False","False","One blade, one purpose. Yet this steel doesn’t get any lighter. Play Yasuo, the Unforgiven, along with Darius, Ekko, and Ahri at EVO 2023.More Project L videos: https://www.youtube.com/watch?v=5hugGCZon3I, https://www.youtube.com/watch?v=BbwmX-coQCM, https://www.youtube.com/watch?v=9zNqyHAP9zcFeatured music:Daffodil - Tennyson from Sessions: ViIonia Theme (Project L) - Riot Games Piltover Bridge (Project L) - Riot GamesChampion Select (Project L) - Riot Games#projectL #riotgames _____________________________________________Subscribe to the channel: YouTube - https://riot.com/3FIOx3kFollow Riot Games on:Twitter - https://riot.com/3UoBdFDInstagram - https://riot.com/3gVbN3KFacebook - https://riot.com/3TYketZWe're hiring! Follow LifeAtRiot for updates:Open Roles - https://riot.com/3Unb61tLinkedIn - https://riot.com/3DSAnviTwitter - https://riot.com/3NwsS09"
"KUidBFtCAr0","Dwayne ‘The Rock’ Johnson Surprises UFC Fighter Themba Gorimbo With New House","2023-08-03T17:18:16Z","UCBdw4dLCLLHmTgAOnW4V0hQ","The Rock","24","23.09.08","therock|the rock|the rock youtube|youtube the rock|dwayne johnson|dwayne johnson youtube|youtube dwayne johnson|the rock johnson|dwayne the rock|dwayne the rock johnson","2282859","87350","0","6522","https://i.ytimg.com/vi/KUidBFtCAr0/default.jpg","False","False","Earlier this year, a tweet from UFC Fighter Themba Gorimbo caught Dwayne ‘The Rock’ Johnson’s eye. Gorimbo tweeted a screenshot of having $7 in his bank account, an amount all-too familiar with Johnson, who infamously had $7 in his pocket after getting cut from the Canadian Football League in 1995 and was forced to move home. Inspired by his story, his selflessness and his determination for greatness, Johnson flew down to Miami to meet Gorimbo in person. While Gorimbo thought that meeting was the surprise of a lifetime, as he would soon find out, a lot more was in store."
"nPiM4Y5BPhM","Adding the WORST Backrooms Levels to my Game...","2023-08-03T19:00:31Z","UCRJilf8hdkxHQqrQa_CafyA","Fancy","24","23.09.08","[none]","891225","54146","0","4259","https://i.ytimg.com/vi/nPiM4Y5BPhM/default.jpg","False","False","i decided to add the worst backrooms levels to my game...  get it here btw: https://store.steampowered.com/app/1943950/Escape_the_Backrooms/Join my Discord:https://discord.gg/fancygamesFollow me on Twitter:https://twitter.com/FancyTheDevFollow me on TikTok:https://www.tiktok.com/@fancygamedevUnreal Engine 5 is a state-of-the-art engine and editor with photorealistic rendering, dynamic physics and effects, lifelike animation, robust data translation, and much more—on an open, extensible platform that won't tie you down.The Backrooms is an urban legend and creepy pasta that tells the tale of an endless maze of randomly generated office rooms. It is characterized by the smell of wet carpet, walls with a monochromatic tone of yellow, and buzzing fluorescent lights.Credits:https://aesthetics.fandom.com/wiki/Liminal_Spacehttps://backrooms-wiki.wikidot.com/https://backrooms.fandom.com/wiki/Backrooms_Wikihttps://sketchfab.com/3d-models/week-15-luggage-bake-ebd45b98bd7c4d95953b2f65a98572b3https://sketchfab.com/3d-models/revolver-kaliber-357-magnum-ced386123bc146588e6e1a138fb12384https://sketchfab.com/3d-models/rapa-nui-statue-scan-with-peel-3d-d8e1d22954e0484f8321ae3e49c5eca0https://sketchfab.com/3d-models/htc-vive-pro-af619eda9b594ca280e35ca4ee1d3a3b"
"XuCfkgaaa08","Baldur's Gate 3: Launch Trailer","2023-08-03T14:59:38Z","UCQ-AAXSt0M5Gx0-A9UGut8g","Larian Studios","20","23.09.08","[none]","996032","40119","0","2941","https://i.ytimg.com/vi/XuCfkgaaa08/default.jpg","False","False","It’s party time!Baldur’s Gate 3 is out now on PC. 6 years in the making, we sincerely hope you enjoy the adventure!Steam: https://larian.club/y_BG3onSteamGOG: https://larian.club/y_BG3onGOGBaldur’s Gate 3 launches on PS5 September 6th. Preordering the Deluxe Edition on PS5 will give you access to 72hrs Early Access and many other goodies.Pre-order the Deluxe Edition: https://larian.club/ya_GetBG3NowFollow us on social media:• Twitter: https://twitter.com/larianstudios• Twitter: https://twitter.com/baldursgate3• Facebook: https://www.facebook.com/LarianStudios/• Facebook: https://facebook.com/baldursgate3• Instagram: https://www.instagram.com/larianstudios/• TikTok: https://tiktok.com/@larianstudios"
"nrHgbVxRH-Q","GOAL | Cole Palmer | Arsenal 0-1 Manchester City | 2023 Community Shield","2023-08-06T16:51:15Z","UCChcWqwYXCEs657MQ00qVWA","The Emirates FA Cup","17","23.09.08","[none]","388294","4779","0","436","https://i.ytimg.com/vi/nrHgbVxRH-Q/default.jpg","False","False",""
"XTzMqWaoqYw","Primitive Technology: Wood Ash Insulated Furnace","2023-08-03T21:35:05Z","UCAL3JXZSzSm8AlZyD3nQdBA","Primitive Technology","28","23.09.08","primitive technology|primitive|technology|tech|primitive tech|technology primitive|tech primitive|prim technology|prim tech|tech prim|technology prim|building from scratch|build from scratch|design|build|wood furnace|wood|furnace|ash|clay|iron|smelt|insulation|handmade|fire|fireburning|ore|wood ash furnace|iron work|furnace making|insulate furnace|wood ash|iron smelt|handmade furnace|clay design|wood burning|natural tools|clay furnace|clay tools","1194105","65943","0","3395","https://i.ytimg.com/vi/XTzMqWaoqYw/default.jpg","False","False","Primitive Technology: Wood Ash Insulated FurnaceSubscribe: http://bit.ly/subPT | Never miss a video! Enable ‘ALL’ Notifications!Watch my newsest content: https://youtube.com/playlist?list=PLGnWLXjIDnpBR4xqf3FO-xFFwE-ucq4Fj&playnext=1&index=2Follow Primitive Technology:Wordpress: https://primitivetechnology.wordpress.com/Patreon: https://patreon.com/user?u=2945881Watch More Primitive Technology:Newest Uploads: https://youtube.com/playlist?list=PLGnWLXjIDnpBR4xqf3FO-xFFwE-ucq4Fj&playnext=1&index=2Pyrotechnology: https://youtube.com/playlist?list=PLGnWLXjIDnpBVRqu5lz5JGaQxjPs7q3CJ&playnext=1&index=2Shelter: https://youtube.com/playlist?list=PLGnWLXjIDnpBBsdKZb-vy30o88SIxItp2&playnext=1&index=2Weapons: https://youtube.com/playlist?list=PLGnWLXjIDnpA-XGDrrmVgBnSXx15i2Awp&playnext=1&index=2Popular Videos: https://youtube.com/playlist?list=PLGnWLXjIDnpAb29Lrdki5BPjTpMon8zla&playnext=1&index=2About This Video:I made a furnace insulated with wood ash to smelt iron in. Furnace insulation stops heat being lost from the walls of a furnace and so increases the heat within the furnace. Dry wood ash makes an excellent insulator for heat as the fine particles separated by small air gaps don't allow heat to conduct very well. To make the furnace a double layered wall of clay was made and the space between was filled with wood ash from different fires. The clay needed to be completely dry before doing so however as it was important the the ash not get wet, which would cause it to loose its insulating properties.The furnace was tested with an iron smelt and it produced 34g of iron from 10 charges of ore. It was going quickly to start with but then I had issues with the blower towards the end of the smelt (broken housing). The furnace design is promising though as this produced the third best smelt I've done in the wild with natural tools and materials (the best were 39g and 41g over a year ago). I'll try it again later when I've replaced the broken forge blower. About Primitive Technology:Primitive technology is a hobby where you build things in the wild completely from scratch using no modern tools or materials. These are the strict rules: If you want a fire, use a fire stick - An axe, pick up a stone and shape it - A hut, build one from trees, mud, rocks etc. The challenge is seeing how far you can go without utilizing modern technology. I do not live in the wild, but enjoy building shelter, tools, and more, only utilizing natural materials. To find specific videos, visit my playlist tab for building videos focused on pyrotechnology, shelter, weapons, food & agriculture, tools & machines, and weaving & fiber.#PrimitiveTechnology #woodfurnace #furnace"
"cuympmzTzro","How To Play Project L","2023-08-04T14:30:11Z","UCJEGvSZnQ1pkVfHO8s5G8hA","Riot Games","24","23.09.08","Riot Games|Life at Riot|Riot Careers","747693","31009","0","2034","https://i.ytimg.com/vi/cuympmzTzro/default.jpg","False","False","Executive producer Tom Cannon and game designer Caroline “Riot Shyvana” Montano walk through everything you’ll want to know before jumping into the Project L Demo at EVO 2023. More Project L videos: https://www.youtube.com/watch?v=5hugGCZon3I, https://www.youtube.com/watch?v=BbwmX-coQCM, https://www.youtube.com/watch?v=9zNqyHAP9zcFeatured music:MOCHI  - bear bear and friends from Sessions: Star Guardian TaliyahPulse - Dilip from Sessions: Diana Sentinel - A.L.I.S.O.N from Sessions: Diana Chasing Rainbows - Barry Whittaker, GilbeyAirpusher - Even Sarucco, Nicholas Sillitoe#projectL #riotgames _____________________________________________Subscribe to the channel: YouTube - https://riot.com/3FIOx3kFollow Riot Games on:Twitter - https://riot.com/3UoBdFDInstagram - https://riot.com/3gVbN3KFacebook - https://riot.com/3TYketZWe're hiring! Follow LifeAtRiot for updates:Open Roles - https://riot.com/3Unb61tLinkedIn - https://riot.com/3DSAnviTwitter - https://riot.com/3NwsS09"
"qZfrTWgu0eI","the longest grind in tileman history | tileman #29","2023-08-03T22:10:11Z","UCs-w7E2HZWwXmjt9RTvBB_A","Settled","20","23.09.08","Swampletics|Mory|Morytania|Area|Maxing|Max|OSRS|UIM|End|Game|Ultimate|Ironman|Old|School|Runescape|RS3|Settled|Settledrs|Progress|Video|Tricks|Tips|Bossing|Skilling|2007|2007Scape|Dream|Gear|Items|Boss|Episode|Settled UIM|UIM Settled|OSRS Settled|Morytania UIM|Morytania Ironman|Mory Ironman|Maxed UIM|UIM Maxing","546064","25223","0","963","https://i.ytimg.com/vi/qZfrTWgu0eI/default.jpg","False","False","2 likes and I will make 3 more episodes of TilemanTry Rocket Money for free: https://RocketMoney.com/settled #ad Support on Patreon - https://www.patreon.com/settledTop Supporters: https://docs.google.com/document/d/15msW8IyvfYx0RMMEgT_nu_fNkeG4nNo1lyiOGnvSd2M/editTileman was a concept by Sram1337https://www.youtube.com/user/sram1337►Twitter: https://twitter.com/SettledRS►Twitch: https://www.twitch.tv/SettledIntro Song: The Thief in Marrakesh - Arc De Soleil► Play Oldschool Runescape (Free online MMORPG by Jagex) here: http://oldschool.runescape.com/Yes, this is actual Old School Runescape! A Re-boot of a 2007 save file of the game, released in February of 2013. We all started fresh, and the game has been getting weekly updates with a dedicated dev team ever since.swampletics osrs settled morytania uimThumbnail work done by 8satBusiness/Thumbnail work contact: @8sat_ on Twitter"
"w8qqeofAI_4","I Bought The CHEAPEST Ferrari In The Country!!","2023-08-03T14:00:43Z","UCtNBFUsxj2YVbEc5HquzFqg","Carter Sharer","24","23.09.08","Carter Sharer|Team RAR|carter|carter share","644126","14435","0","840","https://i.ytimg.com/vi/w8qqeofAI_4/default.jpg","False","False","🔥SHOP NOW!!🔥━► https://www.teamrar.com/ In this mind-blowing episode, join Carter on an adrenaline-fueled quest to score the ultimate deal – the cheapest Ferrari in the country! 🚀🔥 Watch as he navigates through the twists and turns of the internet scouring various platforms and listings. Just when he starts to doubt if it's even possible, fate smiles upon him when he stumbles upon a jaw-dropping deal offered by a seemingly ordinary family. But that's not all! As Carter digs deeper into the backstory of this coveted Ferrari, he uncovers astonishing revelations that will leave you utterly shocked!  Buckle up for an unforgettable ride filled with twists, turns, and jaw-dropping revelations!💌SEND US YOUR FAN MAIL!!💌Team RAR4501 New Bern Ave Suite 130, Box # 360Raleigh NC, 27610❇️ MORE EPIC VLOGS ❇️-----------------------------------------------------------------------------------------------------------📷INSTAGRAM → @CarterSharer https://www.instagram.com/cartersharer/📷INSTAGRAM → @OfficalTeamRAR https://www.instagram.com/officialteamrar/📷INSTAGRAM → @LizzyCapri https://www.instagram.com/lizzycapri/📘FACEBOOK → CARTER SHARER OFFICIAL https://goo.gl/WM7mBuSubscribe to my channel! https://goo.gl/XjjCA8-----------------------------------------------------------------------------------------------------------Business Inquiries: carter@nightmedia.coWARNING: This video is only for entertainment purposes. Do not attempt to recreate any of the acts in this video, as they may be dangerous if not done correctly, and could result in serious injury. If you rely on the information portrayed in this video, you assume the responsibility for the results. Have fun, but always think ahead, and remember that every project you try is at YOUR OWN RISK.This footage is property of Team RAR inc. and is not allowed to be repurposed without written consent from Team RAR inc. For any requests from media contact us at carter@nightmedia.co"
"J4z3JdZbUHc","Knight Evolution: UNKILLABLE.🛡️","2023-08-04T13:00:15Z","UC3S6nIDGJ5OtpC-mbvFA8Ew","Orange Juice Gaming","20","23.09.08","[none]","656958","25376","0","1202","https://i.ytimg.com/vi/J4z3JdZbUHc/default.jpg","False","False","The knight gets his evolution and gets an 80% damage reduction while he is moving. He can tank sparky blasts like a champ. You can deal damage to the knight once he stops moving. Code OJSupercell Store ► https://store.supercell.com/en?boost=ojCR ► https://link.clashroyale.com/en?supportcreator?code=ojBS ► https://link.brawlstars.com/supportcreator/en?code=ojCoC ► https://link.clashofclans.com/en?action=SupportCreator&id=ojChannelsLive Stream ► https://www.youtube.com/channel/UCbfwKVaFIfVDyVDndGrTKTgPodcast ► https://www.youtube.com/@PeelingTheOrangeJuicy News ► https://www.youtube.com/channel/UC4rD2NGH3LxRNeF6VCDLeiQMore Juice ► https://www.youtube.com/channel/UCqycdxt7I6RhNaUV_iSOEVgCheesy Clips ► https://www.youtube.com/channel/UCQC8shNPvBl_AmGJ3sNT17wSPONSORS▶ Set yourself apart from the rest, check out Samsung Galaxy: https://trb.gg/samsunggalaxy▶ AT&T 5G. Fast. Reliable. Secure. https://trb.gg/ATT  STATSBrawlify ► https://brawlify.comDeck Shop ► https://www.deckshop.proRoyale API ► https://royaleapi.com/SOCIALSSubscribe ► YT http://bit.ly/ojsubTwitter ► http://twitter.com/orangejuiceInstagram ► https://www.instagram.com/ojeverydayFacebook ► https://www.facebook.com/orangejuicegamingTwitch ► https://www.twitch.tv/orangejuiceDISCORDClash Royale ► https://discord.gg/ojBrawl Stars ► https://discord.gg/bsGeneral ► https://discord.gg/ojgTRIBE:YouTube ▶ https://youtube.com/tribegamingTwitter ▶ https://twitter.com/tribegamingDiscord ▶ https://discord.gg/tribegamingInstagram ▶ https://instagram.com/tribegamingTikTok ▶ https://www.tiktok.com/@tribegaming BIZ EMAIL:▶ OJ@tribegaming.gg#ojgaming #supercellpartner"
"8h64EYMoLF8","Baldur's Gate 3 - Launch Review (After A Full Playthrough)","2023-08-03T15:00:08Z","UCEQ7KR9enYdQsB6kcMnw0NA","Mortismal Gaming","20","23.09.08","Mortym|Mortismal Gaming|Baldurs Gate|BG3|BG2|BG1|Baldur's Gate|baldur's gate 3 story|baldurs gate 3|bg3 story|baldurs gate 1 & 2 before 3|bg3 gameplay|baldurs gate 3 release showcase|bg3 multiclassing|baldurs gate 3 multiclassing|bg3 classes|bg3 review|baldurs gate 3 review|baldur's gate 3 combat|baldurs gate 3 bear|baldur's gate 3 review|baldurs gate 3 launch review|baldur's gate 3 new reviews","451643","18011","0","1532","https://i.ytimg.com/vi/8h64EYMoLF8/default.jpg","False","False","Talking about my experiences with my first complete playthrough of Baldur's Gate 3 after receiving a review copy of the game ahead of it's full launch!Timestamps00:00 Intro01:24 Overview & Playthrough details02:55 Technical State05:30 Difficulty07:00 Story Set Up & Thoughts11:19 Character Creation14:38 Progression Systems18:37 Combat24:48 Gameplay & World28:17 Party Dynamics/Origin Characters31:08 Positives/Negatives33:40 Conclusion34:47 Wrap UpMotherboard: Asus Prime Z790-PProcessor: Intel i9-13900kRAM: 64GB Corsair Vengeance DDR5 5600Graphics: Nvidia GeForce RTX 4090 (MSI Gaming Trio)Intro Music By Juan Andrés Matos, http://www.juanmatosmusic.com/Merch Shop: https://mortismal-gaming.creator-spring.com/Info On Reviews: https://www.youtube.com/watch?v=bGD7dF8HCEM---------------------------------------------------------------------------Support The Channel By Becoming A Member!---------------------------------------------------------------------------Become A Member!: https://www.youtube.com/channel/UCEQ7KR9enYdQsB6kcMnw0NA/join------------------------------------------------------------------Follow Me On Various Social Media------------------------------------------------------------------Steam Profile: https://steamcommunity.com/id/Mortismalgaming/Steam Curator Page: https://store.steampowered.com/curator/43474224/My Facebook: https://www.facebook.com/MortismalGamingMy Twitter: https://twitter.com/JesseBabcock18#gaming #gamereviews #bg3 #baldursgate3"
"UOg-rbBvvuQ","Molten Steel Exploding at 10,000fps - The Slow Mo Guys","2023-08-03T15:19:40Z","UCUK0HBIBWgM2c4vsPhkYY4w","The Slow Mo Guys","24","23.09.08","slomo|slow|mo|super|motion|Slow Motion|1000|1000fps|gav|dan|slowmoguys|phantom|guys|HD|flex|gavin|free|gavin free|high speed camera|the slow mo guys|2000|2000fps|5000|5000fps|molten|steel|cricket|bat|sparks","979139","68503","0","3854","https://i.ytimg.com/vi/UOg-rbBvvuQ/default.jpg","False","False","In the first video on this channel lit entirely by the moon and some nails, Gav and Dan demonstrate the awe inspiring result of whacking some molten steel with a cricket bat.  http://hensonshaving.com/theslowmoguys - Use code slowmoguys for 100 free blades when buying the razor!Instagram - https://www.instagram.com/theslowmoguysMolten Steel Exploding at 10,000fps - The Slow Mo GuysMusicBlack Vortex Kevin MacLeod (incompetech.com)Licensed under Creative Commons: By Attribution 4.0 Licensehttp://creativecommons.org/licenses/by/4.0/"
"H_E_23JNb4I","Sammi & Ronnie Are Ready to Return to the Jersey Shore | Jersey Shore: Family Vacation","2023-08-03T14:29:49Z","UCalcFcqOC_UdfxQAPHhwOqg","Jersey Shore","24","23.09.08","Jersey Shore Season 6|Season 6|Family Vacation Season 6|Best Moments Jersey Shore|jersey shore|angelina jersey shore|chris jersey shore|throwback|Jersey Shore: Family Vacation|MTV|Jersey Shore|Jersey Shore Ranked|compilation|Top Moments|TBT|Deena|Sammi|Snookie|Ronnie|mike|the situation|Vinny|JS|Jenni|DJ Pauly D|seaside|Jersey Shore relationship|jersey shore: family vacation|Angelina jersey shore|best of jersey shore|best of jersey shore family vacation","487140","5797","0","901","https://i.ytimg.com/vi/H_E_23JNb4I/default.jpg","False","False","Ronnie visits Mike and gives a life update. Angelina tries to convince Sammi to surprise the fam on their trip to the Poconos, but she’s not sure she’s ready to come back yet. Jersey Shore Family Vacation returns Jerzday, August 3rd at 8/7c on MTV!Paramount+ is here! Stream all your favorite shows now on Paramount+. Try it FREE at https://bit.ly/3qyOeOf#JerseyShore #JSFamilyVacation #MTVSubscribe to Jersey Shore: https://goo.gl/FtXE1PNow on YouTube TV: https://tv.youtube.com/welcome/ All your favorite moments with Snooki, JWoww, Deena, Vinny, DJ Pauly D, Ronnie and The Situation. FOLLOW Jersey Shore! Instagram - https://instagram.com/jerseyshore/Facebook - http://facebook.com/jerseyshoremtv"
"UTqPkjk0GLU","Masters and Apprentices | Ahsoka | Disney+","2023-08-04T16:01:43Z","UCZGYJFUizSax-yElQaFDp5Q","Star Wars","24","23.09.08","Star Wars|Lucasfilm|Ahsoka|Chopper|Sabine Wren|Hera Syndula|Thrawn|Grand Admiral Thrawn|Jedi|Rosario Dawson|Natasha Liu Bordizzo|Mary Elizabeth Winstea|Lars Mikkelsen|Ray Stevenson","538969","19623","0","1601","https://i.ytimg.com/vi/UTqPkjk0GLU/default.jpg","False","False","A master and an apprentice. The legacy continues in Ahsoka. Experience the two-episode premiere August 23 only on Disney+"
"HeaikSn2Sbg","I Got Fortnite's Rarest Achievement","2023-08-03T17:11:08Z","UC-sjC5fKKsrpcZRJwlZJzZQ","McCreamy","20","23.09.08","fortnite|fortnite battle royale|fortnite gameplay|challenge|epic|mccreamy|new|update|memes|funny moments|glitches|funny|video games|gaming|fortnite best plays|fortnite challenges|epic games|fortnite glitches|fortnite glitch|free vbucks|fortnite vbucks|fortnite moments|new fortnite season|new fortnite|fortnite new|battlepass|fortnite update|new fortnite update|fortnite chapter 4|fortnite new update|mcreamy|fortnite season 3|fortnite only up","1096392","16745","0","1104","https://i.ytimg.com/vi/HeaikSn2Sbg/default.jpg","False","False","0.00001% of players have completed this achievement…LIKE and SUBSCRIBE!WATCH ME LIVE ON TWITCH! https://twitch.tv/McCreamyJoin my Notification Crew: click the 🔔 Bell & on Twitch click the 💜🐦 TWITTER - https://twitter.com/McCreamy📷 INSTAGRAM - https://instagram.com/mccreamyFor more Fortnite Chapter 4 Season New Update Battle Royale gameplay watch me live athttps://twitch.tv/McCreamyMusic ▼▶ Video Music: Epidemic Sounds▶ Outro Music: https://goo.gl/MrwCEuStill reading, what are you doing? Hit that Subscribe button already or you won't get a high elimination victory royale against stream snipers ( ͡° ͜ʖ ͡°)epic fortnite chapter 4 season 3 moments USE CODE CREAMY IN THE FORTNITE ITEM SHOP"
"A-W4fYvRgzY","trouble","2023-08-02T18:02:18Z","UCOsATJw-IZgqGT8MFrHjKGg","Ice Cream Sandwich","23","23.09.08","[none]","1684755","156403","0","7443","https://i.ytimg.com/vi/A-W4fYvRgzY/default.jpg","False","False","new plush is in the store :) https://icecreamsandwich.store/Stories of times I got in trouble with principles and teachers in school. animators: DavidToons - https://twitter.com/DavidToons_BigChapula - https://twitter.com/bigchaslappaAbnormalChaos - https://twitter.com/AbnormalChaosand me :)Thank you for watching.MERCH IS HERE:https://icecreamsandwich.store/📱 twitter:https://twitter.com/ICSandwichGuy📷 instagram:https://www.instagram.com/icecreamsandwichguy/"
"Y6ZKXqM7HNQ","OMG2 - Official Trailer | Akshay Kumar, Pankaj Tripathi, Yami Gautam | Amit Rai | In Theatres Aug 11","2023-08-03T05:31:25Z","UCs56ffejFhWlCvlvRIdpb9Q","Viacom18 Studios","24","23.09.08","OMG 2 movie|OMG 2|OMG 2 Movie Hindi|Akshay Kumar|Pankaj Tripathi|omg 2 Movie Review|omg 2 Bollywood Movie|omg 2 trailer reaction|omg 2 trailer release date|omg 2 Movie Cast|omg 2 full movie|Gadar 2|Sunny Deol|Ameesha Patel|akshay kumar new movie|har har mahadev omg 2 reaction|pankaj tripathi new movie 2023|omg 2 movie cast|omg 2 Song|omg part 2|omg 2 teaser|Yami Gautam|Yami Gautam movies|omg 2 Bhole songs|omg 2 hindi Trailer|omg 2 updates","36073113","590361","0","39677","https://i.ytimg.com/vi/Y6ZKXqM7HNQ/default.jpg","False","False","११ अगस्त का बुलावा हैआ रहे हैं हम 🙏A sequel to the much-celebrated OMG-Oh My God, OMG2 is a social comedy/drama starring Akshay Kumar, Pankaj Tripathi and Yami Gautam in lead roles. The film will release in theatres on August 11, 2023. Book your tickets on: BookMyShow: https://bookmy.show/OMG-2Paytm: https://m.paytm.me/m_omg2Synopsis: Life is bliss until one day Kanti Sharan Mudgal’s son Vivek is blamed for immoral conduct and expelled from school. Overwhelmed, Kanti plans to leave town until a divine intervention leads him to seek justice by taking those responsible to court.Viacom18 Studio presents ​in association with Cape Of Good Films ​& Wakaoo Films A Cape Of Good Films and Wakaoo Films production ​“OMG 2” Written & Directed by Amit Rai Produced by ​Aruna Bhatia, Cape Of Good Films Produced by ​Viacom18 Studios, Jyoti Deshpande, Ajit Andhare Produced by ​Swaroop Paresh Rawal, Hemal A. Thakkar​Produced by ​Vipul D. Shah, Ashwin Varde, Rajesh BahlCreative Producer: Dr Chandraprakash Dwivedi Co-Producer: Vedant Baali   Story, Screenplay & Dialogues: Amit Rai Director Of Photography: Amalendu Chaudhary Music by Vikram Montrose, Hansraj Raghuwanshi, Djstrings, Pranaay, Sandesh Shandilya Lyrics by Shekhar Astitwa, Hansraj Raghuwanshi, Djstrings, Kabeer Shukla, Ginny Diwan, Sandesh Shandilya Editor: Suvir Nath Music on Zee Music Company#AkshayKumar #PankajTripathi #OMG2Trailer #YamiGautam #OMG2InTheatresAug11 #OMG2 #OfficialTrailer  Viacom18 Studios Handles:-Facebook:- https://www.facebook.com/Viacom18Studios/Twitter :- https://twitter.com/Viacom18StudiosInstagram:- https://www.instagram.com/viacom18studios"
