video_id,title,publishedAt,channelId,channelTitle,categoryId,trending_date,tags,view_count,likes,dislikes,comment_count,thumbnail_link,comments_disabled,ratings_disabled,description
"DkskOhoQpuo","Loki | Temporada 2 | Tráiler doblado | Disney+","2023-07-31T13:33:12Z","UC8LEXZO4hjzVk6wO3G9pJyQ","Marvel Latinoamérica Oficial","24","23.02.08","[none]","892745","57362","0","2497","https://i.ytimg.com/vi/DkskOhoQpuo/default.jpg","False","False","El regreso de tu dios favorito. #Loki, segunda temporada, estreno 6 de octubre en #DisneyPlus."
"_ElO772izD0","CHRISTIAN MARTINOLI, ¿DE QUÉ TE VAS A DISFRAZAR? | La entrevista con Yordi Rosado","2023-07-31T00:00:11Z","UCpYlZ6IrsXW_OBrt5ugKkmA","Yordi Rosado","24","23.02.08","Yordi Rosado|christian martinoli|christian martinoli entrevista|christian martinoli 2023|christian martinoli habla|christian martinoli revela|christian martinoli confiesa|christian martinoli historia|christian martinoli anecdota|christian martinoli con yordi rosado|yordi rosado entrevista|la entrevista con yordi rosado|entrevista|yordi rosado y christian martinoli|christian martinoli habla de luis garcia|christian martinoli infancia","808525","25847","0","1242","https://i.ytimg.com/vi/_ElO772izD0/default.jpg","False","False","Ya llegó el mero mero Unefon Ilimitado. Conoce más en 👉 www.unefon.com.mxEn esta entrevista Christian Martinoli nos cuenta por qué le dicen doctor a Luis García, cómo fue su infancia, los problemas que ha tenido narrando, cómo su personaje al aire es distinto a él, por qué no tiene amigos futbolistas, la única vez que ha pedido una disculpa, por qué le fue terrible en Francia 98, cómo Luis García lo ninguneaba, por qué Luis García no es su amigo y la verdad sobre el pleito con el Piojo Herrera. Deja de sufrir por tu internet y como yo, sé parte de #ElInternetDeLosCreadores con @totalplaymx ➡ Entérate de más aquí: https://bit.ly/44FT9Ro Sigue a Christian Martinoli en:X: https://twitter.com/martinolimxFacebook: https://www.facebook.com/Cmartinolimx/Instagram: https://www.instagram.com/cmartinolimx/Sigue a Yordi Rosado en:Facebook: http://www.facebook.com/YordiRosadoInstagram: https://www.instagram.com/yordirosadooficial/Threads: https://www.threads.net/@yordirosadooficialTikTok: https://www.tiktok.com/@yordirosadooTwitter: https://twitter.com/YordiRosadoSpotify: https://open.spotify.com/show/1ZRePpISu1StY3v1Jf6cUD"
"GKdwUKn8Edg","MI FAMILIA REACCIONA A MI CAMBIO DE LOOK EXTREMO 😱 Juan de Dios Pantoja","2023-07-30T16:27:26Z","UCzoUWqjCbcfWFdOMvoep8FA","Juan De Dios Pantoja","22","23.02.08","Team|juki|Juan|De|Dios|Pantoja|jd|youtube|retos|reto|tag|tags|Challenge|nuevo|video|risa|comedia|diversión|extremo|música|roast","3090247","190042","0","4336","https://i.ytimg.com/vi/GKdwUKn8Edg/default.jpg","False","False","Hola familia PANTOJITA 💎 gracias por tenerme de nuevo en sus pantallas 😃 estoy muy contento y agradecido por todo el apoyo que siempre me dan, GRACIAS POR SER PARTE DE ESTA FAMILIA QUE TANTO AMO ❤️🙏🏻▪️SIGUEME EN MIS REDES SOCIALES QUIERO CONECTARME MAS CONTIGO:• INSTAGRAM: @JuandediosPantoja -  https://bit.ly/2vWtdSj • TWITTER:  @Juandedios_P - https://bit.ly/2OY3UYN• PAGINA DE FACE: Juan De Dios Pantoja Corona - https://bit.ly/2KHVW2E 📩 : marcasjddp@gmail.com"
"ikjcUh2_Z_s","DANNA PAOLA “Nos habla sobre “COMO ATRAVIESA SU MOMENTO MÁS REBELDE Y A LA VEZ MÁS LUMINOSO”","2023-07-31T20:00:41Z","UC-BZEmUUUIXmD1CgkWACVyQ","Calle y Poché","22","23.02.08","calle|poché|calle y poché|colombia|caché|youtubers|pareja|cachers|maria|jose|garzon|daniela|youtube|tag|reto|challenge|couple|bff|vlogs|daniela calle|maria jose garzon|POCHE|CALLE|duo|human of interest|human of interest podcast|podcast|calle y poche host|sascha fitness","132342","8610","0","330","https://i.ytimg.com/vi/ikjcUh2_Z_s/default.jpg","False","False","NUESTRO HUMAN OF INTEREST ES: Danna Paola se sienta con nosotras para hablarnos sobre su verdad. Cómo se siente más luminosa que nunca justo en el momento en el que decide no tapar su oscuridad. Enfocada en SER como sea que ella es. Nos cuenta sobre cómo pensó en algún momento en dejar la música, en cómo se dio cuenta que estaba haciendo cosas que transgredían sus límites, en lo difícil que es crecer en el mundo del entretenimiento, en cómo drenaba sus emociones sólo cuando estaba actuando otros personajes: sintiendo pero en vidas ajenas. Hoy vemos su otro lado, y su valentía infinita.Todos somos un caso sin resolver, y aqui buscamos investigarnos. Todos hemos sido testigos de los triunfos y del caso de éxito de cada uno de nuestros invitados, ha sido evidente, pero queremos indagar más en su trasfondo humano.Hablaremos de esas cosas que no se suelen tocar en público, de las que no se suele preguntar, ni mencionar. Buscando profundidad, viendo, por primera vez, lo que está en la sombra, en la evidencia que, intencionalmente o subconscientemente, evadimos. Será una interrogación cálida y divertida, en donde nos mostrarán su evidencia más cercana al corazón, con ayuda de testigos que los aman, y escucharemos sus propios testimonios sobre quiénes son.NUESTRO INVITADO: DANNA PAOLA✩ Escucha Human Of Interest en todas las plataformas ✩Spotify: https://open.spotify.com/show/22sEY5n...Apple podcasts: https://podcasts.apple.com/us/podcast...Google podcasts:https://podcasts.google.com/feed/aHR0...Stitcher:https://www.stitcher.com/show/1060388Pandora:https://www.pandora.com/podcast/human...Deezer:https://deezer.com/show/5821157Pocketcasts:https://pca.st/4vb7srv5Radio public:https://radiopublic.com/human-of-inte...Tune in:https://tunein.com/radio/HUMAN-OF-INT...Amazon:https://music.amazon.es/podcasts/96a5...#HUMANOFINTEREST✩ NUESTRO REALITY #CALLEYPOCHESINETIQUETAS YA DISPONIBLE EN PRIME VIDEO:https://www.primevideo.com/detail/Cal...✩ Compra nuestros libros (EL PRIMERO) Sí, Si Es Contigo y (NUESTRO NUEVO LIBRO) ¿Y Si No Es Conmigo? ✩https://www.buscalibre.com.co/libro-y...https://www.buscalibre.com.mx/libro-y...✩ Compra nuestro Merch ✩➤ https://fanjoy.co/collections/calle-y...✩ Síguenos en nuestras redes sociales ✩ conecta con nosotras:➤ instagram juntas: https://www.instagram.com/calleypoche/➤ instagram calle: https://www.instagram.com/danielaacal...➤ instagram poché: https://www.instagram.com/poche/➤ twitter juntas: https://twitter.com/CalleyPoche➤ twitter calle: https://twitter.com/danielaacallee➤ twitter poché: https://twitter.com/Pochosaurus➤ tik tok: calleypoche✩ Escucha Bilateral, nuestro podcast ✩Gratis, sólo por Spotify. ➤ https://open.spotify.com/show/00Y0mAL..."
"GJmqbc_T7UI","hola, estoy de vuelta 😀","2023-07-31T21:00:07Z","UCG8eSYvOQUpb9HM8zU5d6xg","RobleisIUTU","20","23.02.08","robleis|robleisiutu|risa|funny|top|videos graciosos|recopilacion|clips|reaccion|juego|mejores momentos|record|reaccionando|best moments|nueva skin|nueva arma|actualizacion|como mejorar|como ganar|trucos|tips|consejos|fails|si me rio","515790","77529","0","7273","https://i.ytimg.com/vi/GJmqbc_T7UI/default.jpg","False","False","🔴 DIRECTOS: https://www.twitch.tv/robleisLike y Sub ayuda muchoo♥seguime en las redes rey► Instagram:  https://instagram.com/robleis► Twitter:  https://twitter.com/robleis01► Spotify: https://open.spotify.com/artist/32AuV4BxATEf2i7YVhIjhtMi Música: https://www.youtube.com/c/RobleisMusicSuscribete y activa la campanita 🔔 para que estés enterado de cuando subo videos :DContacto/Business: contact@teamrobleis.com"
"dR68OU5j7ww","Resumen y goles | América 1-4 Columbus Crew| Leagues Cup 2023 | Cortesía: @AppleTV","2023-08-01T02:51:12Z","UCTIyEyDNHPrwVFPhpi5dm0A","TUDN México","17","23.02.08","Televisa|Univision|TUDN|Televisa deportes|TUDN México|TUDN USA|Deportes|soccer|Futbol mexicano|futbol mls|liga mx vs mls|América 1-4 Columbus","477606","2747","0","1154","https://i.ytimg.com/vi/dR68OU5j7ww/default.jpg","False","False","Cortesía: @AppleTV Con remontada incluida, el cuadro de la MLS le puso una dura goleada a las Águilas de Jardine.Síguenos en nuestras redes sociales:https://www.facebook.com//tudnmex/https://www.instagram.com/tudnmex/https://twitter.com/TUDNMEXSitio Web: https://www.tudn.mx/TUDN México te ofrece la cobertura más completa del mundo deportivo con lo mejor del fútbol mexicano, eventos internacionales, las grandes personalidades del deporte y mucho más."
"mPufqoACksA","Taco y Torta al Pastor | La Capital","2023-07-31T21:00:32Z","UCEwl20VxZ3AwOgiKMZtI1GQ","La Capital","26","23.02.08","tacos al pastor|al pastor receta|al pastor recipe|la capital|tacos mexicanos|oscar meza|salsa verde|salsa chipotle|tortas de carne","1172233","73378","0","1080","https://i.ytimg.com/vi/mPufqoACksA/default.jpg","False","False","Contacto directo: oscarlacapital@gmail.com—————————————————————————————Instagram: https://www.instagram.com/oscarmezarFacebook: https://www.facebook.com/lacapitalcocinaMi Carnicería: http://www.yanagiya.mx—————————————————————————————Mi Equipo: Asador Grande: https://amzn.to/3aFgFqMAsador Chico: https://amzn.to/3G2wxylAsador Gas: https://amzn.to/3vJ5IfRKanka Grill: https://kankagrill.mxHorno eléctrico: https://amzn.to/3uWkHDbAhumador carbón : https://amzn.to/31bzHhlAhumador automático: https://amzn.to/3Sd7vlmSlow cooker: https://amzn.to/3XjwuHjOlla express: https://amzn.to/2CQ1fzrTermómetro: https://amzn.to/3rPIEqySartén Cast Iron: https://amzn.to/3FVCOe8Dutch Oven: https://amzn.to/2NhNDz4Prensa: https://amzn.to/3F18tKMProcesadora: https://amzn.to/3nv1iSxLicuadora: https://amzn.to/33KaeM0Mi cámara: https://amzn.to/4444hXZLente: https://amzn.to/3ppNnnCMolino de Carne: https://amzn.to/3jdwdmYCuchillo 1: https://amzn.to/2DPGXG6Cuchillo 2: https://amzn.to/2rz1iqr Cuchillo 3: https://amzn.to/31pqcZ7Cuchillo 4: https://amzn.to/2AmeCp1Cuchillo 5: https://amzn.to/2PDd38uSellador al vacío: https://amzn.to/3PnHFdIRayador de Queso: https://amzn.to/3PVzGpy"
"at9pWYunEMc","El Chombo presenta : Hablemos con los muñequitos 5","2023-08-01T01:00:10Z","UCvfzJ2WDWI4SPyCHzP35IIw","El Chombo","10","23.02.08","El Chombo|Te lo dijo el chombo|el chombo|chombo|te lo dijo el chombo|dame tu cosita|el chombo michael jackson|dame tu cosita song|ok google|el chombo canserbero|el chombo reggaeton|chacarron|el chombo freddie mercury|jubilados awards el chombo|la cripta|chombo michael jackson|el chombo plagio","465544","59241","0","3242","https://i.ytimg.com/vi/at9pWYunEMc/default.jpg","False","False","Episodio también disponible en formato Podcast sin video. Búscalo en Spotify o tu plataforma favorita.Mis listas: Te Lo Dijo El Chombo: https://bit.ly/TeLoDijoElChombo_Jubilao Caribeño: https://bit.ly/JubilaoCaribenoSígueme en mis redes: Instagram: https://www.instagram.com/elchombo_officialTikTok: https://www.tiktok.com/@elchombo_officialFacebook: https://www.facebook.com/elchombo.official Twitter:  https://twitter.com/ElChombo_1"
"ZyJs5GOx3fQ","KAROL G - MAÑANA SERÁ BONITO (BICHOTA SEASON) (Official Album Trailer)","2023-07-31T19:02:45Z","UCZuPJZ2kGFdlbQu1qotZaHw","KAROL G","10","23.02.08","Karol g|karolg|tusa|tusa karol g|la bichota|bichota|amargura|tqg|mañana sera bonito|mientras me curo del cora|provenza|mamiii|barbie|barbie movie|watati|aldo ranks|karol g y nicki minaj|karol g y dua lipa|s91|karol g s91|bad bunny|becky g|shakira|j balvin|ovy on the drums|karol g y peso pluma|sky rompiendo|verano rosa|feid|karol g y feid|reggaeton|reggaeton colombiano|pop latino|msb|msb bichota season|bichota season","458891","36955","0","1905","https://i.ytimg.com/vi/ZyJs5GOx3fQ/default.jpg","False","False","Pre-order MAÑANA SERÁ BONITO (BICHOTA SEASON): https://KarolG.lnk.to/BichotaSeasonPresave Subscribe to my YouTube channel here: https://karolg.lnk.to/SubscribeKarolGYT Connect with KAROL G:Instagram: https://www.instagram.com/karolg/Twitter: https://twitter.com/karolgTikTok: https://www.tiktok.com/@karolgFacebook: https://www.facebook.com/KarolGOficialTelegram: https://t.me/KarolGTeam #MSB #BICHOTASEASON"
"Kikc4ZCZfTk","¡PASTEL PISCINA DE BARBIE! 🎀 - COMPETENCIA VS @Marisolpink y @CaroTrippar","2023-08-01T02:00:10Z","UCN3ZyGR8BXFI-mN9r77bwAw","MaireWink","24","23.02.08","mairewink|maire|wink","95660","7687","0","835","https://i.ytimg.com/vi/Kikc4ZCZfTk/default.jpg","False","False","💜 ¡45 DÍAS GRATIS EN PODIMO CON ESTE LINK!go.Podimo.com/mairewink🎀Video de @CaroTrippar :https://www.youtube.com/watch?v=XNFh_t_9Qn8🎀Video de @Marisolpink :¡Coming soon! 💖 Instagram: maire_wink💖 twitter: @maire_wink💖 Facebook: https://www.facebook.com/maireguinc💖 Tiktok: https://www.tiktok.com/@maire_wink?la..."
"fhp2fYBymP0","Tortas de MILLONARIOS VS Tortas de BARRIO | Calidad VS Cantidad","2023-07-31T18:30:38Z","UCUAQgUTv4-OiAClB1jYTPnA","La Ruta de la Garnacha","24","23.02.08","Yo|soy|migue|el|papa|de|Lalo|villar|los|consejos|la|jefa|ruta|garnacha|lalo|donde|comer|barato|lugares|ñam|capital|para|mejico|comida|mexicana|como|preparar|recetas|marisolpink|guzzi|hacer|en|df|que|baratos|donde comer|que comer|comida callejera|la capital|la ruta dela garnacha|garnachas|coreano vlogs|ñam ñam|el papa de lalo villar|mexico|lalo villar|Mexico|Tortas|barrio|millonarios|sabor|tortas gigantes|VS|dinero","249746","5914","0","291","https://i.ytimg.com/vi/fhp2fYBymP0/default.jpg","False","False","00:00 Intro 00:31 Las tortas de Polanco01:35 Tortas La Samaritana02:07 La historia de estas tortas07:02 ¡Ámonos a probarlas!08:16 ¿Pagarías esto por una torta?09:13 Dirección, Horarios y precios exactos 09:25 Conclusiones y recomendaciones de La Samaritana10:00 Vamos a las Tortas de Barrio10:59 Entrevista garnachera11:39 La lluvia NO quitaran las ganas de comer una torta12:20 Perdóname Nutríologo por esta vida gorda 15:17 Historia de las tortas15:59 Dirección, Horarios y precios exactos 16:48 Entrevista Garnachera17:14 ¿Qué torta te comprarías?19:34 Despedida y Redes Sociales⬇⬇⬇⬇UBICACIÓN, HORARIOS Y COSTO DEL LUGAR ⬇⬇⬇⬇Tortas La Samaritana Campos Elíseos 116, Polanco, Polanco V Secc, Miguel Hidalgo, 11550 Ciudad de México, CDMXRicas Tortas GigantesC. 7 162, Porvenir, Azcapotzalco, 02940 Ciudad de México, CDMXCREDENCIAL GARNACHERAAdquiérela en : https://tiendafoodie.mx/producto/credencial-garnacheraLugares participantes: https://www.larutadelagarnacha.mx/credencial-garnachera/Mail para más información para ser parte de la credencial garnachera: contacto@larutadelagarnacha.mx CONVIÉRTETE EN UN MIEMBRO GARNACHERO:https://www.youtube.com/channel/UCUAQgUTv4-OiAClB1jYTPnA/join¡SUSCRÍBETE! https://goo.gl/T8XY5i🎉 SIGUEME EN:👉 Facebook: https://goo.gl/3FB0qK👉 Twitter: https://goo.gl/Z9igVk👉 Instagram: http://goo.gl/1UUb7L👉Tiktok: https://www.tiktok.com/@larutadelagarnacha👉Twich: https://www.twitch.tv/larutadelagarnacha?sr=a👉 Recomendaciones de lugares: larutadelagarnachamx@gmail.com👉 Campañas/Media/Prensa: contacto@larutadelagarnacha.mxCANALES HERMANOSMi segundo canal: https://www.youtube.com/c/LaloVillarEl papá de Lalo Villar: www.youtube.com/c/elpapadelalovillarYo soy Migue: https://goo.gl/w3gSR4Los Consejos de la Jefa: https://goo.gl/D2HpNpPARA BAJAR LA APP ENTRA A ESTE LINK DESDE TU NAVEGADOR:https://garnacha.mx Pueden usarla como aplicación si la agregan a su pantalla de inicio, desde Android, lo que deben hacer es entrar al link desde su navegador Chrome y en el menú de hamburguesa de la parte de arriba ( o, los tres puntitos) saldrá la opción de Agregar a la pantalla principal. y listo, podrán tenerla a su disposición en cualquier momento. Si ustedes tienen IPhone, lo que deben hacer es: Una vez dentro del sitio web, en su navegador SAFARI desliza hacia arriba el menú de opciones, y ahí buscan en la parte de abajo la opción de Agregar a inicio dan click en agregar y listo!TIENDA EN LINEA Productos Oficiales de La Ruta de la Garnacha y aquí pueden comprar el Libro de LA RUTA DE LA GARNACHAhttps://www.tiendafoodie.mxEscríbeme o mándame algo al: Apartado Postal 18-839, CP 11801, Ciudad de México, Mexico, Oficina Postal Escandon"
"0bIRwBpBcZQ","ITZY “CAKE” M/V @ITZY","2023-07-31T08:58:09Z","UCaO6TYtlC8U5ttz62hTrZgg","JYP Entertainment","10","23.02.08","JYP Entertainment|JYP|ITZY|있지|イッチ|예지|리아|류진|채령|유나|YEJI|LIA|RYUJIN|CHAERYEONG|YUNA|イェジ|リア|リュジン|チェリョン|ユナ|อิทจี|เยจี|ลีอา|รยูจิน|แชรยอง|ยูนา|ITZY VIDEOS|ITZY LOCO|ITZY BEHIND|MV|ITZY MV|ITZY MUSIC VIEDOS|Teaser|ITZY Teaser|ITZY VLOG|VLOG|IT'z Different|IT'z ICY|IT'z ME|Not Shy|GUESS WHO|CRAZY IN LOVE|DALLA DALLA|ICY|WANNABE|마.피.아.IN THE MORNING|LOCO|SNEAKERS|있지있지|있있|CHESHIRE|체셔|KILLMYDOUBT|BETONME|NoneofMyBusiness|CAKE","7279975","550502","0","61452","https://i.ytimg.com/vi/0bIRwBpBcZQ/default.jpg","False","False","ITZY “CAKE” M/V🎧 TITLE http://kko.to/eoMjL0dgJy💿 ALBUM http://ITZY.lnk.to/KILLMYDOUBT[ITZY Official]▶ https://www.youtube.com/c/ITZY▶ https://www.instagram.com/itzy.all.in.us▶ https://www.tiktok.com/@itzyofficial▶ http://www.twitter.com/ITZYOfficial▶ http://www.facebook.com/OfficialITZY▶ https://www.weibo.com/u/7462077750?is▶ http://ITZY.jype.com▶ http://fans.jype.com/ITZY#ITZY #ITZY_KILLMYDOUBT #ITZY_CAKECopyrights 2023 ⓒ JYP Entertainment. All Rights Reserved"
"HhKzRsP1Wc0","skibidi toilet 54","2023-07-31T14:10:00Z","UCsSsgPaZ2GSmO6il8Cb5iGA","DaFuq!?Boom!","24","23.02.08","toilet in ohio|skibidi meme|tiktok meme|sfm animation|funny animation|gmod animation|skibidi toilet vs cameramen|titan cameraman","23695426","974003","0","90938","https://i.ytimg.com/vi/HhKzRsP1Wc0/default.jpg","False","False","someone has returned...skibidi dop dop dop yes yesfull-screen versionRespectful assets used in the video:suits - https://steamcommunity.com/sharedfiles/filedetails/?id=2849230339map - https://steamcommunity.com/sharedfiles/filedetails/?id=2994310934(if you're author of certain assets and I didn't credit you properly, please contact me)Contact me:instagram.com/dafuqboomtvblugrayguy@gmail.com"
"GyCnGTUX3kw","Marco Antonio Solís - Tu hombre perfecto | Lyric video","2023-07-31T14:30:07Z","UCIKg4QVg91aCWxXWlUkKDLw","Marco Antonio Solís","10","23.02.08","Tu hombre perfecto|Marco Antonio Solís|Marco Antonio Solís - Sigue sin mí|Sigue sin mí|los bukis|Spanish Music|Latin Music|Spanish Songs|Spanish Guitar|Salsa Music|Bachata Songs|Música Española|música Latina|Canciones en Español|Pop Latino","159300","1429","0","171","https://i.ytimg.com/vi/GyCnGTUX3kw/default.jpg","False","False","Subscribe for more official content from Marco Antonio Solis - https://radi.al/MASLyrics: A la medidamuy pocas cosas en la vida encontrarásy con el tiemposin darte cuenta, en su momento lo verásA la medidasólo hallarás lo que cabe en tu corazónbuscando afueraes más certera una triste desilusiónCreo que venimosa este mundo nada más para aprendery sin pensarlotarde o temprano alguien te lo hará entenderCon tu permisocon mis defectos, a otro lado ya me voymas nunca olvidesque yo te amé con lo bueno y malo que soyNo hay hombre perfecto, no haycomo el que buscaste en míperfecta es la lluvia que caey no lo que tú has de elegirComo inventaste que era yoesa infalible soluciónque haría feliz por siempre a tu corazóntu hombre perfecto seráel que nunca a ti llegaráNo hay hombre perfecto, no haycomo el que buscaste en míperfecta es la lluvia que caey no lo que tú has de elegirComo inventaste que era yoesa infalible soluciónque haría feliz por siempre a tu corazóntu hombre perfecto seráel que nunca a ti llegaráListen to Marco Antonio Solis:Apple Music: http://bit.ly/3H65XWASpotify: http://bit.ly/3JkBLd1Amazon: https://bit.ly/3HAUXlLYouTube Music: https://radi.al/MASPandora: http://bit.ly/3WDnM57Follow Marco Antonio Solís:Facebook: https://www.facebook.com/marcoantoniosolisInstagram: https://www.instagram.com/marcoantoniosolis_oficialTwitter: https://twitter.com/MarcoASolisTikTok: https://www.tiktok.com/@marcoasolis_oficialOfficial site: http://www.marcoantoniosolis.comcontacto@marcoantoniosolis.mxMarco Antonio Solis — is a Mexican musician, singer, composer, and record producer. One of the most influential Mexican singer-songwriters in Latin America. Born in Michoacán, Mexico, he has almost 50 years of experience in music. The creator of hits such as “Si no te hubieras ido” and “Tu cárcel”, has sold more than eighty million copies and his catalog includes 16 albums with his group Los Bukis and 16 more as a soloist, which have been awarded various recognitions RIAA endorsed."
"BAZThwhaGMg","CONSTRUYENDO UNA CASA DE LEGOS CON IAN LUCAS🏠❤️ | Domelipa","2023-07-31T02:42:02Z","UC6x71GcLpFRJC15pWnq12NQ","Domelipa","24","23.02.08","[none]","560805","42451","0","2244","https://i.ytimg.com/vi/BAZThwhaGMg/default.jpg","False","False","BUENAS!!! Bienvenidxs a mi canalSíguenos en nuestras redes sociales:DOMELIPATikTok: https://www.tiktok.com/@domelipaInstagram: https://instagram.com/domelipaTwitter: https://twitter.com/domeelipaIAN LUCASYoutube: https://m.youtube.com/@IanLucasOficial TikTok: https://www.tiktok.com/@ianlucasokInstagram: https://instagram.com/ianlucas"
"SW5IAMcjUy4","Apex Legends: Resurrection Launch Trailer | Kill Code - Part 2","2023-07-31T15:00:11Z","UC0ZV6M2THA81QT9hrVWJG3A","Apex Legends","20","23.02.08","apex legends|apex|crypto apex legends|revenant apex legends|apex legends trailer|apex trailer|apex legends season 18 trailer|エーペックス|apex legends season 18|apex legends resurrection|apex トレーラー|apex season 18 trailer|apex resurrection|apex revenant|apex legend|apex season 18|apex legends revenant trailer|apex legends ps4|apex legends xbox|apex legends pc|battle royale game|apex lore|apex legends lore","2071068","79240","0","3091","https://i.ytimg.com/vi/SW5IAMcjUy4/default.jpg","False","False","Crypto hacks into a discarded fragment of Revenant to investigate some disturbing changes. Revenant is losing control of himself – but to who?Learn More: http://x.ea.com/apxl/resurrection  Apex Legends™ is a free-to-play* battle royale game where legendary characters battle for glory, fame, and fortune on the fringes of the Frontier. Play for free now on Xbox One, PlayStation 4, Nintendo Switch, and Origin for PC: http://x.ea.com/57366.Check out our YouTube channel: http://x.ea.com/56710.Follow us on Twitter: https://twitter.com/playapex.Follow us on Instagram: https://www.instagram.com/playapex/.CreditsProduction Company: Electronic Arts, Respawn Entertainment & PsyopSound Design/Mix: FormosaAll other categories: Electronic Arts & Respawn Entertainment*Applicable platform account and platform subscription (sold separately) may be required. Persistent internet connection and EA account required. Age restrictions apply. This game includes optional in-game purchases of virtual currency that can be used to acquire virtual in-game items, including a random selection of virtual in-game items."
"J9lQ2hAAcRo","SE ME PERDIÓ JUANITO EN EL CRUCERO DE DISNEY 🚢 (broma a JD) Kimberly Loaiza","2023-07-29T17:53:20Z","UCQZfFRohQ7UX-0CdXl-6pwQ","Kimberly Loaiza","22","23.02.08","team|juki|jukilop|teamjukilop|juan|de|dios|pantoja|reto|challenge|diversión|entretenimiento|vlog|blogs|nuevo|video|vlogs|blog|lindura|linduras|kimberly|loaiza|risas|musica","6479148","302686","0","13738","https://i.ytimg.com/vi/J9lQ2hAAcRo/default.jpg","False","False","LINDURAS GRACIAS POR VER ESTE VIDEO ME ENCANTARIA QUE LE DIERAN LIKE Y LO COMPARTIERAN FUERA DE GRAN AYUDA ✨ Sígueme en mis redes sociales ✨Instagram: https://www.instagram.com/kimberly.loaiza/Pagina de Facebook: https://www.facebook.com/kimberlyloaizaa/?ref=br_tfTwitter: https://mobile.twitter.com/kimberlyloaiza_Contacto: marcaskim@gmail.com"
"EV8rnE6fey4","Trolleé A Mi Amigo Convirtiendo MOBS en CHICAS en Minecraft","2023-07-31T19:00:07Z","UCdkYpnBPZeGnyS0EvASGMkQ","ARSEL","20","23.02.08","arsel|arsel minecraft|arsel y mario|vmario y arsel|arsel trolleos|hice trampas en minecraft|minecraft|vmario|dano|danomc|arsel y dano|arsel dano y mario|mario dano y arsel|Trolleé A Mi Amigo Convirtiendo MOBS en CHICAS en Minecraft|MOBS CHICAS|CHICAS MINECRAFT|MOBS SON CHICAS","348793","9208","0","326","https://i.ytimg.com/vi/EV8rnE6fey4/default.jpg","False","False","Trolleé A Mi Amigo Convirtiendo MOBS en CHICAS en Minecraft---------------------------------------------------------ENTRA A MI SERVIDOR DE MINECRAFT 👉 IP JAVA : play.deathban.es👉 IP BEDROCK : play.deathban.es (Puerto: 19132)👉 TIENDA:  https://tienda.deathban.es👉 DISCORD:  https://discord.deathban.es---------------------------------------------------------- SÍGUEME AQUÍ:👉 Twitter:  https://twitter.com/arseel​​_👉 Instagram:  https://instagram.com/arselitoo👉 Discord:  https://discord.com/invite/yRsNguXwDy----------------------------------------------------------  CONTACTO📩 Business:  arsel@ageworld-agency.com📩 Contacto:  arselcontacto@gmail.com"
