video_id,title,publishedAt,channelId,channelTitle,categoryId,trending_date,tags,view_count,likes,dislikes,comment_count,thumbnail_link,comments_disabled,ratings_disabled,description
"WK9aq0xZL98","ESTRENO ÉPICO! HAN VUELTO - Five Nights at Freddy's Security Breach RUIN (FNAF Gameplay Español) #1","2023-07-25T08:15:02Z","UCKmlxQVs0vHtaLldRIQ8lsA","iTownGamePlay *Terror&Diversión*","20","23.02.08","towngameplay|itowngameplay|town|itown|terror|miedo|gritos|sustos|entretenimiento|diversión|videojuegos|juegos|español|canciones|fnaf|roblox|creepypastas|música|game|games|horror|fun|happy|android|móvil|celular|IOS","611204","34022","0","1053","https://i.ytimg.com/vi/WK9aq0xZL98/default.jpg","False","False","💎 Hazte MIEMBRO y disfruta de muchas ventajas:http://youtube.com/iTownGamePlay/join Nos espera una aventura inolvidable, en un juego esperadísimo por todos los fans de FNAF, primer episodio de FNAF SB RUIN!, y es aterrador :O🎵 Escucha mis Canciones en Spotify: https://spoti.fi/3dd6iWW💖 ENVÍA un SUPER GRACIAS y daré CORAZÓN a tu COMENTARIO🎮 Descarga mi juego Dark Internet ¡disponible GRATIS!: Android: https://bit.ly/2Ry9Z3aIOS: https://apple.co/3bCQbGX👕 Compra las CAMISETAS OFICIALES del CANAL aquí: https://itowngameplay-merchandising.creator-spring.com/📖 COMPRA mi LIBRO con el Team !! El Multiverso del Terror: Atrapados🔥Compra el libro desde ESPAÑA ( Libro impreso / e-book ) ➡ https://amzn.to/40YPTyz💥Compra desde LATAM (Solo e-book ) ➡ https://amzn.to/430hK3d🌟 Apóyame ingresando mi Star Code ITOWN cuando compres Robux en ROBLOX😁 Más FNAF Security Breach Ruin: https://www.youtube.com/playlist?list=PLjP1J2wV_1fE2UItqV7zpvLb9Pc4x2FFbJuego: https://store.steampowered.com/app/1924720/Five_Nights_at_Freddys_Security_Breach__Ruin/👉 ¡No olvides suscribirte!: http://bit.ly/2dShrQJ🎤 Suscríbete a mi canal de música: https://www.youtube.com/user/HMAlvaroSígueme en TikTok e Instagram-------------------------------------------------------------🔥 TikTok: https://www.tiktok.com/@itowngameplay (Subo clips editados de mis vídeos en YT)-----------------------------------------------------------📸 Instagram: https://www.instagram.com/itownyt/ (Subo fotos)-------------------------------------------------------------------------💪 Agradecimientos Especiales a los Miembros del TERROR y del LEGENDARIOS del canal, que ayudan mucho con su apoyo:                              Liga de LEGENDARIOS: 1º - augmented foxy 114 (34 meses en el nivel Legendario) = 2696 puntos2º - Laura (25 meses en el nivel Legendario) = 1529 puntos  3º - Camilo y sus juguetes (14 meses en el nivel Legendario) = 284 puntos4º - Danalis (6 meses en el nivel Legendario) = 63 puntos5º - delfi (5 meses en el nivel Legendario) = 48 puntos6º - lunita_fan_de_zorros (3 meses en el nivel Legendario) = 24 puntos7º - LariV Dimas (2 meses en el nivel Legendario) = 15 puntos8º - XxivoyaxX (1 mes en el nivel Legendario) = 8 puntos9º - Nom4Trips_ (menos de 1 mes en el nivel Legendario) = 3 puntos10º - Valexipo (menos de 1 mes en el nivel Legendario) = 3 puntos11º - Sr Barba Negra (menos de 1 mes en el nivel Legendario) = 3 puntos12º - XannxietyyS (menos de 1 mes en el nivel Legendario) = 3 puntos-------------------------------------------------------        Liga de TERROR:     1º - LuckyBloZYT (1 mes en el nivel Terror) = 8 puntos                                                                                                                                             Cómo funciona el sistema de puntos:Menos de un mes: +3 puntos1 mes: +5 puntos2 meses: +7 puntos3 meses: +9 puntos4 meses: +11 puntos5 meses: +13 puntos6 meses: +15 puntos7 meses: +17 puntos8 meses: +19 puntos9 meses: +21 puntos10 meses: +23 puntos11 meses: +25 puntos12 meses/1 año: +30 puntos13 meses: +38 puntos14 meses +48 puntos15 meses +60 puntos    16 meses +74 puntos17 meses +90 puntos18 meses +108 puntos19 meses y siguientes +130 puntos"
"gSLGgTcvzsE","skibidi toilet 52","2023-07-25T07:05:00Z","UCsSsgPaZ2GSmO6il8Cb5iGA","DaFuq!?Boom!","24","23.02.08","toilet in ohio|skibidi meme|tiktok meme|sfm animation|funny animation|gmod animation|skibidi toilet vs cameramen|titan cameraman","32404346","1018772","0","60786","https://i.ytimg.com/vi/gSLGgTcvzsE/default.jpg","False","False","cameramen continue the cleaningskibidi dop dop dop yes yesfull-screen versionRespectful assets used in the video:suits - https://steamcommunity.com/sharedfiles/filedetails/?id=2849230339map - https://steamcommunity.com/sharedfiles/filedetails/?id=2558933448camera model - https://steamcommunity.com/sharedfiles/filedetails/?id=2903251774zoey - https://steamcommunity.com/sharedfiles/filedetails/?id=2564020204(if you're author of certain assets and I didn't credit you properly, please contact me)Contact me:instagram.com/dafuqboomtvblugrayguy@gmail.com"
"P38k7iMdb6o","Minecraft | El misterio de Grasswalker15 [FINAL] (ft. El último Tv-Nauta)","2023-07-25T21:45:00Z","UCMdVacSOgVTjrRiRU1D1RTg","LuLYeah","20","23.02.08","Español|comentado|gameplay|curiosidades|Minecraft|Bobicraft|Zowl|Miguel|Gamer|GrassWalker|IA|GW|ARG|OldRoot|TvNauta|Misterio|Theory|Mystery|Teoría|Legends|Dross|DrossRotzank","262234","22671","0","714","https://i.ytimg.com/vi/P38k7iMdb6o/default.jpg","False","False","Descarga Raid gratis ✅️ IOS/ANDROID/PC: https://www.t2m.io/LuLYeah y consigue un pack de bienvenida especial con un campeón épico ⚡️ Knight Errant ⚡️ULTRA SPOOKYMira la PARTE 2: https://youtu.be/hC-uCsxGUlU?si=L2ormTAqfs-oCIrOCanal de Grasswalker15:https://youtube.com/@grasswalker15?si=VGFsQU8sXDgzQDoele daría las gracias al TvNauta PERO YO HICE TODO WEYasí k solo le mandare un beso en el calabazo y yaarriba maincray díganle a GrassWalker que suba una actualización y k no mameTengo Twitter!https://twitter.com/LuLYeahTeamTambien tengo Facebook :Dhttps://www.facebook.com/LuLYeahTeamE-mail de contacto: lulyeah117@gmail.com"
"JrKv_LpRtK0","All The Angles of Naoya Inoue Highlight Reel KO of Fulton | Now Unified Champion | FIGHT HIGHLIGHTS","2023-07-25T13:15:01Z","UCbzRzJNHx7ZLlJML9BjZQVQ","Top Rank Boxing","17","23.02.08","top rank boxing|naoya inoue|井上尚弥|井上直哉亮點|井上直哉訓練|boxing|inoue vs fulton|fulton vs inoue|naoya inoue vs stephen fulton|inoue highlight|stephen fulton vs naoya inoue|井上vsフルトン|stephen fulton vs naoya inoue full fight|naoya inoue vs stephen fulton full fight|naoya inoue vs stephen fulton highlights|stephen fulton vs naoya inoue highlights|fulton vs inoue full fight|fulton vs inoue highlights|inoue vs fulton highlights|inoue vs fulton knockout|fulton inoue|inoue fulton","2123856","30735","0","8717","https://i.ytimg.com/vi/JrKv_LpRtK0/default.jpg","False","False","Watch the #highlights from the main event of #fultoninoue featuring #naoyainoue and #stephenfulton In the fight, it was all Inoue scoring a highlight reel ko victory to become unified champion.Next up for Top Rank Boxing, Pound-for-pound dynamo Seniesa Super Bad” Estrada will defend her WBC and WBA minimumweight world titles against Argentina’s former world champion Leonela Yudica on Friday, July 28 at Pearl Concert Theater at Palms Casino Resort in Las Vegas. In the 10-round junior lightweight co-feature, unbeaten Las Vegas native Andres “Savage” Cortes will take on Sacramento-born contender Xavier Martinez. The entire Estrada-Yudica card will stream live and exclusively in the U.S. on ESPN+. Promoted by Top Rank, tickets starting at $50 go on sale Thursday, June 15 at 12 p.m. PT and can be purchased at Ticketmaster.com.Try ESPN+ For Free: https://watch.espnplus.com/toprank/Subscribe to our YouTube channel to get notified about the latest highlights, free full fights, and fight week content as it's posted.Follow Top Rank on Twitter: http://www.twitter.com/trboxingFollow Top Rank on Instagram: http://www.instagram.com/toprankLike Top Rank on Facebook: http://www.facebook.com/trboxing"
"XL2uitZ0TvY","Heartstopper: Temporada 2 | Tráiler oficial | Netflix","2023-07-25T15:00:02Z","UC5ZiUaIJ2b5dYBYGf5iEUrA","Netflix Latinoamérica","24","23.02.08","alice oseman|heartstopper|heartstopper nuevos episodios|heartstopper parte 2|heartstopper segunda temporada|heartstopper t2|heartstopper temporada 2|joe locke|kit connor","249326","22865","0","1004","https://i.ytimg.com/vi/XL2uitZ0TvY/default.jpg","False","False","Nick, Charlie y compañía siguen aprendiendo a lidiar con los altibajos de la vida, el amor y la amistad. ¡Acompáñalos! 🍂SUSCRÍBETE: https://bit.ly/2W85El8Acerca de Netflix:Netflix es uno de los principales servicios de entretenimiento del mundo, con 238 millones de membresías de pago en más de 190 países. Nuestros miembros disfrutan de series, películas y juegos en una variedad de géneros e idiomas. Además, pueden reproducir, pausar y reanudar contenido cuando y donde quieran, y pueden cambiar de plan en cualquier momento.Sigue a Netflix Latinoamérica en:➡️TWITTER: http://twitter.com/NetflixLAT➡️INSTAGRAM: http://instagram.com/NetflixLAT➡️FACEBOOK: http://facebook.com/NetflixLATINOHeartstopper: Temporada 2 | Tráiler oficial | Netflixhttps://www.youtube.com/@NetflixLATAMCon exámenes, un viaje a París y el baile de graduación en el horizonte, Nick, Charlie y los demás deben surcar nuevos mares en la vida, el amor y la amistad."
"JakzABuiJbY","Asi es la “CIUDAD ZOMBI” (Documental)","2023-07-23T17:07:58Z","UCiwzI8XHuLUGbaUwSaeq1ow","Yulay","24","23.02.08","Yulay|llulai|Yulai|videos de yulay|yulay aventuras|fentanilo|ciudad zombie|kensington|philadelphia|filadelfia|estados unidos|droga zombie","2855830","82853","0","4008","https://i.ytimg.com/vi/JakzABuiJbY/default.jpg","False","False","¡SUSCRIBETE!Mi merch - https://chicomalo.com.mx/Canal en Inglés - https://www.youtube.com/IamYulayInstagram - https://www.instagram.com/yosoyyulayFacebook - https://www.facebook.com/yosoyyulayTwitter - https://twitter.com/YoSoyYulay ¡Subimos varios videos por semana! Partes del video:00:00 Intro00:55 ¿Dónde estamos?02:00 Camino a Kensington03:37 Señora en crisis04:25 Zombies 06:26 NO debo nada a nadie08:17 Origen (Es adictiva)🦠09:49 Cuidado☣️10:29 Necesito rehabilitación11:50 Barrio zombie12:51 5 años consumiendo 13:32 Parque de los piquetes16:24 Danko entrevista18:10 Transformación ( $3 pesos)20:09 ¿Que es la manteca?20:46 En la cima del viaje22:04 Viviendo en otra realidad23:25 Mezclan el veneno ☠️23:52 Debemos tener cuidado⚠️25:00 Vendedores26:51 Triste realidad CONTACTO / PRENSA / EMPRESA: losninos_heroes@hotmail.com"
"yhb6tSMyHiI","RATATOUILLE | TIENES que verla 2 VECES para ENTENDERLA | RESUMEN Y ANÁLISIS","2023-07-25T02:29:19Z","UC83J3suUsNnOacIkqOyKvhw","Farid Dieck","24","23.02.08","Ratatouille|Linguini|Ratatouille resumen|Ratatouille explicacion|Ratarouille remy|remy|Ratatouille colette|Ratatouille linguini|colette|farid dieck|faridieck","887529","45241","0","824","https://i.ytimg.com/vi/yhb6tSMyHiI/default.jpg","False","False","Remy, un ratón con ambiciones culinarias, desafía estereotipos para perseguir su pasión por la cocina. La película explora la autoaceptación, el coraje y  cómo la mente puede superar las limitaciones físicas y sociales.Conviértete en miembro de este canal para disfrutar de ventajas:https://www.youtube.com/channel/UC83J3suUsNnOacIkqOyKvhw/join"
"H1Bqq8t9bGo","Los Reyes De Latam Yair17 y Azoz MX VS Dejavu Y Ely2 😂 Por El Trono De M10 !!","2023-07-25T22:15:11Z","UCFuC4CIhDYSSZ80hlmNnqwA","Dejavu FF","20","23.02.08","garena|free fire|dejavum1014|rg4 dejavu|dejavu ff|dejavu|m1014|rey de la m1014|Soy Suco|Fede Vigevani|Ian Lucas|Trippie SB|ING Pablo|Fabru Blacutt|Nava Luis|TheDonato|Angel Fire|Marc|Caín Guzmán|Andrs BH|SopaTimmy|¿Cuánto Sabes?|BigChungus","991864","57868","0","2948","https://i.ytimg.com/vi/H1Bqq8t9bGo/default.jpg","False","False","✉ ▶ Correo de negocios: → dejavu@mcr-agency.com😎Mi Instagram → https://www.instagram.com/dejavu_exe/Los Reyes De Latam Yair17 y Azoz MX VS Dejavu Y Ely2 😂 Por El Trono De M10 !!❤️Mi Tiktok→ https://www.tiktok.com/@dejavu.new💛Mi Pagina de Facebook→ https://facebook.gg/dejavuff😱Mi twitter→ https://twitter.com/Dejavux100💯Mi Discord→ https://discord.gg/PjXkrqsM#dejavu #freefire #dejavuff #tiktok"
"yZhMQN7v4L8","Robo Un Hyper Auto Modificado A mis Amigos Millonarios 😂 Gta Rp","2023-07-25T18:00:10Z","UCo7CGcPjyP9G5LMzSRjvyEQ","Nino LIVE","20","23.02.08","gta 5|gta v|grand theft auto v|grand theft auto 5|vista gamer|nino live|gta 5 roleplay|gta v roleplay|millonarios|robo un hyper auto|Modificado a mis amigos|Millonarios Gta Rp|Thenino|Nino live|nino videos|nino gta rp|thenino gta|videos de gta rp|videos de gta risas|videos de risa|videos de carreras gta|carreras de gta v|rd javi|el cojo|cojo aventuras|nuevo auto del casino gta 5|nuevo auto de el cojo|nuevo auto de thenino|nuevo auto de rdjavi","288081","11443","0","301","https://i.ytimg.com/vi/yZhMQN7v4L8/default.jpg","False","False","Este es un video de diversion Solo disfrutatelo espero y te guste como me robe este Hyper Auto Modificado al ChinoRB y a Yimmy en sus casas de millonarios 😂 Si quieres Mas Videos asi Dejalo en los comentarios. Suscribete o tendras mala suerte. ╔═╦╗╔╦═╦═╦╦╦╦╗╔═╦══╦═╗║╚╣║║║╚╣╔╣╔╣║╚╣═╬╗╔╣═╣╠╗║╚╝╠╗║╚╣║║║║║═╣║║║═╣ ╚═╩══╩═╩═╩╝╚╩═╩═╝╚╝╚═╝NEGOCIOS : nino@trihaus.es🥺Sigueme o te pateare.Instagram : TheNinoYTTwitter : TheNinoTik Tok : TheNinoYT#hyper #auto #thenino"
"DAOZJPquY_w","Post Malone - Mourning (Official Music Video)","2023-07-24T15:00:09Z","UCOhtMAg7xh8wv_wUHMgFc-Q","PostMaloneVEVO","10","23.02.08","Post|Malone|Mourning|Mercury|Records/Republic|Records|Pop","5897333","271903","0","6884","https://i.ytimg.com/vi/DAOZJPquY_w/default.jpg","False","False","Music video by Post Malone performing Mourning. © 2023 Mercury Records/Republic Records, a division of UMG Recordings, Inc.http://vevo.ly/Zmtdg4"
"VaCcVSMgWuM","24 CITAS EN 24 HORAS A MI MEJOR AMIGO!","2023-07-24T23:00:49Z","UCmzDf_a7CCFuxos7hspcWRQ","Ian Lucas","22","23.02.08","ian lucas|reto|challenge|hermanito|hermanos|hermanito ian lucas|mansion ian lucas|ian y teo|teo y ian|casa ian lucas|fede vigevani|dosogas|fedecole|fede|fede y sus vecinos|fede vecinos|ian|casa fede|casa ian|casa de ian lucas|24 CITAS EN 24 HORAS A MI MEJOR AMIGO!|24 citas en 24 horas|24 citas|24 horas|en 24 horas|citas|citas amigo|citas mejor amigo|mujer|mujeres|mi mejor amigo","6364680","345836","0","24276","https://i.ytimg.com/vi/VaCcVSMgWuM/default.jpg","False","False","QUIEN DIJO? - Ian Lucas: https://youtu.be/T98au8vKPo8 DEJA TU LIKE PARA 2DA PARTE!SUSCRIBITE PARA PRÓXIMOS VÍDEOS: https://www.youtube.com/user/ianlucasoficial?sub_confirmation=1SEGUINOS EN INSTAGRAM! :)https://instagram.com/ianlucashttps://instagram.com/fedevigevanihttps://instagram.com/simonahuedhttps://www.instagram.com/ivanve__Canal de fede: @fedevigevani  Instagram de las chicas:https://instagram.com/melseiler_https://instagram.com/sofia.martina01https://instagram.com/handle__musichttps://instagram.com/nikipinkyhttps://instagram.com/francinamolinaahttps://instagram.com/brisamicaelakhttps://instagram.com/mayadekeukeleere2.0 https://instagram.com/yess_olivierihttps://www.instagram.com/mays_auuhttps://instagram.com/mafpayan124 CITAS EN 24 HORAS A MI MEJOR AMIGO!CONTACTO/PUBLICIDAD: info@ianlucasok.com"
"1E_ghf9u1W4","Sobreviví los 40 días MAS DIFICILES de MINECRAFT","2023-07-24T22:30:00Z","UC4DLCrt55UwaDvAswIr_59A","SpreenDMC","20","23.02.08","Juego|Spreen|Español|PS4|XBOX|PC|Spanish|SpreenDMC|Youtube Fortnite|Videos de Bromas|Bromas|Gracioso|hackers|Staff series en español|Argentina|Humor|Risas|Divertido|Comentado|hack|rush|skywars|fortnite|staff series|xray|hacker","1937320","119255","0","2404","https://i.ytimg.com/vi/1E_ghf9u1W4/default.jpg","False","False","Canal Spreen:https://www.youtube.com/channel/UCgTOIiEgjm58xLjHvDjmgdA/videos● ¡Sigueme por aqui! 👀• Instagram: https://www.instagram.com/ivan_buhaje/• Twitter (Personal): https://twitter.com/ivan_buhaje• Twitter: https://twitter.com/SpreenDMC----------------------------------------------------------------------------------------------------------COMPRA MI CAPA! O USA MI CÓDIGO EN LA COMPRA DE CUALQUIER COSMÉTICO!https://store.badlion.net/referral/SpreenUSANDO EL CODIGO Spreen----------------------------------------------------------------------------------------------------------Canciones de la outro: https://www.youtube.com/user/8BitUniverseMusic#SpreenDMC"
"a0H8H2QXDDs","Usamos Un Tanque Blindado Para Eliminar Un Estafador Gta Rp","2023-07-25T22:00:07Z","UCzjF2EUojZ1hVd_JVKhbCJA","RDjavi","20","23.02.08","rdjavi|carros potentes|El cojo|cojoaventuras|creativos rp|danirep|vegeta777|mexico|roleplay|rp|carros con 1000hp|ibai carreras gta|auron carreras|colombia|panama|venezuela|argentina|gaming españa|el carro mas potente|rolplay|rol|gta rp|CojoAventuras|GTA|motos|moto vs helicoptero|guatemala|peru|chile|yate|BMW|tanque blindado|tanque de guerra|elimionamos un estafador|usamos un tanque blindado|tanques de guerras|estafadores|tanques disparando","1526500","93149","0","5679","https://i.ytimg.com/vi/a0H8H2QXDDs/default.jpg","False","False","LasCojoAventuras hoy decidimos contratar mercenarios y un tanque  de guerras blindado para hacerle frente y quitarle un BMW I8 convertible a un estafador que nos metio en el problema mas grande que  hemos enfrentado pero las cosas se complican cuando uno de nuestros aliados nos traiciona 📸 Sígueme en Instagram: https://instagram.com/rdjavi_?utm_med...💜Mira mis directos: https://twitch.tv/rdjavi💬 Entra en mi servidor de Discord: https://discord.gg/8rVruJ5Q5v📱 Sígueme en TikTok: https://vm.tiktok.com/ZM8wMnbVq/📩 Contacto: rdjavi.negocios@gmail.comGRACIAS POR VER EL VIDEO RECUERDA DEJAR TU LIKE Y SUSCRIBIRTE 🤗 #GTA #TANQUE #BMW"
"_ZYV2Db4ALI","LA RULETA DEJÓ A TODOS CALVOS 👨‍🦲 (Ruleta de castigos y premios) Juan de dios Pantoja","2023-07-22T23:48:39Z","UCzoUWqjCbcfWFdOMvoep8FA","Juan De Dios Pantoja","22","23.02.08","Team|juki|Juan|De|Dios|Pantoja|jd|youtube|retos|reto|tag|tags|Challenge|nuevo|video|risa|comedia|diversión|extremo|música|roast","6817817","259808","0","4460","https://i.ytimg.com/vi/_ZYV2Db4ALI/default.jpg","False","False","Hola familia PANTOJITA 💎 gracias por tenerme de nuevo en sus pantallas 😃 estoy muy contento y agradecido por todo el apoyo que siempre me dan, GRACIAS POR SER PARTE DE ESTA FAMILIA QUE TANTO AMO ❤️🙏🏻▪️SIGUEME EN MIS REDES SOCIALES QUIERO CONECTARME MAS CONTIGO:• INSTAGRAM: @JuandediosPantoja -  https://bit.ly/2vWtdSj • TWITTER:  @Juandedios_P - https://bit.ly/2OY3UYN• PAGINA DE FACE: Juan De Dios Pantoja Corona - https://bit.ly/2KHVW2E 📩 : marcasjddp@gmail.com"
"ZXn6_2r5-PE","TV MAN y TV WOMAN TIENEN UN HIJO EN MINECRAFT 😲 ¿SON PADRES? 📺📺 TVMAN MINECRAFT","2023-07-24T23:12:21Z","UCqHI-maN5C2bU3HXP7ftTgQ","El TV MAN","20","23.02.08","[none]","587762","19961","0","343","https://i.ytimg.com/vi/ZXn6_2r5-PE/default.jpg","False","False","TV MAN y TV WOMAN TIENEN UN HIJO EN MINECRAFT 😲 ¿SON PADRES? 📺📺 TVMAN MINECRAFT📺Bebe TvMan: @bb_tvman  🟣Tv Woman:   @tvwomanreal  🔴 Speakerman:  @El_Speakerman  🔵Titan Camera:  @Titan_CameramanReal  ​⚪Skibidi Boss:  @skibidibosstoilet"
"YmgUWIfsALg","THE BLOB NOS ESTÁ VIGILANDO... | FNaF Security Breach RUIN #1","2023-07-25T07:55:41Z","UCFgPgD20NBkt27gRrqaIKvg","GG Games","20","23.02.08","gg|games|gg games|fnaf|fnaf gg games|gg games fnaf|fnaf gggames|gggames|five|nights|at|freddy|five nights at freddy's gg games|gg games five nights at freddy's|five nights at freddy's|security breach|fnaf sb|ruin|gg games ruin|ruin security breach|security breach ruin|ruin fnaf|fnaf ruin|ruin gg games|gg games sb ruin|ruin dlc|ruin español|gg games security breach|security breach gg games|gg games ruin dlc|gg games gameplay ruin|ruin secretos","212626","17731","0","1018","https://i.ytimg.com/vi/YmgUWIfsALg/default.jpg","False","False",".📖 COMPRA YA nuestro LIBRO de EL TEAM, El Multiverso del Terror: Atrapados!🔥 Compra el libro desde ESPAÑA (Libro impreso / e-Book) ➡ https://amzn.to/40YPTyz💥Compra desde LATAM/Otro País (Solo e-Book) ➡ https://amzn.to/430hK3dℹ️ INFO del LIBRO → https://youtu.be/cceQsoaotF8___________________________________________TODAS MIS Redes Sociales ORDENADAS:https://bio.link/gggames___________________________________________↓ 𝙍𝙀𝘿𝙀𝙎 𝙎𝙊𝘾𝙄𝘼𝙇𝙀𝙎 ↓CANAL VARIADO (GG Gameplays):https://www.youtube.com/channel/UCXviJYlZM-dCO5nC6-A0IrwCANAL de CLIPS (GG Games Clips):https://www.youtube.com/channel/UCsEAl20vDhtOsArM6Dk_XUwТWlТCН (Está en mi web de redes!):https://bio.link/gggamesMERCH OFICIAL de GG Games:https://gggames.creator-spring.com/Únete al Canal!:https://www.youtube.com/channel/UCFgPgD20NBkt27gRrqaIKvg/join𝐂𝐎́𝐃𝐈𝐆𝐎 GGGAMES 𝐄𝐍 𝐋𝐀 𝐓𝐈𝐄𝐍𝐃𝐀 𝐃𝐄𝐋 𝐅𝐎𝐑𝐓𝐍𝐈𝐓𝐄! INSTAGRAM:https://www.instagram.com/gg.games87/TWITTER:https://twitter.com/games878787Apoya mis otros Proyectos en PATREON:https://www.patreon.com/gggames_TIKTOK:https://www.tiktok.com/@gg_games_oficial?lang=esDISCORD:https://discord.com/invite/h8dQqf8TIENDA ROBLOX:https://www.roblox.com/groups/5973044/GG-Games-Roblox#!/storeAMINO:https://aminoapps.com/c/GG_FANS/home/CANAL DE MI PADRE:https://www.youtube.com/channel/UCY-ClofqoNLfOEbiJw1JKoQ↑ 𝙍𝙀𝘿𝙀𝙎 𝙎𝙊𝘾𝙄𝘼𝙇𝙀𝙎 ↑___________________________________________#FNaF #SecurityBreach #RUIN"
"MOutiWPvplQ","¡TV WOMAN ES DEMASIADO REALISTA!","2023-07-25T18:20:47Z","UC7XhSR4zv8xKfiP0-zp9jBQ","El Gato en Español","20","23.02.08","[none]","755338","13421","0","93","https://i.ytimg.com/vi/MOutiWPvplQ/default.jpg","False","False","Iba caminando por la playa y la vi, MUJER DE LA TELEVISIÓN a mi lado. Colaboración: iqstudiobusiness@gmail.com#brookhaven #skibiditoilet #skibiditoiletquiz #skibidi"
"extJ85cuFNw","VLOG EN MADRID 😮😮😮","2023-07-23T20:00:10Z","UCN5-GZpwKi8ISEt2eBoznpw","aldo_geo","20","23.02.08","aldo geo|vlog|madrid|velada 3|la velada del año|la velada del año 3|twitch","428808","37142","0","418","https://i.ytimg.com/vi/extJ85cuFNw/default.jpg","False","False","Aqui les traigo un nuevo video en el cual  les muestro mi viaje a Madrid para la Velada del año 3 :D, espero les guste, no olviden darle like, suscribirse y activar notificación, los TKM 🥰 Stream por twitch a partir de las 8:00 pm hora mexico Recuerden seguirme en mis redes para estar al tanto :)|| Redes ||Twitch: https://twitch.tv/aldo_geoTwitter: https://twitter.com/aldogeotvInstagram: https://www.instagram.com/_aldogeo_/TikTok: https://www.tiktok.com/@aldo_geo?lang=es#aldogeo #vlog #twitch #laveladadelaño #veladadelaño3 #velada3 #madrid #españa"
