video_id,title,publishedAt,channelId,channelTitle,categoryId,trending_date,tags,view_count,likes,dislikes,comment_count,thumbnail_link,comments_disabled,ratings_disabled,description
"dfr31ih7R0s","Ma ///M4 avec les GIGA TURBO est finie !","2023-07-30T10:00:27Z","UCMSA4KvFVDy45aQ3OnrGADA","thierry vigneau Boiserie","2","23.02.08","[none]","585807","33649","0","918","https://i.ytimg.com/vi/dfr31ih7R0s/default.jpg","False","False","Je l'ai laissé entre les mains de Médo, il a mit des cv🤯🟠Précèdents épisodes : https://www.youtube.com/watch?v=oP-HIyAnB7E&list=PLgjux3qGih8MyRWby_P6Axbn__hXEehc9&index=5&ab_channel=thierryvigneauBoiserieDécouvre ma nouvelle collection 👕 :https://la-boiserie.fr/pages/collectionAbonne-toi mon copain pour passer les 2 millions 🔥🔥Pour avoir des exclus c'est ici :👉 INSTA : @thierryvigneauboiserie (1.2M)👉 SNAP : luluvng (1m)👉 FACEBOOK : thierryvigneauboiserie (1M)👉 TIKTOK : thierryvigneauboiserie (700k) Mail pro : contact.laboiserie@gmail.com"
"nsKx3SF4-RI","ON JUGE LE MACDO EN CHINE (la galère)","2023-07-30T09:00:34Z","UC97S5Uiopake8FiOLCy3rkg","Tev & Louis","24","23.02.08","[none]","221652","12191","0","408","https://i.ytimg.com/vi/nsKx3SF4-RI/default.jpg","False","False","Notre boutique de vêtements: https://tevetlouis.com/collections/frontpagePour nous soutenir: http://www.candysan.com Notre chaîne Twitch: https://www.twitch.tv/tev_et_louisChaîne principale de Louis: https://www.youtube.com/LouisSanChaîne principale de Tev: https://www.youtube.com/IciJaponInstagram de Louis: https://www.instagram.com/louis_zenjasInstagram de Tev: https://www.instagram.com/icijaponTwitter de Louis: https://twitter.com/louis_zenjasTwitter de Tev: https://twitter.com/icijaponMail pro: tev.louis.pro@gmail.com"
"_-ohH4FsPV4","Exclusif, les coulisses de France-Brésil (2-1). Chroniques du Mondial #38 I FFF 2023","2023-07-30T10:13:35Z","UCeJlXGyEl7kBgQJKADAHM3A","Fédération Française de Football","17","23.02.08","FFF|FFF TV|Equipe de France|les bleus|french|french team|soccer|football","125727","2864","0","319","https://i.ytimg.com/vi/_-ohH4FsPV4/default.jpg","False","False","Découvrez de l'intérieur la préparation et le déroulement de cette rencontre du groupe F de la Coupe du Monde, remportée par les Bleues à Brisbane grâce à deux buts signés de la tête par Eugénie Le Sommer et Wendie Renard. Les joueuses d'Hervé Renard ont désormais rendez-vous mercredi face au Panama, à Sydney (en direct dès midi, sur France 2).--------------------------------------------------------------------------------------------FFF : https://www.fff.frFacebook : https://www.facebook.com/fffTwitter :  https://www.twitter.com/FFFEQUIPES DE FRANCE : https://www.fff.fr/equipes-de-france Facebook :  https://www.facebook.com/equipedefranceSnapchat :  http://po.st/SnapchatEdFTwitter :  https://www.twitter.com/equipedefrance  Instagram :  https://www.instagram.com/equipedefrance Coupe de France : https://www.fff.fr/coupes Facebook :  https://www.facebook.com/coupedefranc... Twitter :  https://www.twitter.com/coupedefrance CHAMPIONNAT NATIONAL : http://po.st/yTSGBt Facebook : https://www.facebook.com/nationalFFF  CNF CLAIREFONTAINE :  http://www.cnf-clairefontaine.com Facebook :  https://www.facebook.com/fffTwitter :  https://www.twitter.com/FFF--------------------------------------------------------------------------------------------La Fédération Française de Football (F.F.F.) est une association loi de 1901 qui a pour mission:- d'organiser la pratique du football, sous toutes ses formes;- d’établir les règles techniques;- de délivrer les titres et gérer les sélections nationales;- de procéder à la délivrance des licences;- de définir et de mettre en œuvre un projet global de formation;- de défendre les intérêts du football français."
"SYye1bvmj1Y","TU PERDS ? TU MANGES UNE DROITE  feat @LeBouseuh","2023-07-31T15:50:05Z","UCJMvCyy_DqvyedtQOJm4tvQ","PAUL DENA","22","23.02.08","[none]","65596","4188","0","119","https://i.ytimg.com/vi/SYye1bvmj1Y/default.jpg","False","False","Wassup my boys, Vidéo plus chill que la dernière pour éduquer un peu les néophytes du domaine et qui veulent en apprendre plus sur la MMADites nous en commentaires si vous souhaitez une partie 2 dans Rennes avec Baki possiblement.Merci à mes sponsors qui me permettent de m'investir à fond dans mes entrainements: @nutriandco  mes compléments alimentaires, vous avez -10% avec le code pauldena sur le site https://c3po.link/QwBrSKnWsc @ROGUE_EXP   vélo électrique https://www.rogue-shop.com/produit/super73-zg/-100€ avec le code DENA100Mes réseaux:insta: pauldenisnaveroTikTok: pauldenisnaveroMusic by Leokumo Instagram et Soundcloud : Leokumo"
"8g4Hg7pNGKw","EXTENDED HIGHLIGHTS | Man City 1-2 Atletico Madrid | Dias scores in narrow defeat to Atletico","2023-07-30T15:56:21Z","UCkzCjdRMrW2vXLx8mvPVLdQ","Man City","17","23.02.08","man city|manchester city|mcfc|fifa 22|man city highlights|man city goals|city|man|city vs|man city vs|chelsea man city|man city news|man united|chelsea|liverpool|man city v|city fixtures|city vs united|man city fixtures|grealish man city|jack grealish man city|jack grealish|haaland","2991105","42336","0","1607","https://i.ytimg.com/vi/8g4Hg7pNGKw/default.jpg","False","False","Manchester City completed our pre-season tour of Asia with a 2-1 defeat to Atletico Madrid in Seoul.SUBSCRIBE! http://www.youtube.com/subscription_center?add_user=mancityhttp://www.mancity.comhttp://www.facebook.com/mancityhttp://www.twitter.com/mancityhttp://www.instagram.com/mancityhttps://www.tiktok.com/@mancityAbout the Official Man City YouTube Channel:Here you will find all the latest videos from Manchester City, including, all Premier League goals, highlights, behind-the-scenes footage, training and much more.Get closer to the likes of Jack Grealish, Bunny Shaw, Kevin De Bruyne, Lauren Hemp, Erling Haaland, Riyad Mahrez, Ellie Roebuck Phil Foden, Esme Morgan and the rest of Pep Guardiola & Gareth Taylor's teams!"
"DHoEEjD3QH0","INOXTAG VS GMK 🔞 IL CONDUIT MA M3  DE 912 CHEVAUX 😱😨 (JE SUIS PAS BIEN)","2023-07-29T16:29:12Z","UCWPOLkftHreB1p8ospsiApw","GMK","2","23.02.08","GMK001|GMK|Maroun|Kikano|C63|AMG|Camo|RS6|M3|Bentayga|Sound|Top|AUDI|RS3|RS4|RS5|RS7|BMW|MOTORSPORT|Referencement|M2|M4|M5|M6|compétition|C63s|E63|GLE63|tuning|prepa|moteur","830556","68630","0","2039","https://i.ytimg.com/vi/DHoEEjD3QH0/default.jpg","False","False","Pensez à m'ajouter sur instagram: GMK001 http://www.instagram.com/gmk001"
"99dTNLPmGtE","SpaceX teste son déluge à pleine puissance et découpe le SN15 - Starship Update n°90","2023-07-31T16:00:06Z","UCLg3UuuZ8_gn9Z3XyrzDKhg","StarBase FR","28","23.02.08","starbase|star base fr|starship|spacex|elon musk|starlink|falcon 9|super heavy|journal de l'espace|journal espace|hugo lisoir|astronogeek|fusée|spatial|espace|bocachica|boca chica|starbasefr|mechazilla|starship spacex|spacex starship|starship update|space x|starbase spacex|boca chica ive|spacex super heavy","56906","3404","0","300","https://i.ytimg.com/vi/99dTNLPmGtE/default.jpg","False","False","▶️ Bienvenue pour cette nouvelle #Starship Update, la série dédiée à l’avancement des travaux de la #Starbase de #SpaceX. Chaque semaine, je vous propose de suivre l’évolution du chantier de #Bocachica, la construction de l’immense Starfactory, l’extension du site de production, l’assemblage et les essais des nouveaux prototypes. Pour être certain de ne rien manquer, pensez à vous abonner!—----------------------------------------------------👉 Pour soutenir la chaîne, rejoignez mon Patreon: https://www.patreon.com/starbase_frVos dons m’aident à soutenir les photographes et graphistes sans qui cette chaîne n’existerait pas. MERCI :)👉 Devenez membre YouTube pour bénéficier d'avantages exclusifs :https://www.youtube.com/channel/UCLg3UuuZ8_gn9Z3XyrzDKhg/join—----------------------------------------------------💬 Pour ne rien manquer de l’actu, rejoignez-nous sur le discord Starbase FR: https://discord.gg/BxjkprBVjsMon compte twitter: https://twitter.com/starbase_frVous pouvez aussi me contacter par mail: starshipupdate @ gmail.com—----------------------------------------------------Chapitrage:00:00 - Intro00:44 - La table de lancement02:01 - L’étage zéro03:16 - Méchazilla04:19 - Les derniers “tweets”05:41 - Le test du déluge08:36 - Les travaux du déluge10:07 - Le mega bay 211:21 - La starfactory12:32 - Le Ship 2713:38 - Les sections test14:23 - Le Ship 2815:02 - Les futurs Ships16:10 - Les adieux du SN15📷 Sources spécifiques à cet épisode:La chaîne de Cosmic Perspective: https://www.youtube.com/@CosmicPerspectiveLa chaîne de Staship Gazer: https://www.youtube.com/@StarshipGazerLa page twitter de Toney (TDSN): https://twitter.com/TDSN19La chaîne de What About it: https://www.youtube.com/@Whataboutit📣 Merci à Andrew Keating et Cosmic Perspective pour leur soutien et le partage de l’enregistrement audio de l’intro de la chaîne: https://www.youtube.com/@CosmicPerspective📣 Un grand MERCI au photographe Starship Gazer qui me fait confiance pour utiliser ses images: https://twitter.com/StarshipGazer📣 Remerciement spécial à Ryan Hansen Space pour le partage de sa passion et de ses rendus 3D incontournables pour suivre le projet Starship📷 Miniature:Photos de SpaceX🎬 Compte à rebours des Premières YouTube:https://youtu.be/T_bXeiYr7b0🎧 Crédits musicaux (par ordre d’apparition):https://soundcloud.com/sappheirosmusicSappheiros - SpiritSappheiros - DawnSappheiros - AscendSappheiros - UniverseSappheiros - SorrowSappheiros - ParadiseSappheiros - DistantSappheiros - Celestial▶️ All images and pictures are credited on screen. In case of copyright issues, please contact me directly by email or PM - Toutes les images et vidéos de cet épisode sont créditées à l'écran. En cas de problème, merci de me contacter.◻️ Merci de soutenir le travail des photographes:https://twitter.com/RGVaerialphotoshttps://twitter.com/cnunezimageshttps://twitter.com/StarshipGazerhttps://twitter.com/NicAnsuini◻️ Merci à la Team Space pour le partage des diagrammes et des infographies:Zack Golden / CSI Starbase: https://twitter.com/CSI_StarbaseLes Ring Watchers: https://twitter.com/RingwatchersNick: https://twitter.com/ChameleonCirStarship 3D: https://twitter.com/DStarship3Lunar Caveman: https://twitter.com/LunarCavemanFelix Schlang / What about it: https://twitter.com/FelixSchlangBrendan Lewis: https://twitter.com/_brendan_lewisVixxie: https://twitter.com/VickiCocks15◻️ Merci de soutenir les artistes / graphistes:https://twitter.com/RyanHansenSpacehttps://twitter.com/ChameleonCirhttps://twitter.com/Benedikt_3Dhttps://twitter.com/2legit2quit3dhttps://twitter.com/Lolomatico3dhttps://twitter.com/ChristianDebneyhttps://twitter.com/m_tijnhttps://twitter.com/nickhenning3dhttps://twitter.com/Bl3D_Eccentrichttps://twitter.com/3DDaniel1https://twitter.com/AlexSvanArthttps://twitter.com/ErcXspacehttps://twitter.com/Neopork85https://twitter.com/soder3d◻️ Pour ne rien manquer des actus, abonnez-vous aussi à:RGV Aerial photography: https://www.youtube.com/c/RGVAerialPhotographyLab Padre: https://www.youtube.com/c/LabPadreRyan Hansen Space: https://youtube.com/@RyanHansenSpaceCSI Starbase: https://youtube.com/@CSIStarbaseWhat About it: https://www.youtube.com/@WhataboutitNASA Space Flight: https://www.youtube.com/c/NASASpaceflightVideosCosmic Perspective: https://youtube.com/@CosmicPerspectiveOwe: https://www.youtube.com/c/Spacex3DCreationEccentricErc X Space: https://www.youtube.com/c/ErcXSpaceAlexander Svan: https://www.youtube.com/watch?v=Cjq85zVUW7AC-bass 3D: https://www.youtube.com/c/CbassProductionsTijn M: https://www.youtube.com/channel/UCDA8yz_nQY-0Uxd96-qxYjANick Henning 3D: https://www.youtube.com/channel/UC0k6WvuPJUp7BKkbCOjefsgEvan Karen: https://www.youtube.com/c/EvanKarenSoder 3D: https://www.youtube.com/channel/UCaXhno4hyvGa5fMsa6mf75gIamvisual: https://youtu.be/VgUGvNLXly8"
"7tEzeRKlSRw","Je dois finir Minecraft mais sur un bloc et une bordure de 1x1..","2023-07-31T08:30:01Z","UCwknS-xVvhbXnSO5lF336Tg","GEMI MC","20","23.02.08","minecraft|GEMI MC|gemi|mode|challenge|finir minecraft mais|minecraft mais|minecraft un block|survie|defi|vidéo minecraft|noob|troll|pro|joueur minecraft|un chunk|minecraft un chunk|chunk minecraft|one block|block|1 block|bordure|1x1","40227","1623","0","118","https://i.ytimg.com/vi/7tEzeRKlSRw/default.jpg","False","False","Dans cette vidéo Je dois finir Minecraft mais sur un bloc et une bordure 1x1.. (2400 likes pour une suite! )_________________________________________Discord : https://discord.gg/PhttWX5nQUTwitch : https://www.twitch.tv/gemistreamTwitter : https://twitter.com/gemioffimail pro : gemi@rachimedia.com"
"2wYT6TZ7yV0","Samuel Processeur a retourné Planète Rap 🤯🤯🤯","2023-07-30T08:26:27Z","UCtxhwJ-6n4_C6ElALThD25Q","Mcfly et Carlito la chaîne secondaire","22","23.02.08","[none]","158334","17418","0","322","https://i.ytimg.com/vi/2wYT6TZ7yV0/default.jpg","False","False","Samuel Processeur, ingénieur en angle a bien évolué et il a eu la chance d'être accueilli par Fred pour une session mémorablePrésenté par Fred MusaRéal - Lucas Peron  https://www.youtube.com/@lucasppeL’équipe de fou géré par Julio : LauCarréRocket, Flacoo, Martel, Adrien Dezeusse, Marvin, Naël , Marc ,YANNOMELIXO vous avez géré les gars. Merci à Laurent Bouneau  et toutes les équipes pour leur accueil Musique Ecrite par Carlito et Erika FleuryComposé et Mixé par Martin Bonami Rejoignez notre discord : https://discord.gg/mcflyetcarlitoINSTAGRAM★ https://www.instagram.com/rafcarlito★ https://www.instagram.com/levraimcflyTIKTOK@mcflyetcarlitoTWITTER ✔ https://twitter.com/levraimcfly✔ https://twitter.com/raphael_carlier** Règles de l’espace commentaires :- Ecrire dans un français correct (surtout pour Carlito ça)- Écrire de façon respectueuse - Pas de pubs, de spams du genre « me manque un abonné pour devenir stylé » ou encore « 3500 vues sans passer par Youvues, bravo ! »"
"CdZN8PI3MqM","Ticking Away ft. Grabbitz & bbno$ (Official Music Video) // VALORANT Champions 2023 Anthem","2023-07-31T14:00:07Z","UC8CX0LD98EDXl4UYX1MDCXg","VALORANT","20","23.02.08","VALORANT|VALORANT Champions Tour|VALORANT Esports|VALORANT Tournament|VALORANT Grabbitz|Grabbitz Die For You|VALORANT Cinematic|VALORANT Music Video|Champions Music Video|VCT Music Video|VALORANT song|VALORANT anthem|Champions anthem|valorant esports music|valorant champions music|riot games music|VALORANT Los Angeles|Los Angeles|VALORANT TICKING AWAY|VALORANT TICKIN' AWAY|Ticking Away VALORANT|bbno$|Grabbitz|Music Video|Angeles|2023|Champions","1322209","114005","0","3634","https://i.ytimg.com/vi/CdZN8PI3MqM/default.jpg","False","False","A story we all know too well. Of growing up, growing apart, and staying together across the many One More’s of life, love, and VALORANT.Check out the official anthem and music video for Champions 2023 “Ticking Away ft. Grabbitz & bbno$”. LISTEN NOW: https://found.ee/TickingAway Spotify: https://found.ee/TickingAway-Spotify Apple Music: https://found.ee/TickingAway-AppleAmazon Music: https://found.ee/TickingAway-AmazonYoutube Music: https://found.ee/TickingAway-YouTubeDeezer: https://found.ee/TickingAway-DeezerFollow the VALORANT Champions Tour on socials for more action:Twitter: https://twitter.com/valorantesportsInstagram: https://www.instagram.com/valorantesportsFacebook: https://www.facebook.com/ValorantEsportsTikTok: https://www.tiktok.com/@valorantesportsEverything You Need To Know About VALORANT Champions Los Angeles 2023https://www.youtube.com/watch?v=215JySun87IChampions Los Angeles: Everything You Need to Knowhttps://valorantesports.com/news/valorant-champions-2023-everything-you-need-to-know/VALORANT - Free Sign Up, Download & Playhttps://playvalorant.com/#VALORANT #VALORANTChampionsTour​ #VALORANTChampionsPRODUCTION CREDITS:Ticking AwayFeatured artists: Grabbitz and bbno$Written by: Grabbitz and bbno$Produced by: GrabbitzVocal production by: GrabbitzAdditional production by: bbno$Mixed by: Tom NorrisMastered by: Randy Merrill at Sterling SoundVocals performed by: Grabbitz and bbno$P/C Riot Games 2023https://grabbitzmusic.comhttps://fanlink.to/listentobbnomulaMusic Video: Created in partnership with WIZZhttps://wizz.fr/Lyrics:I need to keep you aroundWith my feet tiedWith my feet tied tight to the groundThe end's nowhere to be foundI don’t know whyYou don’t leave me to drown oh-oh-ohDon’t know where to go unless you sayDon’t know what to do unless you stayThinking that today will be our dayWill be our day againWhy am I playing with time as it’s ticking away?It's tickin’ away, away, I’m askin’Why, we run for our lives, not a second to waste?You're tickin’ away, away, awayAlright, let's get itWinnin'Losin'Either way I'm thereGotta attitudeI'm out the roofUp in the airThis round I make it countYeah I'm talkin’ right nowFeel like the comeback kidI got no time to spareWoahDouble up the scoreTurn a 2 to a 4You know I win a lotGotta win one moreOn a hot streakNever gets oldSolo with the aceAnd my team went goldWhy am I playing with time as it’s ticking away?It's tickin’ away, away, I’m askin’Why, we run for our lives, not a second to waste?You're tickin’ away, away, awayYou're tickin’ away, awayI’ll give it one more tryI don’t know whyBut I keep comin’ back every timeI want it more than my lifeI don’t know whyBut it feels so rightWhy am I playing with time as it’s ticking away?It's tickin’ away, away, I’m askin’Why, we run for our lives, not a second to waste?It's tickin’ away, away, awayIt's tickin’ away, away, awayTickin’ away, away, away..."
"o-RGYaM-3y8","ON VIT COMME NOS SIMS, ET ÇA NE SE PASSE PAS COMME PRÉVU... Ft Zafeel et Hctuan","2023-07-29T16:21:59Z","UCLnv0iKl-QbLnkuF-aSZKTQ","Mastu Gear 2","24","23.02.08","mastu|mastutv|matsu|mastus|gaming|redbox|humour|mastu gear|mastu live|mastu sims|mastu sims ranch","353438","31865","0","342","https://i.ytimg.com/vi/o-RGYaM-3y8/default.jpg","False","False","La nouvelle extension « Vie au ranch » des SIMS 4 est sortie, elle est disponible juste ici : https://bit.ly/MastuSims4Vous y trouverez plein de nouveaux ajouts, comme la possibilité d'avoir des chevaux, mini brebis etc...Merci à Electronic Arts d'avoir sponsorisé la vidéo !Un énorme merci au Ranch du Coteau Blanch pour leur superbe accueil !N'hésite pas à t'abonner à ma chaîne pour ne rater aucune vidéo !Merci à tous de rester respectueux dans l'espace commentaire !Bonne vidéo à tous, et bonne journée :D"
"aDaqNisTpkk","Devenir Président : ÇA FAIT QUOI ?","2023-07-31T18:41:12Z","UC4ii4_aeS8iOFzsHuhJTq2w","Poisson Fécond","27","23.02.08","poisson fécond|khundar|orion","298028","15599","0","766","https://i.ytimg.com/vi/aDaqNisTpkk/default.jpg","False","False","Pour commander nos mugs collector à l'effigie de Gustave c'est ici : https://deadlikegustave.com/pages/produit-du-moisEncore merci à Shopify d'avoir soutenu le projet ! Pour vous lancer dans l'aventure, et créer votre boutique en ligne, c'est par là : https://shopify.fr/poissonfecond📸  Mon insta : https://www.instagram.com/elchrisconteQui rêve de gouverner le pays ? D’être l’élu du peuple..? Autrement dit, de devenir Président de la République !? Notre cher Gustave n’attend que ça, et son vœu est sur le point de se réaliser. Mais il n’est pas prêt pour tout ce qui va lui arriver, de bonnes comme de mauvaises surprises… 💀 Ma chaîne d'horreur CONTE FECOND : https://tinyurl.com/27dxvnd8 👨‍💻 Ma chaîne de react ASTRO FECOND : https://tinyurl.com/2p8wj7yw 🐟 Ma chaîne perso EL CHRIS CONTE : https://tinyurl.com/2p9dmdsf ➛ Ma chaîne de docu POISSONFECOND+ : https://www.poissonfecond.tv/FR/ 💬 Discord : https://discord.gg/ns7j8BS 🇫 Facebook : https://www.facebook.com/PoissonFecond 🐦 Twitter : https://twitter.com/PoissonFecond ************************SOURCES :https://www.touscontribuables.org/les-combats-de-contribuables-associes/les-depenses-publiques/emmanuel-macron-a-l-elysee-combien-ca-coutehttps://www.myorientation.fr/conseils-orientation-post-bac/on-texplique-comment-devenir-president-rien-que-ca https://www.lepoint.fr/histoire/l-elysee-en-10-chiffres-cles-08-05-2017-2125735_1615.phphttps://fr.wikipedia.org/wiki/Emmanuel_Macron#Carri%C3%A8re_professionnelle https://fr.wikipedia.org/wiki/Fran%C3%A7ois_Hollande https://fr.wikipedia.org/wiki/Nicolas_Sarkozy https://fr.wikipedia.org/wiki/Jacques_Chirac https://www.vie-publique.fr/fiches/19429-comment-se-deroule-la-campagne-electorale-pour-lelection-presidentiellehttps://www.vie-publique.fr/fiches/19429-comment-se-deroule-la-campagne-electorale-pour-lelection-presidentielle https://www.journaldesmaires.com/fr/elections/8-conseils-pour-planifier-sa-strategie-de-campagne_-b.html https://presidentielle2022.conseil-constitutionnel.fr/l-election/la-campagne/calendrier-exact-de-campagne.htmlhttps://www.rtl.fr/actu/politique/secrets-etat-codes-nucleaires-deroule-passation-pouvoir-macron-hollande-7788524198 https://www.francetvinfo.fr/france/le-rituel-secret-des-codes-nucleaires-et-des-anecdotes_95375.html https://www.conseil-constitutionnel.fr/la-constitution/quel-pouvoir-donne-l-article-16-de-la-constitution-au-president-de-la-republique https://www2.assemblee-nationale.fr/decouvrir-l-assemblee/role-et-pouvoirs-de-l-assemblee-nationale/les-institutions-francaises-generalites/le-president-de-la-republique https://www.1jour1actu.com/france/cest-quoi-le-metier-de-president-de-la-republique https://www.elysee.fr/la-presidence/les-symboles-de-la-republique-francaise https://www.europe1.fr/politique/salaires-transports-logements-a-quoi-a-droit-le-president-de-la-republique-3328295 https://www.challenges.fr/politique/remuneration-retraite-lobbies-les-etranges-privileges-du-president-de-la-republique-epingles_784649 https://www.ladepeche.fr/2020/07/20/emmanuel-macron-cette-habitude-de-travail-qui-coute-cher-a-lelysee-8986997.php https://www.lavoixdunord.fr/1169474/article/2022-04-21/c-est-quoi-ce-petit-pin-s-rouge-qu-emmanuel-macron-arbore-en-toutes https://fr.news.yahoo.com/porter-meme-pins-emmanuel-macron-peut-vous-couter-15000-euros-amende-112753967.html?guccounter=1&guce_referrer=aHR0cHM6Ly93d3cuZ29vZ2xlLmZyLw&guce_referrer_sig=AQAAAJwjHiyxRT79YbgTxe7WAqx9kR6xZJyGl2Jv4fWseb4W1XvzTxdpVogjh9bGhxLGxq_g69XvckdLBJwrzuDaPy87elO2bGYJ7yo1Tbv5yDt0LDgmzBdRSfM9k1Q5qZlDL2i4Ar2zcSfZo3umcWrE4RxwMFFL9I_11ZThYbWPAkVr https://www.cnews.fr/france/2020-12-02/voici-les-avantages-et-privileges-des-anciens-presidents-de-la-republique-27841 https://www.lejdd.fr/Politique/emmanuel-macron-un-president-qui-dort-peu-3455996https://twitter.com/luttopie/status/1008350705399353344?ref_src=twsrc%5Etfw%7Ctwcamp%5Etweetembed%7Ctwterm%5E1008350705399353344%7Ctwgr%5E766f6c489104ffc5560575b5b9fe8591ca099804%7Ctwcon%5Es1_&ref_url=https%3A%2F%2Fwww.lepoint.fr%2Finsolite%2Fils-envoient-de-la-vaisselle-a-l-elysee-pour-eviter-des-depenses-de-dingue-20-06-2018-2228757_48.php https://www.capital.fr/economie-politique/emmanuel-macron-combien-coutent-les-vacances-du-president-au-fort-de-bregancon-1474083 https://www.femmeactuelle.fr/actu/news-actu/emmanuel-et-brigitte-macron-la-routine-matinale-du-couple-presidentiel-revelee-2133253 https://www.letelegramme.fr/t-plus/avant-apres-comment-un-quinquennat-marque-le-physique-d-un-president-231968.php https://www.pleinevie.fr/loisirs/celebrites/emmanuel-macron-francois-hollande-decouvrez-lavant-apres-presidents-58918.html#item=10 ***************************************Merci à Quentin Lacheray pour le script, Lilli Dennemont et Maxime Marszal pour les illustrations, et  Thomas Court pour le montage ♥"
"aOFKxZER_mI","Reza Pishro - Bale Ghorban (feat. Putak) | OFFICIAL TRACK رضا پیشرو و پوتک - بله قربان","2023-07-31T16:41:48Z","UCMuExOeiiefMDbzRa3rvQkw","Reza Pishro","10","23.02.08","Pishro|Reza Pishro|Reza|Persian Rap|Rap Farsi|Persian Music|Persian Songs|Hip Hop|Rap|Best Rap Songs|Best Rap Musics|Top 10|Top|Top Persian Rap|آهنگ رپ|رضا|رضا پیشرو|پیشرو|آهنگ جدید|بهترین آهنگ ها|بهترین رپ|دانلود|دانلود آهنگ رپ|دانلود آهنگ جدید|Download Free music|Free music|Top Playlist|بهترین آهنگ های رپ|Bale Ghorban|Bale|Ghorban|Putak|Pouriya|Puriya|پوریا|پوتک|بله|قربان","288138","16559","0","11030","https://i.ytimg.com/vi/aOFKxZER_mI/default.jpg","False","False","Reza Pishro - Bale Ghorban (feat. Putak) | ORIGINAL AUDIOExtracted from the Nirvana Album01- Nirvana |‌ https://youtu.be/zty9_233svk02- Ghabrestoone HipHop 2 | https://youtu.be/oO-CJYR9aIA03- Zombie |‌ https://youtu.be/kKfXVAMLi1M04- Dardesar (feat. Canis) | https://youtu.be/Ewjj1nucO_s05- Bache Bahala | https://youtu.be/nRJOti9Xf-I06- Bale Ghorban (feat. Putak) | https://youtu.be/aOFKxZER_mI07- Nazm | https://youtu.be/PXjRSS6eU4EListen On YouTube Music: https://bit.ly/35hBXnWListen On Spotify: https://spoti.fi/37wSBTsGet On iTunes/AppleMusic: https://apple.co/37tf8jJListen On Deezer: https://bit.ly/3jhuY3fListen On Amazon: https://amzn.to/2TgeRse►Follow Reza Pishro Online: Subscribe: https://bit.ly/3mbyvSFInstagram: https://bit.ly/31tDiXuTwitter: https://bit.ly/2Hmlwym@rezapishrorail @PooriaPutak #RezaPishro#Putak #BaleGhorban"
