video_id,title,publishedAt,channelId,channelTitle,categoryId,trending_date,tags,view_count,likes,dislikes,comment_count,thumbnail_link,comments_disabled,ratings_disabled,description
"z02mFLLMK1Q","DINIZ NA SELEÇÃO. TRANSIÇÃO DE RISCO!","2023-07-04T23:38:37Z","UCNFf1QdVK-73ZODRfpFwubg","Bruno Formiga","17","23.11.07","CANAL DO BRUNO FORMIGA|CANAL BRUNO FORMIGA|CANAL DO FORMIGA|FORMIGA|BRUNO FORMIGA|TNT|TNT SPORTS|HBO MAX|POLEMICAS VAZIAS|TECNICO DA SELEÇÃO|DINIZISMO NA SELEÇÃO|FERNANDO DINIZ|CARLO ANCELOTTI|ANCELOTTI|CBF|BRASIL|COPA 2026|COPA DO MUNDO","81831","11012","0","571","https://i.ytimg.com/vi/z02mFLLMK1Q/default.jpg","False","False","Aposte com PAGBET. Acertou, tá pago - https://go.pagbet.com/brunoformigaSegundo o GE.COM, Fernando Diniz vai ser o técnico interino da seleção até a suposta chegada de Carlo Ancelotti. Uma decisão, pra mim, muito ruim. A CBF parece meio perdida."
"qljq96dfisg","A PISCINA DA MINHA NOVA CASA ESTÁ PRONTA !","2023-07-04T14:00:36Z","UChMJkHCD2wdvSO7CMOuLR-w","Renato Garcia YT","24","23.11.07","RENATO GARCIA|RENATO DA XJ6|RENATO|CAMARO|DAILY VLOG","1188488","103048","0","1332","https://i.ytimg.com/vi/qljq96dfisg/default.jpg","False","False","Minha Loja: https://www.lojarenatogarciayt.com.br/ ●Instagram: https://www.instagram.com/renatogarciayt●Twitter: https://twitter.com/renatogarciayt●Facebook: https://www.facebook.com/renatogarciayoutubeME ENVIE PRESENTES ! Caixa Postal: 8748CEP: 86020980LONDRINA - PR MEU SEGUNDO CANAL: https://www.youtube.com/channel/UClUN2J5hwEsE6_sKW3SPlMg●Contato para parcerias e eventos: renato@agencia11k.com.br"
"FA2RaipqK_0","O Roger Guedes SÓ FALOU A VERDADE, gente! E o que EXPÕE o Luxemburgo no Corinthians é... DEBATE!","2023-07-04T23:00:04Z","UCv-Nx8pSfG_LxbViMz14RWQ","Jovem Pan Esportes","17","23.11.07","Corinthians|gols|melhores momentos|jovem pan esportes|corinthians tv|craque neto|donos da bola|crise no corinthians|luxemburgo|vanderlei luxemburgo|mauro cezar|mauro cesar|mauro cezar corinthians|mauro cezar luxemburgo|bate pronto|pilulabatepronto|luan|luan corinthians|motel|luan motel|luan corinthians motel|luan agredido|luan agredido motel|roger guedes|roger guedes entrevista|roger guedes corinthians|roger guedes luxemburgo|mcp_pilula","337442","9935","0","613","https://i.ytimg.com/vi/FA2RaipqK_0/default.jpg","False","False","Roger Guedes foi sincero em entrevista e criticou a desorganização do time do Corinthians. O time piorou sob o comando de Vanderlei Luxemburgo? Veja o debate no Bate-Pronto, da Jovem Pan Esportes.Link do vídeo: https://youtu.be/FA2RaipqK_0#JovemPan #BatePronto"
"tWZFyYevZm0","LBFF 2023 RODADA 36 AO VIVO - GRUPOS A E B | FREE FIRE ESPORTS BRASIL","2023-07-04T00:16:05Z","UCOaQsQIByJYHyETtw48l_Vw","Free Fire Esports Brasil #LBFF","20","23.11.07","Free Fire|LBFF|Frifas|garena|free|fire|free fire|pro league|jogo mobile|mobile|ao vivo|garena free fire|free fire brasil|garena brasil|liga brasileira|campeonato garena|lbff ao vivo|free fire ao vivo|competitivo|competitivo free fire|lbff live|free fire live|lbff 2023|formato lbff 2023|6 quedas lbff|free fire esports brasil|free fire campeonato oficial|novidade lbff|loud lbff|grupos lbff|times lbff|times fora da lbff|lbff 2023 ao vivo|LB 2023","386620","19530","0","75","https://i.ytimg.com/vi/tWZFyYevZm0/default.jpg","False","False","Assista ao vivo a Rodada 36 da LBFF 2023, entre os grupos A e B! A LBFF é o principal campeonato de Free Fire Esports no Brasil, onde os 18 melhores times de Free Fire mobile disputam o grande título e vagas no mundial.Grupo A: Fluxo, Meta Gaming, Corinthians CDS, São Paulo eSports, Black Dragons e E1 SportsGrupo B: Vivo Keyd Stars, GOD Esports, paiN Gaming, INTZ, XIS e Amazon Cripz    Siga as redes sociais de Esports Free Fire e fique por dentro de tudo!Kwai - kwai.com/user/@FFesportsBRTwitter - https://twitter.com/FFesportsBRInstagram - https://instagram.com/ffesportsbrFacebook - https://facebook.com/ffesportsbrTikTok - https://www.tiktok.com/@ffesportsbrDiscord - https://discord.gg/freefire#LBFF #FreeFire #Frifas"
"7MGduybxgaY","ESTOU GRÁVIDA!!!","2023-07-04T15:00:04Z","UCXsNBWCCcNUNMKAxqt-zCNQ","Manu Pedrini","22","23.11.07","manu pedrini|manu|manu pedrini gravida|manu gravida|pedrini gravida|manu ta gravida|manu pedrini ta gravida|gravidez|primeiro trismestre gestacao|primeira gestacao|mae de primeira viagem|pais de primeira viagem|contando da gravidez|anunciando gravidez|estou gravida|primeiro filho|cha revelacao|cha de bebe|enxoval de bebe|mala maternidade","58408","11289","0","1659","https://i.ytimg.com/vi/7MGduybxgaY/default.jpg","False","False","💌 Contato para trabalhos: parcerias.manupedrini@gmail.com  📸 Equipamentos Câmera: Iphone 14 pro maxEditor: CapcutMicrofone lapela: https://shopee.com.br/product/2623677... Estabilizador: https://www.amazon.com.br/Estabilizad... Oie, meu nome é Manu :)Aqui eu compartilho com vocês um pouco da minha rotina de recém casada. Faço vários vídeos de faxina, compra do mês, receitinhas e muito mais.  Espero que com os meus vídeos, você se sinta mais motivada a cuidar da sua casa com muito amor❤️ Meu maior objetivo é registar a nossa história e compartilhar tudo com vocês. Espero que gostem ❤️"
"XTPQpkerkDM","NÃO CONSIGO ENTENDER! - GALVÃO ANALISA FERNANDO DINIZ NA SELEÇÃO","2023-07-05T01:21:01Z","UCm1_S0MCQYO9EWukQoAcRFA","Canal GB","17","23.11.07","galvão|globo|galvao bueno|futebol|ao vivo|galvão bueno|esporte|formula 1|copa do mundo|flamengo|seleção|Brasil|Seleção brasileira|cazetv|casimiro","268808","23953","0","1271","https://i.ytimg.com/vi/XTPQpkerkDM/default.jpg","False","False","-----Inscreva-se no Canal GB e ative o sininho para receber notificações de vídeos novos!Realização: Play9"
"fzcuWxAKuYc","Para bom entendedor, meia palavra basta.","2023-07-04T12:25:42Z","UCU5JicSrEM5A63jkJ2QvGYw","Filipe Deschamps","28","23.11.07","filipe deschamps","97784","9893","0","1047","https://i.ytimg.com/vi/fzcuWxAKuYc/default.jpg","False","False",""
"5hZFuLCk9dA","24 HORAS PRA ATRAVESSAR O BRASIL EM LINHA RETA","2023-07-03T20:51:26Z","UCQaBi4mxFO87zLw2uM3-6-A","Manteiga","24","23.11.07","Manteiga|Canal Manteiga|Hero Base|Hero Manteiga|Manteiga Hero Base|Manteiga Fortnite|natan|natan por aí|enaldinho|100 desafios em 24 horas|manteiga desafio extremo|desafio extremo|sobrevivendo em lugares extremos","1682097","30172","0","4663","https://i.ytimg.com/vi/5hZFuLCk9dA/default.jpg","False","False","Veja como eu atravessei o BRASIL em 24 horas, esse desafio foi EXTREMO e muito difícil, então se você leu até aqui, já se inscreve no canal!Alugue um Motorhome Pura Vida e viva essa experiênciaInstagram: https://www.instagram.com/mhpuravida/?hl=pt-brSite: https://motorhomespuravida.com/ ● Meu Instagram: https://www.instagram.com/hero_manteiga● Contato Profissional: contato@canalmanteiga.com.br00:00 Comente BANANA pra ganhar um coraçãozinho00:15 Quem não é inscrito fica careca"
"AySjtkg4X6Q","skibidi toilet 46","2023-07-04T08:50:00Z","UCsSsgPaZ2GSmO6il8Cb5iGA","DaFuq!?Boom!","24","23.11.07","toilet in ohio|skibidi meme|tiktok meme|sfm animation|funny animation|gmod animation|skibidi toilet vs cameramen|tvmen","31614094","811213","0","56771","https://i.ytimg.com/vi/AySjtkg4X6Q/default.jpg","False","False","cinemaman hunts for speakermanskibidi dop dop dop yes yesfull-screen versionRespectful assets used in the video:map - https://steamcommunity.com/sharedfiles/filedetails/?id=2994310934suits - https://steamcommunity.com/sharedfiles/filedetails/?id=2849230339speaker - https://steamcommunity.com/sharedfiles/filedetails/?id=2680336465speaker 2 - https://steamcommunity.com/sharedfiles/filedetails/?id=452964695guard suit - https://steamcommunity.com/sharedfiles/filedetails/?id=1643206589tv - https://steamcommunity.com/sharedfiles/filedetails/?id=2869997020(if you're author of certain assets and I didn't credit you properly, please contact me)Contact me:instagram.com/dafuqboomtvblugrayguy@gmail.com"
"1ZrcPyhO54c","Solo Leveling | TRAILER OFICIAL","2023-07-03T23:07:35Z","UCVc-JLY3Db6-O48y7TS4N7Q","Crunchyroll Brasil","1","23.11.07","crunchyroll|crunchyroll pt|anime|solo leveling|solo leveling game|solo leveling gameplay|a1 pictures|solo leveling trailer|novo jogo solo leveling|solo leveling arise|solo leveling pc mobile|solo leveling anime trailer|quando estreia solo leveling|solo leveling crunchyroll trailer|solo leveling crunchyroll original|crunchyroll collection solo leveling|solo leveling trailer crunchyroll br|crunchyroll brasil solo leveling|trailer solo leveling|crunchyroll brasil","234048","22860","0","1884","https://i.ytimg.com/vi/1ZrcPyhO54c/default.jpg","False","False","Solo Leveling estreia na Temporada de Inverno 2024, exclusivamente aqui na Crunchyroll!Falta pouco para a jornada de Jinwoo Sung começar! ⚔🔥✨ TESTE CRUNCHYROLL DE GRAÇA POR 14 DIAS: https://got.cr/14DayFreeTrialPT ✨#anime #crunchyroll #sololeveling #sololevelingtrailer"
"Fqey8LxQxFU","Olivia Rodrigo - vampire (Official Lyric Video)","2023-07-03T16:00:09Z","UCxE5jEls-T0QtlTHT8lI1lw","OliviaRodrigoVEVO","10","23.11.07","Olivia|Rodrigo|vampire|(Lyric|Video)|Pop","2195542","109368","0","3634","https://i.ytimg.com/vi/Fqey8LxQxFU/default.jpg","False","False","Store: https://OliviaRodrigo.lnk.to/storeFollow Olivia Rodrigo:Instagram: https://instagram.com/oliviarodrigo Twitter: https://twitter.com/Olivia_Rodrigo Facebook: https://www.facebook.com/OliviaRodrigoOfficial/YouTube: https://www.youtube.com/@OliviaRodrigoTikTok: https://tiktok.com/@livbedumb Discord: https://discord.gg/livieshqPresave GUTS: https://OliviaRodrigo.lnk.to/GUTSLYRICShate to give the satisfaction asking how you’re doing nowhow’s the castle built off people you pretend to care aboutjust what you wantedlook at you, cool guy, you got iti see the parties and the diamonds sometimes when i close my eyessix months of torturethat you sold as some forbidden paradisei loved you trulygotta laugh at the stupiditycuz i’ve made some real big mistakesbut you make the worst one look finei should’ve known it was strangeyou only come out at nighti used to think i was smartbut you mademe look so naivethe way you sold me for partsas you sunk your teeth into me, ohbloodsucker, famefuckerbleeding me dry like a goddamn vampireevery girl i ever talked to told me you were bad, bad newsyou called them crazy god i hate the way i called them crazy tooyou’re so convincinghow do you lie without flinching(how do you lie, how do you lie, how do you lie)oh, what a mesmerizing, paralyzing, fucked up little thrillcan’t figure out just how you do it and god knows i never willwent for me and not hercuz girls your age know betteri’ve made some real big mistakesbut you make the worst one look finei should’ve known it was strangeyou only come out at nighti used to think i was smartbut you made me look so naivethe way you sold me for partsas you sunk your teeth into me, ohbloodsucker, famefuckerbleeding me dry like a goddamn vampireyou said it was true lovebut wouldn’t that be hardyou can’t love anyonecuz that would mean you had a hearti tried you help you outnow i know that i can’tcuz how you think’s the kind of thingi’ll never understandi’ve made some real big mistakesbut you make the worst one look finei should’ve known it was strangeyou only come out at nighti used to think i was smartbut you made me look so naivethe way you sold me for partsas you sunk your teeth into me, ohbloodsucker, famefuckerbleeding me dry like a goddamn vampireMusic video by Olivia Rodrigo performing vampire (Lyric Video). © 2023 Olivia Rodrigo, under exclusive license to Geffen Recordshttp://vevo.ly/gLR4yC"
"qa5jJdHeBak","Wanessa Camargo - Fora do Radar (Clipe Oficial)","2023-07-03T20:42:09Z","UCmYVJBJV1fQgbgbfD0_VAhg","Wanessa Camargo","10","23.11.07","Wanessa Camargo|Wanessa Camargo pop|Wanessa Camargo ingles|balada|dado dolabella|Wanessa separacao|Zeze di camargo|fofoca|polemica|dna tour|anitta|luisa sonza|ludmilla|gloria groove|gay|lgbt|jao|tanta saudade wanessa|Wanessa romantica|bbb 23|barraco|xoxo Wanessa camargo|xoxo|música pop|pabllo vittar noitada|Ludmilla sou má|carnaval|#xoxo|wanessa|bbb23|amanda|wanessa camargo antigas|aline|rouge|marina sena|jão|românticas|bbb24","631319","13496","0","3132","https://i.ytimg.com/vi/qa5jJdHeBak/default.jpg","False","False","Ouça Livre - Ato 2 em todas as plataformas digitais: http://bit.ly/LivreAto2Siga Wanessa Camargo nas redes sociais:Instagram: https://www.instagram.com/wanessaFacebook: https://www.facebook.com/wanessaoficialTwitter: https://twitter.com/wanessacamargoTiktok: https://www.tiktok.com/@wanessacamargorealAgenda de Shows: https://linktr.ee/wanessacamargoreal#WanessaCamargo #Wanessa #Livre #LivreAto2 #ForadoRadar #PartedeMim #NãoDevoNada Letra: Fora do Radar(César Lemos e Bárbara Dias)Deu vontade Vou fazer o que me der vontadeAndo pelas ruas da cidadeE a sorte está chamando nos detalhesApós o sinal, deixe seu recadoTardeHoje é dia de voltar mais tardeO meu corpo pede liberdade E não dá pra disfarçar Vou pra algum lugar fora do radarEm alguma outra direção Ninguém pra agradar ou me controlarEu vou acelerar na contra mão A cem por hora céu azul Rumo a lugar nenhum Eu já não sinto medo algum Rumo a lugar nenhum A cem por hora céu azul Rumo a lugar nenhum Eu já não sinto medo algum Rumo a lugar nenhum TardeHoje é dia de voltar mais tardeO meu corpo pede liberdade Não dá pra disfarçarVou pra algum lugar fora do radarEm alguma outra direção Ninguém pra agradar ou me controlarEu vou acelerar na contra mão A cem por hora céu azul Rumo a lugar nenhum Eu já não sinto medo algum Rumo a lugar nenhum A cem por hora céu azul Rumo a lugar nenhum Eu já não sinto medo algum Rumo a lugar nenhum O mundo girando ao contrário Acordo no meu fuso-horário Não sigo nenhum calendário Eu só tô vivendo e curtindo o cenárioO mundo girando ao contrário Acordo no meu fuso-horário Não sigo nenhum calendário A cem por hora céu azul Rumo a lugar nenhum Eu já não sinto medo algum Rumo a lugar nenhum A cem por hora céu azul Rumo a lugar nenhum Eu já não sinto medo algum Rumo a lugar nenhum______________Ficha Técnica:Roteiro: Wanessa Camargo, Moroni Cruz e Steven Cruz Direção: Moroni Cruz e Steven Cruz Direção Fotografia: Kenny KanashiroDireção Arte Cenográfica: Rafael de CastroAssistente de Direção: Ali BarbosaEdição/Pós-produção: Steven CruzProdução Arkon Filmes: Cássia BritoSteadicam: Murillo Ribeiro1ª Assistente de Câmera: Alice Sesoko2º Assistente de Câmera: Yuri CamargoVideo-Assist: Raul Bittencourt Gaffer: Thiago ZumbiAssistentes de Elétrica: Gaspar Balta e JK Produções Maquinista: Heverton MarambaiaAssistentes de Maquinária: Alef Reis e Álex QueirozGMA: Filipe de ToledoTID: Vinícius OliveiraMaking-Of: Júlia Pessini, Lucas Guido e Illan SuarezComposição: César Lemos e Bárbara DiasProdução Musical: César LemosGestão / Financeiro: Igor CamargoGestão / Comercial: Andie FonsecaProdução Executiva: Alana SamaraBeleza Wanessa, Purple Man e dublê: Jonas Santos com assistência de Luciana da SilvaBeleza ballet e elenco: Uacaly Abrahão com assistência de Felipe Crus Direção de Moda (criação de figurinos e stylist): Luis FiodCasting: Luis Fiod e André BonaProdução de moda: André Bona e Otávio SohnAssistente Produção de Moda: Giuliana Grandi Costureiras: Edna Mesquita e Maria RiquetaApoio de Marketing: Junior Waldorf e FMMídias Sociais / Fotos: Alexandre PioSegurança: André CarvalhoAssessoria de Imprensa: Acess MídiaBallet: César Augusto, Day Bergamim, Daniel Chactoura, Diego Josh, Gabriel Carvalho, Gabriela Mak, Malu Caju e Monique SoaresCoreografia e Dublê: Jessica BragaPurple Man: Paulo VictorDr. Laboratório: Dr. Leonardo RezendeAgentes: Caian Moroni e Luciano PradoElenco Festa: Aline Oliveira, Antony Lima, Camila Silva, Daniel Graboski, Elaine Barros, Fabiane Friedric, Joice Lima, Júlia Alves, Leonardo Coelho, Luan Leoneza, Luana Lopes, Priscila Marara, Rafa Vella, Rafael Granado, Wallace ToledoAgradecimento Especial: Millennium Dance Complex e Equipe Villagio JK"
"tYTsad7rIKA","GR COROLLA 2023: ACELERAMOS O RIVAL DO TYPE R! Quanto custa? Detalhes técnicos... Saiba TUDO!","2023-07-03T18:00:19Z","UCi7NjYyIQk6hPRbZ4BVKHyw","FlatOut Brasil","2","23.11.07","gr corolla|honda civic type r|gr corolla 2023|gr yaris|subaru wrx sti|lancer evo|toyota gr corolla|2023 toyota gr corolla","137273","14374","0","592","https://i.ytimg.com/vi/tYTsad7rIKA/default.jpg","False","False","Saiba absolutamente TUDO sobre o GR Corolla: quanto custa, todos os detalhes técnicos... até olhamos o esportivo por baixo, no elevador da oficina da Toyota! Aceleramos ele FUNDO e falamos sobre possibilidades de preparação, como funciona o sistema 4x4, impressões ao volante... uma matéria técnica especial imperdível do grande rival do Honda Civic Type R!"
"Lkb-OUSI37E","Pokémon X ENHYPEN (엔하이픈) 'One and Only' Official Teaser","2023-07-04T15:00:04Z","UCArLZtok93cO5R9RI4_Y5Jw","ENHYPEN","22","23.11.07","BELIFTLAB|ENHYPEN|엔하이픈","546812","132239","0","4043","https://i.ytimg.com/vi/Lkb-OUSI37E/default.jpg","False","False","Pokémon X ENHYPEN (엔하이픈) 'One and Only' Official TeaserCredits:STUDIO SACCHARINDirector : KWON YONGSOO1st AD : YOU WONSIK2st AD : SON SEOYOUNGEditor : KWON HEEGYEONGAssistant Editor : KIM CHAEHYUNDirector of photography : IHM CHIHOONGaffer : KWON HOONHOArt Director : PARK SEOYOUNGDI : COLOUR LUCIDColorist : KWAK HAEWONLENNON STUDIO2D Supervisor : YANG SEUNGBINVFX Supervisor : KO SUNGUKProducer : HAM EUNJUNGConnect with ENHYPENOFFICIAL WEBSITE  https://ENHYPEN.comENHYPEN Weverse https://www.weverse.io/enhypen OFFICIAL YOUTUBE https://www.youtube.com/ENHYPENOFFICIALOFFICIAL TWITTER https://twitter.com/ENHYPENENHYPEN TWITTER https://twitter.com/ENHYPEN_membersOFFICIAL FACEBOOK https://www.facebook.com/officialENHYPENOFFICIAL INSTAGRAM https://www.instagram.com/enhypenOFFICIAL TIKTOK  https://www.tiktok.com/@enhypenOFFICIAL WEIBO https://weibo.com/ENHYPENOFFICIAL JAPAN TWITTER https://twitter.com/ENHYPEN_JPOFFICIAL BILIBILI https://space.bilibili.com/3493119035181246#Pokemon_ENHYPEN #PokemonMusicCollective  #OneandOnly#ポケモン #ポケットモンスター#Pokémon #Pokemon #ENHYPEN"
"MIoEoIyThLk","FESTIVAL DE PARINTINS 2023 | 3° NOITE","2023-07-03T07:28:02Z","UCnLSKfHkgZ6ujEYCO9jq7Sw","TV A Crítica","24","23.11.07","a critica noticia|noticias|tv ao vivo|tv a critica|tv acritica|tv a crítica|boi caprichoso|boi bumba caprichoso|o brado do povo guerreiro|live lançamento caprichoso|boi bumba|festival de parintins|acritica parintins|live parintins|live caprichoso|o brado do povo guerreiro caprichoso|entretenimento|festival caprichoso|caprichoso|garantido|alvorada do garantido|sorteio parintins|parintins sorteio|parintins 2023|festival de parintins 2023","602092","14363","0","254","https://i.ytimg.com/vi/MIoEoIyThLk/default.jpg","False","False","Muitas emoções até aqui, hein?! Confira a última noite do Festival de Parintins 2023:ORDEM DA 1° NOITE:GarantidoCaprichosoAcompanhe a TV A Crítica no Youtube e nas redes sociais:Facebook: https://bit.ly/ftvacriticaInstagram: http://bit.ly/igtvacriticaTikTok: https://bit.ly/tiktokacriticaKwai: https://bit.ly/kwaitvacriticaTwitter: http://bit.ly/tttvacriticaINSCREVA-SE NO CANAL: http://bit.ly/yttvacritica#festivaldeparintins #boicaprichoso #boigarantido"
"N-mGQ__EQXA","MANETIKIN CHAMOU LUIZ DO SOM PRA CORTAR O CABELO | LUIZ DO SOM","2023-07-04T15:00:15Z","UCFJvAGjel1N2QWyOu50pNeQ","LUIZ DO SOM","23","23.11.07","Luiz do som|Manetikin|Canal do veio|Veio do bigode branco|Humor|Comédia|O veio|Pililiu|Charlles|Tiquinho|Tiringa|Gerson Albuquerque","189111","27355","0","1080","https://i.ytimg.com/vi/N-mGQ__EQXA/default.jpg","False","False","#luizdosom #manetikin #comedy TURMA DO MANE https://youtube.com/@Turmadomane✅ BODCAST https://youtube.com/@bodcastoficial1CÓDIGO DE AFILIADO: LUIZDOSOM Inscreva-se nas Redes Sociais do LUIZ DO SOM!Acesse: http://luizdosom.com.br-CAIXA POSTAL 118 RUA SEVERINO TAVARES UCHOA SN IGARASSU/PE CEP 53610970✅ CORTES DO LUIZ DO SOM E MANETIKIN OFICIAL https://youtube.com/channel/UCFDFLWiMmsc0rOJ7KCe0z2QMANETIKIN CHAMOU LUIZ DO SOM PRA CORTAR O CABELO | LUIZ DO SOM MANETIKIN CHAMOU LUIZ DO SOM PRA CORTAR O CABELO | LUIZ DO SOM MANETIKIN CHAMOU LUIZ DO SOM PRA CORTAR O CABELO | LUIZ DO SOM _ __ FICHA TÉCNICA - CANAL LUIZ DO SOM Diretor, Roteirista e Editor:Manoel Lira Alves SiqueiraPersonagens Principais:Sergio Luiz Bezerra da Silva - Luiz do SomManoel Lira Alves Siqueira - ManetikinCategoria dos Vídeos:ComédiaClassificação Indicativa:+14 anosSe você gosta dos vídeos do Tiringa, também vai gostar do Luiz do Som.#luizdosom #comedia #manetikin #tiringa #comedy #comediaselvagem#humor #velhoignorante"
"XSaBR58f7I0","Suicide Squad ISEKAI | Announcement | DC","2023-07-03T18:00:13Z","UCiifkYAs_bq1pt_zbNAzYGg","DC","24","23.11.07","[none]","2998894","176336","0","11009","https://i.ytimg.com/vi/XSaBR58f7I0/default.jpg","False","False","💗#SuicideSquadISEKAI💙 Suicide Squad rampages into Japanese anime in SUICIDE SQUAD ISEKAI, an all-new original anime series collaboration with Warner Bros. Japan and WIT Studio!▶️ https://suicidesquad-isekai.comSubscribe To DC: https://bit.ly/3vDk4Ox #DC #DCComicsConnect with DC Online: Follow DC on INSTAGRAM: https://bit.ly/3XxysUi Like DC on FACEBOOK: https://bit.ly/3oQVPs2 Follow DC on TWITTER: https://bit.ly/3oTsD3S Visit the DC WEBSITE: https://www.dc.com/ Subscribe to DC UNIVERSE INFINITE: https://bit.ly/3zAJZqX The official home of Batman, Superman, Wonder Woman, Green Lantern, The Flash and the rest of The World's Greatest Super Heroes!"
"4qQsKHshIlE","GR Corolla Circuit Edition - Avaliação completa, preço e todos os detalhes!","2023-07-03T18:00:01Z","UCqtPuAH8q5CgZyp8hklSpNA","Macchina","2","23.11.07","carrosdecolecionadores|tiago kfouri|gol glr|v8tk|macchina|macchina tiago kfouri|gol glt|gol tiago kfouri|amg do tk|s55 amg tiago kfouri|s55 amg macchina|rabbit GTI|vw rabbit gti|gti mk1|rabbit mk1|rotary engine|marea|fiat marea|marea turbo|marea do tk|marea tiago kfouri|cb twister|twister nitro|honda twister tk|cb twister tiago kfouri|gr|gr corolla|corolla gr|gazoo racing","131202","9452","0","645","https://i.ytimg.com/vi/4qQsKHshIlE/default.jpg","False","False","O GR Corolla chegou no Brasil!O modelo traz uma receita dos sonhos dos gearheads e o Tiago Kfouri trouxe um conteúdo completo com detalhes técnicos, test drive na pista e mediu o 0-100km/h.Motor 1.6 turbo com mais de 300cv, transmissão manual de 6 velocidades e tração permanente nas 4 rodas.Confiram essa avaliação do GR Corolla Circuit Edition!Acompanhe o canal pessoal do Tiago Kfouri - https://www.youtube.com/tiagokfouriFaça parte do clube de membros e receba benefícios exclusivos! - https://bit.ly/2VRLm3MLink da loja oficial do Macchina - https://www.bulloleo.com.br/macchinaLink Instagram Macchina - https://www.instagram.com/macchinabrLink Instagram TK - https://www.instagram.com/tkfouriCaso queira falar conosco, nosso email é: contato@macchinabr.com.br#Macchina #DriveWhatYouLove #DirijaOqueVoceAma #CarrosDeColecionadores"
"P6yBL2Ezt1A","A ALEGRIA DELE É SER TRISTE...","2023-07-03T18:34:13Z","UC1exXNI_OIhg2E7jvO4Ew_A","Cortes Deu Zebra Cast","22","23.11.07","cortes|podpah|cortes podpah|podcast|panico|panico na tv|panico na band|programa panico|Melhor Podcast do Brasil|Cortes do Ticaracaticast|Melhores Momentos|assista completo|cortes do venus|cortes do cometa|a deriva cortes|cortes do prosa guiada|cortes do favela invest|cortes do enxuga gelo|cortes podcast|comedia|humor|zoeira|futebol|os donos da bola|corinthians|spfc|palmeiras|resenha|jogos de hoje|podcast futebol|flowsportclub|ticaracaticast","165707","4537","0","442","https://i.ytimg.com/vi/P6yBL2Ezt1A/default.jpg","False","False","CANAL OFICIAL DE CORTESOs melhores momentos você encontra aqui.PATROCÍNIO:PODER SPORTShttps://www.podersports.bet/player-from-agent/agent/sheaSiga e tire suas dúvidas no instagram@podersports.betHOST:Alfinete: Instagram - @alfinetetvSormani: Twitter @fabio_sormani57DIREÇÃO:AlpzeraInstagram - @alpzeraRealização: @dummyfilmesREGRAS:- Postar após 24hrs da exibição do episódio- Não usar títulos mentirosos ou que venham denegrir a imagem do host e/ou convidado(s)- Vamos derrubar qualquer canal que for contra as regras e não tiver por algum motivo prévia autorização"
"fqBAzCH4-9g","NMIXX Roller Coaster M/V","2023-07-03T09:00:33Z","UCaO6TYtlC8U5ttz62hTrZgg","JYP Entertainment","10","23.11.07","JYP Entertainment|JYP|NMIXX|엔믹스|릴리|LILY|LILY M|해원|HAEWON|오해원|설윤|SULLYOON|설윤아|배이|BAE|배진솔|지우|JIWOO|김지우|규진|KYUJIN|장규진|JYPn|kpop|girlgroup|#A Midsummer NMIXX's Dream|3rd Single|Single|3rd|Party O'Clock|Roller Coaster","25649791","400196","0","21148","https://i.ytimg.com/vi/fqBAzCH4-9g/default.jpg","False","False","NMIXX Roller Coaster M/VNMIXX 'A Midsummer NMIXX's Dream' Pre-order & Pre-save ▶ https://nmixx.lnk.to/AMidsummerNMIXXDreamNMIXX Official YouTube ▶ https://www.youtube.com/c/NMIXXOfficialNMIXX Official Twitter ▶ https://twitter.com/NMIXX_officialNMIXX Official Instagram ▶ https://www.instagram.com/nmixx_official/NMIXX Official Facebook ▶ https://www.facebook.com/NMIXXOfficial/NMIXX Official Weibo ▶ https://weibo.com/NMIXXOfficialNMIXX Official Website ▶ https://nmixx.jype.com/NMIXX Official Fan's ▶ https://fans.jype.com/nmixxNMIXX Official TikTok ▶ www.tiktok.com/@nmixx_officialⓒ 2023 JYP Entertainment. All Rights Reserved#NMIXX #엔믹스#A_Midsummer_NMIXXs_Dream #Roller_Coaster"
