video_id,title,publishedAt,channelId,channelTitle,categoryId,trending_date,tags,view_count,likes,dislikes,comment_count,thumbnail_link,comments_disabled,ratings_disabled,description
"enMyDIyMO1U","Thiaguinho - Uma Estrela / Insegurança - Ao Vivo - Tardezinha No Recife Diferenciado","2023-07-07T15:00:22Z","UCEnQ70n_hbsUmYXN9R11aSQ","Thiaguinho","10","23.11.07","Thiaguinho|energia surreal|ponto fraco|só vem|pagode|lançamento pagode|rael|vibe|tardezinha","94184","2840","0","116","https://i.ytimg.com/vi/enMyDIyMO1U/default.jpg","False","False","Vem assistir Uma Estrela / Insegurança do EP Tardezinha No Recife Diferenciado!Gravado no dia 20/05/2023, no Centro de Convenções do Recife/PE UMA ESTRELA/ INSEGURANÇA(Délcio Luiz/ Pezinho) (Valtinho Jota)Conversei com uma estrelaCaminhando pelas ruasPra te ver fiz um pedidoE rezei por onde andeiAprendi te amar sonhandoDediquei meu sentimentoDe coração, de corpo e almaEu te ame, por onde andeiUm amor me deixou aquiNessa esquina abandonadaNa fria madrugadaSozinho na calçadaMas quando a cidade adormeceuUm anjo lindo apareceuEra você na minha vidaVi brilhar no céu com emoçãoA luz da minha direçãoEra você na minha vidaMas quando a cidade adormeceuUm anjo lindo apareceuEra você na minha vidaVi brilhar no céu com emoçãoA luz da minha direçãoEra você na minha vidaEssa noite eu notei que você demorou pra dormirCaminhou pela casa ligou a tv eu ouviVocê sussurrando chorando baixinho pra não me acordarSe tiver precisando de amigo pra desabafarSe for alguma coisa comigo vamos conversarEu não quero correr o perigo de um dia você me deixarEscolhi você pra ser minha mulherE sou tão fiel a nossa relaçãoPelo amor de Deus se for insegurança tira do teu coraçãoJá é tarde vamos nos deitarSe quiser conversar na nossa camaPorque sei que tudo isso passa você me abraça e a gente se amaEu não vou te trair com ninguém meu amor você tem minha palavraPorque tudo que um homem precisa eu tenho em casaFICHA TÉCNICATardezinha no Recife Diferenciado é um projeto da Paz&Bem Entretenimento, distribuído por Virgin Music.Direção Geral: Thiaguinho e Ellen BarbosaDireção de Produção: Grazi CaetanoÁUDIODireção Musical: Thiaguinho & PrateadoArranjos: PrateadoUnidade Móvel de Gravação: Estúdio CenturyEngenheiros de Gravação: Gabriel Vasconcelos e Maurício Pinto (Estúdio Century)Mixagem e Masterização: Gabriel Vasconcelos (Estúdio Century)Assistente de Mixagem: Daniele AndradeLabel Manager: Grazi Caetano VÍDEODireção: Douglas Aguillar e Fran LandhinFotografia: Arnaldo MesquitaCâmeras: Arnaldo Mesquita, Douglas Aguillar, Felipe Schmidt, Fran Landhin, Jesus Dantas, GuilhermePaiva, Renan Toledo, Gabriel Matos, Silas Ismael, André Luiz de Holanda, José Eduardo GomesGrua: Alexandre de Souza, Victor Lima, Marcelino de OliveiraDrone: Raphael de Barros LimaCoord. Produção: Angelina TrevisanAssistente de Produção: Clarice DuoProdução: Adriano GobbiMontagem: Thales PedoteColor Grade: Marcelo CosmeFinalização: GogacineBANDA DO PODERBaixo: PrateadoTeclados, gaita, xilofone e piano: Anselmo LimaViolão: Saymon SazCavaco: Nando MartinsBateria: Fábio ViottoSurdo: Gabriel BarrigaPercussão Geral: Rogerinho NagôPandeiros: Nego do PandeiroBacking Vocals: Danilo Oliveira, Caramujo e Júnior PulgãoEQUIPE DO PODERProdução Geral: Fernando PiritubaLogística: Luana BarretoSecretário: Adriano OliveiraTécnico de PA: Gabriel VasconcelosTécnico de Monitor: Lucas EsdrasTécnico de Luz: Ricardinho OliveiraRoadies: Michael Slow, Paulo Xuxa e Vanderlei RussoCenotécnico: Adelino PequenoTécnico de LED: Thiago RamosSegurança: Robinson SouzaConteúdo: Noize MediaContato para shows:Olívia BrasileiroTel: (11) 3628-8638 / (11) 96382-4602contato@pazebemmusica.com.brSiga o Thiaguinho nas redes sociais:https://twitter.com/thiaguinhocomthhttps://www.instagram.com/thbarbosa/https://www.tiktok.com/@thiaguinhocomthhttps://www.facebook.com/thiaguinhocomth"
"aWsfCUlcuT8","Thiaguinho - Um Amor Puro / Meu Bem Querer - Ao Vivo - Tardezinha No Recife Diferenciado","2023-07-07T15:00:16Z","UCEnQ70n_hbsUmYXN9R11aSQ","Thiaguinho","10","23.11.07","Thiaguinho|energia surreal|ponto fraco|só vem|pagode|lançamento pagode|rael|vibe|tardezinha","83776","2311","0","85","https://i.ytimg.com/vi/aWsfCUlcuT8/default.jpg","False","False","Vem assistir Um Amor Puro / Meu Bem Querer do EP Tardezinha No Recife Diferenciado!Gravado no dia 20/05/2023, no Centro de Convenções do Recife/PEUM AMOR PURO/ MEU BEM QUERER(Djavan)O que há dentro do meu coraçãoEu tenho guardado pra te darE todas as horas que o tempoTem pra me concederSão tuas até morrerE a tua história, eu não seiMas me diga só o que for bomUm amor tão puro que ainda nem sabeA força que temÉ teu e de mais ninguémTe adoro em tudo, tudo, tudoQuero mais que tudo, tudo, tudoTe amar sem limitesViver uma grande históriaTe adoro em tudo, tudo, tudoQuero mais que tudo, tudo, tudoTe amar sem limitesViver uma grande históriaAqui ou noutro lugarQue pode ser feio ou bonitoSe nós estivermos juntosHaverá um céu azulUm amor puroNão sabe a força que temMeu amor, eu juroSer teu e de mais ninguémUm amor puroNão sabe a força que temMeu amor, eu juroSer teu e de mais ninguémUm amor puroNão sabe a força que temMeu amor, eu juroSer teu e de mais ninguémUm amor puroNão sabe a força que temMeu amor, eu juroSer teu e de mais ninguémMeu bem quererÉ segredo, é sagradoEstá sacramentado em meu coraçãoMeu bem quererTem um quê de pecadoAcariciado pela emoçãoMeu bem querer, meu encantoTô sofrendo tantoAmor, e o que é o sofrerPara mim que estouJurado pra morrer de amorFICHA TÉCNICATardezinha no Recife Diferenciado é um projeto da Paz&Bem Entretenimento, distribuído por Virgin Music.Direção Geral: Thiaguinho e Ellen BarbosaDireção de Produção: Grazi CaetanoÁUDIODireção Musical: Thiaguinho & PrateadoArranjos: PrateadoUnidade Móvel de Gravação: Estúdio CenturyEngenheiros de Gravação: Gabriel Vasconcelos e Maurício Pinto (Estúdio Century)Mixagem e Masterização: Gabriel Vasconcelos (Estúdio Century)Assistente de Mixagem: Daniele AndradeLabel Manager: Grazi Caetano VÍDEODireção: Douglas Aguillar e Fran LandhinFotografia: Arnaldo MesquitaCâmeras: Arnaldo Mesquita, Douglas Aguillar, Felipe Schmidt, Fran Landhin, Jesus Dantas, GuilhermePaiva, Renan Toledo, Gabriel Matos, Silas Ismael, André Luiz de Holanda, José Eduardo GomesGrua: Alexandre de Souza, Victor Lima, Marcelino de OliveiraDrone: Raphael de Barros LimaCoord. Produção: Angelina TrevisanAssistente de Produção: Clarice DuoProdução: Adriano GobbiMontagem: Douglas AguilarColor Grade: Marcelo CosmeFinalização: GogacineBANDA DO PODERBaixo: PrateadoTeclados, gaita, xilofone e piano: Anselmo LimaViolão: Saymon SazCavaco: Nando MartinsBateria: Fábio ViottoSurdo: Gabriel BarrigaPercussão Geral: Rogerinho NagôPandeiros: Nego do PandeiroBacking Vocals: Danilo Oliveira, Caramujo e Júnior PulgãoEQUIPE DO PODERProdução Geral: Fernando PiritubaLogística: Luana BarretoSecretário: Adriano OliveiraTécnico de PA: Gabriel VasconcelosTécnico de Monitor: Lucas EsdrasTécnico de Luz: Ricardinho OliveiraRoadies: Michael Slow, Paulo Xuxa e Vanderlei RussoCenotécnico: Adelino PequenoTécnico de LED: Thiago RamosSegurança: Robinson SouzaConteúdo: Noize MediaContato para shows:Olívia BrasileiroTel: (11) 3628-8638 / (11) 96382-4602contato@pazebemmusica.com.brSiga o Thiaguinho nas redes sociais:https://twitter.com/thiaguinhocomthhttps://www.instagram.com/thbarbosa/https://www.tiktok.com/@thiaguinhocomthhttps://www.facebook.com/thiaguinhocomth"
"6rN7PcTp9EU","Beijo Fuleiro - Lauana Prado e Diego & Victor Hugo","2023-07-07T14:00:45Z","UCk0M1_PCFtrIQWxGZsrWriw","Lauana Prado","10","23.11.07","[none]","162613","3505","0","969","https://i.ytimg.com/vi/6rN7PcTp9EU/default.jpg","False","False","#LauanaPrado #AoVivoEmBrasília #Diego&VictorHugoClique e ouça: https://umusicbrazil.lnk.to/BeijoFuleiroSIGA LAUANA PRADO:[https://www.lauanaprado.com.br][https://www.facebook.com/LauanaPrado/][https://www.instagram.com/lauanaprado/][https://twitter.com/lauanaprado]Beijo FuleiroQuem foi que faloiQue me esqueceria no primeiro beijo fuleiro No primeiro teto de espelho Foi segundo, foi terceiroE nada Parece que algumas promessas foram arquivadas Parece que algumas noitadas são falsas Algumas latinhas são latadas Quem largou euPra pegar todo mundoHoje tem todo mundo E no fim disso tudo quer eu, né?Não deu!Quem largou euPra pegar todo mundoHoje tem todo mundo E no fim disso tudo quer eu, né?Não deu ligaCê beija beija beijaE não tira minha saudade na salivaQuem foi que falou Que me esqueceria no primeiro beijo fuleiro No primeiro teto de espelho Foi segundo, foi terceiroE nada Parece que algumas promessas foram arquivadas Parece que algumas noitadas são falsas Algumas latinhas são latadas‌Quem largou euPra pegar todo mundoHoje tem todo mundo E no fim disso tudo quer eu, né?Quer eu, né?Quem largou euPra pegar todo mundoHoje tem todo mundo E no fim disso tudo quer eu, né?Não deu ligaCê beija beija beijaE não tira minha saudade na saliva‌Quem largou euPra pegar todo mundoHoje tem todo mundo E no fim disso tudo quer eu, né?Não deu!Quem largou euPra pegar todo mundoHoje tem todo mundo E no fim disso tudo quer eu, né?Não deu ligaCê beija beija beijaE não tira minha saudade na saliva#LauanaPrado #AoVivoEmBrasília #BeijoFuleiroUniversal MusicPresidente: Paulo LimaDiretora de A&R: Juliana PontesGerente de A&R: Daniel RigonAnalista de A&R: Maria Almeida e Fernando LauriaDiretor Geral GTS: Ulisses GaspariniSupervisor Audiovisual: Igor AlarconCoordenadora Audiovisual: Fernanda MesaLabel Manager: Leo NunesDiretor de áudio: Ivan MiyazatoDiretor de vídeo: Fernando Trevisan CatatauMusic video by Lauana Prado e Diego & Victor Hugo performing Beijo Fuleiro (Ao Vivo Em Brasília / 2022). © 2022 Universal Music Ltda"
"igIfiqqVHtA","Taylor Swift - Enchanted (Taylor's Version) (Lyric Video)","2023-07-07T04:00:21Z","UCANLZYMidaCbLQFWXBC95Jg","TaylorSwiftVEVO","10","23.11.07","taylor swift|taylor|swift|speak now taylors version|taylor’s version|speak now TV|speak now taylor’s version|speak now from the vault|speak now vault songs|speak now recrecording|new taylor swift|taylor swift album|taylor swift speak now|taylor speak now","4427621","292775","0","10417","https://i.ytimg.com/vi/igIfiqqVHtA/default.jpg","False","False","Listen to “Enchanted (Taylor’s Version) by Taylor Swift from the album Speak Now (Taylor’s Version).Buy/Download/Stream ‘Speak Now (Taylor's Version)’: https://taylor.lnk.to/speaknowtaylorsversion ►Subscribe to Taylor Swift on YouTube: https://ts.lnk.to/subscribe  ►Shop Merch: http://taylorswift.lnk.to/store►Follow Taylor Swift Online:TikTok: http://tiktok.com/@taylorswiftInstagram: http://instagram.com/taylorswift  Twitter: http://twitter.com/taylorswift13  Snapchat: http://snapchat.com/add/taylorswiftFacebook: http://facebook.com/taylorswift  Tumblr: http://taylorswift.tumblr.com  Website: http://www.taylorswift.com  ►Follow Taylor Nation OnlineTikTok: http://tiktok.com/@taylornationInstagram: http://instagram.com/taylornation  Twitter: http://twitter.com/taylornation13Tumblr: http://taylornation.tumblr.com  #taylorswift #speaknowtaylorsversion #EnchantedMusic video by Taylor Swift performing Enchanted (Taylor's Version) (Lyric Video). © 2023 Taylor Swift"
"LXbArMdOkJo","Thiaguinho - Só Depois / Deixa Eu Ir À Luta - Ao Vivo - Tardezinha No Recife Diferenciado","2023-07-07T15:00:11Z","UCEnQ70n_hbsUmYXN9R11aSQ","Thiaguinho","10","23.11.07","Thiaguinho|energia surreal|ponto fraco|só vem|pagode|lançamento pagode|rael|vibe|tardezinha","60240","1995","0","56","https://i.ytimg.com/vi/LXbArMdOkJo/default.jpg","False","False","Vem assistir Só Depois / Deixa Eu Ir À Luta do EP Tardezinha No Recife Diferenciado!Gravado no dia 20/05/2023, no Centro de Convenções do Recife/PESÓ DEPOIS/ DEIXA EU IR À LUTA(Carlos Caetano/ Charles Bonfim/ Claudemir da Silva) (Leandro Lehart)Só depois que tudo terminouEntendi que não era amorE tudo que fizemos num só momentoDeixou de existirEntendi que o fim foi o melhor pra mimSó assim pude enxergarO que estava tão pertoEu feito um tolo nem percebiQue na vida o hoje tem que aproveitarPorqueEu não sei se o amanhã há de chegarSe me desse ao menos um sinalUm piscar de olho, um sorriso, eu posso garantirQue o nosso caso ia ser fatalQue na vida o hoje tem que aproveitarPorqueEu não sei se o amanhã há de chegarSe me desse ao menos um sinalUm piscar de olho, um sorriso, eu posso garantirQue o nosso caso ia ser fatalDessa vida eu não desisto eu seiÉ que o amor tá aqui dentroVou extravasarE sozinho eu sigoNas horas da vidaSem pedir licença pra continuarE sozinho essa luta vira covardiaDeixe eu ir a luta não posso pararE sozinho eu sigoNas horas da vidaSem pedir licença pra continuarE sozinho essa luta vira covardiaDeixe eu ir a luta não posso pararA vida não ta fácil nãoAlegria virou liçãoA lição aprendida aquiDentro desse meu coraçãoEu aceito reposta até desaforoMas Deus dai-me forçasPra continuarEu me enrosco, eu me ferroMas não faço dramaDeixe eu ir a luta não posso pararDeixe eu ir a luta, deixa euNão posso pararA lição aprendida aquiDentro desse meu coraçãoEu aceito reposta até desaforoMas Deus dai-me forçasPra continuarEu me enrosco, eu me ferroMas não faço dramaDeixe eu ir a luta não posso pararDeixe eu ir a luta, deixa euNão posso pararFICHA TÉCNICATardezinha no Recife Diferenciado é um projeto da Paz&Bem Entretenimento, distribuído por Virgin Music.Direção Geral: Thiaguinho e Ellen BarbosaDireção de Produção: Grazi CaetanoÁUDIODireção Musical: Thiaguinho & PrateadoArranjos: PrateadoUnidade Móvel de Gravação: Estúdio CenturyEngenheiros de Gravação: Gabriel Vasconcelos e Maurício Pinto (Estúdio Century)Mixagem e Masterização: Gabriel Vasconcelos (Estúdio Century)Assistente de Mixagem: Daniele AndradeLabel Manager: Grazi Caetano VÍDEODireção: Douglas Aguillar e Fran LandhinFotografia: Arnaldo MesquitaCâmeras: Arnaldo Mesquita, Douglas Aguillar, Felipe Schmidt, Fran Landhin, Jesus Dantas, GuilhermePaiva, Renan Toledo, Gabriel Matos, Silas Ismael, André Luiz de Holanda, José Eduardo GomesGrua: Alexandre de Souza, Victor Lima, Marcelino de OliveiraDrone: Raphael de Barros LimaCoord. Produção: Angelina TrevisanAssistente de Produção: Clarice DuoProdução: Adriano GobbiMontagem: Douglas AguilarColor Grade: Marcelo CosmeFinalização: GogacineBANDA DO PODERBaixo: PrateadoTeclados, gaita, xilofone e piano: Anselmo LimaViolão: Saymon SazCavaco: Nando MartinsBateria: Fábio ViottoSurdo: Gabriel BarrigaPercussão Geral: Rogerinho NagôPandeiros: Nego do PandeiroBacking Vocals: Danilo Oliveira, Caramujo e Júnior PulgãoEQUIPE DO PODERProdução Geral: Fernando PiritubaLogística: Luana BarretoSecretário: Adriano OliveiraTécnico de PA: Gabriel VasconcelosTécnico de Monitor: Lucas EsdrasTécnico de Luz: Ricardinho OliveiraRoadies: Michael Slow, Paulo Xuxa e Vanderlei RussoCenotécnico: Adelino PequenoTécnico de LED: Thiago RamosSegurança: Robinson SouzaConteúdo: Noize MediaContato para shows:Olívia BrasileiroTel: (11) 3628-8638 / (11) 96382-4602contato@pazebemmusica.com.brSiga o Thiaguinho nas redes sociais:https://twitter.com/thiaguinhocomthhttps://www.instagram.com/thbarbosa/https://www.tiktok.com/@thiaguinhocomthhttps://www.facebook.com/thiaguinhocomth"
"1OPMWy83Ze8","PASSAMOS A NOITE NO PARQUE DA HOT WHEELS SEM NINGUÉM VER!","2023-07-07T15:00:01Z","UC2bYhAHyaqfWlPXWBVk4BcA","Enaldinho","24","23.11.07","Enaldinho|Enaldo Lopes|Desafio|elo team","1600739","48176","0","3468","https://i.ytimg.com/vi/1OPMWy83Ze8/default.jpg","False","False","Meu espetáculo: https://www.enaldinho.com.brO conteúdo deste e de todos os vídeos do canal tem como principal intuito o entretenimento. Não repita ou reproduza este conteúdo, seja em ambientes públicos ou privados. O conteúdo visa exclusivamente gerar entretenimento.CANAL DA ELO TEAM: https://www.youtube.com/results?search_query=elo+teamSeja membro deste canal e ganhe benefícios:https://www.youtube.com/channel/UC2bYhAHyaqfWlPXWBVk4BcA/joinCOMPRE SEU LIVRÃO DO ZAP: http://bit.ly/livrosdoenaldinhoMINHA LOJA:  http://lolja.com.br/enaldinhoINSTA: @Enaldinho ou www.instagram.com/enaldinho/★ Siga nas redes sociais:Twitter: https://twitter.com/Enaldinho1Face: https://www.facebook.com/enaldo.lopes.1Segundo canal: https://goo.gl/oA3ErZ  ★ REDES SOCIAIS INTEGRANTES ELO:LUÍS: https://www.youtube.com/channel/UCLDyrS9G_SPjSUU3BIAsS2gTIAGO:Youtube: https://www.youtube.com/channel/UC7R498nEgxhervYSG8iRDbAGUILHERMEYoutube: https://www.youtube.com/channel/UCUIXGDcq5BMwTGdavU0V8-gBIELYoutube: https://www.youtube.com/user/zvisiongamerBRENNERYoutube: https://www.youtube.com/channel/UC7dN8lVhi2FPM9eZbMDrepwLUIZAYoutube:https://www.youtube.com/channel/UCSvi-LS8fTig35aDgYB8TcQ NICOLASYoutube:https://www.youtube.com/channel/UCW6_V5qKt6XYv-lST3xZ0nQEDIÇÃO, REVISÃO E POSTAGEM: Marcelinho Fernandes- Instagram: @Marcelinho_fe"
"xz5tRT7oQ0o","O Primeiro Dia de Férias da Luluca no Avatar World | Família Luluca","2023-07-07T14:00:45Z","UCO9LPWL-UtupgPug7Ad6nSA","Família Luluca","24","23.11.07","luluca|família luluca|crescendo com luluca|luluca games|avatar world luluca|férias luluca|shorts|shorts luluca","332021","7644","0","633","https://i.ytimg.com/vi/xz5tRT7oQ0o/default.jpg","False","False","Olá pandinhas tudo bem com vcs? O vídeo de hoje é O Primeiro Dia de Férias da Luluca no Avatar World | Família Luluca. Espero que se divirtam muito! Um super beijo!!! #luluca #familialulucaJá DEIXE SEU LuLike... COMPARTILHE esse vídeo com seus amigos e SE INSCREVA no canal que ficarei muito feliz! Um super beijo e tchau tchaaauuuuuuuMINHAS REDES SOCIAIS❤ Instagram - @luluca_oficial❤ Facebook - oficial.luluca❤ Tik Tok - @www.luluca🎮 ROBLOX - JustLuluquinhaAgradeço a todos que me acompanham e que fazem eu querer gravar mais e mais vídeos."
"P9n8X44YEgc","O BOLO DE CAFETERIA MAIS DELICIOSO, ÚMIDO E DE GRANDE SUCESSO POR ONDE PASSA JÁ ESTÁ À SUA ESPERA!","2023-07-07T22:02:59Z","UCftYZOaFsqNiVmlCbS49f6g","SABOR DE FESTA - Chef Álvaro Rodrigues","22","23.11.07","BOLO DE BANANA|TORTA DE BANANA|TORTA DE BANANA COM CHOCOLATE|BOLO DE BANANA COM CHOCOLATE|RECHEIO DE BANANAS|GANACHE DE CHOCOLATE COM BANANAS|BOLO DE CAFETERIA DE BANANAS|BOLO RÁPIDO DE BANANA|BOLO DE BANANAS FOFINHO E MACIO|BOLO DE CANELA|BOLO RÁPIDO|BOLO ACHOCOLATADO DE BANANAS|BOLO DE MANTEIGA|MASSA DE BOLO DE ANIVERSÁRIO|BOLO GOTAS DE CHOCOLATE|BOLO DE CAFETERIA|BOLO DE MAIZENA|BOLO DA VOVÓ|BOLO DE MÃE","92397","11149","0","411","https://i.ytimg.com/vi/P9n8X44YEgc/default.jpg","False","False","Olá pessoal, tudo bem?Hoje tem aulona de confeitaria! Prepare-se para descobrir uma das receitas mais inusitadas e diferentes de tudo que você já viu. O resultado final? Um bolo delicioso, úmido, perfumado e que fará o maior sucesso em sua vida. Aproveitem! SE GOSTOU, FAÇA SUA INSCRIÇÃO NO CANAL, ACIONE O SININHO E FIQUE POR DENTRO DE TODAS AS NOSSAS NOVIDADES!E, CLARO DEIXE SEU LIKE, COMPARTILHE E NOS ENVIE SEU COMENTÁRIO. SEJAM TODOS MUITO BEM VINDOS AO SABOR DE FESTA!Visite nosso site e conheça uma infinidade de outras receitas disponíveis http://alvarorodrigues.com.br/-----------------------------------------------------------------------------Contato para novas parcerias WhatsApp (11) 95551-0698 -----------------------------------------------------------------------------Siga-nos também no Instagram https://www.instagram.com/chefalvarorodrigues -----------------------------------------------------------------------------Apostilas relacionadas ao tema 🔸 BOLOS DE FESTA - 30 RECEITAS COMPLETAS E DISTINTAS🔸 BOLOS DE CAFETERIA – 32 RECEITAS DE BOLOS + 8 RECEITAS DE BEBIDAS QUENTES E FRIASPara maiores informações nos contate no WhatsApp (11) 95551-0698-----------------------------------------------------------------------------PARCEIROS DA RECEITA Bombay - https://www.bombayhs.com.br/ Callebaut - https://www.callebaut.com/pt-BR -----------------------------------------------------------------------------BOLO CHOCO BANANAMASSA AMANTEIGADA60 g de manteiga sem sal macia¾ xícara (chá) de açúcar refinado peneirado (140 g)1 colher (café) rasa de extrato de baunilha Bombay2 ovos grandes inteiros e ligeiramente batidos (total líquido de 100 g)½ xícara (chá) de leite Integral frio (120 ml)1 ¼ xícara (chá) de farinha de trigo (150 g)¼ xícara (chá) de amido de milho (30 g)½ colher (sopa) de fermento em pó (7 g)1 pitada de Flor de Sal BombayRaspas de 1 limão Tahiti médio¼ xícara (chá) de Drops de Chocolate 50% Callebaut (50 g)RECHEIO DE BANANAS6 bananas do tipo Prata maduras amassadas (450 g sem a casca)2 colheres (sopa) de açúcar refinado peneirado (30 g)½ colher (sobremesa) rasa de canela em pó BombaySuco de 1 limão Tahiti médio espremido e coado na hora (20 ml)GANACHE DE COBERTURA200 g de chocolate de chocolate meio amargo 50% Callebaut100 g de creme de leite UHT ou pasteurizado1 pitada de canela em pó Bombay (opcional)MODO DE FAZEREm uma tigela média misture os ingredientes e derreta em banho-maria ou no forno micro-ondas, envolvendo com auxílio de um fouet até obter um creme liso e brilhante. Empregue ainda morno ou ainda maleável.DECORAÇÃO50 g de Flakes ao Leite Monalisa Callebaut✔️ Veja todos os detalhes do preparo da massa, do recheio de bananas, da montagem final e da decoração através do vídeo disponível no canal Sabor de Festa do Youtube.DICAS DO CHEF:✔️ A xícara medida utilizada no preparo desta receita tem 240 ml.✔️ O amido de milho traz à massa muito mais maciez e delicadeza. No entanto, é possível prepará-la apenas com farinha de trigo.✔️ Não é aconselhável utilizar o leite quente, poderia derreter a manteiga e comprometer a textura final da massa.✔️ O ideal seria utilizar as bananas do tipo Prata por serem mais firmes ou mesmo as do tipo “nanicas”.✔️ O delicioso Bolo Choco Banana poderá ser assado em formas de 20/ 22 ou mesmo 24 cm de diâmetro x 5 cm de altura obtendo-se, desta forma, alturas diferenciadas.✔️ O tempo de forneamento será entre 40/45 minutos.✔️ É possível congelar o bolo (decorado ou não) por até 60 dias✔️ O rendimento será de 12 porções.-----------------------------------------------------------------------------ASSISTA TAMBÉM:📌 BOLO DE FUBÁ CREMOSO - https://youtu.be/Hr3gjSOSuZQ📌 BOLO DE LARANJA COM CALDA - https://youtu.be/Sd9sYd0QQTg📌 BOLO MÁRMORE DE COCO - https://youtu.be/wT57VWarPfQ📌 TORTA MOUSSE DE CHOCOLATE - https://youtu.be/_hQohGKFogo📌 BOLO DE MAÇÃS - https://youtu.be/lqdAyrzCg4c📌 QUEIJADINHAS - https://youtu.be/27MnswG2WGg📌 CHOCOLATADA TRUFADA & CAPPUCCINO CREMOSO - https://youtu.be/nNATGCKw1tE📌 BOLO PRESTÍGIO - https://youtu.be/Ai19xOmWNQM"
"9YG0248M78g","BASTIDORES: SÃO PAULO 1 X 0 PALMEIRAS | SPFC PLAY","2023-07-07T01:47:44Z","UCX3zTAsEoZ61rQMYb_08Tow","São Paulo FC","17","23.11.07","SPFC|tricolor|São Paulo|Morumbi|sao paulo|spfctv|Made in Cotia|tricolorpaulista|São Paulo Futebol Clube|VamosSãoPaulo|SPFCPLAY|SPFC PLAY|SPFC APP","290423","30986","0","944","https://i.ytimg.com/vi/9YG0248M78g/default.jpg","False","False","Cadastre-se na SPFC Play: https://spfc.vc/3uLYoyJ📲 Baixe na Play Store: http://bit.ly/3CLjS2k📲 Baixe na App Store: http://apple.co/3F2wCED"
"wU2siJ2c5TA","NewJeans (뉴진스) 'Super Shy' Dance Practice","2023-07-07T09:00:01Z","UCMki_UkHb4qSc0qyEcOHHJw","NewJeans","10","23.11.07","NewJeans|뉴진스|민지|하니|다니엘|해린|혜인|뉴진스 민지|뉴진스 하니|뉴진스 다니엘|뉴진스 해린|뉴진스 혜인|MINJI|HANNI|HAERIN|HYEIN|NewJeans MINJI|NewJeans HANNI|NewJeans HAERIN|NewJeans HYEIN|DANIELLE|NewJeans DANIELLE","4320910","247972","0","6211","https://i.ytimg.com/vi/wU2siJ2c5TA/default.jpg","False","False","NewJeans (뉴진스) 'Super Shy' Dance Practiceⓒ 2023 ADOR. All Rights Reserved.Connect with NewJeansPHONING https://phoning.onelink.me/KG15/n7452q87OFFICIAL YOUTUBE https://www.youtube.com/c/NewJeans_officialOFFICIAL WEBSITE https://newjeans.krOFFICIAL INSTAGRAM https://www.instagram.com/newjeans_officialOFFICIAL TWITTER https://twitter.com/NewJeans_ADOROFFICIAL TIKTOK https://www.tiktok.com/@newjeans_officialOFFICIAL WEVERSE https://weverse.io/newjeansofficialOFFICIAL FACEBOOK https://www.facebook.com/official.newjeansOFFICIAL JAPAN TWITTER https://twitter.com/@NewJeans_jpOFFICIAL WEIBO  https://weibo.com/NewJeansADOROFFICIAL BILIBILI https://space.bilibili.com/3493092783032940#Time_to_NewJeans#NewJeans #뉴진스 #NewJeans_GetUp#NewJeans_SuperShy#ADOR #어도어"
"d_GNKw9-3vA","3 JOGOS DE TERROR DOS SIMPSONS EM 1 VÍDEO!","2023-07-07T15:00:30Z","UCIXguhHCl8eDTkXpEuiGPUA","Jazzghost","20","23.11.07","jazzghost|jazz","1330132","60410","0","2338","https://i.ytimg.com/vi/d_GNKw9-3vA/default.jpg","False","False","Chegou a vez dos Simpsons ser totalmente estragado com 3 jogos obscuros! CONFIRA E SARAIVA O LIKE!======================●Instagram: julianoab●Email de contato: jazzghost@gmail.com"
