video_id,title,publishedAt,channelId,channelTitle,categoryId,trending_date,tags,view_count,likes,dislikes,comment_count,thumbnail_link,comments_disabled,ratings_disabled,description
"xXHN7s4KoKE","O INVASOR DA CREATIVE SQUAD","2023-07-10T12:30:36Z","UCJIl6Ahgkfwg1DRYcg-kY3g","Mendrake","20","23.11.07","[none]","331307","15868","0","949","https://i.ytimg.com/vi/xXHN7s4KoKE/default.jpg","False","False","contatomendrake@surpass-agency.com🌐 Redes Sociais: 🔔 Instagram: https://www.instagram.com/mendrakee/🔔 Twitter: @Mendrakee‹‹ CREATIVE SQUAD ›› 🗻 Geleia - https://www.youtube.com/c/GeleiaPlays1 🗻 Chip - https://www.youtube.com/Naughter 🗻 Ligonz - https://www.youtube.com/Ligonz 🗻 Caduxinn - https://www.youtube.com/Caduxinn 🗻 Onerb - https://www.youtube.com/c/OnerbYT 🗻 MucaHD - https://www.youtube.com/MucaHD🗻 Fixz - https://www.youtube.com/fixzinho 🗻 Feuripe - https://www.youtube.com/Feuripe 🗻 Bern - https://www.youtube.com/c/NHEIN🗻 Tonigon - https://www.youtube.com/c/Tonigon‹‹ DISCORD DA CREATIVESQUAD ›› ♦️ https://discord.gg/STdWJ35Yt7 🌌EnxadaHost: https://enxadahost.com/r/creativesquad O cupom csquad dá 10% de desconto adicional em todos os planos."
"-vL01jbgENE","EA SPORTS FC 24 | Official Announce Trailer","2023-07-10T15:00:00Z","UCoyaxd5LQSuP4ChkxK0pnZQ","EA SPORTS FC","20","23.11.07","ea sports fc|easportsfc|fc 24|ea sports fc 24|easportsfc 24|fc 24 trailer|fc 24 announce|fc 24 reveal|fc 24 announce trailer|fifa 24|fc 24 official|fc 24 official trailer|fc 24 news|fc24 news|fc 24 ps5|fc 24 xbox|fc 24 pc|football video game|soccer video game|ea sports|haaland|vinicius|kerr|beckham|bellingham|virgil|vvd|son|rashford|saka|ultimate team|fut|ea sports fc trailer|ea sports fc gameplay|fc 24 gameplay|fifa 23","1213868","62203","0","3971","https://i.ytimg.com/vi/-vL01jbgENE/default.jpg","False","False","Welcome to the club. Welcome to #EASPORTSFC. See the full reveal of #FC24 on July 13: https://youtube.com/live/OF7VyAI5vsgFeaturing the voice of Daniel Kaluuya.Subscribe to see more from EA SPORTS FC 24: http://bit.ly/pzw4VD"
"i5nUufn_FmE","EXO 엑소 'Cream Soda' MV","2023-07-10T08:59:11Z","UCEf_Bc-KVd7onSeifS3py9g","SMTOWN","10","23.11.07","엑소|exo|cream soda|크림 소다|exist|정규 7집|수호|시우민|백현|첸|찬열|디오|세훈|suho|xiumin|baekhyun|chen|chanyeol|d.o.|sehun|music video|mv|뮤직비디오|뮤비","5247745","775953","0","224225","https://i.ytimg.com/vi/i5nUufn_FmE/default.jpg","False","False","EXO's 7th Album EXIST is out!Listen and download on your favorite platform: https://EXO.lnk.to/EXIST 🌊 'Let Me In' MV https://youtu.be/91VhCIQNjIc📢 'Hear Me Out' MV https://youtu.be/r2VZQa2IgP4[Tracklist]01 Cream Soda02 Regret It03 Hear Me Out04 Private Party05 Cinderella06 No Makeup07 Love Fool09 Another Day09 Let Me InEXO Officialhttps://www.youtube.com/weareoneEXOhttps://www.facebook.com/weareoneEXOhttps://www.instagram.com/weareone.exohttps://twitter.com/weareoneEXOhttps://www.tiktok.com/@weareone.exo_official#EXO #CreamSoda #EXIST #엑소 #EXO_CreamSoda #EXO_EXISTEXO 엑소 'Cream Soda' MV ℗ SM Entertainment"
"CoxCTJaFuTI","Tour pela minha Casa de Férias na Disney 2023 | Luluca","2023-07-10T14:00:08Z","UCnrGkE2AmBAv6Vxj6kjf1jg","Crescendo com Luluca","22","23.11.07","luluca|crescendo com luluca|luluca games|família luluca|shorts|luluca shorts|casa da luluca","495555","24139","0","2219","https://i.ytimg.com/vi/CoxCTJaFuTI/default.jpg","False","False","Tour pela minha Casa de Férias na Disney 2023 | LulucaMe Sigam no Instagram 📸 @luluca_oficialJá deixe seu LuLike... Compartilhe esse vídeo com seus amigos e SE INSCREVA no canal que ficarei muito feliz! Um super beijo  #luluca #crescendocomlulucaSIGAM MINHAS REDES SOCIAIS:❤ Instagram - luluca_oficial❤ TikTok - www.luluca❤ Facebook - oficial.luluca🎮 ROBLOX - JustLuluquinhaAgradeço a todos que me acompanham e que fazem eu querer gravar mais e mais vídeos."
"trzeUClQIIg","ZEROBASEONE (제로베이스원) 'In Bloom' MV","2023-07-10T09:00:37Z","UCSAp0Yl9S0Zq5uDqE6im_XQ","ZEROBASEONE","24","23.11.07","ZEROBASEONE|제로베이스원|제베원|ZB1|ZERO BASE ONE|ZEROBASEONE official|ZERO BASE ONE official|제로즈|성한빈|김지웅|장하오|석매튜|김태래|리키|김규빈|박건욱|한유진|SUNGHANBIN|KIMJIWOONG|ZHANGHAO|SEOKMATTHEW|KIMTAERAE|RICKY|KIMGYUVIN|PARKGUNWOOK|HANYUJIN|ZEROSE|InBloom|인블룸|제베원 인블룸|ZB1 In Bloom|In Bloom MV|인블룸 뮤비|In Bloom","6164574","422766","0","63279","https://i.ytimg.com/vi/trzeUClQIIg/default.jpg","False","False","ZEROBASEONE (제로베이스원) 'In Bloom' MVZEROBASEONE The 1st Mini Album[𝐘𝐎𝐔𝐓𝐇 𝐈𝐍 𝐓𝐇𝐄 𝐒𝐇𝐀𝐃𝐄]2023.07.10 18:00 (KST)More about ZEROBASEONE : https://linktr.ee/zb1_official#ZEROBASEONE #ZB1#제로베이스원 #YOUTHINTHESHADE #InBloom"
"Fjs5L02YxAw","Os planos mudaram completamente vamos mudar de cidade","2023-07-10T15:00:08Z","UCXQe9ldCtjN_RP1V_c9hNUw","Adeline Camargo","24","23.11.07","[none]","168378","31729","0","3385","https://i.ytimg.com/vi/Fjs5L02YxAw/default.jpg","False","False","Como sempre, muito obrigado por sua presença e espero que tenha um ótimo dia! volte sempre.✅Parcerias: familiacamargocomercial@gmail.com 📸 SOCIAL MEDIA LINKS✅ Instagram 📸: https://www.instagram.com/adelinecamargooficial✅ Fanpage:        https://www.facebook.com/adelinecamargooficial✅ YouTube:  https://youtube.com/@AdelineCamargo✅Adeline Camargo Flix: https://www.youtube.com/@AdelineCamargoFlix✅Agatha Camargo: https://www.youtube.com/c/AgathaCamargoVlog de passeio em shoppingsCurtindo a praiaCachorros lindosCompras no supermercadoAventura de compras"
"Tuoh71Kuyh8","QUEM FIZER O MELHOR BARCO DE R$10, R$100 OU R$1000!!","2023-07-10T15:00:09Z","UC2bYhAHyaqfWlPXWBVk4BcA","Enaldinho","24","23.11.07","Enaldinho|Enaldo Lopes|Desafio|elo team","862435","30638","0","1254","https://i.ytimg.com/vi/Tuoh71Kuyh8/default.jpg","False","False","Meu espetáculo: https://www.enaldinho.com.brO conteúdo deste e de todos os vídeos do canal tem como principal intuito o entretenimento. Não repita ou reproduza este conteúdo, seja em ambientes públicos ou privados. O conteúdo visa exclusivamente gerar entretenimento.CANAL DA ELO TEAM: https://www.youtube.com/results?search_query=elo+teamSeja membro deste canal e ganhe benefícios:https://www.youtube.com/channel/UC2bYhAHyaqfWlPXWBVk4BcA/joinCOMPRE SEU LIVRÃO DO ZAP: http://bit.ly/livrosdoenaldinhoMINHA LOJA:  http://lolja.com.br/enaldinhoINSTA: @Enaldinho ou www.instagram.com/enaldinho/★ Siga nas redes sociais:Twitter: https://twitter.com/Enaldinho1Face: https://www.facebook.com/enaldo.lopes.1Segundo canal: https://goo.gl/oA3ErZ  ★ REDES SOCIAIS INTEGRANTES ELO:LUÍS: https://www.youtube.com/channel/UCLDyrS9G_SPjSUU3BIAsS2gTIAGO:Youtube: https://www.youtube.com/channel/UC7R498nEgxhervYSG8iRDbAGUILHERMEYoutube: https://www.youtube.com/channel/UCUIXGDcq5BMwTGdavU0V8-gBIELYoutube: https://www.youtube.com/user/zvisiongamerBRENNERYoutube: https://www.youtube.com/channel/UC7dN8lVhi2FPM9eZbMDrepwLUIZAYoutube:https://www.youtube.com/channel/UCSvi-LS8fTig35aDgYB8TcQ NICOLASYoutube:https://www.youtube.com/channel/UCW6_V5qKt6XYv-lST3xZ0nQEDIÇÃO, REVISÃO E POSTAGEM: Marcelinho Fernandes- Instagram: @Marcelinho_fe"
"U0JTF1qLjn8","Henrique Lima canta 'Na Hora de Amar' na Final – The Voice Kids","2023-07-09T22:45:01Z","UCqUxzFuQz80vFUVo0j6W5CQ","The Voice Kids Brasil","24","23.11.07","the voice kids|the voice kids brasil|the voice brasil|the voice globo|semifinais|maria clara e juan|melhores momentos|the voice kids online|the voice kids completo|final the voice kids|final the voice kids 2023|isa camargo|Israelly Bonfim|Henrique Lima|Emanuel Motta|Laura Medeiros|iza|isa camargo the voice|israelly bonfim the voice|henrique campeão|henrique campão the voice|emanuel motta the voice|laura medeiros the voice|final do the voice kids","82220","746","0","0","https://i.ytimg.com/vi/U0JTF1qLjn8/default.jpg","True","False","Henrique Lima canta 'Na Hora de Amar'!Assista à apresentação completa em ➡️ http://glo.bo/3za9AZkQuer conferir conteúdos exclusivos do #TheVoiceKids? Vem comigo! ➡️ http://glo.bo/3vKRhGTSiga o #TheVoiceKids nas redes e fique por dentro de tudo que está rolando! ✌️https://facebook.com/thevoicebrasil https://twitter.com/thevoicebrasil https://instagram.com/thevoicebrasilReveja todas as apresentações das Audições às Cegas do #TheVoiceKids ➡️ http://glo.bo/3yjCWnB"
"wFZblWxyXGk","ZERANDO O MINECRAFT EM 2023! (1.20)","2023-07-10T15:00:42Z","UCIXguhHCl8eDTkXpEuiGPUA","Jazzghost","20","23.11.07","jazzghost|jazz|minecraft|mine|update|1.20","726713","56458","0","3537","https://i.ytimg.com/vi/wFZblWxyXGk/default.jpg","False","False","Foi lançada a nova atualização do Minecraft 1.20, Trails and Tales. Então eu pensei, por que não zerar o Mine nesse novo update? CONFIRA E SARAIVA O LIKE!======================●Instagram: julianoab●Email de contato: jazzghost@gmail.com"
"1KBucxr3VwQ","CHOQUE DE CULTURA #72: Barbie","2023-07-09T14:00:00Z","UC033rpv7OKk-QYfrvwl5s8Q","TV Quase","23","23.11.07","choque de cultura|tv quase|barbie|choque de cultura barbie","370810","57884","0","1179","https://i.ytimg.com/vi/1KBucxr3VwQ/default.jpg","False","False","NOVA TEMPORADA ROLANDO! Segundas às 22h no Canal Brasil e Globoplay +canaisDomingos às 11h na TV Quase________Nossos especialistas da sétima arte discutem o novo “Lua de Cristal” sem a Xuxa e o Sérgio Mallandro e comentam a decisão da Barbie de deixar Jurerê Internacional para viver no mundo real.________ACESSE: http://tvquase.comINSCREVA-SE: http://tinyurl.com/pz38k86INSTAGRAM: http://instagram.com/tvquaseTWITTER: http://twitter.com/tvquaseFACEBOOK: http://facebook.com/tvquaseTIKTOK: http://tiktok.com/@tvquase Redes sociais: Marcelly VasconcelosSite: Marco Combat (https://lookrio.com) e Marcelly Vasconcelos________COMPRE NOSSOS PRODUTOS!LIVRO DO CHOQUE:https://amzn.to/430K5FfLIVRO DO CRAQUE DANIEL:https://amzn.to/46l1Ly5CAMISAS E BONÉS DO CRAQUE DANIEL:https://www.elcabriton.com/marca/craq...CAMISAS DO ÚLTIMO PROGRAMA DO MUNDO:https://tvquase.com/chicoreiCAMISETA BLIU: https://tvquase.com/camiseta-bliu________Thumbnail: Marcelly Vasconcelos________#choquedecultura #barbie #cinema"
"2RSaivS_V3I","Grêmio x Botafogo | Melhores Momentos | Brasileirão 2023","2023-07-09T22:20:28Z","UC33-r08Jg79RguWuQjM2aAQ","BOLA NA REDE","17","23.11.07","futebol|melhores momentos|gols|ao vivo","222006","2388","0","118","https://i.ytimg.com/vi/2RSaivS_V3I/default.jpg","False","False","Grêmio x Botafogo , Grêmio x Botafogo melhores momentos , Grêmio x Botafogo hoje , Grêmio x Botafogo ao vivo , Grêmio x Botafogo gols , Grêmio e Botafogo , Grêmio x Botafogo brasileirãoGrêmio x Botafogo | Melhores Momentos | Brasileirão 2023"
"DWu6LEH6Uaw","ISSO AÍ FOI PÊNALTI, pô! O 'SISTEMA' tava DORMINDO? O Flamengo foi PREJUDICADO contra o Palmeiras?","2023-07-09T03:00:03Z","UCv-Nx8pSfG_LxbViMz14RWQ","Jovem Pan Esportes","17","23.11.07","jovem pan esportes|palmeiras|flamengo|palmeiras x flamengo|flamengo x palmeiras|flamengo ao vivo|fla tv|flatv|coletiva|sampaoli|jogo do palmeiras|jogo do flamengo|gols|melhores momentos|gols de hoje|abel|abel ferreira|pilhado|mauro cezar|mauro cesar|ao vivo|hoje|canelada|vampeta|pilulacanelada|arbitragem|var|pênalti|pênalti flamengo|pênalti everton ribeiro|pênalti em everton ribeiro|richard rios|pênalti palmeiras x flamengo|sistema|flavio prado|flavio_pilula","910039","31095","0","5887","https://i.ytimg.com/vi/DWu6LEH6Uaw/default.jpg","False","False","Arbitragem e VAR: teve pênalti de Richard Rios em Everton Ribeiro em Palmeiras x Flamengo? Veja o debate no Canelada, da Jovem Pan Esportes.Link do vídeo: https://youtu.be/DWu6LEH6Uaw#JovemPan #Canelada"
"37ieZKq9gnQ","PALMEIRAS 1 X 1 FLAMENGO | MELHORES MOMENTOS | 14ª RODADA BRASILEIRÃO 2023 | ge.globo","2023-07-09T02:27:34Z","UCgCKagVhzGnZcuP9bSMgMCg","ge","17","23.11.07","palmeiras|flamengo|palmeiras x flamengo|flamengo x palmeiras|allianz parque|dudu|rony|arrascaeta|impedido|anulado|anulou|impedimento|murilo|sampaoli|abel|ge|ge.globo|globoesporte|globo esporte|esportes|esporte|globo|globoesporte.com|sportv|futebol|canal do ge|ao vivo|com imagem|com imagens|melhores momentos|gol|gols|lances|highlights|gols da rodada|gols do dia|brasileirao|brasileirão|campeonato brasileiro|pos jogo|pós-jogo|pos-jogo|pós jogo|veiga|everton ribeiro","1890072","54875","0","3549","https://i.ytimg.com/vi/37ieZKq9gnQ/default.jpg","False","False","Flamengo busca empate com o Palmeiras e se mantém à frente do rival no Brasileirão.Verdão é melhor no primeiro tempo, marca com Dudu, mas acaba dominado na segunda etapa e sofrendo empate com gol de Arrascaeta.🌟 Confira os melhores momentos completos com mais replays em ge.globo:https://ge.globo.com/sp/futebol/brasileirao-serie-a/jogo/08-07-2023/palmeiras-flamengo.ghtml🌟 Assine o Premiere: https://gplay.la/ytgepremiere#Palmeiras #Flamengo #Brasileirão______________________________________✅ INSCREVA-SE NO CANAL GE:  https://cutt.ly/xfHlwBk👍 Curtiu o vídeo? Deixe seu like e dê seu pitaco 😎⚽ 🌟 Playlists pra você maratonar 🌟 ► Bola Quadrada:  https://cutt.ly/IfHk7ra ► BMFC: https://cutt.ly/gfHk5bH►Humor no GE: https://cutt.ly/HfHk6SY►Jogos Históricos: https://cutt.ly/BkxoZJX► Listas e TOPs: https://cutt.ly/hkxo51U► Originais GE: https://cutt.ly/vkxpunL► Melhores Momentos do Brasileirão:  https://cutt.ly/NfHk9TS► Melhores Copa do Brasil: https://cutt.ly/LfHk3Di► Gols Série B: https://cutt.ly/LfHk84c✅ Inscreva-se, também, no canal do CARTOLA FC e fique por dentro das melhores dicas do maior fantasy game do Brasil - https://cutt.ly/ffV1Xri______________________________________  No canal ge você encontra os melhores conteúdos do FUTEBOL BRASILEIRO! 🤙😎"
"_RErP63bqas","Recriamos as Skins da TURMA Na Vida Real","2023-07-10T13:06:00Z","UCrcBZDofBltcgGxphNia2tw","Problems","20","23.11.07","maniqueft|lego|problems|probrems|probres|pobrems|problemas|problema|pobrema|mainequeft|minecraft|video do problema|video do problems|video do pobrems|minecraft survival|minecraft mitos|minecraft fatos|problems roblox|roblox|pobrems roblox|pobris roblox|pobrema roblox|problema roblox","472025","16736","0","1057","https://i.ytimg.com/vi/_RErP63bqas/default.jpg","False","False","COMPRE SEU BONECO PROBLEMS:https://lojadoproblems.com/Problems School: https://www.youtube.com/@ProblemsSchoolhttps://linktr.ee/ProblemsYT(Clica no link vai ❤ )Seja membro deste canal e ganhe benefícios:https://www.youtube.com/channel/UCrcBZDofBltcgGxphNia2tw/joinMeu grupo no Roblox:https://www.roblox.com/groups/16901129/Turma-do-Problems-OFICIAL#!/storeENXADAHOST - Cupom: ProblemsMe siga:Discord: https://discord.gg/problems1Instagram: https://www.instagram.com/problems_sr/Twitter: https://twitter.com/problemstrolTiktok: https://www.tiktok.com/@problemssrATENÇÃO: O conteúdo do vídeo é 100% family friendly, ou seja qualquer um pode assistir com toda a familia quando quiser!!#problems #minecraft"
"Kg00dMabkQc","ESSE FOI MEU ÚLTIMO DIA MORANDO NESSA CASA E LEVEI A ACADEMIA E A SINUCA","2023-07-10T14:15:33Z","UCR3vcUrhFUdzagng58ueI2w","Invento na Hora","23","23.11.07","invento na hora|inventonahora|lucas lira|lucaslira|sunaika bruna|sunaikabruna|casa|casa nova|minha casa|casa grande|mansão|casona|meu ap|meu apartamento","476830","52983","0","885","https://i.ytimg.com/vi/Kg00dMabkQc/default.jpg","False","False","● CLICA AQUI PRA SE INSCREVER 😂 → https://goo.gl/6RrS7C ● INSTAGRAM: http://instagram.com/lucas_lira● E-MAIL COMERCIAL: inventonahora@howhow.com.br"
"o9VOwbp7Jig","O DIA QUE ENCONTREI OS PANDAS NO MINECRAFT #3","2023-07-10T12:59:13Z","UCV306eHqgo0LvBf3Mh36AHg","Felipe Neto","24","23.11.07","felipe neto|irmãos neto","520545","58320","0","1709","https://i.ytimg.com/vi/o9VOwbp7Jig/default.jpg","False","False","LOJA DO CANAL - https://www.lolja.com.br/parceiros/felipe-neto/INSCREVA-SE NO CANAL DE CORTES - https://www.youtube.com/c/cortesfelipenetoSEJA MEMBRO! - https://www.youtube.com/felipeneto/join"
"gBSKi7rXdUU","QUEM ACERTAR O DESENHO DO JOGADOR CHUTA!!","2023-07-09T22:53:16Z","UCRcm1ySdquHEzFVvv69WgrQ","Tulinho Oficial","17","23.11.07","Tulinho|Oficial|TULINHO OFICIAL|IRMAOS LO|TAROBINHA|FUTEBOL|DESAFFIO|DESAFIO|FILHO DO TULIO MARAVILHA|BANHEIRISTAS|CAIO LO|VITOR LO|TULINHO|TULINHO BANHEIRISTAS|TULINHO SKILLS|TULINHO SUPERCLASSICO|DESAFIOS DE FUTEBOL|TL5|SOCCER|ACERTE O DESENHO DO JOGADOR|DESAFIO DO DESENHO|#Tulinho1M","114691","9928","0","77","https://i.ytimg.com/vi/gBSKi7rXdUU/default.jpg","False","False","CURTIU O VIDEO NOVO? JA DEIXA SEU LIKE,SE INSCREVE NO CANAL E COMPARTILHE COM TODOS SEUS AMIGOS E VAMOS BATER A META #TULINHO1MVENHA APOSTAR NA SPORTYBET: https://sporty.bet/TulinhoEMAIL PARA CONTATO: tuliocostafilho0@gmail.comME SIGA NO INSTAGRAM: https://www.instagram.com/tulinho/ME SIGA NO TIKTOK: https://www.tiktok.com/@tulinho?_t=8bR5aENZfcM&_r=1PAGINA NO FACEBOOK: https://www.facebook.com/tulinhotl5/"
"DHPDxMBEwWo","ESSE É O CARRO DO CONTEINER...","2023-07-09T14:00:11Z","UChMJkHCD2wdvSO7CMOuLR-w","Renato Garcia YT","24","23.11.07","RENATO GARCIA|RENATO DA XJ6|RENATO|CAMARO|DAILY VLOG","1632411","163983","0","5450","https://i.ytimg.com/vi/DHPDxMBEwWo/default.jpg","False","False","Canal Mareze Classic Car: https://www.youtube.com/c/ClassicCarBrasilInstagram CLASSIC CAR: https://www.instagram.com/classiccarbrasil/Minha Loja: https://www.lojarenatogarciayt.com.br/ ●Instagram: https://www.instagram.com/renatogarciayt●Twitter: https://twitter.com/renatogarciayt●Facebook: https://www.facebook.com/renatogarciayoutubeME ENVIE PRESENTES ! Caixa Postal: 8748CEP: 86020980LONDRINA - PR MEU SEGUNDO CANAL: https://www.youtube.com/channel/UClUN2J5hwEsE6_sKW3SPlMg●Contato para parcerias e eventos: renato@agencia11k.com.br"
"OIAfO18AIHA","EU VIREI UMA PRIVADA ASSUSTADORA NO ROBLOX (skibidi toilet)","2023-07-10T13:30:08Z","UC6P6SvP2arhEdJ9Pg8qwP2A","Athos","20","23.11.07","minecraft|athos|athos gamer|minecraft pe|bedrock|java|pocket edition|maniqueft|virei uma privada assustadora|skibidi toilet","431136","8542","0","170","https://i.ytimg.com/vi/OIAfO18AIHA/default.jpg","False","False","📸 Meu Instagram:https://www.instagram.com/_athos_br/GARANTA SEU BONECO ATHOS:https://lojadoathos.com(use o cupom ATHOS e ganhe desconto)📞 Contato comercial: comercial@agenciacurta.comEU VIREI UMA PRIVADA ASSUSTADORA NO ROBLOX (skibidi toilet)EU VIREI UMA PRIVADA ASSUSTADORA NO ROBLOX (skibidi toilet)#minecraft #athos"
"2jb0etajBbg","Como é viver na CIDADE MAIS BARATA do Brasil","2023-07-09T15:00:01Z","UCiXmFgNtlYNvVt2xj2EoNqg","Minha Pequena Revolução","19","23.11.07","Cidade mais barata|Cidade barata|As cidades mais baratas do Brasil|Cidade barata no brasil|Qual é a cidade mais barata do brasil|Lugar mais barato para morar no Brasil|Estado mais barato|Capital mais barata|Preços na capital da paraíba|Preços João Pessoa|Como é a vida em João Pessoa|Lado pobre e lado rico de João Pessoa|Joao pessoa Paraiba|Quanto custa morar em joao pessoa|Quanto custa supermercado em Joao Pessoa|Preços comparativos|Paraíba|Cidades do Brasil","231784","11681","0","641","https://i.ytimg.com/vi/2jb0etajBbg/default.jpg","False","False","Chegamos na cidade mais barata do Brasil, ou pelo menos a capital mais barata do Brasil. Nesse vídeo mostramos os preços e oportunidades, além do estilo de vida pulsante de uma metrópole do nosso país onde é barato de se viver.Hoje os preços e o custo de vida está muito alto em nosso país, e vemos um movimento das pessoas de mudarem para cidades mais tranquilas, seguras, que proporcionam maior qualidade de vida, mas nem sempre isso é barato e muitas vezes o financeiro não permite, pois nossas contas no banco não possuem dinheiro o suficiente. A cidade de joão pessoa na paraíba é uma exceção a regra.👕 Conheça a INSIDER e use o cupom REVOLUCAO12 para 12% de desconto em todo o site da marca por tempo limitado.https://bit.ly/MinhaPequenaRevolucao_Insider🔑 Apoie o canal através da Chave PIX: pequenarevolucao@gmail.com 🖤  Seja um apoiador oficial do canal: https://apoia.se/pequenarevolucao📸 @pequenarevolucao"
"RTWv5Jm-bYA","MISS UNIVERSO BRASIL 2023 - A GRANDE FINAL","2023-07-09T03:51:43Z","UC6OrcUzetNvJctt93zhZOyA","Miss Universo Brasil","24","23.11.07","[none]","558578","8133","0","1236","https://i.ytimg.com/vi/RTWv5Jm-bYA/default.jpg","False","False","Seja membro deste canal e tenha alguns benefícios:https://www.youtube.com/channel/UC6OrcUzetNvJctt93zhZOyA/join"
"jAXsVKqA_TQ","[최초 공개] '내 지금을 너에게 줄게' ♬In Bloom - ZEROBASEONE(제로베이스원) #ZEROBASEONEDEBUTSHOW:InBloom","2023-07-10T12:14:29Z","UCbD8EppRX3ZwJSou-TVo90A","Mnet K-POP","20","23.11.07","엠넷|mnet|kpop|k-pop|엠카운트다운|엠카|m countdown|mcd","807129","94457","0","3030","https://i.ytimg.com/vi/jAXsVKqA_TQ/default.jpg","False","False","〈ZEROBASEONE DEBUT SHOW: In Bloom〉#제로베이스원 #ZEROBASEONE #ZB1 #InBloom #YouthInShade #ZB1_InBloom #Mnet"
"2ffAdoUFPpE","GRÊMIO 0 X 2 BOTAFOGO | MELHORES MOMENTOS | 14ª RODADA BRASILEIRÃO 2023 | ge.globo","2023-07-09T23:40:10Z","UCgCKagVhzGnZcuP9bSMgMCg","ge","17","23.11.07","Botafogo|Botafogo futebol|Fogãonet|O Glorioso|Clube botafogo|#botafogo|alvinegro|glorioso|fogão|fogo|bot|FBPA|Grêmio|Gremio|Gremista|Grêmio futebol|Grêmio x Botafogo|Melhores momentos|futebol|MM|gol|é gol|futebol nacional|lances|times de futebol|gols|highlights|Campeonato Brasileiro|Brasileirão|Brasileirão 2023|Brasileirao|Vitória|vitória|empate|derrota|defesa|trave|fora|para fora|VAR|esporte|esportes|ge|ge.globo|globo esporte|globo|globoesporte.com|sportv|canal do ge","930390","34268","0","3212","https://i.ytimg.com/vi/2ffAdoUFPpE/default.jpg","False","False","O Botafogo é cada vez mais líder do Campeonato Brasileiro. O time carioca foi até Porto Alegre enfrentar o vice-líder Grêmio e venceu por 2 a 0, em duelo pela 14ª rodada. Os donos da casa martelaram e criaram várias chances para abrir o placar durante boa parte do jogo, mas o Fogão mostrou que não é o ponteiro da tabela à toa. O time treinado por Cláudio Caçapa suportou bem a pressão, cresceu no segundo tempo e soube aproveitar os erros do rival para marcar os gols da vitória, com Eduardo e Carlos Alberto. Quem segura o líder?🌟 Confira todos os melhores momentos com mais replays em ge.globo: https://ge.globo.com/rs/futebol/brasileirao-serie-a/jogo/09-07-2023/gremio-botafogo.ghtml🌟 Veja como ficou a tabela: https://ge.globo.com/futebol/brasileirao-serie-a/🌟 Assine Premiere: https://gplay.la/ytgepremiere#Brasileirão #Grêmio #botafogo ______________________________________✅ INSCREVA-SE NO CANAL GE:  https://cutt.ly/xfHlwBk👍 Curtiu o vídeo? Deixe seu like e dê seu pitaco 😎⚽ 🌟 Playlists pra você maratonar 🌟 ► Bola Quadrada:  https://cutt.ly/IfHk7ra ► BMFC: https://cutt.ly/gfHk5bH►Humor no GE: https://cutt.ly/HfHk6SY►Jogos Históricos: https://cutt.ly/BkxoZJX► Listas e TOPs: https://cutt.ly/hkxo51U► Originais GE: https://cutt.ly/vkxpunL► Melhores Momentos do Brasileirão:  https://cutt.ly/NfHk9TS► Melhores Copa do Brasil: https://cutt.ly/LfHk3Di► Gols Série B: https://cutt.ly/LfHk84c✅ Inscreva-se, também, no canal do CARTOLA FC e fique por dentro das melhores dicas do maior fantasy game do Brasil - https://cutt.ly/ffV1Xri______________________________________  No canal ge você encontra os melhores conteúdos do FUTEBOL BRASILEIRO! 🤙😎"
