video_id,title,publishedAt,channelId,channelTitle,categoryId,trending_date,tags,view_count,likes,dislikes,comment_count,thumbnail_link,comments_disabled,ratings_disabled,description
"x__UYDpJStY","TRANSFORMAMOS NOSSA SALA DE JANTAR E DE ESTAR FICOU INCRÍVEL AMAMOS O RESULTADO 😍","2023-07-06T22:00:38Z","UCn5wNgpDW_f6Hb_6azqmj9w","SEGREDOS DA MA","22","23.11.07","faxina|morandofora|receitas|vlog|donadecasa|deepclean|vivendonaamerica|morandonoseua|limpeza|dya|motorhome|viagem|reforma|casa|casanoseua|compreiminhacasa","180196","0","0","3799","https://i.ytimg.com/vi/x__UYDpJStY/default.jpg","False","False","Espero que tenham gostado! E se você não é inscrito, se inscreva, ative o sininho, deixe seu like e compartilhe com os amigos e familiares. 💖══════════════════════════════════════════════════════ // Me acompanhem // 📸 Instagram • https://www.instagram.com/segredosdama📱 Facebook • https://www.facebook.com/segredosdama// Entre em contato comigo - (contact for partnerships) // 📩 segredosdama@gmail.comEdição do Vídeo - @dbedicoeshttps://www.instagram.com/dbedicoes/// Músicas utilizadas nos vídeos são do Epidemic Sound //www.epidemicsound.com══════════════════════════════════════════════════════ Obrigada por assistir. Beijos 💖"
"PVwmRzoIFtc","A VERDADE SOBRE O DODGE DO RENATO - ENVELOPAMOS ELE INTEIRO !! 🤫","2023-07-06T23:17:16Z","UCaHiBN9bzNwIaDDgrNt-Rdw","Felipe Coronado","24","23.11.07","coronado|felipe|felipe coronado|coronado felipe|hunters|leo da hornet|camera man|leo da hornet e coronado","209220","19018","0","180","https://i.ytimg.com/vi/PVwmRzoIFtc/default.jpg","False","False","Fala pessoal deixa o seu like !"
"40o-ylzDhew","Loterias CAIXA | Federal 05/07/2023","2023-07-05T22:19:59Z","UCPbhr02AfVb2nd5pm12BxTw","CAIXA","25","23.11.07","[none]","107345","1781","0","26","https://i.ytimg.com/vi/40o-ylzDhew/default.jpg","False","False",""
"f8Y7AxDDVDs","GLORIA GROOVE - OOPS I DID IT AGAIN","2023-07-05T12:00:06Z","UCLoL96fSeaLOen3mpDYeqtA","Gloria Groove","10","23.11.07","gloria groove|gloria|groove|clipe|motorola|razr|britney spears|britney|spears|pop|gloria groove lady leste|gloria groove a queda|gloria groove vermelho|anitta gloria groove|proibidona valesca|clipe oficial|ao vivo|musica boa ao vivo|mc cabelinho nossa musica|lady leste|oops i did it again|motorolarazr|razr40ultra|razr40","260591","29692","0","1084","https://i.ytimg.com/vi/f8Y7AxDDVDs/default.jpg","False","False","Já ouviu Gloria Groove hoje? https://gloriagroove.lnk.to/oficialSim, a Motorola fez de novo e eu participei dessa releitura icônica.Para lançar os novos motorola razr 40, uma releitura do ícone V3, nada melhor do que um feat de peso com uma música que marcou época, e que volta agora em uma versão cheia de atitude. E, claro, com os novos razr 40, que têm um design irresistível, tela externa incomparável e uma câmera com infinitas possibilidades.Novo motorola razr 40.Abra a cabeça. Feche a mesmice. Acompanhe todos os detalhes deste lançamento em:  https://bit.ly/3NVrAO6Fique por dentro das novidades nas redes da Motorola: IG: https://www.instagram.com/motorolabr/Twitter: https://www.twitter.com/MotorolaBRTikTok: https://www.tiktok.com/@motorolabrasilYouTube: https://www.youtube.com/@MotoBRABlog: https://www.hellomoto.com.brSite: www.motorola.com.brGloria Groove nas redes sociais: IG: https://www.instagram.com/gloriagroove/Twitter: https://www.twitter.com/gloriagrooveTikTok: https://www.tiktok.com/gloriagrooveFicha Técnica - Motorola | Razr Agência Criativa: Euphoria CreativeAnunciante: MotorolaTítulo: Abra a cabeça. Feche a mesmice.Criação: Marcelo Rizério, Mariah Assis, Júnior Carvalho e Ricardo MillaniPlanejamento: Caio Del MantoMídia: Tiago Santos Atendimento: Andressa Fukunaga, Amanda Teixeira e Mariana Bordignon Producer: Cris Almeida  Produtora de Imagem: MercuriaDireção: We Are MagnoliasDireção 2a unidade: Victoria ZolliDireção de Conteúdo de Social: Sthefany e Gabriel SantosProdução Executiva: Maira Massullo e Marcella FéoAssistente de Produção Executiva:Ana Ocampos Head de ProjetosHead of Project Management: Amanda LavenèreCoordenação de Produção: Juliana SalvianoDireção de Produção: Guilherme ValiengoAssistentes de Direção: Ana Rios, Kenia AnjoDireção de Fotografia: Licia ArosteguyDireção de Fotografia 2a unidade: Dariely BelkeDireção de Arte: Debora PascottoCasting: Barbara CataniStylist: André Braune e Allan GandhiMaquiagem: Marcella Leme FerreiraAssistentes de Maquiagem: Camila Hayasaka, Marília Martins e Elissa Cirino.Pós Produção: Space Gorilla e Hub VFXCoordenação de Pós / Editor: Danilo AbrahamFinalização: TroopPostColor Grade: Marla Colour Grading Produtora de Som: HeftyProdutor: Edu Luke,Cris Botarelli, Otávio Cavalheiro, Celso Moretti, Tuco Barini e Rud Lisboa.Atendimento: Débora Carvalho, Amanda Froes e Thais GazoliCoordenação: Larissa Durante e Susi RodriguesEquipe Gloria Groove:Management: SB MUSIC Direção Geral: Samy EliaDiretora de Produção: Kika SimõesProdução Executiva: Gaby Sartori Produção e Logistica: Gabriela FernandesAtendimento: Anamaria BastosMarketing: Myrella MarinhoAssessoria de Imprensa: Renata Boselli e Dayane Vasconcelos Maquiagem: Victor NogueiraHair: Rafaella SchlindweinStylist: Bianca Jahara Produção de Moda: Alan GomesCamareira: Conceição Dantas Figurino: Ateliê Michelly X e  Ateliê Daniel LimaCréditos MUSICAIS: Musica: Oops!... I Did It AgainAutores: Martin Max,  Rami YacoubEditora: MXM (ASCAP admin by Kobalt Music Publishing Ltda)Artista: Gloria GrooveProdução: Ruxell e Pabllo BispoMaster e Mixagem: TAPSOUNDSGravadora: SB MusicAgência Social: Jüssi  Criação: Paulo Henrique Falcão, André Di Francci, Alexia Campelo, André Silva, Natália Costa, Laura Sá, Carla Sciascia, Renato Matsumoto, Lucas Campos, Sabrina Ramos, João Silva, Felipe MatsukumaPlanejamento: Fernanda Grams, Sergio Avila, Cecilia Ferraz  e Paulo MariaMídia: Cássio Yanata, Bruno Camargo, Samuel Ferreira, Renata Dalpiaz, Amanda Caires e Larissa FernandesSocial: Julia Alcassa, Paula Porto, Juliana Porto, Carlos CastilhoProjetos: Patricia Scigliano, Daniel Pellegrino, Alina LimaCliente Motorola:Juliana Mott, Andrea Brandi, Camila Gazzano, Sacha Brasil, Rodolfo D´Aprille e Silvia Lucca"
"zAfbuAEfN4Q","ZEROBASEONE (제로베이스원) 'YOUTH IN THE SHADE' Album Sampler","2023-07-07T15:53:19Z","UCSAp0Yl9S0Zq5uDqE6im_XQ","ZEROBASEONE","22","23.11.07","ZEROBASEONE|제로베이스원|제베원|ZB1|ZERO BASE ONE|ZEROBASEONE official|ZERO BASE ONE official|제로즈","767744","107177","0","7650","https://i.ytimg.com/vi/zAfbuAEfN4Q/default.jpg","False","False","ZEROBASEONE (제로베이스원) 'YOUTH IN THE SHADE' Album SamplerZEROBASEONE The 1st Mini Album[𝐘𝐎𝐔𝐓𝐇 𝐈𝐍 𝐓𝐇𝐄 𝐒𝐇𝐀𝐃𝐄]2023.07.10 18:00 (KST)More about ZEROBASEONE : https://linktr.ee/zb1_official#ZEROBASEONE #ZB1#제로베이스원 #YOUTHINTHESHADE #BacktoZEROBASE #InBloom#NewKidzontheBlock #우주먼지 #OurSeason #Always"
"H69mchdGhs8","SORTEIO DA LIBERTADORES DEFINIDO! DUELO BRASILEIRO, RIVER NO CAMINHO E ALTITUDE! VEJA O CHAVEAMENTO","2023-07-05T17:32:02Z","UCs-6sCz2LJm1PrWQN4ErsPw","TNT Sports Brasil","17","23.11.07","esporte interativo|tnt sports|tnt sports brasil|prorrogação|libertadores|sorteio libertadores|flamengo sorteio|palmeiras sorteio|confronto brasileiro|confronto libertadores|athletico confronto|atleticomg confronto","537621","23222","0","72","https://i.ytimg.com/vi/H69mchdGhs8/default.jpg","False","False","Atlético Nacional x Racing, Nacional x Boca Jrs., Dep. Pereira x Del Valle, Palmeiras x Atlético-MG, Bolívar x Athletico, River Plate x Internacional, Argentino Jrs. x Fluminense e Flamengo x Olímpia! Quem se deu melhor?#estrelabet #estreladarodada#estrelabet #estreladarodada #ebcpAssista a todos os jogos ao vivo da Champions League só na HBO Max, além de vários jogos EXCLUSIVOS do Campeonato Paulista! Assine e veja tudo isso a partir de R$ 19,99/mês:  http://bit.ly/3GAye7tAcesse o portal da TNT Sports: http://www.tntsports.com.br/Canais:De Placa - http://bit.ly/2HxPlHlDe Sola - http://bit.ly/2k0Xg90EI Games - http://bit.ly/2ufcveAMFM - http://bit.ly/2KnSU6PCortes da TNT Sports - https://bit.ly/3hbxWHCCortes do Futebol Brasileiro - https://bit.ly/3aNJJwnTNT Sports Entrevista - https://bit.ly/3xdRJOE"
"1Kr9zl5Om4Q","EPISÓDIO 10 - 3/5: Docinhos e codorna recheada | TEMP 10 | MASTERCHEF BRASIL (04/07/2023)","2023-07-05T08:02:01Z","UC2EWGw-KBjEReUbXMJEiaCA","MasterChef Brasil","24","23.11.07","doces de festa|confeitaria|confeitaria brasileira|brigadeiro|camafeu|quindim|geleia de pitanga|codorna|codorna recheada|codorna jacquin|maionese|evidencias temporada 10|temporada 2023|MASTERCHEF brasil 2023|masterchef br 2023|DECIMA temporada masterchef|ganhador masterchef|masterchef BR|HELENA RIZZO|ERICK JACQUIN|jacquin|RODRIGO OLIVEIRA|RODRIGO MOCOTO|paola carosella|henrique fogaça|ana paula padrão|fogaça","1483084","20806","0","1120","https://i.ytimg.com/vi/1Kr9zl5Om4Q/default.jpg","False","False","Assista à Parte 3 do Episódio 10 da 10ª Temporada de MasterChef Brasil.Inscreva-se no canal oficial do #MasterChefBr no YouTube: https://goo.gl/hcUL7XAssista também: MasterChef BrasilTemp 9 (2022): https://bit.ly/MC_BR_T09Temp 8 (2021): https://bit.ly/MC_BR_T08Temp 7 (2020): https://bit.ly/MC_BR_T07Temp 6 (2019): https://bit.ly/MC_BR_T06Temp 5 (2018): https://bit.ly/MC_BR_T05Temp 4 (2017): https://bit.ly/MC_BR_T04Temp 3 (2016): https://bit.ly/MC_BR_T03Temp 2 (2015): https://bit.ly/MC_BR_T02Temp 1 (2014): https://bit.ly/MC_BR_T01MasterChef Profissionais BrasilTemp 4 (2022): https://bit.ly/MC_Pro_T04Temp 3 (2018): https://bit.ly/MC_Pro_T03Temp 2 (2017): https://bit.ly/MC_Pro_T02Temp 1 (2016): https://bit.ly/MC_Pro_T01MasterChef+ Temp 1 (2022): https://bit.ly/MCMais_T01MasterChef A Revanche Temp 1 (2019): https://bit.ly/MC_BR_Revanche_T01MasterChef Júnior BrasilTemp 1 (2015): https://bit.ly/MC_JR_T01Temp 2 (2022): https://bit.ly/MC_JR_T02Os comentários nos vídeos do canal MasterChef Brasil implicam na autorização de uso gratuito e sem limitação da imagem a critério exclusivo da Endemol Shine Brasil, para posterior publicação, transmissão, retransmissão, reprodução, distribuição ou divulgação em TV, cinema, rádio, internet, publicidade ou qualquer outro veículo de comunicação, produção de DVD e home-video, sem que caracterize uso indevido ou qualquer outra violação de direitos e sem que deste uso decorra qualquer ônus / indenização."
"bn8NGH5YUW8","Loterias CAIXA / 05/07/2023","2023-07-05T23:45:56Z","UCPbhr02AfVb2nd5pm12BxTw","CAIXA","25","23.11.07","[none]","33324","855","0","10","https://i.ytimg.com/vi/bn8NGH5YUW8/default.jpg","False","False",""
"XEbpCoiUAPQ","VIRADA DE CAMPEÃO | BH ENTRA E MARCA G0L DA VIRADA HERÓICA DO MENGÃ0 PELA C0PA DO BRAS1L","2023-07-06T02:25:11Z","UCWkW6u6-XMyrLUAY8nzpO5g","EGol7","17","23.11.07","[none]","518734","6714","0","445","https://i.ytimg.com/vi/XEbpCoiUAPQ/default.jpg","False","False","VIRADA DE CAMPEÃO | BH ENTRA E MARCA G0L DA VIRADA HERÓICA DO MENGÃ0 PELA C0PA DO BRAS1L"
"meBG4BBQZNE","EPISÓDIO 10 - 2/5: Docinhos e codorna recheada | TEMP 10 | MASTERCHEF BRASIL (04/07/2023)","2023-07-05T08:01:00Z","UC2EWGw-KBjEReUbXMJEiaCA","MasterChef Brasil","24","23.11.07","doces de festa|confeitaria|confeitaria brasileira|brigadeiro|camafeu|quindim|geleia de pitanga|codorna|codorna recheada|codorna jacquin|maionese|evidencias temporada 10|temporada 2023|MASTERCHEF brasil 2023|masterchef br 2023|DECIMA temporada masterchef|ganhador masterchef|masterchef BR|HELENA RIZZO|ERICK JACQUIN|jacquin|RODRIGO OLIVEIRA|RODRIGO MOCOTO|paola carosella|henrique fogaça|ana paula padrão|fogaça","1382184","21122","0","2418","https://i.ytimg.com/vi/meBG4BBQZNE/default.jpg","False","False","Assista à Parte 2 do Episódio 10 da 10ª Temporada de MasterChef Brasil.Inscreva-se no canal oficial do #MasterChefBr no YouTube: https://goo.gl/hcUL7XAssista também: MasterChef BrasilTemp 9 (2022): https://bit.ly/MC_BR_T09Temp 8 (2021): https://bit.ly/MC_BR_T08Temp 7 (2020): https://bit.ly/MC_BR_T07Temp 6 (2019): https://bit.ly/MC_BR_T06Temp 5 (2018): https://bit.ly/MC_BR_T05Temp 4 (2017): https://bit.ly/MC_BR_T04Temp 3 (2016): https://bit.ly/MC_BR_T03Temp 2 (2015): https://bit.ly/MC_BR_T02Temp 1 (2014): https://bit.ly/MC_BR_T01MasterChef Profissionais BrasilTemp 4 (2022): https://bit.ly/MC_Pro_T04Temp 3 (2018): https://bit.ly/MC_Pro_T03Temp 2 (2017): https://bit.ly/MC_Pro_T02Temp 1 (2016): https://bit.ly/MC_Pro_T01MasterChef+ Temp 1 (2022): https://bit.ly/MCMais_T01MasterChef A Revanche Temp 1 (2019): https://bit.ly/MC_BR_Revanche_T01MasterChef Júnior BrasilTemp 1 (2015): https://bit.ly/MC_JR_T01Temp 2 (2022): https://bit.ly/MC_JR_T02Os comentários nos vídeos do canal MasterChef Brasil implicam na autorização de uso gratuito e sem limitação da imagem a critério exclusivo da Endemol Shine Brasil, para posterior publicação, transmissão, retransmissão, reprodução, distribuição ou divulgação em TV, cinema, rádio, internet, publicidade ou qualquer outro veículo de comunicação, produção de DVD e home-video, sem que caracterize uso indevido ou qualquer outra violação de direitos e sem que deste uso decorra qualquer ônus / indenização."
"pvmiFeZxxbo","EPISÓDIO 10 - 4/5: Docinhos e codorna recheada | TEMP 10 | MASTERCHEF BRASIL (04/07/2023)","2023-07-05T08:03:00Z","UC2EWGw-KBjEReUbXMJEiaCA","MasterChef Brasil","24","23.11.07","doces de festa|confeitaria|confeitaria brasileira|brigadeiro|camafeu|quindim|geleia de pitanga|codorna|codorna recheada|codorna jacquin|maionese|evidencias temporada 10|temporada 2023|MASTERCHEF brasil 2023|masterchef br 2023|DECIMA temporada masterchef|ganhador masterchef|masterchef BR|HELENA RIZZO|ERICK JACQUIN|jacquin|RODRIGO OLIVEIRA|RODRIGO MOCOTO|paola carosella|henrique fogaça|ana paula padrão|fogaça","1436869","20517","0","1337","https://i.ytimg.com/vi/pvmiFeZxxbo/default.jpg","False","False","Assista à Parte 4 do Episódio 10 da 10ª Temporada de MasterChef Brasil.Inscreva-se no canal oficial do #MasterChefBr no YouTube: https://goo.gl/hcUL7XAssista também: MasterChef BrasilTemp 9 (2022): https://bit.ly/MC_BR_T09Temp 8 (2021): https://bit.ly/MC_BR_T08Temp 7 (2020): https://bit.ly/MC_BR_T07Temp 6 (2019): https://bit.ly/MC_BR_T06Temp 5 (2018): https://bit.ly/MC_BR_T05Temp 4 (2017): https://bit.ly/MC_BR_T04Temp 3 (2016): https://bit.ly/MC_BR_T03Temp 2 (2015): https://bit.ly/MC_BR_T02Temp 1 (2014): https://bit.ly/MC_BR_T01MasterChef Profissionais BrasilTemp 4 (2022): https://bit.ly/MC_Pro_T04Temp 3 (2018): https://bit.ly/MC_Pro_T03Temp 2 (2017): https://bit.ly/MC_Pro_T02Temp 1 (2016): https://bit.ly/MC_Pro_T01MasterChef+ Temp 1 (2022): https://bit.ly/MCMais_T01A Revanche Temp 1 (2019): https://bit.ly/MC_BR_Revanche_T01Júnior BrasilTemp 1 (2015): https://bit.ly/MC_JR_T01Temp 2 (2022): https://bit.ly/MC_JR_T02Os comentários nos vídeos do canal MasterChef Brasil implicam na autorização de uso gratuito e sem limitação da imagem a critério exclusivo da Endemol Shine Brasil, para posterior publicação, transmissão, retransmissão, reprodução, distribuição ou divulgação em TV, cinema, rádio, internet, publicidade ou qualquer outro veículo de comunicação, produção de DVD e home-video, sem que caracterize uso indevido ou qualquer outra violação de direitos e sem que deste uso decorra qualquer ônus / indenização."
"FrzHQYZoiu8","LEVEI O LÉO EM UM ENCONTRO DE CARROS *causamos com a saveiro*","2023-07-05T01:29:26Z","UCwMiGkjaLWcQn-XXvyQtW0A","Boquinha","24","23.11.07","boquinha|canal boquinha|boquinha canal|youtube|edukof|amenic|breakmen|breakmen boquinha|renato garcia|leo ruiz|roma street|bmx|bike bmx|canal de bmx|boquinha bmx|boquinha bike|diego|diego oliveira|rapel|fazendo rapel|pescaria|fazendo pescaria|rapel boca|boca|manobras bmx","268093","21135","0","160","https://i.ytimg.com/vi/FrzHQYZoiu8/default.jpg","False","False","SE INSCREVA-SE NO CANAL GALERA ! Redes Sociais: Instagram: https://www.instagram.com/booquiinhaa/Twitter: https://twitter.com/boquinhachannelFacebook: https://www.facebook.com/Boquinha-1952937321620466/?ref=br_rsEmail comercial: boquinha@agencia11k.com.br"
"qABKrMbu8pA","Valesca Mayssa | Inflama [Clipe Oficial]","2023-07-04T15:00:10Z","UCpf5YXmzGHC4m5uLCdlrrfA","Todah Music Oficial","10","23.11.07","Todah Music|Gravadora Todah Music|Todah|musica gospel|musica pentecostal|gravadora pentecostal|lançamento Todah Music|Valesca Mayssa|Inflama","508511","19646","0","470","https://i.ytimg.com/vi/qABKrMbu8pA/default.jpg","False","False","Clipe da canção Inflama da cantora Valesca Mayssa lançado pela Todah Music em julho/2023 e que faz parte do EP Eis-me Aqui.Assista o Playback: https://youtu.be/NSFSUCZk2WM---------------------------------------------------🎧 ESCUTE VALESCA MAYSSA NAS PLATAFORMAS DIGITAIS► https://todahmusic.lnk.to/Inflama► https://todahmusic.lnk.to/EuSouTeuPai► https://todahmusic.lnk.to/EisMeAqui► https://todahmusic.lnk.to/TaNasMaosDeus► https://todahmusic.lnk.to/DiasdeGuerra​► https://todahmusic.lnk.to/BoaObra​---------------------------------------------------🎙️ SIGA VALESCA MAYSSA NAS REDES SOCIAIS► Instagram: https://valescamayssa.lnk.to/Instagram​► Facebook: https://valescamayssa.lnk.to/Facebook​► Youtube: https://valescamayssa.lnk.to/Youtube​---------------------------------------------------🎶 ESCUTE NOSSAS PLAYLISTS► https://todahmusic.lnk.to/plataformas► https://todahmusic.lnk.to/noYotube---------------------------------------------------🔊 SOMOS A TODAH MUSICA palavra TODAH vem da mesma raiz que YADAH, significa “mãos estendidas”.Então a expressão TODAH, que também é usada como agradecimento (OBRIGADO) traz em sua raiz uma relação com “estender as mãos”. Estar agradecido é estender as mãos aos céus e reconhecer tudo o que Deus tem feito em nossas vidas.► Site: http://www.todah.com.br/​​​​​​​​​​​​​...► Email: contato@todah.com.br► https://todahmusic.lnk.to/Instagram​​​► https://todahmusic.lnk.to/Facebook​​​​► Telegram: https://t.me/todahmusic​​​---------------------------------------------------🔎 FICHA TÉCNICA► Cantora: Valesca Mayssa ► Canção: Inflama► Composição: Misaias Oliveira, Paulo Sergio, Luã Freitas e Jan Nascimento► Produção Musical: Júnior Papalia► Direção de Vídeo: Amaral Alves ► Fotos: Fabio Rickman ► MakeUp: Ádria Dasi► Produtor Artístico: Beto Rocha► Supervisora de Produção: Bia Caprini ► Produção Geral: Todah Produções► Direção Geral: Alessandro Porfírio► Direção Executiva: Todah Music---------------------------------------------------► Diretor de Fotografia: Leonardo Oliveira► Lighting Designer: Cacio Silva► Direção de Arte: Leonardo Oliveira► Operador do LED: Deivid Meira ► Conteúdo do LED: Showdesign► Set-Design: Showdesign► Execução do projeto: Showdesign---------------------------------------------------✏️ LETRA ► InflamaEu não vou sair daqui, encontrei o meu lugar Meu desejo é te servir, faz em mim o teu altarNada é mais importante não há nada que eu queira maisTraz o céu, se não quiser faz a terra subir com tua glória envolve-meSopra o teu vento aqui, toma todo este lugarSanto Espírito de Deus vem com fogo batizarInflamar esse lugar Sopra o teu vento aqui, toma todo este lugarSanto Espírito de Deus vem com fogo batizarInflamar esse lugar Inflama a minha alma com tua chamaVem derrama, fogo no altar não se apagará inflama a minha alma com tua chama Vem derrama, fogo no altar não se apagará //#SomosTodosTodah #ValescaMayssa #Inflama"
"hFoG8wKq0XE","nice mendiga quer um desconto","2023-07-04T22:00:17Z","UCYALxwppPJjYyTMEwwEcNCQ","LubaTV","22","23.11.07","luba|lubatv|memes|quartas reddit|nice mendigo|choosing beggars|nice mendigos|mãe solteira","494643","94441","0","1858","https://i.ytimg.com/vi/hFoG8wKq0XE/default.jpg","False","False","O defensor das mães solteiras está de volta. ► Torne-se membro e ganhe benefícios exclusivos!https://www.youtube.com/channel/UCYALxwppPJjYyTMEwwEcNCQ/join► Loja LubaTV: http://loja.lubatv.com.br► Cortes: https://www.youtube.com/c/lubatvlives► Stream do Luba: http://twitch.tv/lubatv► Envie seu MEME: http://www.reddit.com/r/lubatv#LubaTV #QuartasReddit"
"mIfpVrYIhvM","KISS OF LIFE (키스오브라이프) '쉿 (Shhh)' Official Music Video","2023-07-05T09:00:01Z","UCvEEeBssb4XxIfWWIB8IjMw","KISS OF LIFE","10","23.11.07","KISS OF LIFE|키오프|키스오브라이프|뮤직비디오|mv|뮤비|kpop|케이팝|유튜브|쥴리|나띠|벨|하늘|심혜원|한쥴리|원하늘|natty|haneul|belle|julie|쉿|shhh|타이틀곡|자유|댄스|dance","11075578","212667","0","7405","https://i.ytimg.com/vi/mIfpVrYIhvM/default.jpg","False","False","KISS OF LIFE (키스오브라이프) '쉿 (Shhh)' Official Music Video#KISSOFLIFE #키스오브라이프 #쉿 '쉿 (Shhh)'Composed by Strawberrybananaclub, Rick Bridges, Belle, NattyLyrics by Rick Bridges, Strawberrybananaclub, Belle, JulieArranged by Strawberrybananaclub-KISS OF LIFE(키스오브라이프) 1st Mini Album [KISS OF LIFE] is OUT NOW!ㅤ🎧 Melon : http://kko.to/pNrCYG7mgm🎧 Bugs : https://bit.ly/44tOVvU🎧 Genie : https://bit.ly/3PIb1GA 🎧 VIBE : https://bit.ly/449UP5C🎧 FLO : https://flomuz.io/s/a.CeUlp🎧 Spotify : https://spoti.fi/44t4AeM🎧 Apple Music : https://apple.co/44t5M1M#KISSOFLIFE #키스오브라이프 #KIOF#쉿 #Shhh-[KISS OF LIFE Official Channel]YouTube : https://www.youtube.com/@KISSOFLIFE_officialTwitter : https://twitter.com/KISSOFLIFE_S2Instagram : https://www.instagram.com/kissoflife_s2Facebook : https://www.facebook.com/KISSOFLIFEof...TikTok : https://www.tiktok.com/@kissoflife_of...Fancafe : https://cafe.daum.net/KISSOFLIFE"
