video_id,title,publishedAt,channelId,channelTitle,categoryId,trending_date,tags,view_count,likes,dislikes,comment_count,thumbnail_link,comments_disabled,ratings_disabled,description
"E9uTd3DWrsE","VIE NOMADE = LIBERTÉ ? Bilan personnel de ces 6 ans #vienomade #insta360 #vanlife  - Voyage Voyages","2023-07-17T15:00:09Z","UCeIlHspLfJOEJ9zNJ9i2sLw","Voyage Voyages","19","23.20.07","van life|vivre autrement|changer de vie|liberté|tuto camping car|tuto fourgon aménagé|m**** a celui ou celle qui lit mes tags|fiat ducato|peugeot boxer|Citroën jumper|voyage|voyages|insta360|insta360X3","47506","7866","0","728","https://i.ytimg.com/vi/E9uTd3DWrsE/default.jpg","False","False","12:55 👉Pour les images 360 J'utilise l'insta 360 X3👉 le lien Insta360 X3  : https://store.insta360.com/product/x3?insrc=INRX4IA En passant par ce lien vous bénéficier d'un accessoire offert(perche à selfie ou protèges-objectifs si le kit contient déjà une perche)Découvrez toutes les possibilités INSTA 360 X3 et les autres produits sur @insta360 👉 Il y'a aussi la Insta 360 GO 3 ( super caméra action pour le petit plus créatif ) que je suis en train de tester ( je vous en reparle très vite )👉le lien Insta 360 GO 3 : https://store.insta360.com/product/go-3?insrc=INRX4IA👉 Pour les 360 très professionnel ( la ONE RS 1-Inch 360 ) https://store.insta360.com/product/one_rs_1_inch_360?insrc=INRX4IAPartenariat rémunéré 😉Dans cette vidéo, je fais mon bilan personnel de ces quelques années de vie Nomade.Est-ce que j'ai réussi à trouver ma liberté ? 👉Mon matériel  ( liens affiliés - ça permet à la chaîne de vivre 😉 )👉Gardez votre eau potable et sans le goût de la cuve grâce au TANK O3Pour commander le Tank-O3 suivre le lien ( ci-dessous )bénéficier d'une réduction de 39,95 euros avec le code PROMO : VVPhttps://www.tank-o3.nl/fr 👉Si vous voulez découvrir le parapente ou apprendre :Faites un baptême ou un Stage Chez Air Alpin ( c'est là que j'ai appris à voler :Vous aurez un PRIX si vous venez de la part de Philippe de Voyage Voyageshttps://air-alpin.com/👉 GPL le Kit Voyage Voyages - CODE PROMO Voyage Voyages -https://www.shopevasion.fr/kit-pour-fourgon-comme-video-voyagevoyages-en-27l-gaslow-c2x30817472👉 MyShop Solaire le code promo est toujours valable ( 5 % ) avec le code Voyage Voyages :https://www.myshop-solaire.com/?gclid=Cj0KCQjwwLKFBhDPARIsAPzPi-LPtt00Ha4HEOl1SwuTuus1USduXkNHj2BYguCfKPpyP-vAzQ6LbOIaAov6EALw_wcB👉 Mon antenne 4g avec Wifi dans le fourgon - Vous avez une promo avec le code : voyagevoyages ALPHA Network : 4 G Camp Pro V2 EU http://bit.ly/antenne4gvoyagevoyagesATTENTION : Ne confondez pas avec le modèle qui amplifi le Wifi et qui ressemble beaucoup à cette antenne !!!!!👉Ma nouvelle antenne fixe + routeur 4G double SIM : Lien du kit selon le choix d' antennes :http://www.multiboutik.fr/index.php?id_product=374&controller=productOuhttp://www.multiboutik.fr/index.php?id_product=413&controller=productOuhttp://www.multiboutik.fr/index.php?id_product=432&controller=product👉  matériel de tournage :Caméra Sony ZV1 : https://amzn.to/3LB6lgJ Il existe un Kit ( personnellement il y’a des accessoires que je n’ai pas essayé ) : https://amzn.to/3qSWcno   Attention si vous acheté le sony ZV1 il est livré sans chargeur ( une aberration ) achetez des batteries supplémentaires + chargeur : https://amzn.to/35sumah Pour protéger votre appareil et un confort de tournage, le  Small Ring :https://amzn.to/3wTA407 ou  https://amzn.to/3NCLDP9 Un petit trépied pour Vloger avec votre ZV1 plusieurs options :l’original pour le sony ZV1 : https://amzn.to/3Ds2hfA   le kit : https://amzn.to/3qSWcno  un autre petit trépied : https://amzn.to/3DtUxKn  Très bien aussi, pas cher et peut s’utiliser avec un téléphone : https://bit.ly/voyagevoyages_tripod2 Il faut une torche efficace et solide :https://amzn.to/3NzQtwH fixation SmallRing :https://amzn.to/3LwYHE0 Mon drone :DJI AIR 2S Fly More Combohttps://amzn.to/36DkRWs le super TOP  DJI Mavic Pro 3 :https://amzn.to/3uJAPpR 👉La musique je la trouve là : https://www.epidemicsound.com/referral/jc51x6/👉Restez connecté : https://www.twitch.tv/voyagevoyageshttp://bit.ly/voyagevoyageslivehttps://www.instagram.com/voyagevoyages_instahttps://www.tiktok.com/@voyagevoyageshttps://www.facebook.com/voyagevoyagesphil/👉Mon autre chaîne Youtube :http://bit.ly/philippedouteau👉Mon fourgon est un Pössl 2Winplus sur Citroën Jumper ( 2016 )👉J'ai un Camion aménagé, en fait un Fourgon aménagé comme un  Camping car. J'aime la Liberté et Voyager. Je veux changer de vie, être au contact de la nature. Bref Vivre autrement*Même si ce n’est pas systématique, cette vidéo est susceptible d’avoir recoursau placement de produits et/ou inclure une communication commerciale. #nomade #voyage #vanlife #campingcar #decouverte #fourgonamenage #voyagevoyages #roadtrip #nature #vie #nomadeencampingcar #fourgonaménagé #transparenceyoutube"
"OVOXPFcj8sI","DÉGUSTATION DE MCDO MAROCAIN AVEC MES PETITS FRÈRES ET KRYPTO ! REMI S'EMBROUILLE AVEC UN ÂNE.. #J5","2023-07-18T18:28:53Z","UC-KkVdOP86k1SDAWzFfw8nA","DEMONEXION","19","23.20.07","voyage|voyage entre frere|vlog voyage|vlog entre frere|vlog mroc|voyage maroc|maroc|demonexion|nadim|demonexion maroc|vacance vlog|vlog vacance|sable|plage|foot plage|foot vacance|avion|vol|ouverture colis abonné|mcdo|mcdo maroc|restaurant maroc|embrouille villa","224286","7766","0","930","https://i.ytimg.com/vi/OVOXPFcj8sI/default.jpg","False","False","Nouveau VLOG au Maroc ! Dans cette vidéo j'ai décidé d'aller faire gouter le Mcdo Marocain à mes petits frères et à kryptoo !Zizou et Rémi eux en attendant se sont embrouillé avec un âne..👕 Boutique De Vêtement : https://lolingo.fr/pages/demonexion🖥️Chaine secondaire : https://youtube.com/@demotv2399🪪Code créateur : demonexionoff🔔Activez la cloche de notification 🔔🔥 Pour être au courant de mes prochains live ou vidéos ! 🔥                                                😄Mes réseaux sociaux😄📞Discord       : https://discord.gg/rwnDB9V5Ft📸Instagram  : @demonexion / https://www.instagram.com/demonexion/?hl=fr👾Twitch : https://www.twitch.tv/dmonexion👻 Snap          : demonexionoff🎼Tik-tok        : https://vm.tiktok.com/ZMdMNfwh7/🐤Twitter        : @demonexionoff / https://twitter.com/demonexionoff◼️ Pour toute demande de partenariat : ▪️ Email : demonexion@rachimedia.com"
"j3NxP6XFHyE","QUI EST LE PLUS !?","2023-07-16T16:00:33Z","UCXGzmENmT70KR28XvAs-nRQ","Thibault & Jessica","23","23.20.07","[none]","139756","5785","0","221","https://i.ytimg.com/vi/j3NxP6XFHyE/default.jpg","False","False","Retrouvez nous aussi sur nos réseaux sociaux !SNAPCHAT : @jessoff13 et @thibaultkurog INSTAGRAM : https://www.instagram.com/jessicathivenin/ et https://www.instagram.com/thibaultgarcia/TIKTOK : https://www.tiktok.com/@jessicathivenin et https://www.tiktok.com/@thibaultgarcia?lang=frNos 2 marques : www.jylor.com et www.bianochy.com"
"oii3bGzySyE","BIENTÔT - Plus Belle La Vie DE RETOUR sur @TF1","2023-07-17T08:55:59Z","UCDq87sGhSDfAb_gQW2ouAzQ","Plus Belle la Vie","24","23.20.07","pblv|plus belle la vie|saison 11|streaming|episode|entier|france 3|replay|plus belle la vie episode|full|partie|complet","33998","595","0","112","https://i.ytimg.com/vi/oii3bGzySyE/default.jpg","False","False","Prochainement sur @TF1 Vous en rêviez on l'a fait ! Plus Belle La Vie va faire son grand retour !#plusbellelavie #fiction #PBLVAbonnez-vous à notre chaîne pour ne manquer aucun contenu du Mistral : http://www.youtube.com/channel/UCDq87sGhSDfAb_gQW2ouAzQ?sub_confirmation=1👀 Et rendez-vous aussi sur nos réseaux sociaux : 👀 Facebook : https://www.facebook.com/plusbellelavie 👀 Twitter : https://twitter.com/pblvofficiel👀 Instagram : https://www.instagram.com/pblvofficielChaine officielle du feuilleton Plus Belle la Vie.Mystère, romance, drame, enquêtes et coups de folie, c’est le quotidien du Mistral, un quartier de Marseille dont les habitants, tout ce qu’il y a de plus ordinaires, vivent des aventures extraordinaires !Un programme produit par Newen France"
"1If6CLO0IzI","FINAL: France v Israel | Full Basketball Game | FIBA U20 European Championship 2023","2023-07-16T20:47:08Z","UCtInrnU3QbWqFGsdKT1GZtg","FIBA - The Basketball Channel","17","23.20.07","16.07.2023|16/07/2023|FIBA|FIBA U20 European Championship|FIBA U20 European Championship 2023|FRA|FRA v ISR 16.07.2023|France|France (FRA)|ISR|Israel|Israel (ISR)|basketball live stream|live|livestream|Full Game","264836","2064","0","73","https://i.ytimg.com/vi/1If6CLO0IzI/default.jpg","False","False","#fibau20europe #basketball Watch the Final game between France and Israel at the FIBA U20 European Championship 2023.🏀 Love to watch basketball? We show dozens of free live games per week! Subscribe and hit the bell 🔔 http://fiba.com/subYT Click here for more: https://www.fiba.basketball/europe/u20/2023Facebook: https://www.facebook.com/NextGenHoopsTwitter: http://twitter.com/FIBAInstagram: https://www.instagram.com/NextGenHoopsTikTok: https://www.tiktok.com/@fibaTwitch: http://www.twitch.tv/fibaSina Weibo: http://weibo.com/FIBAofficial00:00:00 Intro00:11:13 1st quarter00:32:46 2nd quarter01:10:53 3rd quarter01:34:59 4th quarter02:02:40 OT02:17:08 Award Ceremony"
"0zOEUkgx7L8","TOTTENHAM HOTSPUR 2-3 WEST HAM | PRE-SEASON HIGHLIGHTS","2023-07-18T15:02:22Z","UCEg25rdRZXg32iwai6N6l0w","Tottenham Hotspur","17","23.20.07","Spurs|Tottenham Hotspur|토트넘|손흥민|THFC|Tottenham|Tottenham 2-3 West Ham|Spurs 2-3 West Ham|Spurs Perth|West Ham Perth|Spurs pre-season","614972","9282","0","1345","https://i.ytimg.com/vi/0zOEUkgx7L8/default.jpg","False","False","Watch all the highlights from an exciting pre-season clash between Tottenham Hotspur and West Ham at the Optus Stadium in Perth, Australia.SPURSPLAY is live! Check it out now ► https://bit.ly/3a9klBiSUBSCRIBE to ensure you don’t miss a video from the Spurs YouTube channel. Hit the bell to get notifications on our latest uploads! ► Subscribe: https://www.youtube.com/channel/UCEg25rdRZXg32iwai6N6l0w?sub_confirmation=1 FOLLOW US!Instagram: https://www.instagram.com/spursofficial/Twitch: https://www.twitch.tv/tottenhamhotspur/TikTok: https://www.tiktok.com/@spursofficialTwitter: https://twitter.com/SpursOfficialFacebook: https://www.facebook.com/TottenhamHotspur/Download the Spurs App: https://www.tottenhamhotspur.com/spurs-official-app/#tottenham #spurs #westham"
"krvO-FClk6A","Si je Meurs, mes Amis Perdent sur Minecraft !","2023-07-18T16:08:55Z","UCiFyJ_EBmF2XJuR9buWE_3A","Unchained_Off","20","23.20.07","unchained|unchained_off|fortnite|unchained fortnite|fortnite chapitre 4|glitch fortnite|fortnite skin|fortnite battle royale|vbucks|fortnite défilé de mode|glitch|défi fortnite|top 1|mrbeast|streamhack|unchained minecraft|drole|skin|rare|danse|bambi|cache cache|hack|cheat|triche|cheats|Minecraft|coeurs|minecraft mais|minecraft|crafter|diamants|diamand|minecraft mod|meme|réaliste|shader|futur|manhunt|dream|ninjaxx|fuze|minecraft chasseur|si je meurs|mes amis erdent","189922","19301","0","621","https://i.ytimg.com/vi/krvO-FClk6A/default.jpg","False","False","⏩CODE MAP Only Up INFINI : 1468-0062-5889🎁Abonne-toi à ma chaine Gaming ► https://bit.ly/Unchained_gaming✅Code : unchained sur Fortnite ! 💖MON INSTA : https://www.instagram.com/unchained_off🖤Mon Tik Tok : unchained_off💙 Twitter : https://twitter.com/UnchainedYtb​​​​​​Code MAP Interdite aux Garçons : 6794-2804-2802Code MAP BUILDFIGHT : 6288 0341 6030 🔥Code MAP DON'T FALL : 5251-6671-7857"
"NWZxx1cPTJA","Les Français massivement privés d'eau à Mayotte, Taylor Swift… Actus du jour","2023-07-18T20:00:14Z","UCAcAnMF0OrCtUep3Y4M-ZPw","HugoDécrypte - Actus du jour","25","23.20.07","[none]","181118","6104","0","479","https://i.ytimg.com/vi/NWZxx1cPTJA/default.jpg","False","False","📧 Le lien d’abonnement à notre newsletter : https://hugodecry.pt/newsletterLes actus du jour, résumées et expliquées ! 🔔 Pour découvrir mes longs formats sur YouTube : https://hugodecry.pt/YT-Grands-Formats🎧 Les Actus du jour en podcast : https://hugodecry.pt/Spotify-ADJ / https://hugodecry.pt/Apple-ADJ📣 Les Actus du Jour aussi sur : · Instagram (en 2 min) : https://hugodecry.pt/IG· TikTok (en 30 sec) : https://hugodecry.pt/TikTok· Twitter : https://hugodecry.pt/Twitter · Les plateformes de podcast : https://hugodecry.pt/Spotify-ADJ / https://hugodecry.pt/Apple-ADJ🍿⚽️ Sur Instagram, retrouve aussi les actus :· Pop & culturelles : https://hugodecry.pt/IG-Pop· Sportives : https://hugodecry.pt/IG-Sport——–SOMMAIRE00:00 Pénurie d'eau potable à Mayotte05:56 Changements de ministres à venir ?06:48 Hausse des prix de l'électricité 07:18 Vaccination des enfants07:52 Grève au JDD08:55 Interdiction de s’asseoir à Angoulême09:49 Taylor Swift bat tous les records10:36 Débat du jour–🔗 DES LIENS POUR EN SAVOIR PLUSMAYOTTEhttps://www.francetvinfo.fr/france/mayotte/mayotte-trois-questions-sur-la-secheresse-sans-precedent-qui-va-priver-d-eau-les-principales-villes-chaque-jour-des-16-heures_5947808.htmlhttps://la1ere.francetvinfo.fr/crise-de-l-eau-a-mayotte-cela-fait-20-ans-que-le-gouvernement-promet-des-investissements-denonce-estelle-youssouffa-1414139.htmlhttps://www.francetvinfo.fr/france/mayotte/mayotte-la-prefecture-annonce-une-intensification-des-coupures-d-eau_5946698.htmlhttps://la1ere.francetvinfo.fr/mayotte/quel-controle-sur-le-prix-des-bouteilles-d-eau-1378106.htmlhttps://www.francetvinfo.fr/economie/crise-a-mayotte/reportage-operation-wuambushu-a-mayotte-un-mois-apres-la-demolition-du-bidonville-talus-2-ses-anciens-habitants-vivent-eparpilles-et-sans-espoir_5897996.htmlBORNE PREMIÈRE MINISTRE https://www.lemonde.fr/politique/article/2023/07/17/elisabeth-borne-maintenue-au-poste-de-premiere-ministre-par-emmanuel-macron_6182373_823448.html https://www.ouest-france.fr/politique/emmanuel-macron/remaniement-elisabeth-borne-confirmee-comme-premiere-ministre-par-emmanuel-macron-fd198ad8-24c6-11ee-b6a8-3abc413c71fcPRIX ÉLECTRICITÉ https://www.lemonde.fr/economie/article/2023/07/18/electricite-les-prix-vont-encore-augmenter-de-10-en-aout_6182457_3234.html https://www.lexpress.fr/economie/electricite-les-tarifs-de-vont-augmenter-de-10-au-1er-aout-HRUQDDEE7VHVXB4527ZILMXTJE/VACCINATION DES ENFANTS https://www.francetvinfo.fr/sante/vaccins/la-vaccination-des-enfants-commence-a-se-retablir-apres-la-baisse-des-annees-covid-19-annonce-l-onu_5956880.html https://www.unicef.fr/article/la-vaccination-des-enfants-commence-a-rattraper-le-retard-pris-avec-la-pandemie-de-covid-19/ JDD https://www.ouest-france.fr/medias/la-greve-au-jdd-reconduite-des-deputes-vont-deposer-une-proposition-de-loi-pour-proteger-les-medias-8545c64a-2541-11ee-bf48-f73cfda37352https://www.sudouest.fr/culture/medias/greve-au-jdd-une-proposition-de-loi-transpartisane-visant-a-proteger-la-liberte-editoriale-des-medias-15969829.phpANGOULÊMEhttps://www.leparisien.fr/charente-16/a-angouleme-etre-debout-assis-ou-allonge-dans-la-rue-peut-desormais-couter-35-euros-damende-15-07-2023-GXJPXVDQBFDVHIOD44OP37ASSE.phphttps://www.francetvinfo.fr/france/nouvelle-aquitaine/charente/charente-la-ville-d-angouleme-interdit-de-rester-assis-allonge-debout-stastique-dans-le-centre-ville-sous-peine-d-une-amende-de-35-euros_5955320.htmlTAYLOR SWIFT  https://www.lemonde.fr/culture/article/2023/07/18/taylor-swift-devient-la-chanteuse-ayant-classe-le-plus-grand-nombre-d-albums-en-tete-des-ventes_6182391_3246.html​​https://www.billboard.com/artist/taylor-swift/Écriture : Blanche Vathonne - Anais Lochon - Samy Rabbata - Paul Foucaud - Hugo Travers Montage : Stanley Duplan"
"tOZTQ8Dqrsk","1999 : Une journée avec Jane Birkin | Archive INA","2023-07-17T15:14:00Z","UCBZ-iF-2O5ooVnAm6LQY8MQ","INA Stars","22","23.20.07","INA|Archive|Institut national de l'audiovisuel|star|people","51714","737","0","63","https://i.ytimg.com/vi/tOZTQ8Dqrsk/default.jpg","False","False","Abonnez-vous http://bit.ly/InastarsThé ou café | France 2 | 07/02/1999En 1999, la chanteuse et actrice Jane Birkin est l'invitée de Catherine Ceylac dans son émission intimiste Thé ou café. Elle parle d'abord de son physique et de son allure androgyne. Un portrait lui est ensuite consacré, la suivant dans son quotidien le temps d'une journée. Le reportage débute tard le matin chez elle avec sa fille Lou Doillon, leur chat et chien. Il se poursuit dans Paris chez ses commerçants de prédilection, puis par une rencontre fortuite avec Lambert Wilson et enfin au théâtre, dans sa loge, où elle joue la pièce Oh pardon ! tu dormais....***** info sur les commentaires *****Sur les chaînes YouTube, vous êtes libre de donner votre opinion, fût-elle critique. Pour assurer la qualité du débat, nous vous demandons toutefois de toujours rester calme, poli et respectueux des autres commentateurs. Le prosélytisme, les propos grossiers, agressifs, irrévérencieux envers une personne ou un groupe de personnes sont proscrites. Tout commentaire insultant ou diffamant sera supprimé. Nous nous réservons le droit de bannir tout utilisateur qui ne respecterait pas les règles de la communauté.*******************************************************************Images d'archive INAInstitut National de l'Audiovisuelhttp://www.ina.fr#INA #People #Star"
"XlhxaTOvF2s","3 FLIPETTES DANS LES BACKROOMS","2023-07-17T14:59:52Z","UCBQZKMg9bPGjusfXF0Ey4TQ","Coopa Multigaming","20","23.20.07","coopa|coopa multigaming|coopa troll|koopa|koupa|coupa|keupa|multigaming|troll|Escape the Backrooms|backrooms|backroom|backroom steam|Escape the Backrooms gameplay|Escape the Backrooms gameplay fr|Escape the Backrooms troll|Escape the Backrooms fr","52241","4231","0","98","https://i.ytimg.com/vi/XlhxaTOvF2s/default.jpg","False","False","🔊 Dans les Backrooms avec Pepson & @Breadator ❤️ Discord : http://discord.gg/coopa🩲 Avatar Coopa crée sur : https://www.southparkstudios.com/info...et customisés par Mendez & Cathou.👍 Fanart Coopa (sur certaines vidéos) créés par des membres du discord.gg/coopa🎹 Music from Epidemic Sound : http://www.epidemicsound.com"
"V8Z-xt1pSS0","BOMBE ATOMIQUE sur PARIS : ça fait quoi ?","2023-07-16T14:30:17Z","UCG9G2dyRv04FDSH1FSYuLBg","Jamy - Epicurieux","28","23.20.07","jamy|jamy gourmaud|c'est pas sorcier|jami|le monde de jamy|épicurieux|tsar bomba|projet manhattan|bombe atomique|bombe atomique jamy|bombe atomique paris|seconde guerre mondiale|hiroshima|nagasaki|BOMBE ATOMIQUE sur PARIS : ça fait quoi ?|invention bombe atomique|oppenheimer film|oppenheimer|christopher nolan oppenheimer|La bombe H|guerre froide|comment a été inventé la bombe atomique|einsten bombe atomique","505810","21786","0","1507","https://i.ytimg.com/vi/V8Z-xt1pSS0/default.jpg","False","False","Et si une bombe atomique tombait sur Paris ? Quels seraient les dégâts ? 😨C'est la question que nous nous sommes posée à l'occasion de la sortie du film Oppenheimer.00:00 Intro00:46 Les bombes atomiques d'Hiroshima et Nagasaki01:59 L'invention de la bombe Atomique04:44 Bombe atomique : comment ça marche ?06:05 BOMBE ATOMIQUE sur PARIS : ça fait quoi ?08:21 : La bombe H09:24 : La dissuasion atomique 11:10 OutroPour les nouveaux Épicurieux : abonnez-vous (et activez la 🔔) pour ne rater aucune vidéo ! ▶️ https://www.youtube.com/c/Jamyepicurieux/?sub_confirmation=1Et pour ceux qui ont vraiment le goût du savoir, la suite du menu à retrouver sur les réseaux sociaux :Instagram ➡️ https://bit.ly/Instagram_EpicurieuxFacebook ➡️ https://bit.ly/Facebook_EpicurieuxTikTok  ➡️ https://bit.ly/TikTok_EpicurieuxRetrouvez aussi mes comptes : Insta ➡️ https://bit.ly/Insta_JamyTwitter ➡️ https://bit.ly/Twitter_JamyFacebook ➡️ https://bit.ly/Jamy_Facebook À tout de suite 🤓"
"hFGAX1tQ31Y","Bousi aide Dobby à aller sur le toit de la villa, nos super moments en famille ⛱","2023-07-16T10:00:34Z","UCobKE2pCskZnatGHG50PH2w","Pidi","24","23.20.07","vacances|villa|bouzi|dobby|pidi|valouzz|premiere vacances en famille|vlog vacances|8 jours de vacs|croûtons|dozo family|bêtises|drôles","316027","19859","0","662","https://i.ytimg.com/vi/hFGAX1tQ31Y/default.jpg","False","False","8 jours condensé en quelques minutes de nos premières vacances en famille.Pétanque, piscine, jeu de société, bouffe et cocktails... Petit vlog vacances.Viens t'abonner à ma chaine YouTube:https://www.youtube.com/channel/UCobKE2pCskZnatGHG50PH2w )N'hésite pas à me suivre sur les réseaux:► Insta : https://www.instagram.com/pidi_meg/► Twitter : https://twitter.com/pidi_meg► Discord: https://discord.com/invite/7bu4V4f--------------------------------------------------------------------Contact :  pidimeg.yt@gmail.com"
"zDx7ZAe-qMs","LA RAGE DE LUFFY CONTRE BARBE NOIRE : LE COMBAT FINAL DES ROIS ! ONE PIECE 1087 THÉORIE ANALYSE","2023-07-16T08:00:33Z","UCu2e-o9q5_hZgPHCv8m1Qzg","Mont Corvo","20","23.20.07","one piece|one piece theorie|theorie one piece|one piece theory|theory one piece|luffy|luffy one piece|luffy theorie|theory luffy|gear 5|one piece gear|luffy gear 5|vs|zoro|puissance|forme|power|pouvoir|force|yonko|level|shanks|haki|prime|mugiwara|devil fruit|fruit du démon|demon|ending|explained|expliqué|combat one piece|one piece fight|top|manga|anime|chapitre|chapter|joy boy|nika|eveil|awakening|xebec|démon|revelation|Im|figarland|1069|1087|1088|garp|kobby|fin","263156","13310","0","688","https://i.ytimg.com/vi/zDx7ZAe-qMs/default.jpg","False","False","La mort de la légende Monkey D. Garp s'annonce sous le glas de la Ruche. Sous les ordres de Barbe noire, Aokiji va devoir tuer son ancien mentor afin de faire de Teach le roi de Mariegoise. Luffy et Kobby, comme Roger et Garp il y a 38 ans, vont devoir s'allier pour faire tomber à la fois Im et Teach. Mais Shanks a toujours son mot à dire... (☞ﾟ∀ﾟ)☞Lisez légalement One Piece sur MangaPlus : https://mangaplus.shueisha.co.jp/titles/700005｡◕‿◕｡ LES RÉSEAUX SOCIAUX !! ｡◕‿◕｡✪Notre Chaine Manga : https://www.youtube.com/channel/UCEPdz-ySl3obg3de47w2BUg✪ Radio One Piece : https://www.youtube.com/channel/UCZA68ebb7WZcD_Bv1D2RNSg✪ Twitter : https://twitter.com/MontCorvo_Off✪Live Twitch : https://www.twitch.tv/kamalkyta✪ Discord : https://discord.gg/qsz27fF✪ Facebook : https://www.facebook.com/MontCorvo/?f✪ Instagram : https://www.instagram.com/mont_corvo_✪ Tiktok : https://vm.tiktok.com/ZMRrhu2cU/✪Snapchat : https://story.snapchat.com/p/3cc0d86f-8da9-4f56-aaab-15bd3b4fce2a___________________FAQ/Questions récurrentes : *Vous êtes quoi ? : Deux frères jumeaux*Vous avez le brevet ? : On a 26 ans*Vous connaissez ONE PIECE ? : Depuis nos 10 ans, soit 16 ans.*C'est quoi cette musique endiablée d'intro  : Opening composés par Louis Bellamy *Tu utilises quel grille pain pour les vidéos ? : La suite adobe"
"4r_WKnBtWzE","Le PSG fait une OFFRE IRREFUSABLE pour Kane, Mahrez va RAPPORTER 20 M€ à Man City | JT Foot Mercato","2023-07-17T16:13:33Z","UCrzDtXyuSBch2u_31JJj-Dw","Foot Mercato","17","23.20.07","foot|football|foot mercato|info mercato|info transfert|footmercato|Marseille|Olympique de Marseille|Olympique de Marseille Mercato|pierre-emerick aubameyang|Pierre-emerick aubamayang Marseille|Pierre-emerick aubamayang Mercato|Paris|Paris Saint-Germain Mercato|Harry Kane Paris Saint Germain|Harry Kane Mercato|Bernardo Silva Mercato|Bernardo Silva Paris Saint Germain|Manchester United Mercato|Zidane Real Madrid|Lionel Messi Inter Miami|kane psg|kane","234810","7589","0","322","https://i.ytimg.com/vi/4r_WKnBtWzE/default.jpg","False","False","Au programme de ce JT Foot Mercato : le PSG fait une offre de dingue pour  pour Kane, Mahrez va rapporter 20 millions d'euros à City, l'heure du changement a sonné du côté de Manchester United, l'OM met un loft en place et les officiels du jour. 00:00 Introduction 00:10 Les grandes manœuvres de l’OM 00:53 Paris en feu 01:42 La révolution de ten Hag04:55 Juan Cuadrado a retrouvé un club05:15 Milan fait le forcing pour Taremi05:42 Jérémy Ménez va rebondir à Bari06:01 Zidane va prolonger à Madrid06:13 Les exclus du jour 07:45 Les officiels du jour 09:17 L'image du jour Pour ne plus rien manquer des nouvelles vidéos Foot Mercato : Abonne-toi ! ► http://www.youtube.com/c/mercato?sub_confirmation=1Pour ne rien manquer de nos débriefs d'après-match sur Twitch, abonne-toi juste ici : https://www.twitch.tv/footmercatoEt retrouvez les meilleurs moments de l'émission sur notre nouvelle chaîne, Foot Mercato FC : https://www.youtube.com/@footmercatofcNotre site Internet ► www.footmercato.net#TeamFootMercato"
"GtT93csNleY","Le RAVAGÉ de Discord","2023-07-16T14:30:04Z","UCn0VbHe_Chjws3qjUF4JJMw","Kombo","20","23.20.07","mmorpg|kombo|discord|documentaire discord","390594","27305","0","855","https://i.ytimg.com/vi/GtT93csNleY/default.jpg","False","False","Le premier anniversaire de Saint Seiya: Legend of Justice débute ! Commencez le jeu et obtenez 1000 tirages gratuitement, le lien pour débuter votre aventure est ici → https://bit.ly/44jEyLqUtilisez mon code  LEGEND1ST  pour recevoir un pack cadeau d'anniversaire exclusif, c'est parti ! ⚡️-Oui cette vidéo aurait dû s'intituler L'imbécile de Discord-🎥 En stream tous les jours sur : https://twitch.tv/kombo000🐤 Le seul réseau social que j'utilise : https://twitter.com/kombo000© Musiques, sources & montage : https://pastebin.com/QHVwhph4-→ Chapitres : 00:00 Intro01:08 Sponso02:53 Mystérieux lien05:40 Enquête08:04 Jack12:35 Outro-#kombo #discord"
