video_id,title,publishedAt,channelId,channelTitle,categoryId,trending_date,tags,view_count,likes,dislikes,comment_count,thumbnail_link,comments_disabled,ratings_disabled,description
"U0P7JXH6EKs","Napoléon : analyse de la bande-annonce par une HISTORIENNE (du Musée de l'armée)","2023-07-14T14:30:18Z","UCaPr4ZvxHm97X4c7QTeVyeQ","Musée de l'Armée","27","23.20.07","Joaquin Phoenix|napoleon|napoleon bonaparte|trailer napoleon|bande annonce napoleon|trailer reacts|ridley scott|analyse|analyse bande-annonce|historienne|musee de l'armee","458184","15500","0","1321","https://i.ytimg.com/vi/U0P7JXH6EKs/default.jpg","False","False","Référente pour l’histoire napoléonienne au musée de l’Armée, Émilie Robbe décrypte la bande-annonce du dernier film de Ridley Scott : Napoléon !Elle réagit au trailer du film, dont Joaquin Phoenix incarne Napoléon Bonaparte, et nous aide à identifier et dater les scènes clés…pour y débusquer l’intrigue ! Du mythique chapeau de Napoléon aux uniformes des grenadiers en passant par Vizir, le cheval de l’empereur, le musée de l’Armée possède une remarquable collection d’objets relative à Napoléon Bonaparte, ses armées et ses maréchaux : https://www.musee-armee.fr/collections/explorer-les-collections/portofolios/napoleon-ier-le-vol-de-laigle.html👍 N'hésitez pas à vous abonner à la chaîne et à nous suivre sur nos différents réseaux !"
"zLC-7Il-uYg","Quavo & Future - Turn Your Clic Up (Official Video)","2023-07-14T22:00:07Z","UCBBS37qiiYHkMBA42LgDmOg","QuavoVEVO","10","23.20.07","Quavo|Future|Turn|Clic|Quality|Control|Music/Motown|Records|Hip|Hop","2346805","112731","0","4705","https://i.ytimg.com/vi/zLC-7Il-uYg/default.jpg","False","False","Stream // Download Quavo and Future's Turn Yo Clic Up here: https://QualityControl.lnk.to/TurnYoClickUpFollow Quavo!https://www.instagram.com/quavohuncho https://twitter.com/QuavoStuntin https://www.tiktok.com/@quavohuncho https://www.facebook.com/THEMigosAtlMusic video by Quavo, Future performing Turn Yo Clic Up. Quality Control Music/Motown Records; © 2023 Quality Control Music, LLC, under exclusive license to UMG Recordings, Inc.http://vevo.ly/rGzpou"
"lhXbUWimtx0","Qui est l'IMPOSTEUR sur ROCKET LEAGUE 🔎 (édition extrême)","2023-07-17T18:18:55Z","UC3ejl7_LE3vVaXmluBDBsew","SniiperRL","20","23.20.07","rocket league|rocket league fr|SniiperRL|Kouros|Tequilaz|Playourlife|Wesh92|grand champion|rocket league tuto|funny|fr|GC|grand champ|rocket league tips|Kaydop","40624","2541","0","56","https://i.ytimg.com/vi/lhXbUWimtx0/default.jpg","False","False","► Essayez Wondershare Filmora pour monter vos vidéos facilement: https://bit.ly/44kdefW Ou l'appli mobile Wondershare Filmora: https://app.adjust.com/12pg2yov_12wswumo►Pour apprendre à monter vos vidéos c'est ici: https://bit.ly/45jmnq3📢 6% de réduction avec le code Sniip pour acheter tes items Rocket League : https://www.aoeah.com/rocket-league-items/fr📌 LIENSArtyrus: https://www.twitch.tv/artyrusBatou: https://www.twitch.tv/batouJSTKiss: https://www.twitch.tv/jstkissFlytz: https://www.twitch.tv/flytzrl_Syreox: https://www.twitch.tv/syreox_💎 RÉSEAUX➤ LIVE/TWITCH : https://www.twitch.tv/sniiperrl➤ DISCORD : https://discord.gg/sniiperrl➤ INSTAGRAM : https://www.instagram.com/sniiperrl/➤ TWITTER : https://twitter.com/SniiperRL➤ TIKTOK : https://www.tiktok.com/@sniiperrl_off➤ MUSIQUE : http://www.epidemicsound.com👉 Pour toutes demandes professionnelles ou commerciales: Sniiper@thenode.gg"
"WHc__D_v-do","🆒🎥🤣 NO COMMENT - EP 1","2023-07-14T14:30:17Z","UCt9a_qP9CqHCNwilf-iULag","PSG - Paris Saint-Germain","17","23.20.07","We Are Paris|PSG|PARIS SAINT-GERMAIN|PARIS|FOOTBALL|Sergio Rico|Alexandre Letellier|Gianluigi Donnarumma|Achraf Hakimi|Presnel Kimpembe|Sergio Ramos|Marquinhos|Juan Bernat|Nuno Mendes|Nordi Mukiele|Marco Verratti|Fabian Ruiz|Danilo Pereira|Vitinha|Renato Sanches|Carlos Soler|Kylian Mbappé|Neymar Jr|Lionel Messi|Messi|Mbappé|Hugo Ekitike|No Comment|Inside|Highlights|Skill|Training|Goal|Interview|Warren|Zaïre-Emery|Bitshiabu|Gharbi|Housni|Pembélé|Lavalle","436927","15312","0","853","https://i.ytimg.com/vi/WHc__D_v-do/default.jpg","False","False","SUBSCRIBE ➡️ https://www.youtube.com/psgFOLLOW PSG 🔴🔵👨‍💻 Website: https://en.psg.fr/ 📸 Instagram: https://www.instagram.com/psg/📲 TikTok: https://www.tiktok.com/@psg/🎥  Twitch: https://www.twitch.tv/psg/🐦  Twitter: https://twitter.com/PSG_English/💻  Facebook: https://www.facebook.com/PSG/ABONNEZ-VOUS ➡️ https://www.youtube.com/psgSUIVEZ LE PARIS SAINT-GERMAIN 🔴🔵👨‍💻 Website: https://www.psg.fr/ 📸 Instagram: https://www.instagram.com/psg/📲 TikTok: https://www.tiktok.com/@psg/🎥 Twitch: https://www.twitch.tv/psg/🐦 Twitter: https://twitter.com/PSG_inside/ 💻 Facebook: https://www.facebook.com/PSG/INSCREVA-SE ➡️ https://www.youtube.com/psgFOLLOW PSG 🔴🔵👨‍💻 Website: https://pt.psg.fr/ 📸 Instagram: https://www.instagram.com/psg/📲 TikTok: https://www.tiktok.com/@psg/🎥 Twitch: https://www.twitch.tv/psg/🐦 Twitter: https://twitter.com/PSGBrasil/ 💻 Facebook: https://www.facebook.com/PSG/"
"9Qpb45-avUw","ALLO APO APÉRO’","2023-07-15T09:00:10Z","UCzKBmXm7Or4tAt3RN2kVHAg","Apo","24","23.20.07","appo|apo|apol1|pid|pidi|teamcrouton|crouton|croutonapo|croutonpidi|cuisine|cook|appero|fun|funny","49006","5162","0","138","https://i.ytimg.com/vi/9Qpb45-avUw/default.jpg","False","False","Vous m'avez beaucoup demandé sur instagram comment je faisais mes belles planches appéro, c'est chose faite! On s'est régalé avec Pid!Toutes les refs de mes tenues (Lien affilié): https://www.shopltk.com/explore/Apollinegrmz Bon visionnage, j'espère que vous allez kiffer la vidéo!Des bisous, j'vous keffRetrouvez-moi sur:🌼 Instagram: https://www.instagram.com/apollinegrmz/🌼 Twitter: https://twitter.com/apolline_guer🌼 TikTok: https://vm.tiktok.com/ZSxFKF3u/ 🌼 Twitch: https://www.twitch.tv/apol1gaming🌼 Discord: https://discord.gg/apooContact pro: apolline.grmz@gmail.com"
"w8jvJUv3zXQ","Binguini Bakhaga - Oumar Gamby dit Barouni (Son Officiel)","2023-07-13T19:52:31Z","UCbimeSblS-Z02BWigBmt7Yw","Binguini Bakhaga","10","23.20.07","[none]","1072408","40640","0","8643","https://i.ytimg.com/vi/w8jvJUv3zXQ/default.jpg","False","False","Abonne-toi à Binguini Bakhaga Officiel sur YouTube 👉 https://www.youtube.com/channel/UCbimeSblS-Z02BWigBmt7Yw?sub_confirmation=1-----------------------------------------------------------------------------------La reconnaissance est la mémoire du cœur et elle ne pousse qu’en bonne terre. Pour remercier Barouni Gamby de son geste formidable. Maintenant donnons de la force à ce projet en le partageant au max !-----------------------------------------------------------------------------------Auteur : Binguini BakhagaCompositeur : Djeli Baba DiabatéProduction : Royaume Keit / Ate Gri GriDistribution : Keyzit Distribution#BinguiniBakhaga #AteGriGri #RoyaumeKeit"
"gNZBlPsqKEQ","THRILLER BARK, On s'en FOUT ? - ONEPIECEOLOGIE","2023-07-14T16:23:26Z","UC5sbGkJ_Fuzn_NCxFfX0zLw","LeChefOtaku","24","23.20.07","[none]","147953","9280","0","717","https://i.ytimg.com/vi/gNZBlPsqKEQ/default.jpg","False","False","La célébration du premier anniversaire de Saint Seiya: Legend of Justice” est ouverte magnifiquement, et Seiya d’Armure Divine arrive! Maintenant, démarrez le jeu et obtenez 1000 tirages gratuits, cliquez sur le lien pour commencer votre aventure → https://bit.ly/3JMXZnKUtilisez mon code de jeu exclusif LEGEND1ST pour obtenir le pack-cadeaux d’anniversaire. -----------------------------------------------------------------------Mon MANGA ARENA TOME 1 : https://amzn.to/3cF4bjU                                       TOME 2 : https://amzn.to/3STOVj1                                       TOME 3 : https://urlz.fr/mjSkBoîte de jeu Quizz Manga : https://amzn.to/3S0gqap                                                 https://urlz.fr/jf8VMon LIVRE MANGASTORY : https://amzn.to/3yDcswH-----------------------------------------------------------------------Boutique CHEF OTAKU ( BD, t-SHIRT...) :https://utip.io/lechefotaku/shopSeconde chaîne : https://www.youtube.com/channel/UCr85SbHVJydkcsXnt6kX2dgSuivez-nous sur twitch : https://www.twitch.tv/chef_brosRejoignez la page Facebook: https://www.facebook.com/MenuMangaSuivez nous sur Twitter  : https://twitter.com/MenuMangaInstagram : https://instagram.com/le_chef_otaku_/TIKTOK : Tiktok : https://vm.tiktok.com/ZM8cynWjJ/ Discord-officiel : https://discord.gg/4rSSYHrfj9Contact pro : menu.manga@gmail.comMusique Générique : https://www.youtube.com/user/VayleMystery"
"78313ESGT6Q","LE PLUS GROS RAT DE L'HISTOIRE (3 JEUX BOB L'ÉPONGE)","2023-07-14T14:36:48Z","UCNMXy9oYAQdGefNVHFQukCQ","AYOUB1080p","20","23.20.07","Ayoub|Ayoub1080p|bob l'éponge|jeux|gameplay|FR","198744","7312","0","185","https://i.ytimg.com/vi/78313ESGT6Q/default.jpg","False","False","pour rejoindre les membres de la chaine :https://www.youtube.com/channel/UCNMXy9oYAQdGefNVHFQukCQ/joinPour stream Blabla https://fanlink.to/BlablaPour stream Valentine https://fanlink.to/ia6fMail pro : ayoubusiness.contact@gmail.com"
"w9ZUN1CQUVc","Singuila Feat. Gaz Mawete -  Linga Nga","2023-07-14T17:00:40Z","UCSZlpl-Vk0dHydBQcrmbgIA","SinguilaOfficiel","10","23.20.07","singuila|rossignol|aicha|ma go|universalmusic|chanteur|afrique|rnb|love|music","478671","26838","0","1826","https://i.ytimg.com/vi/w9ZUN1CQUVc/default.jpg","False","False","Singuila Feat. Gaz Mawete -  Linga NgaDirected by JackemProduced by Kingondebeatz 🎧 Pour écouter le titre 👉🏾https://SinguilaxGazMawete.lnk.to/LingaNgaAbonne-toi ici:   Retrouvez SINGUILA sur ses différents réseaux sociaux:Facebook: https://www.facebook.com/SinguilaOfficielInstagram: https://www.instagram.com/singuilaofficiel/Twitter: https://twitter.com/SinguilaMusic#Singuila #gazmawete #LingaNga #TendanceCongo #DocteurLove #Rossignol #Abidjan #Kinshasa #KongoMusic by Singuila performing Linga Nga.© 2023 Universal Music Africa"
"SRtrG6eDDZw","Des smoothies de CHAIR HUMAINE pour rester en vie? Richard Chase le VAMPIRE de Sacramento","2023-07-14T14:44:43Z","UCWQ8XdwaHNDxs9kWoTH9O5A","Liv","24","23.20.07","liv|live|liz|liz paranormal|lise|liv paranormal|divertissement|vidéo peur|vidéo horreur|paranormal|histoire d'horreur|Thread horreur|Liv thread horreur|Thread horreur liv|horreur|Fait divers|Histoire de crime|histoire vraie|histoire vraie flippante|dérangeant|storytime|étrange|mystère|mystérieux|sombre|true crime|richard chase|richard chase interview|richard chase histoire|vampire|psychologie|tueur en serie americain|tueur en serie reportage|cannibale|smoothie","138034","8111","0","334","https://i.ytimg.com/vi/SRtrG6eDDZw/default.jpg","False","False","🔔 Clique ici https://www.cyberghostvpn.com/LIV pour bénéficier de 83% sur ton abonnement à Cyberghostvpn (soit 2,03€ par mois + 4 mois offerts)Dans cette vidéo, plongez dans l'affaire terrifiante de Richard Chase, surnommé Le Vampire de Sacramento. Découvrez les détails glaçants de ses crimes macabres qui ont semé la terreur dans les années 1970. Nous explorerons la psychologie troublante de Chase et son obsession pour le sang et la chair humaine, ainsi que les circonstances qui ont conduit à sa capture.Rejoignez-nous pour une analyse approfondie de l'affaire Richard Chase, en examinant les preuves, les témoignages et les conséquences de ces actes horribles. Nous plongerons dans l'esprit torturé de Chase, en cherchant à comprendre les motivations derrière ses actes violents.📄 SOURCEShttps://truecrimeseven.com/the-vampire-of-sacramento-the-true-story-of-richard-chase/https://murderpedia.org/male.C/c/chase-richard.htmhttps://allthatsinteresting.com/richard-chasehttps://thecrimewire.com/true-crime/Profile-of-a-Serial-Killer-Richard-Trenton-Chase-The-Vampire-of-Sacramentohttps://www.thesun.ie/news/8288688/vampire-sacramento-killer-victim-speaks-pregnant-wife-murder/https://archive.org/details/ia-screener-richard-chase-reel-1↓↓  MES RÉSEAUX ↓👥 TIK TOK https://www.tiktok.com/@_livandi_?_t=8ZZQAfgzIZh&_r=1📸 Instagram https://www.instagram.com/_livandi_/🔍 Jette un oeil à mes dernières vidéos → Cette ADO a JETÉ son bébé dans une POUBELLE d’hôpital: L'affaire Alexee Trevizo https://youtu.be/SFFcVsD41eIDe nounou à ESCLAVE: la DESCENTE AUX ENFERS de Sophie Lionnet https://youtu.be/uGWROZEIxBQSur les traces d'un SERIAL KILLER anglais ÉNIGMATIQUE https://youtu.be/dpx5-ir8ZREsubcount: 937k"
"JpE_mAuzU1c","Carlos Alcaraz's FIRST Interview as Wimbledon Champion | Wimbledon 2023","2023-07-16T18:49:38Z","UCNa8NxMgSm7m4Ii9d4QGk1Q","Wimbledon","17","23.20.07","Tennis|Wimbledon|wimbledon championship|wimbledon tennis|wimbledon video|Wimbledon 2023|Tennis Grandslam|The Championships|Grand Slam|Grass|2023|Always Like Never Before|Carlos Alcaraz|celebration|Carlos|Alcaraz|Carlos Alcaraz vs Novak Djokovic|Post match interview|Final Interview|Interview|Grand Slam tennis|Grand Slam Final|Centre Court|Wimbledon news|news|Spain|Grand Slam Champion|Carlos Alcaraz Post Match","1354709","15036","0","1294","https://i.ytimg.com/vi/JpE_mAuzU1c/default.jpg","False","False","Our new champion speaks moments after his hard-fought final against Novak Djokovic. SUBSCRIBE to keep up with all The Championships action and news!Join myWimbledon for a personalised Wimbledon experience: http://wimbledon.com/mywimbledonTo follow all of the action as it happens go to: https://www.wimbledon.com/en_GB/scores/index.html#Wimbledon #CarlosAlcaraz #InterviewTo license Wimbledon footage, visit: https://bit.ly/3fy0RbA"
"5jV17TXET_8","1ER RANG PHYSIQUE... - REDOUANE BOUGHERABA","2023-07-16T08:30:02Z","UC-4xdm_HWFZqaoZVbJ72o0w","Redouane Bougheraba TV","23","23.20.07","redouane|redouanebougheraba|bougheraba|humour|stand-up|bougeraba|reduane","186631","4478","0","69","https://i.ytimg.com/vi/5jV17TXET_8/default.jpg","False","False","Abonne-toi ► https://www.youtube.com/channel/UC-4xdm_HWFZqaoZVbJ72o0w/?sub_confirmation=1Extrait d'impro de mon spectacle On m'appelle Marseille, à L'Olympia de Montréal !Ajoute-moi sur les réseaux, tu vas te régaler ! Instagram : https://www.instagram.com/redouanebougheraba/Facebook : https://www.facebook.com/redoneshow"
"zhyNk8fQVOM","Les SECRETS sur l’ENDURANCE des CYCLISTES au TOUR de FRANCE 🚴🇫🇷","2023-07-14T14:52:59Z","UCz0CYhFQYxsacBSBdiVF53A","Sport Trash","17","23.20.07","Sport Trash|cyclisme|tour de france|endurance|sports|sport","279209","14795","0","428","https://i.ytimg.com/vi/zhyNk8fQVOM/default.jpg","False","False","3.406 kilomètres de parcours, 55.460 mètres d’altitude cumulés à grimper sur 21 étapes… C’est ce qui attend les coureurs du Tour de France 2023 ! Pour cette 110e édition, les cyclistes n’auront droit qu’à 2 petits jours de repos complets entre le 1er et le 23 juillet. 3 semaines durant lesquelles les athlètes vont devoir enchaîner les efforts à haute intensité… C’est colossal ! Entre préparation, nutrition et force mentale, on vous explique comment les cyclistes du Tour de France sont aussi endurants ! Voix · Trekim & IkutsenTexte · Hugo KcsMontage · Numiss, Bouwah, Trekim, IkutsenTrekim : https://instagram.com/trekim_Ikutsen : https://instagram.com/ikutsenfc#sports #sporttrash #cyclisme #tourdefrance"
"rSpet_lKy-U","Larry - EN PÉPÉ 5 (Clip officiel)","2023-07-14T16:00:46Z","UCbOO7kLwv0viB2I1GGInhTg","LarryOfficielVEVO","10","23.20.07","EN PÉPÉ|GOTHVM Records|Hip-Hop/Rap|Larry","633917","14297","0","428","https://i.ytimg.com/vi/rSpet_lKy-U/default.jpg","False","False","« EN PÉPÉ 5 » – Disponible sur toutes les plateformes de streaming : http://Larry.lnk.to/enpp5Retrouvez tous les épisodes de la série de freestyles 'EN PÉPÉ' ici : http://www.larry.lnk.to/ENPEPE --- Interprété par : LarryComposé par : MITCHIngénieur son : Le BorgneMix/Mastering : Le BorgneRéalisé par BADAZZ ---  Abonnez-vous à ma chaîne Youtube : https://www.youtube.com/channel/UC0TD...Instagram : https://www.instagram.com/larrysogood...Tiktok : https://www.tiktok.com/@larrysogoodFacebook: https://www.facebook.com/larrysogood/Twitter : https://twitter.com/Larrysogood#Larry #ENPEPE5 #Lawy"
"E93Kiy7nt0c","Rousnam - Correction #10 (Street Clip)","2023-07-14T17:00:17Z","UC-fOxjirP3KS1lh_Ok3d2lQ","Rousnam Officiel","10","23.20.07","rousnam|rousman|reynerie","113036","1884","0","90","https://i.ytimg.com/vi/E93Kiy7nt0c/default.jpg","False","False","Correction #10 disponible sur toutes les plateformes → https://idol-io.ffm.to/correction10MIXTAPE  JE M'ATTACHE A LA VIE MAINTENANT DISPONIBLE→ https://idol-io.link/JMALV Clip by SLOWMPRODAuguri LabelsPage Facebook : https://www.facebook.com/rousnamofficielInstagram : https://instagram.com/rousnam_311Snapchat : https://www.snapchat.com/add/Rousnam31"
"Gr2AgvxzmEo","LES 19 NOUVELLES PRIMES DE ONE PIECE DÉPASSANT 3 MILLIARDS DE BERRYS !","2023-07-14T15:00:16Z","UCVW8CUKYU8nRNGO_bFKIVjw","Luffylosophe","24","23.20.07","luffylosophe|luffylosophy|one piece|one piece theorie|one|piece|anime one piece|manga one piece|dragon|monkey d dragon|gold roger|edward newgate|rocks d xebec|kaido|big mom|shiki|rayleigh|shanks|kuzan|kuzan 1087|oden kozuki|scopper gaban|mihawk|prime one piece|theorie one piece|luffy|zoro|puissance|power|pouvoir|force|yonko|level|haki|prime|mugiwara|fruit du démon|one piece fight|top|manga|anime|chapitre|joy boy|nika|eveil|revelation|sabo|gorosei|imu|1087|aokiji","124376","4062","0","287","https://i.ytimg.com/vi/Gr2AgvxzmEo/default.jpg","False","False","On va découvrir des primes cachés préparez-vous...▸ Lien du concours avec AkemiFigurine : https://twitter.com/_Luffylosophe/status/1679865192706875392?s=20▸ contact pro : Luffylosophe@rachimedia.com▸ Discord ONE PIECE:  https://discord.gg/onepiecefr▸ Miniature : https://www.instagram.com/ophan_drawing/▸Twitter : https://twitter.com/_Luffylosophe▸ Tiktok : https://www.tiktok.com/@_luffylosophe▸Mes musiques viennent de là : https://www.epidemicsound.com/referral/uqt9pr▸Les meilleurs fanart : https://www.instagram.com/art_by_kaz/▸Titre :  LES 19 NOUVELLES PRIMES DE ONE PIECE DÉPASSANT 3 MILLIARDS DE BERRYS !00:00 Luffy Law Kid01:20 3 milliards - 3 milliards 500 millions07:27 3 milliards 500 millions - 4 milliards13:50 4 milliards - 5 milliards20:17 Au dessus de 5 milliardsI do not own One Piece, the One Piece manga or the One Piece anime. 𝙲𝚘𝚙𝚢𝚛𝚒𝚐𝚑𝚝 𝙳𝚒𝚜𝚌𝚕𝚊𝚒𝚖𝚎𝚛: This video was made for educational purposes. Under Section 107 of the Copyright Act 1976, allowance is made for 'fair use' for purposes such as criticism, comment, news reporting, teaching, scholarship, and research. Fair use is a use permitted by copyright statute that might otherwise be infringing. Non-profit, educational or personal use tips the balance in favor of fair use. This video is a critical review & analysis of the story of One Piece."
"5McUFZz2s-w","Seven (feat. Latto) - Explicit Ver.","2023-07-14T04:01:01Z","UC-pOuHFcndLpyfWSPVqXt_A","Jung Kook - Topic","10","23.20.07","정국 (Jung Kook)|Jung Kook|Seven (feat. Latto)|Seven (feat. Latto) - Explicit Ver.","6889626","357948","0","0","https://i.ytimg.com/vi/5McUFZz2s-w/default.jpg","False","False","Provided to YouTube by 'BIGHIT MUSIC'Seven (feat. Latto) - Explicit Ver. · 정국 (Jung Kook)Seven (feat. Latto)Released on: 2023-07-14Auto-generated by YouTube."
"QJT2uOTRWNA","Tour de France : Le résumé de l'étape 14","2023-07-15T16:40:51Z","UCRm-DLbhzojKd10edotYxMg","France tv sport","17","23.20.07","cyclisme|pogacar|sports|tour de france|vingegaard","309725","4312","0","355","https://i.ytimg.com/vi/QJT2uOTRWNA/default.jpg","False","False","▶️ Retrouvez l'actualité sportive en vidéo : https://www.france.tv/sport/ 🔔 Pensez à activer la cloche 🔔 pour recevoir une notification pour chacune de nos vidéos !   Retrouvez le résumé de la 14e étape du Tour de France 2023 entre Annemasse et Morzine Les Portes du Soleil."
"QIwcxx1h0F4","DJ Hamida feat. Anas Yan & Silva - Wesh Arif Ino (clip officiel)","2023-07-14T15:43:14Z","UC3bmcYcRQ3D4zrHVyzyqjjQ","DJHAMIDAOFFICIEL","10","23.20.07","dj hamida|arif ino|summer edition|anas yan|silva|amazigh|rif|rif gang|morocco|maroc|algérie|berbère|lartiste|maes|niro|nassi|riffi|nador|tanger|Al Hoceïma|ketama|Hafssa Da|Chekama","705448","9734","0","737","https://i.ytimg.com/vi/QIwcxx1h0F4/default.jpg","False","False","DJ Hamida, Anas Yan, Silva - Wesh Arif Ino ☀️Extrait de l'album A la bien (summer edition 2.0) disponible: https://djhamida.lnk.to/Alabiensummeredition20Merci à Anas Yan, Silva et leurs équipes !Prod. by DJ Hamida & NiizarLyrics by Salim El Hamdani (Anas Yan)Rush by AMIMOUN Realisé par Le TruquisteRetrouvez DJ Hamida sur: Facebook: https://www.facebook.com/DjHAMiDAOFFioficiel71Twitter: https://twitter.com/djhamida71Instagram : https://instagram.com/djhamidaofficiel Snapchat : https://www.snapchat.com/add/DjhamidaoficielTout DJ Hamida sur iTunes : http://bit.ly/1p9r7ETRetrouvez les clips et sons de DJ Hamida sur Youtube: https://www.youtube.com/djhamidaofficiel#djhamida #arifino"
"x6mc_rRwD3A","Jung Kook of BTS performs ‘Seven’ in NYC l GMA","2023-07-14T14:03:44Z","UCH1oRy1dINbMVp3UFWrKP0w","Good Morning America","24","23.20.07","abc|army|bts|career|central|concert|evacuation|gma|jung|kook|news|nyc|p_cmsid=2494279|p_vid=news-101268801|park|series|seven|solo|summer|jungkook seven|junggook seven lyrics|bts gma summer concert|jung kook central park|jung kook seven|good morning america jungkook","8306938","724224","0","15876","https://i.ytimg.com/vi/x6mc_rRwD3A/default.jpg","False","False","The global pop star performs his new hit “Seven” during the “GMA” Summer Concert Series from New York City’s Central Park.SUBSCRIBE: https://bit.ly/2Zq0dU5 SIGN UP to get the daily GMA Wake-Up Newsletter: https://gma.abc/2Vzcd5jVISIT GMA: https://www.goodmorningamerica.comFOLLOW:TikTok: https://tiktok.com/@gmaInstagram: https://instagram.com/GoodMorningAmericaFacebook: https://facebook.com/GoodMorningAmericaTwitter: https://twitter.com/gma#jungkook #jungkookongma #btsarmy #seven #music #gma"
"p3JRHkCx0KI","BARO x Naz Eda - Kuş oldum uçtum (Official Video)","2023-07-14T22:00:06Z","UCHDqtwOUvLDsWSGqzjefOPQ","BARO","10","23.20.07","Kuş oldum uçtum|Baro kuş oldum uçtum|baro naz eda kuş oldum uçtum|baro naz eda|baro|naz eda|vatan|baro naz eda vatan|sıla yolu şarkısı|sıla yolu|türkü|gurbet|gurbet eller haram|Kuş oldum uçtum|Baro kuş oldum uçtum|baro naz eda kuş oldum uçtum|baro naz eda|baro|naz eda|vatan|baro naz eda vatan|sıla yolu şarkısı|sıla yolu|türkü|gurbet|gurbet eller haram","556989","16591","0","664","https://i.ytimg.com/vi/p3JRHkCx0KI/default.jpg","False","False","Stream here: https://linktr.ee/baroffiziell► BARO on Instagram: https://www.instagram.com/baroffiziell/► BARO on TikTok: https://www.tiktok.com/@baroffiziell/► Naz Eda on Instagram: Instagram: https://www.instagram.com/nazedaofficial/► Naz Eda TikTok: https://www.tiktok.com/@nazedaofficial/► Kuş oldum uçtum Prod. by ZTrone► ZTrone Instagram: https://www.instagram.com/z.trone/► Video by: Diablon .D. VisualzzInstagram: https://instagram.com/diablondvisualzz?igshid=MzRlODBiNWFlZA==Söz/Lyrics:Bu yürekte bi dert var Yine mi keder lan yine Efkar Biz hiç gün yüzü görmedik oğlum Olsun yaşamaya yine de sebep varELBET BİR GÜNyedik hayattan hep sürgün  Her şey mümkün Yeter ki Annem hep gülsünYaşı mı sorma hiç yaşayamadım kiÖlümü bekler oldum Beni bekleme AnnemBelki hiç gelmez oğlunKuş oldum uçtum gökyüzüne Huzuru buldum döndüm özüme Gurban olayım salın beni Ben yoldaş olmuşum ölüme Kuş oldum uçtum gökyüzüne Ganadım kırıldı düştüm yere Gurban olayım gömün beni Hasret kaldığım o köyüme Köyümün kokusunu özledim anne Bana söz verin anne Dayımın yanına gömünbeni açık gider yoksa gözlerim anneRüyamda küçüklüğüm Boğazda büyük düğünBoğazda büyük düğümİstediklerim hiç olmicak anne Derdimi anlattım dağlaraOmzumda yüklerim ağır Ana Yazdığım mektubu okurken Gurban olurum sana sen ağlama Çınlatsın babam bi bağlama Sen söyle yakın bi ağıt banaAllahım alcaksan al beniAlışamadım ben bu vedalaraKuş oldum uçtum gökyüzüne Huzuru buldum döndüm özüme Gurban olayım salın beni Ben yoldaş olmuşum ölüme Kuş oldum uçtum gökyüzüne Ganadım kırıldı düştüm yere Gurban olayım gömün beni Hasret kaldığım o köyümeBaris Sarikaya"
