video_id,title,publishedAt,channelId,channelTitle,categoryId,trending_date,tags,view_count,likes,dislikes,comment_count,thumbnail_link,comments_disabled,ratings_disabled,description
"77NiHeEa5Gg","LE MASHUP DES JEUX VIDÉO","2023-07-18T16:04:01Z","UCyWqModMQlbIo8274Wh_ZsQ","Cyprien","23","23.20.07","[none]","1874477","256270","0","6541","https://i.ytimg.com/vi/77NiHeEa5Gg/default.jpg","False","False","Téléchargez Saint Seiya Legend of Justice pour profiter des 1000 invocations et Seiya Armure Divine : https://bit.ly/3XJHmigOubliez pas mon code de pack cadeau gratuit d'anniversaire : CYPRIEN1STRéalisé par Cyprien IovEcrit par Cyprien Iov, Valentin Vincent, Julien JosselinDirectrice de production, assistante mise en scène : Eléna BultotChargée de figuration : Maya SaracChef opérateur : Antoine GuibertAssistant caméra : François GaudièreChef électricien : Hugo DerooElectricien : Loïc LatapieChef opérateur son : Adrien BrizardCheffe costumière : Charline GraffeuilCostumière : Elise Le DuCheffe maquilleuse : Elodie MullerMaquilleuse : Rosalba DelfinMaquilleuse : Lena KappaufMaquilleuse FX (Zombie) : Alexia SeliniDéco : Julia Dagood, Lo Richert-Lebon, Frédéric Bernard, Yan JumbouRégisseur général : Arnaud SagaertRégisseuse : Ingrid HolleyMonteur : Edmond NoëlEtalonneur : Mickael MaalaouiMixe : Studio de l’Arrière BoutiqueEffets spéciaux : Griffe - Spectre, Antoine Behaeghel - MoodMakerAvec @Mastu @MathSeFaitDesFilms @lemondealenversvideo  @joueurdugrenier @LeFatShow et Stéphane BernCascadeur : Julien MeynierPyramide Head : JoyceZombie : AdamCosplays :Yennefer : Constance - Insta @ayuukycosplayGeralt :  Audrey et Joffrey - Ivy et JeffClaqueur : Matthieu - Insta @tharede_cosplayPyramide Head - Loïc / Spyder AtelierUn grand merci à l’Hôtel Lamoignon, Bibliothèque historique de la ville de Paris @BibliothequesdeParis ainsi qu’à la ville de Paris.Un immense merci également à tous nos figurants, à Cathy Serrat, Clara Luciani (c'est une longue histoire)Remerciements : Pleine Image, Logifilm, Dinosaures, Studio Keral, Micromania, Les Caves St Sabin, The Trip - l’expérience immersive, Fabien Plazannet, Guillaume Ladrange, UbisoftUne production Périple"
"70I94z_2toM","24H SUR LE TRAIN LE PLUS DANGEREUX DU MONDE !","2023-07-18T15:59:37Z","UC-4M8AN08hw39nn2v91VuMQ","CYRILmp4","24","23.20.07","cyril|cyrilmp4|24h|train|dangereux|desert|voyage","620664","86141","0","3538","https://i.ytimg.com/vi/70I94z_2toM/default.jpg","False","False","J'ai traversé clandestinement le Sahara sur ce train incroyable !👍 Merci à tous ceux qui laisseront un pouce bleu►Ma 2ème chaîne gaming : @CYRILstudio ►Abonne toi: http://bit.ly/1rot6qe►Instagram: https://www.instagram.com/cyrilmp4►Twitter: https://twitter.com/Cyril_mp4►Rejoins mon Discord : https://discord.gg/cyrilmp4►En live sur Twitch ici : https://www.twitch.tv/cyrilmp4Contact professionnel : cyrilmp4@laportegroupe.com"
"hFyMgn16dC0","Buffet à volonté empoisonné : Qui choisira le plat piégé ?","2023-07-18T15:00:36Z","UCC_r3spMB5i5QKgtdNVO0OQ","Pierre Croce","23","23.20.07","pierre|croce|pierrecroce|funny|marrante|drole|vidéo|vidéos|youtubeur|lol|fun|comedie|comedy|comedien|benjamin|verrecchia","553825","23437","0","337","https://i.ytimg.com/vi/hFyMgn16dC0/default.jpg","False","False","Mon canal insta : https://ig.me/j/AbbHtE4Yypl2ol0d/Merci à @lucas_studio @Universdesora @BenjaminVerrecchia @emyltr @fredvanlong Cadrage : Mathieu Monconduit, Thibault Guieu,  Morgane Mariel,Montage : Lucas KientzyResponsable de production : Jordie BoillereauGraphisme : Lucas BlettnerMerci à Greg notre cuisinier : https://www.instagram.com/gregorio_dicarpaccio/?hl=frhttps://www.instagram.com/lapetiteepicerie_auteuil/?hl=fr"
"YB1uFF53guQ","JE METS LES CHOSES AU CLAIR. (FAQ 2023)","2023-07-18T15:54:02Z","UCUl7mwOyySfZzUkq4H29nug","LeBouseuh","24","23.20.07","faq|lebouseuh|je reponds a vos questions|lebouseuh faq","574619","51874","0","697","https://i.ytimg.com/vi/YB1uFF53guQ/default.jpg","False","False","Abonne toi à ma chaîne ►  http://urlz.fr/4jF2N'hésite pas non plus à lâcher le petit pouce bleu des famillesFAQ été 2023 afin d'en savoir plus sur moi et ce qui m'entoure !Merci encore pour vos questions sur Instagram↓REJOINS MOI SUR LES RESEAUX↓◦ Instagram : https://www.instagram.com/levraibouseuh/◦ Twitter : https://twitter.com/lebouseuh◦ Twitch : https://www.twitch.tv/lebouseuh◦ Facebook : https://www.facebook.com/lebouseuh/"
"i_AFJeSivvY","Jane BIRKIN, ses dernières confidences « Ma vie n’a été que folie et amour » (octobre 2022)","2023-07-18T17:12:57Z","UCtyZ1cGRbRnTGKok6RU9CwA","L'invité","25","23.20.07","TV5MONDE|Actualité|Patrick Simonin|L'invité|jane birkin|serge gainsbourg|johnny jane|babe alone|les dessous chics|france|londres|charlotte gainsbourg|lou doillon|jacques doillon|kate barry|mort|john barry|cinéma|slogan|la piscine|la moutarde me monte au nez|je t'aime moi non plus|la décadanse|chanson|jane b|fuir le bonheur de peur qu'il ne se sauve|hermès|varda|chéreau","125976","1828","0","232","https://i.ytimg.com/vi/i_AFJeSivvY/default.jpg","False","False","Tous les jours, à 18h50 (heure de Paris), Patrick Simonin reçoit les personnalités qui font l'actualité sur TV5MONDE.Retrouvez toutes les émissions sur http://www.tv5monde.com/linviteL'Invité est sur les réseaux sociaux : Facebook : https://www.facebook.com/LInvite-166784776680731/Twitter : https://twitter.com/PatrickSimoninL'Invité sur TV5MONDE, c'est tous les jours : France / Belgique / Suisse : 18H50 heure de Paris.Europe : 18h30 heure de Paris.Afrique : 17h50 heure de Dakar.Maghreb/Orient : 20h20 heure de Beyrouth.Asie : 08h20 heure de BangkokPacifique :  12h20 heure de Tokyo.Etats Unis : 13h45 heure de New York.Amérique Latine: 14h45 heure de Buenos Aires."
"oZzDNSA-Q94","PARLONS DE THUNES.","2023-07-17T18:51:20Z","UCDkl5M0WVaddTWE4rr2cSeA","Lena Situations","26","23.20.07","LENA Situations|Déco|lena Situation|lena|Mahfouf|Situations|appartement|abonnée|Valérie Damidot|solene|Marcus|seb|lena Mahfouf|déménage|appartement tour|diy","1289310","100722","0","2217","https://i.ytimg.com/vi/oZzDNSA-Q94/default.jpg","False","False","C’est toujours un peu intimidant de parler d’argent, c’est un sujet tabouche qui divise, qui peut mettre mal à l’aise mais qui est pourtant très important dans la création de son projet. Ce que j’aimerai avec cette série sur Hotel Mahfouf c’est d’ouvrir la conversation honnêtement sur ce que c’est de lancer sa marque, le bon comme le mauvais.  TOUTES LES INFOS DE CETTE VIDEO ⇩ ⇩ ⇩ ⇩✰ MON LIVRE TOUJOURS PLUS ✰📒  Commande mon livre de développement personnel ici: https://tidd.ly/3bqgwDD​​​​​​​ ou 👂 en format livre audio ici : www.audible.fr/lenaMON LOOK DANS LA VIDÉO ⇩‣ Combinaison Hôtel Mahfouf: sold out, restock soon ! ------------------------MES MEUBLES DANS LA VIDÉO ⇩‣ Neon +=+ || coming sooooon‣ Tabouret transparent : https://bit.ly/3JG0mZb‣ Lampadaire vers de terre: https://bit.ly/449avG5‣ Bloc marbre: https://bit.ly/3r1C85d------------------------✰ SUIVEZ MOI ✰ instagram ‣ @lenamahfouf tiktok  ‣ https://vm.tiktok.com/Cf7evy/​​​​​​​ @lenasituations  ------------------------Réalisateurs: @lenamahfouf @igordorembusParties en studio:Chef opérateur: @gwendalperonProducteurs: @samy.andre @julienallardidzDirecteur de production: @icesparisChargée de production: @gaelledek1ère assistante réalisateur: @barbier_juliette1er assistant caméra: @mathiasgodronChef électricien: Sylvain GabayetÉlectriciens: @eva.baldit @the_guicheChef machiniste: @marin.barraudMachinistes: Joseph BoujenahCheffes décoratrices: @castay.s @juliette.castay @castaycharlotteConstructeur: @labuzanceÉquipe décoration: @theojata @alexis__sab @garyneveuRégisseurs: @double2m2 @beberfefeRégisseur plateau: Joris MesdariÉtalonnage: @i_henrymanceauPhotographe plateau: @ryaan_93kStagiaire production: @jvs_75iMontage @lucilemoreno @lenamahfouf @igordorembusVidéo festival : @ilanbrk_Remerciements: @HugoDecrypte @JulienGranel @BigfloetOli  @eyelite_france @rvzparis @fullmotionlocation @cinesyl @flycar @keepgrading✰ MONTAGE & EQUIPEMENT DE TOUS LES JOURS ✰ ‣ Final Cut Pro X sur iMac ‣ Grosse caméra:  Sony |||  (utilisée pour cette vidéo )‣ Mon ordinateur portable : https://bit.ly/37ZhWnB​​​​​​​‣ Mon ordinateur de bureau : https://bit.ly/3oPsV9W​​​​​​​‣ Mes lumières: https://bit.ly/3neRVXO​​​​​​​----------------------------------------------------------------------------------------------------Commente  HAUT DE GAMME  si tu as lu la barre d'info en entier. :p-----------------------------------------------------------------------------------------------------▹ Cette vidéo n'est pas sponsorisée !"
"eUqkibPzW3s","EA SPORTS FC 24 | Official Gameplay Deep Dive","2023-07-18T14:58:10Z","UCoyaxd5LQSuP4ChkxK0pnZQ","EA SPORTS FC","20","23.20.07","Fc 24|ea sports fc 24|ea sports fc 24 trailer|ea sports fc 24 gameplay|fc 24 gameplay trailer|fc24 gameplay|fc24 gameplay trailer|EA SPORTS FC|EA SPORTS FC 24 features|EA SPORTS FC 24 release date|EA SPORTS FC 24 ps5|EA SPORTS FC 24 xbox|EA SPORTS FC 24 pc|EA SPORTS FC 24 news|EA SPORTS FC 24 official trailer|EA SPORTS FC 24 pre-order|fifa 24|ea fc 24|ea fc|ea fc 24 trailer","2051528","94618","0","5030","https://i.ytimg.com/vi/eUqkibPzW3s/default.jpg","False","False","See the new gameplay features in EA SPORTS FC 24, including HyperMotionV, PlayStyles optimised by Opta, and an enhanced Frostbite engine. Pre-order FC 24 now: http://x.ea.com/77068Learn more about the new gameplay features in EA SPORTS FC 24, launching September 29: http://x.ea.com/77086Pre-order EA SPORTS FC™ 24 Ultimate Edition by 22 August to get a UEFA Champions League or UEFA Women’s Champions League Ultimate Team™ Hero Item on 27 November**: http://x.ea.com/77068CHAPTERS:0:00 - Intro0:24 - HyperMotionV3:15 - PlayStyles6:34 - FrostbiteSubscribe to see more from EA SPORTS FC™: http://bit.ly/pzw4VD#FC24"
"ZZoOPTkXBI4","27-0 win | All Goals & Highlights | FC Rottach-Egern - FC Bayern","2023-07-18T20:17:27Z","UCZkcxFIsqW5htimoUQKA0iA","FC Bayern München","17","23.20.07","FC Bayern München|Bayern Munich|FCB|FC Bayern|Fußball|Football|Soccer|Bayern Highlights|27-0|All Goals|Alle Tore|Musiala|Sabitzer|Mane|Gnabry|Tel|Laimer","1789586","34184","0","2283","https://i.ytimg.com/vi/ZZoOPTkXBI4/default.jpg","False","False","FC Bayern beat Rottach-Egern 27-0 in their first game of pre-season at their Tegernsee training camp. Head coach Thomas Tuchel started with a strong line-up of Sven Ulreich in goal, a back four of Noussair Mazraoui, Dayot Upamecano, Benjamin Pavard and Alphonso Davies. Konrad Laimer was handed his debut in midfield alongside captain Joshua Kimmich. The front four consisted of Leroy Sane, Jamal Musiala, Mathys Tel and Serge Gnabry. New defender Minjae Kim was not involved but in attendance to watch just hours after his signing was announced.► Wanna see more of Musiala, Müller, Davies & Co.? Subscribe now and hit the bell 🔔: https://fc.bayern/YouTubeAboFC Bayern Matchday Center: https://www.youtube.com/c/FCBayernMatchdayCenterFacebook: https://www.facebook.com/FCBayernTwitter: https://twitter.com/fcbayernInstagram: https://www.instagram.com/fcbayernTikTok: https://www.tiktok.com/@fcbayernSnapchat: https://fc.bayern/FCBayernSnapsWebsite: https://fcbayern.comFC Bayern.tv: https://fcbayern.com/fcbayerntvFC Bayern.tv live: https://fcbayern.com/fcbayerntv/de/fcbayerntvliveFC Bayern Newsletter: https://fc.bayern/newsletter_youtube"
"falOjDvWyxU","ANDIE ELLA BALANCE SON FRIGO ! (accro au PRINGLES ? des pâtes à la VODKA ?) ft. @andieella","2023-07-17T16:30:55Z","UCIPbzkl1kZ_9Gyuph_FGvzg","Juju Fitcats","24","23.20.07","jujufitcats|andie ella|jujufitcats andie ella|jujufitcats andie ella je mange comme|jujufitcats balance son frigo|jujufitcats balance ton frigo|andie ella balance son frigo|andie ella balance son frigo jujufitcats|andie ella balance son frigo pates a la vodka|andie ella balance son frigo pates a la vodka jujufitcats|accro au pringles|andie ella addiction pringles|chips pringles","386101","15880","0","558","https://i.ytimg.com/vi/falOjDvWyxU/default.jpg","False","False","#balancetonfrigo #andieellabalancesonfrigo Dans le frigo de @andieella... Andie : Balance ton Frigo ! Notre vidéo sur la chaîne d'Andie  ➤ https://www.youtube.com/watch?v=-AtuYs-AXkg&t=657sMon livre SANS FILTRE dispo en précommande ➤ https://bit.ly/3CVv2QFMusique Belle Au Naturel sur toutes les plateformes de streaming ➤ https://smarturl.it/BelleAuNaturelABONNEZ-VOUS A MA CHAÎNE ➤ http://bit.ly/2x0Brfp​​​​​​​​​​​ ➤ DEVENEZ LE MEILLEUR FITCAT !Collection BELLE AU NATUREL ➤ https://jujufitcats.comN'hésitez pas à me suivre sur mes différents réseaux sociaux :- Instagram ➤ https://www.instagram.com/jujufitcats...- Twitter ➤ https://twitter.com/jujufitcats/​​​​​...- Facebook ➤ https://www.facebook.com/jujufitcatsa....- Snapchat ➤ @jujufitcats- TiK TOK ➤ @jujufitcatsMa boîte postale :JUJU FITCATSBP 6005691470 LIMOURSMon adresse e-mail (contacts pros uniquement) ➤ jujufitcatspro@gmail.comCameraman : Elliot LeCorreMonteur : Freddy MettlerMusiques : Benoît Ghio Si vous êtes arrivés jusqu'ici, écrivez MAAANGEEER ! dans les commentaires !"
"eiv4Q9rKZn8","Ronisia - C'est toi (Audio)","2023-07-18T22:00:30Z","UCj9gYDjpUtrgHqMyJLfsoSw","RonisiaVEVO","10","23.20.07","C'est toi|Epic|R&B/Soul|Ronisia","49452","4310","0","195","https://i.ytimg.com/vi/eiv4Q9rKZn8/default.jpg","False","False","Music video by Ronisia performing C'est toi (Audio). (C) 2023 Epic Records France - a division of Sony Music Entertainment France SAShttp://vevo.ly/l1vrUx"
"NVTB5az1TPQ","Jane Birkin évoque sa première nuit avec Serge Gainsbourg - Vivement Dimanche 14 octobre 2018","2023-07-17T12:53:06Z","UCDA0UZOAbEv0Lc6todGs43Q","Vivement Dimanche ","24","23.20.07","michel drucker|canapé rouge|vivement dimanche|france 3|stars|célébrité|rires|rire|blague|Jane Birkin|jane|birkin|jane birkin|gainsbourg|hommage|décès|santé|charlotte|anglaise|76|lou doillon|kate barry|journal intime|confidence|confession|serge gainsbourg|rencontre|première rencontre|première nuit|chez Régine","274619","704","0","81","https://i.ytimg.com/vi/NVTB5az1TPQ/default.jpg","False","False","+ de Vivement Dimanche : https://www.france.tv/france-3/vivement-dimanche/Abonnez-vous : https://bit.ly/3U7BygvJane Birkin évoque sa première nuit avec Serge Gainsbourg - Vivement Dimanche 14 octobre 2018Vivement dimanche sur France 3, que les téléspectateurs retrouvent de 13.30 à 15.00 chaque dimanche, reste fidèle à son concept célèbre et populaire. Dans ce rendez-vous incontournable, Michel Drucker met en lumière les talents d’hier, d’aujourd’hui et de demain : chanteurs, acteurs, humoristes..."
"ukYaTF7fnG8","J’ai Construit une Maison avec les Blocs les plus Rares de Minecraft..","2023-07-18T15:00:45Z","UC0OQ6-y4ru8l_laBZW-2KHQ","Axyo","20","23.20.07","Minecraft|Minecraft fr|Axyo|Axio|Kamoof smp|axyo kamoof smp|axyo minecraft","73102","2376","0","101","https://i.ytimg.com/vi/ukYaTF7fnG8/default.jpg","False","False","#kamoofsmp Aujourd'hui J’ai Construit une Maison avec les Blocs les plus Rares de Minecraft, on est passé d'une simple laine rose à l’œuf de dragon (que j'ai du voler à mybios.., heureusement que wyktaur était là 👀 )Concept Inspirée de : SirSwagalishus Participants : Mybios, Wyktaur (y'a aussi Multicort Laylo Sohran et Zakyphren dans le serveur)Mes vidéos qui pourrait te plaire :J’ai Utilisé une IA pour Refaire les mobs de Minecraft… (avec Sohran)/J’ai TRICHÉ en utilisant des Astuces de Noël en Build… (avec WYktaur)/J'ai dressé 1032 Loups afin de Battre ce Joueur sur Minecraft.. (avec (presque) tout le kamoof smp)Abonne Toi !J'suis la aussi :-Discord : https://discord.gg/HhMuz7MdpN-Twitter : https://twitter.com/Axyoo1-Twitch : https://www.twitch.tv/axyoo- Instagram : https://instagram.com/axyoboss"
"PsLffmRvz90","IMPOSSIBLE QUE ÇA SOIT VRAI ! (et pourtant)","2023-07-16T11:00:18Z","UCow2IGnug1l3Xazkrc5jM_Q","JOYCA","24","23.20.07","Joyca|video|reaction|Français|fake news|news|mastu|vrai ou faux","2115665","166616","0","1581","https://i.ytimg.com/vi/PsLffmRvz90/default.jpg","False","False","On doit deviner si ces articles de presse sont vrai ou faux avec ​⁠@Mastu ! Lien de téléchargement des rushs fond vert (81 Go) : https://we.tl/t-bMopEO42Z7Lien de téléchargement léger des rushs fond vert     (2 Go) :  https://we.tl/t-uyzQ001oBkMontage : Larsen👉 LIVE/TWITCH : https://www.twitch.tv/joyca/videos👉 INSTAGRAM : Joyca👉 TWITTER : https://twitter.com/JoycaOff👉 TIK TOK : @joycaledelire_______👉 JOYCA MUSIC : https://www.youtube.com/channel/UCZakU1z0jijzvw940Hwmlxg/👉 LIL JOYCA : https://www.youtube.com/channel/UCgANFlYnbE47942AoazfNsg➤➤➤ Pour toutes demandes professionnelles ou commerciales : contact.joyca@gmail.com"
"_hWc3MsEraE","TOUR DE FRANCE 2023 - Pogacar choqué par l'écart du chrono : Je pensais être en jaune ce soir","2023-07-18T17:30:06Z","UCozt5iXNqmhU1I7tcjJ0UFQ","Eurosport France","17","23.20.07","cyclisme|Eurosport|eurosport France|Tour de France 2023|Tour de France 2023 parcours|eurosport cyclisme|tour de france 2023 highlights|pogacar|tour de france direct|tour de france 2023 résumé|tour de france 2023 reaction|vingegaard pogacar|pogacar interview|pogacar attack|chute tour de france|16e étape tour de france|pogacar moto|contre-la-montre tour de france|vingegaard contre-la-montre|vingegaard tour de france|vingegaard pogacar contre-la-montre","173600","1693","0","590","https://i.ytimg.com/vi/_hWc3MsEraE/default.jpg","False","False","Deuxième du contre-la-montre de la 16e étape du Tour de France 2023, Tadej Pogacar (UAE) a concédé 1min38s sur le maillot jaune Jonas Vingegaard (Jumbo-Visma) au classement général. Même s'il a avoué ne pas s'est bien senti sur la fin de course, le Slovène a été surpris de l'écart entre lui et le Danois, révélant même s'être imaginé en jaune ce mardi soir avant le départ du chrono.Abonnez-vous à notre chaîne 👉 https://bit.ly/3OetlmTSuivez les meilleurs évènements sur Eurosport Player 👉 https://bit.ly/3xS2XtyTéléchargez notre appli pour iPhone 👉 https://apple.co/3MNSALGTéléchargez notre appli pour Android 👉 https://bit.ly/3MNSBiIToute l'actualité du sport 👉 https://www.eurosport.fr"
"qMwL6ljr2r4","FAST FOOD vs LUXE !! (avec Lonni et Yass)","2023-07-17T16:38:38Z","UCHmMvgJsdYk-WBh-SePzmLA","Snaptrox","23","23.20.07","snaptrox|fast food vs luxe|Xavier pincemin|étoilé ou surgelé|burger 5€ vs burger 500€|yass encore|lonni|yass react|lonni nouvelle école|hotel luxe|mr beast","348932","33034","0","399","https://i.ytimg.com/vi/qMwL6ljr2r4/default.jpg","False","False","aujourd’hui avec @kidlonni et @YassEncore  on teste des fast food vs plats de luxe (5€ vs 500€) chez le chef  @xavierpincemin658 !! abonnez vous fort à ces big boss ÉPISODE 1 : https://youtu.be/exrUasfwJb8LIKE ET COMMENTE pour plus de vidéo !TIK TOK : https://www.tiktok.com/@snaptrox__INSTAGRAM : https://www.instagram.com/snaptrox__TWITCH : https://www.twitch.tv/snaptroxTWITTER : https://twitter.com/SnaptroxLONNI: https://www.youtube.com/@kidlonniYASS: https://www.youtube.com/@YassEncoreXAVIER PINCEMIN: https://www.youtube.com/@xavierpincemin658contact : snaptroxpro@outlook.frmontage : shizoochargé de prod: keziahcadrage : ms corpcadrage : warren v étalonnage: ms corpassistant real: noaminiature : brisseu / yuma"
"jQirmMacv74","DISNEYLAND PARIS SE MOQUE DE NOUS .. !!","2023-07-18T15:00:37Z","UCDsqF-kL2i47_OQIZ8Pu1Dw","Wonder Hook","24","23.20.07","DISNEY|DISNEYLAND|PARIS|WONDER|HOOK|CALENDRIER|VLOG|ASTUCE|CONSEIL|ATTRACTION|DISNEYLAND PARIS|PARC D'ATTRACTION","81652","5400","0","1288","https://i.ytimg.com/vi/jQirmMacv74/default.jpg","False","False","Disneyland Paris augmente les prix, ils veulent une image premium, mais sont ils vraiment à laHauteur ..?------------------Lien de ma boutique : https://teespring.com/stores/wonder-shop-3N'hésitez pas à me suivre sur les réseaux sociaux! TWITTER : @Wonder_Hook INSTAGRAM : Wonder_Hook FACEBOOK : Wonder HookADRESSE MAIL : WonderHook@outlook.fr ADRESSE POSTALE : 1 Boulevard de Romainvilliers à Bailly Romainvilliers 77700 ------------------ MON MATÉRIEL DE TOURNAGE / MONTAGE :Caméra : Sony Zve10 / Insta 360Logiciel de montage : Sony Vegas Pro 13.0Micro : BlueYeti ------------------ MUSIQUE : DEAF KEV - Invincible----------------------------------- Abonnez-vous pour voir de nouvelles vidéos Disney."
"u0jCx45YFqM","Jane BIRKIN et Charlotte GAINSBOURG à Cannes (2021) : « L’amour nous unit pour toujours »","2023-07-18T17:09:15Z","UCtyZ1cGRbRnTGKok6RU9CwA","L'invité","25","23.20.07","TV5MONDE|Actualité|Patrick Simonin|L'invité","69406","970","0","133","https://i.ytimg.com/vi/u0jCx45YFqM/default.jpg","False","False","Tous les jours, à 18h50 (heure de Paris), Patrick Simonin reçoit les personnalités qui font l'actualité sur TV5MONDE.Retrouvez toutes les émissions sur http://www.tv5monde.com/linviteL'Invité est sur les réseaux sociaux : Facebook : https://www.facebook.com/LInvite-166784776680731/Twitter : https://twitter.com/PatrickSimoninL'Invité sur TV5MONDE, c'est tous les jours : France / Belgique / Suisse : 18H50 heure de Paris.Europe : 18h30 heure de Paris.Afrique : 17h50 heure de Dakar.Maghreb/Orient : 20h20 heure de Beyrouth.Asie : 08h20 heure de BangkokPacifique :  12h20 heure de Tokyo.Etats Unis : 13h45 heure de New York.Amérique Latine: 14h45 heure de Buenos Aires."
"fxwCMhVdkEQ","Ce soir dans votre TV 2 - Palmashow","2023-07-19T07:53:30Z","UCoZoRz4-y6r87ptDp4Jk74g","Palmashow","23","23.20.07","[none]","581656","39370","0","453","https://i.ytimg.com/vi/fxwCMhVdkEQ/default.jpg","False","False","Dernier sketch tiré de Ce Soir C'est Palmashow 2. À la prochaine les amis Retrouve le Palmashow sur ses réseaux sociauxInstagram : https://www.instagram.com/palmashow_officiel/Tiktok : https://www.tiktok.com/@palmashow_officielFacebook : https://www.facebook.com/palmashowTwitter : https://twitter.com/palmashow"
"tij-VErYIlc","7 jours en Van pour faire le Tour de France (Ft. GMK)","2023-07-15T12:30:27Z","UCL9aTJb0ur4sovxcppAopEw","Inoxtag","24","23.20.07","INOXTAG|INOX|CROUTON|inox caravane|inox gmk|inox gmk caravane|Tour de France gmk inox|Tour de France inoxtag","4173110","629090","0","7933","https://i.ytimg.com/vi/tij-VErYIlc/default.jpg","False","False","Hello tout le monde!! Nouvelle vidéo avec mon grand golem géant Royal!! On a parcouru un chemin pour pouvoir vous montrer la beaute de notre pays! Faire le Tour de France en caravane avec GMK qui l’eu cru? Merci a Kinder Bueno glaces d’avoir sponsorisé la vidéo et de nous avoir régalé pendant le voyage ! Pour votre santé, pratiquez une activité physique régulière. www.mangerbouger.fr# collaborationcommerciale​⁠@kinderbuenofr Un concept d’Inoxtag Production : Talent Manager : Thomas Lescurieux Chargé de Prod : Mathieu Caquelard Directeur de clientèle influence : Ferdinand MaupinDirectrice Delivery Influence : Justine OriolCheffe de projet : Marie JegouPost-Production Chef Monteur : AeronDérusheur : SpyroMotion design : Arthur & Késiah Miniature : AziatackRemerciement : GMKKinder BuenoL’office de tourisme de NoirmoutierLe. Permacultueur CBX🎥 Chaîne secondaire : https://inoxtag.tv/inoxtag2.0💙 T'abonner : https://inoxtag.tv/subscribe🔔✅ Activez la cloche de notification, afin d'être au courant de mes prochains lives ou vidéos !📸 Instagram: @Inoxtag / https://inoxtag.tv/instagram🐤 Twitter: @Inoxtag / https://inoxtag.tv/twitter🚀 Actualités: @InoxtagCrew / https://inoxtag.tv/news📞 Discord: https://inoxtag.tv/discord💜 Twitch: https://inoxtag.tv/twitch📡 Reddit: https://inoxtag.tv/reddit💎 Deviens Sponsor: https://inoxtag.tv/sponsor💌 SponsorShip : inoxtag@talentweb.frl"
"zuu1bVJL8Sg","Bovann - C’est mon Ami ft Axel Merryl & TMA Crush (Official Video)@AxelmerrylVrai @tmacrush7719","2023-07-17T15:00:10Z","UCqBiDK5hYpaBg1aeVjy42Fg","Bovann","10","23.20.07","Axel|Axel Merryl|Ami|Amitié|C‘est mon Ami|Thema|TMA|Crush|Bovann|Tiktok","778527","83650","0","6588","https://i.ytimg.com/vi/zuu1bVJL8Sg/default.jpg","False","False","L’amitié implique souvent un partage de valeurs morales communes. Une relation d'amitié peut prendre différentes formes ; l'entraide, l'écoute réciproque, l'échange de conseils, le soutien, la critique bienveillante, l'admiration pour l'autre, en passant par le partage de loisirs."
