video_id,title,publishedAt,channelId,channelTitle,categoryId,trending_date,tags,view_count,likes,dislikes,comment_count,thumbnail_link,comments_disabled,ratings_disabled,description
"c9_20kflptY","I spent a day with KRIS TYSON","2023-07-21T18:00:16Z","UCPJHQ5_DLtxZ1gzBvZE99_g","AnthonyPadilla","27","23.22.07","anthony padilla|padilla|anthony|i spent a day with|interview","785240","81493","0","25741","https://i.ytimg.com/vi/c9_20kflptY/default.jpg","False","False","⭐️ Become a member and watch this series UNCENSORED & AD FREE: https://www.youtube.com/anthonypadilla/join. I spent a day with Kris Tyson to learn her truth.▸This episode is sponsored by Betterhelp - go to http://betterhelp.com/padilla to get 10% off your first month. ▸Go to http://liquidiv.com and use code PADILLA to get 20% off.🎙THE PODCASTSpotify ▸ https://open.spotify.com/show/5aOLuPenneHbhLh05fmkeu  Apple ▸ https://podcasts.apple.com/us/podcast/i-spent-a-day-with/id1550213250  💥NEW YOUTOOZ FIGURE: https://youtooz.com/products/anthony-padilla 🧨HUGE thank you to Kris:▸TWITTER -  https://twitter.com/christhealtgod?s=21▸INSTAGRAM - https://instagram.com/chris_thememegod?igshid=OGQ5ZDc2ODk2ZA==▸THREADS - https://www.threads.net/@chris_thememegod🗯MORE EPISODES…▸ TRANSWOMEN - https://youtu.be/6J5ZJJs7H8g▸ TRANSMEN - https://youtu.be/hZQ5B3DdLSY▸ NON BINARY - https://youtu.be/LzEWEQiytoQ🎥Crew▸ Creator, Director, Writer, etc - Anthony Padilla▸ Executive Producer - Alessandra Catanese▸ Producer/ Social Media Manager - Mallory Myers▸ Production Coordinator - Joshua Dozier▸ Director of Photograph  - Matthew Faulkner▸ Camera Operator - Josh Kirkwood▸ Post Supervisor - Mike Criscimagna AKA Mork Crispy▸ Head Editor - Patrick Horba▸ Editor - Ash Duckworth▸ Editor - Nikki Blacklock▸ Sound Mixing - Major Latimer▸ Sound Supervisor - Gareth Hird ▸ Sound Editor - Jandre van Heerden▸ Assistant Editor - Levi Villalpando▸ Social Media Editor - Cassie Korn▸ Captions - Davy Gerichten🎵Theme Music Composer - Matt Good AKA The King of Emo 🖼Portrait painted by: Rhianna Robles - https://instagram.com/zerogattsu🦥Slade mascot built by: The Pastel Prince - https://youtube.com/channel/UC7wq2U4FF2NyZD1o_P8QP0g 📢BE ON THE SHOW▸ If you are part of an underrepresented subculture or live a lifestyle you feel is not widely understood and would like to be interviewed by me, email inquiry[at]pressalike.com with your subculture in the title of the email.❗️You dug this deep into the description. You owe it to yourself to subscribe ▶ https://youtube.com/subscription_center?add_user=AnthonyPadilla or get more at http://instagram.com/anthonypadilla & http://twitter.com/anthonypadilla0:00 INTRODUCTION3:34 KRIS'S GENDER5:30 THE PUBLIC'S REACTION6:46 COMING OUT9:24 HORMONE REPLACEMENT THERAPY14:00 ACCEPTING MYSELF17:58 WHY IT'S BIG NEWS21:08 TELLING MY FRIENDS25:27 SPONSOR27:25 CHANGING MY NAME29:37 CHANGING MY VOICE32:46 WHAT'S NEXT34:20 BLOOPER"
"_kS7F4VpJa0","Travis Scott, Bad Bunny, The Weeknd - K-POP (Official Music Video)","2023-07-21T16:00:26Z","UClRx3MMyYUyqOxyEqA5F2nQ","TravisScottVEVO","10","23.22.07","bad bunny|utopia|travis scott utopia|utopia travis scott|the weeknd|travis scott bad bunny|k-pop|kpop|travis scott k-pop|travis scott kpop|Lo mejor de Travis Scott|Éxitos de Travis Scott|Canción de Travis Scott|Video de Travis Scott|melhor de Travis Scott|Sucessos de Travis Scott|Vídeo de Travis Scott|Música de Travis Scott|highest in the room|Sicko Mode|goosebumps|Birds in the Trap|through the late night|Rodeo|new","3945405","264172","0","13876","https://i.ytimg.com/vi/_kS7F4VpJa0/default.jpg","False","False","Travis Scott, Bad Bunny & The Weeknd - K-POP (Official Music Video)K-POP available at: https://TravisScott.lnk.to/K-POPDirected by Travis ScottTravis Scott online:https://shop.travisscott.com/https://twitter.com/trvisXXhttps://www.instagram.com/travisscott/https://soundcloud.com/travisscott-2https://www.facebook.com/travisscottlaflamehttps://travisscott.com/(C) 2023 Cactus Jack Records under exclusive license to Epic Records, a division of Sony Music Entertainment#TravisScott #BadBunny #TheWeeknd #KPOP"
"YrdQI3nqh7A","Drake: “You a th*t, Bobbi","2023-07-20T20:37:59Z","UCR6JgrsJ3RZKO8_eD7LNq_A","Bobbi Althoff","22","23.22.07","drake|podcast|bobbi|boobi althoff|aubrey graham|the really good podcast|really good podcast|very good podcast|the good podcast|the really really good podcast|bobby althoff|tyga","1975760","110281","0","8387","https://i.ytimg.com/vi/YrdQI3nqh7A/default.jpg","False","False","From the comfort of his bed, Bobbi talks to Aubrey: a rapper and/or singer and/or musician, author, and very rich and famous person. How much is Drake really worth? What are his marriage plans? His kinks? Amazingly enough, he's decided to unveil all of the answers to Bobbi Althoff."
"bgqGdIoa52s","Marvel's Spider-Man 2 - Story Trailer | PS5 Games","2023-07-20T22:25:58Z","UC-2Y8dQb0S6DtpxNgAKoJKA","PlayStation","20","23.22.07","PlayStation|PS5|video games|next gen|Sony|#SpiderMan2PS5|#BeGreaterTogether|Action Adventure|Spider-Man|story|peter parker|venom|miles morales|kraven","5731393","338681","0","17641","https://i.ytimg.com/vi/bgqGdIoa52s/default.jpg","False","False","https://www.playstation.com/en-us/games/marvels-spider-man-2/We’re going to heal the world. The Spider-Men, Peter Parker and Miles Morales, enter new chapters in their lives as they balance their responsibilities as protectors of Marvel’s New York. As Harry Osborn, Peter’s best friend, returns into his life, and Miles looks to build his future beyond high school, the relationship between our heroes is tested and strained as the Symbiote appears to threaten them, the city, and the ones they love.Developed by Insomniac Games in collaboration with Marvel Games and PlayStation, Marvel’s Spider-Man 2 continues the saga of the critically acclaimed Marvel’s Spider-Man franchise.For more information, follow Insomniac Games on social media:  - twitter.com/InsomniacGames- instagram.com/InsomniacGames- facebook.com/InsomniacGames- discord.gg/InsomniacGames#ps5 #ps5games #spiderman #spiderman2"
"wS_qbDztgVY","Marvel Studios' The Marvels | Official Trailer","2023-07-21T04:00:38Z","UCvC4D8onUfXzvjTOM-dBfEA","Marvel Entertainment","24","23.22.07","marvel|comics","11117666","148976","0","11754","https://i.ytimg.com/vi/wS_qbDztgVY/default.jpg","False","False","This fall, The Marvels take flight.Carol Danvers aka Captain Marvel has reclaimed her identity from the tyrannical Kree and taken revenge on the Supreme Intelligence. But unintended consequences see Carol shouldering the burden of a destabilized universe. When her duties send her to an anomalous wormhole linked to a Kree revolutionary, her powers become entangled with that of Jersey City super-fan, Kamala Khan aka Ms. Marvel, and Carol's estranged niece, now S.A.B.E.R. astronaut Captain Monica Rambeau. Together, this unlikely trio must team-up and learn to work in concert to save the universe as The Marvels.Marvel Studios' The Marvels stars Brie Larson, Teyonah Parris, Iman Vellani, Zawe Ashton, Gary Lewis, Park Seo-joon, Zenobia Shroff, Mohan Kapur, Saagar Shaikh, and Samuel L. Jackson.Nia DaCosta directs with Kevin Feige producing. Louis D'Esposito, Victoria Alonso, Mary Livanos, Jonathan Schwartz and Matthew Jenkins serve as executive producers. The screenplay is by Megan McDonnell, Nia DaCosta, Elissa Karasik and Zeb Wells. ► Watch Marvel on Disney+: https://bit.ly/2XyBSIW► Subscribe to Marvel on YouTube: http://bit.ly/WeO3YJFollow Marvel on Twitter: ‪https://twitter.com/marvelLike Marvel on Facebook: ‪https://www.facebook.com/marvelWatch Marvel on Twitch: https://www.twitch.tv/marvelReward your Marvel fandom by joining Marvel Insider!Earn points, then redeem for awesome rewards.Terms and conditions apply. Learn more at https://www.marvel.com/insider?Osocial=YT&CID=MarvelInsiderFor even more news, stay tuned to:Tumblr: ‪http://marvelentertainment.tumblr.com/Instagram: https://www.instagram.com/marvelPinterest: ‪http://pinterest.com/marvelofficialReddit: http://reddit.com/u/marvel-official"
"Bsb9T1g5nlE","I ate at every Margaritaville in the Country","2023-07-20T16:00:18Z","UCuo9VyowIT-ljA5G2ZuC6Yw","Eddy Burback","23","23.22.07","[none]","2129547","155180","0","13045","https://i.ytimg.com/vi/Bsb9T1g5nlE/default.jpg","False","False","Thanks to SoFi for sponsoring the video! Enter to win $10,000: https://sofi.com/eddyOpen a Checking and Savings account to enter. No purchase necessary. See Rules for info & free entry method.merch - https://www.yikesshop.com/my other channel - https://www.youtube.com/channel/UCJHM5IJ44__fkOxkD4vxoBwInstagram - https://www.instagram.com/eddyburbackTwitter - https://twitter.com/eddyburback@TedNivison @Burback @NakeyJakey @jarvis @JordanAdika @drewisgooden @jschlatt @Danny-Gonzalez"
"sJ8Fu_Yz884","I Built the SNIFFER in Minecraft Hardcore","2023-07-21T12:00:46Z","UCIVSqoHCUN1XdEpiVItxfoQ","aCookieGod","20","23.22.07","acookiegod|a cookie god|a cookie god minecraft|cookie minecraft|minecraft cookie|minecraft cookie god|cookie god|acookiegod series|acookiegod hardcore|minecraft hardcore|hardcore minecraft|minecraft|extracookie|minecraft sniffer|i built the sniffer in minecraft hardcore|i built a sniffer statue in minecraft hardcore|minecraft sniffer statue","1276333","44081","0","3871","https://i.ytimg.com/vi/sJ8Fu_Yz884/default.jpg","False","False","Building a SNIFFER STATUE in Hardcore Minecraft📽️ Watch BONUS VIDEO: https://youtu.be/G_kS-c_oguM🔥 Watch From EPISODE #1: https://www.youtube.com/watch?v=EDYifz45dhU&list=PLqyCqmSEa8cTmHfheGsE70w9uzcas3BFH📺 Watch my LAST EPISODE: https://youtu.be/MUYpeX74dGE(I Played the NEW 1.20 Update in Minecraft Hardcore #40)➖➖➖➖➖➖➖➖➖⭐ FOLLOW ME:🐤 » Twitter: https://twitter.com/aCookieGod📷 » Instagram: https://www.instagram.com/aCookieGod/💬 » Discord Server: https://discord.gg/cookiearmy👕 » COOKIE MERCH: https://acookiegod.shop/➖➖➖➖➖➖➖➖➖》All music by Kevin Macleod is licensed under a Creative Commons Attribution 4.0 license.Link to Artist: https://incompetech.com/music/This MINECRAFT HARDCORE SERIES is inspired by Wadzee, MumboJumbo, Grian, and sandiction! Instead of being the Hermitcraft SMP, this series is similar to a MINECRAFT CHALLENGE video because it is HARDCORE MINECRAFT! This is similar to my 100 DAYS in MINECRAFT HARDCORE but better! :)I Built the SNIFFER in Minecraft Hardcore➖➖➖➖➖➖➖➖➖#minecraft #hardcore #but"
"bC36d8e3bb0","Kalki 2898 AD Glimpse | Prabhas | Amitabh Bachchan | Kamal Haasan | Deepika Padukone | Nag Ashwin","2023-07-20T19:20:11Z","UC70pKToywlxOGdgIvz8gYqA","Vyjayanthi Network","1","23.22.07","Project K|prabhas|deepika padukone|prabhas project k|nag ashwin|prabhas nag ashwin movie|vyjayanthi movies|Amitabh Bachchan|kamal haasan|Ulaganayagan|kamal haasan prabhas|Santhosh Narayanan|Project K Glimpse|Kalki 2898 AD Glimpse|kalki|kalki glimpse|project k teaser|Kalaki glimpse|prabhas kalki glimpse|kalki movie|prabhas kalki teaser|kalki movie glimpse|Kalki 2898 AD|KALKI Glimpse|prabhas comic con|comic con project k|comic con kalki 2898 ad","15365446","753351","0","43279","https://i.ytimg.com/vi/bC36d8e3bb0/default.jpg","False","False","𝐏𝐑𝐎𝐉𝐄𝐂𝐓-𝐊 is now #Kalki2898AD 💥#KalkiGlimpse #Prabhas #AmitabhBachchan #KamalHaasan #DeepikaPadukone #NagAshwin #VyjayanthiMoviesProduced By Vyjayanthi MoviesDirected by Nag AshwinCast: Prabhas, Amitabh Bachchan, Kamal Haasan, Deepika Padukone, Disha Patani and othersDirector of Photography: Djordje StojiljkovicMusic by: Santhosh NarayananProducer: Chalasani Aswani DuttBanner: Vyjayanthi MoviesPRO: Vamsi - ShekarDigital Media PR & Marketing Head: Prasad BhimanadhamDigital Partner: Silly MonksFor more updates:Subscribe us on Youtube: https://www.youtube.com/VyjayanthiNetwork?sub_confirmation=1Like us on Facebook: https://www.facebook.com/VyjayanthiMoviesFollow us on Twitter: https://twitter.com/VyjayanthiFilmsFollow us on Instagram: https://instagram.com/vyjayanthimovies"
"Nj9Oy2Jx2dM","I Drove to Every Margaritaville in the USA","2023-07-20T19:03:55Z","UCJGgP4txIUr_7JTDvOGVQrA","Ted Nivison","23","23.22.07","JehBerDeh|TedNivison|Ted|Nivison|Ted Nivision|Nivision|Nvision","1359934","133537","0","8039","https://i.ytimg.com/vi/Nj9Oy2Jx2dM/default.jpg","False","False","Thanks to SoFi for sponsoring the video! Learn more about financing your education at: https://sofi.com/tednivisonMERCH AVAILABLE NOW: https://ted.store/@EddyBurback and I embarked once again on the trip of a lifetime, to every Margaritaville in the United States in Canada. The tale of a glorious road trip across the country. Thanks to everyone who had fun with us on this trip!@jschlattLIVE @Danny-Gonzalez @Burback @EddyBurback @jarvis @NakeyJakey @JordanAdika @drewisgooden ► ALL MY SOCIALS: https://linktr.ee/tednivisonHave an idea you want covered? Submit here: https://forms.gle/wzbXDHqEZZJHwz958Custom Music by Oval:  @OvalMusic  Outro: Pls Proceed by Baron GrandRoyalty Free Music by http://www.epidemicsound.com/"
"XOQcDjRUJHA","Travis Scott, Bad Bunny, The Weeknd - K-POP (Official Audio)","2023-07-21T04:00:15Z","UClRx3MMyYUyqOxyEqA5F2nQ","TravisScottVEVO","10","23.22.07","bad bunny|utopia|travis scott utopia|utopia travis scott|the weeknd|travis scott bad bunny|k-pop|kpop|travis scott k-pop|travis scott kpop|Lo mejor de Travis Scott|Éxitos de Travis Scott|Canción de Travis Scott|Video de Travis Scott|melhor de Travis Scott|Sucessos de Travis Scott|Vídeo de Travis Scott|Música de Travis Scott|highest in the room|Sicko Mode|goosebumps|Birds in the Trap|through the late night|Rodeo|new","1809089","200163","0","14045","https://i.ytimg.com/vi/XOQcDjRUJHA/default.jpg","False","False","Travis Scott, Bad Bunny & The Weeknd - K-POP (Official Audio)K-POP available at: https://TravisScott.lnk.to/K-POPTravis Scott online:https://shop.travisscott.com/https://twitter.com/trvisXXhttps://www.instagram.com/travisscott/https://soundcloud.com/travisscott-2https://www.facebook.com/travisscottlaflamehttps://travisscott.com/(C) 2023 Cactus Jack Records under exclusive license to Epic Records, a division of Sony Music Entertainment#TravisScott #BadBunny #TheWeeknd #KPOP"
"QvOr1-P6XR8","True Facts: Elephants","2023-07-21T16:00:28Z","UCVpankR4HtoAVtYnFDUieYA","Ze Frank","15","23.22.07","[none]","445816","40477","0","1753","https://i.ytimg.com/vi/QvOr1-P6XR8/default.jpg","False","False","Go to https://brilliant.org/zefrank to get a 30-day free trial + the first 200 people will get 20% off their annual subscription.merch: https://ze-true-store.myshopify.com/patreon: https://www.patreon.com/truefactsclassical music: https://soundcloud.com/querflote/5-au...sponsor music: https://incompetech.com/Thank you:Dr Andrew Schulz, Max Planck InstituteDr Caitlin O’Connell-Rodwell, Harvard UnivDr Joshua Plotnik, CUNYCaitlin Hawley, Arizona State UnivDr Julio de CastroDr David L. Hu, Georgia TechDr Jianing Wu, Georgia TechBernard Dupont, https://www.flickr.com/photos/berniedup/Michael Rose, https://www.instagram.com/michaelrose17/Tiffany Lo, https://www.instagram.com/tlotravels/Destination Uganda, https://www.youtube.com/@bekuthman2Mason Elephant Park & Lodge, masonelephantlodge.comWildest Kruger Sightings, https://www.youtube.com/@WildestKrugerSightings CitationsDale, R., Plotnik, J. Elephants know when their bodies are obstacles to success in a novel transfer task. Sci Rep 7, 46309 (2017). https://doi.org/10.1038/srep46309Deiringer, N et al. The functional anatomy of elephant trunk whiskers. Commun Biol. 2023 Jun 8;6(1):591. doi: 10.1038/s42003-023-04945-5. Foerder P, et al. Insightful problem solving in an Asian elephant. PLoS One. 2011;6(8):e23251. doi: 10.1371/journal.pone.0023251. Hoerner F, et al. Long-Term Olfactory Memory in African Elephants. Animals (Basel). 2023 Feb 15;13(4):679. doi: 10.3390/ani13040679Kaufmann, L.V., et al. Elephant Banana Peeling. Current Biology, 33, R239–R258, April 10, 2023. Lefebvre J, et al. Monitoring Thermoregulation Patterns in Asian Elephants (Elephas maximus) in Winter Months in Southwestern Ontario Using Infrared Thermography. Journal of Zoological and Botanical Gardens. 2023; 4(2):312-324. https://doi.org/10.3390/jzbg4020026Li LL, Plotnik JM, Xia SW, Meaux E, Quan RC. Cooperating elephants mitigate competition until the stakes get too high. PLoS Biol. 2021 Sep 28;19(9):e3001391. doi: 10.1371/journal.pbio.3001391Plotnik JM, et al. Elephants know when they need a helping trunk in a cooperative task. Proc Natl Acad Sci U S A. 2011 Mar 22;108(12):5116-21. doi: 10.1073/pnas.1101765108. Plotnik JM, et al. Self-recognition in an Asian elephant. Proc Natl Acad Sci U S A. 2006 Nov 7;103(45):17053-7. doi: 10.1073/pnas.0608062103. Martins AF, et al. Locally-curved geometry generates bending cracks in the African elephant skin. Nat Commun. 2018 Oct 2;9(1):3865. doi: 10.1038/s41467-018-06257-3. Myhrvold CL, et al. (2012) What Is the Use of Elephant Hair? PLoS ONE 7(10): e47018. https://doi.org/10.1371/journal.pone.0047018O'Connell-Rodwell CE. Keeping an ear to the ground: seismic communication in elephants. Physiology (Bethesda). 2007 Aug;22:287-94. doi: 10.1152/physiol.00008.2007. O'Connell-Rodwell CE, et al. Male African Elephant (Loxodonta africana) Behavioral Responses to Estrous Call Playbacks May Inform Conservation Management Tools. Animals (Basel). 2022 May 1;12(9):1162. doi: 10.3390/ani12091162. Phasukdee, N., et al. Comparative Anatomy and Histology of Elephant, Human, and Tree Shrew Brains. BSCM, Vol. 61 No. 4 (2022): October-December. DOI: 10.12982/BSCM.2022.24Schulz AK, Boyle M, Boyle C, Sordilla S, Rincon C, Hooper S, Aubuchon C, Reidenberg JS, Higgins C, Hu DL. Skin wrinkles and folds enable asymmetric stretch in the elephant trunk. Proc Natl Acad Sci U S A. 2022 Aug 2;119(31):e2122563119. doi: 10.1073/pnas.2122563119.Schulz Andrew K., Ning Wu Jia, Ha Sung Yeon Sara, Kim Greena, Braccini Slade Stephanie, Rivera Sam, Reidenberg Joy S. and Hu David L. 2021Suction feeding by elephantsJ. R. Soc. Interface.182021021520210215, http://doi.org/10.1098/rsif.2021.0215Schulz AK, Reidenberg JS, Ning Wu J, Ying Tang C, Seleb B, Mancebo J, Elgart N, Hu DL. Elephant trunks use an adaptable prehensile grip. Bioinspir Biomim. 2023 Feb 8;18(2). doi: 10.1088/1748-3190/acb477. Stoeger AS, Baotic A. Operant control and call usage learning in African elephants. Philos Trans R Soc Lond B Biol Sci. 2021 Oct 25;376(1836):20200254. doi: 10.1098/rstb.2020.0254. Stoeger AS, et al. An Asian elephant imitates human speech. Curr Biol. 2012 Nov 20;22(22):2144-8. doi: 10.1016/j.cub.2012.09.022. Stoeger AS, et al. Vocal Creativity in Elephant Sound Production. Biology (Basel). 2021 Aug 5;10(8):750. doi: 10.3390/biology10080750. Vollrath, F. Uncoupling elephant TP53 and cancer. Trends in Ecology & Evolution, VOLUME 38, ISSUE 8, P705-707, AUGUST 2023. https://doi.org/10.1016/j.tree.2023.05.011Weissengruber GE, et al. The structure of the cushions in the feet of African elephants (Loxodonta africana). J Anat. 2006 Dec;209(6):781-92. doi: 10.1111/j.1469-7580.2006.00648.xWu J, Zhao Y, Zhang Y, Shumate D, Braccini Slade S, Franklin SV, Hu DL. Elephant trunks form joints to squeeze together small objects. J R Soc Interface. 2018 Oct 24;15(147):20180377. doi: 10.1098/rsif.2018.0377."
"ea3hX2qV6qA","Ice Spice - Deli (Visualizer)","2023-07-21T04:00:31Z","UCCdbL-yl7Qa_vurbYWdn5SA","IceSpiceVEVO","10","23.22.07","Ice|Spice|Deli|(Visualizer)|10K|Projects/Capitol|Records|Hip|Hop","409026","37200","0","3496","https://i.ytimg.com/vi/ea3hX2qV6qA/default.jpg","False","False","Music video by Ice Spice performing Deli (Visualizer). 10K Projects/Capitol Records; © 2023 Dolo Entertainment, Inc., under exclusive license to UMG Recordings, Inc. & 10K Projects, LLC.http://vevo.ly/fATiIK"
"WJhTnAQVeHQ","I Tried CSI Academy","2023-07-21T15:00:22Z","UCGGZ_POGmIWG1pQXTDzQv-g","Michelle Khare","24","23.22.07","[none]","462032","28448","0","1421","https://i.ytimg.com/vi/WJhTnAQVeHQ/default.jpg","False","False","Thank you to Liquid I.V. for sponsoring today’s video! Use code MICHELLE20 or my link https://bit.ly/3pTnf4H to get 20% off, plus free shipping, on your next Liquid I.V. order! Lemon Lime Hydration Multipliers in Sugar-Free are also available to purchase in stores at Costco.💪🏽 Get my workout plans HERE ► https://MKfit.coINSTAGRAM ► https://www.instagram.com/michellekhareTWITTER ► https://twitter.com/MichelleKhareDISCORD ► https://discord.gg/FCMYanYAvjSPECIAL THANKS to the San Diego Police Department for making this experience possible. TEAM MK:Directed by Garrett Kennell ► http://www.instagram.com/garrettkennell​Edited by Ryan Forsythe ► https://www.instagram.com/ryan_forsythe/ Senior Producer - Nick Hurt ► https://www.tiktok.com/@very_cool_nickChief of Staff - Carissa S.Director of Photography - Kevin Stiller ► https://www.kevinstiller.com3D Animations by Ryan Gonzales ► https://twitter.com/ItsRyanGonzalesSound Design by Ryan Gonzales ► https://twitter.com/ItsRyanGonzalesColor by Ryan Forsythe ► https://www.instagram.com/ryan_forsythe/ Thumbnail designed by @venturepsdRole of the Suspect played by Steve M. RobertsonProduction and Post Production Audio Services Provided by Paper Mountain Post LLC - https://www.papermountainpost.co/Supervising Sound Editor: Christina Gonzalez MPSERe-Recording Mixer: Christina Gonzalez MPSE"
"918oGJFtjjw","ZAYN - Love Like This (Official Music Video)","2023-07-21T04:00:08Z","UCy5FUarBYUHFpPtYVuvzgcA","ZaynVEVO","10","23.22.07","Zayn|泽恩·马利克|제인 말릭|Zain|Zayn new music|lyric|zayn new video|zayn|zayn love like this|zayn new song|zayn malik|zayn call her daddy|zayn malik new music|zayn pop|zayn jon bellion|zayn malik 2023","2607654","352200","0","21624","https://i.ytimg.com/vi/918oGJFtjjw/default.jpg","False","False","Watch the official video for Love Like This by ZAYN.Stream/download Love Like This: https://zayn.lnk.to/lovelikethis Follow Zayn:https://instagram.com/zaynhttps://tiktok.com/@zaynhttps://facebook.com/zaynFollow inZAYN on Instagram: https://instagram.com/inzaynLYRICSOh I love it when you show, when you show, when you show that you got my backIf they ever try to roll, try to roll, try to roll on your name I blackHow you hit em with the clothes and the stare and the hips and the hair like thatGot me all up in the zone, in the zone, in the zone, in the zone likeI don’t wanna waste no timeI don’t wanna waste no time causeYou are the you are the crown andI just wanna take you time andEverything is on the line but IWould rather be deadIf its gonna mean a life thats lived without you by meI guess thats love like thisUsually I never wanna jump like thisBut I think I wanna dump my chips causeI can not go backI guess thats faith like thisGive you everything and you can skate like thisBut I think I gotta take that risk causeI can not go backAnd im loving what ya say, what ya say, what ya say, when your on my lineIf I never make it back, make it back, make it back from the chase im fineDoesn’t matter if its left or its right your direction is on my mindGot me all up in the zone, in the zone, in the zone, in the zone likeI don’t wanna waste no timeI don’t wanna waste no time causeYou are the you are the crown andI just wanna take you time andEverything is on the line but IWould rather be deadIf its gonna mean a life thats lived without you by meI guess thats love like thisUsually I never wanna jump like thisBut I think I wanna dump my chips causeI can not go backI guess thats faith like thisGive you everything and you can skate like thisBut I think I gotta take that risk causeI can not go backOne kiss I am wrapped2 4 6 my jack All I know is thatI can not go backOne kiss I am wrapped2 and I’m attachedAll I know is thatI can not go backI don’t wanna waste no time causeYou are the you are the crownEverything is on the line but IWould rather be deadIf its gonna mean a life thats lived without you babyI guess thats love like thisUsually I never wanna jump like thisBut I think I wanna dump my chips causeI can not go backI guess thats faith like thisGive you everything and you can skate like thisBut I think I gotta take that risk causeI can not go back#ZAYN #LoveLikeThis"
