video_id,title,publishedAt,channelId,channelTitle,categoryId,trending_date,tags,view_count,likes,dislikes,comment_count,thumbnail_link,comments_disabled,ratings_disabled,description
"-UJCMfuFtSQ","Harry Styles - Daylight (Official Video)","2023-07-19T16:00:07Z","UCbOCbp5gXL8jigIBZLqMPrw","HarryStylesVEVO","10","23.20.07","HarryStyles|Harry's House|HarrysHouse|May 20|new album|harry styles|Golden|FineLine|WatermelonSugar|Harry|Adore You|LightsUp|Cherry|Falling|Sunflower|TreatPeoplewithKindness|Line|Fine|Hstyles|kiwi|Canyon Moon|To Be So Lonely|You’re so Golden|as it was|asitwas|Music for sushi restaurant|love of my life|boyfriends|satellite|keep driving|matilda|little freak|grapejuice|daylight|late night talking|cinema","2620358","421752","0","17721","https://i.ytimg.com/vi/-UJCMfuFtSQ/default.jpg","False","False","Official Video for Daylight by Harry Styles.Harry's album Harry's House out now. Listen here:  https://hstyles.lnk.to/HarrysHouse Amazon Music: https://hstyles.lnk.to/HarrysHouse/AmazonMusicApple Music: https://hstyles.lnk.to/HarrysHouse/AppleMusicDeezer: https://hstyles.lnk.to/HarrysHouse/DeezeriTunes: https://hstyles.lnk.to/HarrysHouse/iTunesPandora: https://hstyles.lnk.to/HarrysHouse/PandoraSoundcloud: https://hstyles.lnk.to/HarrysHouse/SoundcloudSpotify: https://hstyles.lnk.to/HarrysHouse/SpotifyYouTube Music: https://hstyles.lnk.to/HarrysHouse/YouTubeMusic Follow Harry Styles:Facebook: https://HarryStyles.lnk.to/followFIInstagram: https://HarryStyles.lnk.to/followIITwitter: https://HarryStyles.lnk.to/followTIWebsite: https://HarryStyles.lnk.to/followWISpotify: https://HarryStyles.lnk.to/followSIYouTube: https://HarryStyles.lnk.to/subscribeYD Credits:Made with love by a creative team from Ukraine.Director: Tanu MuinoProducers: Bryan Younce, Frank Borin, Ivanna Borin, Mauricio Von TrappCreative Director: Molly HawkinsProduction Company: UnderWonder ContentDirector of Photograph: Nikita KuzmenkoProduction Designer: Spencer GravesEditor: Carlos Font ClosColorist: Joseph BicknellLyrics:I’m on the roof,You’re in your airplane seat,I was nose bleeding,Looking for life out there,Reading your horoscope,You were just doing cocaine in my kitchen,You never listen,I hope you’re missing me by now, If I was a bluebird,I would fly to you,You’d be the spoon,Dip you in honey so I could be sticking to you, Daylight,You got me cursing the daylight,Daylight,You got me cursing the daylight,Daylight,You’ve got me calling at all times,Ain’t gonna sleep ’til the daylight, Out of New York,I’m on the come down speed,We’re on bicycles,Saying there’s life out there,You’ve got the antidote,I’ll take one to go, go please,Get the picture,Cut out my middle,You ain’t got time for me right now, If I was a bluebird,I would fly to you,You’d be the spoon,Dip you in honey so I could be sticking to you, Daylight,You’ve got me calling at all times,Ain’t gonna sleep ’til the daylight,Daylight,You got me cursing the daylight,Daylight,You got me cursing the daylight,Daylight,You’ve got me calling at all times,Ain’t gonna sleep ’til the daylight, If I was a blue bird,I would fly to you,You’d be the spoon,Dip you in honey so I could be sticking to you,  #HarryStyles #HarrysHouse #Daylight"
"WkHrFn4Fx6Q","skibidi toilet 50","2023-07-19T08:10:00Z","UCsSsgPaZ2GSmO6il8Cb5iGA","DaFuq!?Boom!","24","23.20.07","toilet in ohio|skibidi meme|tiktok meme|sfm animation|funny animation|gmod animation|skibidi toilet vs cameramen|titan cameraman","23299401","1315682","0","161277","https://i.ytimg.com/vi/WkHrFn4Fx6Q/default.jpg","False","False","someone has finally awakenskibidi dop dop dop yes yesfull-screen versionRespectful assets used in the video:speakers - https://steamcommunity.com/sharedfiles/filedetails/?id=2680336465suits - https://steamcommunity.com/sharedfiles/filedetails/?id=2849230339(if you're author of certain assets and I didn't credit you properly, please contact me)Contact me:instagram.com/dafuqboomtvblugrayguy@gmail.com"
"Xzv84ZdtlE0","Why Oppenheimer Deserves His Own Movie","2023-07-18T23:28:16Z","UCHnyfMqiRRG1u-2MsSQLbXA","Veritasium","27","23.20.07","veritasium|science|physics","3115602","149547","0","8182","https://i.ytimg.com/vi/Xzv84ZdtlE0/default.jpg","False","False","J. Robert Oppenheimer forever changed the course of history. He may be the most important physicist to have ever lived. Part of this video is sponsored by Wren. Offset your carbon footprint on Wren: ​https://www.wren.co/start/veritasium1 For the first 100 people who sign up, I will personally pay for the first month of your subscription!If you want to learn more about Oppeheimer, I strongly recommend the book “American Prometheus” By Kai Bird and Martin Sherwin. It is a remarkable book, very much deserving of the Pulitzer prize it received.If you’re looking for a molecular modeling kit, try Snatoms – a kit I invented where the atoms snap together magnetically – https://ve42.co/SnatomsV▀▀▀A huge thank you to Dr. Martin Rohde and Dr. Antonia Denkova from the TU Delft for proofreading the script and providing valuable feedback.▀▀▀References:Bird, K., & Sherwin, M. J. (2021). American Prometheus: the triumph and tragedy of J. Robert Oppenheimer. Atlantic Books.Smith, A. K., & Weiner, C. (1980). Robert Oppenheimer: letters and recollections. Bulletin of the Atomic Scientists, 36(5), 19-27. - https://ve42.co/Smith1980 Combes, J. M., Duclos, P., & Seiler, R. (1981). The born-oppenheimer approximation. Rigorous atomic and molecular physics, 185-213. - https://ve42.co/Combes1981 Rhodes, R. (2012). The making of the atomic bomb. Simon and Schuster.Oppenheimer, J. R., & Volkoff, G. M. (1939). On massive neutron cores. Physical Review, 55(4), 374. - https://ve42.co/Oppenheimer1939b Oppenheimer, J. R. (1927). Bemerkung zur Zerstreuung der α-Teilchen. Zeitschrift für Physik, 43(5-6), 413-415. - https://ve42.co/Oppenheimer1927 Oppenheimer, J. R. (1927). Zur quantenmechanik der richtungsentartung. Zeitschrift für Physik, 43(1-2), 27-46. - https://ve42.co/Oppenheimer1927b Born, M., & Oppenheimer, R. (1927). Zur Quantentheorie der Molekeln Annalen der Physik, v. 84. - https://ve42.co/Born1927 Oppenheimer, J. R. (1928). Three notes on the quantum theory of aperiodic effects. Physical review, 31(1), 66.Oppenheimer, J. R. (1928). On the quantum theory of the capture of electrons. Physical review, 31(3), 349.Oppenheimer, J. R. (1931). Note on light quanta and the electromagnetic field. Physical Review, 38(4), 725.Furry, W. H., & Oppenheimer, J. R. (1934). On the theory of the electron and positive. Physical Review, 45(4), 245. - https://ve42.co/Oppenheimer1934 Oppenheimer, J. R. (1935). Note on charge and field fluctuations. Physical Review, 47(2), 144. - https://ve42.co/Oppenheimer1935 Oppenheimer, J. R., & Snyder, H. (1939). On continued gravitational contraction. Physical Review, 56(5), 455. - https://ve42.co/Oppenheimer1939 Oppenheimer, J. R., & Phillips, M. (1935). Note on the transmutation function for deuterons. Physical Review, 48(6), 500. - https://ve42.co/Oppenheimer1935b Malik, J. (1985). Yields of the Hiroshima and Nagasaki nuclear explosions (No. LA-8819). Los Alamos National Lab.(LANL), Los Alamos, NM (United States). - https://ve42.co/Malik1985 Ignition of the atmosphere with nuclear bombs -- https://ve42.co/Konopinski46▀▀▀Special thanks to our Patreon supporters:Adam Foreman, Amadeo Bee, Anton Ragin, Balkrishna Heroor, Benedikt Heinen, Bernard McGee, Bill Linder, Blake Byers, Burt Humburg, Dave Kircher, Diffbot, Evgeny Skvortsov, Gnare, John H. Austin, Jr., john kiehl, Josh Hibschman, Juan Benet, KeyWestr, Lee Redden, Marinus Kuivenhoven, Meekay, meg noah, Michael Krugman, Orlando Bassotto, Paul Peijzel, Richard Sundvall, Sam Lutfi, Stephen Wilcox, Tj Steyn, TTST, Ubiquity Ventures▀▀▀Written by Petr Lebedev & Derek MullerEdited by Trenton Oliver & Katrina JacksonFilmed by Derek MullerAnimation by Fabio Albertelli, Ivy Tello, & Mike RadjabovIllustration by Jakub Misiek and Celia BodeAdditional video/photos supplied by Getty Images & Pond5Music from Epidemic Sound"
"b1_RKu-ESCY","Jason Aldean - Try That In A Small Town (Official Music Video)","2023-07-14T13:00:08Z","UCw0F_Xuz0VqemtMAtEfHTdA","Jason Aldean","10","23.20.07","Jason Aldene|Jason Aldeaon|Jason Aldine|Jason Alldean|tough crowd|jason aldean tough crowd|tough crowd jason aldean|new jason aldean songs|acm awards|acm awards 2023|jason aldean acm awards|jelly roll acm awards|jelly roll lainey wilson|jason aldean dirt road anthem|jason aldean heaven|acm performance|acm awards 2023 full show|try that in a small town|jason aldean try that|jason aldean try that in a small town|try that in a small town jason aldean","3588015","241348","0","36150","https://i.ytimg.com/vi/b1_RKu-ESCY/default.jpg","False","False","The official audio video for Try That In A Small Town. Listen here ►https://jasonaldean.lnk.to/TryThatInASmallTownIDGet tickets to Jason Aldean's Highway Desperado Tour 2023: https://www.jasonaldean.com/tour/►Subscribe to Jason's YouTube Channel: https://jasonaldean.lnk.to/ytchnlsubscribe►Shop Merch: https://store.jasonaldean.com►Join the Mailing List: https://jasonaldean.lnk.to/signup►Follow Jason Aldean:    Website/Tour Dates/Aldean Army: http://www.jasonaldean.com Facebook: https://www.facebook.com/jasonaldean Instagram: http://instagram.com/jasonaldean Twitter: https://twitter.com/jason_aldeanTikTok: https://www.tiktok.com/@jasonaldeanmusicLYRICS:SUCKER PUNCH SOMEBODY ON A SIDEWALKCAR JACK AN OLD LADY AT A RED LIGHTPULL A GUN ON THE OWNER OF A LIQUOR STOREYA THINK IT’S COOL WELL ACT A FOOL IF YA LIKECUSS OUT A COP SPIT IN HIS FACESTOMP ON THE FLAG AND LIGHT IT UPYEAH YA THINK YOU’RE TOUGHWELL TRY THAT IN A SMALL TOWNSEE HOW FAR YA MAKE IT DOWN THE ROAD‘ROUND HERE WE TAKE CARE OF OUR OWNYOU CROSS THAT LINE IT WON’T TAKE LONGFOR YOU TO FIND OUTI RECOMMEND YOU DON’TTRY THAT IN A SMALL TOWNGOT A GUN THAT MY GRANDDAD GAVE METHEY SAY ONE DAY THEY’RE GONNA ROUND UPWELL THAT SHIT MIGHT FLY IN THE CITY GOOD LUCKTRY THAT IN A SMALL TOWNSEE HOW FAR YOU MAKE IT DOWN THE ROAD‘ROUND HERE WE TAKE CARE OF OUR OWNYOU CROSS THAT LINE IT WON’T TAKE LONGFOR YOU TO FIND OUTI RECOMMEND YOU DON’TTRY THAT IN A SMALL TOWNFULL OF GOOD OL BOYS, RAISED UP RIGHTIF YOU’RE LOOKING FOR A FIGHT TRY THAT IN A SMALL TOWNTRY THAT IN A SMALL TOWNTRY THAT IN A SMALL TOWNSEE HOW FAR YOU MAKE IT DOWN THE ROAD‘ROUND HERE WE TAKE CARE OF OUR OWNYOU CROSS THAT LINE IT WON’T TAKE LONGFOR YOU TO FIND OUTI RECOMMEND YOU DON’TTRY THAT IN A SMALL TOWNTRY THAT IN A SMALL TOWNTRY THAT IN A SMALL TOWN#JasonAldean #TryThatInASmallTown"
"0Hh5i5C8nVg","0° vs 40° Football Challenges","2023-07-19T17:00:08Z","UCQ-YJstgVdAiCT52TiBWDbg","ChrisMD","24","23.20.07","[none]","924109","54634","0","872","https://i.ytimg.com/vi/0Hh5i5C8nVg/default.jpg","False","False","The coldest video of 2023 just dropped ❄️Click the link and use the code ChrisMD for 24% off of 1 Displate or 34% off of 2+ Displateshttps://displate.com/?art=5fae94db5f428Subscribe to Ethan: https://www.youtube.com/@BehzingaSubscribe to W2S: https://www.youtube.com/@w2sSubscribe to Reev: https://www.youtube.com/@reevSubscribe to Arthur: https://www.youtube.com/@Arthur_TVSubscribe to Danny: https://www.youtube.com/@DannyAaronsSubscribe to George: https://www.youtube.com/@georgeclarkey► Second channel: https://www.youtube.com/@chrismdixon10► Instagram: http://instagram.com/chrismd10► Twitter: https://twitter.com/chrismd10► Facebook: https://www.facebook.com/OfficialChrisMDIf you want to know how I use popular music in my content - Lickd provide an affordable service to license mainstream music for use in monetised content. Save 50% off your first track on Lickd and improve your video quality with popular music: https://lickd.co/affiliate/chrismdMusic:00:01, 26:33 | Get Praise You (Radio Edit) by Fatboy Slim and over 1M + mainstream tracks here https://go.lickd.co/MusicLicense ID: E7omr09MDvn02:01 Track: ANGELPLAYA - PSYCHOPATHIC [NCS Release]Music provided by NoCopyrightSounds.Watch: http://ncs.lnk.to/PSYCHOPATHICAT/youtubeFree Download / Stream: http://ncs.io/PSYCHOPATHIC03:37 | Get The Power Of Love by Huey Lewis & The News and over 1M + mainstream tracks here https://go.lickd.co/MusicLicense ID: JK495zAN4MB https://lickd.lnk.to/mFoXkHID!ChrisMD05:08 | Track: 32Stitches & CHENDA, Harley Bird - Freedom [NCS Release]Music provided by NoCopyrightSounds.Watch: https://www.youtube.com/watch?v=JRQei9hJekc Free Download / Stream: http://NCS.io/32SFreedom06:07 | Get Temperature by Sean Paul and over 1M + mainstream tracks here https://go.lickd.co/MusicLicense ID: rDRlLN76RW8 https://lickd.lnk.to/obE9n7ID!ChrisMD07:46 | Track: Zack Merci - Kadak (feat. Nieko & Blxk Trey) [NCS Release]Music provided by NoCopyrightSounds.Watch: https://www.youtube.com/watch?v=y_LwPwwlb6EFree Download / Stream: http://ncs.io/Kadak12:37 | Get Kiss from a Rose by Seal and over 1M + mainstream tracks here https://go.lickd.co/MusicLicense ID: kDvJg4nY3GJ13:18 | Track: D'Amico & Valax - Mirage Of My Heart (ft. Fayzone) [Arcade Release]Music from Arcade by NoCopyrightSounds.Watch: https://www.youtube.com/watch?v=o0GJGGfWPOUFree Download / Stream: http://ncs.io/MirageOfMyHeart20:14 | Track: Alan Walker - Dreamer (Rival Remix) [NCS Release]Music provided by NoCopyrightSounds.Watch: http://ncs.lnk.to/rival_dreamerAT/you...Free Download / Stream: http://ncs.io/rival_dreamer23:20 | Get Hot Hot Hot by Arrow and over 1M + mainstream tracks here https://go.lickd.co/MusicLicense ID: 6BqwMpm5kPz29:21 | Get 2001: A Space Odyssey (Main Theme)  by The Intermezzo Orchestra and over 1M + mainstream tracks here https://go.lickd.co/MusicLicense ID: Wzr7Q7x4n14Music by Epidemic Sound (http://www.epidemicsound.com) & others.Credits:Talent:Chris DixonEthan PayneHarry LewisOliver Fletcher-WarringtonArthur FernDanny AaronsGeorge ClarkeProduction:Production Manager: Jessica ThompsonAssistant Creative Producer: Jamie BristowAssistant Creative Director: Luis ConteBrand Coordinator: Laura SebrightEditors:Lead Editor: Jamie ArcherJonathan WardHarry PhillipsDarragh O’Reilly Cinematographers:Mark Upson (2PlayerStudio)Jack Upson (2PlayerStudio)Joss WildDrone Pilot: Louis Houiller (Dreamfast)Photographer: Kirsty WellsBig thanks to:Henningsvaer StadiumStudio52Precision FootballHot Air Balloon UAE"
"H3jaIhSj23E","Oppenheimer - Movie Review","2023-07-19T16:00:21Z","UCCqEeDAUf4Mg0GgEN658tkA","Chris Stuckmann","24","23.20.07","Oppenheimer|Movie Review|Chris Stuckmann|Reviews|Film|Scene|Clip|Trailer|Teaser|IMAX|Sound|Mix|Dialogue|Subtitles|Cillian Murphy|Emily Blunt|Robert Downey Jr.|Matt Damon|Rami Malek|Florence Pugh|Benny Safdie|Michael Angarano|Josh Hartnett|Kenneth Branagh|Trinity Test|2023|Christopher Nolan|Josh Peck","494618","25105","0","2259","https://i.ytimg.com/vi/H3jaIhSj23E/default.jpg","False","False","Chris Stuckmann reviews Oppenheimer, starring Cillian Murphy, Emily Blunt, Robert Downey Jr., Matt Damon, Rami Malek, Florence Pugh, Benny Safdie, Michael Angarano, Josh Hartnett, Kenneth Branagh. Directed by Christopher Nolan."
"c4zUnACRrQU","Canada’s $30BN Gamble To Become An Energy Superpower","2023-07-19T10:56:39Z","UC6n8I1UDTKP1IWjQMg6_TwA","The B1M","27","23.20.07","B1M|TheB1M|Construction|architecture|engineering|The B1M|Fred Mills|building|lng|lng canada|liquefied natural gas|natural gas|energy|canada|kitimat|shell|british columbia|qatar|australia|united states|energy crisis|europe|asia|bluebeam|china|coal|fossil fuels|renewable energy|megaprojects|north america|justin trudeau|first nations","205861","8078","0","610","https://i.ytimg.com/vi/c4zUnACRrQU/default.jpg","False","False","It's one of North America's biggest megaprojects, but you've probably never heard of it. Read how Bluebeam Revu helped one company in the oil and gas industry go from paper to digital - https://bit.ly/3NZvmG9Full story here - https://theb1m.com/video/lng-canada-30bn-megaprojectThis video contains paid promotion for Bluebeam.Additional footage and images courtesy of LNG Canada, CBC Vancouver, CNBC, Justin Trudeau - Prime Minister of Canada and Sony Pictures Television.Listen to The World's Best Construction Podcast by The B1MApple - https://apple.co/3OssZsHSpotify - https://spoti.fi/3om1NkBAmazon Music - https://amzn.to/3znmBP4View this video and more at - https://www.TheB1M.com/ Follow us on Twitter - http://www.twitter.com/TheB1M/Like us on Facebook - http://www.facebook.com/TheB1M/Follow us on TikTok - https://www.tiktok.com/@theb1m/Follow us on LinkedIn - https://www.linkedin.com/company/the-b1m-ltd/Follow us on Instagram - http://instagram.com/theb1m/The B1M Merch store - https://theb1m.creator-spring.com/#construction #architecture #energyWe welcome you sharing our content to inspire others, but please be nice and play by our rules - http://www.theb1m.com/guidelines-for-sharingOur content may only be embedded onto third party websites by arrangement. We have established partnerships with domains to share our content and help it reach a wider audience. If you are interested in partnering with us please contact Video@TheB1M.com.Ripping and/or editing this video is illegal and will result in legal action. © 2023 The B1M Limited"
"Xx1PLArdTmY","Diablo 4 - Patch 1.1 is DISGRACEFUL - More Nerfs Found, Devs Confirm More Changes, Season 1 Ruined!","2023-07-19T14:00:32Z","UC2nMSE3t71qC8sG06WSJnMg","RageGamingVideos","20","23.20.07","diablo 4 campfire chat|diablo 4 drama|diablo 4 patch 1.1|patch 1.1|season 1 patch|season 1|season of the malignant|xp nerf|dungeon nerf|affix nerf|diablo 4 season 1|diablo 4 season of the malignant|diablo 4 xp changes|diablo 4 balance patch|diablo 4 nerf|diablo 4 patch|diablo 4 update|diablo 4 balance changes|diablo 4 buff|diablo 4 class changes|patch notes|new|rogue|barbarian|sorcerer|druid|necromancer|season 1 patch 1.1|patch|nerf|d4|ragegamingvideos","226727","10583","0","4395","https://i.ytimg.com/vi/Xx1PLArdTmY/default.jpg","False","False","Patch 1.1 is one of the biggest failures in recent gaming history... Enjoy!Support us on Patreon: http://bit.ly/1FUac4SHunters Three Channel Shop: https://huntersthree.store/Discord Community: https://discord.gg/fQH5bucMonster Hunter Rise Sunbreak gameplay is on hold for now we look at new Diablo 4 and the Diablo 4 gameplay Diablo 4 best class Diablo 4 Sorceress Barbarian Necromancer Druid Rogue build guide Diablo 4 most powerful class Diablo 4 best build skills abilities Diablo 4 best build all classes highest damage Diablo 4 Diablo 4 Balance Patch Diablo 4 Class Nerfs & Buffs Diablo 4 Patch 1.1 notes breakdown guide explained Diablo 4 Nerf Buff Diablo 4 Expansion Diablo 4 Season 1 Season of the Malignant release date announcement dev stream chat Diablo 4 Cormond New Legendary Aspects Unique Gear Malignant Tunnel Dungeon Season Journey Chapters Battle Pass Favours Malignant Hearts Wrathful Heart Elites Codex Invoker New Bosses Malignant Elites Diablo 4 Patch 1.1 Malignant Heart Crafting New Legendary Aspects Season of the Malignant new boss gameplay chapters story reveal Diablo 4 Season 1 new ultra rare uber unique class nerf buff nightmare dungeon drop rate! Diablo 4 Season of the Malignant 1 prep guide Diablo 4 Patch 1.1 patch notes nerfs xp changes affix gear nerf Diablo 4 Patch 1.1 Campfire Chat backlash!#diablo4 #diablo4season1patch1.1 #diablo41.1 #season1patch #diablo4seasonofthemalignant #season1 #diablo4patch1.1 #nerf #buffSubscribe (http://bit.ly/1hTCETC) for more gaming content and read the description to fulfil your dreams!Incredible thumbnail art by Lighght: https://twitter.com/llighghtFor exclusives, fun times and general shenanigans follow me on:Twitter: http://twitter.com/ragegamingvideoFacebook: http://www.facebook.com/RageGamingVideosMore life changing links!Steam Group: http://steamcommunity.com/groups/RageGamingVideosStream: http://www.twitch.tv/ragegamingvideosReddit: http://www.reddit.com/r/RageGaming/Email: ragegaminggeneral@gmail.comT-Shirts: http://www.redbubble.com/people/ragegamingvideo/shopI'm Josh with Cotton and Hollow. We make funny things, we make useful things and we end up in many improbable situations. If you've got this far in the description you are an intrepid explorer of boxes and I approve you as a comrade in curiosity. So join me on this adventure as we make multitudes of majorly magnificent videos as we be excessively modest and have a good time! Thanks for watching and reading, give yourself a cookie."
"Tix0P-ynx08","15 Fabulous Secrets in Elden Ring!","2023-07-19T09:24:30Z","UCe0DNp0mKMqrYVaTundyr9w","VaatiVidya","20","23.20.07","guide|walkthrough|lore|dark|souls|dlc|two|bloodborne|story|vaatividya|vaati|vidya|videos|(video|game)|shadows|twice|from|software|sekiro|combat|tips|tricks|elden|ring|trailer|demon's souls|remake|ps5|playstation 5|demigods|great runes|radagon|mohg|malenia|miquella|leyndell|prepare to cry|frenzied flame|secrets|ranni questline|rune farm|armored core 6|vi|all endings|best build|shadow of the erdtree|SotE|Godrick|Radahn|runebear|Astel|Malenia|Scarlet Rot|Roderika|elemer","622065","37697","0","1971","https://i.ytimg.com/vi/Tix0P-ynx08/default.jpg","False","False","►Check out my Displates here https://displate.com/vaatividya/vaatividya-originals?art=5e87123a79f28►Become a patron for early access, exclusive merch, and more http://www.patreon.com/vaatividyaCREDITS ▼▼▼►Displate artwork by https://www.artstation.com/francoyovich►@Quelaag has great lore videos►@ZullietheWitch has a great video on Astel https://youtu.be/v5bzgLBMYb4►The pillars thread: https://www.reddit.com/r/Eldenring/comments/12t7aoh/on_the_left_the_pillars_reddit_thought_to_have/►My Malenia lore video: https://youtu.be/UV3P8c5kNNQ►My joint timeline video: https://youtu.be/vT_4jf02wsU►Thread on Godrick's leg https://reddit.com/r/Eldenring/comments/12jc0s5/today_i_noticed_that_godricks_left_leg_that_he/►Lokey is our resident translator: https://twitter.com/lokey_ds►@miss_chalice makes amazing lore videos. You can also find her on TikTok! https://www.tiktok.com/@miss.chalice►@Leviathannohit has a great video on the lowest damage attack in Elden Ring https://youtu.be/-a7VWWhhD1g►Thread on avoiding the madness eye https://www.reddit.com/r/Eldenring/comments/14chiu0/you_can_literally_fool_the_madness_eye/►Thread on the Mausoleum Knights https://www.reddit.com/r/Eldenring/comments/zntf2p/have_you_noticed_the_bloody_streak_running_down/►Check out Mauricio Negreira's artwork! https://www.instagram.com/maurinegreira.ad/TIMESTAMPS ▼▼▼00:00 I fought all of the Rune Bears01:24 Radahn's soldiers used his swords02:17 The gravity crest looks a lot like...03:20 Why Radahn was holding back the stars06:15 Why are Iji's weapons blunt?09:16 There's something underneath Liurnia...11:20 Elden Ring is Path of Exile14:19 Godrick's leg is stolen17:23 Roderika's secret18:50 The weakest attack in Elden Ring19:20 Hide from the Eye19:50 Elemer wants YOU to be ascetic21:28 Damn, Radagon's got hands22:02 Look at the Mausoleum Set...22:58 The thumbnail artMERCHANDISE►Consider buying a Displate poster here: https://bit.ly/43Ujbk1►Buy more Posters & Apparel at https://vaatividya.com/SPECIAL THANKS TO►Mispap1, for Lore / Prepare to Cry editing and footage -  @mispap1►Frans Bouma, for your legendary Elden Ring camera tools - https://fransbouma.com/►Rainer, for their modding assistance in these videos -  @rainergeis4071PLAYLISTS►My Best Videos: http://bit.ly/2oMp66a►Elden Ring Prepare to Cry: https://bit.ly/3ApeG2N►Elden Ring Lore: https://bit.ly/3q3saNf►Elden Ring Secrets: https://bit.ly/3RdCNbQ►Elden Ring News: https://bit.ly/2ZkDV2d►Sekiro Lore: https://bit.ly/2KGEzD1►Sekiro Secrets: https://bit.ly/2IsObhW►Dark Souls 3 Lore: http://bit.ly/2n0bU13►Dark Souls 3 News: http://bit.ly/1NQbgbW►Bloodborne Lore: http://bit.ly/1X9doOQ►Demon's Souls Lore: http://bit.ly/16mIF86►Dark Souls Remastered Lore: http://bit.ly/13x6nNs►Dark Souls 2 Lore: http://bit.ly/1dedWjI►Souls-like: http://bit.ly/1xCPDnuSOCIAL►Follow me on Twitter: https://twitter.com/VaatiVidya►Follow me on TikTok: https://www.tiktok.com/@vaatividya►Follow me on Twitch.tv: http://www.twitch.tv/vaatividya►Follow me on Tumblr: http://vaatividya.tumblr.com/►Follow me on Facebook: https://www.facebook.com/Vaatividya►Follow me on Patreon: http://www.patreon.com/vaatividya►Join me on Discord: http://discord.gg/vaatividyaTHUMBNAIL ART►Maurine Negreira https://www.instagram.com/maurinegreira.ad/MUSIC (most is royalty-free or licensed from Epidemic Sound. Sign up or browse here: (https://www.epidemicsound.com/referral/j49549/)►Colonization of Mars►A Journeys Epilogue►Some Things Were Said►Downtown Binary - Gravity►Alon Peretz - Song for Heather.►Ian Post - Beyond►The Monument►Character Creation theme (Elden Ring)►Lead - Farrell Wooten►Documents - Farrell Wooten►A Home in the Lowlands - Flouw►Roie Shpigler - Coal CloudsPATRONS►I'd like to give sincere thanks to all my patrons - your contributions have changed the course of my life, allowing me to put more emphasis on video production in the future.►Special thanks to Soul of Cinder-tier Patrons: John, Mihaf, Matthew, Colin, budhawillyboy, Chattan, Aritz, Erlend, Michael, Finbarwrong, David, AmazinShawn, Aidan, Joshua, Ryan, Cat, Lucian, Nicholas, HugDucks, Kyle, Xavier, Justin, Andreas, Ian, Xensvet, Mike, Loak, Morningstar, Morgan, Vanguard, Ricakardsson, Seleiful, Dain, Diablo, Chase, Andronikos, Nezzly, Rune, Thomas, Jacob, One Unimpressed Boi, Matthew, Aj, GoldenSunX, Yousif, sean, Croonz, ndr.alng, Meistermuall, Armand, Albert, Liam, AJ, Aishlinn, Reiftyr, nicolas, and Ricky."
