video_id,title,publishedAt,channelId,channelTitle,categoryId,trending_date,tags,view_count,likes,dislikes,comment_count,thumbnail_link,comments_disabled,ratings_disabled,description
"itSTswrvUWA","Ich habe ANGST UM DIESE POKÉMON-REMAKES","2023-07-26T15:00:40Z","UC4e4Pas5ycu5JY9wv7rJeYQ","Lennyficate","24","23.28.07","lennyficate|lenny ficate|lennificate|der lenny|pokemon|lennyficate pokemon|lenny pokemon|derlenny","49190","4089","0","526","https://i.ytimg.com/vi/itSTswrvUWA/default.jpg","False","False","Ich habe mich in Pokémon Schwarz und Weiß verliebt. Und darum habe ich Angst um die 5. Gen Remakes!► ᵂᴱᴿᴮᵁᴺᴳ LEVLUP: http://levlup.de/?ref=Lenny 🔹 MEGA 2FÜR1-AKTION mit Code LENNY2 🔥 ► ᵂᴱᴿᴮᵁᴺᴳ POKÉVIERT: https://www.pokeviert.shop/?sca_ref=3976401.09PWusWgIm 🔹 Günstige Pokémonkarten 🔥► KANALMITGLIED WERDEN: https://www.youtube.com/channel/UC4e4Pas5ycu5JY9wv7rJeYQ/join ⭐► NEUER ZWEITKANAL: https://www.youtube.com/@Leponitox 🔥► RGEs Video: https://youtu.be/6E_jPR9InDo► FOLGT MIR AUF× Twitch: http://bit.ly/lennyftwitch× Twitter: http://bit.ly/1PiR414× Instagram: http://bit.ly/2N9Qszl× Discord: https://bit.ly/3K2SdhGTimestamps:0:00 Video4:37 Werbung4:57 Video"
"xgyMGFlw9Ks","MEIN NEUES PFERD - VORSTELLUNG | ANJA FEE","2023-07-26T18:04:37Z","UCExx7JoZS-Su1XqeCCacCeA","Anja Fee","15","23.28.07","[none]","32252","1908","0","71","https://i.ytimg.com/vi/xgyMGFlw9Ks/default.jpg","False","False","Darf ich vorstellen : Calando Blue 💙 .Ich bin einfach nur überwältigt und überglücklich, dass dieses hübsche Kerl jetzt mir gehört. Falls ihr noch weitere Fragen habt, dann stellt sie gerne in den Kommentaren .Eure Anja !"
"Wt3QS_7dYDU","RICHARLISON SCORES HAT-TRICK IN SINGAPORE | TOTTENHAM HOTSPUR 5-1 LION CITY SAILORS | HIGHLIGHTS","2023-07-26T15:53:42Z","UCEg25rdRZXg32iwai6N6l0w","Tottenham Hotspur","17","23.28.07","Spurs|Tottenham Hotspur|토트넘|손흥민","1711706","21568","0","1529","https://i.ytimg.com/vi/Wt3QS_7dYDU/default.jpg","False","False","SPURSPLAY is live! Check it out now ► https://bit.ly/3a9klBiSUBSCRIBE to ensure you don’t miss a video from the Spurs YouTube channel. Hit the bell to get notifications on our latest uploads! ► Subscribe: https://www.youtube.com/channel/UCEg25rdRZXg32iwai6N6l0w?sub_confirmation=1 FOLLOW US!Instagram: https://www.instagram.com/spursofficial/Twitch: https://www.twitch.tv/tottenhamhotspur/TikTok: https://www.tiktok.com/@spursofficialTwitter: https://twitter.com/SpursOfficialFacebook: https://www.facebook.com/TottenhamHotspur/Download the Spurs App: https://www.tottenhamhotspur.com/spurs-official-app/"
"y5S2pVu87gY","ViscaBarca im Messi Quiz - Wie gut kennt er ihn wirklich?","2023-07-26T18:22:29Z","UCAWasvnUzSnIfNkAHIifNFg","EINFACH FUSSBALL.","17","23.28.07","Fußball|Football|Soccer|Bundesliga|2. Bundesliga|3. Liga|Around The World|Tutorial|Skills|Einfach Fussball|Champions League|Bayern München|DFB|Nationalmannschaft","53685","3737","0","73","https://i.ytimg.com/vi/y5S2pVu87gY/default.jpg","False","False","ViscaBarca ist blühender Fan vom FC Barcelona und insbesondere Lionel Messi. Doch kennt er sich wirklich so gut mit seinem Idol aus? Wir haben es getestet!Viel Spaß und nicht vergessen den Kanal zu abonnieren! ⚽️❤️--Danke an Anton:https://www.youtube.com/@Visca96Barca--Schaut bei uns auf Instagram vorbei:https://www.instagram.com/einfachfussball--Anfragen: info.einfachfussball@gmail.com--Wir gehören auch zu # funk. Schaut da mal rein:YouTube: https://www.youtube.com/funkofficialInstagram: https://www.instagram.com/funkTikTok: https://www.tiktok.com/@funk Website: https://go.funk.netWir haben ein Herz für Kritiker, aber nicht für Hater: https://go.funk.net/netiquettehttps://go.funk.net/impressum"
"KTQWrK7Tdlc","Hagelkatastrophe am Gardasee","2023-07-25T16:25:36Z","UCEHSAhzItg3sMONXAewVRpg","WetterOnline","28","23.28.07","Wetter|Wetterbericht|Wettervorhersage|Wetter für Deutschland|Wettertrend|Wetteraussichten|Wie wird das Wetter?|Wetter heute|Deutschland|wetter net|dominic jung|kai zorn wetter|wetterexperte|Wetter kai zorn|Berlin|Hamburg|Köln|München|Video|kostenlos|Wetter Deutschland|kachelmann|kachelmannwetter|Pollen|Pollenflug|nrw|bayern|nordrhein-westfalen|Frankfurt|Dreseden|Leipzig|Stuttgart|Düsseldorf|Hannover|Unwetter|Italien|Hagel|Gardasee","148808","634","0","172","https://i.ytimg.com/vi/KTQWrK7Tdlc/default.jpg","False","False","Am Montagabend wurde die südliche Region des Gardasees von schweren Unwettern erfasst. Hagelgeschosse von bis zu 10 Zentimeter Größe richteten massive Schäden an. Viele Urlauber sind betroffen.🔔  Abonnieren und Glocke drücken...Daaaanke! https://www.youtube.com/user/WetterOnlineGmbH🌦  Das Wetter für euren Ort: https://app.wetteronline.de/pHdP/DEytl-  -  -  -  -  -  -  -  -  -  -  -  -  -  -  -  -  -  -  -  -  -  -  -  -✅  Facebook: https://www.facebook.com/wetteronline✅  Twitter: https://twitter.com/WetterOnline ✅  Instagram: https://www.instagram.com/wetteronline/"
"vB5cmsamLzU","Mein Ersteindruck: Samsung Flip 5 & Fold 5!","2023-07-26T11:00:18Z","UCF_n906__yoMtxZQtmqmZbA","iKnowReview","28","23.28.07","[none]","96280","4770","0","300","https://i.ytimg.com/vi/vB5cmsamLzU/default.jpg","False","False","Samsung hat das neue Galaxy Fold 5, Flip 5, die Galaxy Watch 6 (Classic) und die Tab S9 Serie vorgestellt!Marshall Middleton: https://www.marshallheadphones.com/de/de/middleton.htmlBei MediaMarkt: https://www.mediamarkt.de/de/product/_marshall-middleton-bluetooth-speaker-black-and-brass-wasserfest-2858592.htmlMeine Webseite!https://kram.storeInstagram: https://www.instagram.com/iknow.mp4Twitter:  https://twitter.com/iKnowReviewTikTok: https://www.tiktok.com/@iknow.mp4Mein elektrischer Schreibtisch*: https://www.ergotopia.de/?utm_medium=10iKnowReview Hülle*: https://rhinoshield.de/collections/artist-iknowreview?aff=6Paperlike*: paperlike.com/iknowMeist die Hintergrundmusik:http://bit.ly/1aCoXeIOft aber auch:*https://www.epidemicsound.com/referral/0m1dtg/*Affiliate Links unterstützen meinen Kanal - der Einkauf kostet für dich genau gleich viel :)"
"v_XhxONGEJc","Polaris - NIGHTMARE [Official Music Video]","2023-07-26T23:00:09Z","UCSs38VPbAqfnf2nX5h4FuDw","PolarisAus","10","23.28.07","[none]","97124","11907","0","839","https://i.ytimg.com/vi/v_XhxONGEJc/default.jpg","False","False","In loving memory of Ryan SiewNightmare is the second single from our third LP ‘FATALISM’, out September 1 via Resist/Sharptone. Pre-order FATALISM now: https://bfan.link/fatalismLYRICS:I saw the signsThe signal fires that burned atop the hillRising tides and violent skiesAll the while the world was standing stillDefenceless as a rat in a cageLiving with our backs to the wallFrom the minute we wakeToo sedated to noticeWe’re living in a nightmareA pre-apocalyptic wastelandIs there no one who can save usIf we refuse to save ourselves?Our best intentions pave our path to hellWhat does it mean to be a captiveIn the confines of your mind? What does it mean to be a hostage To the enemy inside?We’ve been here beforeI guess we learned nothingThe signs were all but ignoredThe planets collide as we all stop and stareToo jaded to noticeWe’re living in a nightmareA pre-apocalyptic wastelandIs there no one who can save usIf we refuse to save ourselves? Our best intentions pave our path to hellI see their shadows dance on the wallsAs voices echo in empty hallsIt makes my stomach sinkAs I close my eyes and beg for sleepChaos kills the calmFingers through my palmsI can’t make it stopSomebody kick the chair and fucking wake me upSpare your thoughts and prayersThey’ll never be enoughIt only tightens the nooseThe more we struggle to cut ourselves looseEvery cry rings out like a shotThe streets run red as the forests wither and rotDeclaring with their final breathEternal fear is a fate worse than deathBut no one’s gonna save usIf we won’t fucking save ourselvesOur best intentions pave our path to hellWe’re living in a nightmare(Never again will we sleep)A pre-apocalyptic wasteland(Until we are weary and weak)And there’s no one who can save usIf we refuse to save ourselvesOur best intentions pave our path to hellAnd you will see me there when they tighten the nooseI deserve this just like the rest of you___Produced & Engineered by Lance Prenc and Scott SimpsonMixed and Mastered by Lance Prenc___Directed / DOP / Edited / VFX / Colour Graded - @thirdeyevisualsauProducer - Todd Farley2nd Camera Op / Gaffer - Ed BellamyFPV Drone Pilot - Josh LabitaProduction Designer - Zak DouglasArt Assist - Candice NelsonProduction Assistant - Jess DouglasMUA - Chiara MocnikCatering - Carmel and Bernie FarleyBTS - @RixoncreativeSpecial Thanks - Harpy Film , Working Heritage , BETA BY STH BNK, BEULAH, Sharegear , Andrew Lock."
"aeCyWrIR37g","Ist Lidl besser als andere? Der Discounter-Gigant unter der Lupe | Marktcheck SWR","2023-07-25T18:15:01Z","UCxec_VgCE-5DUZ8MocKbEdg","SWR Marktcheck","27","23.28.07","Aldi|Discounter|Edeka|Lidl|Marktcheck checkt Lidl|Rewe|billig|checkt|Kaufland|Supermarkt|Aldi Süd|Lidl online|Lidl Angebote|Fleisch von Lidl|Tierwohl|Massentierhaltung|wie gut ist Lidl|Stiftung Warentest|Eigenmarken|Wie günstig ist Lidl?|Welcher Supermarkt ist am günstigsten?|günstig einkaufen|Lidl Eigenmarke|Helene Fischer|Lidl Kollektion|Preisvergleich|Welcher Supermarkt ist der günstigste?|Lebensmittel|Hendrike Brenninkmeyer|Marktcheck|SWR|SWR Marktcheck","190888","2432","0","551","https://i.ytimg.com/vi/aeCyWrIR37g/default.jpg","False","False","Lohnt sich Lidl wirklich? Sind die Preise besser als bei Aldi, Rewe und Edeka? Und wie wichtig ist dem Konzern Tierwohl beim Fleisch?Sieben Jahre ist unser letzter Lidl-Check her - jetzt nehmen wir uns den Discounter noch mal vor und schauen, was sich verändert hat.00:00 Marktcheck checkt Lidl02:22 Preise bei Lidl, Aldi, Edeka, Rewe: Wo sind Lebensmittel günstiger?05:14 Markenartikel bei Lidl und Aldi selten reduziert?08:22 Schwarz-Gruppe produziert viel selbst: Brot, Nudeln und Schokolade10:33 Qualitäts-Check: Wie frisch sind die Lebensmittel bei Lidl14:50 E-Bike aus dem Lidl Online Shop im Test18:57 Fritz Cola, Coca Cola und Cola von Lidl-Eigenmarke “Freeway”: Welche schmeckt am besten?21:57 Helene Fischer wirbt für Lidl27:50 Geld-zurück-Garantie bei Lidl31:50 Achtet Lidl bei Fleisch auf Tierwohl?37:54 Backwaren von Lidl im Vergleich mit Aldi und Rewe41:14 Fazit von Ökotest----------  Marktcheck-Sendungen inkl. Untertitel in der Mediathek: http://x.swr.de/s/13zv     Übrigens: Da Marktcheck zum SWR gehört, könnt ihr dieses Video kostenlos im WLAN herunterladen und unterwegs offline schauen!  ----------  BARBARA SCHÖNEBERGER UND HELENE FISCHER FÜR LIDLDer Discounter Lidl feiert 50 Jahre – mit Sonderaktionen und Werbe-Spots. Mit rund 12.000 Filialen in 31 Ländern ist Lidl der größte Discounter der Welt und das Jubiläum wird groß gefeiert. Stars wie Barbara Schöneberger oder Helene Fischer lächeln einem von Plakaten und im Fernseher entgegen. LIDL, ALDI, REWE, EDEKA: WELCHE EIGENMARKEN SIND AM GÜNSTIGSTEN?Warum kaufen Kund:innen bei Lidl ein? Wie schneidet Lidl bei Preisen und Qualität im Vergleich zu Mitbewerbern ab - im Dauer-Duell mit dem Discounterriesen Aldi, aber auch mit den Eigenmarken von Rewe und Edeka? Das SWR Verbrauchermagazin klärt, ob der Lidl-Slogan „Mehr als günstig“ wirklich zutrifft. Wo gibt´s die meisten Rabatte? COLA-TEST: WELCHE SCHMECKT AM BESTEN?Auf dem SWR Sommerfestival in Ingelheim wird eine Blindverkostung mit einem Lidl-Produkt und Konkurrenzprodukten gemacht. Wer schneidet besser ab? E-BIKE VON LIDLUnd es gibt einen E-Bike-Vergleich, denn Lidl hat sein erstes eigenes E-Bike der bekannten Lidl-Eigenmarke Crivit auf den Markt gebracht. Wie gut ist das Urban E-Bike? Und: Kann Lidl auch auf der grünen Welle punkten?Autor: Daniel GüldnerRedaktion: Jürgen Battlogg, Martin KaschwichBildquelle: picture alliance/Hendrik SchmidtHier gibt es zwei Artikel zum Thema: https://www.swrfernsehen.de/marktcheck/marktcheck-checkt-lidl-preise-qualitaet-tierwohl-100.htmlund: https://www.swrfernsehen.de/marktcheck/wie-gut-ist-fleisch-von-lidl-tierwohl-100.html-----------   ► Balkonkraftwerke von Lidl und Netto im Check | Marktcheck SWR: https://www.youtube.com/watch?v=LuGxrACjToQ► Grillen mit Aldi und Lidl: Wo sind die Produkte besser? | Marktcheck SWR: https://youtu.be/GwtdBTGX4es► Aldi und Edeka im Vergleich: Preise und Qualität | Marktcheck SWR: https://youtu.be/wGlGgKvrgdk► Gouda von LIDL, ALDI, Alnatura, FRICO und Co. - welcher ist der beste? | Marktcheck SWR: https://youtu.be/uwy_HPG60Lw► Der große Kaufland-Test: Supermarkt oder Discounter? | Marktcheck SWR: https://youtu.be/diJho6bHsso-----------► Mehr Infos zur Sendung auf unserer Homepage: https://www.swrfernsehen.de/marktcheck/  ► Mehr zu Marktcheck auf unserer Facebook-Seite: https://www.facebook.com/marktcheck   ► Zu unserem Kanal-Abo geht es hier: http://x.swr.de/s/13x1  ► Mehr zu unseren Ökocheckern gibt es auf Instagram: https://www.instagram.com/oekochecker/  ► Kommentare sind willkommen – aber bitte unter Beachtung der Netiquette: https://www.swr.de/home/netiquette-100.html  ► Impressum: https://www.swr.de/impressum/    #lidl  #edeka   #aldi"
"vJpdsTZfFX4","Secret Invasion: So verändert das Finale das MCU 😳  | Super-Skrulls, Captain America 4 & Nick Fury","2023-07-26T15:00:48Z","UCkDsn8e0cRXKyxPxPIkDfTg","FILMSTARTS","1","23.28.07","secret invasion finale|secret invasion folge 6|secret invasion episode 6|secret invasion ende erklärt|secret invasion ending explained|secret invasion super skrull|secret invasion president|secret invasion skrulls|secret invasion captain america 4|secret invasion|secret invasion marvel","50350","1968","0","589","https://i.ytimg.com/vi/vJpdsTZfFX4/default.jpg","False","False","Secret Invasion Folge 6 RecapMarvels Secret Invasion ist vorbei. Folge 6 liefert uns ein Finale mit vielen Fragen. Was hat es mit den Super-Skrulls noch auf sich? Wie wird Nick Fury in Zukunft agieren? Wo bleiben die Avengers, wenn man sie mal braucht? Wie geht es jetzt weiter... mit The Marvels, mit Captain America 4 oder den Thunderbolts? Ich habe das Finale geschaut und gebe euch ein paar Antworten.#marvel #secretinvasion #nickfury ▬▬▬▬▬▬▬▬▬Hier findet ihr mich auch:• Sebastian auf Instagram: https://www.instagram.com/die_blonde_gefahr/• Sebastians Podcast Leinwandliebe: https://spoti.fi/3EsqdhL• Web: http://www.filmstarts.de• Facebook: http://facebook.com/filmstarts• Twitter: http://twitter.com/filmstarts• Instagram: https://www.instagram.com/filmstarts/"
"WFopn8mfY10","Deutschland - Marokko | FIFA WM 2023 | sportstudio","2023-07-24T10:51:09Z","UClCIWcZNvq15p0Y-E4ToGOw","sportstudio fußball","17","23.28.07","Fußball|Fussball|FIFA|Frauenfußball|Frauen Fußball|Fußball-WM|Fußball WM|WM|Weltmeisterschaft|Weltmeisterschaften|Frauen-WM|Frauen WM|Frauen|Deutschland|Marokko|Deutschland Marokko|Deutschland Zusammenfassung|Marokko Zusammenfassung|Deutschland Marokko Zusammenfassung|Marokko Deutschland Zusammenfassung|Deutschland Highlights|Marokko Highlights|Deutschland Marokko Highlights|Marokko Deutschland Highlights|Popp|Popp Tor|Brand Tor|Eigentor|Schüller Tor|ZDF|sportstudio","1005735","14701","0","2111","https://i.ytimg.com/vi/WFopn8mfY10/default.jpg","False","False","Die deutsche Nationalmannschaft hat in ihrem ersten Gruppenspiel bei der Fußball-Weltmeisterschaft in Australien und Neuseeland mit 6:0 gegen Marokko gewonnen. Die Halbzeitführung für die DFB-Elf stellte Kapitänin Alexandra Popp her (11., 39. Minute), im zweiten Durchgang legte Klara Bühl nach (46.). Zwei marokkanische Eigentore bauten die deutsche Führung weiter aus, bevor Lea Schüller zum 6:0-Endstand traf (90.). Auf unserem Kanal seht ihr die Highlights aller Spiele der FIFA WM 2023. Lasst ein Abo da: https://kurz.zdf.de/abosport/   sportstudio bei Instagram https://www.instagram.com/sportstudio/     sportstudio bei TikTok https://www.tiktok.com/@sportstudio.de     sportstudio bei Twitter https://twitter.com/sportstudio    Elf Minuten dauerte es, bis die deutsche Kapitänin Alexandra Popp das erste Mal jubelnd über den Platz lief – in die Arme von Innenverteidigerin Kathrin Hendrich, die mit einer Flanke von rechts den ersten deutschen Treffer des Turniers vorbereitet hatte. Danach wurden die DFB-Spielerinnen jedoch etwas unsicherer und sie ließen die Marokkanerinnen durch Umschaltsituationen ins Spiel kommen. In dieser Phase waren zu viele Fehler im Spiel der deutschen Auswahl und die Abwehr kam das ein oder andere Mal in Bedrängnis. Erst in den letzten Minuten des ersten Durchgangs besserte sich das und vor allem im Angriff spielten die Deutschen wieder druckvoller. So konnte Popp mit ihrem zweiten Kopfballtreffer nach einem Eckball nachlegen und eine sichere 2:0-Halbzeitführung herstellen (39.). Die DFB-Elf startete stark in die zweite Hälfte: Erst leitete Bühl selbst mit einer Flanke auf Brand ein, die Lina Magull am Fünfmeterraum bediente. Ihr Schuss wurde an die Latte geblockt - schließlich kam der Ball aber über Umwege wieder von Jule Brand zu Klara Bühl, die im linken Strafraum flach und wuchtig zum 3:0 abzog (46.). Zwei marokkanische Eigentore schraubten die deutsche Führung noch weiter in die Höhe (Ait El Haj 54., Yas 79.), bevor Lea Schüller in der 90. Minute zum 6:0-Endstand für das Team von Martina Voss-Tecklenburg traf. Die Aufstellungen:  Deutschland: Frohms - Huth, Hendrich, Doorsoun, Rauch (90. Hagel) - Leupolz (64. Schüller), Däbritz, Magull (64. Lattwein), Brand, Bühl (64. Anyomi) - Popp (84. Freigang) Trainerin: Martina Voss-Tecklenburg Marokko:  Errmichi - Kassi, Ait El Haj, Yas (82. El Chad), Redouani - Ouzraoui, Nakkach (82. Badri), Chebbak, Tagnaout - Ayane, Lahmari (67.) Trainer: Reynald Pedros Schiedsrichterin: Tori Penso (USA) Kommentator: Adrian von der Groeben  #FIFAWWC"
"MLeaGOLZrcA","Newcastle United 1 Chelsea 1 | Premier League Summer Series Highlights","2023-07-27T03:55:57Z","UCywGl_BPp9QhD0uAcP2HsJw","Newcastle United","17","23.28.07","newcastle united|nufc|football|premier league","491901","6049","0","668","https://i.ytimg.com/vi/MLeaGOLZrcA/default.jpg","False","False","Miguel Almirón scored on his return to the Mercedes Benz Stadium as Newcastle United drew 1-1 with Chelsea in the Premier League Summer Series.For more from Newcastle United:Twitter 👉 https://twitter.com/NUFCFacebook 👉 https://www.facebook.com/newcastleunitedInstagram 👉 https://www.instagram.com/nufc/?hl=enTikTok 👉 https://www.tiktok.com/@nufc?Website 👉 https://www.nufc.co.uk/"
"tkkNXt7tJY8","Heartstopper: Season 2 | Official Trailer | Netflix","2023-07-25T15:00:03Z","UCWOA1ZGywLbqmigxE4Qlvuw","Netflix","24","23.28.07","alice oseman|heartstopper|heartstopper s2|heartstopper season 2|heartstopper series 2|joe locke|kit connor","2125617","168203","0","6354","https://i.ytimg.com/vi/tkkNXt7tJY8/default.jpg","False","False","Nick, Charlie and the gang return as they journey through the next chapter of life, love and friendship. 🍂SUBSCRIBE: http://bit.ly/29qBUt7About Netflix:Netflix is one of the world's leading entertainment services with over 238 million paid memberships in over 190 countries enjoying TV series, films and games across a wide variety of genres and languages. Members can play, pause and resume watching as much as they want, anytime, anywhere, and can change their plans at any time.Heartstopper: Season 2 | Official Trailer | Netflixhttps://www.youtube.com/@NetflixWith exams, a school trip to Paris and prom on the horizon, Nick, Charlie and the gang must navigate the next stages of life, love and friendship."
"CjOTjaTgSw0","xikers(싸이커스) - 'Koong' Performance Video","2023-07-26T15:00:03Z","UCQdq-lqPEq_yZ_wP_kuVB9Q","KQ ENTERTAINMENT","10","23.28.07","KQ|케이큐|xikers|싸이커스|HOUSE OF TRICKY : HOW TO PLAY|HOW TO PLAY|싸이커스 HOW TO PLAY|xikers HOW TO PLAY|쿵|xikers Koong|싸이커스 쿵|Koong Perormance Video|쿵 퍼포먼스 비디오|xikers Koong PV|Koong|민재|준민|수민|진식|현우|정훈|세은|유준|헌터|예찬|MINJAE|JUNMIN|SUMIN|JINSIK|HYUNWOO|JUNGHOON|SEEUN|YUJUN|HUNTER|YECHAN","4436584","58369","0","4362","https://i.ytimg.com/vi/CjOTjaTgSw0/default.jpg","False","False","[Koong]Performance Video Release Date : 2023. 07. 27 12AM (KST) [HOUSE OF TRICKY : HOW TO PLAY]Album Release Date : 2023. 08. 02 6PM (KST)▶ xikers Official Platformhttps://xikers.kr▶ xikers Official Twitter: https://twitter.com/xikers_official▶ xikers Official Instagram:https://instagram.com/xikers_official/▶ xikers Official TikTok:https://tiktok.com/@xikers_official/▶ xikers Official Facebook:  https://facebook.com/xikersKQ/▶ KQ Official Homepage: http://kqent.com▶ KQ Official Facebook: https://facebook.com/kqent▶ KQ Official Twitter: https://twitter.com/kqent▶ KQ Official Instagram:https://instagram.com/kqent#xikers #싸이커스 #Koong #쿵 #2NDMINIALBUM #HOUSE_OF_TRICKY #HOW_TO_PLAY #KQ"
"Xthv8r2cIGc","S04-PK vor Hamburg | FC Schalke 04","2023-07-26T11:22:13Z","UCEa_Oh2Ut2G05AGue5QNUzA","FC Schalke 04","17","23.28.07","[none]","74799","2342","0","228","https://i.ytimg.com/vi/Xthv8r2cIGc/default.jpg","False","False","Es geht wieder los! Der FC Schalke 04 eröffnet die Zweiligasaison 2023/2024 beim Hamburger SV. Vor dem Duell steht Chef-Trainer Thomas Reis am Mittwoch (26.7.) ab 13 Uhr den Journalisten Rede und Antwort. Schalke TV überträgt die Spieltags-Pressekonferenz live in voller Länge.► #UpToDate - PKs, Interviews, Highlights etc.► #EinLebenLang - Abonnieren/Subscribe: https://s04.de/YoutubeAboShop: https://shop.schalke04.de/Website: https://schalke04.deFacebook: https://s04.de/facebookTwitter: https://s04.de/twitterInstagram: https://s04.de/instagramGiphy: https://s04.de/giphy"
"mljj92tRwlk","#Gadar2 Official Trailer | 11th August | Sunny Deol | Ameesha Patel | Anil Sharma | Zee Studios","2023-07-26T14:00:13Z","UC3jMepkLKF8y4iiwWmAB3RA","Zee Studios","1","23.28.07","Zee Studios|Bollywood Cinema|Hindi Cinema|Bollywood movie|Latest bollywood movie|Gadar 2 upcoming bollywood movie|Trailer|zee|entertainment|popular|famous|superhit|Blockbuster movie|Sunny Deol|Ameesha Patel|Sunny Deol Movie Gadar 2|Gadar 2 Teaser|Gadar 2 Trailer|Sunny Deol Action|Hindustan Zindadabad|Sakeena|Tara Singh|Utkarsh Sharma|Anil Sharma|Latest 2023 Trailer","49927883","876118","0","72863","https://i.ytimg.com/vi/mljj92tRwlk/default.jpg","False","False","Apne parivaar aur desh ke liye, ek baar phir se Gadar machayega Tara Singh! 💥💪🏻On the occasion of #KargilVijayDiwas, presenting you all with #Gadar2Trailer 🔥#Gadar2 aa rahi hai bade parde par 🔥 lagane iss Independence Day! 🇮🇳 Cinemas mein 11th August se 🎞️#SunnyDeol #AmeeshaPatel #AnilSharma #ZeeStudios Get 1+1 on Movie Tickets - https://m.paytm.me/dl_gadar2Zee Studios PresentsDirected by - Anil SharmaProduced by - Zee StudiosProduced by - Anil Sharma Productions, MM Moviez Co-Producer - Suman SharmaStarring -Sunny DeolAmeesha Patel Utkarsh SharmaManish WadhwaGaurav ChopraLuv SinhaIntroducing - Simrat KaurWritten by - Shaktimaan TalwarCinematographer - Najeeb KhanMusic - MithoonLyricist - Sayeed QuadriChoreography - Shabina KhanProduction Desginer - Muneesh SappelCostumes Stylists - Nidhi Yasha, Gagan Oberoi (Sunny Deol)Action Directors - Ravi Verma, Tinu Verma, Shyam Kaushal & Abbas Ali MoghulBackground Music - Monty SharmaEditor - Ashfaq Makrani & Sanjay SankhlaSound Designer - Jitendra Chaudhry Mixing - Anup DevExecutive Producer - Rana BhatiaSound Designer (SFX) - Kingshuk MoranSecond Unit Cameraman - Azeez SiddiquiAssociate Directors - Hidayat Khan & Hanish LambaVFX - Pixelld Studios, Prisca Di - Prime Focus Colorist - Ashirwaad Visual Promotions - MA+TH (Marching Ants+ Trigger Happy) •Member of Hakuhodo International•Poster Design - Rahul Nanda Stay Updated On:https://www.facebook.com/ZeeStudios​https://twitter.com/ZeeStudios_​https://www.instagram.com/zeestudiosofficial/https://www.youtube.com/ZeeStudiosofficial"
