video_id,title,publishedAt,channelId,channelTitle,categoryId,trending_date,tags,view_count,likes,dislikes,comment_count,thumbnail_link,comments_disabled,ratings_disabled,description
"ywjupbGPuYM","Carlee Russell: Full police press conference | FOX 5 News","2023-07-19T20:10:22Z","UCjHWv2DU5-HLpogAAr386DQ","FOX 5 Atlanta","25","23.22.07","Carlee Russell|Carlee Russell update|carlee russell found|carlee|alabama woman found|missing alabama woman","742868","6463","0","5393","https://i.ytimg.com/vi/ywjupbGPuYM/default.jpg","False","False","The Hoover Police Department held a press conference to give details in the investigation into the reported abduction of Carlee Russell.0:00 Press conference begins0:56 Mayor Frank Vincent Brocato2:39 Chief Nicholas Derzis4:50 Carlee Russell 911 call7:36 Chief gives timeline14:38 Q&ASubscribe to FOX 5 Atlanta!: https://bit.ly/3vpFpcmWatch FOX 5 Atlanta Live: https://www.fox5atlanta.com/liveFOX 5 Atlanta delivers breaking news, live events, investigations, politics, entertainment, business news and local stories from metro Atlanta, north Georgia and across the nation.Watch more from FOX 5 Atlanta on YouTube:FOX 5 News: https://www.youtube.com/playlist?list=PLUgtVJuOxfqkmrF1fONNmi8nKI0Z-FPE-FOX 5 Atlanta I-Team: https://www.youtube.com/playlist?list=PLUgtVJuOxfqlb_I16wBwizoAoUsfKEeWBGood Day Atlanta: https://www.youtube.com/playlist?list=PLUgtVJuOxfqlKT5xsbsPFgr5EBzdsWTvGFOX 5 Extras: https://www.youtube.com/playlist?list=PLUgtVJuOxfqli-5MS_2X-i6bNGWvV0RYPYou Decide: https://www.youtube.com/playlist?list=PLUgtVJuOxfqnCKb7UkRde2NXuaoPEAXutDownload the FOX 5 Atlanta app: https://www.fox5atlanta.com/appDownload the FOX 5 Storm Team app: https://www.fox5atlanta.com/stormFollow FOX 5 Atlanta on Facebook: https://facebook.com/fox5atlantaFollow FOX 5 Atlanta on Twitter: https://twitter.com/FOX5AtlantaFollow FOX 5 Atlanta on Instagram: https://www.instagram.com/fox5atlanta/Subscribe to the Morning Brief and other newsletters from FOX 5 Atlanta: https://www.fox5atlanta.com/email"
"w-Gk-Cq0Sn8","Buying a cheap tractor","2023-07-20T15:54:26Z","UCUujfNBK9uv3cIW-P5PX7vA","Andrew Camarata","2","23.22.07","[none]","456775","28887","0","2084","https://i.ytimg.com/vi/w-Gk-Cq0Sn8/default.jpg","False","False","Buying a 1968 Ford tractor, then installing a new 3pt hay blower on it. Painting it, new seat, basic maintenance then running a brush mower."
"uBekcGq99Z4","Barbie's Dream Divorce","2023-07-20T17:53:06Z","UCywhnhPP3dAw7huG_y0hdEg","Brandon Rogers","10","23.22.07","[none]","202794","28906","0","1100","https://i.ytimg.com/vi/uBekcGq99Z4/default.jpg","False","False","Barbie's done with all his s***shot by Liam KrugJensyn Clement as Barbie Brandon Rogers as Ken"
"xhHjhdwD8gk","Interstellar Pitch Meeting","2023-07-20T19:00:33Z","UC9Kq-yEt1iYsbUzNOoIRK0g","Pitch Meeting","24","23.22.07","Interstellar|Matthew McConaughey|anne hathaway|christopher nolan|hans zimmer|matt damon|michael caine|nolan|pitch meeting|ryan george|screen rant|super easy barely an inconvenience|time|timothee chalamet|waves","698973","56024","0","3872","https://i.ytimg.com/vi/xhHjhdwD8gk/default.jpg","False","False","Step inside the Pitch Meeting that led to Interstellar!Subscribe for more Pitch Meetings: https://www.youtube.com/channel/UC9Kq-yEt1iYsbUzNOoIRK0gChristopher Nolan has made a name for himself making intellectual mind-bendy movies with films like Memento, Inception and Tenet. Let’s just say it, the dude is a little obsessed with time. He’s one of the few filmmakers making truly “epic” movies, and it’s really cool when you can understand them.Interstellar definitely raises some questions though. Like why doesn’t anyone seem to care about Tom? Why did they decide to go down to that time dilation planet first? Why did they try to collect that worthless data? Why was there a Matt Damon jumpscare on the second planet? Why did Tom name his kid Coop Cooper? Why did Cooper send the same “stay” message that he knew did not get him to stay?To answer all these questions, check out the pitch meeting that led to Interstellar!Check Out These Other Videos:Indiana Jones and the Dial of Destiny Pitch Meetinghttps://www.youtube.com/watch?v=7N5nQPNCNkgThe Flash Pitch Meetinghttps://www.youtube.com/watch?v=nzlSBBVpbS4Our Social Media:https://twitter.com/screenranthttps://www.facebook.com/PitchMeetingOur Websitehttp://screenrant.com/"
"JoVhE3MftPc","AMP LOVE & BASKETBALL 2","2023-07-19T00:43:46Z","UCJbYdyufHR-cxOuY96KIoqA","AMP","24","23.22.07","AMP LOVE & BASKETBALL|AMP LOVE & BASKETBALL 2|AMP BASKETBALL|KAI CENAT|DUKE DENNIS|FANUM|AGENT 00|IMDAVISSS|CHRISNXTDOOR|YOURRAGE|JIDION|ISHOWSPEED","2860862","142851","0","6552","https://i.ytimg.com/vi/JoVhE3MftPc/default.jpg","False","False","GET APPAREL DROP 2 BEFORE ITS SOLD OUT https://amp.shopSUB TO THE AMP PODCAST CHANNEL https://www.youtube.com/channel/UC51ypdbMnEyRb9f9MCOg_Vg?sub_confirmation=1SHOUTOUT THE GIRLS FOR SHOWING OUT!AMP AMP AMP AMP📸 Follow us on Instagram: https://www.instagram.com/ampexclusive🦅 Follow us on Twitter: https://twitter.com/ampexclusive⚡️⚡️AMP⚡️⚡️⚡️Fanum aka JustFanum🎥 https://www.youtube.com/c/FanumReacts/videos📸 https://www.instagram.com/elfanum/🦅 https://twitter.com/FanumTV⚡️Duke aka Duke Dennis🎥 https://www.youtube.com/c/DeeBlockDukeDennis📸 https://www.instagram.com/duke_dennis/🦅 https://twitter.com/ImDukeDennis⚡️Agent aka Agent 00🎥 https://www.youtube.com/user/CallMeAgent00📸 https://www.instagram.com/callmeagentzero/🦅 https://twitter.com/CallMeAgent00⚡️Davis aka ImDavisss🎥  https://www.youtube.com/c/ItsDavisss📸 https://www.instagram.com/imdavisssyt/🦅 https://twitter.com/imdavisss⚡️ Kai aka Kai Cenat🎥 https://www.youtube.com/c/KaiCenat📸 https://www.instagram.com/kai_cenattv/🦅 https://twitter.com/KaiCenat⚡️Chris aka chrisnxtdoor🎥 https://www.youtube.com/watch?v=yEREEVk06ZM📸 https://www.instagram.com/chrisnxtdoor_/🦅 https://twitter.com/chrisnxtdoor_"
"VxLrmkWHtu4","The Weeknd's Awful TV Show Ended Early and He's FURIOUS.","2023-07-19T21:00:08Z","UCHTM9IknXs4ZHzwHqDjakoQ","D'Angelo Wallace","23","23.22.07","d'angelo wallace|funny|commentary|comedy|satire","1108423","69911","0","4933","https://i.ytimg.com/vi/VxLrmkWHtu4/default.jpg","False","False","If you’re ever injured in an accident, you can check out Morgan & Morgan. Their fee is free unless they win. For more information go to https://forthepeople.com/DAngeloWallaceI finally watched episode 4 and episode 5 of The Idol, the new HBO and Max show from Euphoria creator Sam Levinson, starring Abel “The Weeknd” Tesfaye and Lily-Rose Depp. I wish I didn't!"
"7aDQIEbFB8M","my friends room was messy... so I Built His DREAM Room!","2023-07-20T17:59:56Z","UCwVg9btOceLQuNCdoQk9CXg","Ben Azelart","24","23.22.07","ben azelart|brent rivera|Lexi rivera|stokes twins|ben Azelart girlfriend|Lexi rivera boyfriend|mylifeaseva|lexi hensler|Andrew davila|pierson|Pierson wodzynski|Jeremy hutchins|dom brack|Brent and pierson|Airrack|mrbeast|preston|unspeakable|Mathew beem|Ryan trahan","2016499","37714","0","2895","https://i.ytimg.com/vi/7aDQIEbFB8M/default.jpg","False","False","My best friend Jeremy's room was MESSY... So, we surprised him with his DREAM ROOM!Shoutout to @rug !Subscribe to @StayWildVlogs  GET THE MERCH! https://staywildshop.comSubscribe to my friends!@CamHuff @DerekandMatthew @Alexa Rivera@Brent Rivera@Jeremy Hutchins@Liv Swearingen@Pierson@Andrew Davila☆ FOLLOW ME!INSTAGRAM: @BenAzelart https://www.instagram.com/benazelart/YOUTUBE: Ben Azelart https://www.youtube.com/benazelart/SNAPCHAT: @BenAzelart"
"D6RUR79SesE","Marvel's Spider-Man 2 - STORY TRAILER REACTION","2023-07-20T23:20:37Z","UCWkdg1JlFH--qu0HVN_RBow","Caboose","20","23.22.07","Spider-Man|spiderman|spiderman 2|Spider-man 2|New|Today|Last|Hour|1080p|Spider-Man 2 story trailer|Spiderman 2 story trailer|Spiderman 2 venom trailer|Spider-Man 2 venom trailer|Caboose|Venom|Spider|Man|Spiderman 2 symbiote|Spider-Man 2 symbiote|PS5|PlayStation|PlayStation 5|Sony|Marvel|spiderman 2 new trailer|spider-man 2 new trailer|spiderman 2 hall h|spider-man 2 hall h|SDCC|comic con|hall h|spiderman 2 venom story trailer|venom|symbiote|sdcc hall h","130869","8215","0","694","https://i.ytimg.com/vi/D6RUR79SesE/default.jpg","False","False","Marvel’s Spider-Man 2 - OFFICIAL STORY TRAILER REACTION! I was there LIVE in Hall H when they dropped the NEW story trailer for Spider-Man 2! Check out my reaction. 👓 - Sponsored by GamerAdvantage! Use code Caboose at checkout for 10% off: https://gameradvantage.com/?ref=CABOOSE💬 - Join my Discord! You can interact with me and The Cavalry here: https://discord.gg/SSR44pJ🔴 -  Official Elgato Partner: https://e.lga.to/Caboose📱 - Follow me on Twitter: https://twitter.com/CabooseEK📷:Follow me on Instagram: http://instagram.com/CabooseEKCheck out my other videos on the channel: Which Edition of Marvel's Spider-Man 2 Should YOU Buy?: https://www.youtube.com/watch?v=2aa8g32U_NQMarvel's Spider-Man 2 - Things Are Starting to get Crazy: https://www.youtube.com/watch?v=BIedDtHB-5Q&ab_channel=Caboose📣: Logo Created By: https://twitter.com/pixelflaregfx https://www.pixelflarestudios.com/Like, Favourite, Comment and Subscribe!ABOUT MARVEL'S SPIDER-MAN 2:Kraven’s Hunters are in pursuit of Dr. Curt Connors, AKA The Lizard, and Spider-Men, Peter Parker and Miles Morales, need to stop them. Launching Fall 2023, Marvel’s Spider-Man 2 is the next game in PlayStation’s critically acclaimed Marvel’s Spider-Man franchise. Developed for the PlayStation®5 console in collaboration with PlayStation and Marvel Games. There are many Marvel's Spider-Man 2 Videos on the Caboose YouTube channel. I am covering everything leading up to this games release including: Easter Eggs and Things YOU MISSED for Marvel's Spider-Man 2, The Editions of Marvel's Spider-Man 2, Gameplay Trailer Reactions for Marvel's Spider-Man 2, All Confirmed Villains so far in Marvel's Spider-Man 2, The Story of Marvel's Spider-Man 2, Speculation and Theories for Marvel's Spider-Man 2, Who is Venom in Marvel's Spider-Man 2, the pre-order bonus alternate suits in Marvel's Spider-Man 2, the Symbiote abilities for Peter Parker in Marvel's Spider-Man 2, the Blue Bioelectric abilities for Miles Morales in Marvel's Spider-Man 2 and SO Much More!#SpiderMan2PS5 #SpiderMan2 #BeGreaterTogether"
"6Gv6A5dy3VM","Last To Stop Riding Wins $10,000 (Off-Road Edition)","2023-07-19T14:00:05Z","UCtNBFUsxj2YVbEc5HquzFqg","Carter Sharer","24","23.22.07","Carter Sharer|Team RAR|carter|carter share","665628","7769","0","493","https://i.ytimg.com/vi/6Gv6A5dy3VM/default.jpg","False","False","🔥SHOP NOW!!🔥━► https://www.teamrar.com/ Get ready for an adrenaline-fueled off-road adventure like never before! Join us on an epic Last to Stop Riding Challenge at the breathtaking Busco Beach! Who will come out as the winner in this endurance filled challenge? Will it be Carter? Andrew? Matt? Drew? Or Richard? Keep watching to find out who takes home the prize!💌SEND US YOUR FAN MAIL!!💌Team RAR4501 New Bern Ave Suite 130, Box # 360Raleigh NC, 27610❇️ MORE EPIC VLOGS ❇️-----------------------------------------------------------------------------------------------------------📷INSTAGRAM → @CarterSharer https://www.instagram.com/cartersharer/📷INSTAGRAM → @OfficalTeamRAR https://www.instagram.com/officialteamrar/📷INSTAGRAM → @LizzyCapri https://www.instagram.com/lizzycapri/📘FACEBOOK → CARTER SHARER OFFICIAL https://goo.gl/WM7mBuSubscribe to my channel! https://goo.gl/XjjCA8-----------------------------------------------------------------------------------------------------------Business Inquiries: carter@nightmedia.coWARNING: This video is only for entertainment purposes. Do not attempt to recreate any of the acts in this video, as they may be dangerous if not done correctly, and could result in serious injury. If you rely on the information portrayed in this video, you assume the responsibility for the results. Have fun, but always think ahead, and remember that every project you try is at YOUR OWN RISK.This footage is property of Team RAR inc. and is not allowed to be repurposed without written consent from Team RAR inc. For any requests from media contact us at carter@nightmedia.co"
"8iLba9yaRFs","THE END OF CASH MONEY MAWK","2023-07-19T18:23:56Z","UC4G10tk3AHFuyMIuD3rHOBA","RDCworld1","1","23.22.07","[none]","740234","77428","0","4942","https://i.ytimg.com/vi/8iLba9yaRFs/default.jpg","False","False","Did the top-selling recording artist of all time finally meet his match?! Cash Money Mawk has always been an inspiration to the kids, how could this happen??Cash Money Mawk Official Youtooz drops July 21st here: https://youtooz.com/products/cash-money-mawk🌎RDC's SOCIALS🌎Mark - @SupremeDreams_1Aff - @AffiongLeland - @23_Is_LelandDylan - @DylanPatel4_Desmond - @l0v3andPeac3Benjamin - @Ive_Ben_JamminJohn - @PlayThatJohnNNW Mauri - @cantbmauriSPECIAL THANKS TOhttps://www.instagram.com/kalani_rodgers/https://www.instagram.com/brazenbri/https://www.instagram.com/leahraquelofficial/https://www.instagram.com/theautumnpaige/https://www.instagram.com/jessicalynndiaz/https://www.instagram.com/iamnhiyablu/https://www.instagram.com/kurlyyyjayyy/https://www.instagram.com/theicebrothers/EARLY RELEASES DROPPING HERE: https://www.rdcuniverse.com/FREE 7-DAY TRIAL🌎 REAL DREAMS CHANGE THE WORLD 🌎🗣️ TWITTER: https://twitter.com/RDCworld1📷 IG: https://www.instagram.com/rdcworld1/👔 MERCH: https://rdcworld1.com🎮 GAMING CHANNEL: https://www.youtube.com/@RDCWorldGaming👾 TWITCH: https://www.twitch.tv/rdcgaming🎙️ PODCAST: https://linktr.ee/rdcworld💜 DISCORD: https://discord.gg/rdcworld1☁️ DREAM CON: https://www.dreamconvention.com🎵 SOUNDCLOUD: https://soundcloud.com/rdcworld"
"Xzv84ZdtlE0","Why Oppenheimer Deserves His Own Movie","2023-07-18T23:28:16Z","UCHnyfMqiRRG1u-2MsSQLbXA","Veritasium","27","23.22.07","veritasium|science|physics","5259263","221516","0","10688","https://i.ytimg.com/vi/Xzv84ZdtlE0/default.jpg","False","False","J. Robert Oppenheimer forever changed the course of history. He may be the most important physicist to have ever lived. Part of this video is sponsored by Wren. Offset your carbon footprint on Wren: ​https://www.wren.co/start/veritasium1 For the first 100 people who sign up, I will personally pay for the first month of your subscription!If you want to learn more about Oppeheimer, I strongly recommend the book “American Prometheus” By Kai Bird and Martin Sherwin. It is a remarkable book, very much deserving of the Pulitzer prize it received.If you’re looking for a molecular modeling kit, try Snatoms – a kit I invented where the atoms snap together magnetically – https://ve42.co/SnatomsV▀▀▀A huge thank you to Dr. Martin Rohde and Dr. Antonia Denkova from the TU Delft for proofreading the script and providing valuable feedback.▀▀▀References:Bird, K., & Sherwin, M. J. (2021). American Prometheus: the triumph and tragedy of J. Robert Oppenheimer. Atlantic Books.Smith, A. K., & Weiner, C. (1980). Robert Oppenheimer: letters and recollections. Bulletin of the Atomic Scientists, 36(5), 19-27. - https://ve42.co/Smith1980 Combes, J. M., Duclos, P., & Seiler, R. (1981). The born-oppenheimer approximation. Rigorous atomic and molecular physics, 185-213. - https://ve42.co/Combes1981 Rhodes, R. (2012). The making of the atomic bomb. Simon and Schuster.Oppenheimer, J. R., & Volkoff, G. M. (1939). On massive neutron cores. Physical Review, 55(4), 374. - https://ve42.co/Oppenheimer1939b Oppenheimer, J. R. (1927). Bemerkung zur Zerstreuung der α-Teilchen. Zeitschrift für Physik, 43(5-6), 413-415. - https://ve42.co/Oppenheimer1927 Oppenheimer, J. R. (1927). Zur quantenmechanik der richtungsentartung. Zeitschrift für Physik, 43(1-2), 27-46. - https://ve42.co/Oppenheimer1927b Born, M., & Oppenheimer, R. (1927). Zur Quantentheorie der Molekeln Annalen der Physik, v. 84. - https://ve42.co/Born1927 Oppenheimer, J. R. (1928). Three notes on the quantum theory of aperiodic effects. Physical review, 31(1), 66.Oppenheimer, J. R. (1928). On the quantum theory of the capture of electrons. Physical review, 31(3), 349.Oppenheimer, J. R. (1931). Note on light quanta and the electromagnetic field. Physical Review, 38(4), 725.Furry, W. H., & Oppenheimer, J. R. (1934). On the theory of the electron and positive. Physical Review, 45(4), 245. - https://ve42.co/Oppenheimer1934 Oppenheimer, J. R. (1935). Note on charge and field fluctuations. Physical Review, 47(2), 144. - https://ve42.co/Oppenheimer1935 Oppenheimer, J. R., & Snyder, H. (1939). On continued gravitational contraction. Physical Review, 56(5), 455. - https://ve42.co/Oppenheimer1939 Oppenheimer, J. R., & Phillips, M. (1935). Note on the transmutation function for deuterons. Physical Review, 48(6), 500. - https://ve42.co/Oppenheimer1935b Malik, J. (1985). Yields of the Hiroshima and Nagasaki nuclear explosions (No. LA-8819). Los Alamos National Lab.(LANL), Los Alamos, NM (United States). - https://ve42.co/Malik1985 Ignition of the atmosphere with nuclear bombs -- https://ve42.co/Konopinski46▀▀▀Special thanks to our Patreon supporters:Adam Foreman, Amadeo Bee, Anton Ragin, Balkrishna Heroor, Benedikt Heinen, Bernard McGee, Bill Linder, Blake Byers, Burt Humburg, Dave Kircher, Diffbot, Evgeny Skvortsov, Gnare, John H. Austin, Jr., john kiehl, Josh Hibschman, Juan Benet, KeyWestr, Lee Redden, Marinus Kuivenhoven, Meekay, meg noah, Michael Krugman, Orlando Bassotto, Paul Peijzel, Richard Sundvall, Sam Lutfi, Stephen Wilcox, Tj Steyn, TTST, Ubiquity Ventures▀▀▀Written by Petr Lebedev & Derek MullerEdited by Trenton Oliver & Katrina JacksonFilmed by Derek MullerAnimation by Fabio Albertelli, Ivy Tello, & Mike RadjabovIllustration by Jakub Misiek and Celia BodeAdditional video/photos supplied by Getty Images & Pond5Music from Epidemic Sound"
"H3jaIhSj23E","Oppenheimer - Movie Review","2023-07-19T16:00:21Z","UCCqEeDAUf4Mg0GgEN658tkA","Chris Stuckmann","24","23.22.07","Oppenheimer|Movie Review|Chris Stuckmann|Reviews|Film|Scene|Clip|Trailer|Teaser|IMAX|Sound|Mix|Dialogue|Subtitles|Cillian Murphy|Emily Blunt|Robert Downey Jr.|Matt Damon|Rami Malek|Florence Pugh|Benny Safdie|Michael Angarano|Josh Hartnett|Kenneth Branagh|Trinity Test|2023|Christopher Nolan|Josh Peck","907697","37425","0","3398","https://i.ytimg.com/vi/H3jaIhSj23E/default.jpg","False","False","Chris Stuckmann reviews Oppenheimer, starring Cillian Murphy, Emily Blunt, Robert Downey Jr., Matt Damon, Rami Malek, Florence Pugh, Benny Safdie, Michael Angarano, Josh Hartnett, Kenneth Branagh. Directed by Christopher Nolan."
"IuP9TZ1ilE8","Someone Broke Into Our NEW Home..","2023-07-19T22:29:27Z","UCtj45MepAoKxZoyR_Mnt86Q","Queen & Clarence","24","23.22.07","queen Naija|Medicine|Queen|Royalty Squad|Spicy Mafia|ClarenceNYC TV|Clarence white|cj|legend|queen and clarence|clarence and queen|Broke in to new house|Queen naija house break in","270457","13625","0","1460","https://i.ytimg.com/vi/IuP9TZ1ilE8/default.jpg","False","False","Queen's Instagram: https://www.instagram.com/queennaija/Queen's Twitter: https://www.twitter.com/queennaija/Queen's SnapChat: QueennaijaClarence's Instagram: https://www.instagram.com/clarencenyc/Clarence's Twitter:  https://www.twitter.com/clarencenyc/Clarence's SnapChat: ClarencenycCJ's Instagram: https://www.instagram.com/iamcjsails/Legend's Instagram: https://www.instagram.com/iamlegend/Business inquires: info@spicymanagement.com"
"bsinF-k9q4s","We Were Umpires In A Real Baseball Game!","2023-07-19T17:05:00Z","UCtbR0PykhOjHOMqfkbIw5kA","Momentum","17","23.22.07","baseball|momentum|strikeout|documentary|video|pitching|hitting|mlb|milb|the game|the show|commissioner|rob manfred|trevor bauer|mike clevinger|major leagues|watch momentum|pitcher|pitch|bauer bytes|live at bats|los angeles dodgers|dodgers|rachel luba|behind the scenes|day in the life|free agency|sports|inside the covid season|major league baseball|trevor bauer vlog|yasiel puig|trevor bauer mic'd up|vlog","535216","9770","0","535","https://i.ytimg.com/vi/bsinF-k9q4s/default.jpg","False","False","Go to https://www.chime.com/momentum to sign up for a Chime Credit Builder Visa Credit Card today! Thanks to Chime for supporting the show👇Follow Momentum on social media👇 https://www.twitter.com/Watch_Momentumhttps://www.instagram.com/watch_momentumhttps://www.facebook.com/WatchMomentum1/https://www.tiktok.com/@watch_momentumSHOP MOMENTUM at https://watch-momentum.com/shopMusicBed ID: MB01N1DFYKX2TOJ#baseball #softball #umpire"
"FhVOY0EfsPA","'The Summer I Turned Pretty' Cast Plays I Dare You | Teen Vogue","2023-07-19T16:00:20Z","UCr7ZFxNlDvb3waeoTN1_3mA","Teen Vogue","24","23.22.07","amazon|amazon prime|belly conrad jeremiah|celebrity|christopher briney|comedy|david iacono|drama|elsie fisher|entertainment|gavin casalegno|jenny han|lola tung|sean kaufman|summer i turned pretty|team conrad|team jeremiah|teen drama|teen vogue|the summer i turned pretty|the summer i turned pretty belly|the summer i turned pretty cast|the summer i turned pretty interview|the summer i turned pretty season 2|tsitp|tsitp interview|tv","477555","13220","0","301","https://i.ytimg.com/vi/FhVOY0EfsPA/default.jpg","False","False","The cast of Amazon Prime's 'The Summer I Turned Pretty' plays a fun game of I Dare You! Lola Tung, Christopher Briney, Gavin Casalegno, Sean Kaufman, David Iacono & Elsie Fisher take turns choosing between truths or dares to test their boldness. See the stars eat spoonfuls of hot sauce, battle each other in a dance-off, fold a fitted sheet in 30 seconds and more! Which member SCREAMED after an accidental kiss? Watch to find out!SAG-AFTRA members are currently on strike; as part of the strike, union actors are not promoting their film and TV projects. This video was conducted prior to the strike.Director: Jameer PondDirector of Photography: Jack BelisleEditor: Lucy NebekerTalent: Lola Tung, Chris Briney, Gavin Casalegno, Sean Kaufman, David Iacono, Elsie Fisher Producer: Madison CoffeyLine Producer: Jen SantosAssociate Producer: Rafael VasquezProduction Manager: Natasha Soto-Albors Talent Booker: Mica Medoff Camera Operator: Chloe RamosAudio Engineer: Lily Van Leuwen, Philip KimProduction Assistant: Ziyne AbdoPost Production Supervisor: Christian OlguinPost Production Coordinator: Scout AlterSupervising Editor: Erica DillmanAssistant Editor: Billy WardGraphics Supervisor: Ross RackinAssociate Manager, Creative Development: Ali FarooquiStill haven’t subscribed to Teen Vogue on YouTube? ►► http://bit.ly/tvyoutubesub ABOUT TEEN VOGUEFashion, beauty tips, celebrity style, pop culture, videos, and more—everything you need to be ahead of the trends.  Fashion starts here."
