video_id,title,publishedAt,channelId,channelTitle,categoryId,trending_date,tags,view_count,likes,dislikes,comment_count,thumbnail_link,comments_disabled,ratings_disabled,description
"iKNw1mnA5M0","Philadelphia I-95 Bridge Collapse Explained","2023-07-18T13:00:35Z","UCMOqf8ab-42UUQIdVoKwjlQ","Practical Engineering","27","23.20.07","[none]","453245","21485","0","1603","https://i.ytimg.com/vi/iKNw1mnA5M0/default.jpg","False","False","An overview of bridge fires and how I-95 was reopened within 2 weeks.🌌Get Nebula using my link for 40% off an annual subscription: https://go.nebula.tv/Practical-Engineering🚆Watch How Shanghai Built the World’s Largest Metro System: https://nebula.tv/videos/city-beautiful-how-shanghai-built-the-worlds-largest-metro-system?ref=practical-engineeringTanker truck fires at bridges happen rarely, but when they do, they often lead to a collapse or at least a replacement. How do engineers characterize bridge fires, and should bridges be better protected against them?Great article on the MacArthur Maze repairs: https://www.sfgate.com/bayarea/article/A-MAZE-ING-His-reputation-on-the-line-2592154.phpWatch this video ad-free on Nebula: https://nebula.tv/videos/practical-engineering-philadelphia-i95-bridge-collapse-explained?ref=practical-engineeringSigned copies of my book (plus other cool stuff) are available here: https://store.practical.engineering/Practical Engineering is a YouTube channel about infrastructure and the human-made world around us. It is hosted, written, and produced by Grady Hillhouse. We have new videos posted regularly, so please subscribe for updates. If you enjoyed the video, hit that ‘like’ button, give us a comment, or watch another of our videos!CONNECT WITH ME____________________________________Website:         http://practical.engineeringTwitter:           https://twitter.com/HillhouseGradyInstagram:     https://www.instagram.com/practicalengineeringReddit:            https://www.reddit.com/r/PracticalEngineeringFacebook:      https://www.facebook.com/PracticalEngineerGrady​Patreon:         http://patreon.com/PracticalEngineeringSPONSORSHIP INQUIRIES____________________________________Please email my agent at practicalengineering@standard.tvDISCLAIMER____________________________________This is not engineering advice. Everything here is for informational and entertainment purposes only. Contact an engineer licensed to practice in your area if you need professional advice or services. All non-licensed clips used for fair use commentary, criticism, and educational purposes.SPECIAL THANKS____________________________________This video is sponsored by Nebula.Stock video and imagery provided by Getty Images and the Associated Press.Music by Epidemic Sound: http://epidemicsound.com/creatorTonic and Energy by Elexive is licensed under a Creative Commons Attribution LicenseSource: https://www.youtube.com/watch?v=U6fBPdu8w9UVideo by Grady HillhouseEdited by Wesley CrumpProduced by Ralph CreweProduction Assistance from Josh LorenzDrone footage by @billykyle"
"YB1uFF53guQ","JE METS LES CHOSES AU CLAIR. (FAQ 2023)","2023-07-18T15:54:02Z","UCUl7mwOyySfZzUkq4H29nug","LeBouseuh","24","23.20.07","faq|lebouseuh|je reponds a vos questions|lebouseuh faq","574619","51874","0","697","https://i.ytimg.com/vi/YB1uFF53guQ/default.jpg","False","False","Abonne toi à ma chaîne ►  http://urlz.fr/4jF2N'hésite pas non plus à lâcher le petit pouce bleu des famillesFAQ été 2023 afin d'en savoir plus sur moi et ce qui m'entoure !Merci encore pour vos questions sur Instagram↓REJOINS MOI SUR LES RESEAUX↓◦ Instagram : https://www.instagram.com/levraibouseuh/◦ Twitter : https://twitter.com/lebouseuh◦ Twitch : https://www.twitch.tv/lebouseuh◦ Facebook : https://www.facebook.com/lebouseuh/"
"2zG-ZrC4BO0","Why This NASA Battery May Be The Future of Energy Storage","2023-07-18T12:16:56Z","UCjtUS7-SZTi6pXjUbzGHQCg","Undecided with Matt Ferrell","28","23.20.07","batteries|battery|energy storage|energy storage battery|energy storage solutions|energy storage systems|energy storage technologies|lithium ion battery|nickel hydrogen battery|renewable energy|undecided with matt ferrell","508190","21228","0","1436","https://i.ytimg.com/vi/2zG-ZrC4BO0/default.jpg","False","False","Is this the perfect battery? Go to https://brilliant.org/Undecided/ and get 20% off your subscription and a 30 day free trial with Brilliant.org! What do you do if a satellite runs out of batteries? It’s prohibitively expensive to send a team into orbit and pop in some new AAs, and as a result many satellites use very efficient, reliable and long-lived nickel-hydrogen batteries. We’re talking about batteries that last decades. That sounds like the sort of battery that could revolutionize grid-scale energy storage and really help out renewables back here on Earth, which is why EnerVenue is backing nickel hydrogen batteries as the next step forward! But if batteries rugged and powerful enough for spacecraft already exist, then why haven’t we used it back here on Earth until now?Fully Charged Live Canada (25% off with code UNDECIDED): https://link.undecidedmf.com/fullychargedliveHydrogen safety demonstration video - AlChE Academy: https://www.aiche.org/iliWatch Is Small, Fast, & Cheap the Future of Nuclear Energy? https://youtu.be/L31px6rQ-vQ?list=PLnTSM-ORSgi4dFnLD9622FK77atWtQVv7Video script and citations:https://undecidedmf.com/why-this-nasa-battery-may-be-the-future-of-energy-storage/Get my achieve energy security with solar guide: https://link.undecidedmf.com/solar-guideFollow-up podcast:Video version - https://www.youtube.com/channel/UC4-aWB84Bupf5hxGqrwYqLAAudio version - http://bit.ly/stilltbdfmJoin the Undecided Discord server:https://geni.us/undecided-discord👋 Support Undecided on Patreon!https://www.patreon.com/mattferrell⚙️ Gear & Products I Likehttps://undecidedmf.com/shop/Great sustainable products for your home:https://geni.us/buildwithriseVisit my Energysage Portal:Research solar panels and get quotes for free!http://www.energysage.com/p/undecided/Or find community solar near you:https://communitysolar.energysage.com/?rc=p-undecidedFor a curated solar buying experienceEnergyPal's free personalized quotes:https://energypal.com/undecidedTesla Referral Code:Get 1,000 free supercharging miles or a discount on Tesla Solar & Powerwallshttps://ts.la/matthew84515👉 Follow MeMastodonhttps://mastodon.social/@mattferrellTwitter https://twitter.com/mattferrellhttps://twitter.com/undecidedMFInstagramhttps://www.instagram.com/mattferrellhttps://www.instagram.com/undecidedmfFacebookhttps://www.facebook.com/undecidedMF/Websitehttps://undecidedmf.com📺 YouTube Tools I RecommendAudio file(s) provided by Epidemic Soundhttp://bit.ly/UndecidedEpidemicTubeBuddyhttps://www.tubebuddy.com/undecidedVidIQhttps://vidiq.com/undecidedI may earn a small commission for my endorsement or recommendation to products or services linked above, but I wouldn't put them here if I didn't like them.  Your purchase helps support the channel and the videos I produce.  Thank you.#FullyCharged LIVE"
"von_IMi97-w","What I learned from taking a train across the US","2023-07-18T14:38:38Z","UCLXo7UDZvByw2ixzpQCufnA","Vox","25","23.20.07","Travel|Vox.com|amtrak|explain|explainer|locomotive|railway|sleeper train|train car|trains|vox|journey|los angeles|new york city|LA|NYC|LA to NYC amtrak|train trip|passenger rail|freight train|train travel|underfunded|inefficient|rail network|us government|penn station|union station|grand central station|chicago|US department of transportation|department of transportation|summer travel|travel by train","568721","20402","0","1301","https://i.ytimg.com/vi/von_IMi97-w/default.jpg","False","False","Here’s how US train travel went from excellent to mediocre.Subscribe and turn on notifications 🔔  so you don't miss any videos: http://goo.gl/0bsAjO If you’ve taken the Amtrak recently, you might have no idea that the United States used to have the largest and wealthiest rail system in the world. How did the US go from having luxurious, widely used passenger trains to the Amtrak system we have today? Video producer Dean Peterson makes a 72-hour journey on Amtrak from LA to NYC to show its current state of operation. From getting kicked in the head by his sleeping seat mate to taking in sweeping views of the desert at sunset, Dean shows the highs and lows of being stuck on Amtrak for days on end. Along the way, he explains the history of passenger rail in the US — starting in the problematic robber baron era to the US government’s takeover of passenger rail. Will the United States ever catch up to the rest of the world when it comes to train travel, or are Americans stuck with an underfunded, inefficient rail network forever? Join Dean on his journey as he sets out to find out the answer to these questions and more.Sources:The Great Railroad Revolution by Christian Wolmarhttps://www.amazon.com/Great-Railroad-Revolution-History-America/dp/1610393473Amtrak, America's Railroad: Transportation's Orphan and Its Struggle for Survival (Railroads Past and Present) by  Geoffrey H. Doughty, Jeffrey T. Darbee, Eugene E. Harmonhttps://www.amazon.com/Amtrak-Americas-Railroad-Transportations-Railroads/dp/B0B5B5N3FLConquering Gotham: Building Penn Station and Its Tunnels by Jill Jonneshttps://www.amazon.com/Conquering-Gotham-Building-Station-Tunnels/dp/0143113240The Pennsylvania Railroad, Volume 1: Building an Empire, 1846-1917 By Albert J. Churellahttps://www.amazon.com/Pennsylvania-Railroad-Building-1846-1917-American/dp/081224348XZephyrs, chiefs & other orphans ; the first five years of Amtrak by Fred W Fraileyhttps://www.amazon.com/Zephyrs-Chiefs-Other-Orphans-Amtrak/dp/B0006WTC1KThe Golden Age of American Railroading by Judith Macy, Mary McInroy, and Robert McCownhttps://www.lib.uiowa.edu/exhibits/previous/railroad/Association of American Railroadshttps://www.aar.org/chronology-of-americas-freight-railroads/#:~:text=The%20Great%20Depression%20devastated,abandonments%20and%20deferred%20maintenanceMore information about roadway deaths vs. train deaths from the US Department of Transportation: https://www.transportation.gov/NRSS/SafetyProblem Travel is back in a big way this summer. Vox’s first-ever travel guide is answering some of your most pressing questions about travel. Keep up on the site where new articles and videos are being published each week in July: https://www.vox.com/e/23499975Vox is an explanatory newsroom on a mission to help everyone understand our weird, wonderful, complicated world, so that we can all help shape it. Part of that mission is keeping our work free. You can help us do that by making a gift: http://www.vox.com/givenowWatch our full video catalog: http://goo.gl/IZONyE Follow Vox on TikTok: http://tiktok.com/@voxdotcom Check out our articles: https://www.vox.com/Listen to our podcasts: https://www.vox.com/podcasts"
"hFyMgn16dC0","Buffet à volonté empoisonné : Qui choisira le plat piégé ?","2023-07-18T15:00:36Z","UCC_r3spMB5i5QKgtdNVO0OQ","Pierre Croce","23","23.20.07","pierre|croce|pierrecroce|funny|marrante|drole|vidéo|vidéos|youtubeur|lol|fun|comedie|comedy|comedien|benjamin|verrecchia","553825","23437","0","337","https://i.ytimg.com/vi/hFyMgn16dC0/default.jpg","False","False","Mon canal insta : https://ig.me/j/AbbHtE4Yypl2ol0d/Merci à @lucas_studio @Universdesora @BenjaminVerrecchia @emyltr @fredvanlong Cadrage : Mathieu Monconduit, Thibault Guieu,  Morgane Mariel,Montage : Lucas KientzyResponsable de production : Jordie BoillereauGraphisme : Lucas BlettnerMerci à Greg notre cuisinier : https://www.instagram.com/gregorio_dicarpaccio/?hl=frhttps://www.instagram.com/lapetiteepicerie_auteuil/?hl=fr"
"j2Pe_sUms94","change","2023-07-18T19:00:18Z","UCjVLCcrQsYX7Lu98pOcP3GA","Nicolas Sturniolo","22","23.20.07","Nick sturniolo|Nicolas sturniolo|Nicolas sturniolo hair|Nick sturniolo hair|Nicolas sturniolo blonde|Nick sturniolo blonde|Nick sturniolo best moments|Nicolas sturniolo change|Nicolas sturniolo hair salon|Sturniolo|Sturniolos|Nick sturniolo lip balm|Nicolas sturniolo Q&A","289697","46547","0","4962","https://i.ytimg.com/vi/j2Pe_sUms94/default.jpg","False","False","Follow Me on Instagram : https://www.instagram.com/nicolassturniolo Follow Me on TikTok : https://www.tiktok.com/@nicolassturnioloAdd me on Snapchat : @nicolassturn"
"tGTKY1dpo_E","Young Thug - Oh U Went (feat. Drake) [Official Video]","2023-07-17T17:00:09Z","UCuwdplPbuTFZj_64d03tSBA","Young Thug","10","23.20.07","Young Thug Business is Business|Business is Business|BIB|Young Thug BIB|Young Thug|Young Thug Drake|BIB Young Thug|Business is Business official visualizer|Young Thug official visualizer|Young Thug Business|new young thug|Business is business video|Young|Thug|Young Thug - Oh U Went (feat. Drake) [Official Visualizer]|Young Thug - Oh U Went|Oh U Went (feat. Drake)|Young Thug Oh U Went|Young Thug Drake Oh U Went|Drake|Drake and Young Thug|Oh U Went Drake","1684361","101155","0","3234","https://i.ytimg.com/vi/tGTKY1dpo_E/default.jpg","False","False","The official video for Young Thug's Oh U Went music video featuring @DrakeOfficial from his album 'BUSINESS IS BUSINESS' - Out Now!Stream 'BUSINESS IS BUSINESS' on all platforms: http://youngthug.ffm.to/businessisbusinessFollow Young Thughttp://www.twitter.com/youngthug​http://instagram.com/thuggerthugger1​http://www.tiktok.com/@thuggerthugger1http://www.facebook.com/youngthugmusicFollow Drakehttps://www.drakeofficial.comhttps://instagram.com/champagnepapihttps://facebook.com/drakehttps://twitter.com/drakehttps://www.drakeofficial.com#YoungThug #Drake #OhUWent℗ 2023 Young Stoner Life Records exclusively distributed by 300 Entertainment/Atlantic RecordsAy u went flyin bentley spurAy u went drivin round the worldAy u went brown like a squirrelAy u went Chanel pearlsAy u went Rolls royce carAy u went Rolls Royce TruckOh u want water on all my hoesOh u want to line it all upAh I’m a player/playa it how it isAh I been playa for some yearsAh u tryina steal all the spillAh im in the field on a pillAy u wanna spill then lets spillAh u know how real niggas isRolls royce still Uncle PhilYeah , uh uh Verse 1Oh u went top offOh u went flintstonesOh u took the lil rolley offOh u went big stonesOh u made two extra m’sOh u went ringtonesOh u went train on that bitchOh u went ding dongOh u went kingpinOh u went wings inOh u went hands onOh u went semenOh u went demonShootin out the demon Oh u had came in Now they were streamingHookAy u went flyin bentley spurAy u went drivin round the worldAy u went brown like a squirrelAy u went Chanel pearlsAy u went Rolls royce carAy u went Rolls Royce TruckOh u want water on all my hoesOh u want to line it all upAh I’ma player/playa it how it isAh I been playa for some yearsAh u tryina steal all the spillAh im in the feel another pillAy u wanna spill then lets spillAh u know how real niggas isRolls royce still Uncle PhilYeah , uh uh (DRAKE)Yup, look6 God, he a visionaryI’m the definition like the dictionaryBaby turn around, forget the missionaryIf they pull up on me with some bad intentions, you gon read about it in obituaryI got more soldiers than a militaryGot more stones than a cemetery Mo strings, and y’all are February (? - unclear)It’s getting hard to put a price on a show, can’t even pick an amount nowIf a nigga really try to jam me, get jammed first like the countdownI thank God for that flight straight from the 9 side going southboundThey say that life’s about balance baby, and the balance is in my account nowOkay, she gotta perc and a BirkI got her twerking in TurksShe’ll probably let both of us hitThe way that she smirking at DirkShe getting cake off the pictures she take,I said girl if it work then it workFuck a wedding dress, I’m tryna murk it then skrrrrtHookAy u went flyin bentley spurAy u went drivin round the worldAy u went brown like a squirrelAy u went Chanel pearlsAy u went Rolls royce carAy u went Rolls Royce TruckOh u want water on all my hoesOh u want to line it all upAh I’ma player/playa it how it isAh I been playa for some yearsAh u tryina steal all the spillAh im in the feel another pillAy u wanna spill then lets spillAh u know how real niggas isRolls royce still Uncle PhilYeah , uh uh"
"0zOEUkgx7L8","TOTTENHAM HOTSPUR 2-3 WEST HAM | PRE-SEASON HIGHLIGHTS","2023-07-18T15:02:22Z","UCEg25rdRZXg32iwai6N6l0w","Tottenham Hotspur","17","23.20.07","Spurs|Tottenham Hotspur|토트넘|손흥민|THFC|Tottenham|Tottenham 2-3 West Ham|Spurs 2-3 West Ham|Spurs Perth|West Ham Perth|Spurs pre-season","614972","9282","0","1345","https://i.ytimg.com/vi/0zOEUkgx7L8/default.jpg","False","False","Watch all the highlights from an exciting pre-season clash between Tottenham Hotspur and West Ham at the Optus Stadium in Perth, Australia.SPURSPLAY is live! Check it out now ► https://bit.ly/3a9klBiSUBSCRIBE to ensure you don’t miss a video from the Spurs YouTube channel. Hit the bell to get notifications on our latest uploads! ► Subscribe: https://www.youtube.com/channel/UCEg25rdRZXg32iwai6N6l0w?sub_confirmation=1 FOLLOW US!Instagram: https://www.instagram.com/spursofficial/Twitch: https://www.twitch.tv/tottenhamhotspur/TikTok: https://www.tiktok.com/@spursofficialTwitter: https://twitter.com/SpursOfficialFacebook: https://www.facebook.com/TottenhamHotspur/Download the Spurs App: https://www.tottenhamhotspur.com/spurs-official-app/#tottenham #spurs #westham"
"sFnLvZmyx48","ASMR Relax with gentle massage care","2023-07-18T14:49:53Z","UCQe2Y7V-C9bNMAcCJCBvzQQ","Latte ASMR","24","23.20.07","ASMR|Latte ASMR|ASMR relax|ASMR massage|ASMR sleep","276262","15085","0","813","https://i.ytimg.com/vi/sFnLvZmyx48/default.jpg","False","False","Hi everyone! It's Latte :)In this video I will help you to relax and all a sleep well with gentle massage and soft care.I hope you enjoy! Thank you for watching and have a good day~Join membership and support me ❤https://www.youtube.com/@LatteASMR/join"
"nMhK16S1tB0","I Made YOUR Drawings into MINECRAFT Mobs!","2023-07-17T14:01:00Z","UCn4BNPzJDyxkoBgXRuOFeyA","TerasHD","20","23.20.07","minecraft|mob|minecraft mob|mobs|custom mobs|blockbench|minecraft mod|minecraft mods","1952254","58035","0","2502","https://i.ytimg.com/vi/nMhK16S1tB0/default.jpg","False","False","Today I turn YOUR drawings into custom mobs in Minecraft! Subscribe to @CaptainCooky ! He was a lifesaver for this video by coding for us so I could spend time with my family that was visiting me from abroad!Submit your Drawings on our discord! (Strictly only for people over the age of 13, younger kids need to have an older person submit it)https://discord.gg/pEqVdugfyTCheck out the professional modders' channels!@ArtsByKev @CaptainCooky @DanielKrafft - Twitter: https://twitter.com/TerasHD- Instagram: http://instagram.com/terashdWe used Blockbench to make the Minecraft mobshttps://www.blockbench.net/#minecraft #minecraftmods #blockbench"
"SQSCFftDIuA","Darth Vader VS Obito Uchiha (Star Wars VS Naruto) | DEATH BATTLE!","2023-07-17T17:00:12Z","UCB9_VH_CNbbH4GfKu8qh63w","DEATH BATTLE!","24","23.20.07","DEATH BATTLE|Rooster Teeth|RT|DBX|DEATH BATTLE Cast|death battle|rooster teeth|deathbattle|death battle cast|deathbattlecast|ben singer|chad james|animation|3D animation|animated battle|blender|SFM|animated fight|who would win|star wars|starwars|naruto|boruto|anakin|clone wars|skywalker|george lucas|Kishimoto|lightsaber|tie fighter|xwing|x-wing|obiwan|obi-wan|kenobi|leia|sasuke|sakura|kakashi|ninja|sith|jedi|jedi vs ninja","1127240","68732","0","12063","https://i.ytimg.com/vi/SQSCFftDIuA/default.jpg","False","False","Jedi turned Sith battles the fallen ninja. Who will win?► Go to http://youtube.com/@BrandonYates to subscribe to Brandon Yates' YouTube channel and follow him on Spotify.► Get extra perks as a Death Battle Member! https://www.youtube.com/deathbattle/joinOFFICIAL DEATH BATTLE SUGGESTION FORM: http://bit.ly/DBRequestFormClick to SUBSCRIBE: http://bit.ly/SubToDeathBattle►Our Twitter: https://twitter.com/DEATHBATTLE►Our Store: http://bit.ly/DeathBattleStore►Watch our stuff early: http://bit.ly/2m9WLsZ►Follow the hosts on Twitter:Ben - https://twitter.com/BenBSingerChad - https://twitter.com/ChadJamesRT"
"soVg7yjNG5s","In This Moment - THE PURGE [OFFICIAL VIDEO]","2023-07-18T14:00:08Z","UC3o9YaRy8gc-lMmw_XpqgiQ","In This Moment","10","23.20.07","[none]","211507","23488","0","1356","https://i.ytimg.com/vi/soVg7yjNG5s/default.jpg","False","False","Official music video for THE PURGE.From the forthcoming album GODMODE out October 27.Pre-order/pre-save here: https://inthismoment.lnk.to/GODMODEDirector/Cinematographer: Jensen NoenProducers: Phoenix Vaughn & Ruth Devereaux & Ashley Haines & Arthur GrigoryanExecutive Producers: Frank Borin & Ivanna BorinExecutive Producers: Josh Balz & Amber HancockProduction Company: Blesscode EntertainmentStoryboard by: Maria Brink & Jensen Noen Video Commissioner: Valeri HedgesBMG On-Site Rep: Jordan MeltzerDMX Programmer/Op: Zane BlanchardLeadman: Yurii FedorovTechno Jib Op: Tim Lee1st AC: Kraig BryantColor: Lunar EdgeVFX: Alex Verenchyck1st AD: Tiffany WaxlerSteadicam: Eugene FilatovChoreography: Maria Brink & Erin BridgesHair & Makeup: Tara TatangeloStylist: Maria Brink & Travis Johnson Performers: Erin Bridges, Erin Gray, Amy Morgan, Ivanna Jackson, Evie Martinez, & Kasey CanterBehind the Scenes Photography: Jeremy SafferBehind the Scenes Video: Joe CotelaSong produced, co-written, mixed, and mastered by Kane Churko"
"K-VmllVIOXA","Carlos Alcaraz vs Novak Djokovic: Final Highlights | Wimbledon 2023","2023-07-16T18:18:17Z","UCNa8NxMgSm7m4Ii9d4QGk1Q","Wimbledon","17","23.20.07","Tennis|Wimbledon|wimbledon championship|wimbledon tennis|wimbledon video|Wimbledon 2023|Tennis Grandslam|The Championships|Grand Slam|Grass|2023|Always Like Never Before|Highlights|Carlos Alcaraz|Carlos|Alcaraz|Wimbledon Champion|Spain|Wimbledon Highlights|Novak Djokovic|Djokovic|Tennis News|Tennis Highlights|Wimbledon News|News|Trending|Carlos Alcaraz Wimbledon Champion|Carlos Alcaraz vs Novak Djokovic|Spanish Tennis|Grand Slam Final|Final Highlights","4860567","51831","0","4621","https://i.ytimg.com/vi/K-VmllVIOXA/default.jpg","False","False","Match highlights of Carlos Alcaraz vs Novak Djokovic in the Wimbledon 2023 Gentlemen's Singles Final.SUBSCRIBE to keep up with all The Championships action and news!Join myWimbledon for a personalised Wimbledon experience: http://wimbledon.com/mywimbledonTo follow all of the action as it happens go to: https://www.wimbledon.com/en_GB/scores/index.html#Wimbledon #AlcarazVsDjokovic #Highlights To license Wimbledon footage, visit: https://bit.ly/3fy0RbA"
"-xbqolHqz1s","Why I had to Go...","2023-07-18T19:12:12Z","UC6H65RnCt4AJWkWixWKW-lA","billzo","22","23.20.07","Billy hope|billzo|billzo come back|Billy|Why I had to go|why i had to go|Billzo|Why i left|Why I left|Mental health","196504","46695","0","2977","https://i.ytimg.com/vi/-xbqolHqz1s/default.jpg","False","False","Don't be afraid to get help, I know I know it's a scary thought but don't be afraid to talk to somebody.P.S. Keep an eye out on all socials for easter eggs and teasers on future projects"
"GXyJLv0eoNc","ARRAY ft. Brandon Semenuk | SRAM Presents","2023-07-18T13:59:33Z","UCZQhLgsgDObN7066d5rnDhw","SRAM","17","23.20.07","brandon semenuk|semenuk raw|brandon semenuk revel|brandon semenuk sram|brandon semenuk red bull|brandon semenuk array|brandon semenuk video|brandon semenuk one shot|semenuk rampage|semenuk mtb|brandon semenuk best|best semenuk video|brandon semenuk trek|legacy bike park|legacy bike park montana|legacy mountain bike park|trek slash semenuk|semenuk mountain bike|semenuk trail bike","58252","2883","0","116","https://i.ytimg.com/vi/GXyJLv0eoNc/default.jpg","False","False","The dog days of summer lend themselves to productivity. The light is out late, the air is warm on the breeze even in the late evening and the sessions can go for hours. Light fades from white to gold to blue to black, making one session feel like four all melting together. With long open days and free reign to conceptualize and create a new build in Montana at the Legacy Bike Park, Brandon Semenuk has pieced together one of his best trail bike edits yet. SUBSCRIBE TO THE SRAM CHANNEL ⇩⇩⇩http://www.youtube.com/channel/UCZQhLgsgDObN7066d5rnDhw?sub_confirmation=1"
"ARjKpfnFW9c","FOR BETTER FOR WORSE | MR MACARONI | MUMMY WA | LIFE OF PRAISE","2023-07-18T07:56:06Z","UCxAkiUiL3KnMl0BIFBv6xxA","MR MACARONI","24","23.20.07","[none]","210969","7762","0","506","https://i.ytimg.com/vi/ARjKpfnFW9c/default.jpg","False","False",""
