video_id,title,publishedAt,channelId,channelTitle,categoryId,trending_date,tags,view_count,likes,dislikes,comment_count,thumbnail_link,comments_disabled,ratings_disabled,description
"dCVIEOzcARE","Real Madrid 2-0 Manchester United | Highlights | Houston","2023-07-27T03:37:01Z","UCWV3obpZVGgJ3j9FVhEjF2Q","Real Madrid","17","23.28.07","Real Madrid|Madrid|Real Madrid CF|Madridistas|Santiago Bernabéu|Bernabéu|Hala Madrid|Carlo Ancelotti|レアル・マドリード|ريال مدريد|레알 마드리드|joselu golazo|Joselu chilena|joselu bicycle|Joselu highlights vs Manchester United|Bellingham golazo|bellingham chip vs Manchester United|Bellingham highlights Real Madrid|Real Madrid 2-0 Manchester United highlights|Vini Jr highlights|Real Madrid USA Summer Tour|Real Madrid highlights","5300073","116424","0","3456","https://i.ytimg.com/vi/dCVIEOzcARE/default.jpg","False","False","Enjoy the goals and highlights from Real Madrid’s second pre-season match against Manchester United (Real Madrid 2-0 Manchester United) in Houston. Real Madrid took the lead early on with a superb chipped goal by Jude Bellingham, while fellow new recruit Joselu rounded off the win with a sensational scissor-kick goal late on. Real Madrid will face Barcelona in their next match in Dallas.#RealMadridOnTour🆕📺 RM PLAY: play.realmadrid.com🎥  SUBSCRIBE | SUSCRÍBETE:YOUTUBE: https://www.youtube.com/subscription_center?add_user=realmadridcf📱 FOLLOW US | SÍGUENOS:INSTAGRAM: https://instagram.com/realmadridTIKTOK: https://www.tiktok.com/@realmadridTWITTER: https://twitter.com/realmadridTWITCH: https://www.twitch.tv/realmadridSNAPCHAT: https://snapchat.com/add/realmadridFACEBOOK: https://facebook.com/realmadrid💳 BECOME A MADRIDISTA | HAZTE MADRIDISTA:https://bit.ly/become_a_madridista_YT"
"CE4X8Elx1FY","Falsche Versprechen und Entschuldigungen | Esoterik Statement 🔮","2023-07-26T16:03:00Z","UCh24_9600fCJemez4RgoOmw","Marvin","24","23.28.07","marvin|marvin wildhage|marvin influencer|hydro hype|a hole|marvin doktortitel|Vanessa Mariposa|Tanja Makaric|Julienco|Julienco Freundin|Bibi|Julienco Tanja|Yasmin|Yasmin Fee|Sashka|Heilsteine|Exposed|Esoterik|Spiritualität|Gefahren|Betrug|Manipulation|Ausbeutung|Angst|Krebs|Depressionen|Geldmacherei|Esoterische Praktiken|Spirituelle Heilung|Abzocke|Heilversprechen","592820","40636","0","868","https://i.ytimg.com/vi/CE4X8Elx1FY/default.jpg","False","False","✖️Instagram ▸ http://www.instagram.com/marvin.wildhage✖️TikTok ▸ https://www.tiktok.com/@marvin.wildhage✖️Anfragen ▸ info@marvinwildhage.de▬▬▬▬▬▬▬▬▬▬▬▬▬▬▬▬▬▬▬▬▬▬▬▬▬▬Kamera & Schnitt ▸ https://instagram.com/jonathan_hefner/Kamera ▸ https://www.instagram.com/einfachtimo/Redaktion ▸ https://www.instagram.com/aarontroschke/▬▬▬▬▬▬▬▬▬▬▬▬▬▬▬▬▬▬▬▬▬▬▬▬▬▬HILFESTELLUNGHilfe bei Krebs ▸ https://www.krebshilfe.de/helfen/rat-hilfe/persoenliche-krebsberatung-infonetzkrebs/Hilfe bei psychischen Problemen ▸ https://www.deutsche-depressionshilfe.de/depression-infos-und-hilfe/wo-finde-ich-hilfe/info-telefon"
"G04DUq1sMJs","Der größte Macaron-Keks der Welt - 6 Jahre später","2023-07-26T15:00:26Z","UCGWSzxsb4UXsQf_FRQ7rR1g","Joey's Jungle","24","23.28.07","Backen|Backvideo|Joeys Jungle|Joey|Emy|Schwester|XXL|Macaron|Keks|2023","387660","51504","0","2262","https://i.ytimg.com/vi/G04DUq1sMJs/default.jpg","False","False","Ein neues Backvideo von Joey und Emy? Jap, wir wollten da mal was ausprobieren, hat natürlich mal wieder nicht so gut funktioniert 🫣Emy: https://www.instagram.com/emelyjonaGeschäftliche Anfragen: joey@bwm-com.com"
"37i37j86WFc","Autoschrott in Afrika: Was deutsche Gebrauchtwagen anrichten | Die Story | Kontrovers | BR24","2023-07-26T13:59:50Z","UCcweJsCV2TUP_kzMX25U-oQ","BR24","25","23.28.07","Schrottautos|Gebrauchtwagen|Autoschrott|Export von Schrottautos|Altfahrzeuge|Exportwagen|Schrottplatz|Ghana|Accra|schrottautos afrika|auto verschiffung nach afrika|autoexport afrika|alte autos|schrottautos reparieren|Autoexport Ghana|schrottautos nach afrika|schrottautos afrika reportage|doku|gebrauchtwagen deutschland|gebrauchtwagen afrika|giftig|schmutzig|gefährlich|wirtschaft","267468","2595","0","1189","https://i.ytimg.com/vi/37i37j86WFc/default.jpg","False","False","Fast eine Million Gebrauchtwagen werden jedes Jahr aus der EU in Drittländer exportiert. Viele über den Hafen in Hamburg. Somit auch deutsche Autos. Ein Milliardengeschäft - mit Autos, die in Europa schon lange nicht mehr auf die Straße dürfen: zu alt, zu unsicher, zu schmutzig. Eigentlich ist der Export von Schrottautos verboten. Altfahrzeuge gelten als Giftmüll und müssten in der EU entsorgt werden. Aber: Werden die Autos als Gebrauchtwagen deklariert, können sie bisher ohne Probleme verschifft werden. Die ältesten und schmutzigsten Exportwagen gehen nach Westafrika. Viele landen in Tema, dem wichtigsten Hafen Ghanas. Über hunderttausend Autos werden dort jedes Jahr abgeladen. Dort verschmutzen die sie nicht nur die Luft, sie werden oft unter unwürdigen Bedingungen repariert und am Ende bleibt eine riesige Menge Schrott. Und: Die Altwagenflut verhindert den Aufbau einer heimischen Industrie. Ghana hat zwar Einfuhrverbote für ältere Wagen, aber was erst mal im Hafen ankommt, bleibt im Land. Die Reporter der Kontrovers-Story sind auf Spurensuche nach deutschen Autos in Ghana gegangen und haben Menschen vor Ort kennengelernt, die mit den Schrottautos aus Europa zu tun haben.Autoren: Fritz Espenlaub und Niklas Eckert00:00 Intro00:35 Kann ein 3er Golf ohne TÜV noch verkauft werden?03:05 Grafik: Export von Gebrauchtwagen aus EU in Drittländer04:02 Schrottautos im Safebond in Tema, Ghana04:48 Schweißer in Ghana soll rostigen Bus reparieren.08:21 Aufbereitung von altem Motoröl10:56 Die Reparatur des Busses kommt nur schwer voran.13:50 Grafik: Ghana will die Einfuhr alter Autos verhindern.14:10 Zollkontrolle in Ghana: Viele alte Autos aus Deutschland20:48 Bekommt der Schweißer sein Geld?22:39 Auslieferung aufbereitetes Altöl24:53 Frühere Besitzer wundert sich über Export seines Autos nach Ghana27:47 EU-Pläne gegen Ausfuhr fahruntauglicher AutosDie Story - unser wöchentliches Doku- und Reportageformat aus der Kontrovers-Redaktion des Bayerischen Rundfunks. Jeden Mittwoch um 16 Uhr auf diesem Kanal. Hier geht‘s zur Playlist: https://www.youtube.com/playlist?list=PLvAQXonIfGbNgNSzIqSNMwbId2JU6rS8w Hier geht's zu unserer BR24-Website: http://www.BR24.deBR24-Newsletter - hier abonnieren: http://br24.de/newsletterBR24-Facebook: http://www.facebook.com/BR24/BR24-Twitter: http://twitter.com/BR24BR24-Instagram: http://www.instagram.com/BR24#kontrovers #story #schrottautos"
"RPLNJCPzgWc","Gruppe Wagner: Prigoschin ist zurück - was du jetzt wissen solltest I Spurensuche I frontal","2023-07-26T16:56:05Z","UCDw0K7K658-ztRuCn2mn0Kw","frontal","25","23.28.07","frontal|frontal21|frontal 21|zdf frontal|zdf|prigoschin|jewgeni prigoschin|frontal gruppe wagner|gruppe wagner|gruppe wagner putschversuch|putsch|aufstand|söldner erklärt|russland söldner|söldner ukraine|putin söldner|söldner gruppe wagner|russland putin krieg|ukraine putin krieg|söldner doku|militär doku|terrorismus doku|anti-terror-kampf|kalashnikov|ak-47|privatarmee|private militärunternehmen|afrika|rebellion|nato|ZDFinfo|ZDFheute|zdf doku","288959","3625","0","1007","https://i.ytimg.com/vi/RPLNJCPzgWc/default.jpg","False","False","Das erste Lebenszeichen von Wagner-Chef Jewgeni Prigoschin nach dem Marsch auf Moskau ist ein Foto. Prigoschin sitzt in Unterhose auf einem Feldbett und grüßt in die Kamera. In den Telegram-Chats der Gruppe Wagner kursieren weitere Bilder. In einem Video sagt Prigoschin: “Wir haben ehrenhaft gekämpft. Ihr habt viel für Russland getan. Was an der Front passiert, ist eine Schande.” Wie authentisch das Bildmaterial ist, lässt sich nur schwer klären. Eins ist jedoch sicher: Dem russischen Präsidenten Putin dürfte die Verbreitung solcher Aussagen nicht gefallen. Prigoschin ist der Mann mit den vielen Gesichtern - er lebte im Luxus, war im Gefängnis, schuf sich viele Identitäten. Man kennt ihn als “Putins Koch”, als despotischen Oligarchen und als erbarmungslosen Söldner-Chef der Wagner Gruppe.Wir sprechen mit Insidern: Ein ehemaliger Sicherheitsmann schildert uns, wie rücksichtslos und brutal Prigoschin schon vor seiner Zeit als Wagner-Chef war.Was plant der Mann, der Putin immer wieder herausfordert?  Eine Spurensuche._______________Kapitel:     00:00 Intro01:55 Spurensuche Prigoschin03:20 Wie gefährlich ist Jewgeni Prigoschin?06:28 Projekt K - Gefängnisinsassen als Soldaten07:45 Wie geht es weiter mit der Gruppe Wagner?09:57 Outro_______________Autoren: Johannes Bauer, Werner Doyé, Markus ThößKamera: Karsten NeubertSchnitt: Regina Fischer, Richard Fuchs, Eva Maria ArndtSprecher: Anton WeilArt Director, Grafik: Nicolas de Leval Jezierski  Grafik: Malte PaetzTeam Cine Impuls Leipzig: Lisa Goldberg, Dirk Nebel, Anne Haferung, Malte Möller, Sabrina GoldackHead of Social Media Cine Impuls Leipzig: Veronika Prütz  CvD Cine Impuls Leipzig: Henrik MerkerProduzentin Cine Impuls Leipzig: Anke Kossira CvD frontal ZDF: Jörg GoebelHead of Content frontal ZDF: Kyo Mali Jung _______________Songs im Video:Pesnya pro Prigoschina - LeningradInfiltration Operation - Michael McGuillWar Zone – Bob Bradley, Thomas Richard BalmforthThe Alley – Bob Bradley, Thomas Richard BalmforthDeath Toll – Paul EnglishbyUnder Surveillance – Niraj ChagThe Approach – Aaron Albert SrdocVery Scary – Stephane HirondelleGloomy Pulse – KloozAncient Legend Trailer – Philippe BestionFirst Contact – Dmitriy Alexandrovich Mityukhin, Sergey AzbelInsomnia - Hans Gruber, Max Burn, William KnotDark Outcome - Alexius Tschallener, Max Burn, William Knot_______________Weiterführende Links:Deutscher Bundestag; Die Zusammenarbeit von Staaten mit privaten Sicherheits- und Militärfirmen: https://www.bundestag.de/resource/blob/414968/4a1e7dcee51d7929c0787c6f0ea73ea4/WD-2-140-06-pdf-data.pdf ECCHR; Rules and Responsibilities of Employees of Private Military Companies: https://www.ecchr.eu/publikation/rules-and-responsibilities-of-employees-of-private-military-companies-under-international-humanitarian-law/ Die UN hat eine eigene Abteilung, die sich der Beobachtung und Analyse von Söldnern und privaten Sicherheitsfirmen widmet. Ihre Webseite sowie viele Berichte findest du hier: https://www.ohchr.org/en/issues/mercenaries/wgmercenaries/pages/wgmercenariesindex.aspx Einen Überblick über die Entwicklung, Herkunft und Arbeitsmethoden von modernen Söldnern gibt der Kommissar der Vereinten Nationen für Menschenrechte: https://www.ohchr.org/Documents/issues/Mercenaries/WG/OtherStakeholders/sean-mcfate-submission.pdf______________Noch mehr Hintergründe aus dem ZDF:Nach Aufstand in Russland - CIA-Chef sagt, Putin will Rache an Prigoschin: https://www.zdf.de/nachrichten/politik/putin-prigoschin-rache-ukraine-krieg-russland-100.html#xtor=CS3-178 Im Söldner Biz - die Söldner der Gruppe Wagner: https://youtu.be/jgywJmbU5tU Das Geschäft der Schattenarmeen: https://www.zdf.de/politik/frontal/krieg-der-schattenarmeen-soeldner-in-syrien-100.html#xtor=CS3-178 Wo ist Prigoschin? https://www.zdf.de/politik/frontal/wagner-gruppe-soeldner-prigoschin-aufstand-putin-russland-100.html#xtor=CS3-178 ZDFinfo - wer ist Jewgeni Prigoschin: https://youtu.be/65BIaJRP9BA _______________Willkommen bei frontal! Du kennst bestimmt schon die spannenden Dokus und Reportagen von unseren Kolleg:innen von ZDFheute Nachrichten, ZDFinfo oder ZDF Magazin Royale. frontal ist das YouTube-Format zur gleichnamigen Sendung, dem Politikmagazin des ZDF. ________________ Mehr von frontal? Jede Woche gibt es auf diesem Kanal ein neues Video. Du willst nichts verpassen? Abonniere frontal! Du hast einen Themenvorschlag? Schreib uns an: frontal.youtube@cine-impuls.de ________________Mehr Infos unter:Mediathek: https://www.zdf.de/politik/frontal#xtor=CS3-178Twitter: https://twitter.com/ZDFfrontalFacebook: https://www.facebook.com/ZDFfrontal/ Netiquette: https://www.zdf.de/service-und-hilfe/netiquette-104.html#xtor=CS3-178Impressum: https://www.zdf.de/service-und-hilfe/social-media-impressum-100.html#xtor=CS3-178#GruppeWagner #frontal #zdf"
"96n43IjceaY","Wer ist der Profi Spieler ? | Find the Pro #3","2023-07-26T15:00:07Z","UCc_5NZ8_J8y3f343GQfWJLA","Diyar Ac","17","23.28.07","[none]","241277","11329","0","465","https://i.ytimg.com/vi/96n43IjceaY/default.jpg","False","False","Mmmmmatchday Freunde, Leute endlich seht ihr die dritte Folge von meinem YouTube Format, Find the Pro!*Anzeige: Sichert euch jetzt ganze 50% rabatt auf die Fitgun  mit dem Rabattcode: Diyar50 Link zur Fitgun : https://www.fitgun.com/discount/diyar50Bei diesem YouTube Format geht es darum den Profi - Spieler (NLZ Spieler) zu erkennen, nicht nur durch seinen Erzählungen, sondern auch durch seine Qualität auf dem Platz.Von allen 7 Teilnehmern, gibt es nur einen NLZ Spieler und die Jury muss erraten, wer es sein könnte!Die Teilnehmer duellieren sich in den verschiedensten Challenges gegeneinander.Konntet  ihr erraten wer der NLZ Spieler ist ? Schreibt es gerne in die Kommentare!Wenn ihr bei der nächsten Folge dabei sein wollt, meldet euch gerne bei meinem Management auf Instagram:https://instagram.com/kawa_management?igshid=MjEwN2IyYWYwYw==Die Jury :Diyar : https://instagram.com/diyar_ac_?igshid=OGQ5ZDc2ODk2ZA==Kevin Reuter: https://instagram.com/reuter_100and10?igshid=MzRlODBiNWFlZA==Kader: https://instagram.com/km1_training?igshid=MzRlODBiNWFlZA==Heiko Dietz:https://instagram.com/hei_ko80?igshid=MzRlODBiNWFlZA==Danke auch nochmal an Könige und Grafen Sportwerk in Ochtrup :https://instagram.com/koenigeundgrafensportwerk?igshid=OGQ5ZDc2ODk2ZA=="
"u1hjxY982AI","RUMATHRA IST SO DUMM","2023-07-26T15:00:50Z","UCxivtyDib-xnd_fH3a3nQFg","Hungriger Hugo","24","23.28.07","hungriger hugo|trymacs|monte|montanablack|hungriger hugo reaktion|monte hungriger hugo|trymacs hugo|hungriger hugo trymacs|montanablack hungriger hugo|unge hungriger hugo|elotrix hungriger hugo|hungriger hugo reaction|mehr anzeigen hungriger hugo|unsympathischtv|sascha hungriger hugo|hugo|knossi|knossi hungriger hugo|knossi hugo|montanablack meme|hungriger hugo monte|hugo monte|monte hugo|unge|tanzverbot|elotrix","498084","40422","0","522","https://i.ytimg.com/vi/u1hjxY982AI/default.jpg","False","False","(Werbung) Mit dem Code HungrigerHugo erhaltet ihr vom 26.07 bis zum 27.08. bei air up 10% Rabatt: https://airup.link/HungrigerHugo#airup #denkneutrinkneu 🗓 Deutsche Memes Folge 64📒Quellen:@Rumathra @Trymacs @papaplatte @Reeze @Knossi @montanablack @SkylineTV @commanderkrieger @unsympathischtv @starletnova @LetsHugo @inscope21 Hungriger Hugo Team:- Hauptschnitt in Premiere Pro:  https://www.instagram.com/hungrigerhugo_official/   - krassere After Effects Edits u Ä.: Levi: https://www.instagram.com/levi.aee/Alex: https://www.instagram.com/arlex.ae/    📸 Insta: https://www.instagram.com/hungrigerhugo_official/   👾 Twitch: https://www.twitch.tv/hungrigerhugoyt🎵 Welche Musik ich benutze: https://www.epidemicsound.com/referral/55rtly (* Werbung )(Das ist Epedemic Sounds, da bezahlt man 13€ pro Monat und kann dafür dann ganz viel Musik benutzen, ihr könnt euch auch nen gratis Monat zum Testen holen. Wenn ihr das über meinen Link hier macht kriege ich ab dem Moment wo ihr bezahlt, falls ihr das Abo nach dem Gratismonat verlängert, 50%🤝) 👨‍👩‍👧‍👦Kanalmitglied werden: https://www.youtube.com/channel/UCxivtyDib-xnd_fH3a3nQFg/joinMein restliches Social Media:🔥TikTok: https://www.tiktok.com/@hungrigerhugoyt🐦 Twitter: https://mobile.twitter.com/hungrigerhugoyt"
"csfQ-H65kpA","Sinéad O'Connor Todesursache - die ersten Details | PROMIPOOL","2023-07-26T18:43:33Z","UCBteQA7zgU9BTn1BaXhWA7g","PROMIPOOL","24","23.28.07","Promipool|Promipool news|Sturm der Liebe|Sturm der Liebe news|Sturm der Liebe TV|Sturm der Liebe heute|Sturm der Liebe aktuell|TV Geschichten|TV-Serien|Serien|Daily Soap|Promis|Prominews|Stars heute|Promiflash|Promi Interviews|todesfälle|berühmte todesfälle|sinead o'connor|sinead o'connor tot|sinead o'connor gestorben|stars tot|stars gestorben|sinead tot|sinead gestorben","50080","274","0","220","https://i.ytimg.com/vi/csfQ-H65kpA/default.jpg","False","False","Tragische Nachricht für alle Fans: Am 26. Juli wurde von britischen Medien der Tod von Sinéad O'Connor verkündet.Die Sängerin, die unter anderem mit dem Hit „Nothing compares 2 u“ weltweite Erfolge feierte, wurde nur 56 Jahre alt.#Promipool #SturmDerLiebe Mehr von Promipool: https://www.promipool.de/ PROMIPOOL im Abo: http://promi.is/get-promipool ------------------------------------------------------------­--------------------„Sturm der Liebe“, „Rote Rosen“ und die besten TV-Geschichten Deutschlands. PROMIPOOL liefert euch alle Infos, Vorschauen und Hintergrundberichte zu den schönsten Serien sowie den besten Filmen aller Zeiten. Welche wie kam Florian Silbereisen zum „Traumschiff“, warum war Audrey Hepburn eine derartige Stilikone und was wurde aus den Stars von „Unsere kleine Farm“? Wir klären euch auf und geben euch auch Geschichten mit auf dem Weg, mit denen ihr beim nächsten TV-Abend glänzt.Im PROMIPOOL-Kanal bekommt ihr immer die besten News, Infos und Hintergründe – täglich neu. Viel Spaß!------------------------------------------------------------­--------------------► “it's in TV“ auf YouTube: http://promi.is/get-itsintv► “ROYALS“ auf YouTube: http://promi.is/get-royals ► “BEST of REALITY TV“ auf YouTube: http://promi.is/get-best-of-reality-tv ► “CRIME TIME“ auf YouTube abonnieren: http://promi.is/get-crime-time-----------------------------------------------------------­--------------------Mehr Promi-News und exklusive Stories gibt es hier:► Facebook: https://www.facebook.com/promipool ► Instagram: https://www.instagram.com/promipool ► Pinterest: https://www.pinterest.de/promipool ► TikTok: https://www.tiktok.com/@promipool?is_from_webapp=1&sender_device=pcImpressum: https://www.promipool.de/impressum"
"CByCfJOBBAE","EXTENDED HIGHLIGHTS | Bayern Munich 1-2 Man City | McAtee, Laporte & Tel Goals","2023-07-26T15:00:05Z","UCkzCjdRMrW2vXLx8mvPVLdQ","Man City","17","23.28.07","man city|manchester city|mcfc|fifa 22|man city highlights|man city goals|city|man|city vs|man city vs|chelsea man city|man city news|man united|chelsea|liverpool|man city v|city fixtures|city vs united|man city fixtures|grealish man city|jack grealish man city|jack grealish|haaland|laporte|mcatee|aymeric laporte|james mcatee|bayern munich|tokyo|pre-season|pre season|friendly|sane freekick|leroy sane|freekick|sane","3537709","59320","0","1267","https://i.ytimg.com/vi/CByCfJOBBAE/default.jpg","False","False","Manchester City completed the Japan leg of our pre-season tour with a 2-1 victory over Bayern Munich in Tokyo.SUBSCRIBE! http://www.youtube.com/subscription_center?add_user=mancityhttp://www.mancity.comhttp://www.facebook.com/mancityhttp://www.twitter.com/mancityhttp://www.instagram.com/mancityhttps://www.tiktok.com/@mancityAbout the Official Man City YouTube Channel:Here you will find all the latest videos from Manchester City, including, all Premier League goals, highlights, behind-the-scenes footage, training and much more.Get closer to the likes of Jack Grealish, Bunny Shaw, Kevin De Bruyne, Lauren Hemp, Erling Haaland, Riyad Mahrez, Ellie Roebuck Phil Foden, Esme Morgan and the rest of Pep Guardiola & Gareth Taylor's teams!"
"IY1JoM1DbMs","Džeko, Tadić & Co. glänzen im Quali-Hinspiel | Fenerbahçe Istanbul - FC Zimbru Chisinau","2023-07-26T20:30:17Z","UC-O69Nmy3jj55K0H4ZzPxtA","Sportdigital FUSSBALL","17","23.28.07","sportdigital|internationaler|fußball|deutsch|tore|highlights|Edin Džeko|Dušan Tadić|Ferdi Kadıoğlu|Ryan Kent|Sebastian Szymański|Joshua King|Europa Conference League|Fenerbahce|Zimbru","80052","1492","0","142","https://i.ytimg.com/vi/IY1JoM1DbMs/default.jpg","False","False","Das Hinspiel der zweiten Europa Conference League Qualifikationsrunde zwischen Fenerbahçe Istanbul und dem FC Zimbru Chisinau in der Zusammenfassung kommentiert von Jörg Steiger.SPORTDIGITAL FUSSBALL bietet Dir wirklich alles rund um den internationalen Fußball: Egal ob LIVE, NEWS oder wertvolle INSIGHTS!Mit uns kannst Du rund um die Uhr die internationalen Top Fußball-Ligen LIVE genießen, denn wir zeigen LIVE-Fußball-Spiele aus vielen unterschiedlichen Zeitzonen der Welt. Morgens Fußball aus Asien; mittags Fußball aus Zentral-Europa; nachmittags und abends aus West-Europa sowie nachts aus Mittel- und Südamerika.Mit unserem täglichen Magazin „Transfermarkt TV“ bist Du immer auf dem neuesten Stand - Du erfährst alle aktuellen News über internationale Spieler, deren Marktwertentwicklungen und über mögliche Transfers sowie alle Neuigkeiten aus der Welt des Sports.Außerdem bieten wir Dir jede Menge Hochglanz-Magazine und Dokus rund um den internationalen Fußball, so dass Du wertvolle Insights in die private Glanz- und Glamourwelt der internationalen Fußball-Megastars erhältst. Darüber hinaus bieten wir Dir jede Woche mit „SCOOORE!“ verschiedene Highlight-Shows aus unseren internationalen Topligen sowie ein wöchentliches Round Up zu den wirklich wichtigen Themen aus der Welt des Fußballs.Aus den 20 SPORTDIGITAL FUSSBALL-Ligen und Wettbewerben zeigen wir Dir rund um die Uhr die besten LIVE-Spiele: AFC Cup (Asien), Campeonato Brasileiro (Brasilien), CAF WM-Qualifikation (Afrika), Sky Bet Championship (England), CONCACAF Champions League (Nord- und Mittelamerika), Copa America (Südamerika), Copa de la Superliga (Argentinien), Copa do Brasil (Brasilien), Copa Libertadores (Südamerika), Ekstraklasa (Polen), Eredivisie (Niederlande), Fortuna Liga (Tschechien), CONCACAF Gold Cup (Nord- und Mittelamerika), Liga Profesional (Argentinien), J. League (Japan), K League (Korea), Primeira Liga (Portugal), MLS (USA), Turkiye Kupası (Türkei)So kannst du SPORTDIGITAL FUSSBALL empfangen:Wir sind überall dabei. Meistens in HD und mit Zweikanalton. In Deutschland, Österreich und der Schweiz ist SPORTDIGITAL FUSSBALL in den Pay-TV Paketen über die Kabel- und IPTV-Anbieter sowie über Satellit, im Web und als App empfangbar. Wann und wo immer Du willst. Und hier findest Du die beste Empfangsmöglichkeit für SPORTDIGITAL FUSSBALL:► Empfangswege von SPORTDIGITAL FUSSBALL: https://bit.ly/2Dm4hIB► SPORTDIGITAL FUSSBALL im Live-Stream: https://bit.ly/2BaIhzv___________________________________Playlist ► Highlights: https://www.youtube.com/playlist?list=PLsny0VeRMkSG2LQI2rMpuETXVPSr-eaWY___________________________________Social Media► Facebook: https://bit.ly/2UH1ggR ► Instagram: https://bit.ly/2GqL2Q6► Twitter: https://bit.ly/2vamYus ► Commentaro Facebook: http://bit.ly/2XhtZph► Commentaro Instagram: http://bit.ly/2VQN0hO"
