video_id,title,publishedAt,channelId,channelTitle,categoryId,trending_date,tags,view_count,likes,dislikes,comment_count,thumbnail_link,comments_disabled,ratings_disabled,description
"l5IA1-omLlo","Les techniques de build Illégales de Minecraft...","2023-07-17T17:32:32Z","UCfznY5SlSoZoXN0-kBPtCdg","Fuze III","20","23.20.07","[none]","273449","20746","0","616","https://i.ytimg.com/vi/l5IA1-omLlo/default.jpg","False","False","Aujourd'hui, j'ai testé un mod assez... spécial...👕Acheter les peluches Didier: http://fuzeshop.fr📚 Ma BD Fuze et Didier: https://amzn.to/38CqIvRCréateur du Mod: https://www.youtube.com/c/EightSidedSquare/Le mod: https://eightsidedsquare.com/modsVenez jouer avec moi sur Paladium: http://paladium-pvp.fr/Venez jouer avec moi sur Modded: http://modded.fr/Envie de travailler avec moi ? https://jobs.fuzeiii.fr/🎮Instant Gaming (Jeux à -70%): https://www.instant-gaming.com/fr/giveaway/FUZECREDITS :- Musique intro/outro : Disco on Tutti - Incompletech sous licence Creative Commons.- Un crédit manquant ? → https://jobs.fuzeiii.fr/credit-report🎬 Ma chaîne secondaire: https://www.youtube.com/channel/UCzTTYntJHARp5YCxakwUepA📷 Mon Instagram: http://instagram.com/fuzeIII_hd🐦 Mon twitter : http://twitter.com/FuzeIII🔴 Ma chaîne Twitch : http://twitch.tv/FuzeIII🎵 Mon TikTok: https://www.tiktok.com/@fuzeiii_yt💬 Mon Discord: http://discord.gg/fuzeiii👉 Code créateur EpicGames: FuzeLeVrai⬆️ Mon subbredit pour les memes: https://www.reddit.com/r/FuzeLeVrai/"
"vbsyeHNlKNA","Un dôme de chaleur frappe le nord de la planète, tests ADN pour chiens, Mr Beast… Actus du jour","2023-07-17T20:00:30Z","UCAcAnMF0OrCtUep3Y4M-ZPw","HugoDécrypte - Actus du jour","25","23.20.07","[none]","357664","10212","0","1355","https://i.ytimg.com/vi/vbsyeHNlKNA/default.jpg","False","False","📧 Le lien d’abonnement à notre newsletter : https://hugodecry.pt/newsletter🔔 Pour découvrir mes longs formats sur YouTube : https://hugodecry.pt/YT-Grands-Formats🎧 Les Actus du jour en podcast : https://hugodecry.pt/Spotify-ADJ / https://hugodecry.pt/Apple-ADJ📣 Les Actus du Jour aussi sur : · Instagram (en 2 min) : https://hugodecry.pt/IG· TikTok (en 30 sec) : https://hugodecry.pt/TikTok· Twitter : https://hugodecry.pt/Twitter · Les plateformes de podcast : https://hugodecry.pt/Spotify-ADJ / https://hugodecry.pt/Apple-ADJ🍿⚽️ Sur Instagram, retrouve aussi les actus :· Pop & culturelles : https://hugodecry.pt/IG-Pop· Sportives : https://hugodecry.pt/IG-Sport——–SOMMAIRE00:00 Dôme de chaleur en Europe06:56 Interview Face Cachée de Christopher Nolan08:03 Pont de Crimée attaqué09:11 Changements concernant les accidents de la route10:12 Police des mœurs en Iran10:46 Annonces de la SNCF11:53 Aggression s*xuelle en Italie12:44 Guerre aux crottes de chien13:16 Arkunir VS MrBeast13:57 Débat du jour–🔗 DES LIENS POUR EN SAVOIR PLUSDÔME DE CHALEURhttps://www.midilibre.fr/2023/07/17/meteo-quest-ce-quun-dome-de-chaleur-ce-phenomene-qui-va-faire-grimper-le-mercure-jusqua-40-c-cette-semaine-11345124.phphttps://www.geo.fr/environnement/qu-est-ce-quun-dome-de-chaleur-meteorologie-matthieu-sorel-canicule-cloche-215698https://www.francetvinfo.fr/meteo/canicule/canicule-l-hemisphere-nord-touche-par-un-dome-de-chaleur_5954132.htmlhttps://meteofrance.com/actualites-et-dossiers/magazine/questions/anticyclone-depression-quels-types-de-temps-sont-ils-associes#:~:text=L'air%20froid%20descend%2C%20quand,une%20zone%20de%20haute%20pression.UKRAINE PONT DE CRIMÉE​​https://www.huffingtonpost.fr/international/article/guerre-en-ukraine-le-pont-de-crimee-endommage-que-sait-on-de-cette-situation-d-urgence_220715.htmlhttps://www.lemonde.fr/international/live/2023/07/17/guerre-en-ukraine-en-direct-une-explosion-a-eu-lieu-sur-le-pont-de-crimee-tuant-deux-civils-selon-les-autorites-russes_6182260_3210.htmlHOMICIDE ROUTIERhttps://www.bfmtv.com/politique/homicide-routier-vers-la-creation-d-un-nouveau-delit-pour-les-conducteurs-alcoolises-ou-drogues_AN-202307160039.htmlhttps://www.francetvinfo.fr/societe/securite-routiere/securite-routiere-l-appellation-homicide-involontaire-requalifiee-en-homicide-routier_5955236.htmlIRAN POLICE DES MŒURShttps://www.france24.com/fr/asie-pacifique/20230717-la-police-des-moeurs-de-retour-en-iran-dix-mois-apr%C3%A8s-la-mort-de-mahsa-amini https://information.tv5monde.com/international/video/iran-le-retour-de-la-police-des-moeurs-2658493 ITALIE AGRESSION SEXUELLEhttps://www.slate.fr/story/250375/agression-sexuelle-acquitte-duree-attouchements-secondes-otaliehttps://www.rtl.fr/actu/justice-faits-divers/italie-accuse-d-agression-sexuelle-il-est-relaxe-car-son-geste-n-a-dure-que-10-secondes-7900282611ADN CR0TTE DE CHIEN https://www.francebleu.fr/infos/societe/exclu-l-adn-canin-desormais-utilise-a-beziers-pour-lutter-contre-les-crottes-de-chien-5721407 https://www.francetvinfo.fr/politique/robert-menard/herault-l-adn-canin-est-desormais-obligatoire-dans-une-partie-du-centre-ville-de-beziers-pour-lutter-contre-les-crottes-de-chien_5953979.html SNCF https://www.francetvinfo.fr/economie/transports/sncf/transports-la-carte-avantage-de-la-sncf-sera-bientot-moins-genereuse_5955080.html https://www.leparisien.fr/economie/sncf-300-000-billets-a-petits-prix-pour-le-mois-daout-17-07-2023-GJ5G2OK56NECHNTLWRJ4KGTV3Q.php TWITTER ARKUNIR MRBEASThttps://www.bfmtv.com/tech/twitter/apres-avoir-ratio-elon-musk-arkunir-mobilise-encore-le-web-francais-face-au-youtubeur-mr-beast_AV-202307170218.html https://www.30millionsdamis.fr/actualites/article/23941-le-francais-arkunir-realise-un-nouvel-exploit-sur-twitter-pour-les-animaux/Écriture : Blanche Vathonne - Anais Lochon - Samy Rabbata - Paul Foucaud - Hugo Travers Montage : Stanley Duplan"
"rt_RfUkc_ME","J'aime les gens malades : Jane Birkin face à Marc-Olivier Fogiel","2023-07-16T17:01:25Z","UCct38M-8F9JO9Fgb8KZ5ccw","Entrée libre","24","23.20.07","Actus|Actualités|entrée libre|marc-olivier fogiel|marc-olivier fogiel clash|marc-olivier fogiel fou rire|marc-olivier fogiel le divan|le divan|on n'est pas couché|onpp|onpp fogiel|clash tv|quelle époque france 2|on n'est pas couché clash|arte|INA|touche pas à mon poste|salut les terriens|talk-show|jane birkin|jane birkin mort|jane birkin interview|jane birkin serge gainsbourg|jane birkin la gadoue|jane birkin chanson|jane birkin 2023|serge gainsbourg","64078","491","0","66","https://i.ytimg.com/vi/rt_RfUkc_ME/default.jpg","False","False","Invitée dans l'émission On ne peut pas plaire à tout le monde en octobre 2001, Jane Birkin se confiait sur sa relation avec Serge Gainsbourg, son talent de comédienne ou encore son amour pour les gens malades.On ne peut pas plaire à tout le monde, également connue son l'acronyme ONPP, est une émission de talk-show, diffusée de 2000 à 2006, présentée et animée par Marc-Olivier Fogiel.© ENDEMOL FRANCE"
"4EvMd7dQESI","Un IMMENSE TRIANGLE dans le ciel nocturne !!","2023-07-16T15:12:34Z","UCkMsSGlEMPRxhqvGj6qeucQ","12 Parsecs","28","23.20.07","Astronomie|constellations|Altaïr|Deneb|Vega|Aigle|Cygne","84976","10018","0","846","https://i.ytimg.com/vi/4EvMd7dQESI/default.jpg","False","False","Hello there... Là voici là voilà : la nouvelle vidéo Astro !! C'est pas trop tôt bordel de nom d'un chien !!! On parle aujourd'hui de l'astérisque le plus célèbre de la période estivale : Le Grand TRIANGLE d'été !!J’espère que la vidéo vous plaira ! Bon visionnage...N'oubliez pas de liker cette vidéo, de la commenter en disant des âneries qui ne font rire que vous, de la partager absolument partout et de vous abonner à la chaine !!** Lien de la chaine Twitch ** https://www.twitch.tv/12_parsecs_LIVE TOUS LES DIMANCHES SOIR À 21H** NOUVEAU : Lien du DISCORD **https://discord.gg/vD3wAtW5-----Venez nous rejoindre sur les réseaux !!Twitch : https://www.twitch.tv/12_parsecs_Facebook : https://www.facebook.com/douzeparsecs...Twitter : https://twitter.com/DouzeParsecs​​​Instagram : https://www.instagram.com/douze.parse...Tipeee : ​​​https://fr.tipeee.com/12-parsecs"
"s-FylSergGs","J'ai Brisé 100 Mythes sur Minecraft en 24H !!","2023-07-16T15:48:29Z","UCtgGt41P7WhoZxtEFPt-5pA","Azpaz Tv","20","23.20.07","minecraft|minecraft fr|azpaz|azpaz tv|100 mythes|mythes minecraft|24h","142364","5625","0","544","https://i.ytimg.com/vi/s-FylSergGs/default.jpg","False","False","Ce n'est pas une vidéo speedrunner / speed run vs hunter / assassin comme les vidéos Ninjaxx et FuzeIII, ni une vidéo 100 jours dans minecraft ni une vidéo de Lined ou Unchained, mais une aventure extrême de cache-cache dans minecraft !IP DE MON SERVEUR : nulcraft.frDans cette vidéo vous verrez des vidéos de type Minecraft, Mais il pleut Lucky Blocks / Minecraft, Mais les Items sont Aléatoires / Minecraft, Mais il pleut Lava, etc...Seulement cette fois, le monde de Minecraft sera Tilt, donc la difficulté augmentera beaucoup plus. Même, la difficulté pourrait être impossible dans certains cas.Montage par le bossMail pour tout contact commercial : azpaztv@gmail.comMon Twitter : https://www.twitter.com/azpaztvMon Discord  + de nulcraft : https://discord.gg/EBPCS6YF9eMerci pour les 340k road to 400kJ'ai Brisé 100 Mythes sur Minecraft en 24H !!"
"1QYBiNRu1ok","정국 (Jung Kook) 'Seven (feat. Latto)' Official Performance Video","2023-07-15T14:59:59Z","UCLkAepWjdylmXSltofFvsYQ","BANGTANTV","10","23.20.07","방탄소년단|BTS|BANGTAN|알엠|RM|슈가|SUGA|제이홉|jhope|지민|정국|k-pop|방탄|j-hope|Jung Kook|Jimin|BTS V|Jin","14606384","1857666","0","57662","https://i.ytimg.com/vi/1QYBiNRu1ok/default.jpg","False","False","정국 (Jung Kook) 'Seven (feat. Latto)' Official Performance Video'Seven (feat. Latto)' Release💽 Listen to 'Seven': https://ingrv.es/SevenCredits:Director: Jihye Yoon (Lumpens)Co-Director: Yong Seok Choi (Lumpens)Production Assistants: Chanyang Kim, Soeyoung ParkProducer : Emma Sungeun Kim (GE production) Production Assistants: Minho Seo, Seungwon ChoiDirector of Photography: Hyunwoo Nam Focus Puller: Eun Ki Kim2nd AC: Young Seo Park3rd AC: Sangphil KimDIT: Hyunji KimGaffer: Heo Jung HwanLighting Crew: Jo Ho Ik, Kim Yoon Sik, Ryu Sung Hoon, Son Su Won, Kang Min Gu, Eom Ji HoProduction Designer / Art Director: Bona Kim & Jinsil Park (Mu:E)Assistant Art Director: A yeong Choi, Minjung Kim (Mu:E)Art Team Manager: Ilho Heo (Mu:E)Techno Crane: Hwang Yong Geun, Kim Hak Seo, Lee Beom Ki, Lim Woo JinDI: Lucid ColourColorist: Wonseok Ko, Dain KimDI Crew: Seojin Jang, Jihyun Song, Imgoo Jo, Suhyeon BaeDI Producer: Ingyeong ChoiPerformance Directing: Lee Byungeun , Yoon SeongeunBX: LONETONE, Jihee HwangA&R: Daye Shin, Daniella Kim, Dongbin Shin, Jongwon Lee, Scooter BraunBIGHIT MUSIC. Rights are reserved selectively in the video. Unauthorized reproduction is a violation of applicable laws. Manufactured by BIGHIT MUSIC, Seoul, Korea.Connect with BTS: https://ibighit.com/bts http://twitter.com/BTS_bighithttp://twitter.com/BTS_twt http://www.facebook.com/bangtan.official https://www.youtube.com/user/BANGTANTV http://instagram.com/BTS.bighitofficial https://www.tiktok.com/@bts_official_bighithttps://weverse.onelink.me/qt3S/94808190https://www.weibo.com/BTSbighithttps://www.weibo.com/BTSmembers http://btsblog.ibighit.com#정국 #JungKook #JungKook_Seven"
"pva5AqQUzFc","Voici mon plus gros projet !!!","2023-07-15T16:00:37Z","UC-4M8AN08hw39nn2v91VuMQ","CYRILmp4","24","23.20.07","il|faut|qu'on|parle","460793","56559","0","2887","https://i.ytimg.com/vi/pva5AqQUzFc/default.jpg","False","False","👍 Merci à tous ceux qui laisseront un pouce bleu ►Abonne toi: http://bit.ly/1rot6qe►Instagram: https://www.instagram.com/cyrilmp4►Twitter: https://twitter.com/Cyril_mp4►Rejoins mon Discord : https://discord.gg/cyrilmp4►En live sur Twitch ici : https://www.twitch.tv/cyrilmp4►Ma 2ème chaîne gaming : https://www.youtube.com/@CYRILstudioContact professionnel : cyrilmp4@laportegroupe.com"
"Kewhc2P4lvI","Décès de Jane Birkin : la police devant son domicile parisien | AFP Images","2023-07-16T13:50:09Z","UCckz6n8QccTd6K_xdwKqa0A","AFP","25","23.20.07","1ES|IMAGES|FRANCE|MUSIQUE|CINEMA|CELEBRITES|GB|AFP|NEWS|ACTU|INFO","205273","553","0","428","https://i.ytimg.com/vi/Kewhc2P4lvI/default.jpg","False","False","Images du domicile de la chanteuse et actrice franco-britannique, Jane Birkin, décédée à l'âge de 76 ans, dans son domicile parisien.Vous souhaitez acquérir une licence d’exploitation de cette vidéo ? Contactez-nous 👉 http://u.afp.com/wvnR N.B. : les services et contenus de l’AFP sont réservés à un usage professionnel"
"KX0M6svVwKU","Cul noir de la tomate : comment prévenir et traiter pour des tomates parfaites","2023-07-16T06:07:26Z","UCDIgmeZc9u74_km26GTQy7g","f1rcx","26","23.20.07","[none]","166488","848","0","113","https://i.ytimg.com/vi/KX0M6svVwKU/default.jpg","False","False","Je vous dis pourquoi"
"TXPG5CgD8Go","MAKEUP 100% AMAZON !","2023-07-16T09:00:14Z","UCUvPpj_n9rQr0mU4OPp6Cjw","MissouMakeup","24","23.20.07","missou|missoumakeup|amazon|haul amazon|makeup amazon","202674","12559","0","426","https://i.ytimg.com/vi/TXPG5CgD8Go/default.jpg","False","False","HEY ! DÉROULE ICI POUR PLUS D'INFO ↓J'espère que tu vas bien et que tu as bien kiffé cette vidéo ❤️Je te mets ici les liens des articles de la vidéo: Certains liens sont affiliésBandeau escargot: https://amzn.to/3XPO6LPHighlighter MINA: https://amzn.to/44uI7OUFaux-cils: https://amzn.to/3XUOLLVCrayons à lèvre MINA: https://amzn.to/3XVL1tJPalette couleurs 40 fards: https://amzn.to/3rzeCwYRouge à lèvre MINA: https://amzn.to/3NQiqRTRecourbe cils chauffant: https://amzn.to/3NQiqRTÉponges: https://amzn.to/3JYbbGlBlush: https://amzn.to/3PYHCbyPinceau Rose:https://amzn.to/3PYHCby Kit de pinceaux: https://amzn.to/3Og632IMes réseaux sociaux 👉  INSTA: https://bit.ly/3yzzjXW                                       👉 TIKTOK: https://bit.ly/2VCoZjH                                       👉  FACEBOOK: https://bit.ly/2VEB0ERContact professionnel uniquement: missou.contact@gmail.comSi tu as des questions, n'hésite pas en commentaire !Pleins de bisous et à la prochaine LOVE Missou"
"pEEkD2VMpDo","Call of Duty est sauvé.. ? (Vidéo importante)","2023-07-17T19:20:52Z","UCjvsS_pdoMNIK73E4iJfsmw","AymenZeR","20","23.20.07","aymenzer|call of duty|call of duty 2023","33909","2116","0","317","https://i.ytimg.com/vi/pEEkD2VMpDo/default.jpg","False","False","Twitter → https://twitter.com/AymenZeRRRTwitch → https://www.twitch.tv/aymenzerChaine secondaire → http://bit.ly/AymenZeREMon discord : https://discord.gg/gdGKKzxfsQSource : https://twitter.com/JVCom/status/1678785800522158082https://twitter.com/PSInsideFr/status/1680583783756488705Mail pro : nemyaskill26@gmail.com💻 Pc :• Écran -  MSI NXG253R 360hz• CPU - Amd ryzen 5800X 3D• RAM - 16GO DDR4• GPU - MSI 4070 Ti Gaming TRIOSettings :1680x1050400dpiMouse pad : Cerapad KIN Tu as besoin d'aide ?  n’hésite pas  👇Sos Suicide : 09 72 39 40 50Harcèlement scolaire/internet : 3020Sos Addiction (drogue, jeux video..) : 06 01 43 31 94"
"PTgVhfv0Fms","4 BOSS qui te HARCÈLENT (fictifs, oubliez Bobby Kotick)","2023-07-17T15:15:04Z","UCeVpI1jEdMUfboWOtl_Bq6g","Iconoclaste","27","23.20.07","boss jeu vidéo|jeux vidéo|boss|harcèlent|combat|bagarre|fictifs|bobby kotick|kiryu|majima|majima everywhere|badlur|god of war|playstation|ps4|ps5|badeline|celeste|madeline|silver|pokémon gold|iconoclaste|boss ico","121007","5512","0","241","https://i.ytimg.com/vi/PTgVhfv0Fms/default.jpg","False","False","🔥 Utilisez ce lien pour téléchargez le jeu et obtenir 1000 tirages et Seiya Armure Divine : https://bit.ly/3XJVEQ2 Code de pack des bénédictions d'anniversaire : LEGEND1ST🔥 Nous soutenir sur PATREON ► https://www.patreon.com/iconoclasteDes boss qui se permettent de vous affronter régulièrement avant une ultime confrontation… vous en connaissez beaucoup ? Si vous avez joué à Mario, techniquement… vous devriez instinctivement penser à Bowser. A chaque fin de monde on parcourt un château rempli de lave, la grosse tortue cracheuse de feu vous attend au fond. Petit saut sur la hache qui fait tomber le pont, Bowser tombe, on passe au niveau suivant et rebelote, avec toujours un cran de difficulté supplémentaire plus on avance dans le jeu. Ce qui est rigolo avec Bowser c’est que l’omniprésence du roi des Koopas dans la trame des jeux sera aussi conservée dans les Mario 3D… sauf peut-être bien dans Sunshine, remplacé par son fils. Bah oui, même les vilains ont le droit à des vacances, autant charger le marmot de la sale besogne en prenant un bon bain. Et pour être honnête.. à part dans le jeux d’horreur, comme Resident Evil 2 & 3 ou… littéralement l’immense majorité des jeux d’horreur en fait, c’est pas si commun d’avoir un Boug qui te course dans les couloirs pour te mettre des coups de machette. Si dans l’horreur la référence évidente au slasher saute aux yeux, avec un ennemis invulnérable qui te tue en un coup - qui en réalité offre à ces jeux d'avantages de points communs avec Pacman qu’on ne veut bien l’admettre - dans d’autres styles c’est un peu plus compliqué. Si on joue c’est qu’on a l’opportunité d’être vainqueur… alors comment légitimer une victoire contre le boss final avant la fin du jeu sans que ce soit contre-immersif ? Oh je suis sûr que vous en avez des tonnes d’exemples de ces combats précoces que vous gagnez mais qui aboutissent à la victoire du vilain quand même pour X ou Y raison. Pareil, mettre en scène une défaite n'est pas si commun que ça non plus. Bonjour… vous ! J’un poil galéré dans ma sélection mais je vous ai trouvé quand même 4 exemples de boss qui vous harcèlent pendant tout le jeu, pas un seul n’est issu d’un jeu d’horreur et comme tous - sauf un - sont lié au développement de l’intrigue de leurs jeux respectif autant être cash : on va spoiler sec. Pensez à vous abonner si le travail vous plait, à mettre un pouce en l’air et à laisser un commentaire. Merci à tous les Patreotes qui nous soutiennent au quotidien… c’est parti. 0:00 Sponso1:24 Intro3:29 Badeline // Celeste8:38 Silver // Pokémon Or/Argent/Cristal13:52 Baldur // God of War (2018)20:07 Majima Everywhere // Yakuza Kiwami26:06 Conclusion ========================================­========================================­==============================🐤Twitter : Iconoclaste_sp📷Instagram : iconoclaste_sp🌎Facebook : L'IconoclasteChibi créé par @yeamob_========================================­========================================­==============================Pensez à lâcher les pouces bleus de l'amour, à vous abonner à partager la vidéo, c'est ma rétribution !"
"szxqyQhz8OE","KTYB x Don Pac - MESTWI","2023-07-17T13:31:55Z","UCnBeOXkvCydq1dY2XAOJ5nw","KTYB","10","23.20.07","[none]","171750","13034","0","785","https://i.ytimg.com/vi/szxqyQhz8OE/default.jpg","False","False","Music video , titled MESTWI , performed by KTYB feat Don Pac.Directed byOussama HamrouniEdited byAmir JebaliCamera operatorAnis ZaierProduced byLOBSTERS PRODCo-produced by:Digital Iris ProductionColor grading & VFXOussama HamrouniArt Direction & StylingInes GermainMixed & Mastered byFeddiniMusic byDon PacKTYBSpecial Thanks:Bedis ChaouachiYousr BoudenTamarziztBORN IN EXILE - Ibrahim ShebaniHippoclub - Omar TRABELSIAlba - Clubhouse Gammarth - Youssef BelhassineMax GermainVELOOKAmel M'radConnect with Oussama HAMROUNI :          Instagram - https://www.instagram.com/oussamahamr...Connect with Anis ZAIER :          Instagram  -  https://www.instagram.com/thehandouss/          Website - https://www.aniszaier.com/Connect with KTYB:           Instagram - https://bit.ly/2Sn1vdv           Facebook  - https://bit.ly/3d42FCN           Website -  https://soobidih.com/Connect with FEDDINI :          Instagram  - http://bit.ly/2O0cBlIConnect with Ines Germain:         Instagram  - https://www.instagram.com/inesgermain_/Connect with LOBSTERS PROD :          Instagram  - https://www.instagram.com/lobstersprod/Connect with DIGITAL IRIS PRODUCTION :          Instagram  - https://www.instagram.com/digitalirisproductions/?hl=frMESTWI © 2023 LOBSTERS PROD."
"RhOSjnMWBg8","Je fais un SON avec un ARTISTE au HASARD DANS LE MONDE #2","2023-07-16T16:00:16Z","UCOoEpLtkM4eFpToj7wXnykg","Ysos","10","23.20.07","artiste monde|ysos|globe|ysos beats|fl studio|composition|banger|beatmaker|beatmaking|artiste au hasard|monde|hasard|taiwan|zeo|ysos taiwan|ysos zeo","99823","11361","0","515","https://i.ytimg.com/vi/RhOSjnMWBg8/default.jpg","False","False","Un grand merci à Tracklib d'avoir sponsorisé cette vidéo ! 🙏🏻🔥Pour profiter de 15 crédits de téléchargement et 30 jours d'abonnement gratuits c'est ici ➡️ https://www.tracklib.com/campaign/ysos?code=ysos 🎶 Le morceau que j'ai samplé : https://www.tracklib.com/music/artists/nicole-bus/trust-1Un grand merci à ZEO pour sa participation 🙏🏻🎥 https://www.youtube.com/@zeow📷 https://www.instagram.com/zeowater-🌌 Nouveau drumkit « NOVA » disponible ➡️ https://air.bi/HN3Hk📦 Mes autres kits (Atlas, Cosmos…) ➡️ https://ysosbeats.infinity.airbit.com/kits-📱 TIKTOK : https://www.tiktok.com/@ysos_📷 INSTAGRAM : https://www.instagram.com/ysos.beats/📩 MAIL : contact@ysosbeats.com-🔔 Pour ne pas louper les prochaines vidéos, active les notifications ➡️ http://bit.ly/Sub-Ysos🎬 Ma chaîne de best-ofs ➡️ https://www.youtube.com/channel/UCvfDbkkMDrBGqivCBkJiwoA🎤 Chaîne d'Instrumentales ➡️ https://youtube.com/c/YsosBeats🌐 Mon site internet ➡️ https://www.ysosbeats.com/🎥 Vidéo montée par Frederic Rabeson💼 Assistant de production : Killian Jacq🎨 Miniature par hugovids-#Ysos"
"RxPFyXjWBGU","[MV] MAMAMOO+ '지구에 혼자 남게 된다면 (Save Me)'","2023-07-18T09:00:21Z","UCuhAUMLzJxlP1W7mEk0_6lA","MAMAMOO","10","23.20.07","MAMAMOO|마마무|솔라|Solar|문별|MoonByul|마마무플러스|MAMAMOOplus|지구에 혼자 남게 된다면|Save Me|TWO RABBTS","499947","40308","0","3084","https://i.ytimg.com/vi/RxPFyXjWBGU/default.jpg","False","False","[MV] MAMAMOO+ '지구에 혼자 남게 된다면 (Save Me)'Instagram: https://bit.ly/2TrQPJDFacebook: https://bit.ly/2OYoA1WTwitter: https://bit.ly/2TuKNboAbout MAMAMOO.MAMAMOO(마마무) OFFICIAL CHANNEL#MAMAMOOplus #마마무플러스 #지구에_혼자_남게_된다면MAMAMOO.SUBSCRIBE: https://bit.ly/2PFdfsIhttps://www.youtube.com/c/MAMAMOO_OFFICIALDon't forget to subscribe, like and leave a comment."
"kwVTJOCgKfs","LES MODS SUR I AM FISH","2023-07-17T12:59:49Z","UCKbxNkW0HIvZn7MisD46Vag","AYOUB1080plus","20","23.20.07","Ayoub|ayoub1080p|I am fish|gameplay|mods|FR","48901","2364","0","128","https://i.ytimg.com/vi/kwVTJOCgKfs/default.jpg","False","False",""
"JKaVYVCnggc","Alcaraz DÉTRÔNE Djokovic et GAGNE son 1er Wimbledon ! 👑 (Analyse Complète)","2023-07-16T20:03:43Z","UCwqA7PwSptp_jTz75XD6Nvg","Service Volée","17","23.20.07","tennis|service volée|alcaraz|alcaraz djokovic|djokovic alcaraz|carlos alcaraz|alcaraz wimbledon|wimbledon finale|wimbledon résumé|sans filet|the court|jules marie","50130","3958","0","759","https://i.ytimg.com/vi/JKaVYVCnggc/default.jpg","False","False","Il l'a fait ! Alcaraz détrône le maitre Djokovic en 5 sets en finale de Wimbledon au terme d'une performance physique, mentale et technique exceptionnelle. Une finale hautement symbolique et de légende dont je vous refais le film dans cette vidéo.--🎾-- LE CLUB --🎾--❤️ S'abonner ► https://bit.ly/32xL1la📲  Twitter ► https://twitter.com/SVolee 📺 Twitch ► https://www.twitch.tv/servicevolee--🎾-- LE PREMIUM --🎾--🙏 Tipeee (contenu Premium) ► https://fr.tipeee.com/servicevolee😍 Rejoindre (contenu Premium) ► https://bit.ly/3upeXic✍️ Contact ► servicevoleepodcast(@)gmail.com ✍️ Contact Premium ► servicevoleepremium(@)gmail.com --🎾-- LES IMMANQUABLES --🎾--💯 Ces Matches Qui M'ont Marqué ► https://bit.ly/3Wja9Z6🐐 Ma série sur le G.O.A.T, nominée aux Oscars ► https://bit.ly/3syqLxq❌ Tout commentaire haineux, hors-sujet ou illisible sera immédiatement retiré avec risque de permaban.🕛 CODE DE TEMPS :  00:00 Une finale légendaire ?02:38 Un tournoi sauvé par sa finale hommes03:35 Djokovic, perdant magnifique06:07 Alcaraz, la bénédiction10:06 Analyse tactique de la finale (revers, service et momentum)21:05 Le mot de la fin#alcaraz #djokovic #wimbledon"
"2t25A3PjKQY","MOISSON DES COLZAS 2023 ! C'est limite, limite...","2023-07-16T08:00:02Z","UCqUZbBrsA717E-c3lknHXoQ","Germain - Vlog Agricole","2","23.20.07","agricole|vlog|Agriculture|moisson|farming|colza|2023|moisson 2023|Claas|moissonneuse|colzas|agriculteur","47743","3651","0","94","https://i.ytimg.com/vi/2t25A3PjKQY/default.jpg","False","False","⬇️ Salut tout le monde, Les amis, aujourd'hui c'est le top départ pour les moissons des colzas 2023.Vous allez me suivre jour après jour durant la moisson avec la Claas Tucano, les New Holland et les Massey Ferguson. De notre côté, la moisson des colzas, ça a été limite limite... Je vous laisse le découvrir.  🛍️ Boutique ⬇️https://www.familleagri.fr🌅 Instagram ⬇️Instagram : https://www.instagram.com/germainvlogagricole📩 Contact Pro ⬇️germainvlogagricole@hotmail.com"
