video_id,title,publishedAt,channelId,channelTitle,categoryId,trending_date,tags,view_count,likes,dislikes,comment_count,thumbnail_link,comments_disabled,ratings_disabled,description
"ocSj5E7AvKg","Tyler Henry Brings Worst Day of Howie Mandel's Life to Light | Hollywood Medium | E!","2023-07-18T15:00:39Z","UCj7V_ikJOXO9RC8at6kYfHQ","E! Entertainment","22","23.22.07","Hollywood Medium|AMERICA'S GOT TALENT|AMERICAS_GOT_TALENT|CELEBRITIES|E! SHOWS|E_SHOWS|ENTERTAINMENT|REALITY TV|REALITY_TV|TV|TYLER HENRY|TYLER_HENRY|Tyler Henry|future|clarity|career|work|life|accurately|predicts|journey|Medium|clairvoyant|supernatural|paranormal|spirits|spiritual|readings|celebrity readings|afterlife|beyond the grave|howie mandel|howie mandel hollywood medium|judaism|lung cancer|late father|past guilt|guilt|america's got talent|deal or no deal","543077","10369","0","392","https://i.ytimg.com/vi/ocSj5E7AvKg/default.jpg","False","False","Hollywood Medium Tyler Henry relinquishes Howie Mandel from past guilt. Plus, the America's Got Talent judge re-lives a messy situation for the first time publicly. Check it out on this classic clip of Hollywood Medium With Tyler Henry. Full episodes available here: https://www.nbc.com/hollywood-medium-with-tyler-henry#HollywoodMedium #TylerHenry #HowieMandel #EEntertainmentSUBSCRIBE: http://bit.ly/EentsubAbout Hollywood Medium with Tyler Henry:Medium, clairvoyant, medical intuitive --Tyler Henry has an undeniable gift that he's ready to share with the world. Explore the life of this clairvoyant medium as he brings messages from the beyond to Hollywood celebrities, delivers jaw-dropping readings to celebrities looking for advice, connection and closure with loved ones who have passed on, all while balancing his unique abilities with trying to be a regular millennial. Tyler is the most sought after medium in Hollywood!Connect with the Hollywood Medium:Visit the Hollywood Medium WEBSITE: http://www.eonline.com/shows/hollywood_mediumWatch the Hollywood Medium Full Episode: http://www.eonline.com/now/hollywood-medium-with-tyler-henry  Like Hollywood Medium on FACEBOOK: https://www.facebook.com/hollywoodmediumwithtylerhenry/Follow Hollywood Medium on TWITTER: https://twitter.com/hollywoodmediumAbout E! Entertainment:E! is a pop culture destination where you can find great shows and romantic comedy movies. Fans can’t get enough of E!’s pop culture hits including “Celebrity Prank Wars,” “Celebrity Game Face” and “Botched.” And with new original programming on the way, there will be even more to love and talk about.Download The E! News App For The Latest Celebrity News and Trending Videos: https://eonline.onelink.me/yMtl/4ead5017Your favorite shows, movies and more are here. Stream now on Peacock. https://bit.ly/PeacockEEntConnect with E! Entertainment:Visit the E! WEBSITE: http://eonli.ne/1iX6d8n Like E! on FACEBOOK: http://eonli.ne/facebookCheck out E! on INSTAGRAM: https://www.instagram.com/eentertainmentFollow E! on TWITTER: https://twitter.com/eentertainmentFollow E! on Spotify: http://eonli.ne/spotifyTyler Henry Brings Worst Day of Howie Mandel's Life to Light | Hollywood Medium | E!http://www.youtube.com/user/Eentertainment"
"S951cdansBI","Deep Fakes are About to Change Everything","2023-07-19T12:00:19Z","UCmGSJVG3mCRXVOP4yZrU1Dw","Johnny Harris","28","23.22.07","Johnny Harris|Johnny Harris Vox|Vox Borders|Johnny Harris Vox Borders|Vox|deep fakes|ai|artificial intelligence|technology|video|morph|synthetic|media|deep learning|digital|machine learning|manip|sag|entertainment|strike","1277569","43345","0","3841","https://i.ytimg.com/vi/S951cdansBI/default.jpg","False","False","WTF is a Deep Fake?Use code JOHNNYHARRIS at the link below to get an exclusive 60% off an annual Incogni plan: https://incogni.com/johnnyharrisCheck out Ctrl Shift Face: https://youtube.com/@CtrlShiftFaceReady or not, deep fakes are here to stay. Deep fakes are going to change the way we trust information around us and even each other. The question is - are we prepared for the threat they cause while being able to harness their potential for good?My next video is live on Nebula NOW! It's about how countries are starting to challenge the US-led world order that emerged after World War 2. Watch now: https://nebula.tv/videos/johnnyharris-were-heading-into-a-new-cold-warCheck out all my sources for this video here: https://docs.google.com/document/d/1m-P_PVIa4PRfIccxh2QIoUpK5Je9BFOx9jAGYB-_g1o/edit?usp=sharingGet access to behind-the-scenes vlogs, my scripts, and extended interviews over at https://www.patreon.com/johnnyharrisI made a poster about maps - check it out: https://store.dftba.com/products/all-maps-are-wrong-posterCustom Presets & LUTs [what we use]: https://store.dftba.com/products/johnny-iz-luts-and-presetsThe music for this video, created by our in house composer Tom Fox, is available on our music channel, The Music Room! Follow the link to hear this soundtrack and many more: https://youtu.be/Y_WBGC_28z4About: Johnny Harris is an Emmy-winning independent journalist and contributor to the New York Times. Based in Washington, DC, Harris reports on interesting trends and stories domestically and around the globe, publishing to his audience of over 3.5 million on Youtube.  Harris produced and hosted the twice Emmy-nominated series Borders for Vox Media. His visual style blends motion graphics with cinematic videography to create content that explains complex issues in relatable ways.- press - NYTimes: https://www.nytimes.com/2021/11/09/opinion/democrats-blue-states-legislation.htmlNYTimes: https://www.nytimes.com/video/opinion/100000007358968/covid-pandemic-us-response.htmlVox Borders: https://www.youtube.com/watch?v=hLrFyjGZ9NUNPR Planet Money: https://www.npr.org/transcripts/1072164745- where to find me -Instagram: https://www.instagram.com/johnny.harris/Tiktok: https://www.tiktok.com/@johnny.harrisFacebook: https://www.facebook.com/JohnnyHarrisVoxIz's (my wife’s) channel: https://www.youtube.com/iz-harris- how i make my videos -Tom Fox makes my music, work with him here: https://tfbeats.com/I make maps using this AE Plugin: https://aescripts.com/geolayers/?aff=77All the gear I use: https://www.izharris.com/gear-guide - my courses - Learn a language: https://brighttrip.com/course/language/Visual storytelling: https://www.brighttrip.com/courses/visual-storytelling"
"j2Pe_sUms94","change","2023-07-18T19:00:18Z","UCjVLCcrQsYX7Lu98pOcP3GA","Nicolas Sturniolo","22","23.22.07","Nick sturniolo|Nicolas sturniolo|Nicolas sturniolo hair|Nick sturniolo hair|Nicolas sturniolo blonde|Nick sturniolo blonde|Nick sturniolo best moments|Nicolas sturniolo change|Nicolas sturniolo hair salon|Sturniolo|Sturniolos|Nick sturniolo lip balm|Nicolas sturniolo Q&A","365360","52664","0","5111","https://i.ytimg.com/vi/j2Pe_sUms94/default.jpg","False","False","Follow Me on Instagram : https://www.instagram.com/nicolassturniolo Follow Me on TikTok : https://www.tiktok.com/@nicolassturnioloAdd me on Snapchat : @nicolassturn"
"-JnpyNsWNqo","Justified: City Primeval | Episode 1 Opening Scene: Raylan and Willa's Run-In | FX","2023-07-18T20:59:50Z","UC2dIDJBf9W88PxGm-uHZPaQ","FX Networks","24","23.22.07","FX|Justified|City Primeval|US Marshal service|Elmore Leonard|Detroit|crime novel|Fire in the Hole|Timothy Olyphant|tv series|FX networks|Hulu|Sequel|Aunjanue Ellis|Boyd Holbrook|Adelaide Clemens|Vivian Olyphant|Spin Off|preview|sneak peek|pilot|first episode|season 1 episode 1|first season|raylan and willa|raylans daughter|car crash|car chase|car theft|trade|steal a car|willa givens|car accident|gun fight|showdown|sheriff|new justified series","412127","3619","0","429","https://i.ytimg.com/vi/-JnpyNsWNqo/default.jpg","False","False","We're a long way from home. FX’s Justified: City Primeval premieres tonight on FX. Stream on Hulu.Subscribe now for more Justified: City Primeval clips: http://bit.ly/SubscribeFX  |  Visit Official Site https://fx.tv/JCP Starring Timothy Olyphant, Aunjanue Ellis and Boyd Holbrook. Raylan Givens left the hollers of Kentucky and is balancing life as a U.S. Marshal with being a part-time father. A chance encounter sends him to Detroit and on a collision course with a violent sociopath and a formidable defense attorney.Like Justified on Facebook: https://www.facebook.com/JustifiedFXFollow Justified on Twitter: https://twitter.com/justifiedfx Follow Justified on Instagram: http://instagram.com/justifiedfxLike FX on Facebook:  http://bit.ly/FXNetworksFacebook Follow FX on Twitter: http://bit.ly/FXNetworksTW Follow FX on Instagram: http://bit.ly/FXNetworksInstagram Justified: City Primeval | Episode 1 Opening Scene: Raylan and Willa's Run-In | FXhttps://www.youtube.com/user/FXNetwork"
"REAofm9qh-E","LABOR AND DELIVERY VLOG!","2023-07-18T19:00:11Z","UCYPV-kSs-WzUqIFoIlgoFGg","Ace And Chloe","24","23.22.07","Yungeen ace|ace and chloe|Chloe g|Chloe glass|the ace family|pranks|family|challenges|entertainment|dearra|riss & quan","207791","15339","0","1350","https://i.ytimg.com/vi/REAofm9qh-E/default.jpg","False","False","Instagram : @chloeglasss , @yungeenace Twitter : @chloeglass11 , @yungeen ace   Youtube : @aceandchloe6467 , @YungeenAce , @chloeg7049WWW.CGLASSCLOTHING.COM"
"xoyPbAz2P8E","The Ferrari Daytona SP3 Is a $2.5 Million Dream Supercar","2023-07-18T15:55:00Z","UCsqjHFMB_JYTaEnf_vmTNqg","Doug DeMuro","2","23.22.07","[none]","863277","27604","0","4122","https://i.ytimg.com/vi/xoyPbAz2P8E/default.jpg","False","False","CHECK OUT CARS & BIDS!https://carsandbids.comThis is the Ferrari Daytona SP3, a $2.5 million dream supercar. Today I'm reviewing this Ferrari Daytona SP3, and I'll show you all the many quirks and features. I'm also going to get behind the wheel of the Ferrari Daytona SP3 and show you what it's like to drive.WEBSITE & MERCH!http://www.dougdemuro.comFOLLOW CARS & BIDS!YouTube - @carsandbids Instagram - https://www.instagram.com/carsandbids/TikTok - https://www.tiktok.com/@cars_and_bidsTwitter - https://twitter.com/carsandbidsFOLLOW ME!Twitter - http://www.twitter.com/dougdemuroInstagram - http://www.instagram.com/dougdemuroFacebook - http://www.facebook.com/ddemuroDOUGSCORE CHART:https://www.dougdemuro.com/dougscoreCHAPTERS:00:00 CARS & BIDS!!!00:16 THIS...00:44 Overview02:01 Supercar??02:34 Incredibly Expensive02:57 Most Powerful Ferrari NA V1204:39 Incredibly Fast05:20 Ferrari P4 Styling06:11 Controversial Design07:07 Getting Inside10:00 Fender Mounted Mirrors10:27 Purpose Built Interior11:40 Steering Wheel Controls12:50 Gauge Cluster Screen14:18 Other Screens14:57 Mirror Adjustment16:38 Removable Roof17:36 Gated Shifter Buttons18:38 No Storage19:19 Climbing Out20:11 Front Trunk20:54 Ferrari Tool Kit21:27 Window Sticker22:13 Exterior Quirks & Features23:53 Vroom Vroom24:25 No Engine Access25:09 Driving Experience25:40 I Barely Fit26:20 Beautiful Reflections26:54 Compared to the Monza SP127:18 Bringing Back the Ferrari Specialness27:43 Sheer Power28:31 More Special than LaFerrari?29:23 Final Thoughts29:53 DougScore#dougdemuro #cars #ferrari #daytona"
"soVg7yjNG5s","In This Moment - THE PURGE [OFFICIAL VIDEO]","2023-07-18T14:00:08Z","UC3o9YaRy8gc-lMmw_XpqgiQ","In This Moment","10","23.22.07","[none]","478175","40786","0","1960","https://i.ytimg.com/vi/soVg7yjNG5s/default.jpg","False","False","Official music video for THE PURGE.From the forthcoming album GODMODE out October 27.Pre-order/pre-save here: https://inthismoment.lnk.to/GODMODEDirector/Cinematographer: Jensen NoenProducers: Phoenix Vaughn & Ruth Devereaux & Ashley Haines & Arthur GrigoryanExecutive Producers: Frank Borin & Ivanna BorinExecutive Producers: Josh Balz & Amber HancockProduction Company: Blesscode EntertainmentStoryboard by: Maria Brink & Jensen Noen Video Commissioner: Valeri HedgesBMG On-Site Rep: Jordan MeltzerDMX Programmer/Op: Zane BlanchardLeadman: Yurii FedorovTechno Jib Op: Tim Lee1st AC: Kraig BryantColor: Lunar EdgeVFX: Alex Verenchyck1st AD: Tiffany WaxlerSteadicam: Eugene FilatovChoreography: Maria Brink & Erin BridgesHair & Makeup: Tara TatangeloStylist: Maria Brink & Travis Johnson Performers: Erin Bridges, Erin Gray, Amy Morgan, Ivanna Jackson, Evie Martinez, & Kasey CanterBehind the Scenes Photography: Jeremy SafferBehind the Scenes Video: Joe CotelaSong produced, co-written, mixed, and mastered by Kane Churko"
"ZZoOPTkXBI4","27-0 win | All Goals & Highlights | FC Rottach-Egern - FC Bayern","2023-07-18T20:17:27Z","UCZkcxFIsqW5htimoUQKA0iA","FC Bayern München","17","23.22.07","FC Bayern München|Bayern Munich|FCB|FC Bayern|Fußball|Football|Soccer|Bayern Highlights|27-0|All Goals|Alle Tore|Musiala|Sabitzer|Mane|Gnabry|Tel|Laimer","2659489","46846","0","3066","https://i.ytimg.com/vi/ZZoOPTkXBI4/default.jpg","False","False","FC Bayern beat Rottach-Egern 27-0 in their first game of pre-season at their Tegernsee training camp. Head coach Thomas Tuchel started with a strong line-up of Sven Ulreich in goal, a back four of Noussair Mazraoui, Dayot Upamecano, Benjamin Pavard and Alphonso Davies. Konrad Laimer was handed his debut in midfield alongside captain Joshua Kimmich. The front four consisted of Leroy Sane, Jamal Musiala, Mathys Tel and Serge Gnabry. New defender Minjae Kim was not involved but in attendance to watch just hours after his signing was announced.► Wanna see more of Musiala, Müller, Davies & Co.? Subscribe now and hit the bell 🔔: https://fc.bayern/YouTubeAboFC Bayern Matchday Center: https://www.youtube.com/c/FCBayernMatchdayCenterFacebook: https://www.facebook.com/FCBayernTwitter: https://twitter.com/fcbayernInstagram: https://www.instagram.com/fcbayernTikTok: https://www.tiktok.com/@fcbayernSnapchat: https://fc.bayern/FCBayernSnapsWebsite: https://fcbayern.comFC Bayern.tv: https://fcbayern.com/fcbayerntvFC Bayern.tv live: https://fcbayern.com/fcbayerntv/de/fcbayerntvliveFC Bayern Newsletter: https://fc.bayern/newsletter_youtube"
"4k0nwpoBNXo","That Mexican OT - Barrio feat. Lefty Sm (Official Music Video)","2023-07-17T19:00:10Z","UC4cvpsB_dAX8i5vdaBB-96w","That Mexican OT","10","23.22.07","that mexican ot|mexican ot|interscope|interscope records|geffen records|cinematic music group|rap|hip-hop|texas|nonsense & mexican shit|paul wall|curren$y|baycity|southern rap|south texas|south Texas rap|texas hiphop|mexican rap|johnnydang|johnny dang","872006","39539","0","2015","https://i.ytimg.com/vi/4k0nwpoBNXo/default.jpg","False","False","Listen to That Mexican OT's Barrio - https://thatmexicanot.lnk.to/BarrioThat Mexican OT - Johnny Dang (feat. Drodi & Paul Wall) (Official Music Video) - https://youtu.be/tvmUrOSahscListen to That Mexican OT's Johnny Dang - https://thatmexicanot.lnk.to/JohnnyDangFollow That Mexican OT:Instagram - https://www.instagram.com/thatmexicanotTikTok - https://www.tiktok.com/@thatmexicanot?_t=8cc8pHxWOZ0&_r=1Soundcloud - https://soundcloud.com/thatmexicanotFacebook - https://www.facebook.com/thatmexicanotmusicTwitter - twitter.com/thatmexicanot_#thatmexicanot #mexicanot #leftysm #barrio"
"tGTKY1dpo_E","Young Thug - Oh U Went (feat. Drake) [Official Video]","2023-07-17T17:00:09Z","UCuwdplPbuTFZj_64d03tSBA","Young Thug","10","23.22.07","Young Thug Business is Business|Business is Business|BIB|Young Thug BIB|Young Thug|Young Thug Drake|BIB Young Thug|Business is Business official visualizer|Young Thug official visualizer|Young Thug Business|new young thug|Business is business video|Young|Thug|Young Thug - Oh U Went (feat. Drake) [Official Visualizer]|Young Thug - Oh U Went|Oh U Went (feat. Drake)|Young Thug Oh U Went|Young Thug Drake Oh U Went|Drake|Drake and Young Thug|Oh U Went Drake","2364052","126640","0","3634","https://i.ytimg.com/vi/tGTKY1dpo_E/default.jpg","False","False","The official video for Young Thug's Oh U Went music video featuring @DrakeOfficial from his album 'BUSINESS IS BUSINESS' - Out Now!Stream 'BUSINESS IS BUSINESS' on all platforms: http://youngthug.ffm.to/businessisbusinessFollow Young Thughttp://www.twitter.com/youngthug​http://instagram.com/thuggerthugger1​http://www.tiktok.com/@thuggerthugger1http://www.facebook.com/youngthugmusicFollow Drakehttps://www.drakeofficial.comhttps://instagram.com/champagnepapihttps://facebook.com/drakehttps://twitter.com/drakehttps://www.drakeofficial.com#YoungThug #Drake #OhUWent℗ 2023 Young Stoner Life Records exclusively distributed by 300 Entertainment/Atlantic RecordsAy u went flyin bentley spurAy u went drivin round the worldAy u went brown like a squirrelAy u went Chanel pearlsAy u went Rolls royce carAy u went Rolls Royce TruckOh u want water on all my hoesOh u want to line it all upAh I’m a player/playa it how it isAh I been playa for some yearsAh u tryina steal all the spillAh im in the field on a pillAy u wanna spill then lets spillAh u know how real niggas isRolls royce still Uncle PhilYeah , uh uh Verse 1Oh u went top offOh u went flintstonesOh u took the lil rolley offOh u went big stonesOh u made two extra m’sOh u went ringtonesOh u went train on that bitchOh u went ding dongOh u went kingpinOh u went wings inOh u went hands onOh u went semenOh u went demonShootin out the demon Oh u had came in Now they were streamingHookAy u went flyin bentley spurAy u went drivin round the worldAy u went brown like a squirrelAy u went Chanel pearlsAy u went Rolls royce carAy u went Rolls Royce TruckOh u want water on all my hoesOh u want to line it all upAh I’ma player/playa it how it isAh I been playa for some yearsAh u tryina steal all the spillAh im in the feel another pillAy u wanna spill then lets spillAh u know how real niggas isRolls royce still Uncle PhilYeah , uh uh (DRAKE)Yup, look6 God, he a visionaryI’m the definition like the dictionaryBaby turn around, forget the missionaryIf they pull up on me with some bad intentions, you gon read about it in obituaryI got more soldiers than a militaryGot more stones than a cemetery Mo strings, and y’all are February (? - unclear)It’s getting hard to put a price on a show, can’t even pick an amount nowIf a nigga really try to jam me, get jammed first like the countdownI thank God for that flight straight from the 9 side going southboundThey say that life’s about balance baby, and the balance is in my account nowOkay, she gotta perc and a BirkI got her twerking in TurksShe’ll probably let both of us hitThe way that she smirking at DirkShe getting cake off the pictures she take,I said girl if it work then it workFuck a wedding dress, I’m tryna murk it then skrrrrtHookAy u went flyin bentley spurAy u went drivin round the worldAy u went brown like a squirrelAy u went Chanel pearlsAy u went Rolls royce carAy u went Rolls Royce TruckOh u want water on all my hoesOh u want to line it all upAh I’ma player/playa it how it isAh I been playa for some yearsAh u tryina steal all the spillAh im in the feel another pillAy u wanna spill then lets spillAh u know how real niggas isRolls royce still Uncle PhilYeah , uh uh"
"5mutcH0B7XU","100 Pranks to Make Your Friends RAGE Quit","2023-07-18T22:00:02Z","UCJZam2u1G0syq3kyqrCXrNw","PrestonPlayz","20","23.22.07","minecraft|preston|brianna|gaming|funny|family friendly|ssundee|unspeakable|mrbeast|aphmau|canman|lankybox|cash minecraft|nico mc|stokestwins|gametoons|maizen|eyestreem","1045915","18777","0","1053","https://i.ytimg.com/vi/5mutcH0B7XU/default.jpg","False","False","👕 MERCH - http://www.firemerch.com 🔥 NEW Fire Merch App - https://tinyurl.com/mvsnxr6👀 FOLLOW ME HERE!☛ TikTok - https://www.tiktok.com/@preston☛ Instagram - https://instagram.com/prestonplayz☛ Twitter - https://twitter.com/Preston☛ PrestonShorts - https://bit.ly/2VrTLIr🎮 Join my Fan Discord! ☛ http://discord.gg/Preston------------------------------Additional music provided by Epidemic SoundClick here for a free trial!  http://share.epidemicsound.com/TBNR#minecraft"
"eUqkibPzW3s","EA SPORTS FC 24 | Official Gameplay Deep Dive","2023-07-18T14:58:10Z","UCoyaxd5LQSuP4ChkxK0pnZQ","EA SPORTS FC","20","23.22.07","Fc 24|ea sports fc 24|ea sports fc 24 trailer|ea sports fc 24 gameplay|fc 24 gameplay trailer|fc24 gameplay|fc24 gameplay trailer|EA SPORTS FC|EA SPORTS FC 24 features|EA SPORTS FC 24 release date|EA SPORTS FC 24 ps5|EA SPORTS FC 24 xbox|EA SPORTS FC 24 pc|EA SPORTS FC 24 news|EA SPORTS FC 24 official trailer|EA SPORTS FC 24 pre-order|fifa 24|ea fc 24|ea fc|ea fc 24 trailer","2566113","104374","0","5554","https://i.ytimg.com/vi/eUqkibPzW3s/default.jpg","False","False","See the new gameplay features in EA SPORTS FC 24, including HyperMotionV, PlayStyles optimised by Opta, and an enhanced Frostbite engine. Pre-order FC 24 now: http://x.ea.com/77068Learn more about the new gameplay features in EA SPORTS FC 24, launching September 29: http://x.ea.com/77086Pre-order EA SPORTS FC™ 24 Ultimate Edition by 22 August to get a UEFA Champions League or UEFA Women’s Champions League Ultimate Team™ Hero Item on 27 November**: http://x.ea.com/77068CHAPTERS:0:00 - Intro0:24 - HyperMotionV3:15 - PlayStyles6:34 - FrostbiteSubscribe to see more from EA SPORTS FC™: http://bit.ly/pzw4VD#FC24"
"-4H3l6DX0pA","2023 XXL Freshman Cypher With Finesse2tymes, Lola Brooke, Fridayy, Real Boston Richey","2023-07-17T16:00:28Z","UCbg_UMjlHJg_19SZckaKajg","XXL","10","23.22.07","[none]","493418","14731","0","4717","https://i.ytimg.com/vi/-4H3l6DX0pA/default.jpg","False","False","Watch the 2023 XXL Freshman cypher featuring Finesse2tymes, Real Boston Richey, Fridayy and Lola Brooke.Beat for cypher produced by Pi’erre BourneVideo directed by Travis Satten (https://www.travissatten.com/)Video produced by The Rhythm Section Creative (https://www.therhythmsection.us/)Buy the 2023 XXL Freshman Class magazine here: https://shop.xxlmag.com/p/xxl-magazine-freshman-class-2023-issueVisit the 2023 XXL Freshman Class official page: https://www.xxlmag.com/freshman/#XXLFreshman #XXLFreshmen #Finesse2tymes #Fridayy #RealBostonRichey #LolaBrooke #PierreBourne #HipHop #Rap #Rapper #Cypher #Freestyle Subscribe to XXL → http://bit.ly/subscribe-xxl Go here → http://www.xxlmag.com/XXL on Twitter → https://twitter.com/XXLXXL on Instagram → https://instagram.com/xxl/XXL on Facebook → https://www.facebook.com/xxlmag"
