video_id,title,publishedAt,channelId,channelTitle,categoryId,trending_date,tags,view_count,likes,dislikes,comment_count,thumbnail_link,comments_disabled,ratings_disabled,description
"QFTKyVTrGvo","ICON 5 | R2 | Ep. 2 - Kampf ums Überleben (Nächste Folge bei 12.000 Likes)","2023-07-23T16:00:10Z","UCjNU3wSbOC6hJ5UQI0l45WQ","ICONxMADE","10","23.28.07","Made Entertainment|ICON 3|ICON 4|ICON 5|MADE|ICON|Favela|Team biggie|biggie68|azu|Vito|shabab|hassuna|skandal|infinit|Kelmo|Accaoui|Nyon","397881","26286","0","1949","https://i.ytimg.com/vi/QFTKyVTrGvo/default.jpg","False","False","➤ 𝗧𝗜𝗖𝗞𝗘𝗧𝗦: https://openair-hoherbusch.de/products/icon-5-live         ↪ (35 Euro im VVK, 50 Euro Abendkasse)➤ 𝗦𝗣𝗢𝗧𝗜𝗙𝗬: https://sptfy.com/Lp7F➤ 𝗜𝗖𝗢𝗡 𝟔 𝗔𝗡𝗠𝗘𝗟𝗗𝗨𝗡𝗚: https://icon-music.de/➤ 𝗠𝗘𝗥𝗖𝗛: https://iiicon.shop/➤ 𝗩𝗢𝗧𝗜𝗡𝗚 𝗟𝗜𝗩𝗘 𝗩𝗘𝗥𝗙𝗢𝗟𝗚𝗘𝗡: https://app.icon-music.de➤ 𝗗𝗜𝗦𝗖𝗢𝗥𝗗 𝗕𝗘𝗜𝗧𝗥𝗘𝗧𝗘𝗡: https://discord.gg/ICONxMADE𝗞𝗔𝗣𝗜𝗧𝗘𝗟 𝗔𝗨𝗦𝗪𝗔𝗛𝗟:0:00 Intro & Challenge Beschreibung10:20 Team Kenan (Versuch 1)14:25 Teaam Ozan20:35 Team Kenan (Versuch 2)26:57 Team Skandal 31:39 Team Biggie68 (Favela)𝗕𝗘𝗦𝗖𝗛𝗥𝗘𝗜𝗕𝗨𝗡𝗚:Wir haben 40 der besten Künstler aus ganz Deutschland im Knast eingesperrt. Durch eine reihe von Rap Challenges müssen die Künstler ihr Talent unter beweise stellen um sich einen Platz im großen Live Event und dem Finale zu sichern. Wer kann die Nerven behalten und sich gegen die Konkurrenz durchsetzen? Wer wird Eliminiert? Schalte ein, um es herauszufinden!𝗗𝗜𝗘 𝗖𝗥𝗘𝗪:Calien (MADE) - Executive Producer, Organisation, Planung, Editing, Color Grading, Sound design, Livestream KoordinatorXandro (MADE) - Organisation, Planung, Künstler Management, Recording, Mixing/Mastering, Jury MitgliedMonkeyfilms - Kamerateam Management, Video Produktion, OrganisationEmre - Jury Mitglied, Organisation, Planung, Location ScoutingBzet - Jury Mitglied, Organisation, PlanungPeter (MADE) - Künstler Management, Organisation, Planung, Musik Vertrieb, Musik Verlag, Legal, App DevelopmentBleron (MADE) - Thumbnails, Graphics, Social Media ManagementNoah (MADE) - Social Media ManagementOnkel (Dreamhall) - Discord Community Management100 Bendo - Unterstützender SchauspielerSmakov - Unterstützdender SchauspielerDanke an Alle Künstler für euer Vertrauen und Hingabe zum Projekt!Ich hoffe euch allen gefällt was wir alle zusammen in einem der größten kollaborativen Projekte auf Youtube gemacht haben. Viel spaß beim zuschauen!Tags:#ICON5 #Runde2 #Knast #Talentwettbewerb #Musikwettbewerb ICON 5, Talentwettbewerb, Musikwettbewerb, Live-Voting, Künstlername, App ICON Music, Künstler der Top 40:Kelmo, Shabab, Adones, Yassine, Adaver, Queris, Nyon, 4Nesca, Hassuna, Faset119, Raise, Alan, Massary, Deny, Scapecher, Infinit, Accaoui, Skandal, JZ, Mocro, Cali, Vito030, Zako159, Crimez53, Ozan, Ata, Benzko, Azu, Saki, Sntry, Rasa, Sari, Cy Chris, Biggie68, Baro, Bayor, Kenan, Smelly, F1rst, Rubar47"
"dZrgAMWvIBA","【#holoAdvent】WANTED!【hololive English New Unit Debut PV】","2023-07-26T02:57:09Z","UCotXwY6s8pWmuWd_snKYjhg","hololive English","24","23.28.07","[none]","684682","55708","0","2673","https://i.ytimg.com/vi/dZrgAMWvIBA/default.jpg","False","False","hololive English ‐Advent‐ debuts on 7/29-30 PDT!👁‍🗨 @ShioriNovella  (Debut: 7/29 @ 8:00 PM PDT)Debut stream: https://www.youtube.com/watch?v=EwGAcKnE-y4🗿 @KosekiBijou  (Debut: 7/29 @ 8:45 PM PDT)Debut stream: https://www.youtube.com/watch?v=rpAQib0T5v0🎼 @NerissaRavencroft  (Debut: 7/30 @ 8:00 PM PDT)Debut stream: https://www.youtube.com/watch?v=gg3SrFzHn9M🐾 @FUWAMOCOch (Debut: 7/30 @ 8:45 PM PDT)Debut stream: https://www.youtube.com/watch?v=Kttt7pb5o6I====================CREDITS:[Editors]Ni-c (https://twitter.com/gokinjocat)よし (https://twitter.com/yoshi_8900)[Key Visual]Chyan (https://twitter.com/qleleldhcks)[Music]az sound====================Follow the official hololive English accounts!▶Official YouTube channel: @hololiveEnglish   ▶Official Twitter: https://twitter.com/hololive_En▶Official Facebook: https://www.facebook.com/hololivetv/▶️Official Reddit: https://www.reddit.com/r/Hololive/▶Request from hololive production to underage viewers:Please be sure to check the link below before viewing our content.https://en.hololive.tv/request-to-minors"
"BwYxUwWXeSc","Dani Mocanu - Cand altii ma copiaza | Official Video","2023-07-24T16:00:07Z","UC7F3aaccZ4D64ZCrzkCmANw","Mocanu Top Romania","10","23.28.07","[none]","795548","25979","0","632","https://i.ytimg.com/vi/BwYxUwWXeSc/default.jpg","False","False","Subscribe ► https://www.youtube.com/c/MocanuTopRomaniaToate drepturile rezervate © & ® Mocanu Top RomaniaBooking & Licensing ► mocanutopromania@gmail.com Dani Mocanu online :FB page ► https://www.facebook.com/DanielMocanuOficialFB personal ► https://www.facebook.com/danielmocanuofficialInstagram ► https://www.instagram.com/danimocanu.oficialTiktok ► https://vm.tiktok.com/p7uatJ/ @danimocanu10Pentru Concerte & Evenimente 📞+40733 931 072  ☎️ (Adrian Necula)Atentie ! La acest numar raspunde numai managerul#DaniMocanu #MocanuTopRomania"
"m5cxXmbSIks","Should Souls Fans Play Armored Core 6?","2023-07-25T15:00:23Z","UC477Kvszl9JivqOxN1dFgPQ","Iron Pineapple","20","23.28.07","armored core|armored core 6|souls like|soulslike|iron pineapple|dark souls|elden ring|gameplay|review|guide|commentary","712613","36280","0","2933","https://i.ytimg.com/vi/m5cxXmbSIks/default.jpg","False","False","I played Armored Core 6: Fires of Rubicon for 6 hours, and as someone previously unfamiliar with Armored Core, I have a lot of thoughts.twitter: https://twitter.com/IronPineapple_TIMESTAMPS0:00 Intro0:36 FromSoftware Souls Fan Perspective1:43 Quick Review2:16 Basic Overview2:53 Movement & Boosting4:24 Targeting/Shooting5:32 Weapons6:30 Scanning & Healing6:44 Combat and STAGGER8:10 Attack Power and Impact8:45 More Weapons (sword and shield too)9:42 Boost Kick and Core Expansion10:15 Movement is important 10:51 Combat Difficulty 11:23 SOULS-LIKE???12:16 Mech Customization16:32 Missions Overview18:01 Desert Mission18:44 Operation Wallclimber Mission19:26 Mission 1119:41 FINAL BOSS20:52 Interview with Director Masaru Yamamura21:53 Interview Questions/Answers26:12 Conclusionalso big thanks for help from:Onua for creating the SFM pose of the knight in the thumbnail: https://twitter.com/Odynom"
"48WNEf3pnqI","Warum gerade keine Videos kommen...","2023-07-25T15:45:53Z","UC173FCaSv6VvqDxuoinDr3g","Felixba","28","23.28.07","[none]","107918","13410","0","1301","https://i.ytimg.com/vi/48WNEf3pnqI/default.jpg","False","False","Jep, ich bin jetzt Vater! Aber was bedeutet das für die Zukunft von diesen Kanal? Das klären wir heute :)#MiniBaMein Podcast KREWKAST mit Julian von OwnGalaxy:YouTube: http://www.youtube.com/dierumpelkisteApple Podcasts: https://podcasts.apple.com/de/podcast/krewkast/id1245391611Spotify: https://open.spotify.com/show/5eYTEL27Xp8dnObTDbeNPq?si=88233e27247440d5--------------------------------------------------------------Instagram:http://www.instagram.com/felixbaTwitter:http://www.twitter.com/felixba--------------------------------------------------------------Die Amazon-Links (http.amzn.to/????) in der Videobeschreibung sind Afilliate-Links. Wenn ihr über die Links etwas kauft, bekomme ich eine kleine Provision, ohne dass sich der Preis für euch ändert. Danke für den netten Support!"
"DcDjyestr4Y","ARMORED CORE VI FIRES OF RUBICON – Gameplay Preview","2023-07-25T13:45:06Z","UC_ntXHv-XdKCD7CPynVvnQw","Bandai Namco Entertainment America","20","23.28.07","Bandai Namco|Bandai Namco Entertainment|Video|Games|video games|namco bandai|United States|PS5|PS4|Xbox Series X","2129598","71404","0","6046","https://i.ytimg.com/vi/DcDjyestr4Y/default.jpg","False","False","Feed the fire. Let the last cinders burn.Pre-order #ARMOREDCORE VI : https://armoredcore6.comStart your mission on August 25th, 2023 on PlayStation, Xbox, and PC. Follow us on:Web: https://armoredcore6.comInstagram: https://www.instagram.com/armoredcore/Twitter: https://twitter.com/armoredcoreFollow Bandai Namco Entertainment: Instagram: https://www.instagram.com/bandainamcousFacebook: https://www.facebook.com/BandaiNamcoUSTwitter: https://twitter.com/BandaiNamcoUSTwitch: http://www.twitch.tv/bandainamcous"
"jBeXyKVvhb0","How England’s football league is breaking the sport","2023-07-25T12:00:27Z","UC7KbIaEOuY7H2j-cvhJ3mYA","Search Party","17","23.28.07","sam|ellis|johnny|harris|search party|vox|vox borders|vox atlas|vox explained|geopolitics|news|sports|politics|explainers|journalism|premier league|football|soccer|england|fulham|ffc|chelsea|cfc|fifa|europe|uk|british|teams","452620","26468","0","2250","https://i.ytimg.com/vi/jBeXyKVvhb0/default.jpg","False","False","And why the rest of Europe can’t keep upUse code SEARCHPARTY at the link below to get an exclusive 60% off an annual Incogni plan: https://incogni.com/searchpartySince 1992, the English Premier League has enjoyed some of the most remarkable growth in sports history. Today, its clubs collectively generate more than Є6.5 billion in revenue each year.  But Europe’s other leagues make far less, and their disadvantage is starting to make the sport less competitive.Check out all our sources here: https://docs.google.com/document/d/1Y0uOga8hYh5tZhqB8BWZZkPijm9Vpyf4bIHvP3jYbls/edit?usp=sharingWelcome to Search Party!Search Party is a new, independent, video news show that combines experienced journalism and visual design to decode the most complex stories in international sports and geopolitics.Subscribe and turn on notifications 🔔  so you don't miss any videos: https://www.youtube.com/@Search-PartyBecome a Search Party Original member today: https://www.youtube.com/channel/UC7KbIaEOuY7H2j-cvhJ3mYA/joinAbout:Search Party is led and produced by Sam Ellis, a journalist, director, editor, and animator based in New York City. For more than 6 years, Ellis produced the hugely popular video series, Vox Atlas, for which he earned an Emmy nomination. He specializes in breaking down the most complex new stories and presenting them with a refreshing, accessible, and engaging visual style. He’s produced explainers on some of the world’s thorniest geopolitical stories; from corruption scandals in Latin America, conflict in the Middle East, and the rise of China, to the world of sports; the Monaco Grand Prix, the FIFA corruption scandal, and the 100-foot waves of Nazaré, Portugal.  Ellis has also directed multiple episodes of TV; notably on Netflix’s ‘Explained’ and HBO Sport’s ‘Level PLaying Field’. Got story ideas or tips? Reach out to the team at:Twitter: https://twitter.com/swellis_Email: sam@searchparty.ch"
"3ajADL92vuU","Shocking Hazard at Open Sauce (best event of the year so far!)","2023-07-25T16:01:33Z","UCJ0-OtVpF0wOKEqT2Z1HEtA","ElectroBOOM","28","23.28.07","educational|electrical|ElectroBOOM|science|electronics|engineering|entertainment|equipment|measurement|experiment|mehdi|mehdi sadaghdar|arc|mishap|physics|Sadaghdar|test|tools|circuit|funny|learn|shock|spark|discharge|Open Sauce","373159","27876","0","1527","https://i.ytimg.com/vi/3ajADL92vuU/default.jpg","False","False","It’s like meeting family and friends you didn’t get to meet for a long time, and then shocking them!!! No sure they want to meet me again... But they started selling next year tickets already and it is selling fast. Will they dare to invite me?!Get your ElectroBOOM Bundle at https://www.circuitspecialists.com/electroboom-101-kit.htmlMy new MERCH:  https://electroboom.creator-spring.comThanks for your support @ http://patreon.com/electroboomPost your submissions to: http://reddit.com/r/electroboom My Facebook:  http://www.facebook.com/ElectroBOOMMy Twitter:   http://twitter.com/electroboomguyMy other articles:  https://www.electroboom.com/Thanks to Circuit Specialists for proving my essential lab tools, my referral link: https://www.circuitspecialists.com/?ref=l2p0t4z1 Also thanks to Keysight for their awesome scopes and meters: http://keysight.com And thanks to Lulzbot for 3D printer and filaments: https://lulzbot.comCheckout my Amazon picks (my affiliate link): https://www.amazon.com/shop/ElectroboomBelow are my Super Patrons with support to the extreme!Nicholas Moller at https://www.usbmemorydirect.comSam LutfiZoddyAmbiance DomotiqueMy sponsors and top patrons: http://www.electroboom.com/?page_id=727Enter your school for tools: https://goo.gl/forms/VAgRre8rLVvA1cEi2By: Mehdi Sadaghdar"
"oziUBiAmsdk","GIVING TOBI 30 PRESENTS FOR HIS BIRTHDAY!","2023-07-25T17:19:05Z","UCWZmCMB7mmKWcXJSIPRhzZw","Miniminter","24","23.28.07","simon|sidemen|miniminter|mm7games|random|vlog","2028184","112644","0","1720","https://i.ytimg.com/vi/oziUBiAmsdk/default.jpg","False","False","Which present was the best? Check out the ROG Ally here: https://uk.rog.gg/miniminterThank you to Asus ROG for sponsoring this video. ⭐ SEND ME YOUR VIDEO IDEAS:https://docs.google.com/forms/d/e/1FAIpQLSfrqSDycG6GevuJD7gGvfHsa3O-qdbTTyZjV-Lr3tjoP5hXLQ/viewform?usp=sf_link➖ Follow me ➖📷 Instagram: https://www.instagram.com/miniminter🐦 Twitter: https://twitter.com/miniminter🎮 Twitch: https://www.twitch.tv/miniminter🎬 Second Channel: https://www.youtube.com/MM7Games👕 Sidemen Clothing:  https://www.sidemenclothing.com➖ My Equipment ➖My PC: http://bit.ly/miniminterHow I record my gameplay: http://e.lga.to/mmVideo uploaded bySimon/Miniminter/mm7games"
"pYwgLNQDNyU","DETECT MY LOVE - MYSTA RIAS (prod. Camellia)","2023-07-25T12:50:10Z","UCIM92Ok_spNKLVB5TsgwseQ","Mysta Rias 【NIJISANJI EN】","10","23.28.07","にじさんじ|NIJISANJI EN|vtuber|envtuber|english vtuber|English|male vtuber|Luxiem|Ike Eveland|Mysta Rias|Shu Yamino|Luca Kaneshiro|Vox Akuma|LazuLight|OBSYDIA|Ethyria","1539423","168225","0","18471","https://i.ytimg.com/vi/pYwgLNQDNyU/default.jpg","False","False","It's finally released huh? Please don't take my singing so seriously, I made this a fun little project for myself! I'm no singer, rapper or song writer but I for sure had fun with what was produced and I think that is clear to see!Hope you all enjoy and thanks so much to Camellia for making this happen!Vocals by Mysta RiasMusic produced/arranged by CamelliaLyrics by Camellia & Mysta RiasArt by GurepyonArtTwitter: https://twitter.com/Mysta_RiasLYRICS: (Woah-oh) (Ah ah)(Woah-oh)De-De-DeDetect my-(Woah-oh) (Ah ah)(Woah-oh)De-De-DeDetect my-I wanna feel your heat against my skin (uh-huh)These feelings I've been trying to hold in (uh-huh)Oh won’t you please just let me in (uh-huh)I want you baby just let me inyou know i can see it in your eyesDon't sit and act like you're surprisedI'm so tired of playing niceI know you want my love tonightI knew you were the one when i laid sightGive me a chance to impress you with all my mightOkay I’m rapping while this song is bumping, Swing those arms yeah get them pumpingI'm gonna just keep saying words to make you think I’m saying somethingIn reality i put this part here for essentially nothingBut i sound coolNow can you feel my heartDetect my loveIt’s something you don't know you missLa-lee-luh-loveHow many words before youDetect my loveYou know that i love you (Yeah)Only one option to choose (Yeah)Hey I won't let you stay shyWhen you’re in front of this mysterious guy(Woah-oh)De-De-DeAnd i'm back forAnother rap yourGonna tell me how to make you want me back yeahI live inside your head everyday rent freeMy influence be getting bigger everyday i needSome competition cause I’m tired of being in this positionGetting told to disappear like I’m a fucking magicianBut i don’t listen, making numbers like a fucking mathematicianyou do nothing with your life for years its fucking tradition so yeahI'll be over in this corner going fucking insaneIn my room alone writing these words inside my brainThe only outlet that i have since i rose to fameWhen I’m sitting in my home it doesn't feel the sameI need eyes on me now that i need constant attentionHow the fuck can i live life when I’m not looking at mentionsGoing crazy looking at my stats for viewer retentionI’m here stuck at my desk like I’m at fucking detention  Don't panic, look at me (okay)To calm down your stare is all i needBut I just want you to make me freeI’ll try to match your paceYou won't forget my tasteSo cant i end the night in your embraceNow can you feel my heartDetect my loveYou know you just can't get enoughLa-lee-luh-loveBaby i caught your bluff  Detect my loveI know that u love me (Yeah)Only one option i see (Yeah)Hey I won't let you stay shyWhen you’re in front of this mysterious guyHooked on this case i know i just can't stay away                   This trails been hot i really like the way you play   These pictures in my office your my prime suspect    After our fun I'll make sure you will detectGonna wanna take a moment just look a little deeperYou’re the one that’s going to save me just like a goalkeeperPlaying your game dodging bombs its feeling like its minesweeperCan you please just realise through these bars you’re a gatekeeperFOR MY HEARTIf you now feel my heartDetect my loveYou can finally just accept this blissLa-lee-la-lee-loveYou don’t need any more words toDetect my loveYou burn bright but i'm flameproofOnly one option to chooseHey I won't let you stay shyLook at the sky, the stars so highFeel comfort now that i'm nearbyYeah you’re in front of this mysterious guy(Woah-oh) (Ah ah)(Woah-oh)De-De-DeDetect my-(Woah-oh) (Ah ah)(Woah-oh)De-De-DeDetect my love.▽　Guidance for minorshttps://www.anycolor.co.jp/notice-for...▽　For Business and PR Inquiries https://www.anycolor.co.jp/en/contact"
"JrKv_LpRtK0","All The Angles of Naoya Inoue Highlight Reel KO of Fulton | Now Unified Champion | FIGHT HIGHLIGHTS","2023-07-25T13:15:01Z","UCbzRzJNHx7ZLlJML9BjZQVQ","Top Rank Boxing","17","23.28.07","top rank boxing|naoya inoue|井上尚弥|井上直哉亮點|井上直哉訓練|boxing|inoue vs fulton|fulton vs inoue|naoya inoue vs stephen fulton|inoue highlight|stephen fulton vs naoya inoue|井上vsフルトン|stephen fulton vs naoya inoue full fight|naoya inoue vs stephen fulton full fight|naoya inoue vs stephen fulton highlights|stephen fulton vs naoya inoue highlights|fulton vs inoue full fight|fulton vs inoue highlights|inoue vs fulton highlights|inoue vs fulton knockout|fulton inoue|inoue fulton","1901869","28104","0","8209","https://i.ytimg.com/vi/JrKv_LpRtK0/default.jpg","False","False","Watch the #highlights from the main event of #fultoninoue featuring #naoyainoue and #stephenfulton In the fight, it was all Inoue scoring a highlight reel ko victory to become unified champion.Next up for Top Rank Boxing, Pound-for-pound dynamo Seniesa Super Bad” Estrada will defend her WBC and WBA minimumweight world titles against Argentina’s former world champion Leonela Yudica on Friday, July 28 at Pearl Concert Theater at Palms Casino Resort in Las Vegas. In the 10-round junior lightweight co-feature, unbeaten Las Vegas native Andres “Savage” Cortes will take on Sacramento-born contender Xavier Martinez. The entire Estrada-Yudica card will stream live and exclusively in the U.S. on ESPN+. Promoted by Top Rank, tickets starting at $50 go on sale Thursday, June 15 at 12 p.m. PT and can be purchased at Ticketmaster.com.Try ESPN+ For Free: https://watch.espnplus.com/toprank/Subscribe to our YouTube channel to get notified about the latest highlights, free full fights, and fight week content as it's posted.Follow Top Rank on Twitter: http://www.twitter.com/trboxingFollow Top Rank on Instagram: http://www.instagram.com/toprankLike Top Rank on Facebook: http://www.facebook.com/trboxing"
"LOrfUtRNxko","JP Performance - Nach 5 Jahren endlich wieder GOODWOOD! | Vlog mit meiner Freundin","2023-07-25T09:30:06Z","UC1-VOKyTJrgLiBeiJqzeIUQ","JP Performance GmbH","2","23.28.07","goodwood|2023|jp|freundin|jp freundin|vlog|jpperformance|jean pierre|kraemo|lamborghini|hyundai|ioniq|lotus|Sound|JP Performance|Jean Pierre Kraemer|PS Profis|JP|Boost|Turbo|Dortmund|Germany|Drift|Flames|Backfire|Antilag|Burnout|Loud|Exhaust|Abgasanlage|Tuning|VLOG|Fail|Compilation|BMW|M4|Audi|R8|Lamborghini|Bugatti|Veyron|VW|Golf|GTI|F40|918|Spyder|Cars|BiTurbo|Supra|Corvette|Straßenumfrage|Frankfurt|dreamcar|Anfängerauto|Gemera","743887","39513","0","2666","https://i.ytimg.com/vi/LOrfUtRNxko/default.jpg","False","False","Schön wieder hier zu sein!- - -#jpperformanceDiese Produkte nutzen wir alltäglich!* https://www.amazon.de/shop/jpperformance*Affiliate-Link: Euch entstehen keine Kosten oder Nachteile. Kauf über diesen Link erwirtschaftet eine einstellig prozentuale Provision.- - -TikTok: https://bit.ly/34wBKB2TWITCH: https://www.twitch.tv/kraemounchainedHIGHLIGHTS: https://bit.ly/3zW7UjNFACEBOOK: https://goo.gl/CpAuI4INSTAGRAM: https://goo.gl/SxiVbkWEBSITE: http://goo.gl/MPbEzf- - -...Jean Pierre Kraemer / JP Performance GmbH - zwei Begriffe die für Spaß, Leistung, Power, freche Sprüche, schnelle Autos, Turbotechnik, Turboumbauten, Ladedruck und noch vieles mehr stehen.Mit diesen Videos biete ich dir einen Einblick ins tägliche Leben hier in der Firma ,Leistungssteigerungen, technische Details & Erklärungen, Soundfiles, Messwerte, Vergleiche, Neuvorstellungen & Präsentationen und und und...Du bist quasi live bei all unseren Projekten, Events und Reisen in die große, weite Welt mit dabei. Egal ob Audi, BMW, Chrysler, Dodge, Ferrari, Ford, GMC, Honda, Infiniti, Jaguar, Koenigsegg, Lamborghini, Mercedes, Nissan, Opel, Porsche, Range Rover, Skoda, Tesla, Volkswagen oder Wiesmann... es ist für jeden etwas dabei und auch fast von A - Z :-PJeder der sich denkt: I LIKE BIG BOOST ist hier genau richtig, frei nach dem Motto FÄHRSTE QUER SIEHSTE MEHR siehst du hier Aufnahmen von Drifts, Drags und anderen Spielerein die große Jungs halt gerne machen.Wenn du Anregungen / Wünsche oder sonstiges hast, kannst du dich gerne melden unter:0231/39696375 - info@jp-performance.de - www.jp-performance.de"
"6J6QDgH0Nsk","Diese XXL FISCHFALLE funktioniert! - Reuse für 7 vs. Wild | Survival Training","2023-07-23T16:00:09Z","UCSyAFJ6cmgYabA0RfPCNuzA","Fritz Meinecke","19","23.28.07","Diese XXL FISCHFALLE funktioniert! - Reuse für 7 vs. Wild | Survival Training|7 vs. wild|7 vs wild|fritz meinecke 7 vs wild|fritz meinecke|fisch falle bauen|fischfalle bauen|reuse bauen","764210","52254","0","1342","https://i.ytimg.com/vi/6J6QDgH0Nsk/default.jpg","False","False","Diese XXL FISCHFALLE funktioniert! - Reuse für 7 vs. Wild | Survival Training► ► Checkt die INSTA360 X3 hier: https://www.insta360.com/sal/x3?insrc=INRJY3RErhaltet über diesen Link exklusiv 8% Rabatt und einen gratis Selfie Stick!►7 vs. Wild Kanal: https://www.youtube.com/@7_vs._wild►Mein Live Kanal: https://www.youtube.com/c/FritzMeineckeLive►►►Mein Onlineshop:https://bit.ly/33CNBsQ►Instagram:https://bit.ly/2FHbRSn►Hier findest du meine komplette Ausrüstung:https://bit.ly/3ks3IA8►Hier bekommst du 10% Rabatt bei YFood mit dem Code 10Fritzhttps://bit.ly/yfoodtasterpack_fritz►Hier bekommst du 15% Rabatt bei Revolution Race mit dem Code fritz15 https://bit.ly/RR-Fritz►Hier bekommst du 5% Rabatt für deinen online Angelschein mit dem Code fritz5https://bit.ly/3hJW95U►Hier kannst du eine 7 Tage Kanutour auf eigene Faust machen:https://bit.ly/3ccLHmu►Werde Youtube-Mitglied wenn du mich unterstützen möchtest: http://bit.ly/2VTvtsy"
"8s44_lzQW-k","Wir bauen eine 90° STEILE REGENBOGEN WASSER RUTSCHE! (mit Trampolin POOL!)","2023-07-23T16:00:08Z","UCGCYzFQ-rQ5eXjeTQJ_W-VA","Vinny Piano","24","23.28.07","Regenbogen|Riesig|riesen regenbogen|rutsche|wasser rutsche|xxl|pool|trampolin|trampolin pool|trampolin turm|riesen rutsche|wasserbombe|garten|wir bauen|selber bauen|kreativ|DIY|brüder|bros|spaß|lustig|lachen|big bounce|salto|springen|sommer|sonne|sommerferien|vlog|vinny piano|vincent stenzel|trends|sport|outdoor|selber machen|wasser|slip n slide|airtrack|schnellste wasserrutsche|steilste wasserrutsche","532281","23063","0","1028","https://i.ytimg.com/vi/8s44_lzQW-k/default.jpg","False","False","Wir bauen eine RIESEN REGENBOGEN WASSERRUTSCHE die vom TRAMPOLIN TURM in den POOL geht... 🌊 Vinny Piano SHOP: https://www.vinnypianoshop.comWenn dir meine Videos gefallen, kannst du mich gerne kostenlos abonnieren!🔥⬇️FOLG MIR AUCH AUF⬇️INSTAGRAM (vinnypiano):https://www.instagram.com/vinnypianoTIK TOK (vinnypiano):https://www.tiktok.com/@vinnypiano ► Bis zum nächsten Mal, tschau! MUSIK:Track: Inukshuk - The Long Road Home [NCS Release]Music provided by NoCopyrightSounds.Listen:  https://youtu.be/athFRSHdragFree Download / Stream: http://ncs.io/TLRHYOSong: Oshóva - In The Jungle (Vlog No Copyright Music)Music promoted by Vlog No Copyright Music.Video Link: https://youtu.be/HhYKFJfKXUQ OUTRO MUSIK:Song: Ship Wrek, Zookeepers & Trauzers - Vessel [NCS Release] Music provided by NoCopyrightSounds.Watch: https://youtu.be/PXf4rkguwDI Download/Stream: http://ncs.io/VesselCr"
