video_id,title,publishedAt,channelId,channelTitle,categoryId,trending_date,tags,view_count,likes,dislikes,comment_count,thumbnail_link,comments_disabled,ratings_disabled,description
"3hd1b3lqy4M","Es ist was passiert..","2023-07-23T10:00:02Z","UCsdvYCZNcEySbDbAy4NFsCw","Malwanne","24","23.28.07","Malwanne|ankündigung|verlobung|freund|verlobter|heiraten|vanessa timo","244404","34836","0","1928","https://i.ytimg.com/vi/3hd1b3lqy4M/default.jpg","False","False","Was soll ich sagen. Es ist was passiert..*Hier findest du Produkte aus meinen Videos: https://www.amazon.de/shop/malwanne🎬TIKTOK: https://www.tiktok.com/@malwanne📸INSTAGRAM: http://instagram.com/malwanne👩🏻‍🍳📚*MEIN KOCHBUCH: https://amzn.to/2KHfV3fLinks, die mit einem * gekennzeichnet sind zählen als Affiliate Links. Das bedeutet, dass nach einem messbaren Erfolg ein kleiner Gewinn ausgezahlt wird, wenn ihr Produkte über diese Links kauft. Ihr müsst sie natürlich nicht darüber bestellen. Ich bedanke mich für jede Unterstützung!"
"CH0GME7dlyY","Official r/place canvas timelapse: day 5","2023-07-24T21:34:31Z","UCUgrUBKwSnXwQOBG4v3igMg","Reddit","28","23.28.07","Reddit|Reddit.com","272672","4300","0","1094","https://i.ytimg.com/vi/CH0GME7dlyY/default.jpg","False","False","r/place is live on Reddit, but it won't be for long. Enjoy the official timelapse from day 5: https://reddit.app.link/C2KTtV07vBb"
"2hCUsjNVuiY","200K Zuschauer vernichten Frankreich & Türkei! Papaplatte übernimmt r/place mit spanischem Streamer","2023-07-24T14:00:02Z","UCKGsnVRGTkEt1qufI9SiHWQ","zCrexpy","24","23.28.07","papaplatte|papaplatte clips|papaplatte highlights|papaplatte best of stream|papaplatte donation|papaplatte gaming|papaplatte realtalk|papaplatte bastighg|Twitch|papaplatte musik|papaplatte rap|papaplatte freundin","225503","8884","0","321","https://i.ytimg.com/vi/2hCUsjNVuiY/default.jpg","False","False","Neues süßes Kevin Video für eure Augen! Papaplatte SocialsTwitch: https://www.twitch.tv/papaplatteTwitter:  https://twitter.com/Papaplatte?lang=deYoutube: https://www.youtube.com/user/papaplatteInstagram: https://instagram.com/papaplatte  Podcast auf Spotify: https://spoti.fi/2SrXQcezCrexpy SocialsTwitter: https://twitter.com/CrexpainTwitter: https://twitter.com/zCrexpyTwitch: https://www.twitch.tv/zcrexpy#papaplatte #papaplatteclips #papaplattehighlights"
"MPc8-Do7Ekc","“I think I fit in very well here“ | Marcel Sabitzer joins BVB","2023-07-24T17:23:35Z","UCK8rTVgp3-MebXkmeJcQb1Q","Borussia Dortmund","17","23.28.07","BVB|Borussia Dortmund|Bundesliga|Marcel Sabitzer|Sabitzer|Neuverpflichtung|Nummer 20|Sabitzer BVB|Dortmund Sabitzer|Sabitzer BVB Interview|Sabitzer Interview|Sabitzer Highlights|Marcel Sabitzer Dortmund|Sabitzer Rückennumer|Sabitzer Transfer|Transfer|Transfer BVB|Schwarzgelb","115760","5426","0","613","https://i.ytimg.com/vi/MPc8-Do7Ekc/default.jpg","False","False","Marcel Sabitzer Borussia Dortmunds new number 20! Immediately after his signing, the central midfielder took time to talk to us about his motivations, playing style and goals. In doing so, the energetic Sabitzer wants to go ahead with all motivation in his new living room and inspire the black and yellow fans.▶ Subscribe & hit the bell: https://goo.gl/kujepCBVB-TV: https://www.bvb.tv/ Twitch: https://www.twitch.tv/bvb_officialTwitter: https://twitter.com/BVBInstagram: https://www.instagram.com/bvb09Facebook: https://facebook.com/BVBDiscord: https://discord.com/invite/borussiado...TikTok: https://www.tiktok.com/@bvbWebsite: https://www.bvb.de/#BVB"
"p6qGc-pwxqE","Ich übernehme r/Place","2023-07-22T11:08:19Z","UCGrEhW-D986zSjijnnhq5hg","LetsHugo","24","23.28.07","LetsHugo|Hugo|Reddit|r/place|Place|Pixelart|Jules|Trollen|Papaplatte|Mango|Mahluna|Monte|Gönrgy|Hugo testet Gönrgy|Monte Getränk|Indienflagge|osu angriff|hugo zerstört osu|place event reddit|reddit event|pixelart reddit|osu pixelart|kanada r/place fail","338426","20437","0","481","https://i.ytimg.com/vi/p6qGc-pwxqE/default.jpg","False","False","Heute gibts eine Zusammenfassung, wie ich im Stream zusammen mit meinen Zuschauern andere Pixelarts attackiert habe in R/Place. Dabei waren Stegi, Papaplatte und Mahluna.Außerdem habe ich das neue Getränk von Monte namens Gönrgy getrunken.🎊Abonnieren : https://bit.ly/3asQajd🔊Discord : https://discord.gg/3TtnubH🥈2. Kanal : https://bit.ly/3byiJvL📈Daily Streams : https://www.twitch.tv/letshugotv🎉Mitglied werden : https://bit.ly/2WRuXM6💬Social Media💬•Instagram : https://www.instagram.com/letshugo/?hl=de•Twitter : https://twitter.com/LetsHugoYT?lang=de📨 Geschäftliche Anfragen▸LetsHugo@ins.gg"
"3SdKODqdNZw","Finnel - Dorfkinder (prod. by Stard Ova)","2023-07-21T16:00:09Z","UC6zt1e6c9N4VaSBOhC1wV9g","Finnel","10","23.28.07","Finnel|Dorfkinder|Dorfkind|Fendt|Musikvideo|Song","2598150","101112","0","8260","https://i.ytimg.com/vi/3SdKODqdNZw/default.jpg","False","False","Die Single „Dorfkinder“ von Finnel ab sofort streamen:https://finnel.lnk.to/DorfkinderMehr zu Finnel:Instagram: https://www.instagram.com/finnelTikTok: https://www.tiktok.com/@finnelMit freundlicher Unterstützung von meinem Heimatverein FC Wang:https://www.fcwang.de/und der freiwilligen Feuerwehr Wang:https://feuerwehr-wang.feuerwehren.bayern/Musik Credits:Text: Finn Lorenzen / Andre Braun / Chimaobinna Enyiakanwanne Onyele / Peter Jordan / Colin Kniewe Komposition: Finn Lorenzen / Andre Braun / Chimaobinna Enyiakanwanne Onyele / Peter Jordan / Colin Kniewe Produktion: Stard OvaMix & Master: Stard OvaVideo Credits: Director: Basel HegewaldProducer: Sönke AhrendsDoP: Luka Katic1st AC: Mert Alhan  Styling: Pauline Knorr Grading: Claudiu BodanLight Effects: Jannik SonnenbergSFX: Star-Effects GmbHSchwein: Piglet CircusEine FASTLANES Produktionwww.fastlanes.dehttps://www.instagram.com/fast.lanes/Ein VIRRAL x FAST LANES Produkt ©️ 2023#finnel #dorfkinder"
"X5sBqaAyUOg","ReLive: Rot-Weiß Erfurt - BVB | 3. Testspiel der Saison 2023/24 | 🇩🇪 Kommentar","2023-07-22T16:35:48Z","UCK8rTVgp3-MebXkmeJcQb1Q","Borussia Dortmund","17","23.28.07","BVB|Borussia Dortmund|Bundesliga|BVB Live|dortmund|dortmund live|bvb spiel live|bvb testspiel|bvb 2023|bvb test live|bvb test|bvb erfurt|dortmund erfurt|borussia dortmund rot weiß erfurt|bvb erfurt live","369973","5421","0","126","https://i.ytimg.com/vi/X5sBqaAyUOg/default.jpg","False","False","Click here for the stream with English commentary: https://youtube.com/live/i0ctJgmuNk0Im dritten Testspiel der Saison 2023/24 gastiert der BVB beim Regionalligisten Rot-Weiß Erfurt. Hier seht ihr die kompletten 90 Minuten der Mannschaft von Edin Terzic live, es kommentieren Boris Rupert und Stephan Gabele.▶ Abonnieren & die Glocke aktivieren: https://goo.gl/kujepCBVB-TV: https://www.bvb.tv/ Facebook: https://facebook.com/BVBTwitter: https://twitter.com/BVBInstagram: https://www.instagram.com/bvb09Twitch: https://www.twitch.tv/bvb_officialTikTok: BVBWebsite: https://www.bvb.de/#BVB"
"qlxe3V7YhI4","Auf dem RASEN + KOMMENTATOR 😍💙 Schalke vs Twente STADION VLOG 🔥","2023-07-23T08:02:40Z","UCY7aQw00ds31nu29HPiWbtg","Broski","24","23.28.07","gamerbrother|gamerbrother 2 kanal|broski|broski fifa|gamerbrother vlog|broski vlog|broski kanal|stadion vlog|staion|vlog|gamerbrother stadion vlog|broski stadion vlog|stadion vlog deutsch|broski stadionvlog|broski schalke vlog|broski schalke stadion|broski schalke kommentator|broski spende|broski schalke spende|broski schalke tour|Schalke Twente|Schalke twente 2 2|Twente|Twente schalke|Schalke testspiel","94334","8443","0","186","https://i.ytimg.com/vi/qlxe3V7YhI4/default.jpg","False","False","👉 Zu GamerBrother: ➽ Youtube: https://www.youtube.com/user/TheGamerBrothersTV➽ Instagram: https://goo.gl/7zcIgg➽ Twitch Livestreams: https://www.twitch.tv/gamerbrother➽ Twitter: https://goo.gl/VwGw1V  ➽ Tik Tok: https://www.tiktok.com/@realgamerbrother⭐️ Stream Highlights Kanal: https://bit.ly/2KuYhS0⭐️ GamerBrother Clips: https://www.youtube.com/channel/UCZ_hsuvK0-wxAWOieS_EGqw⭐️ At Broski - Die Sport Show: https://www.youtube.com/channel/UCouRH0Rc_lcCg2_YbiCFxkw▬▬▬▬▬▬▬▬▬▬▬▬▬▬▬▬▬▬▬▬▬▬▬➽  Meine Marke TNO: https://www.tno-clothing.com/ * Die Links hängen mit Partnerprogrammen zusammen. Sie dienen dem potentiellen Käufer als Orientierung und verweisen explizit auf bestimmte Produkte. Sofern diese Links genutzt werden, kann im Falle einer Kaufentscheidung eine Provision an mich ausgeschüttet werden.▬▬▬▬▬▬▬▬▬▬▬▬▬▬▬▬▬▬▬▬▬▬▬Playlisten: ➽ Stadion Vlogs: https://www.youtube.com/playlist?list=PLerJ_GyWqi_Geoaw0qKIYjwJDlpNFt52c➽ Parma Karriere Fifa 22: https://www.youtube.com/playlist?list=PLerJ_GyWqi_HwbCMDHj71bE043KCteK47➽ Haus Vlogs: https://www.youtube.com/playlist?list=PLerJ_GyWqi_HA7S0B_02JVgB1hWoY2126▬▬▬▬▬▬▬▬▬▬▬▬▬▬▬▬▬▬▬▬▬▬▬Impressum:Simon SchildgenC/O Fairplay-Management GmbH Schauenburgerstraße 11624118 Kiel0431 55601469gamerbrother@fairplay-management.de"
"3kmQzYCAh9o","Worst MMO Ever? - Champions Online","2023-07-23T17:00:07Z","UCRWyPm7MrfotIYF8A8MGV3g","Josh Strife Hayes","24","23.28.07","mmo podcast|mmo discussion|mmo design|mmorpg youtuber|mmo news","458310","18052","0","1785","https://i.ytimg.com/vi/3kmQzYCAh9o/default.jpg","False","False","Patreon: https://www.patreon.com/joshstrifehayesTwitch: https://www.twitch.tv/joshstrifehayesDiscord: https://discord.gg/GM2sCUXTwitter: https://www.twitter.com/joshstrifehayesReddit: https://www.reddit.com/r/joshstrifehayes#####Look up in the sky!is it a bird?Is it a plane?No, it's legally distinct man with super powers!Champions online is a superhero MMO made by Cryptic, our old friends behind Neverwinter and Star Trek Online, and as such it's fun...but my god it's monetised.So join me for 45 minutes of superhero jokes.Thanks as always to the supporters on Patreon, Twitch and Youtube. :)"
"jj430D3wYzM","ICH BIN WIEDER SCHWANGER! 🤰🏻LIVE REAKTION 😍 ∣ CANSIN","2023-07-23T13:00:28Z","UCN7V3udUGbBwjMbjOchjgnw","Cansin","24","23.28.07","pregnant|baby2023|pregnantrevveal|wirbekommeneinbaby|wirsindschwanger|schwanger|schwanger2023|cansin|reaktion|babyno2","56550","2180","0","215","https://i.ytimg.com/vi/jj430D3wYzM/default.jpg","False","False","Ich hoffe dieses video hat euch gefallen, für mehr Videos hinterlasst uns einen Daumen nach oben und vergisst nicht uns kostenlos zu Abonnieren. :)HIER KÖNNT IHR MIR FOLGEN 👇🏻Instagram 📸Cansin.11Geschäftliche Anfragen / Business Inquiries:cansel94@hotmail.de"
"hEE-BD5gfw8","ONE PIECE | Offizieller Trailer | Netflix","2023-07-22T01:00:02Z","UCZqgRlLcvO3Fnx_npQJygcQ","Netflix Deutschland, Österreich und Schweiz","24","23.28.07","Abenteuer|Alvida|Anime|Arlong|Buggy|Eiichiro Oda|Emily Rudd|Flying Lamb|Going Merry|Gummi|Iñaki Godoy|Jacob Romero Gibson|Kuro|Luffy|Mackenyu|Manga|Mihawk|Nami|Netflix|ONE PIECE|Piraten|Piratinnen|Realverfilmung|Ruffy|Sanji|Strohhut|Strohhüte|Taz Skylar|Trailer|Usopp|Zoro|dehnbar|elastisch","568504","11545","0","1990","https://i.ytimg.com/vi/hEE-BD5gfw8/default.jpg","False","False","Alle an Bord! Wir stechen in See … Die Suche nach dem ONE PIECE beginnt am 31. August exklusiv auf Netflix.Abonniere den YouTube-Kanal von Netflix Deutschland, Österreich und der Schweiz: http://bit.ly/2QSZLs9Besucht unseren Netflix-Guide für alle News, Neustarts, Serien-Hypes und Blicke hinter die Kulissen: https://www.netflixwoche.deÜber Netflix:Netflix ist mit 238 Millionen zahlenden Mitgliedern in über 190 Ländern einer der größten Entertainment-Dienste weltweit und bietet Zugriff auf eine große Auswahl vielfältiger Serien, Filme, Dokumentationen, Reality- und Comedy-Formate sowie Mobile Games in zahlreichen Sprachen. Mitglieder können die Wiedergabe der Inhalte jederzeit und überall unbegrenzt starten, unterbrechen und fortsetzen sowie ihr Abo zu jedem Zeitpunkt ändern.Folge Netflix:Facebook: https://www.facebook.com/NetflixDACH/Twitter: https://twitter.com/NetflixDEInstagram: https://www.instagram.com/netflixde/TikTok: https://www.tiktok.com/@netflixdeONE PIECE | Offizieller Trailer | Netflixhttps://www.youtube.com/@Netflixdach"
"-dPllbFcK0I","Fohlen BABYPARTY🥰🎉💕 mit @HellaGabbert","2023-07-23T13:42:33Z","UCme4EdkCzTxn5xIjciDteZA","Julia Libertyhorses","15","23.28.07","Fohlen|Pferde|Ponys|Babys|Babyparty|Ponyfohlen|Pferdebaby|Pferd|Shetty|Tiervideos|Lustige videos|Baby|Kinder","64916","2459","0","74","https://i.ytimg.com/vi/-dPllbFcK0I/default.jpg","False","False","Für meine Fohlen gab es dieses Jahr eine BABYPARTY😍🎉 Mit dabei die liebe Micha (bavarian.mammuts) & Patrick (patrickheckl) & Josef (tschossl) & @HellaGabbert & @LeaJellWorkingEquitation & Tom Stein🙂Es war ein toller Tag mit spannenden Challenges🥰🎉Auf Hella& Toms Kanal findet ihr das Video mit den Vorbereitungen:https://youtu.be/cXhwPzhyObo💕 zu meinem online Shop:https://libertyhorses.de/shop/💕 Online Seminare zur Freiarbeit & Tricktraininghttps://libertyhorses.de/online-seminare/"
"g5-VtyLYb2Y","【#holoAdvent】BREACH【hololive English】","2023-07-24T03:00:30Z","UCotXwY6s8pWmuWd_snKYjhg","hololive English","24","23.28.07","[none]","630179","49553","0","3088","https://i.ytimg.com/vi/g5-VtyLYb2Y/default.jpg","False","False","July 25th, 8 PM PDT | 12 PM JST (+1 Day)▶Request from hololive production to underage viewers:Please be sure to check the link below before viewing our content.https://en.hololive.tv/request-to-minors"
"fC5MKJDW6sc","GEAR5 (fifth) This is my PEAK! -ANIME DATE REVEALED TEASER REEL","2023-07-22T02:09:38Z","UCdAHaWcKdpbT5XkN2Er6BUQ","ONE PIECE公式YouTubeチャンネル","1","23.28.07","[none]","9178032","370778","0","21991","https://i.ytimg.com/vi/fC5MKJDW6sc/default.jpg","False","False","In Japan...6th Aug. !!Luffy will get to his PEAK in ANIME chap.1071.Epic MANGA ONE PIECE's chap.1044 is going to be finally delivered as ANIME!! chap. 1071「Luffy’s Peak – Attained! GEAR5」Director: 長峯達也 Tatsuya NagamineAnimation Director: 松田翠 Midori Matsuda, 斉藤圭太 Keita Saito#ONEPIECE #LUFFY #GEAR5"
"qyuYHfNBw0A","SIDEMEN FORFEIT WHEEL OF FORTUNE","2023-07-23T18:01:23Z","UCDogdKl7t7NHzQ95aEwkdMw","Sidemen","24","23.28.07","sidemen|sidemen sunday|#sidemensunday","6158271","320794","0","14802","https://i.ytimg.com/vi/qyuYHfNBw0A/default.jpg","False","False","🍗: Order food NOW at: https://www.eatsides.com/🎥: Access exclusive content at: https://www.sideplus.com/🍹: XIX Vodka: https://www.xixvodka.com/👉🏻: Subscribe to our Reacts Channel: https://www.youtube.com/SidemenReacts 👈🏻👕: Sidemen Clothing: http://www.sidemenclothing.com👉🏻 Subscribe to our 2nd Channel: https://www.youtube.com/MoreSidemen 👈🏻📸: Sidemen Instagram: http://www.instagram.com/Sidemen🐤: Sidemen Twitter: http://www.twitter.com/Sidemen✏️: SUBMIT A #SidemenSunday IDEA HEREhttps://forms.gle/JDuGrSzM4F6mdo6D9-----------------------------------------------------------------------------------------------------------------------▶️ SIDEMEN ◀️🔵 JOSH (Zerkaa)● http://www.youtube.com/Zerkaa● http://www.youtube.com/ZerkaaPlays● http://www.instagram.com/Zerkaa● http://www.twitter.com/ZerkaaHD🔴 HARRY (W2S)● http://www.youtube.com/W2S● http://www.youtube.com/W2SPlays● http://www.instagram.com/Wroetoshaw● http://www.twitter.com/Wroetoshaw🔵 VIK (Vikkstar123)● http://www.youtube.com/Vikkstar123● http://www.youtube.com/Vikkstar123HD● http://www.youtube.com/VikkstarPlays● http://www.instagram.com/Vikkstagram● http://www.twitter.com/Vikkstar123🔴 JJ (KSI)● http://www.youtube.com/KSI● http://www.youtube.com/KSIOlajidebtHD● http://www.instagram.com/KSI● http://www.twitter.com/KSIOlajidebt🔵 TOBI (Tobjizzle)● http://www.youtube.com/TBJZL● http://www.youtube.com/Editingaming● http://www.instagram.com/Tobjizzle● http://www.twitter.com/Tobjizzle🔴 ETHAN (Behzinga)● http://www.youtube.com/Behzinga● http://www.youtube.com/Beh2inga● http://www.instagram.com/Behzingagram● http://www.twitter.com/Behzinga🔵 SIMON (Miniminter)● http://www.youtube.com/Miniminter● http://www.youtube.com/MM7Games● http://www.instagram.com/Miniminter● http://www.twitter.com/Miniminter"
"nrhcrcyBOHA","😍🍦 How to: Eis aus dem Thermomix® | Thermomix® Rezept","2023-07-23T15:00:38Z","UCVbHgm94gDxopIG5iBeYsLw","mein ZauberTopf","26","23.28.07","thermomix|rezepte für den thermomix|tm5|tm6|thermomix hacks|rezepte für tm5|rezepte für tm6|einfach thermomix|kochen mit thermomix|rezept thermomix|thermomix all in one|thermomix rezepte|kochen mit dem thermomix|backen mit dem thermomix|thermomix tm5|thermomix tm6|thermomix rezepte deutsch|Thermomix Eis|Slush Eis Thermomix|Nicecream Thermomix|Vanilleeis Thermomix|Thermomix Sorbet|thermomix softeis|thermomix eis|thermomix eis machen|softeis rezept","80295","976","0","79","https://i.ytimg.com/vi/nrhcrcyBOHA/default.jpg","False","False","Tauche ein in die Eiswelt des Thermomix® und erlebe die leckersten Eiskreationen wie Softeis ohne Ei, erfrischende Sorbets und fruchtige Nicecream. 🌟🍨Unsere Thermomix® Expertin Desi zeigt dir, wie du mit nur wenigen Zutaten köstliche Eisvariationen herstellen kannst. Außerdem verrät sie dir, wie du das fluffigste Softeis in kürzester Zeit herstellt. 😍 💫🍨Softeis ohne Ei🥣 Zutaten: 150 g TK Beeren200 g Milch30 g Proteinpulver 1️⃣ 150 g Beeren (TK) 10 Sek. | Stufe 8 pürieren, mit dem Spatel nach unten schieben.  2️⃣Rühraufsatz einsetzen. 200 g Milch und 30 g Proteinpulver (Alternativ Aquafaba)zugeben und 4 Min. | Stufe 4 luftig schlagen."
"iFhOT5hbgbU","Jala Brat & Buba Corelli & Hava - Dale (Official Music Video)","2023-07-22T10:00:07Z","UCaWaxupwQ7Pssm94Xcxi8LA","IMPERIA","10","23.28.07","[none]","1365788","18320","0","560","https://i.ytimg.com/vi/iFhOT5hbgbU/default.jpg","False","False","📀 Distributed by: http://emdcmusic.com✔ Social Media:https://emdc.yt/imperiahttps://emdc.yt/jalabrathttps://emdc.yt/bubacorelli✔ Stream & Download: https://emdc.yt/goodfellasMuzika: Jala Brat, Buba CorelliTekst: Jala Brat, Buba Corelli, HavaAranzman: Marko Dragic Pablo, RimDaMix & Master: Amar Karahasanovic, Tedi LazarevicVideo: New Era Digitalhttps://emdc.yt/newera© IMPERIA by EMDC NetworkDistributed by: EMDC ®⏩ EMDC Network: http://emdcnetwork.com      (YouTube MCN, Digitalni marketing i all-round usluge)🔊 EMDC Music: http://emdcmusic.com      (Platforma za distribuciju muzike)🎶 EMDC Publishing: http://emdcpublishing.com      (Licence za covere i zastupanje autorskih prava)📷 Instagram: https://instagram.com/emdc_network"
"B9TB0pbfZAE","Match Highlights | Finals | India 'A' vs Pakistan 'A' | ACC Men's Emerging Teams Asia Cup","2023-07-23T18:09:06Z","UC7ITT3ooYWDYY_ehIUbt6eg","Asian Cricket Council","17","23.28.07","[none]","4503314","74037","0","8232","https://i.ytimg.com/vi/B9TB0pbfZAE/default.jpg","False","False","#ACCMensEmergingTeamsAsiaCup Match Highlights | Finals | India 'A' vs Pakistan 'A'"
"cwJe3loovxk","United Win In Front Of RECORD Crowd ❤️‍🔥 | Man Utd 2-0 Arsenal | 2023/24 Pre-Season","2023-07-23T00:22:00Z","UC6yW44UGJJBvYTlfC7CRg2Q","Manchester United","17","23.28.07","manchester united|mufc|man utd|manutd|mu|ggmu|old trafford|goals|highlights|raphael varane|jadon sancho|cristiano ronaldo|ronaldo|ronaldo goals|david de gea|de gea|maguire|shaw|fred|mctominay|man utd goals|Elanga|Rashford|Marcus Rashford|Bruno|Bruno Fernandes|Lindelof|Erik ten Hag|Ten Hag|Martinez|Malacia|Eriksen|Casemiro|Antony|MU Highlights","7830981","129118","0","2925","https://i.ytimg.com/vi/cwJe3loovxk/default.jpg","False","False","Bruno Fernandes and Jadon Sancho found the back of the net to make it three wins from three in front of a whopping 82,262 fans at the MetLife stadium! 🔥▶️ Subscribe to Manchester United on YouTube at http://bit.ly/ManU_YT📲 Download the Man Utd app: http://manutd.co/F4c💻 Visit Manchester United: http://www.manutd.com🛒 Shop your favourite United attire: https://bit.ly/3s9uTW7#MUFC"
"26TeG-Q8XQ0","Testspiel LIVE | FC Schalke 04 - FC Twente","2023-07-22T13:26:40Z","UCEa_Oh2Ut2G05AGue5QNUzA","FC Schalke 04","17","23.28.07","[none]","193270","4009","0","62","https://i.ytimg.com/vi/26TeG-Q8XQ0/default.jpg","False","False","Generalprobe in der VELTINS-Arena! Am Samstag (22.7.) um 13.30 Uhr testet das Team von Chef-Trainer gegen den FC Twente. Die letzte Begegnung kurz vor dem Saisonstart wird präsentiert von GGM Gastro, dem königsblauen Partner aus Ochtrup. Schalke TV überträgt live in voller Länge.► Abonnieren/Subscribe: https://s04.de/YoutubeAboShop: https://shop.schalke04.deWebsite: https://schalke04.deFacebook: https://s04.de/facebookTwitter: https://s04.de/twitterInstagram: https://s04.de/instagramGiphy: https://s04.de/giphy"
"UOMNw9QOGa8","® SASA KOVACEVIC - Greska (official video) NOVO! © 2023","2023-07-22T16:00:09Z","UCBbqfQ8vwyAD2vGhuFyUgxg","Sasa Kovacevic .TV","24","23.28.07","sasa kovacevic|sasha kovacevic|cаша kовачевић|sashakovacevictv|cаша kовачевиќ|novo|new|song|video|spot|music|film|singl|pesma|hit|hd|like|album|official|premijera|sk media|sk|artist|pop|live|concert|recording|metamorphosis|ekskluzivno","1499455","17770","0","518","https://i.ytimg.com/vi/UOMNw9QOGa8/default.jpg","False","False","Instagram: https://goo.gl/v4n8rsFacebook:  https://goo.gl/epgTFgTik Tok:       https://cutt.ly/uZtObzTTwitter:       https://goo.gl/ahJhTkYoutube:     https://goo.gl/fJvuZRSasa Kovacevic - Greska © 2023 Novo!Music: Rade & Sasa KovacevicLyrics: Milan MileticInstrumental: Leonidas Tzitzos, Rade & Sasa KovacevicMix: Yannis Kyfonidis Aditional Production: Xasqui Ten, Ten Productions, BarcelonaMastering: Yannis Kyfonidis @BK studios AthensVideo Production: SK MediaDirector: Martin MakarievDoP: Andrei AndreevScreenplay: Martin MakarievEdititing: Stevan Maric / FreecuttersColor Grading: Nikola Marinkovic, Radoslav UkalskiProducer: Emin  Guliyev 1 AD: İlkin Hamidli 2nd AD: Hasrat Ramazanov Production manager: Ulviyya Mammadova Production manager: Elnur Bayramov Production designer: Zaur Abdullayev Props master: Fati Popova Costume design:  Niko, Lala Rustamova, Olqa ŞabanovaMake up artist: Qrimyor Ilkane Gaffer: Samsor Mangal Focuspuller: Vüsal Süleymanov Production company: FilmLab (Isa Melikov)CGI: Slavko Gavric, Bojan BenakModel: Sofija JekicActor: Vusal HacikadirSpecial Thanx:Niko StylistAca ZdravkovicKinghtsbridge ResidenceLocation: Baku, AzerbaijanLyrics:GRESKAStrofa 1:Nežno ko ubica anđeoskog lica I đavolskih nameraPrvo si me zavelaA sad se praviš naivnaDok mi prsti klize Ti mi usne grizešOvo s nama greška je Govoriš a sutra opet zvaćeš meOboje znamo toDa već je prekasnoRefren:Da si greška greška si Al neka neka neka siNe bi ti ovde sa mnom bila Da kraj njega srećna siZato neka neka te Neka taksi čeka teOd mene niko noćas bolje Ne zna teStrofa 2:Kao zver u mrakuUpadam u zamkuNe znam sta se desavaProganjas me danimaA sad se pravis naivnaOboje znamo toDa već je prekasnoRefren:Da si greška greška si Al neka neka neka siNe bi ti ovde sa mnom bila Da kraj njega srećna siZato neka neka te Neka taksi čeka teOd mene niko noćas bolje Ne zna teBuy It On:iTunes: coming soon...Google Play: coming soon...Amazon: coming soon...Listen: Deezer: coming soon...Spotify: https://shorturl.at/fqBEFSoundcloud: coming soon...Booking manager:studiokovacevic@yahoo.comPublishing & copyright - SK Media © 2023 / All rights reserved"
"WA9Q-3qD9mw","Deutsche über Tempolimit.","2023-07-23T08:00:12Z","UCw81xLtFkpks4D8_hYUP9VA","Varion","23","23.28.07","varion|fun|happy|lustig|verarsche|prank|usa|amerika|austausch|exchange|scetch|comedy|one|man|ein|mann|Deutsche über|Deutsche|über|Günther|Jürgen|Werner|Tempo|Tempolimit|Km/h|Autobahn|Bahn|Handwerker|Unterhaltung|Gespräch|Entertainment|Varion|Flovarion|Sketch|Comedy|Comedy Sketch|Komik|Funny|Lustig|Auto|Wagen|fahren","180024","13998","0","582","https://i.ytimg.com/vi/WA9Q-3qD9mw/default.jpg","False","False","Heute unterhalten sich die 3 Freunde über das Tempolimit auf der Autobahn.Was sie davon halten und ob sie dafür oder dagegen sind, seht ihr wohl nur im Sketch.Viel Spaß!▪ Podcast Offline + Ehrlich - https://spoti.fi/3ocRJLn ᵂ ᴱ ᴿ ᴮ ᵁ ᴺ ᴳ▪ Varion Klamotten (Merch) - https://varion.shop ᵂ ᴱ ᴿ ᴮ ᵁ ᴺ ᴳKANÄLE:▪ Reingeschifft (Stream Content) - https://bit.ly/2QfXOIz▪ Varionhalla (Brawlhalla Content)  - hhttps://bit.ly/3Nx6hit▪ Varion (Sketch Content) - http://bit.ly/1EVWIUm▪ flovarion (Shorts Content)  - https://bit.ly/2R2UGwcSOCIAL MEDIA:▪ Twitter - https://twitter.com/varion▪ Instagram - https://www.instagram.com/varion/▪ Twitch - https://www.twitch.tv/varion▪ TikTok - https://www.tiktok.com/@varion▪ Facebook - https://www.facebook.com/flovarionMUSIK▪ Outro Song - [No Copyright Music] Retro 80s Funky Jazz-Hop Instrumental (Copyright Free) Music - Sundance Remix"
