video_id,title,publishedAt,channelId,channelTitle,categoryId,trending_date,tags,view_count,likes,dislikes,comment_count,thumbnail_link,comments_disabled,ratings_disabled,description
"mj7WJc4OAZY","The MASSIVE $72,884.52 Update to my Dream House.","2023-07-18T18:00:21Z","UC21Kozr_K0yDM-VjoihG9Aw","TheStradman","2","23.22.07","[none]","978531","55614","0","5215","https://i.ytimg.com/vi/mj7WJc4OAZY/default.jpg","False","False","Save 20% on your SimpliSafe system and your first month is free when you sign up for Fast Protect Monitoring.  Visit https://SimpliSafe.com/Stradman to customize yours!  Try SimpliSafe risk-free.  If you don't love it, return it for a full refund within 60 days."
"_TedFmvfCYo","I Paid a Taxi $10,000 to See How Far it Takes Me!","2023-07-16T19:24:04Z","UCvK4bOhULCpmLabd2pDMtnA","Yes Theory","24","23.22.07","yestheory|seek discomfort|yes theory strangers|yes theory travel|yes theory subscribers|getting out of your comfort zone|Amazon FBA","3034464","185176","0","14270","https://i.ytimg.com/vi/_TedFmvfCYo/default.jpg","False","False","Wildest adventure of the year HANDS DOWN!🧊 Watch the film here: https://www.theicemanfilm.com/ Use code YESTHEORY at checkout for 50% OFF only until July 24th!If you want to watch the film but don't have a credit card and want to use PayPal, you can do so here: https://www.seekdiscomfort.com/products/project-iceman-film-viewing-experience⚡️ This video was made possible through your support of Seek Discomfort. If you want to rep it on your day-to-day, check out the link below: SEEK DISCOMFORT: http://seek-discomfort.com/yes-theoryFollow Reg on Instagram or TikTok: https://www.instagram.com/kingregcab/Check out our cinematographers' work ​⁠​⁠@TylerPalmerFilmmaker @bbacalhau  @louibabaAnd thank you for following along!/ Thomas, Ammar, Staffan & the whole Yes Team"
"tXKWrfqgfGI","We Steal a Grimace Shake and Everything Goes Wrong in People Playground!","2023-07-17T14:15:03Z","UCPhckk25N7P8OI580ucRidA","Ctop","20","23.22.07","ctop|gaming|funny moments|people playground|people playground game|people playground gameplay|physics game|ragdoll game|titan|titans|attack on titan|people playground mods|people playground ragdolls|ragdoll gameplay|grimace shake","568163","8670","0","301","https://i.ytimg.com/vi/tXKWrfqgfGI/default.jpg","False","False","Welcome to People Playground with Ctop and SimplyChris! We are now in the game, let's do some dumb stuff in this physics ragdoll game! Today let's have a nice Grimace milkshake!Thanks to Slebbey for making Ctop and SimplyChris in People Playground!https://steamcommunity.com/sharedfiles/filedetails/?id=2780987906&searchtext=ctopJoin this channel to get access to perks:https://www.youtube.com/channel/UCPhckk25N7P8OI580ucRidA/join---------------------------------------------------------------------------------------------------------Twitter:  https://twitter.com/CtopGamingInstagram: https://www.instagram.com/ctopVR/Twitch Livestreams: https://www.twitch.tv/ctoptwitchDiscord Community: https://discord.gg/ctopShirts: https://teespring.com/stores/ctops-store---------------------------------------------------------------------------------------------------------"
"OYfswIXw-xc","weird dreams","2023-07-16T16:00:13Z","UCXMwCQVey4PhdWFJ6WhAVhA","SockStudios","23","23.22.07","weird dreams|dreams|lucid dreams|weird dream|dream|meaning of dreams|weird|how do dreams work|are you having weird dreams|facts about dreams|my dreams|dream interpretation|werid dreams stories|stress dreams|why do we dream|dream symbols|scary|bad dreams|scary dream|scary story|scary videos|scary stories|scary dreams shorts|scary video|dream meanings|scary dreaming|scariest dreams|cartoon|animation|funny cartoon|cartoon network|cartoons|funny","1567994","40740","0","5346","https://i.ytimg.com/vi/OYfswIXw-xc/default.jpg","False","False","today we tell about our weird dreams animations subscribe!! (or else...)Twitter  → https://bit.ly/2MrebAuReddit → https://bit.ly/3apoz3CDiscord  → https://bit.ly/3aoc08UInsta  →  https://bit.ly/2MRg4WPfriends in video @Joocie  @FatMemeGod  @allyvt  @BlazaPlays  @Nadweyt  @TbhHonest @MuffinJuice amazing teamITEL https://twitter.com/itelldrawsCOOL https://twitter.com/coolnaisuscary dreams,dream cartoon,horror dreams,dream animation,lucid dream,bear cartoon,my scary dreams,cartoony,good dream,i animated our weirdest dreams,sleep cartoon,stupid dreams,haunted dreams,animation,dreams,weird dreams,funny,lucid dreams,dream animation,dream,funny animations,weird dream,2d animation,dream animatic,scary dreams,weird,animation meme,storytime animation,flash animation,animations"
"tP1nt5wv3Uk","An NFL Player Lined Up & Wanted Smoke For $10,000! (Tampa 1on1’s)","2023-07-16T17:33:55Z","UC4mLlRa_dezwvytudo9s1sw","Deestroying","24","23.22.07","Deestroying|Donald De La Haye|Virginia|1 on 1's|1 on 1|Football|Football TikToks|1 handed catch","1032400","28732","0","1545","https://i.ytimg.com/vi/tP1nt5wv3Uk/default.jpg","False","False","We pulled up to Tampa, FL to run 1's and the competition was insane! An NFL Player even wanted smoke!Thank you to Prize Picks for sponsoring this video! Sign Up For PrizePicks: https://prizepicks.onelink.me/ivHR/DEESTROYINGWINNER IG : _6ixreasonsGET YOUR ELEVEN GEAR HERE : https://theeleven.storeSUBSCRIBE TO MY 2ND CHANNEL :https://www.youtube.com/@moredeestroying692Business Inquires: deestroyingbusiness@gmail.comFOLLOW ME ONTwitter : https://www.twitter.com/deestroyingIG : https://www.instagram.com/deestroyingFilmed and Edited By :https://www.instagram.com/filmedbydavid/https://www.instagram.com/itsdanny.t/"
"BtBRs-eucVo","A Personal Update","2023-07-17T17:00:16Z","UCS5Oz6CHmeoF7vSad0qqXfw","DanTDM","22","23.22.07","dantdm|dan tdm|gaming|video games|minecraft|funny|roblox","1353528","127038","0","12818","https://i.ytimg.com/vi/BtBRs-eucVo/default.jpg","False","False","tw: depressionIf you need it:UK - https://www.samaritans.org/US - https://988lifeline.org/Australia - https://www.lifeline.org.au/World - https://faq.whatsapp.com/1417269125743673/?helpref=uf_shareLive Channel: @DanTDMLive Retirement Video: https://youtu.be/vXWQ6Gdz0GoTwitter: http://www.twitter.com/DanTDMInstagram: http://www.instagram.com/DanTDMContent:00:00 DanTDM is 11 years old01:23 9 videos & YouTube Shorts03:20 How My Day Goes03:55 Brain Update08:06 The Future"
"YZraLPTMgoA","ALL ACCESS: Spence vs. Crawford | Ep 2 | Full Episode | SHOWTIME PPV","2023-07-16T13:00:21Z","UCFPoJNd0d4k1H9A6UOlikcg","SHOWTIME Sports","17","23.22.07","showtime|shosports|sports|showtime ppv|Showtime boxing|boxing 2023 latest fight|boxing news|Errol Spence Jr|Terence Crawford|Spence|spence vs crawford|crawford vs spence jr|errol spence calls out crawford|errol spence jr vs terence crawford|errol spence jr highlights|terence crawford vs errol spence jr|terence crawford highlights|boxing big fights|Spence Crawford Press Conference|All Access|all access spence vs crawford|All access|all access full episodes","1512943","30969","0","4082","https://i.ytimg.com/vi/YZraLPTMgoA/default.jpg","False","False","The Emmy® winning series takes viewers beyond the ring with unprecedented access as undefeated superstars Errol Spence Jr. and Terence Crawford prepare for a matchup that will go down in history as one of the most significant fights of all time. #spencecrawford is Saturday, July 29th on SHOWTIME PPV.#spencecrawford  #boxing #shosports #showtimechampionshipboxing #errolspencejr #terencecrawfordDon't miss out on the action! Visit the below links to sign up for reminders!Championship Boxing: https://s.sho.com/3oiG6REBellator: https://s.sho.com/3eSmXDbSubscribe to the SHOWTIME Sports YouTube channel: https://goo.gl/s8CWVTFollow SHOWTIME Sports:Facebook: https://www.facebook.com/ShoSports/Twitter: https://twitter.com/SHOsportsInstagram: https://instagram.com/shosportsOfficial Site: https://www.sho.com/sportsFollow SHOWTIME Boxing:Facebook: https://www.facebook.com/ShoBoxingTwitter: https://twitter.com/ShowtimeBoxingInstagram: https://instagram.com/showtimeboxingSnapchat: https://www.snapchat.com/add/showtimeboxingTumblr: http://showtimeboxing.tumblr.com/Follow SHOWTIME Basketball:Instagram: https://www.instagram.com/showtimebasketballTwitter: https://twitter.com/shobasketballFollow ALL THE SMOKE:Instagram: https://www.instagram.com/allthesmoke/YouTube: https://bit.ly/2OLkr50 Follow BELOW THE BELT with Brendan Schaub:Facebook: https://www.facebook.com/BelowTheBeltSHOTwitter: https://twitter.com/btbshowtimeInstagram: https://www.instagram.com/belowthebelt/YouTube: http://s.sho.com/BelowtheBeltFollow MORNING KOMBAT:Instagram: https://www.instagram.com/morningkombat/YouTube: https://bit.ly/2lPpvsjFollow INSIDE THE NFL:Facebook: https://www.facebook.com/insidetheNFLTwitter: https://twitter.com/insidetheNFLInstagram: https://www.instagram.com/insidetheNFL/Follow 4th and Forever:Instagram: https://www.instagram.com/4thandforever/YouTube: http://bit.ly/30iZqSZFollow SHOWTIME:Facebook: https://www.facebook.com/showtimeTwitter: https://twitter.com/ShowtimeInstagram: https://instagram.com/showtime/Youtube: https://www.youtube.com/user/SHOWTIMEOfficial Site: https://www.sho.com/"
"ONWzzPmiNQY","I paid nearly $6000 for this Unit at the Auction, Sight Unseen, Will it run??","2023-07-17T12:43:41Z","UCBB0oz7Yo_35gnbPYGKGJTA","Diesel Creek","2","23.22.07","caterpillar|c13|c-13|acert|electronic|hydro demo|cat|c15|c-15","632181","63136","0","2261","https://i.ytimg.com/vi/ONWzzPmiNQY/default.jpg","False","False","For inquires: DieselCreek@gmail.com Check our Sams Channel. @ScrappyIndustries Grab Yourself a Hat and a Shirt from the Merch Store! https://DieselCreek.com/ Like something you see in a video? good chance its linked in my Amazon Store: https://www.amazon.com/shop/dieselcreekFollow me on Instagram & Facebook @dieselcreek #DieselCreekCustom Music made for me by Vinnie Longhi of the Semi-Supervillains Check them out here:  http://www.youtube.com/tssvillainsWanna send me something? Sent it to:Diesel Creek P.O. Box 109 Burgettstown PA 15021-0109"
"MAMC6iyibKg","You Laugh, You Go On A Billboard","2023-07-17T01:32:05Z","UCKt6UNcaVIS258z9Gujeirw","Crispy Concords","24","23.22.07","you laugh you lose|ylyl|if i laugh|the video ends|go on billboard|funny|memes|meme|react|reaction|reacting|new|viral|tik toks|discord|jimmyhere|jimmy here|crispy|crispy concords","641816","48855","0","1618","https://i.ytimg.com/vi/MAMC6iyibKg/default.jpg","False","False","you laugh you go on a billboard...MY YOUTOOZ IS OUT NOW!! - http://crispy.youtooz.com/you laugh you lose taken to a new level with the king himself, Jimmy Here. The first to laugh 3 times goes up on a billboard designed by the other person. Truly the most extreme YLYL i've done yet lolSub to Jimmy!! - @JimmyHereOfficial Join my Discord! - http://discord.gg/crispyMy Links:Twitter: http://twitter.com/CrispyInstagram: http://instagram.com/CrispySnapchat: CrispyConcords"
"JG4b0cBqVg4","Crayon 301 from New Hampshire | Extended Highlights | NASCAR Cup Series","2023-07-17T19:31:51Z","UCuN9hYw2RpoAW8rZ3VK3isA","NASCAR","17","23.22.07","nascar|nascar cup series|extended highlights|nascar on nbc|nascar on usa|nbc sports|New Hampshire motor speedway|crayon 301|Martin Truex Jr.|Kyle larson|Christopher bell|Kyle busch|Aric almirola|monday race|rain delay|nascar highlights|Crayon 301 from New Hampshire | Extended Highlights | NASCAR Cup Series|Crayon 301 from New Hampshire|Ross Chastain|New Hampshire extended highlights|lobster|burnout","193953","2215","0","179","https://i.ytimg.com/vi/JG4b0cBqVg4/default.jpg","False","False","Relive the 2023 NASCAR Cup Series Crayon 301 from New Hampshire Motor Speedway that saw Kyle Larson, Joey Logano, Chrisopher Bell and Martin Truex Jr. battle all race for a win in New England. #nascar #newhampshire #kylelarson #martintruexjr #joeylogano #dennyhamlin #christopherbell ----------Subscribe to NASCAR on YouTube: https://nas.cr/youtubeVisit NASCAR.com for the latest news: https://nas.cr/nascarCheckout NASCAR's Discord discord.gg/nascarFor more race day in-car cameras check out NASCAR Drive - https://www.nascar.com/driveShop for your favorite NASCAR gear, diecasts and more: https://nas.cr/storeDownload the NASCAR Mobile App: https://nas.cr/mobileWeekend schedule for on-track action: https://nas.cr/weekend----------Play every weekend!----------NASCAR Fantasy Live: https://nas.cr/fantasy----------NASCAR on Social Media----------Twitter: https://twitter.com/nascarFacebook: https://www.facebook.com/NASCAR/Instagram: https://www.instagram.com/nascar/Snapchat: https://nas.cr/SnapchatAddTikTok: https://nas.cr/TikTokGIPHY: https://giphy.com/nascar00:00:00 - Green flag at New Hampshire Motor Speedway00:00:50 - Martin Truex Jr. takes the lead 00:01:16 - AJ Allmendinger Spins in Stage 100:02:14 - Replay of Kyle Busch and Corey LaJoie wrecking at New Hampshire 00:02:36 - Green flag flies in Stage 2 at New Hampshire 00:03:30 - William Byron makes contact with Justin Haley when leaving pit road in Stage 200:03:52 - Erik Jones spins in Stage 200:04:27 - Late Stage 2 restart: Aric Almirola wrecks due to a loose wheel00:06:31 - Martin Truex Jr. wins Stage 2 at New Hampshire 00:07:02 - Noah Gragson wrecks late in Stage 300:09:26 - Ryan Blaney late-pit stop issues 00:09:40 - Late-race yellow, Alex Bowman goes for a slide00:10:29 - Late restart 16 laps to go00:11:08 - Christopher Bell brings out the yellow flag late00:11:53 - Final Restart, 9 laps to go at New Hampshire 00:12:22 - Martin Truex Jr. wins at New Hampshire"
"b1_RKu-ESCY","Jason Aldean - Try That In A Small Town (Official Music Video)","2023-07-14T13:00:08Z","UCw0F_Xuz0VqemtMAtEfHTdA","Jason Aldean","10","23.22.07","Jason Aldene|Jason Aldeaon|Jason Aldine|Jason Alldean|tough crowd|jason aldean tough crowd|tough crowd jason aldean|new jason aldean songs|acm awards|acm awards 2023|jason aldean acm awards|jelly roll acm awards|jelly roll lainey wilson|jason aldean dirt road anthem|jason aldean heaven|acm performance|acm awards 2023 full show|try that in a small town|jason aldean try that|jason aldean try that in a small town|try that in a small town jason aldean","12598411","729467","0","104552","https://i.ytimg.com/vi/b1_RKu-ESCY/default.jpg","False","False","The official audio video for Try That In A Small Town. Listen here ►https://jasonaldean.lnk.to/TryThatInASmallTownIDGet tickets to Jason Aldean's Highway Desperado Tour 2023: https://www.jasonaldean.com/tour/►Subscribe to Jason's YouTube Channel: https://jasonaldean.lnk.to/ytchnlsubscribe►Shop Merch: https://store.jasonaldean.com►Join the Mailing List: https://jasonaldean.lnk.to/signup►Follow Jason Aldean:    Website/Tour Dates/Aldean Army: http://www.jasonaldean.com Facebook: https://www.facebook.com/jasonaldean Instagram: http://instagram.com/jasonaldean Twitter: https://twitter.com/jason_aldeanTikTok: https://www.tiktok.com/@jasonaldeanmusicLYRICS:SUCKER PUNCH SOMEBODY ON A SIDEWALKCAR JACK AN OLD LADY AT A RED LIGHTPULL A GUN ON THE OWNER OF A LIQUOR STOREYA THINK IT’S COOL WELL ACT A FOOL IF YA LIKECUSS OUT A COP SPIT IN HIS FACESTOMP ON THE FLAG AND LIGHT IT UPYEAH YA THINK YOU’RE TOUGHWELL TRY THAT IN A SMALL TOWNSEE HOW FAR YA MAKE IT DOWN THE ROAD‘ROUND HERE WE TAKE CARE OF OUR OWNYOU CROSS THAT LINE IT WON’T TAKE LONGFOR YOU TO FIND OUTI RECOMMEND YOU DON’TTRY THAT IN A SMALL TOWNGOT A GUN THAT MY GRANDDAD GAVE METHEY SAY ONE DAY THEY’RE GONNA ROUND UPWELL THAT SHIT MIGHT FLY IN THE CITY GOOD LUCKTRY THAT IN A SMALL TOWNSEE HOW FAR YOU MAKE IT DOWN THE ROAD‘ROUND HERE WE TAKE CARE OF OUR OWNYOU CROSS THAT LINE IT WON’T TAKE LONGFOR YOU TO FIND OUTI RECOMMEND YOU DON’TTRY THAT IN A SMALL TOWNFULL OF GOOD OL BOYS, RAISED UP RIGHTIF YOU’RE LOOKING FOR A FIGHT TRY THAT IN A SMALL TOWNTRY THAT IN A SMALL TOWNTRY THAT IN A SMALL TOWNSEE HOW FAR YOU MAKE IT DOWN THE ROAD‘ROUND HERE WE TAKE CARE OF OUR OWNYOU CROSS THAT LINE IT WON’T TAKE LONGFOR YOU TO FIND OUTI RECOMMEND YOU DON’TTRY THAT IN A SMALL TOWNTRY THAT IN A SMALL TOWNTRY THAT IN A SMALL TOWN#JasonAldean #TryThatInASmallTown"
"TQoqmUs9NoY","Margot Robbie Pokes Fun At Ryan Gosling's Barbie Dance Moves: 'That Was Very Boy Band' | Cosmo UK","2023-07-17T15:30:14Z","UC_zayf7JlPBt8n-0WMcdBjg","Cosmopolitan UK","24","23.22.07","cosmopolitan|cosmopolitan uk|cosmo uk|cosmo|female lifestyle|celeb interviews|celebrity interviews","445697","2393","0","248","https://i.ytimg.com/vi/TQoqmUs9NoY/default.jpg","False","False","Hi Barbie! Ahead of the release of Barbie on 21st July Margot Robbie and Ryan Gosling got Up Close with Cosmopolitan UK. They revealed how they celebrated the end of filming Barbie, their favourite looks from the movie and Ken’s signature dance moves.Barbie is in cinemas from 21st July.Disclaimer: This interview was filmed prior to union strikes.Don't miss out on the latest must-see videos from Cosmo UK ►► http://bit.ly/CosmoSubscribeSUBSCRIBE to Cosmopolitan: https://bit.ly/2UsOjEgBUY NOW with free P+P: https://bit.ly/2y4mCdx// ABOUT COSMO //Cosmopolitan UK is your go-to place for all things beauty, hair, Love Island, fun celebrity interviews and games, drag queen transformations and more! Website: https://www.cosmopolitan.com/uk/Facebook: https://www.facebook.com/cosmopolitanuk/ Instagram: https://www.instagram.com/cosmopolitanukTwitter: https://twitter.com/CosmopolitanUKTik Tok: https://www.tiktok.com/@cosmopolitanuk"
"6UbSy5JRc10","Something About Resident Evil 4 REMAKE ANIMATED (Loud Sound Warning) 🧟","2023-07-16T15:10:54Z","UCLFXk9J3O-hhOk0msOjKYdQ","TerminalMontage","20","23.22.07","terminalmontage|terminal|montage|jeremey|jer|chinshue|nintendo|animation|cartoon|animated|something|about|cartoon violence|fighting|action|meme|parody|comedy|funny|loud|screaming","1460823","134658","0","7070","https://i.ytimg.com/vi/6UbSy5JRc10/default.jpg","False","False","The president's daughter has been kidnapped and there's only one man for the job. LEON. S. KENNEDY. **YEEEEEEEEEAAAAAAAAAAA-**http://www.TerminalMontage.comPatreon: https://www.patreon.com/terminalmontageTwitter: https://twitter.com/TerminalMontageFacebook: https://www.facebook.com/TerminalMontage/Instagram: https://www.instagram.com/jeremeyyyyyy/Merch: https://terminalmontagemerchportal.weebly.com/Clips Channel: https://www.youtube.com/TerminalMontageClipsResearch, Writing, Character Concepts, Storyboard, Sound Resources by Lollergatorhttps://twitter.com/lollergatorAnimatic, Animation, Backgrounds, Character Design, Coloring, Lineart, Sound Design, Special Effects, Additional Writing by Jeremey Chinshuehttps://twitter.com/JeremeyChinshueBackgrounds, Additional Foreground Asset Lineart and Additional Special Effects by Edgar Nielsenhttps://twitter.com/funymonyhttps://www.mediamuffin.com/https://www.youtube.com/channel/UCQ7LdY3b1_1eN6G0G_igTbQVoice of Ashley by ColonelCheruhttps://twitter.com/ColonelCheruhttps://www.twitch.tv/colonelcheruVoice of The Merchant by Igor Popovhttps://www.voices.com/profile/igorpopovJapanese Leon Voice by Kozy (Just Global Media)https://www.fiverr.com/kojiasano?source=gig-cards&ref_ctx_id=4d469021-dee2-4787-9a68-c742cebbfce0MUSIC:Resident Evil 2 - Secure Place (Sega Genesis Remix) | PATRON REQUEST By TheLegendOfRenegadehttps://www.youtube.com/watch?v=wZ7qc8_lL4IResident Evil 2 - The Marshalling Yard (The Second Half) (Sega Genesis Remix) By TheLegendOfRenegadehttps://www.youtube.com/watch?v=uurXEZGBs9QMega Man 7 - Shade Man Stage II (Sega Genesis Remix) By TheLegendOfRenegadehttps://www.youtube.com/watch?v=-jOxr-SqXI8Cadillacs and Dinosaurs - Like the Wind (Sega Genesis Remix) By TheLegendOfRenegadehttps://www.youtube.com/watch?v=qhwA3iHdBtcResident Evil - More Rooms (Sega Genesis Remix) | PATRON REQUEST By TheLegendOfRenegadehttps://www.youtube.com/watch?v=MofoQIVr89YMerry Go Round And Round By The Fly Guy Five (Epidemic Sound)https://www.epidemicsound.com/track/52oDNwx7x4/Super Smash Bros Melee - Break The Targets REMIX By MyNewSoundtrackhttps://www.youtube.com/watch?v=-ppOBRERRTQTurrican II - The Final Fight (Sega Genesis Remix) By TheLegendOfRenegadehttps://www.youtube.com/watch?v=eyJPJGKR13MResident Evil 3: Nemesis - Free From Fear (Sega Genesis Remix) By TheLegendOfRenegadehttps://www.youtube.com/watch?v=3OCJgZqlf3cMega Man X4 - SIGMA 1st (Sega Genesis Remix) By TheLegendOfRenegadehttps://www.youtube.com/watch?v=IdqJxI65uzAResident Evil 2 - The Underground Laboratory (Sega Genesis Remix) By TheLegendOfRenegadehttps://www.youtube.com/watch?v=eRwusnFHaXUMega Man Zero 4 - Falling Down (Sega Genesis Remix) By TheLegendOfRenegadehttps://www.youtube.com/watch?v=VjVSPQhhS5MMega Man X3 - Victory/Get A Weapon (Sega Genesis Remix) [2] By TheLegendOfRenegadehttps://www.youtube.com/watch?v=EnQHOyI3HZ8Credits theme; Garden Stage by Jattello https://youtu.be/WSDSCWLkaXE?t=2679For advertising email: Marketing@Frederator.comTERMINALMONTAGE® SOMETHING ABOUT® SOMETHING SERIES®Registered in the U.S. Patent and Trademark Office.© TERMINALMONTAGE LLC. All Rights Reserved. For additional legal information, please see: https://terminalmontageportal.weebly.com/legal-notices-and-disclaimers.html#SomethingSeries #ResidentEvil4 #ResidentEvil #Capcom #Parody #cartoon #animation #gaming"
"kDyH94TRh24","Best Whiteboard Art Wins $10,000!","2023-07-16T14:09:15Z","UCPAk4rqVIwg1NCXh61VJxbg","ZHC Crafts","26","23.22.07","[none]","1546110","45681","0","3835","https://i.ytimg.com/vi/kDyH94TRh24/default.jpg","False","False","We made dry erase marker art on whiteboards! Watch until the end to see who wins!Go get your signed Space Turkey plushie now: https://zhcstore.com/Subscribe To Help Fund ZHC's Expensive Videos  @ZHCYT Follow these!Instagram - https://www.instagram.com/zhcDiscord - https://discord.gg/Fa2fyZXKhrTwitter - https://twitter.com/zhc_ytFacebook - https://www.facebook.com/ZHC"
"agHMTdIgrpM","Highlights: Best of Stephen Curry at American Century Championship | Golf Channel","2023-07-17T00:20:13Z","UC5igJFdBQVqg7hXFI7075OQ","Golf Channel","17","23.22.07","golf|sports|american century championship highlights|2023 american century championship|american century championship 2023|golf channel|american century championship golf|american century championship|golf videos|golf game youtube|golf highlights 2023|golf highlights today|golf highlights|stephen curry golf|stephen curry american century championship|stephen curry golf highlights|steph curry golf highlights 2023|stephen curry|steph curry golf|steph curry","405842","5625","0","691","https://i.ytimg.com/vi/agHMTdIgrpM/default.jpg","False","False","Check out the top moments from Steph Curry’s winning performance at the 2023 American Century Championship. #GolfChannel #AmericanCenturyChampionship #StephenCurry» Subscribe to Golf Channel: https://www.youtube.com/golfchannel?sub_confirmation=1» For the latest news around Golf: https://www.golfchannel.comCo-founded by Arnold Palmer and Joe Gibbs on January 17, 1995, Golf Channel in 2011 became part of the NBC Sports Group and – serving the most-affluent audience in all of television – now is available to nearly 500 million viewers in nearly 80 countries and nine languages around the world. Golf Channel connects the world to golf through a wide array of digital and lifestyle offerings, including Golf Channel Mobile a comprehensive app covering golf’s latest headlines, scores and analysis; GolfNow, the world’s largest online tee time booking platform and golf course technology partner, which includes the GolfNow Mobile App, featuring on-course GPS tracking, in-round scoring and game tracking; Revolution Golf, the largest direct-to-consumer digital platform in golf; GolfAdvisor.com, the world’s largest golf course ratings and review resource for golfers, by golfers; a North American network of Golf Channel Academy instructional facilities; Golf Channel Am Tour, the world’s largest amateur golf tour; and as the Official Media Partner of St. Andrews Links, the Home of Golf.Visit Golf Channel: https://www.golfchannel.comFind Golf Channel on Facebook: https://www.facebook.com/GolfChannel/Follow Golf Channel on Twitter: https://twitter.com/golfchannelFollow Golf Channel on Instagram: https://www.instagram.com/golfchannel/Highlights: Best of Stephen Curry at American Century Championship | Golf Channelhttps://www.youtube.com/golfchannel?sub_confirmation=1"
"AhKLpJmHhIg","THE HOLDOVERS - Official Trailer [HD] - In Select Theaters October 27, Everywhere November 10","2023-07-17T15:00:12Z","UCU4SM3j_9TNWaSu8KdGV50g","Focus Features","24","23.22.07","Focus Features|Alexander Payne|David Hemingson|Paul Giamatti|Da’Vine Joy Randolph|Dominic Sessa|Sideways|The Descendants","5691942","1667","0","156","https://i.ytimg.com/vi/AhKLpJmHhIg/default.jpg","False","False","A new film by Alexander Payne, director of SIDEWAYS and THE DESCENDANTS. Paul Giamatti stars in THE HOLDOVERS, in select theaters October 27, everywhere November 10.From acclaimed director Alexander Payne, THE HOLDOVERS follows a curmudgeonly instructor (Paul Giamatti) at a New England prep school who is forced to remain on campus during Christmas break to babysit the handful of students with nowhere to go.  Eventually he forms an unlikely bond with one of them -- a damaged, brainy troublemaker (newcomer Dominic Sessa) -- and with the school’s head cook, who has just lost a son in Vietnam (Da’Vine Joy Randolph).https://www.focusfeatures.com/the-holdovershttps://twitter.com/HoldoversFilmhttps://www.instagram.com/TheHoldoversFilmhttps://www.facebook.com/TheHoldoversFilmhttps://www.threads.net/@TheHoldoversFilmSubscribe to Focus Features: http://bit.ly/FocusFeaturesYouTubeBecome a Focus Insider: https://insider.focusfeatures.com Website: https://www.focusfeatures.comInstagram: https://www.instagram.com/focusfeaturesFacebook: https://www.facebook.com/focusfeaturesTwitter: https://twitter.com/focusfeatures"
