video_id,title,publishedAt,channelId,channelTitle,categoryId,trending_date,tags,view_count,likes,dislikes,comment_count,thumbnail_link,comments_disabled,ratings_disabled,description
"j2kxyT8UisQ","It's Impossible to Find this Item","2023-07-16T14:00:34Z","UCPLMPHT-d8GZOqL_AHJFdQQ","Parrot","20","23.20.07","Minecraft|Minecraft SMP|SMP|Minecraft Server|LifeSteal SMP|School Minecraft Server|School SMP|School Parrot|Parrot|ParrotX2|Dream SMP|TommyInnit|LifeSteal|parrot lifesteal smp|Spoke|minecraft survival|minecraft hardcore|minecraft challenge|minecraft server|HermitCraft|MumboJumbo|Grian|why i broke 100+ bedrock|Here's Why I Made 12240 Minecraft Cakes|Minecraft Hunt|LifeSteal Season 3|1 Heart Minecraft|LifeSteal Season 4|Why I Removed the World","892772","42722","0","2317","https://i.ytimg.com/vi/j2kxyT8UisQ/default.jpg","False","False","My friend hid 5 items: one in each element. If they are individually brought back to him, you receive a cash prize. If someone miraculously acquires all 5, they receive the Grand Prize. I don't know what the Grand Prize is, but I need it. This is why It's Impossible to Find this Item:Discord: https://discord.gg/VeVDgNgv8VPodcast: @testrunpodcast Like ParrotX2 and his LifeSteal SMP Series where he broke bedrock or blew up 2000 TNT. Not Tubbo / TommyInnit / or any other Dream SMP member. This is a new and original Minecraft idea like HermitCraft or LastLife with Grian and MumboJumbo. Survival is harder than Hardcore Minecraft because PVP is on. A Minecraft video made by Parrot or ParrotX2 on other platforms! Enjoy! Thanks to Slatcho for the help editing: https://linktr.ee/slatcho?utm_source=linktree_admin_shareIf anyone on School SMP is reading this: We did it! High school went by so fast, and although I didn't really enjoy calculating velocity vectors or writing 5 paragraph essays with a works cited, I would never take back a single moment that I had with you all. I've come to realize that friendship is one of the most valuable things in the world, and I can't thank you enough. You all supported me when YouTube was just a dream, and you never changed when that dream became a reality. But, you did so much more. You made me crack up when I was at my lowest points. You pushed me when I didn't feel like moving forward. You were all so true to yourself, and I appreciate you all so much for that. 7 years zipped by, but the memories we made together will stick with me forever. I was gonna submit a speech for graduation, but I'd much rather make a YouTube video XD. I'm gonna miss you guys, but I'll always have your back no matter what. Love ya!"
"JG4b0cBqVg4","Crayon 301 from New Hampshire | Extended Highlights | NASCAR Cup Series","2023-07-17T19:31:51Z","UCuN9hYw2RpoAW8rZ3VK3isA","NASCAR","17","23.20.07","nascar|nascar cup series|extended highlights|nascar on nbc|nascar on usa|nbc sports|New Hampshire motor speedway|crayon 301|Martin Truex Jr.|Kyle larson|Christopher bell|Kyle busch|Aric almirola|monday race|rain delay|nascar highlights|Crayon 301 from New Hampshire | Extended Highlights | NASCAR Cup Series|Crayon 301 from New Hampshire|Ross Chastain|New Hampshire extended highlights|lobster|burnout","177547","2081","0","171","https://i.ytimg.com/vi/JG4b0cBqVg4/default.jpg","False","False","Relive the 2023 NASCAR Cup Series Crayon 301 from New Hampshire Motor Speedway that saw Kyle Larson, Joey Logano, Chrisopher Bell and Martin Truex Jr. battle all race for a win in New England. #nascar #newhampshire #kylelarson #martintruexjr #joeylogano #dennyhamlin #christopherbell ----------Subscribe to NASCAR on YouTube: https://nas.cr/youtubeVisit NASCAR.com for the latest news: https://nas.cr/nascarCheckout NASCAR's Discord discord.gg/nascarFor more race day in-car cameras check out NASCAR Drive - https://www.nascar.com/driveShop for your favorite NASCAR gear, diecasts and more: https://nas.cr/storeDownload the NASCAR Mobile App: https://nas.cr/mobileWeekend schedule for on-track action: https://nas.cr/weekend----------Play every weekend!----------NASCAR Fantasy Live: https://nas.cr/fantasy----------NASCAR on Social Media----------Twitter: https://twitter.com/nascarFacebook: https://www.facebook.com/NASCAR/Instagram: https://www.instagram.com/nascar/Snapchat: https://nas.cr/SnapchatAddTikTok: https://nas.cr/TikTokGIPHY: https://giphy.com/nascar00:00:00 - Green flag at New Hampshire Motor Speedway00:00:50 - Martin Truex Jr. takes the lead 00:01:16 - AJ Allmendinger Spins in Stage 100:02:14 - Replay of Kyle Busch and Corey LaJoie wrecking at New Hampshire 00:02:36 - Green flag flies in Stage 2 at New Hampshire 00:03:30 - William Byron makes contact with Justin Haley when leaving pit road in Stage 200:03:52 - Erik Jones spins in Stage 200:04:27 - Late Stage 2 restart: Aric Almirola wrecks due to a loose wheel00:06:31 - Martin Truex Jr. wins Stage 2 at New Hampshire 00:07:02 - Noah Gragson wrecks late in Stage 300:09:26 - Ryan Blaney late-pit stop issues 00:09:40 - Late-race yellow, Alex Bowman goes for a slide00:10:29 - Late restart 16 laps to go00:11:08 - Christopher Bell brings out the yellow flag late00:11:53 - Final Restart, 9 laps to go at New Hampshire 00:12:22 - Martin Truex Jr. wins at New Hampshire"
"MAMC6iyibKg","You Laugh, You Go On A Billboard","2023-07-17T01:32:05Z","UCKt6UNcaVIS258z9Gujeirw","Crispy Concords","24","23.20.07","you laugh you lose|ylyl|if i laugh|the video ends|go on billboard|funny|memes|meme|react|reaction|reacting|new|viral|tik toks|discord|jimmyhere|jimmy here|crispy|crispy concords","591985","46267","0","1551","https://i.ytimg.com/vi/MAMC6iyibKg/default.jpg","False","False","you laugh you go on a billboard...MY YOUTOOZ IS OUT NOW!! - http://crispy.youtooz.com/you laugh you lose taken to a new level with the king himself, Jimmy Here. The first to laugh 3 times goes up on a billboard designed by the other person. Truly the most extreme YLYL i've done yet lolSub to Jimmy!! - @JimmyHereOfficial Join my Discord! - http://discord.gg/crispyMy Links:Twitter: http://twitter.com/CrispyInstagram: http://instagram.com/CrispySnapchat: CrispyConcords"
"esB0AkFIDeE","Lionel Messi Officially Announced for Inter Miami","2023-07-17T01:13:04Z","UCSZbXT5TLLW_i-5W8FZpFsg","Major League Soccer","17","23.20.07","messi|lionel messi|mls|inter miami","719352","22609","0","1703","https://i.ytimg.com/vi/esB0AkFIDeE/default.jpg","False","False","Lionel Messi has formally joined Inter Miami CF, as the club announced Saturday they’ve signed the seven-time Ballon d’Or winner and FIFA World Cup champion.The Argentine superstar, who will occupy a Designated Player slot, is under contract with Inter Miami through the 2025 Major League Soccer season. #messi #mls #intermiami"
"nBrCXhhBlKs","1st Test - Day 3 | Highlights | Pakistan Tour Of Sri Lanka | 18th July 2023","2023-07-18T14:43:06Z","UCOQNJjhXwvAScuELTT_i7cQ","Sony LIV","24","23.20.07","cricket highlights|sports highlights|test match highlights|cricket highlights on sony liv|cricket|live cricket score|live cricket|cricket score|live cricket match today|cricket matches|live match score|cricket live|sports|test match|pakistan|sri lanka|pak vs sl|sl vs pak|pakistan vs sri lanka 2023|sri lanka vs pakistan|sri lanka cricket|pakistan cricket|Pakistan Tour Of Sri Lanka squad|pakistan tour of sri lanka 2023|pakistan tour of sri lanka schedule","2223551","35410","0","989","https://i.ytimg.com/vi/nBrCXhhBlKs/default.jpg","False","False","Click here to subscribe to Sony LIV Channel: https://www.youtube.com/user/sonyliv Click here to watch all highlights: https://bit.ly/3OVl9LMClick here to watch more: https://www.sonyliv.com/sports/cricket-pakistan-tour-of-sri-lanka-1700001261Click here to subscribe now: https://bit.ly/3Q78rHUPakistan had a brilliant day on the third day of the test match. Saud Shakeel was simply outstanding as the batter scored a double century against Sri Lanka. An unbeaten 208 from 361 deliveries led Pakistan to a massive total of 461 runs. Sri Lankan openers then played 3.4 overs before the end of day 3.Click here to subscribe: https://www.sonyliv.com/subscriptionFind Out: www.sonyliv.com or click on the below links to download the Sony LIV app:Android Play Store: https://play.google.com/store/apps/details?id=com.sonyliv App Store: https://apps.apple.com/in/app/sonyliv-live-cricket-tv-movies/id587794258"
"agHMTdIgrpM","Highlights: Best of Stephen Curry at American Century Championship | Golf Channel","2023-07-17T00:20:13Z","UC5igJFdBQVqg7hXFI7075OQ","Golf Channel","17","23.20.07","golf|sports|american century championship highlights|2023 american century championship|american century championship 2023|golf channel|american century championship golf|american century championship|golf videos|golf game youtube|golf highlights 2023|golf highlights today|golf highlights|stephen curry golf|stephen curry american century championship|stephen curry golf highlights|steph curry golf highlights 2023|stephen curry|steph curry golf|steph curry","325431","4613","0","607","https://i.ytimg.com/vi/agHMTdIgrpM/default.jpg","False","False","Check out the top moments from Steph Curry’s winning performance at the 2023 American Century Championship. #GolfChannel #AmericanCenturyChampionship #StephenCurry» Subscribe to Golf Channel: https://www.youtube.com/golfchannel?sub_confirmation=1» For the latest news around Golf: https://www.golfchannel.comCo-founded by Arnold Palmer and Joe Gibbs on January 17, 1995, Golf Channel in 2011 became part of the NBC Sports Group and – serving the most-affluent audience in all of television – now is available to nearly 500 million viewers in nearly 80 countries and nine languages around the world. Golf Channel connects the world to golf through a wide array of digital and lifestyle offerings, including Golf Channel Mobile a comprehensive app covering golf’s latest headlines, scores and analysis; GolfNow, the world’s largest online tee time booking platform and golf course technology partner, which includes the GolfNow Mobile App, featuring on-course GPS tracking, in-round scoring and game tracking; Revolution Golf, the largest direct-to-consumer digital platform in golf; GolfAdvisor.com, the world’s largest golf course ratings and review resource for golfers, by golfers; a North American network of Golf Channel Academy instructional facilities; Golf Channel Am Tour, the world’s largest amateur golf tour; and as the Official Media Partner of St. Andrews Links, the Home of Golf.Visit Golf Channel: https://www.golfchannel.comFind Golf Channel on Facebook: https://www.facebook.com/GolfChannel/Follow Golf Channel on Twitter: https://twitter.com/golfchannelFollow Golf Channel on Instagram: https://www.instagram.com/golfchannel/Highlights: Best of Stephen Curry at American Century Championship | Golf Channelhttps://www.youtube.com/golfchannel?sub_confirmation=1"
"VHDPetsLFeI","Uncle Roger HATE Rachael Ray Adobo","2023-07-16T14:00:17Z","UCVjlpEjEY9GpksqbEesJnNA","mrnigelng","23","23.20.07","nigel ng|uncle roger|nigel ng comedy","1949619","92365","0","9470","https://i.ytimg.com/vi/VHDPetsLFeI/default.jpg","False","False","Go to https://www.expressvpn.com/uncleroger and find out how you can get 3 months of ExpressVPN free!Niece Rachael's original weejio: https://youtu.be/7V_u9F9pGpkUncle Roger's favorite noodles and dumplings (US only): https://eatmila.com/pages/uncleroger💰 Support me so I can keep making weejios for you!Merch: https://unclerogermerch.com/Channel membership: https://www.youtube.com/channel/UCVjlpEjEY9GpksqbEesJnNA/joinShoutouts: https://www.cameo.com/mrnigelng---Uncle Roger is the creation of comedian Nigel Ng.Follow my socials for more content ⬇️💬 Discord: https://discord.gg/2WT3gfc2Qw📸 Instagram: https://www.instagram.com/mrnigelng/👪 Facebook: https://www.facebook.com/nigelngcomedy/🤖 Reddit: https://www.reddit.com/r/UncleRoger/🕺 tiktok: https://www.tiktok.com/@mrnigelng🐦 Twitter: https://twitter.com/MrNigelNg🌎 If you want me to tour your area, put your city in here: http://bit.ly/nigelngmail© Orange Heart Productions"
"8thShXdjsf0","Moneybagg Yo - F My BM (Official Music Video)","2023-07-17T17:00:05Z","UC7r-J2sPQVv9i3iNcte1u-A","MoneybaggYoVEVO","10","23.20.07","Moneybagg|CMG/N-Less/Interscope|Records|Hip|Hop","727835","28298","0","918","https://i.ytimg.com/vi/8thShXdjsf0/default.jpg","False","False","Stream Moneybagg Yo's 'Hard To Love':https://MoneybaggYo.Ink.to/HardToLoveFollow Moneybagg Yo:https://www.instagram.com/moneybaggyo/https://twitter.com/moneybaggyohttps://www.facebook.com/moneybaggyohttp://www.tiktok.com/@moneybaggyo#MoneybaggYo #FMyBM #DaBaby #HardToLoveMusic video by Moneybagg Yo performing F My BM. © 2023 CMG/N-Less/Interscope Recordshttp://vevo.ly/TE2quM"
"6UbSy5JRc10","Something About Resident Evil 4 REMAKE ANIMATED (Loud Sound Warning) 🧟","2023-07-16T15:10:54Z","UCLFXk9J3O-hhOk0msOjKYdQ","TerminalMontage","20","23.20.07","terminalmontage|terminal|montage|jeremey|jer|chinshue|nintendo|animation|cartoon|animated|something|about|cartoon violence|fighting|action|meme|parody|comedy|funny|loud|screaming","1218803","122017","0","6596","https://i.ytimg.com/vi/6UbSy5JRc10/default.jpg","False","False","The president's daughter has been kidnapped and there's only one man for the job. LEON. S. KENNEDY. **YEEEEEEEEEAAAAAAAAAAA-**http://www.TerminalMontage.comPatreon: https://www.patreon.com/terminalmontageTwitter: https://twitter.com/TerminalMontageFacebook: https://www.facebook.com/TerminalMontage/Instagram: https://www.instagram.com/jeremeyyyyyy/Merch: https://terminalmontagemerchportal.weebly.com/Clips Channel: https://www.youtube.com/TerminalMontageClipsResearch, Writing, Character Concepts, Storyboard, Sound Resources by Lollergatorhttps://twitter.com/lollergatorAnimatic, Animation, Backgrounds, Character Design, Coloring, Lineart, Sound Design, Special Effects, Additional Writing by Jeremey Chinshuehttps://twitter.com/JeremeyChinshueBackgrounds, Additional Foreground Asset Lineart and Additional Special Effects by Edgar Nielsenhttps://twitter.com/funymonyhttps://www.mediamuffin.com/https://www.youtube.com/channel/UCQ7LdY3b1_1eN6G0G_igTbQVoice of Ashley by ColonelCheruhttps://twitter.com/ColonelCheruhttps://www.twitch.tv/colonelcheruVoice of The Merchant by Igor Popovhttps://www.voices.com/profile/igorpopovJapanese Leon Voice by Kozy (Just Global Media)https://www.fiverr.com/kojiasano?source=gig-cards&ref_ctx_id=4d469021-dee2-4787-9a68-c742cebbfce0MUSIC:Resident Evil 2 - Secure Place (Sega Genesis Remix) | PATRON REQUEST By TheLegendOfRenegadehttps://www.youtube.com/watch?v=wZ7qc8_lL4IResident Evil 2 - The Marshalling Yard (The Second Half) (Sega Genesis Remix) By TheLegendOfRenegadehttps://www.youtube.com/watch?v=uurXEZGBs9QMega Man 7 - Shade Man Stage II (Sega Genesis Remix) By TheLegendOfRenegadehttps://www.youtube.com/watch?v=-jOxr-SqXI8Cadillacs and Dinosaurs - Like the Wind (Sega Genesis Remix) By TheLegendOfRenegadehttps://www.youtube.com/watch?v=qhwA3iHdBtcResident Evil - More Rooms (Sega Genesis Remix) | PATRON REQUEST By TheLegendOfRenegadehttps://www.youtube.com/watch?v=MofoQIVr89YMerry Go Round And Round By The Fly Guy Five (Epidemic Sound)https://www.epidemicsound.com/track/52oDNwx7x4/Super Smash Bros Melee - Break The Targets REMIX By MyNewSoundtrackhttps://www.youtube.com/watch?v=-ppOBRERRTQTurrican II - The Final Fight (Sega Genesis Remix) By TheLegendOfRenegadehttps://www.youtube.com/watch?v=eyJPJGKR13MResident Evil 3: Nemesis - Free From Fear (Sega Genesis Remix) By TheLegendOfRenegadehttps://www.youtube.com/watch?v=3OCJgZqlf3cMega Man X4 - SIGMA 1st (Sega Genesis Remix) By TheLegendOfRenegadehttps://www.youtube.com/watch?v=IdqJxI65uzAResident Evil 2 - The Underground Laboratory (Sega Genesis Remix) By TheLegendOfRenegadehttps://www.youtube.com/watch?v=eRwusnFHaXUMega Man Zero 4 - Falling Down (Sega Genesis Remix) By TheLegendOfRenegadehttps://www.youtube.com/watch?v=VjVSPQhhS5MMega Man X3 - Victory/Get A Weapon (Sega Genesis Remix) [2] By TheLegendOfRenegadehttps://www.youtube.com/watch?v=EnQHOyI3HZ8Credits theme; Garden Stage by Jattello https://youtu.be/WSDSCWLkaXE?t=2679For advertising email: Marketing@Frederator.comTERMINALMONTAGE® SOMETHING ABOUT® SOMETHING SERIES®Registered in the U.S. Patent and Trademark Office.© TERMINALMONTAGE LLC. All Rights Reserved. For additional legal information, please see: https://terminalmontageportal.weebly.com/legal-notices-and-disclaimers.html#SomethingSeries #ResidentEvil4 #ResidentEvil #Capcom #Parody #cartoon #animation #gaming"
"Vu9RtrsQft4","I groom them when no one else will","2023-07-16T16:15:17Z","UC94iuT0ABFJYZD1L20wvY7w","Girl With The Dogs 2","22","23.20.07","[none]","569619","42703","0","5829","https://i.ytimg.com/vi/Vu9RtrsQft4/default.jpg","False","False","*NEW FLUFF OFF! GWTD DE-SHEDDING PRODUCT LINE*https://girlwiththedogs.com/shop*ALSO AVAILABLE ON AMAZON, LINK BELOW**CORAL SLICKER BRUSH* https://girlwiththedogs.com*EQUIGROOMER™ DE-SHEDDING BRUSH:* https://girlwiththedogs.com/shop*PET BANDANAS* https://girlwiththedogs.com/shop*HAPPY HOODIE®:* https://girlwiththedogs.com/shop?tag=Pet%20Products*NEW! High quality leather alternative leashes:* https://www.girlwiththedogs.com*Fluff Off De-shedding shampoo:* https://www.amazon.com/Girl-Dogs-Natural-Deshedding-Oz/dp/B0BG7H8P84?maas=maas_adg_4F0D549612B89E1E7FB1C8121414BC8A_afap_abs&ref_=aa_maas&tag=maas*Fluff Off De-shedding conditioner:* https://www.amazon.com/Girl-Dogs-Natural-Deshedding-Conditioner/dp/B0BG7N84GT?maas=maas_adg_CABD14289C3401B69C5B099AC0EB2FB9_afap_abs&ref_=aa_maas&tag=maas*Blueberry Bubble Gum Pet Cologne:* https://www.amazon.com/Girl-Dogs-Fluff-Blueberry-Bubblegum/dp/B0BLC21QSX?maas=maas_adg_50330CEEAE3F55EC227D48DE9E559606_afap_abs&ref_=aa_maas&tag=maas*HAPPY HOODIE AMAZON CANADA*https://www.amazon.ca/Zoni-Pets-LLC-Happy-Hoodies/dp/B08N1LFBV3/ref=mp_s_a_1_3?crid=3M1EJ4KCK9PP6&keywords=happy+hoodie+for+dogs&qid=1649500731&sprefix=happy+ho%2Caps%2C101&sr=8-3*SHAMPOO NOZZLE:* https://www.amazon.com/shop/perfectpoochesgrooming/list/3S8IHIPUFW3C6*FACEBOOK:*https://www.facebook.com/perfectpoochesgrooming*INSTAGRAM:*https://www.instagram.com/perfectpoochesgrooming/*Breed specific product recommendations:**USA:* https://www.amazon.com/shop/perfectpoochesgrooming*CANADA:* https://www.amazon.ca/shop/perfectpoochesgrooming*Disclaimer: I am an Amazon associate and I earn commissions from my Amazon storefront**PAYPAL*https://paypal.me/girlwithedogs"
"1QYBiNRu1ok","정국 (Jung Kook) 'Seven (feat. Latto)' Official Performance Video","2023-07-15T14:59:59Z","UCLkAepWjdylmXSltofFvsYQ","BANGTANTV","10","23.20.07","방탄소년단|BTS|BANGTAN|알엠|RM|슈가|SUGA|제이홉|jhope|지민|정국|k-pop|방탄|j-hope|Jung Kook|Jimin|BTS V|Jin","14606384","1857664","0","57662","https://i.ytimg.com/vi/1QYBiNRu1ok/default.jpg","False","False","정국 (Jung Kook) 'Seven (feat. Latto)' Official Performance Video'Seven (feat. Latto)' Release💽 Listen to 'Seven': https://ingrv.es/SevenCredits:Director: Jihye Yoon (Lumpens)Co-Director: Yong Seok Choi (Lumpens)Production Assistants: Chanyang Kim, Soeyoung ParkProducer : Emma Sungeun Kim (GE production) Production Assistants: Minho Seo, Seungwon ChoiDirector of Photography: Hyunwoo Nam Focus Puller: Eun Ki Kim2nd AC: Young Seo Park3rd AC: Sangphil KimDIT: Hyunji KimGaffer: Heo Jung HwanLighting Crew: Jo Ho Ik, Kim Yoon Sik, Ryu Sung Hoon, Son Su Won, Kang Min Gu, Eom Ji HoProduction Designer / Art Director: Bona Kim & Jinsil Park (Mu:E)Assistant Art Director: A yeong Choi, Minjung Kim (Mu:E)Art Team Manager: Ilho Heo (Mu:E)Techno Crane: Hwang Yong Geun, Kim Hak Seo, Lee Beom Ki, Lim Woo JinDI: Lucid ColourColorist: Wonseok Ko, Dain KimDI Crew: Seojin Jang, Jihyun Song, Imgoo Jo, Suhyeon BaeDI Producer: Ingyeong ChoiPerformance Directing: Lee Byungeun , Yoon SeongeunBX: LONETONE, Jihee HwangA&R: Daye Shin, Daniella Kim, Dongbin Shin, Jongwon Lee, Scooter BraunBIGHIT MUSIC. Rights are reserved selectively in the video. Unauthorized reproduction is a violation of applicable laws. Manufactured by BIGHIT MUSIC, Seoul, Korea.Connect with BTS: https://ibighit.com/bts http://twitter.com/BTS_bighithttp://twitter.com/BTS_twt http://www.facebook.com/bangtan.official https://www.youtube.com/user/BANGTANTV http://instagram.com/BTS.bighitofficial https://www.tiktok.com/@bts_official_bighithttps://weverse.onelink.me/qt3S/94808190https://www.weibo.com/BTSbighithttps://www.weibo.com/BTSmembers http://btsblog.ibighit.com#정국 #JungKook #JungKook_Seven"
"J6iQ7iSQSoY","SIDEMEN BECOME FARMERS FOR 24 HOURS","2023-07-16T18:00:13Z","UCDogdKl7t7NHzQ95aEwkdMw","Sidemen","24","23.20.07","sidemen|sidemen sunday|#sidemensunday","5457425","247965","0","8727","https://i.ytimg.com/vi/J6iQ7iSQSoY/default.jpg","False","False","🎥 GET 50% OFF SIDE+ UNTIL JULY 19th 2023Use Code 'HUMBLEKSI' at https://watch.sideplus.com/checkout/subscribe/purchase🍗: Order food NOW at: https://www.eatsides.com/🍹: XIX Vodka: https://www.xixvodka.com/👉🏻: Subscribe to our Reacts Channel: https://www.youtube.com/SidemenReacts 👈🏻👕: Sidemen Clothing: http://www.sidemenclothing.com👉🏻 Subscribe to our 2nd Channel: https://www.youtube.com/MoreSidemen 👈🏻📸: Sidemen Instagram: http://www.instagram.com/Sidemen🐤: Sidemen Twitter: http://www.twitter.com/Sidemen✏️: SUBMIT A #SidemenSunday IDEA HEREhttps://forms.gle/JDuGrSzM4F6mdo6D9-----------------------------------------------------------------------------------------------------------------------▶️ SIDEMEN ◀️🔵 JOSH (Zerkaa)● http://www.youtube.com/Zerkaa● http://www.youtube.com/ZerkaaPlays● http://www.instagram.com/Zerkaa● http://www.twitter.com/ZerkaaHD🔴 HARRY (W2S)● http://www.youtube.com/W2S● http://www.youtube.com/W2SPlays● http://www.instagram.com/Wroetoshaw● http://www.twitter.com/Wroetoshaw🔵 VIK (Vikkstar123)● http://www.youtube.com/Vikkstar123● http://www.youtube.com/Vikkstar123HD● http://www.youtube.com/VikkstarPlays● http://www.instagram.com/Vikkstagram● http://www.twitter.com/Vikkstar123🔴 JJ (KSI)● http://www.youtube.com/KSI● http://www.youtube.com/KSIOlajidebtHD● http://www.instagram.com/KSI● http://www.twitter.com/KSIOlajidebt🔵 TOBI (Tobjizzle)● http://www.youtube.com/TBJZL● http://www.youtube.com/Editingaming● http://www.instagram.com/Tobjizzle● http://www.twitter.com/Tobjizzle🔴 ETHAN (Behzinga)● http://www.youtube.com/Behzinga● http://www.youtube.com/Beh2inga● http://www.instagram.com/Behzingagram● http://www.twitter.com/Behzinga🔵 SIMON (Miniminter)● http://www.youtube.com/Miniminter● http://www.youtube.com/MM7Games● http://www.instagram.com/Miniminter● http://www.twitter.com/Miniminter"
"tXKWrfqgfGI","We Steal a Grimace Shake and Everything Goes Wrong in People Playground!","2023-07-17T14:15:03Z","UCPhckk25N7P8OI580ucRidA","Ctop","20","23.20.07","ctop|gaming|funny moments|people playground|people playground game|people playground gameplay|physics game|ragdoll game|titan|titans|attack on titan|people playground mods|people playground ragdolls|ragdoll gameplay|grimace shake","436202","7507","0","266","https://i.ytimg.com/vi/tXKWrfqgfGI/default.jpg","False","False","Welcome to People Playground with Ctop and SimplyChris! We are now in the game, let's do some dumb stuff in this physics ragdoll game! Today let's have a nice Grimace milkshake!Thanks to Slebbey for making Ctop and SimplyChris in People Playground!https://steamcommunity.com/sharedfiles/filedetails/?id=2780987906&searchtext=ctopJoin this channel to get access to perks:https://www.youtube.com/channel/UCPhckk25N7P8OI580ucRidA/join---------------------------------------------------------------------------------------------------------Twitter:  https://twitter.com/CtopGamingInstagram: https://www.instagram.com/ctopVR/Twitch Livestreams: https://www.twitch.tv/ctoptwitchDiscord Community: https://discord.gg/ctopShirts: https://teespring.com/stores/ctops-store---------------------------------------------------------------------------------------------------------"
"FoI4GPWxRtA","How I Lost $1,000,000 On A Minecraft Server...","2023-07-16T19:09:28Z","UCAz5JW1_oryewk0eR-eP7Bw","Tubbo","20","23.20.07","tubbo|vlog|in real life|minecraft|in|real|life|twitch|stealing|funny|fun|challenge|shopping|tommyinnit vlog|jack manifold|jack|boat|blog|I Built A Boat|subbathon|stream|minecraft server|hypixel|mineplex|hive|How I Spent $1000000 On A Minecraft Server","483525","54207","0","1712","https://i.ytimg.com/vi/FoI4GPWxRtA/default.jpg","False","False","follow my twitch ► https://www.twitch.tv/tubboThis is TubNet the full story! TubNet is a minecraft minigame server similar to hypixel and mineplex and this video is dedicated to my story and journey from day 1 of the project to the launch day!Directed and Shot by @ScottpostsEditor:  https://twitter.com/ccleafofficialfollow my Twitter - https://twitter.com/TubboLIVEfollow my Instagram - https://www.instagram.com/tubbolive/#tubbo"
