video_id,title,publishedAt,channelId,channelTitle,categoryId,trending_date,tags,view_count,likes,dislikes,comment_count,thumbnail_link,comments_disabled,ratings_disabled,description
"SVrvU-iHf3o","I Survived 100 Days as GODZILLA in Minecraft","2023-07-15T12:30:11Z","UCHRTfR2r0Ss3UjFyw7gSA-A","Ryguyrocky","20","23.20.07","Minecraft|minecraft roleplay|ryguyrocky|I Survived 100 Days as GODZILLA in Minecraft|Minecraft 100 Days|Minecraft 100 Day Godzilla|100 Day Godzilla|Minecraft Godzilla|Minecraft Custom Mod|Minecraft Custom Map|ryguyrocky 100|minecraft academy|academy|minecraft mod|minecraft mods|spotlight|playthrough|no cursing|no swearing|family friendly|kid friendly|kid|kids|school","1301354","22547","0","2040","https://i.ytimg.com/vi/SVrvU-iHf3o/default.jpg","False","False","Want to be in a future video? Join my Discord! ►https://discord.com/invite/nZpvfe49Vk►Episode  - I Survived 100 Days as GODZILLA in Minecraft•🔷•🔷•🔷•🔷•🔷•🔷•🔷•🔷•🔷•🔷•🔷•Check out my other CHANNELS!►Ryguy IRL - https://www.youtube.com/channel/UCZ3ioJV6Nanz-HjAkLnvrxQ►Ryguy Roblox - https://www.youtube.com/channel/UCepSF6Lms2gtEJo9RslDWFQ►Ryguy Plays - https://www.youtube.com/channel/UCPxASykySKRXfAxvFtdMqig•🔷•🔷•🔷•🔷•🔷•🔷•🔷•🔷•🔷•🔷•🔷•Follow me:🐦 Twitter - http://twitter.com/Ryguyrocky📘 Facebook - https://www.facebook.com/RyguyrockyOFFICIAL📷 Instagram - http://instagram.com/Ryguyrocky🎵 TikTok - https://www.tiktok.com/@ryguy_official•🔷•🔷•🔷•🔷•🔷•🔷•🔷•🔷•🔷•🔷•🔷•I hope you all enjoyed!If you did; please make sure to subscribe and hit that 🔔 notification bell 🔔so you never miss an upload!Thanks for all the support, Rock Army!#ryguyrocky #minecraft #minecraftroleplay"
"xkh0JP3ZfjY","I Built Turbo Shoes to Run Faster","2023-07-15T14:55:00Z","UCrGDhgrJH1G9CVHY1krv5lQ","Jake Carlini","24","23.20.07","I built shoes to run faster|I built shoes that make me run faster|worlds fastest shoes|fastest shoes|ai powered shoes|running shoes|best running shoes|running|i built fast shoes|fast shoes","759878","9711","0","819","https://i.ytimg.com/vi/xkh0JP3ZfjY/default.jpg","False","False","Try Air Up today! Use discount code Jake20 for 20% off sitewide https://airup.link/JakeCarlini072023Follow me on Instagram: https://www.instagram.com/jakecarlini/JCU Merch: https://Shop.jakecarlini.comMUSIC: https://www.youtube.com/channel/UCjhzSeYzkNQE6SA6YE-ZW4gThat's All I Got!Disclaimer : Some links that may appear are from companies which Jake Carlini will earn an affiliate commission or referral bonus."
"tZkK7DdKD9I","Game Theory: Give Me Your SOUL! (Minecraft Legends)","2023-07-15T18:05:27Z","UCo_IB5145EVNcf8hw1Kku7w","The Game Theorists","20","23.20.07","minecraft|minecraft legends|minecraft 1.2|minecraft lore|minecraft legends lore|minecraft mob|minecraft update|minecraft new update|minecraft legends gameplay|minecraft legends theory|minecraft legends game|minecraft legneds story|minecraft survival|minecraft challenge|minecraft theories|minecraft lore solved|minecraft legends lore explained|minecraft legends ending|game theorists|matpat|game theory|matpat minecraft|game theory minecraft|gt minecraft","1719232","95471","0","5310","https://i.ytimg.com/vi/tZkK7DdKD9I/default.jpg","False","False","Download the best fantasy RPG game Watcher of Realms for free: https://click.fan/GameTheorists_WoRJoin the ultimate battle event and team up with me to get a chance to win amazing prizes like iPhones, Nintendo Switch, and more. Visit https://click.fan/GameTheorists_event for details.Friends, welcome back to the block-shaped world of Minecraft! Today we're talking about Minecraft Legends, the newest release from Mojang, and some of the sweet juicy lore we've found so far! There's So much in this game that we've put together 3 Minecraft Legends theories for you to ponder today. So whip out those pickaxes and let's get to work!‐‐‐‐‐‐‐‐‐‐‐‐‐‐‐‐‐‐‐‐‐‐‐‐‐‐‐‐‐‐‐‐‐‐‐‐‐‐‐‐‐‐‐‐‐‐‐‐‐‐*🔽 Don’t Miss Out!*Get Your TheoryWear! ► https://theorywear.com/Dive into the Reddit! ► https://www.reddit.com/r/GameTheorists/Need Royalty Free Music for your Content? Try Epidemic Sound.Get Your 30 Day Free Trial Now ► http://share.epidemicsound.com/MatPat‐‐‐‐‐‐‐‐‐‐‐‐‐‐‐‐‐‐‐‐‐‐‐‐‐‐‐‐‐‐‐‐‐‐‐‐‐‐‐‐‐‐‐‐‐‐‐‐‐‐*👀 Watch MORE Theories:*Minecraft, The FROZEN Nether ► https://youtu.be/9vbb57UIG0YThe Forgotten War of Minecraft ► https://youtu.be/_2jULayKYTsMinecraft: Secrets of the Undead Ender Dragon ► https://youtu.be/aL8sWlFT3mo‐‐‐‐‐‐‐‐‐‐‐‐‐‐‐‐‐‐‐‐‐‐‐‐‐‐‐‐‐‐‐‐‐‐‐‐‐‐‐‐‐‐‐‐‐‐‐‐‐‐*SUBSCRIBE to Game Theory!*https://www.youtube.com/@GameTheory/?sub_confirmation=1‐‐‐‐‐‐‐‐‐‐‐‐‐‐‐‐‐‐‐‐‐‐‐‐‐‐‐‐‐‐‐‐‐‐‐‐‐‐‐‐‐‐‐‐‐‐‐‐‐‐*Join Our Other YouTube Channels!*🎥   @FilmTheory  🍔   @FoodTheory  👔   @StyleTheorists ‐‐‐‐‐‐‐‐‐‐‐‐‐‐‐‐‐‐‐‐‐‐‐‐‐‐‐‐‐‐‐‐‐‐‐‐‐‐‐‐‐‐‐‐‐‐‐‐‐‐*Credits:*Writers: Matthew Patrick and Tom RobinsonEditors: Dan Cybert Seibert, Warak, Tyler Mascola and JayskiBeanSound Designer: Yosi Berman‐‐‐‐‐‐‐‐‐‐‐‐‐‐‐‐‐‐‐‐‐‐‐‐‐‐‐‐‐‐‐‐‐‐‐‐‐‐‐‐‐‐‐‐‐‐‐‐‐‐#Minecraft #MinecraftLegends #MinecraftLore #Watcherofrealms#NextgenRPG #MinecraftTheory #MinecraftUpdate #Theory #GameTheory #Matpat"
"8Mvt-ewV_B0","Using FAKE Lava to FOOL My Friends","2023-07-16T01:00:02Z","UCharrcPjOA4XLCVcfkyepDg","Firelight","20","23.20.07","eystreem|eystream|firelight|ethan minecraft|firelight846|eystreem best friend|minecraft|family friendly|roleplay|funny|prank|secret|minecraft phone|minecraft bedrock edition|using fake lava to fool my friends|i fooled my friend|fooling my friend in minecraft|minecraft pranks|minecraft trolls|i pranked my friend in minecraft|i secretly cheated using fake blocks|fake blocks mod minecraft|minecraft fake diamonds|minecraft diamond trap|trapping my friend in minecraft","697122","11805","0","531","https://i.ytimg.com/vi/8Mvt-ewV_B0/default.jpg","False","False","I Secretly Pranked Luke with a REALISTIC Block Hack in Minecraft! Can you find the REAL Diamonds?✅ Main Channel: https://www.youtube.com/c/eystreem?sub_confirmation=1❤️ Tik Tok: https://www.tiktok.com/@firelight846mc?_t=8ZCYwB1CFKT&_r=1📷 Instagram: https://www.instagram.com/itsfirelight846/🎮 My Minecraft Server Address: play.eyserver.comYou can join this server on Bedrock Edition (Phones, Consoles and Tablets) and Java Edition (PC and Mac)💙 Huge thanks and credit to these awesome creators for inspiring today's video: https://docs.google.com/document/d/1_UilMRDHRNSZ3VyzxhW0fQ6_T5GfizFUlMGCI20vPGI/edit?usp=sharing🎵 Music from: http://share.epidemicsound.com/wn87w#Firelight #Minecraft"
"xvDQ8eUurYU","The best Festival of Speed runs | Sunday","2023-07-16T19:21:38Z","UC8rador8CU-pTJ6p7WNiv6w","Goodwood Road & Racing","2","23.20.07","Goodwood|Goodwood Festival|Goodwood Festival of Speed|Festival of Speed|F1|best bits|Goodwood best|best runs|Goodwood motorsport|Formula 1|Mick Schumacher|Sebastian Vettel|Timed Shootout|Goodwood Shootout|Drift","410685","6318","0","359","https://i.ytimg.com/vi/xvDQ8eUurYU/default.jpg","False","False","Mick Schumacher driving his fathers car was just one of the mind-blowing families that happened on the Sunday of the 2023 Festival of Speed presented by Mastercard. There was also things like Sebastian Vettel donuting the F1 title winning Williams FW14B. A new hillclimb Timed Shootout winner, drifters going mad and much more. What was your favourite moment?#FOS #F1 #Vettel #Schumacher #bestof Timestamps00:00 Intro00:10 Mick Schumacher's donuts01:48 Adam Smalley Porsche 911 GT3 Cup02:47 Ducati's World Champions04:45 Travis Pastrana shows off05:49 McMurtry burnouts07:28 Aston Martin DBX 707 drifting08:06 Sebastian Vettel donuts FW14B09:40 Lamborghini Huracan Sterrato drifts10:33 Travis right to the edge11:25 Eurofighter BMW smokeshow12:53 WRC Escort on fire13:52 Shootout winnerOfficial Website 👉 http://www.goodwood.com/grr/Facebook 👉 http://www.facebook.com/goodwoodrrcInstagram 👉 http://www.instagram.com/goodwoodrrc/ Twitter 👉 http://www.twitter.com/goodwoodrrcSUBSCRIBE for more racing cars, supercars, new car reviews, historic motorsport and Goodwood event coverage  👉 http://bit.ly/GoodwoodTVBuy your Goodwood Event tickets 👉 http://bit.ly/GWBuyTickets"
"zLC-7Il-uYg","Quavo & Future - Turn Your Clic Up (Official Video)","2023-07-14T22:00:07Z","UCBBS37qiiYHkMBA42LgDmOg","QuavoVEVO","10","23.20.07","Quavo|Future|Turn|Clic|Quality|Control|Music/Motown|Records|Hip|Hop","2346805","112731","0","4705","https://i.ytimg.com/vi/zLC-7Il-uYg/default.jpg","False","False","Stream // Download Quavo and Future's Turn Yo Clic Up here: https://QualityControl.lnk.to/TurnYoClickUpFollow Quavo!https://www.instagram.com/quavohuncho https://twitter.com/QuavoStuntin https://www.tiktok.com/@quavohuncho https://www.facebook.com/THEMigosAtlMusic video by Quavo, Future performing Turn Yo Clic Up. Quality Control Music/Motown Records; © 2023 Quality Control Music, LLC, under exclusive license to UMG Recordings, Inc.http://vevo.ly/rGzpou"
"P3VGfx1sd1Q","The Champions: Season 7, Episode 4","2023-07-17T16:00:31Z","UClvow1RFSyeh5CRwRB_m5sA","B/R Football","17","23.20.07","br football|bleacher report|soccer|football|goal|champions|champions league|epl|world cup|ronaldo|messi","736713","43468","0","2007","https://i.ytimg.com/vi/P3VGfx1sd1Q/default.jpg","False","False","Arsenal finally arrive at the mansion, only to find it in ruins 😱We hope you enjoyed The Champions Season 7!"
"Bw-StjYAgoA","Tony Hawk Made a Low Budget Animated Movie?","2023-07-14T19:00:01Z","UC7zsxKqd5MicTf4VhS9Y74g","Kurtis Conner","23","23.20.07","kurtis conner|kurtis connor|tony hawk|animated movie|movie review|commentary","1711839","119930","0","6331","https://i.ytimg.com/vi/Bw-StjYAgoA/default.jpg","False","False","For 50% off with HelloFresh PLUS free shipping, use code KURTISTOWN50 at https://bit.ly/407Yq1PTony Hawk made an animated movie and it's not good let's watch it together► kurtisconner.world.co FOLLOW ME:► https://instagram.com/kurtisconner/► https://twitter.com/kurtisconnerNEW MERCH ► https://shop.kurtisconner.com/PODCAST:► https://patreon.com/veryreallygoodLISTEN TO MY PODCAST:► https://open.spotify.com/show/3nGVLHpNXo6MiHQmotIAHG?si=T9Q-NAIOQG6BpWL_7oUvDA► https://podcasts.apple.com/ca/podcast/very-really-good/id1335843384TWITCH:► https://www.twitch.tv/kurtisconner  MY GAMING CHANNEL: ► https://www.youtube.com/channel/UCG1CpMuKazt5wJxy3AwMfpwthanks for watching!comment those are some mad beats yo” ur reading this#kurtisconner"
"Lk4N2epJzgg","He Made A Million Dollar Shot And They Didn't Want To Pay Him","2023-07-14T22:16:09Z","UC3L9XPe0_FGfRG-CMGtBvFg","JxmyHighroller","17","23.20.07","LeBron James|House of Highlights|ESPN|NBA highlights|Jimmy Highroller|NBA trash talk|Buzzer Beaters|Brooklyn Nets|Ankle Breakers|NBA Championship|Rebound|Stephen Curry|Lakers|nba breaking news|Lakers trade|Kevin Durant trade|Russell Westbrook trade|LeBron scoring record|Nikola Jokic|Jimmy Butler|Miami Heat|Victor Wembenyama|Michael Jordan|kobe bryant|in season tournament|kyrie|nba free agency|nba summer league|Chet Holmgren|million dollar shot","7154630","201063","0","11076","https://i.ytimg.com/vi/Lk4N2epJzgg/default.jpg","False","False","Use code JXMY for $20 oﬀ your ﬁrst SeatGeek order.https://seatgeek.onelink.me/RrnK/JXMYFollow me on Instagram: https: //www.instagram.com/jxmyhighroller Be sure to subscribe and turn on notifications for the latest content from ya boy Jxmy! We doin this a couple times a week, every week! *Copyright Disclaimer Under Section 107 of the Copyright Act 1976, allowance is made for fair use for purposes such as criticism, comment, news reporting, teaching, scholarship, and research. Fair use is a use permitted by copyright statute that might otherwise be infringing. Non-profit, educational or personal use tips the balance in favor of fair use. No copyright infringement intended. ALL RIGHTS BELONG TO THEIR RESPECTIVE OWNERS"
"DVa4tfzpZ90","I 3D printed my friends and surprised them with it","2023-07-14T19:17:49Z","UCTSRIY3GLFYIpkR2QwyeklA","Drew Gooden","23","23.20.07","drew gooden|comedy|commentary|reaction|vine|drew gooden vine|road work ahead guy|parody|rant|cringe|3d print|danny gonzalez|kurtis conner|eddy burback|jarvis johnson|nakeyjakey|collab|action figures","1771060","155396","0","6149","https://i.ytimg.com/vi/DVa4tfzpZ90/default.jpg","False","False","Thanks to HelloFresh for sponsoring this video. For 50% off with HelloFresh PLUS free shipping, use code IMALITTLESTINKER50 at https://bit.ly/3r6tsuE.NEW MERCH:https://drewgoodenshop.com/collections/frontpagefeaturing:​ @Danny-Gonzalez ​ @kurtisconner  ​ @jarvis ​ @NakeyJakey   @EddyBurback   @JordanAdika  follow me:twitter - https://www.twitter.com/drewisgoodeninstagram - https://www.instagram.com/drewisgooden"
"q3TgQUpuzlE","Highlights | West Indies v India | India Win By Innings | 1st Cycle Pure Agarbathi Test Day 3","2023-07-15T00:23:14Z","UC2MHTOXktfTK26aDKyQs3cQ","Windies Cricket","17","23.20.07","cricket|cricket west indies|west indies|windies|west indies cricket team|cricket highlights|cricket highlights match today|West indies vs India|west indies india Cricket|west indies india test|virat kohli|rohit sharma|jason holder|bcci cricket|india cricket highlights","2927359","23508","0","951","https://i.ytimg.com/vi/q3TgQUpuzlE/default.jpg","False","False","Watch day 3 highlights of West Indies v India during the 1st Cycle Pure Agarbathi Test Series powered by Yes Bank at Windsor Park, Roseau. This is the official channel for the West Indies cricket team, providing all the latest highlights, interviews and features to keep you up to date with all things Windies. Subscribe to the channel here!https://www.youtube.com/channel/UC2MHTOXktfTK26aDKyQs3cQ?view_as=subscriberFind out more about the Windies at:http://Windiescricket.com"
"QgPX_NE1it8","STOP COPYING ME!!","2023-07-14T16:00:10Z","UCY30JRSgfhYXA6i6xX1erWg","Smosh","23","23.20.07","smosh|smosh games|smosh pit|ian and anthony|anthony and ian|smosh anthony|smosh ian|smush|smoosh|comedy|sketch comedy|sketch|skit|skit comedy|comedy sketches|funny sketches|stand up|stand up comedy|funny|ian hecox|anthony padilla","3032121","458787","0","17754","https://i.ytimg.com/vi/QgPX_NE1it8/default.jpg","False","False","We've known each other for too long...BECOME A MEMBER: https://youtube.com/@smosh/joinWEAR OUR JOKES: https://smosh.com+SMOSH ROYALTY GETS ACCESS TO THE LIVE WATCH PARTY WITH IAN & ANTHONY @ 12PM PT TODAYWHO YOU SEEIan HecoxAnthony Padilla911 Operator 1- Shayne Topp911 Operator 2 - Courtney MillerWHO YOU DON’T SEE (usually)Director, Writer, etc - Anthony PadillaDirector, Writer, etc - Ian HecoxExecutive Producer - Alessandra CataneseProducer - Elise FelberProducer - Kathy Sue HoltorfDirector of Photography/Co - Director - Kathy Sue HoltorfCam Op - Amber SteeleCam Op - Noah KellyDIT/Assistant Editor - Matt DuranGaffer - Noah KellyProduction Designer- Stephanie BatesSet Decorating - John HastieSound Mixing - Matthew FaulknerScript Supervisor - Joshua DozierSocial Media Manager - Mallory MyersPost Supervisor - Mike CriscimagnaHead Editor - Patrick HorbaEditor - Josh FleurySound Supervisor - Gareth HirdAssistant Editor - Levi VillalpandoSocial Media Editor - Cassie KornProduction Assistant - Marcus MunguiaOTHER SMOSHES:Smosh Pit: https://smo.sh/Sub2SmoshPitSmosh Games: https://smo.sh/Sub2SmoshGamesEl Smosh (Spanish Dub): https://smo.sh/Sub2ElSmoshFOLLOW US:TikTok: https://smo.sh/TikTokSnapchat: http://smo.sh/OnSnapchatInstagram: https://instagram.com/smoshFacebook: https://facebook.com/smoshTwitter: https://twitter.com/smosh"
"x6mc_rRwD3A","Jung Kook of BTS performs ‘Seven’ in NYC l GMA","2023-07-14T14:03:44Z","UCH1oRy1dINbMVp3UFWrKP0w","Good Morning America","24","23.20.07","abc|army|bts|career|central|concert|evacuation|gma|jung|kook|news|nyc|p_cmsid=2494279|p_vid=news-101268801|park|series|seven|solo|summer|jungkook seven|junggook seven lyrics|bts gma summer concert|jung kook central park|jung kook seven|good morning america jungkook","8306938","724224","0","15876","https://i.ytimg.com/vi/x6mc_rRwD3A/default.jpg","False","False","The global pop star performs his new hit “Seven” during the “GMA” Summer Concert Series from New York City’s Central Park.SUBSCRIBE: https://bit.ly/2Zq0dU5 SIGN UP to get the daily GMA Wake-Up Newsletter: https://gma.abc/2Vzcd5jVISIT GMA: https://www.goodmorningamerica.comFOLLOW:TikTok: https://tiktok.com/@gmaInstagram: https://instagram.com/GoodMorningAmericaFacebook: https://facebook.com/GoodMorningAmericaTwitter: https://twitter.com/gma#jungkook #jungkookongma #btsarmy #seven #music #gma"
"3wzFrm9ERkY","Rocko Suffered an Injury - What Do We Do Now? - Van Life in BC","2023-07-15T17:12:41Z","UCofJu853kJKpkg4y5a-9YXg","Foresty Forest","24","23.20.07","[none]","116380","13355","0","1223","https://i.ytimg.com/vi/3wzFrm9ERkY/default.jpg","False","False","Rocko injured and needed stitches, so we head out to find a project.Merchandise:https://foresty-forests-store.creator-spring.comSummit Map:https://drive.google.com/open?id=12GFzG-9ZUr4Ue9pjq22mZVF3fdk_dYpY&usp=sharinghttp://www.strava.com/clubs/forestyforesthttp://www.instagram.com/forestyforest"
"5LWDl5qaQbA","iOS 17 Hands-On: Top 5 Features!","2023-07-14T16:39:30Z","UCBJycsmduvYEL83R_U4JriQ","Marques Brownlee","28","23.20.07","ios 17|iOS 17 features|iOS 17 review|features|MKBHD|iOS update|iOS download|iphone update|iphone software|iphone 17|iPhone OS|iMessage|Personal Voice|Standby|Standby Mode|iOS 17|funciones de iOS 17|reseña de iOS 17|funciones|actualización iOS|descarga de iOS|actualización de iPhone|software de iPhone|Voz Personal|En Espera|Modo En Espera","4242366","126540","0","5601","https://i.ytimg.com/vi/5LWDl5qaQbA/default.jpg","False","False","iOS 17, coming soon to an iPhone near youWhen Apple is a shark: https://youtu.be/qNAo0UdYF6gMKBHD Merch: http://shop.MKBHD.comTech I'm using right now: https://www.amazon.com/shop/MKBHDIntro Track: http://youtube.com/20sylPlaylist of MKBHD Intro music: https://goo.gl/B3AWV5~http://twitter.com/MKBHDhttp://instagram.com/MKBHDhttp://facebook.com/MKBHD0:00 There's a theme here1:18 NameDrop3:42 Personal Voice6:00 The Little Things7:38 Standby Mode9:48 The Phone"
"nqzQpdhwPjY","This Hurricane Season Is About To Go Nuts…","2023-07-15T17:39:26Z","UCJHAT3Uvv-g3I8H3GhHWV7w","Ryan Hall, Y'all","24","23.20.07","weather|weather forecasting|forecasting|forecast|wild weather|extreme weather|intense weather|beautiful weather|weather channel|weather hunter|severe weather|major|intense|extreme|historic|blizzard|snow|heavy snow|major snow storm|snowstorm|snow squall|one foot snow|two feet snow|winter storm|tornado|tornado chasing|tornado chasers|storm chasing|storm chasers|tornadoes|ef5|hurricane|major hurricane|ryan hall","1420094","50805","0","3099","https://i.ytimg.com/vi/nqzQpdhwPjY/default.jpg","False","False","Use code YALL50 to get 50% off your first Factor box at https://bit.ly/3qT0Kgn !In this video we are talking about the record breaking sea surface temperatures in the Atlantic, El Nino, and their influence on this upcoming peak hurricane season… #weatherchannel #ryanhall #ryanhallyallThe Y'all Squad Nonprofit: https://www.theyallsquad.org/Official Weather Merch: https://shopryanhall.com/Join this channel to get access to exclusive perks:https://www.youtube.com/channel/UCJHAT3Uvv-g3I8H3GhHWV7w/join_____________________________________The Atlantic Is Boiling: 0:00El Nino Update: 1:38Hurricane Season Update: 4:22_____________________________________Subscribe to these other channels:Ryan Hall, Y'all XTRA: https://www.youtube.com/@RyanHallYallXTRAY'all Squad: https://www.youtube.com/@YallSquadMeteorologist Andy Hill: https://www.youtube.com/@metandyhillCheck out the Y'all Squad discord server!https://discord.gg/ryanhallyallFollow me on these things:https://www.facebook.com/ryanhallyallhttps://twitter.com/ryanhallyallhttps://www.instagram.com/ryanhallyall/https://www.tiktok.com/@ryanhallyallhttps://www.twitch.tv/ryanhallyallOFFICIAL WEBSITE: https://ryanhallyall.com/BUSINESS INQUIRIES: info@ryanhallyall.comSend us something in the mail!PO Box 2668Pikeville, KY 41501Please refer to your local National Weather Service office to get the most reliable and up to date weather information as possible."
"sdhsp6NaB-A","SLEEPLESS - AP Dhillon","2023-07-14T04:00:12Z","UCsaXTlOmt0o9aGeC_n_r8VQ","RUN-UP RECORDS","10","23.20.07","ap dhillon|sleepless ap dhillon|latest Punjabi songs|new Punjabi music|Punjabi hiphop|desi hiphop|2023 trending music|trending punjabi music|ap dhillon new song|brown munde new song|punjabi hits|Punjabi classic","802096","33822","0","1398","https://i.ytimg.com/vi/sdhsp6NaB-A/default.jpg","False","False","AP Dhillon presents Sleepless”Subscribe for 🔥: Run-up Records : http://bit.ly/2qqGljILatest Punjabi Song 2023SLEEPLESS - AP DHILLON Song   : SLEEPLESSSinger : AP DHILLONMusic : CASTELLO BEATSLyrics :  SHINDA KAHLONMix : AP DHILLONVideo : SPIKE JORDANAll streaming platforms : AP DHILLON - www.instagram.com/ap.dhillxn/PUNJABI SONG 2023 LATEST PUNJABI SONGSPUNJABI HIPHOPNEW PUNJABI SONGS"
"HmhpmkeptXE","7.2 earthquake triggers tsunami warning in Alaska","2023-07-16T11:03:09Z","UC52X5wxOL_s5yw0dQk7NtgA","Associated Press","25","23.20.07","150d90011a5c4d36ae6e337f8a7c42d4|4444708|Alaska|Associated Press|Kodiak|US AK Earthquake Siren (CR)|be81adb8f81044098549e3c90b52c6f3|news","502377","3134","0","492","https://i.ytimg.com/vi/HmhpmkeptXE/default.jpg","False","False","A brief tsunami warning has been triggered after a 7.2 earthquake struck 66 miles off the Alaskan coast in the Pacific ocean."
"QYmKDngX7rY","Skate Anywhere Like Frozone! (Freeze and Skate)","2023-07-14T21:01:06Z","UC89AgkG34oooZubVt23wzFw","JLaservideo","1","23.20.07","Jlaservideo|DIY|how to|tutorial|frozone|ice|walk on water|superhero|engineering|technology|invention|ice skating|super powers","1875195","100767","0","5138","https://i.ytimg.com/vi/QYmKDngX7rY/default.jpg","False","False","Download the best fantasy RPG game Watcher of Realms for free: https://click.fan/JLaser_WoRJoin the ultimate battle event and team up with TGT or Jschlatt, to get a chance to win amazing prizes like iPhones, Nintendo Switch, and more. Visit https://event.watcherofrealms.com/en/m/index.html?utm_source=JLaservideo for details.#Watcherofrealms #NextgenRPGGet a Web Shooter: http://jlaservideo.com/webshooterHere's how to skate anywhere like Frozone. This device features liquid nitrogen as well as elephants toothpaste to create snow that is blasted from the users hands. Facebook: http://goo.gl/ZzRoKMInstagram: http://goo.gl/b4W1ftPlaylist of Every Video: http://goo.gl/QVU2WzIf you liked this video, check out more on my channel http://youtube.com/jlaservideoMusic: https://goo.gl/7bB4Jk"
