video_id,title,publishedAt,channelId,channelTitle,categoryId,trending_date,tags,view_count,likes,dislikes,comment_count,thumbnail_link,comments_disabled,ratings_disabled,description
"pPY3aZYT2gI","Soolking ft. DYSTINCT - Y Dor [Clip Officiel]","2023-07-28T16:00:41Z","UCz6JjQtnK9XjMwKuqlEkRxw","Soolking Officiel","10","23.30.07","Soolking|Soolking nouveau clip|Soolking officiel|Soolking album|Soolking zemer|Soolking paroles|Soolking parole|Soolking lyrics|zemer|Soolking new video|Soolking algérie|Soolking musique|Soolking music|Soolking official|Soolking nouveau single|Soolking fada|melegim|suavemente|bessame|guerilla|niska|askim|jul|baila|balader|sans visa|casanova|soolking clip|clip casanova|soolking gazo|soolking gazo casanova|y dor|soolking dystinct|soolking dystinct y dor","697378","43249","0","1970","https://i.ytimg.com/vi/pPY3aZYT2gI/default.jpg","False","False","Écoutez Y Dor feat DYSTINCT  : https://soolking.lnk.to/YDORClip réalisé par William Thomas Prod by YAM & Unleaded Abonnez-vous à la chaîne :  https://www.youtube.com/channel/UCz6JjQtnK9XjMwKuqlEkRxw?sub_confirmation=1 Rejoignez-moi sur les réseaux sociaux :Facebook : http://bit.ly/2ApZ9nxInstagram : http://bit.ly/2jinDYcTwitter : http://bit.ly/2Bp2lj4Snapchat : http://bit.ly/2BS3fSa #Soolking #DYSTINCT #YdorDécoration Amel Montel design https://instagram.com/amel_montel_design_?igshid=NTc4MTIwNjQ2YQ=="
"Fij7x3h_S6Y","AMP FRESHMAN CYPHER 2023","2023-07-27T00:05:04Z","UCJbYdyufHR-cxOuY96KIoqA","AMP","24","23.30.07","AMP FRESHMAN CYPHER 2023|AMP CYPHER|AMP FRESHMAN CYPHER|KAI CENAT|DUKE DENNIS|FANUM|AGENT 00|CHRISNXTDOOR|IMDAVISSS|LIL YACHTY|KAYSAN","3161844","268217","0","32129","https://i.ytimg.com/vi/Fij7x3h_S6Y/default.jpg","False","False","CHECK OUT APPAREL DROP 2 ⚡ HTTPS://AMP.SHOPWE RECORDED A PODCAST!! SUB NOW https://www.youtube.com/channel/UC51ypdbMnEyRb9f9MCOg_Vg?sub_confirmation=1VIDEO DIRECTED & EDITED BY JESSE LOMAX & FOURTH FRAME STUDIOSAMP AMP AMP AMP📸 Follow us on Instagram: https://www.instagram.com/ampexclusive🦅 Follow us on Twitter: https://twitter.com/ampexclusive⚡️⚡️AMP⚡️⚡️⚡️Fanum aka JustFanum🎥 https://www.youtube.com/c/FanumReacts/videos📸 https://www.instagram.com/elfanum/🦅 https://twitter.com/FanumTV⚡️Duke aka Duke Dennis🎥 https://www.youtube.com/c/DeeBlockDukeDennis📸 https://www.instagram.com/duke_dennis/🦅 https://twitter.com/ImDukeDennis⚡️Agent aka Agent 00🎥 https://www.youtube.com/user/CallMeAgent00📸 https://www.instagram.com/callmeagentzero/🦅 https://twitter.com/CallMeAgent00⚡️Davis aka ImDavisss🎥  https://www.youtube.com/c/ItsDavisss📸 https://www.instagram.com/imdavisssyt/🦅 https://twitter.com/imdavisss⚡️ Kai aka Kai Cenat🎥 https://www.youtube.com/c/KaiCenat📸 https://www.instagram.com/kai_cenattv/🦅 https://twitter.com/KaiCenat⚡️Chris aka chrisnxtdoor🎥 https://www.youtube.com/watch?v=yEREEVk06ZM📸 https://www.instagram.com/chrisnxtdoor_/🦅 https://twitter.com/chrisnxtdoor_"
"bSC8PQ1DXAg","7 Façons de Voler des Diamants dans Minecraft","2023-07-28T10:49:21Z","UCtgGt41P7WhoZxtEFPt-5pA","Azpaz Tv","20","23.30.07","minecraft|minecraft fr|azpaz|azpaz tv|Minecraft|Minecraft mod|family friendly|kid friendly|diamants|7 façons de voler des diamants dans minecraft","167188","7073","0","218","https://i.ytimg.com/vi/bSC8PQ1DXAg/default.jpg","False","False","Aujourd'hui, Ratman rentre chez lui avec des tas de diamants dans son inventaire, et le range dans son coffre ! Mais, Azpaz va secrètement derrière son dos et les vole quand il ne regarde pas ! Ratman découvrira-t-il qui le vole ? Ou Azpaz s'en tirera-t-il ? Regardez pour le savoir !IP DE MON SERVEUR : nulcraft.frMontage par le bossMail pour tout contact commercial : azpaztv@gmail.comMon Twitter : https://www.twitter.com/azpaztvMon Discord  + de nulcraft : https://discord.gg/EBPCS6YF9eMerci pour les 300k road to 400kCe n'est pas Minecraft, Mais l'eau monte ou Minecraft, mais la lave monte, ou Survivre 100 jours dans Minecraft, ou tout type de défi dans Minecraft mais. Il s'agit d'un speedrun / Manhunt . ShortsDans cette vidéo Minecraft 1.20 (1.21 et non 1.19, 1.18 ou 1.17), je répondrai à toutes les questions que vous me poserez sans faire une seule exception. Il y a des questions embarrassantes, des questions intéressantes et beaucoup d'entre elles tout simplement stupides XD Cette vidéo est l'une de mes préférées que j'ai faites, alors profitez-en :)Ce n'est pas Minecraft dans la vraie vie, pas l'édition éducative de Minecraft, pas Minecraft, mais vous pouvez en couper un morceau entier. Cela répond à vos questions les plus litigieuses/absurdes.Je vous aime tous beaucoup!"
"A3tQpki0yd4","[MIX & MAX] TXT YEONJUN & HUENINGKAI (연준&휴닝카이) 'TEMPTED + The Devil I Know' (4K)","2023-07-28T14:00:06Z","UCEIi7zFR_wE23jFncVtd6-A","STUDIO CHOOM [스튜디오 춤]","24","23.30.07","M2|엠투|스튜디오 춤|스춤|Studio choom|COVERS|커버스|DANCE THE X|댄스 더 엑스|댄스|DANCE|비 오리지널|BE ORIGINAL|커버|COVER|Artist Of The Month|AOTM|Drop the dance|드롭더댄스|Mix & Max|믹스앤맥스|믹앤맥","957084","199345","0","11967","https://i.ytimg.com/vi/A3tQpki0yd4/default.jpg","False","False","[MIX & MAX] TOMORROW X TOGETHER YEONJUN & HUENINGKAI 'TEMPTED + The Devil I Know'[믹스앤맥스] 투모로우바이투게더 연준&휴닝카이 'TEMPTED + The Devil I Know'연준&휴닝카이 퍼포먼스합 미쳤다😈🔥(1:13) 연주니즈 분위기 반전 레전드임..2023.8.4 'Choreo-Record' Coming Soon* Original Track: TEMPTED Produced by MAIZ & Will Bowes ‘The Devil I Know’ * Choreographer & Performance Director: SUBIN KIM / HYUNWOO WOO / JAEPY / KAIN* Dancer: Kyungmin / Larf / Than Kim / Kori / Cobaltblue / HyunWoo / Hwi gun / Veri / Hiro / Daejun / Heonbin / Hoho[MIX & MAX] A collaborated pair performance showing the synergy of two K-POP artists, and a peek into their inner thoughts about dance.Welcome to the new K-POP Dance journey of STUDIO CHOOM with your favorite K-POP Artists!'MIX & MAX' present by 스튜디오 춤K-POP 아티스트의 시너지가 담긴 페어 퍼포먼스와 춤에 대한 깊은 이야기를 들어보는 시간#MIXandMAX #믹스앤맥스Stream various performance video on #STUDIOCHOOM!👉SUBSCRIBE👈YouTube: https://www.youtube.com/STUDIOCHOOMFacebook:  https://www.facebook.com/StudioCHOOMInstagram: https://www.instagram.com/studio_choom/Naver TV: https://tv.naver.com/cjenm.STUDIOCHOOM"
"pNKxI6NeJD4","Kushi Title Song - Lyrical | Vijay Deverakonda, Samantha | Hesham Abdul Wahab | Shiva Nirvana","2023-07-28T12:31:11Z","UC68nKdrLbLL0Vj7ilVkLmmg","Saregama Telugu","10","23.30.07","kushi title song|kushi song|Vijay Devarakonda|Samantha|kushi|kushi songs|aaradhya song kushi|kushi telugu songs|kushi second single|kushi vijay devarakonda|kushi samantha|latest telugu songs|kushi telugu single|vijay devarakonda songs|vijay devarakonda new movie|kushi song promo|Kushi songs|samantha|vijay devarakonda kushi movie|samantha ruth prabhu|telugu love songs|Aradhya song promo|trending songs telugu|Telugu Love songs","6112532","122050","0","2747","https://i.ytimg.com/vi/pNKxI6NeJD4/default.jpg","False","False","Here is the most awaited 'Kushi - Title Song' starring Vijay Deverakonda, Samantha & Others. A Shiva Nirvana Entertainer. A Hesham Abdul Wahab Musical.KUSHI TITLE SONG TELUGUMusic Composed, Arranged & Programmed by Hesham Abdul WahabLyrics by Shiva NirvanaSung by Hesham Abdul WahabChoreographer Brindha MasterMusician Credits: Saaz & Oud: Tapas RoyBass Guitar: Sumesh ParameswarMridangam: D.A Srinivas Strings: Chennai StringsMusic Assistants: Suroor Musthafa & George Thomas PVArtist Co-ordination: K.D Vincent & Don VincentSong Mixed and Mastered byEric Pillai (Future Sound Of Bombay)Recording Engineers:Suroor Musthafa  @HW Studio (Cochin)George Thomas PV @HW Studio (Cochin) Biju James @UNO Records (Chennai)Naresh Mamindla @Jubilee10 Studios (Hyderabad)Rakesh Mikky @Jubilee10 Studios (Hyderabad)Midhun Manoj @Soundtown Studios (Chennai)Vishnu Shankar @Soundtown Studios (Chennai)Rahul @Studio504 (Mumbai)Audio Recording Studios:HW Studio (Cochin)UNO Records (Chennai)Jubilee10 Studios (Hyderabad)Soundtown Studios (Chennai) Studio504 (Mumbai)Cast - Vijay Deverakonda, Samantha Ruth Prabhu, Jayaram, Sachin Khedakar, Murali Sharma, Lakshmi, Ali, Rohini, Vennela Kishore, Rahul Ramakrishna, Srikanth Iyengar and Saranya PradeepTechnical Crew:Make Up : BashaCostumes : P.VenkatStylist: RajeshProduction Executive: Denkala RamaKrishna Production Controller: Shaik Shekshavali Art Directors : Uttara kumar Surisetty, ChandrikaStunts : Peter Hein, V.Venkat Choreography: Choreography: Raju Sundaram, Brinda, Pony VermaP.R.O : GSK MediaWriting Assistance : Naresh babu.PPublicity Designer: KabilanCo-Director: Suresh kumarProduction Designer: Jayashree LakshminarayananExecutive Producer : Dinesh NarasimhanEditing : Prawin PudiMusic : Hesham Abdul WahabD.O.P : G.MuraliC.E.O : CherryMarketing : First ShowColorist : Vivek Anand Mix Engineer : kannan ganapathSound design: Sync CinemaD.I & SOUND MIX : ANNAPURNA STUDIOS VFX : MATRIXPRODUCERS : NAVEEN YERNENI RAVI SHANKAR YELAMANCHILI STORY - SCREENPLAY - DIALOGUES - DIRECTION : SHIVA NIRVANALyrics:Kushi nuvvu kanabadithe…(Male) Kushi nee maata vinabadithe…PALLAVI: Hey… Nechheli nechheli vachhi visirinadhi vechhani vechhani valaHey… Muchhatagaa nannu gilli gichhinadhi kalaHey… Vennela vennela velli virisinadhi kannula kannula milaHey… Langaru dhaati dhooki ponginadhi alaHey… Nuvvu nenu saath hein Neethone naa pyaar hein Yegase prema rang rang barasath heinREPEAT HOOK: Kushi nuvvu kanabadithe…Kushi nee maata vinabadithe…Kushi nuvvu jatha kadithe…Kushi naa ollantha thullinthe…CHARANAM: 1 Thumhaara matthulo… yelaa paddano pichhi gaHamaara maayalo… ila thelaane haayigaNijam ne cheppanaa… nuvve le naaku aashiqui…Pramanam cheyyanaa… sadhaa neethone zindagi…Dil mein dhadkan… nee oopiri thagilindho…Mann mein thoofan… ninu thaakina aa nimisham…REPEAT PALLAVI: Hey… Nechheli nechheli vachhi visirinadhi vechhani vechhani valaHey… Muchhatagaa nannu gilli gichhinadhi kalaHey… Nuvvu nenu saath hein… Neethone naa pyaar hein… Yegase prema rang rang barasath hein…REPEAT HOOK: Kushi nuvvu kanabadithe…(Male) Kushi nee maata vinabadithe…Kushi nuvvu jathakadithe…Kushi naa ollantha thullinthe…Label: Saregama India Limited, A RPSG Group CompanyTo buy Carvaan, visit https://www.saregama.com/carvaan/teluguTo buy virus free original tracks, visit  https://www.saregama.com/musicstoreFollow us on: YouTube:https://www.youtube.com/channel/saregamateluguFacebook: http://www.facebook.com/SaregamateluguTwitter: https://twitter.com/saregamasouth​​#KushiTitleSong #VijayDeverakonda #Samantha #SaregamaTelugu"
"II-L8Hq0_i4","Tyler Childers - In Your Love (Official Video)","2023-07-27T12:00:08Z","UCAJFKfQOt3SsccXg5QOcZKQ","TylerChildersVEVO","10","23.30.07","tyler childers|can take my hounds to heaven|angel band|tyler childers whitehouse road|tyler childers live|tyler childers jersey giant|tyler childers angel band|tyler childers silas interview|silas interview|tyler childers interview|tyler childers shake the frost|tyler childers all yourn|tyler childers feathered indian|tyler childers all yourn live|tyler childers all yours|silas house|in your love|in your love tyler childers","2251441","60376","0","11711","https://i.ytimg.com/vi/II-L8Hq0_i4/default.jpg","False","False","“In Your Love” is out now: https://tchilders.lnk.to/inyourlovePre-Order Rustin’ in the Rain now: https://tchilders.lnk.to/rustinintherainFollow Tyler on Socials:Official site: https://tylerchildersmusic.com/collections/allFacebook: https://facebook.com/tylerchildersmusic/Instagram: https://www.instagram.com/timmytychilders/Twitter: https://twitter.com/TTChildersTikTok: https://www.tiktok.com/@timmytychildersmusicLyrics:I will wait for youTil the sun turns into ashesAnd bows down to the moonI will wait for youIt’s a long hard warAh but I can grin and bare itCause I know what the hell I’m fighting forAnd I will wait for youWe were never made to run foreverWe were just meant to go long enoughTo find what we were chasing afterI believe I found it here in your love I will stand my groundI’m a bad man looking for takers You’re the finest thing aroundSo I will stand my ground  Cause it’s cold out thereAnd you know some men search for agesFor the love that I have found So I will stand my ground We were never made to run foreverWe were just meant to go long enoughTo find what we were chasing afterI believe I found it here in your love Honey I will wait for youHoney I will stand my groundI will work for youTil my hands are tired and bleedin’I know what it is from us I’m needin’I will work for youLike a team of mulesPulling Hell off from its hingesIt’s the love that I’ll keep tendin’ I will work for youWe were never made to run foreverWe were just meant to go long enoughTo find what we were chasing afterI believe I found it here in your love Honey I will wait for youHoney I will stand my groundI will work for you I will stand my groundPRODUCTION DIRECTOR – Bryan SchlamWRITTEN BY – Silas House PRODUCED BY– Kacie BartonPRODUCED BY– Whitney WolaninPRODUCED BY – Nicholas RobespierrePRODUCED BY– Ian Thornton PRODUCED BY – Silas HouseSTORY BY – Silas House and Jason Kyle HowardPARTNER – Mark De Pace PARTNER – Zachary MortensenEXEC PRODUCER – Kacie BartonMANAGING DIRECTOR – Alexis Kaplan HEAD OF BUSINESS DEV – Justin Medley STAFF COORDINATOR – Andrea Tangelo LINE PRODUCER – Whitney WolaninPRODUCTION SUPERVISOR – Loren Greene DIRECTOR OF PHOTOGRAPHY – Doug Porter PRODUCTION DESIGNER – Amanda Alberto WARDROBE STYLIST– Samantha Roe HMU – Nichole Lim CASTING – Harriet Greenspan  1st AD – Eric Williams 2nd AD – Quinn Cooke  POST PRODUCTION  - Ghost RobotPOST PRODUCTION – Kacie Barton EDITOR – Bryan SchlamVFX – John StanchCOLOR – Company 3 – Matt Osbourne COLOR PRODUCER – Dan Butler / Matt Moran  TALENT JASPER – Colton Haynes MATTHEW – James Scully NED – Matthew James Ballinger ELDER JASPER – James Carey MINERS -Thomas De Braun -Brent Greene -Russell Terry -Benjamin Wilson FARMER – Silas House FRIENDS -Adam Tanaka -Andi Tillman -Dara Tiller -Casey CampbellDOCTOR – Robert RidhageBARTENDER – Ashley Barber BAR PATRONS -Cameron Bortz-Hunter Jones -William Arthur-Steven Handeland-Courtne Moran -Kayla Powell-Jason Howard-Reece Hassell LABEL – RCA RECORDSVP, Video & Visual Content Production - Nicholas Robespierre Director, Video & Visual Content Production - Win Smith Marketing – Aaron SternMANAGEMENT Manager – Ian ThorntonManager – Michael Corcoran #TylerChilders #InYourLove #RustinInTheRain"
"7jLQRqMI_Uc","Canada vs. Republic of Ireland Full Highlights - FIFA Women's World Cup, 2023","2023-07-26T14:45:17Z","UC--i2rV5NCxiEIPefr3l-zQ","TSN","24","23.30.07","Women's World Cup|WWC|WWC2023|FIFAWWC|Canada|Canada WNT|Ireland|Republic of Ireland|Adriana Leon|Julia Grosso|Katie McCabe|FIFA|Soccer|TSN","208079","1636","0","393","https://i.ytimg.com/vi/7jLQRqMI_Uc/default.jpg","False","False","With a scrappy Republic of Ireland squad facing elimination, Canada knew they were in tough. Here are the full highlights from Group B action at the Women's World Cup."
"d1zyuhHhJbw","This Team Just Set The Craziest Record In All Of Basketball","2023-07-28T00:54:41Z","UC3L9XPe0_FGfRG-CMGtBvFg","JxmyHighroller","17","23.30.07","LeBron James|House of Highlights|ESPN|NBA highlights|Jimmy Highroller|NBA trash talk|Buzzer Beaters|Brooklyn Nets|Ankle Breakers|NBA Championship|Rebound|Stephen Curry|Lakers|nba breaking news|Lakers trade|Kevin Durant trade|Russell Westbrook trade|LeBron scoring record|Nikola Jokic|Jimmy Butler|Miami Heat|Victor Wembenyama|Michael Jordan|kobe bryant|in season tournament|kyrie|nba free agency|nba summer league|Chet Holmgren|million dollar shot","722915","35121","0","1532","https://i.ytimg.com/vi/d1zyuhHhJbw/default.jpg","False","False","Don’t miss out on all the action this week at DraftKings!  Download the DraftKings app today! Sign-up using https://dkng.co/jxmyhighroller or through my promo code JXMYHIGHROLLERGambling Problem? Call1-800-GAMBLER (1-800-426-2537) (CO/IL/IN/LA/MD/MI/NJ/OH/PA/TN/WV/WY), (800) 327-5050 or visit gamblinghelplinema.org (MA), Call 877-8-HOPENY/text HOPENY (467369) (NY). Please Gamble Responsibly. Call 1-800-NEXT STEP (AZ), 1-800-522-4700 (KS/NH), 888-789-7777/visit ccpg.org (CT), 1-800-BETS OFF (IA), visit OPGR.org (OR). 21+ (18+ NH/WY). Physically present in AZ/CO/CT/IL/IN/IA/KS/LA(select parishes)/MA/MI/MD/NJ/NY/OH/PA/TN/VA/WV/WY only. Void in NH/OR/ONT. Eligibility restrictions apply. Valid 1 per new customer. Min. $5 deposit. Min. $5 bet. $150 issued as bonus bets that expire 7 days (168 hours) after being awarded. See terms at sportsbook.draftkings.com/boxingterms. On behalf of Boot Hill Casino & Resort (KS). Ends 8/20/23 at 11:59PM ET. Sponsored by DK.Follow me on Instagram: https: //www.instagram.com/jxmyhighroller Be sure to subscribe and turn on notifications for the latest content from ya boy Jxmy! We doin this a couple times a week, every week! *Copyright Disclaimer Under Section 107 of the Copyright Act 1976, allowance is made for fair use for purposes such as criticism, comment, news reporting, teaching, scholarship, and research. Fair use is a use permitted by copyright statute that might otherwise be infringing. Non-profit, educational or personal use tips the balance in favor of fair use. No copyright infringement intended. ALL RIGHTS BELONG TO THEIR RESPECTIVE OWNERS"
"YqKBJYDnOZU","아는누나랑나불","2023-07-28T09:00:32Z","UCQ2O-iftmnlfrBuNsUUTofQ","채널 십오야","24","23.30.07","나영석|나PD|아간세|아이슬란드간세끼|이수근|수근세끼|은지원|지원세끼|삼시세끼|세끼|신효정|나피디|묘한이|tvN|라끼남|라면|라면끼리는남자|강호동|양정우|육봉선생|6봉선생|라면먹방|마포멋쟁이|마포|멋쟁이|송민호|표지훈|민호|지훈|피오|MINO|PO|P.O|위너|WINNER|송표|표송|패션|패션유튜버|패션유튜브|삼시네세끼|달나라공약이행프로젝트|달나라프로젝트|달나라|젝스키스|젝키|Sechs Kies|슬의|슬기로운하드털이|슬의생|신원호|조정석|유연석|장겨울|hospitalplaylist|이식당|나홀로이식당|나노|우주|김준|어깨춤|언제까지어깨춤을추게할거야|규현|조규현|조정뱅이|슈퍼주니어|superjunior|슈주|악마는정남이를입는다|악마정남|배정남|출장십오야|출장|슬기로운캠핑생활|캠핑생활|슬캠|내과박원장|이서진|BH|BTS|하이브|hybe|스타쉽|starship|txt|르세라핌|lesserafim|세븐틴|seventeen|지구오락실|지락실|토롱이","1087584","19714","0","1027","https://i.ytimg.com/vi/YqKBJYDnOZU/default.jpg","False","False","세계적 미녀와 화려한 나불 속으로... 2편에서 또 나불[나불나불_염정아 1편 타임라인]00:00 정아 도착00:15 식혜 사령관01:01 대혼돈의 메뉴선정01:47 속눈썹 붙였잖앙.02:31 웃수저의 역사03:31 제일 바빴던 시기04:27 화-려했던 데뷔05:01 미스코리아의 시작05:42 91년도 픽06:19 미코 후보의 to do list 06:57 내 눈물 모아07:46 땡스 투 호정 원장님08:22 상금보단 화려10:19 [밀수].ssul10:40 수중연기 도전기11:34 숨 참고 어촌편 다이브12:10 산에 있자❤️12:24 정아의 안 미지근한(?) 인생12:45 배우 염정아13:28 격정 멜로 치정 멜로14:22 연기 장인15:08 좋아해, 연기하는 거❤️15:54 배우 인생의 위기17:23 [밀수] 촬영장 비하인드18:50 이서진 맛집의 비밀19:57 정아의 구독 목록20:14 정아의 관리 비법#채널십오야 #나불나불 #염정아"
"OOGPIeAmZG8","$40 TINY Kitchen is TOO BIG! Miniverse Make It Mini Kitchen Unbox Review","2023-07-28T15:46:01Z","UCgtBufRyeqqVCwbNLx-bPhQ","NerdECrafter","24","23.30.07","crafts|miniverse kitchen|make it mini kitchen|make it mini kitchen miniverse|make mini kitchen set|miniverse make it mini lifestyle|miniverse make it mini food series 2|series 2 cafe|series 2 diner|make it mini lifestlye|miniverse lifestlye|unbox|review|mystery box resin|craft mystery box","174819","7139","0","585","https://i.ytimg.com/vi/OOGPIeAmZG8/default.jpg","False","False","Unbox Review Miniverse Make it Mini Kitchen viral craft mystery box. Sponsor: Sponsor: Download Temu App: https://temu.to/k/usQeKnRRw3mqw7i to get 50% off for APP new users. Or you can apply code [dke9462] within 1 hour after downloading TEMU app. in this video, we are unboxing the viral diy resin mystery boxes known as make it mini foods. We have unbox series 1 miniverse make it mini cafe series 1, diner series 1 BUT we also did cafe series 2 and diner series 2. i also bought miniverse make it mini lifestyle and hopefully will do a review soon.JAZZA'S KICKSTARTER: https://www.kickstarter.com/projects/carryallstudio/the-carry-all-studio?ref=qocy8j💛💛Items/ Videos mentioned in today's episode:Visit Temu here: https://temu.to/m/usTkoiWuduM6qdl to save more and shop various craft & mini decorations.Temu offers:-FREE shipping +FREE returns for up to 90 days-AfterPay & Secure Payment-Save big this summer Up To 90% off！LINKS TO ALL ITEMS SHOWN IN THIS VIDEO：(1 Mini Express Box + 4 Mini Bottles) Resin Decoration Toys $1.69💰https://temu.to/m/ud0s4r2pbjgDinosaur Mini Water Dispenser Toy $4.49💰https://temu.to/m/um87r7zu8ceMini Simulation Juicer Coffee Machine $2.99💰https://temu.to/m/u48xz6dwmgg1:12 Doll House Kitchen Miniature Ornaments $5.49💰https://temu.to/m/ulf1yiqhsr0Metal Toaster Dollhouse Bread Machine $2.65💰https://temu.to/m/umet443it3r1:6 Cute Dollhouse Mini Coffee Cup $1.79💰https://temu.to/m/ucgd9c6ql0z15Pcs Vintage Miniature White Porcelain Tea Set $3.69💰https://temu.to/m/uznmtcdx2zp-They Made NEW ONES?! Viral Miniature Craft Mystery Box! Mini Verse Make it Mini Food Cafe: https://youtu.be/wXacDZ2_43U-The MOST Viral Miniature Craft Mystery Box Ever! Mini Verse Make it Mini Food: https://youtu.be/yIe2oEkpOd0-OBSESSED! Viral Miniature Craft Mystery Box! Mini Verse Make it Mini Food Cafe: https://youtu.be/eK4anq6nkLI-I NEEDED MORE! Viral Miniature Craft Mystery Box! Mini Verse Make it Mini Food: https://youtu.be/otW7yyiygD8💜💛 Want to support future projects on my channel? Feel free to check out my YouTube Memberships and Perks: https://www.youtube.com/channel/UCgtBufRyeqqVCwbNLx-bPhQ/join --------------------------MY VLOG CHANNEL: https://goo.gl/uv2Zal-------------------------------Hi fellow grains! My name is Jackie and I love crafting geeky diys. I mainly do polymer clay tutorials, but I also do resin crafting, felt diys, and custom diy soap on my channel, but I love experimenting and having fun! Let's go on this diy crafting journey together ^_^ Remember to hashtag Nerdecrafter on Instagram if you make anything geeky. Also, if you share my videos, you automatically get love and sparkles (ﾉ◕ヮ◕)ﾉ*:･ﾟ✧-----------------------------My gear:- Face Camera: Lumix G95- Desk Camera: Sony FDR-AX 100Streaming:- Elgato Stream Deck- Logitec Brio 4k webcam- MSI LaptopMY TWITCH: https://www.twitch.tv/nerdecrafterMY INSTAGRAM:http://instagram.com/nerdecrafterMY FACEBOOK:https://www.facebook.com/NerdEcrafterMY TWITTER:https://twitter.com/NerdECraftercontents00:00:00 unbox miniverse kitchen00:01:47 sponsor00:04:09 miniverse make it mini kitchen"
"qHpLCsZ2fTs","Five Nights at Freddy's Security Breach: RUIN - Part 1","2023-07-26T03:58:32Z","UC7_YxT-KID8kRbqZo7MyscQ","Markiplier","20","23.30.07","five nights at freddys security breach|fnaf|markiplier|markiplier security breach|markiplier five nights at freddy's|five nights at freddy's|part 1|gaming|gameplay|playthrough|reactions|screaming|jump scares|freddy|chica|bonnie|golden freddy|ruin|ruin dlc|security breach ruin","8122493","450510","0","22227","https://i.ytimg.com/vi/qHpLCsZ2fTs/default.jpg","False","False","The first official free roam Five Nights at Freddy's game got it's first DLC! Step back into the Pizzaplex and explore the Ruin we left behind.LISTEN TO DISTRACTIBLE ►► https://open.spotify.com/show/2X40qLyoj1wQ2qE5FVpA7xPlay FNAF Security Breach RUIN ► https://store.steampowered.com/app/1924720/Five_Nights_at_Freddys_Security_Breach__Ruin/Scary Games Playlist ► https://www.youtube.com/playlist?list=PL3tRBEVW0hiBSFOFhTC5wt75P2BES0rAoHorror Outro ► https://soundcloud.com/shurkofficial/haunted"
"X2q9NBiQFx8","Sanbiev VS Hater ! Enfin il Combat YFC#52","2023-07-28T16:39:09Z","UCmIoN2ICieMp1hX2R_VmYkg","IbraTV","17","23.30.07","ibratv|poce blo|free fire|mma|ufc|mixed martial arts|combat sports|ultimate fighting championship|mma fighting|yfc","413905","13906","0","2516","https://i.ytimg.com/vi/X2q9NBiQFx8/default.jpg","False","False","Enfin Sanbiev fait un combat, j'espère que les combats vont vous plaire ! CODE PROMO MY PROTEIN «IBRA» : https://tidd.ly/3BlLBVAPour avoir 43% de réduction sur tout le site pendants 24h à partir de la sortie de la vidéo.Greffe de Cheveux/BarbeBELLA HAIR Whatsapp: +90 535 685 83 93www.bellahair.fr Instagram: bellahairclinicClinique Dentaire BELDENTE Whatsapp: +90 552 534 99 34www.beldente.fr Instagram: beldente.frAdresse de nos restorants Black and White Burger :1er       73 Boulevard de Clichy 75009 paris2eme   31 rue Saint denis 75001 Paris3eme   Centre Commercial STEEL, 2 Rue Ferrer, 42000 Saint-Étienne4eme   Boulevard Anspach 4, 1000 Bruxelles, Belgium5eme   1 RUE DE NEMOURS. 35000 RENNES6eme :  Blackandwhiteburger Docks bruxellesSuivez les actualités de notre restaurant sur:https://www.instagram.com/blackandwhiteburgerMon Instagram: https://www.instagram.com/ts_ibra/Mail Pro : ibrapluspro@gmail.com"
