video_id,title,publishedAt,channelId,channelTitle,categoryId,trending_date,tags,view_count,likes,dislikes,comment_count,thumbnail_link,comments_disabled,ratings_disabled,description
"GHSjp_JYBcw","1945 K Ration Breakfast Units MRE Review Meal Ready to Eat Tasting Test & Surprising Food Discovery","2023-07-27T01:38:30Z","UC2I6Et1JkidnnbWgJFiMeHA","Steve1989MREInfo","24","23.30.07","mre|ration|army|food|military|meal|ready|to|eat|pack|survival|camping|emergency|ASMR|steve1989|mreinfo|steve|mci|korea|vietnam|gulf|modern|civilian|packaged|packet|oldest|eaten|tasting|crazy|rarest|coolest|amazing|SHTF|review|MRE|Steve|Taste|Test|Steve1989 MRE Taste Test|MRE Steve|Meal Ready to Eat","602681","33397","0","3573","https://i.ytimg.com/vi/GHSjp_JYBcw/default.jpg","False","False","Two K Ration Breakfast units in opposite condition. Stick around for the second one. It's still to this day, by far the most pristine and well preserved example of one I've ever found. History on the K ration in a simple and straightforward approach, and with one surprising food discovery after another.Finally out from my video archives due to locating better photos and the recent composition of more a more traditional music track.(An early preview short version of the music used in one of my most important upcoming WW2 ration reviews on something that may never be seen again after that video is released.)https://www.patreon.com/user?u=2821334&ty=hTo send a Military Ration for review, my exact mailing information is: Steve19893616 Harden Blvd360Lakeland, FL 33803 https://teespring.com/stores/steve1989"
"NPd83ZO1jZ8","NLE Choppa- It’s Getting Hot [Official Music Video] (NELLY TRIBUTE)","2023-07-27T22:00:39Z","UCWICXNlSLc7eeNazpzUZcLg","NLE CHOPPA","10","23.30.07","nle choppa|nle|choppa|getting hot|its getting hot|nle choppa nelly|nelly nle choppa|nle choppa music|nle choppa its getting hot|it's getting hot|gettin hot|nle choppa new|Official Music Video|itsgettinghot|new music|hip hop|nelly|nelly tribute|its getting hot nelly|nelly it's getting hot in here|nle chopa|nle choppa videos|nle choppa music video|choppa hot in here|choppa new video|nle choppa hot in here|nle choppa hot in here video|nle choppa sexy","482921","36153","0","3532","https://i.ytimg.com/vi/NPd83ZO1jZ8/default.jpg","False","False","NLE Choppa- It’s Getting Hot [Official Music Video]Stream Cottonwood 2 now: https://nlechoppa.lnk.to/Cottonwood2🔔 Subscribe to my channel: http://bit.ly/2vNE1CWWEBSITE: MERCHhttps://nlechoppa.warnerrecords.com/Follow NLE Choppa:Txt: (901) 245-5603Web: https://nlechoppa.comEmail:  https://nlechoppa.com/mailing-listInstagram: https://instagram.com/nlechoppamusicFacebook: https://facebook.com/nlechoppamusicTwitter: https://twitter.com/nlechoppa1Snapchat: https://snapchat.com/add/nlechoppamusicTikTok: https://www.tiktok.com/@nlechoppamusicTriller: https://triller.co/@nlechoppa#nlechoppa #itsgettinghot #hiphop #newmusic"
"GMNTkFv6iG8","Season 05 Launch Trailer | Call of Duty: Modern Warfare II & Warzone","2023-07-27T16:00:07Z","UC9YydG57epLqxA9cTzZXSeQ","Call of Duty","20","23.30.07","call of duty|cod|activision|New Warzone Map|Vondel|Modern Warfare II|Warzone|COD|video game|gaming|online gaming|multiplayer|game|fps|first person shooter|blizzard|xbox|playstation|pc|maps|call of duty maps|new call of duty games|new call of duty seasons|warzone|modern warfare|new games|games|gaming updates|call of duty updates|new releases|new|teaser|trailer|season 5|MWII Season 5|Modern Warfare II Season 5|Warzone Season 5|Season 5|call of duty season 5","224538","9466","0","1368","https://i.ytimg.com/vi/GMNTkFv6iG8/default.jpg","False","False","When darkness falls, the shadows will rise 🌑Shadow Company and Task Force 141 face off in Season 05 of Call of Duty #Warzone and #MWII Which side will you choose?Follow #CallofDuty for the latest intel:Twitter: http://twitter.com/CallofDutyInstagram: http://instagram.com/callofdutyFacebook: http://facebook.com/CallofDutyTikTok: http://www.tiktok.com/@callofduty#ModernWarfare2 #Warzone"
"hfy6X1VYIZI","Game Theory: FNAF, The AI Uprising! (Security Breach Ruin)","2023-07-25T19:05:09Z","UCo_IB5145EVNcf8hw1Kku7w","The Game Theorists","20","23.30.07","Five nights at freddys|fnaf|fnaf ruin|ruin|ruin dlc|ruin fnaf|five nights at freddys ruin|ruin gameplay|fnaf ruin game|fnaf ruin gameplay|fnaf dlc|new fnaf|new fnaf dlc|glitchtrap|mimic|freddy|afton|five nights at freddys new dlc|ruin lore|fnaf ruin theory|ruin explained|fnaf ruin dlc|steel wool studios|steel wool|fnaf ruin dlc release date|game theory|matpat|game theorists|five nights at freddys trailer|fnaf mimic|fnaf ruin mimic|ruin mimic","3279713","171843","0","11105","https://i.ytimg.com/vi/hfy6X1VYIZI/default.jpg","False","False","Special thanks to Rise Of Kingdoms for sponsoring this video!Conquer with Greece. Rise to Greatness. Download Rise of Kingdoms: https://bit.ly/GreeceRoK_TGT Join the amazing Civilization Clash Event: https://www.rok.games/?kol=TheGameTheorists, vote for Greece, re-make history! Win amazing awards like Apple Vision Pro, Sony PS5 and Nintendo Switch OLED!Use promo code GREECE4ROK and get 20 SILVER KEYS!Friends, Ruin is finally here! The game we’ve been waiting for has finally arrived and you know I just HAD to get one more theory in before it proves me totally wrong! After finally catching up on all of the graphic novels, books, short stories, epilogs, and EVERYTHING else this franchise has to offer, I’ve got one final prediction about where the future of Five Nights At Freddy's is heading. So ALT + F4 out of everything else and settle in for a nice little pre-ruin appetizer. ‐‐‐‐‐‐‐‐‐‐‐‐‐‐‐‐‐‐‐‐‐‐‐‐‐‐‐‐‐‐‐‐‐‐‐‐‐‐‐‐‐‐‐‐‐‐‐‐‐‐*🔽 Don’t Miss Out!*Get Your TheoryWear! ► https://theorywear.com/Dive into the Reddit! ► https://www.reddit.com/r/GameTheorists/Need Royalty Free Music for your Content? Try Epidemic Sound.Get Your 30 Day Free Trial Now ► http://share.epidemicsound.com/MatPat‐‐‐‐‐‐‐‐‐‐‐‐‐‐‐‐‐‐‐‐‐‐‐‐‐‐‐‐‐‐‐‐‐‐‐‐‐‐‐‐‐‐‐‐‐‐‐‐‐‐*👀 Watch MORE Theories:*FNAF, The ULTIMATE Timeline (Part 1) ►► https://youtu.be/gWOXSh4-IucFNAF, Origins Of Evil ►► https://youtu.be/ZfomNvIEX74FNAF, I Solved Ruin ►► https://youtu.be/kRsAOW2zE20‐‐‐‐‐‐‐‐‐‐‐‐‐‐‐‐‐‐‐‐‐‐‐‐‐‐‐‐‐‐‐‐‐‐‐‐‐‐‐‐‐‐‐‐‐‐‐‐‐‐*SUBSCRIBE to Game Theory!*https://www.youtube.com/@GameTheory/?sub_confirmation=1‐‐‐‐‐‐‐‐‐‐‐‐‐‐‐‐‐‐‐‐‐‐‐‐‐‐‐‐‐‐‐‐‐‐‐‐‐‐‐‐‐‐‐‐‐‐‐‐‐‐*Join Our Other YouTube Channels!*​🎥    @FilmTheory 🍔    @FoodTheory  👔    @StyleTheorists  ‐‐‐‐‐‐‐‐‐‐‐‐‐‐‐‐‐‐‐‐‐‐‐‐‐‐‐‐‐‐‐‐‐‐‐‐‐‐‐‐‐‐‐‐‐‐‐‐‐‐*Credits:*Writers: Matthew Patrick, and Tom RobinsonEditors: Dan Cybert Seibert,Tyler Mascola, Koen Verhagen, Danial BanditRants Keristoufi, Daniel Zemke, Dom Sealion, and KL AllenSound Designer: Yosi Berman‐‐‐‐‐‐‐‐‐‐‐‐‐‐‐‐‐‐‐‐‐‐‐‐‐‐‐‐‐‐‐‐‐‐‐‐‐‐‐‐‐‐‐‐‐‐‐‐‐‐#FNAF #FiveNightsAtFreddys #FNAFRuin #RuinDLC #FNAFSB #FNAFLore #FNAFTheory #FNAFSecurityBreach #Theory #GameTheory #Matpat"
"GMk8DhcsvjA","Highlights | West Indies v India | Kishan and Kuldeep Star | 1st CG United ODI","2023-07-27T19:48:28Z","UC2MHTOXktfTK26aDKyQs3cQ","Windies Cricket","17","23.30.07","cricket|cricket west indies|west indies|windies|west indies cricket team|cricket highlights|cricket highlights match today|west indies vs india|west indies india cricket|virat kohli|rohit sharma|bcci cricket","3141427","34600","0","1310","https://i.ytimg.com/vi/GMk8DhcsvjA/default.jpg","False","False","Watch highlights of the 1st ODI between West Indies v India during the CG United ODI Series powered by Yes Bank at Kensington Oval, BridgetownThis is the official channel for the West Indies cricket team, providing all the latest highlights, interviews and features to keep you up to date with all things Windies. Subscribe to the channel here!https://www.youtube.com/channel/UC2MHTOXktfTK26aDKyQs3cQ?view_as=subscriberFind out more about the Windies at:http://Windiescricket.com"
"irFAiINM1-s","FNAF Ruin Is FINALLY Out! | Five Nights At Freddy’s Security Breach RUIN DLC","2023-07-25T20:01:09Z","UCAaegDUlb7doIKo0Rc1F08g","GTLive","20","23.30.07","Five nights at freddys|fnaf|fnaf ruin|ruin|ruin dlc|ruin fnaf|five nights at freddys ruin|fnaf ruin playthrough|ruin playthrough|ruin gameplay|fnaf ruin game|fnaf ruin gameplay|fnaf dlc|new fnaf|new fnaf dlc|glitchtrap|mimic|freddy|afton|five nights at freddys new dlc|ruin lore|fnaf ruin theory|ruin explained|fnaf ruin dlc|steel wool studios|steel wool|fnaf ruin dlc release date|game theory|matpat|gtlive|fnaf ruin vanny|fnaf mimic ruin|ruin mimic","1766158","69353","0","7161","https://i.ytimg.com/vi/irFAiINM1-s/default.jpg","False","False","Game Theory Is Now Available On SPOTIFY!Check Out Some Of Your Favorite Episodes On Spotify! ► https://tinyurl.com/GameTheorySpotifySpecial thanks to Steffi Grace for her help with this episode!Friends, today is the day! Ruin is here! No more wondering about what the new Security Breach DLC is gonna be like, it’s time to dive in there and get PLAYING! I am SO excited to start this playthrough with you all. Even better, we’re diving into Five Nights at Freddy’s with a special guest! Game Theory Creative Director Tom (@DapperMrTom ) and I will be pulling all the new LORE out of this new update. Now let’s get in there and find out what’s going on in the DLC… and hope my FNAF timeline isn’t RUINed! The game on steam ► https://store.steampowered.com/app/747660/Five_Nights_at_Freddys_Security_Breach/‐‐‐‐‐‐‐‐‐‐‐‐‐‐‐‐‐‐‐‐‐‐‐‐‐‐‐‐‐‐‐‐‐‐‐‐‐‐‐‐‐‐‐‐‐‐‐‐‐‐*🔽 Don’t Miss Out!*Get Your TheoryWear! ► https://theorywear.com/Dive into the Reddit! ► https://www.reddit.com/r/GameTheorists/0:00 - The Witty Breakdown7:08 -  he could walk through walls, disappear and fly1:35:15 - The Witty Wrap UpNeed Royalty Free Music for your Content? Try Epidemic Sound.Get Your 30 Day Free Trial Now ► http://share.epidemicsound.com/GTLive‐‐‐‐‐‐‐‐‐‐‐‐‐‐‐‐‐‐‐‐‐‐‐‐‐‐‐‐‐‐‐‐‐‐‐‐‐‐‐‐‐‐‐‐‐‐‐‐‐‐*👀 Watch MORE Episodes:*FNAF Help Wanted 2 Reaction ►► https://youtu.be/ZcLm7Wq4l4UFNAF Ruin Trailer Reaction ►► https://youtu.be/oHtHnrc9yVcFNAF Mechanism (Fangame) ►► https://youtu.be/e42bY9GcKSw‐‐‐‐‐‐‐‐‐‐‐‐‐‐‐‐‐‐‐‐‐‐‐‐‐‐‐‐‐‐‐‐‐‐‐‐‐‐‐‐‐‐‐‐‐‐‐‐‐‐*SUBSCRIBE to GTLive!*https://www.youtube.com/@GTLive/?sub_confirmation=1‐‐‐‐‐‐‐‐‐‐‐‐‐‐‐‐‐‐‐‐‐‐‐‐‐‐‐‐‐‐‐‐‐‐‐‐‐‐‐‐‐‐‐‐‐‐‐‐‐‐*Join Our Other YouTube Channels!*​🕹️ @GameTheory    ​🎥 @FilmTheory     🍔 @FoodTheory      👔 @StyleTheorists     ‐‐‐‐‐‐‐‐‐‐‐‐‐‐‐‐‐‐‐‐‐‐‐‐‐‐‐‐‐‐‐‐‐‐‐‐‐‐‐‐‐‐‐‐‐‐‐‐‐‐#FNAF #FiveNightsAtFreddys #Ruin #FNAFSB #SecurityBreach #RuinDLC #FNAFSecurityBreach #FNAFRuin #FNAFDLC #GTLive #MatPat #GameTheory"
"lu3OL_waqW0","The Morning Show — Season 3 Teaser Trailer | Apple TV+","2023-07-27T13:59:52Z","UC1Myj674wRVXB9I4c6Hm5zA","Apple TV","24","23.30.07","tms|the morning show|the morning show season 3|season 3|morning show season 3|the morning show offical trailer|trailer|teaser|official trailer|the morning show trailer|jennifer aniston|jennifer aniston the morning show|reese witherspoon|reese witherspoon the morning show|jon hamm|billy crudup|mark duplass|nestor carbonell|greta lee|series|show|the morning show apple tv|apple tv|apple|tv|apple tv+|apple tv app|apple original|apple tv youtube|drama","9325077","2110","0","0","https://i.ytimg.com/vi/lu3OL_waqW0/default.jpg","True","False","Let all the secrets come out. The Morning Show Season 3 returns September 13 on Apple TV+ https://apple.co/_TheMorningShowIn The Morning Show season three, the future of the network is thrown into question and loyalties are pushed to the brink when a tech titan takes an interest in UBA. Unexpected alliances form, private truths are weaponized, and everyone is forced to confront their core values both in and out of the newsroom. Along with Witherspoon and Aniston, the star-studded season three ensemble cast is led by Billy Crudup, Mark Duplass, Nestor Carbonell, Karen Pittman, Greta Lee, Jon Hamm, Nicole Beharie, and Julianna Margulies.  The Emmy, SAG and Critics Choice Award-winning drama, which has already received an early renewal for season four, is directed and executive produced by Mimi Leder, with Charlotte Stoudt serving as showrunner and executive producer. The series is produced by the studio Media Res, and executive produced by Michael Ellenberg through Media Res, along with Aniston and Kristin Hahn through Echo Films; Witherspoon and Lauren Neustadter through Hello Sunshine. Leder serves as executive producer and director. Now streaming globally on Apple TV+, the broadly acclaimed second season of The Morning Show received Emmy Award nominations for Outstanding Lead Actress in a Drama Series, Reese Witherspoon; Outstanding Supporting Actor in a Drama Series, Billy Crudup, who also won the award for season one; and, Outstanding Guest Actress in a Drama Series, Marcia Gay Harden.  In its first season, Crudup’s performance as Cory Ellison earned an Emmy win in the Supporting Actor in a Drama Series category, in addition to a Critics Choice Award. Aniston's powerful performance as Alex Levy, earned a SAG Award for Outstanding Performance by a Female Actor in a Drama Series. Leder earned an Outstanding Directing For a Drama Series nomination for helming the season one finale. The series also received nominations from the Television Critics Association for Outstanding New Program and a TV Choice Award for Best New Drama.Song: “Glory” by H.E.R.Subscribe to Apple TV’s YouTube channel: https://apple.co/AppleTVYouTube Follow The Morning Show:Instagram: https://www.instagram.com/themorningshow  Twitter: https://twitter.com/themorningshow Follow Apple TV:Instagram: https://instagram.com/AppleTV Facebook: https://facebook.com/AppleTV Twitter: https://twitter.com/AppleTV Giphy: https://giphy.com/AppleTV Follow Apple Films:Instagram: https://instagram.com/AppleFilmsTwitter: https://twitter.com/AppleFilmsMore from Apple TV: https://apple.co/32qgOEJ Apple TV+ is a streaming service with original stories from the most creative minds in TV and film. Watch now on the Apple TV app: https://apple.co/_AppleTVapp Subscription required for Apple TV+ #TheMorningShow #Teaser #AppleTV"
"aaifwVfAf4E","Only Murders in the Building | Season 3 Trailer | Hulu","2023-07-26T16:07:34Z","UCE5mQnNl8Q4H2qcv4ikaXeA","Hulu","24","23.30.07","hulu|disney|hulu movies|hulu shows|only murders in the building|season 3|only murders in the building season 3|Season 3 Trailer|Trailer|official trailer|only murders in the building trailer|Only Murders returns|August 8|Charles|Oliver|Mabel|investigate a murder|investigation|murder|behind the scenes|Broadway show|Steve Martin|Martin Short|Selena Gomez|Paul Rudd|Meryl Streep|only on hulu|new season|new season August 8|Only Murders returns August 8","11287795","22961","0","761","https://i.ytimg.com/vi/aaifwVfAf4E/default.jpg","False","False","Only Murders returns August 8! Charles, Oliver & Mabel investigate a murder behind the scenes at a Broadway show. Starring Steve Martin, Martin Short,  Selena Gomez, Paul Rudd & Meryl Streep. Watch Only Murders in the Building on Hulu!ABOUT ONLY MURDERS IN THE BUILDINGThree strangers share an obsession with true crime and suddenly find themselves wrapped up in one.SUBSCRIBE TO HULU’S YOUTUBE CHANNELClick the link to subscribe to our channel for the latest shows & updates: http://www.youtube.com/hulu?sub_confiSTART YOUR FREE TRIAL http://hulu.com/start FOLLOW US ON SOCIALInstagram: https://www.instagram.com/hulu/ Hulu on Twitter: https://twitter.com/huluFacebook: https://www.facebook.com/huluABOUT HULUHulu is the leading all-in-one premium streaming service that offers an expansive slate of live and on-demand entertainment, both in and outside the home. Hulu is the only on-demand platform that provides access to a library of both hit TV Series/Films and award-winning Hulu Originals like Only Murders In The Building, The Handmaid’s Tale, The Kardashians, and more! Visit Hulu.com to subscribe now.#hulu #disney #onlymurdersinthebuildingOnly Murders in the Building | Season 3 Trailer | Huluhttps://youtu.be/aaifwVfAf4E"
"JSAXlh-4hmw","Brewstew Book Redo - If You Give A Mouse A Cookie","2023-07-26T20:41:22Z","UCepPGz8AVCbggMl3BvboaBA","brewstewfilms","23","23.30.07","brewstew|if you give a mouse a cookie|book review|stick figure|mouse cookie|cartoon|flash animation|funny story","642760","42757","0","2485","https://i.ytimg.com/vi/JSAXlh-4hmw/default.jpg","False","False","The remake that nobody asked for.Merch Store:https://teespring.com/stores/brewstewSpecial Thanks to the people that support me on Patreon!https://www.patreon.com/brewstewBrewstew.comFan Mail:P.O. Box 1Lambertville, MI48144Music:Hidden Agenda Kevin MacLeod (incompetech.com) Licensed under Creative Commons: By Attribution 3.0http://creativecommons.org/licenses/b...End Music by Mark JaySound Effects:http://www.freesfx.co.uk/"
"i2r-g3j0WjI","HIGHLIGHTS from Lionel Messi’s first start for Inter Miami vs. Atlanta United | ESPN FC","2023-07-26T01:31:12Z","UC6c1z7bA__85CIWZ_jpCK-Q","ESPN FC","17","23.30.07","[none]","4080331","88206","0","6778","https://i.ytimg.com/vi/i2r-g3j0WjI/default.jpg","False","False","Watch Lionel Messi make his starting debut for Inter Miami, scoring 2 goals and 1 assist in Leagues Cup match vs. Atlanta United. Miami would dominate Atlanta in a 4-0 clean sheet victory.✔ Subscribe to ESPN+: http://espnplus.com/soccer/youtube✔ Subscribe to ESPN FC on YouTube: http://bit.ly/SUBSCRIBEtoESPNFC"
"y8gVD6QBHUo","camping w/ Michael 🔥","2023-07-26T16:00:56Z","UCvWU1K29wCZ8j1NsXsRrKnA","LilyPichu","24","23.30.07","lilypichu|lily|highlights|hilarious|funny|twitchtv|moments|offlinetv|vlog","505281","36957","0","772","https://i.ytimg.com/vi/y8gVD6QBHUo/default.jpg","False","False","MORE FOOTAGE AT https://www.patreon.com/lilypichu Lily and Michael go camping during rain and get harrassed by a duck. ❀TIKTOK -  https://www.tiktok.com/@lilypichu❀WEBSITE - https://www.lilypichu.com❀LilyGaming - https://www.youtube.com/lilygamepad❀edited by - https://twitter.com/itsPhlex❀thumbnail art - https://twitter.com/LReimi❀thumbnail art - https://twitter.com/DaggerPogger0:00 Driving3:00 Camping Stuff4:00 Drawing Stuff5:21 Fire and Bird6:45 More Stuff8:15 Chefing /w Michael11:30 Good Morning Lily12:45 CHECK OUT PATREON #camping #lilypichu #michaelreeves #vlog"
"KD93AEsAshw","Fnaf Security Breach RUIN DLC STORY & ALL ENDING EXPLAINED","2023-07-26T15:31:37Z","UCZ9zJNZDmuQQ7Uw97Kdjwkw","GamerSault","20","23.30.07","Fnaf RUIN DLC STORY & ALL ENDING EXPLAINED|fnaf ruin dlc|fnaf security breach ruin dlc explained|fnaf ruin dlc lore|fnaf ruin dlc explained|fnaf ruin dlc story|fnaf ruin dlc all endings|fnaf ruin dlc endings|fnaf ruin dlc all endings explained|fnaf ruin dlc ending explained|fnaf ruin dlc story explained|fnaf security breach ruin explained|fnaf security breach ruin dlc story|fnaf security breach ruin dlc story explained|fnaf security breach ruin dlc all endings","343167","10443","0","948","https://i.ytimg.com/vi/KD93AEsAshw/default.jpg","False","False","Fnaf Security breach all endings, good ending, secret ending and bad ending, explained. fnaf lore deepens in the latest instalment, the ruin dlc which expands on the backstory of gregory, introducing a new character called cassie and mimic, also the entity or the digital glitch rabbit.Sub to gamersault/ gamer sault for more horror game related content.00:00 - 00:52 Intro00:54 - 11:33 Endings11:34 - 14:57 Normal Ending14:57 - 15:44 Fredbear Ending15:44 - 16:30 Scooper Ending16:30 Outro"
"dLvq89AF5vs","HIGHLIGHTS: Inter Miami CF vs. Atlanta United FC | July 25, 2023","2023-07-26T02:30:26Z","UCSZbXT5TLLW_i-5W8FZpFsg","Major League Soccer","17","23.30.07","mls|football|soccer|highlights|major league soccer|goals|goal","2796504","61301","0","3299","https://i.ytimg.com/vi/dLvq89AF5vs/default.jpg","False","False","You can also watch every match with MLS Season Pass on Apple TV: http://apple.co/MLSWant to see similar content to this? Subscribe to our channel for more: http://www.youtube.com/subscription_c...Follow us on:- TikTok: https://www.tiktok.com/@mls?lang=en- Instagram: http://instagram.com/mls- Twitter: https://twitter.com/MLS- Like us on Facebook: http://www.facebook.com/MLSFor more information about MLS, go to the league's official website: http://www.MLSsoccer.com#mls #highlights #mlsseasonpass"
"D3FF7qxfG2c","I Busted 65 Myths in Minecraft 1.20!","2023-07-27T12:21:15Z","UCcx50mGQFrrrdinB6BwZcXg","Eider","20","23.30.07","[none]","326116","3552","0","236","https://i.ytimg.com/vi/D3FF7qxfG2c/default.jpg","False","False","Minecraft 1.20 was just released so I decided to bust 65 of the craziest myths in this new update!This video is inspired by MeltTiktok: https://www.tiktok.com/@eideridiotTwitter: https://twitter.com/eideridiotOther stuff: https://solo.to/eider"
"5WW7cuAm-7Y","Mitski - Bug Like an Angel (Official Music Video)","2023-07-26T16:00:10Z","UC_Fv428B6qnjWLcR8d7t9jQ","MitskiVEVO","10","23.30.07","mitski|bug like an angel|new mitski|mistki|mitksi|bug angel|buglikeanangel|mitski bug like an angel|bug like an angel video|video|music|the land is inhospitable and so are we|the land is inhospitable|laurel hell|be the cowboy|puberty|retired from sad new career in business|sad indie|indie|alternative|lucy dacus|japanese breakfast|faye webster|soccer mommy|washing machine heart|nobody|me and my husband|pearl|tik","1007034","161332","0","15009","https://i.ytimg.com/vi/5WW7cuAm-7Y/default.jpg","False","False","“Bug Like an Angel” by Mitski from the upcoming album ‘The Land Is Inhospitable and So Are We’, out September 15th.Listen: https://mitski.lnk.to/Bug-Like-an-AngelPre-order on Black, Pink Aster or Gold Metallic Vinyl: https://mitski.lnk.to/TLIIASAW-PhysicalPre-save: https://Mitski.lnk.to/TLIIASAWhttps://mitski.com/https://www.twitter.com/mitskileakshttps://www.instagram.com/mitskileaks/https://tiktok.com/@mitskileaksCredits:Featuring: K.J. HolmesDirector: Noel Paul @n0elpaulProducer: Raven JensenDoP: Trevor Tweeten EP: Danny HermanProd Co: Friend LondonRecord Label: Dead OceansProduction Manager: Lucy RennickAssociate Producer: Jordan Alexander1st AD: Tasha Petty2nd AD: Taylor Harris-Butler PA: Aaron Prescott PA: Tim LopezPA: Adrian LausellPA: Kaileen Rozanski 1st AC: Rob Agulo2nd AC: Jeff PollinaGaffer: Eric Sorensen Key Grip: Dominic Ciofalo BBE: David WilliamsonBBG: Austin BlankenauProduction Designer: Carol KimStylist: Emily ConstantinoStylist Asst: Bailey Rose Brown HMU: Lauren CiteraHMU asst: Mary ChapmanColorist: Belal HibriVFX: Miled BoulosBTS:  Rafe Scobey ThalCasting: Michele Mansoor Choir: Janis Russell, Brandon Peterson, Cara Brownell, Wayne Babineaux, Jonsie Cheatham, Barbra Dahl, Susan Farwell, Michael Finch, Cigmond Millnery, Kelsey Swift, Nelson Kezoh, Brandon Peterson, Vilma DonovanSpecial thanks:The Lafayette Inspirational Ensemble & Choir at Lafayette Avenue Presbyterian church, Ramzi Hibri, Lucid Post, jv8inc, Iva Gocheva, Tala Safié, Ben Levin, Robby Morris, Good Harbor Music, Toufic SafiéLyrics:There’s a bug like an angel  Stuck to the bottom Of my glass, with a little bit left As I got older I learned I’m a drinker Sometimes a drink feels like family Family Hey, what’s the matter Looking like your sticker Is stuck on a floor somewhere – Did you go and make promises you can’t keep? Well, when you break them  They break you right back Amateur mistake You can take it from me They break you right back Break you right back When I’m bent over Wishing it was over Making all variety of vows I’ll never keep I try to remember The wrath of the devil Was also given him by God-Mitski - Bug Like an Angel (Official Video)#Mitski #BugLikeanAngel #TheLandIsInhospitableandSoAreWe"
