video_id,title,publishedAt,channelId,channelTitle,categoryId,trending_date,tags,view_count,likes,dislikes,comment_count,thumbnail_link,comments_disabled,ratings_disabled,description
"aF42DaSl4SU","ЗВОНОК ПОСЛЕ ОБМЕНА. ЖЕСТКАЯ ПРАВДА / @dmytrokarpenko","2023-07-28T16:30:10Z","UC8juxfcRfSm9Af90S4mZE1Q","Volodymyr Zolkin","29","23.30.07","Volodymyr Zolkin|Zolkin Volodymyr|Володимир Золкін|Золкін Володимир|Владимир Золкин|Золкин Владимир|ищи своих|ищи своих ютуб|золкін|vladimir zolkin|золкин ищи своих|война россия украина 2022|золкин ютуб|золкин последнее|золкін інтерв'ю з полоненими|золкін володимир ютуб|золкин новое|золкин пленные|золкін полонені|золкин дима|табір для військовополонених|табір для військовополонених захід 1|Золкін табір|табір Золкін|військовополонені Золкін","1665704","98253","0","12644","https://i.ytimg.com/vi/aF42DaSl4SU/default.jpg","False","False","☝️ Наш telegram-канал https://t.me/volodymyrzolkin ☝️__________________________________________ГУГУЕВ__________________________________________📌 Выбирай жизнь📌 -  https://t.me/hochu_zhyt (_Единый центр приема обращений по сдаче в плен Хочу жить_)Координаційний Штаб з питань поводження з військовополоненими https://koordshtab.gov.ua/%d0%ba%d0%b8%d1%97%d0%b2__________________________________________Наш telegram-канал https://t.me/volodymyrzolkin__________________________________________ ⚠️*Они идут бороться с нацизмом но не видят нацизма у себя в стране:* ⚠️https://youtu.be/42qb42EUGz8__________________________________________⚠️ *8 лет. О чем молчит рос. пропаганда* ⚠️https://youtu.be/ZgIVE62J-hs____________________________________________________________________________________💸Стань спонсором канала: https://cutt.ly/uGZdWI7ПО ВОПРОСАМ РЕКЛАМЫ в YouTube, TELEGRAM и Instagram обращаться:email - syuczigor@gmail.comTG - https://t.me/Ihor87Instagram -https://instagram.com/zolkin_coop____________________________________________________________________________________Связь: Чат-бот: https://t.me/vzolkinbot?start=ZGw6MTQxODM0Мы создали “банку” в Монобанке, куда можно сбрасывать деньги, которые пойдут на вознаграждение нашим бойцам за  новый обменный фонд:https://send.monobank.ua/jar/4B1N268g9Hкарта -  5375 4112 0098 3927Поддержать канал: monobank: 5375 4112 0098 3927paypal: doj.maestro@gmail.comhttps://www.patreon.com/zolkinUSDT(trc20) TZA1DjD93ivybrmnosXRFVPhrBU2WYuaXaBTC bc1qfz6ezvejapmlh0x63kp9pckfq2xtfcq6334fw0ETH 0x2db5e5a09697E61E1777426DA568E488D8bB5883BNB bnb1nmc2r0myv282y4rdarqyv8e0ad50dhsvhksfw7__________________________________________Авторы видео - журналисты Владимир Золкин и Дмитрий Карпенко.Профессиональной журналистской деятельностью занимаются более 4 лет и имеют действующее удостоверение журналиста.☝️ Цель создания данных видео - задокументировать происходящие события во время военного конфликта Украины с Россией. В научных целях провести добровольное интервью с пленными русскими военными и раскрыть кратко историю их жизни.__________________________________________The authors of the video are journalists Vladimir Zolkin and Dmitry Karpenko.They have been engaged in professional journalistic activities for more than 4 years and have a valid journalist's certificate.☝️ The purpose of these videos is to document events during the military conflict between Ukraine and Russia. For academic purposes, to conduct voluntary interviews with captive Russian servicemen and to reveal briefly the story of their lives."
"gXpsOMoi2YA","Путин: Россия готова искать пути к миру с Украиной","2023-07-29T12:51:11Z","UCNPxzbEkoNcydfLrRdTb-HA","AKIpress news","25","23.30.07","akipress|новости|news|Putin|Vladimir Putin|moscow|Путин|Владимир Путин|Россия|Russia|Кремль|Ukraine war|Ukraine|Putin Ukraine|War in Ukraine|Russian army|Army of Putin|обращение путина 2023|putin 2023|putin with army|russian soldier|putin donbass|война на украине|НАТО|NATO Putin|NATO|Africa Russia|саммит россия африка","1309773","13687","0","7456","https://i.ytimg.com/vi/gXpsOMoi2YA/default.jpg","False","False","Власти Украины прошлой весной отказались от переговоров с Россией, несмотря на готовность Москвы обсуждать условия мирного договора, теперь миротворческий процесс целиком зависит от Киева, заявил президент Владимир Путин на встрече с лидерами африканских государств. Он подчеркнул, что Россия готова искать пути мирного урегулирования ситуации вокруг Украины, сообщает Кремль.«После отвода наших войск из-под Киева — а нас просили это сделать, чтобы создать условия для заключения окончательного договора — киевские власти отказались от всех прежних договоренностей. Поэтому я считаю, что мяч полностью на их стороне», — сказал президент.Путин указал, что не станет раскрывать условия соглашения, к которым двигались стороны. При этом, продолжил он, в декларации о независимости Украины фиксируется нейтральный статус государства, что имеет принципиальное значение для России.Москва внимательно изучила предложения по достижению мира на Украине, составленные африканскими странами, добавил Путин. Он заверил, что Россия ценит сбалансированный подход государств Африки к поиску решения конфликта и их отказ от поддержки «антироссийской кампании». Он пообещал отнестись к их идеям «очень серьезно и с большим вниманием».«Мы со своей стороны никогда от переговоров не отказывались, всегда говорили, что готовы к продолжению диалога», — подчеркнул президент.В африканскую миссию по урегулирования конфликта на Украине входят Египет, Замбия, Коморские Острова, Конго, Сенегал, Уганда и ЮАР. Их мирный план предполагает деэскалацию с обеих сторон, в нем нет пункта о выводе российских войск с территорий, которые Украина считает своими. Миссия в середине июня проводила встречи с президентом Украины Владимиром Зеленским в Киеве и президентом РФ Владимиром Путиным в Санкт-Петербурге.Подробнее: centralasia.media/news:1961261?f=cp[ Официальный канал ИА АКИpress ]Смотрите и читайте нас: Наш сайт: www.akipress.orgInstagram: instagram.com/akipressFacebook: facebook.com/akipressTwitter: twitter.com/akipress Телеграм: t.me/akipress TikTok: tiktok.com/@akipresskg"
"a1bgZAR6kCY","МЫ СТАНЕМ РОДИТЕЛЯМИ во второй раз","2023-07-28T13:00:07Z","UCwn8lEqpPSSegaO2isJ4g7A","Anyaischuk","22","23.30.07","Аня Ищук|Ищук Аня|материнство|роды|беременность|мы станем родителями|мы ждём малыша|у нас будет ребёнок|ребёнок|малыш|увеличение груди|сложные роды|я родила|мои роды|день родов|моя беременность|будущие мамы|советы маме|первая беременность.|аня ищук и димас блог|аня ищук беременна|аня ищук канал|аня ищук беременна второй раз|аня ищук и димас блог роды","895265","51865","0","1697","https://i.ytimg.com/vi/a1bgZAR6kCY/default.jpg","False","False","Заходите в моё сообщество VK, там вас уже ждет новое эксклюзивное видео: https://vk.com/anyaischukkkВсем привет, вы находить на канале АНЯ ИЩУК! И сегодня вас ждёт очень важный ролик для нашей семьи, потому что в нем вы узнаете, что МЫ СТАНЕМ РОДИТЕЛЯМИ.Мы показали реакции наших близкий людей на то что мы ждём малыша, рассказали, как сами отреагировали на эту новость и поделились своими впечатлениями. Заказать нашу косметику можно на всех маркетплейсах: https://taplink.cc/kisycosmeticsБудь всегда с нами:Телеграм Ани: https://t.me/anyaischukkkkТелеграм Димы: https://t.me/dimasblog333VK Ани - https://vk.com/anyaischukkkVK Димы - https://vk.com/dimasblog.musicРЕКЛАМЫ/ СОТРУДНИЧЕСТВА anyaischuk@liveliness.agencyPR: телеграм @pr_dimanya#беременность #аняищук #роды"
"ZtFKzVfhBZw","Как в 3 раза дешевле взять водную прогулку в Питере?","2023-07-29T15:18:01Z","UCnJZSsBoLh8_4758IFMxbqQ","Vlad Slav","1","23.30.07","[none]","29109","3928","0","24","https://i.ytimg.com/vi/ZtFKzVfhBZw/default.jpg","False","False",""
"yxq2sirgexU","Aytilmagan Haqiqatlar — O‘zbek Trakchilarining Real Hayoti | SUBYEKTIV","2023-07-29T15:17:30Z","UCsC7BrXVI11qE1gosuWIYCQ","SUBYEKTIV","22","23.30.07","subyektivuz|subyektiv yangi korsatuv|ozbek trakchilari|amerikadagi o'zbek trakchilari|o'zbek trakchilarining real hayoti|amerikadagi o'zbeklar|trak biznesi|qanday qilib trak qilsa bo'ladi|green card|grin karta|trakchi o'zbeklar","253025","19307","0","1992","https://i.ytimg.com/vi/yxq2sirgexU/default.jpg","False","False","Ushbu ko‘rsatuv quyidagi hamkorlarimizsiz imkonsiz bo‘lar edi:💸 Payme — Hayotiy yechimlar!😎 UPG — Upgrade qilish vaqti keldi!✈️ Mehmonxona va avia chiptalarni arzon narxlarda sotib olish xizmati — www.aviasales.uz🔝 Cambridge Learning Centre — Impossible is Possible!Soundtrack:▪️ Konsta 👉 https://www.youtube.com/@Konsta_uz▪️ Recording Studio 👉 https://youtube.com/@singularmusicuz▪️Beat 👉 https://youtube.com/@dupliciyoBosh homiy: Kun.uz internet nashri▪️ Texnik Hamkor: UPG 👉 https://www.youtube.com/c/UPGuz▪️ Reklama 👉 +99890 044-66-81▪️ Aloqa 👉 https://t.me/SubyektivuzbotSifatli kontent yaratishga hissa qo‘shing:▪️ VISA, MasterCard, СБЕРБАНК, Webmoney, QIWI 👉 https://www.donationalerts.com/r/subyektiv▪️ Payme 👉 https://payme.uz/618b687475752e8a58788312▪️ UzumBank 👉 https://www.apelsin.uz/qr?uid=6914774f00000001690290967245#Amerika #Trak #AmerikadagiUzbeklarJamoa:▪️ Jamshidxon Ziyoxonov: https://www.instagram.com/ziyokhonov/▪️ Muhammadjon G‘aniyev: https://www.instagram.com/mukhammad.man/▪️ Baxtishod Muxiddinov: https://www.instagram.com/baxtiishod▪️ Abdullajon Yusupov: https://www.instagram.com/abdullajon.yusupov/▪️ Bekmirza Rashidov: https://www.instagram.com/beckmirzaTelegram kanalimiz: https://t.me/subyektivuzFacebook sahifamiz: https://www.facebook.com/subyektivuz/Instagram sahifamiz: https://www.instagram.com/subyektivuz/TikTok sahifamiz: https://www.tiktok.com/@subyektivuz"
"-GLRiYqXCuo","ГЕНА МИЛЛЕР VS РОДИНА  МЕДИА | КУБОК ФИФЕРОВ 2023 | 2 ТУР","2023-07-29T12:59:58Z","UCsTO-f7ij90TBSBxl7LbS7g","Gena Miller","20","23.30.07","кубок фиферов|гена миллер|родина медиа|блатов|текилла|тарасов|медиафутбол|чисто питер|фифа23","95479","8050","0","196","https://i.ytimg.com/vi/-GLRiYqXCuo/default.jpg","False","False","Монеты и Игры - https://vk.cc/8CZkM7 Телега - https://t.me/millergena/Ролик Родины -  https://www.youtube.com/@PAPABLAT22Мой инст -  http://instagram.com/MILLER_GENAТвич - https://www.twitch.tv/miller_genaОткрыт для сотрудничества - genamillercommercial@gmail.com"
"TMPsoW9xy0c","СУТЕНЕР 2 — Сколько стоит невинность? / Безумные желания звезд / Как потерял миллионы? (Подкаст №1)","2023-07-28T17:59:36Z","UCjDwvpIhyfBGz4bbH8bcvUg","ДЖАРАХОВ","22","23.30.07","джарахов|эльдар джарахов|подкаст джарахов|подкаст|podcast|подкаст джарахова №1|клик клак|КЛИККЛАК|джарахов мэджик|андрей мэджик|Жизнь по вызову","847370","34059","0","1251","https://i.ytimg.com/vi/TMPsoW9xy0c/default.jpg","False","False","Смотрите первый сезон провокационной драмы Жизнь по вызову. Узнайте самые смелые тайны империи страсти и не пропустите премьеру нового сезона, которая уже совсем скоро состоится в онлайн-кинотеатре KION. Это будет смело! https://clck.ru/358ahf🛍Unicorn - магазин оригинальных товаровТГ канал - https://t.me/+qlvH8g_spyo0MWJiПриложение - https://unicorngo.ruСпонсор встреч с друзьями https://i.avs.io/hbq6l7Новый сезон на YouTube канале КЛИККЛАК:https://youtube.com/klikklakМой телеграм-канал:https://t.me/dzharakhov1Семнадцатый выпуск нового сезона Подкаста №1.Сегодня снова в гостях — продавец любви Андрей Мэджик.Все истории являются художественным вымыслом и не имеют связи с реальностью.Приятного просмотра!Андрей Magic Man:Инстаграм*: https://instagram.com/magicpimpmanЖора Макэлрой:YouTube: https://www.youtube.com/NewsMcElroyИнстаграм**: https://instagram.com/uncle_mcelroyМои Соцсети: TikTok: https://www.tiktok.com/@dzharakhovИнстаграм*: https://instagram.com/dlgreez Паблик VK: https://vk.com/dzharakhov00:00 – Сериал с Павлом Прилучным по мотивам историй Андрея00:24 – В этом выпуске01:13 – Новый сезон на YouTube канале @klikklak 02:01 – Все истории сутенера – фанфики04:43 – Подарок для гостя07:44 – Что случилось после выхода первого подкастаСмотри первый подкаст тут: https://youtu.be/qKyXVIgN4YQ11:13 — Эскортницы на охоте15:26 – Мужики никогда не взрослеют16:59 — Дикие истории из работы сутенёра23:48 — Дикая история от подписчика29:25 — Эскорт = Проституция?36:07 – Семейный подряд39:50 – Вебкам42:58 — Неприятный сюрприз от знакомства46:12 — Почему Андрей не скрывается49:26 — История про самого неудачливого сутенёра52:24 — Как Андрея пытались посадить54:43 — Настоящие друзья56:57 — Природа мужчин1:00:59 — Девушки чуть не погибли1:07:04 — Умение врать и играть жертву1:12:18 — Когда заказ оказался последним1:16:51 — Про виагру1:20:24 — Детство Андрея1:35:55 — Фигура отца и взросление1:44:07 — Доверие к людям и психотерапия1:47:47 — Веселая история под конец1:59:30 — Благодарности и концовка**Meta признана экстримистcкойт"
"OXjiWZf1pAw","КУБОК ФИФЕРОВ x PARI | PANDAFX vs KEFIR / 2ТУР","2023-07-29T16:00:00Z","UCg-hPMTOOFqGRjYg8tSXGiA","PANDAFX","20","23.30.07","FIFA|ФИФА|ПАНДА|ПАНДАФХ|PANDAFX|ULTIMATETEAM|УЛЬТИМЕЙТИМ|ЧЕЛЛЕНДЖИ|ПАКИ|ПАКОПЕНИНГ|ФИФЕР|ФИФЕРЫ|FIFA19|ФИФА19|FIFA20|ФИФА20|ФИФА20УЛЬТИМЕЙТИМ|БИТВАСОСТАВОВ|АМКАЛ|ПАНДАЭФИКС|FIFA21|ФИФА21|ФИФА21ПАКИ|ПАКИПАНДАФХ|СПАСИБОПАНДОС|ФИФА22|FIFA22|ФИФАСПАКАМИ|ПОЙМАЛИКОНУ|ПОЙМАЛЛЕГЕНДУ|ФИФА22ПАНДА|КУБОКФИФЕРОВ|КУБОКФИФЕРОВ2023|КУБОКФИФЕРОВ20232ТУР|КУБОКФИФЕРОВПАНДАФХКЕФИР|КУБОКФИФЕРОВPANDAFXKEFIR|КУБОКФИФЕРОВПАНДА|fifa 23|fifa 23 pack opening|fifa 23 ultimate team|EAFC24","132972","13258","0","454","https://i.ytimg.com/vi/OXjiWZf1pAw/default.jpg","False","False","Интернет-магазин Регард: https://vk.cc/cpMDNVКупить EA FC 24 - https://vk.com/pandafanKefir - https://www.youtube.com/@fckefirМой сайт с монетками - https://pandacoin.ru/Мой телеграм - https://t.me/pandafxИнстаграм: http://instagram.com/pandaffxИнстаграм видеоигровой https://www.instagram.com/pandafx2.0/Мой Твич канал - https://www.twitch.tv/pandafxfxПочта для Рекламы : brucerobertsonfifa@gmail.comМоя страница ВК - https://vk.com/pandafxМоя группа ВК - https://vk.com/pandafanPlaystation - Pandawhithe#FIFA23 #ФИФА23"
"ClfFvf7Z0U8","СМОЖЕШЬ ЗАДЕРЖАТЬ ДЫХАНИЕ В ROBLOX #Shorts #Глент #А4","2023-07-29T11:00:16Z","UCBYvr4SqfGQd5fTmOXVQ4Zw","ГЛЕНТ","20","23.30.07","СМОЖЕШЬ ЗАДЕРЖАТЬ ДЫХАНИЕ В ROBLOX|СМОЖЕШЬ ЗАДЕРЖАТЬ ДЫХАНИЕ|глент|глент роблокс|глент roblox|глент канал|глент из а4|а4|a4|глент челлендж|задержал дыхание в роблокс|глент играет в roblox|глент игра|роблокс|roblox|глент шортс|глент shorts|shorts|шортс|shorts roblox|глент а4|roblox funny shorts|roblox race|roblox top|роблокс бег","1368935","108740","0","9575","https://i.ytimg.com/vi/ClfFvf7Z0U8/default.jpg","False","False","▶️ МОЙ Telegram - https://t.me/vladglenttg▶️ МОЙ Telegram - https://t.me/vladglenttg▶️ МОЙ Telegram - https://t.me/vladglenttgВ ЭТОМ ВИДЕО Я ПЫТАЮСЬ ПРОЙТИ КАРТУ ЗАДЕРЖАВ ДЫХАНИЕ В #ROBLOX #SHORTS #ГЛЕНТ #A4"
"kO9IB5coYQA","Skibidi Toilet 53 (new episodes) - Tv Man's Love Story With Camera Woman | Skibidi Toilet Animation","2023-07-29T08:58:25Z","UCDXP7uHrt4WiEG7jgnOHKzg","Spirit Action","1","23.30.07","skibidi toilet|Skibidi Toilet 50|skibidi toilet 51|skibidi toilet all episodes|skibidi toilet meme|skibidi toilet shorts|skibidi toilet season 16|skibidi|skibidi toilet 47|skibidi meme|skibidi toilet vs cameramen|skibidi toilet 48|skibidi toilet 52|skibidi toilet 49|toilet skibidi|TV Man|cameraman|DaFuqBoom|tvman|tvman titan|Skibidi Toilet Animation|tv woman|camera woman","1241379","15419","0","91","https://i.ytimg.com/vi/kO9IB5coYQA/default.jpg","False","False","#cameraman #animation #skibiditoilet #DaFuqBoom #tvwoman"
"QKTYAGHbU_c","Xamdam Sobirov - Janze (Official Music Video)","2023-07-29T14:00:10Z","UCkaUg9b9LplVoJdx1JwwyOg","NevoMusic","10","23.30.07","uzbek klip|uzbek|uzbekcha klip|yangi|yangi klip|uzbek klip new|uzbek klip 2018|new uzbek music|узбек клип|узбек|узбекча клип|янги|янги клип","392628","15913","0","1481","https://i.ytimg.com/vi/QKTYAGHbU_c/default.jpg","False","False","▸Subscribe: https://www.youtube.com/nevotv?sub_confirmation=1  • Credits: Clipmaker: Doniyor RajabovMusic: Xamdam SobirovLyrics: Xamdam SobirovArranger: Doniyor Ahmedov ▪️ Follow Xamdam Sobirovhttps://www.instagram.com/xamdam__sobirov/  ▪️ Booking Xamdam Sobirov    +998 99 501-22-22  ▪️ Follow  @NevoMusic : NV: https://nevomusic.net/ VK: https://vk.com/nevotv ОК: https://ok.ru/nevomusic TG: https://telegram.me/nevomusic IG: https://www.instagram.com/nevomusic/ FB: https://www.facebook.com/groups/nevomusic/  All rights reserved. Unauthorized reproduction is a violation of applicable laws. In order to avoid copyright infringement, please do not upload this video on your channel.  © 2023 NEVO Music ℗ 2023  AIR Music"
"_WIwUb6Xh_c","«Мой принц»: почему Коко Шанель так называла убийцу Григория Распутина? #shorts","2023-07-29T17:02:00Z","UCQDVQ8Bf-b9ibGvfRR3UoUw","PRO Историю","22","23.30.07","дмитрий павлович романов|дмитрий павлович|коко шанель|шанель|григорий распутин|убийца григория распутина|ссылка дмитрия павловича|распутин|духи шанель номер 5|Chanel № 5|история коко шанель|эрнест бо|мария романова|париж|романовы|романовы в иммиграции|романовы в париже|1920|мода 1920|история россии|российская империя|pro историю|история интересно","39246","2779","0","45","https://i.ytimg.com/vi/_WIwUb6Xh_c/default.jpg","False","False","«Мой принц» называла Великого князя Дмитрия Павловича Романова известная во всем мире Коко Шанель. Он, как принц на белом коне, помог превратить ее жизнь в сказку. Благодаря ему Коко стала легендой мира моды и парфюмерии. После участия в убийстве Григория Распутина Дмитрий Павлович был сначала арестован, а потом сослан в Персию – в состав действующей армии. Эта ссылка, по сути, спасла молодого князя от смерти – во время революции он уже был за границей. Затем князь переехал в Париж, где и состоялась его судьбоносная встреча с Коко Шанель. Дмитрий Павлович перезнакомил Коко с представительницами самых громких фамилий, включая племянницу Николая II, супермодель Наталию Палей и свою родную сестру, Великую княгиню Марию Романову, которая в то время много шила и стала сотрудничать с Шанель. Париж будет заворожен их коллекцией с явным «русским акцентом».  Вскоре русским парфюмером-эмигрантом Эрнестом Бо , с которым Коко познакомил также Дмитрий Павлович. будут созданы знаменитые духи Chanel № 5. Роман с Коко был продуктивным и бурным, но длился всего год. С русским князем Шанель сохранила дружеские отношения.Подписывайтесь на канал! Так же подписывайтесь и на другие соц. сети!ВК - https://vk.com/public213600110Яндекс. Дзен - https://zen.yandex.ru/id/5d6fcf397cccba00adae736cТелеграм - https://t.me/prohistoryrussia"
