video_id,title,publishedAt,channelId,channelTitle,categoryId,trending_date,tags,view_count,likes,dislikes,comment_count,thumbnail_link,comments_disabled,ratings_disabled,description
"KC_Yf7ZEmnQ","Мои Волшебные Роды Без Анестезии от Начала Схваток до Потуг","2023-07-27T13:04:17Z","UCqmx3IZWOUyOSEBttRE0C6w","Alexandra Posnova","22","23.30.07","мои роды|история моих родов|роды без анестезии|гипнороды|мои вторые роды|волшебные роды|схватки|как проживать схватки|как подготовиться к родам|потуги|золотой час|огненное кольцо|беременность|александра поснова роды|александра поснова|саша поснова|плацента|послед|партнёрские роды","480119","32697","0","1861","https://i.ytimg.com/vi/KC_Yf7ZEmnQ/default.jpg","False","False","‣ Мой телеграм-канал: https://t.me/posnovaalexandra‣ Мой инстаграм: https://www.instagram.com/alexandraposnova/ ‣ Видеограф/фотограф в роды: https://instagram.com/katybutarova_newborn?igshid=MzRlODBiNWFlZA==‣ Сотрудничество: alexandra.posnova@gmail.com ‣ Влоги: https://clck.ru/JXpQ4‣ Плейлист про квартиру и переезд: https://clck.ru/33Q3uN‣ Прошлая беременность: https://clck.ru/339MGX‣ Про замершую беременность: https://clck.ru/339MTh‣ Макияжи: https://clck.ru/atujw#моироды #историямоихродов #моивторыероды #родыбезанестезии #гипнороды #роды #какрожатьбезболи #какпомочьсебевродах #партнёрскиероды #партнёрнародах #схватки #потуги #какоблегчитьсхватки #огненноекольцо #плацента #пересечениепуповины #днивроддоме #роддом #историяродов #александрапосноваProduction Music courtesy of Epidemic Sound0:00 О чём это видео0:55 Прогулка на рассвете4:37 Про ПДР6:16 Про гипнороды6:55 Проживание схваток дома8:49 Про дыхание во время схваток12:43 Едем в роддом15:23 В роддоме20:01 Про список «окситоциновых дел»27:58 Этап родов «огненное кольцо» и встреча с малышкой29:53 Отвечаю про послед и пересечение пуповины34:12 Подарок Дениса на рождение Миры35:55 Послеродовой период39:05 Была ли у меня анестезия в родах?39:48 Как не тужиться на потугах?42:50 Как нам пришла идея назвать дочку Мира?43:52 Что делала доула, что Денис во время родов?44:43 Есть ли разница между первыми и вторыми родами?47:12 Что я капала на руку на раскрытии?47:50 Какие способы обезболивания использовала во время потуг?48:42 Как я так быстро восстанавливаюсь?49:07 Больно ли сокращалась матка после родов?49:54 Как настроить себя, что роды-это не боль, а нечто замечательное?50:31 Денис отвечает на вопросы о совместных родах50:36 Не теряется ли интерес к женщине у мужчины после совместных родов?52:15 Есть ли отличия между первыми и вторыми родами?52:45 Если отец не пойдет на роды, что он потеряет?53:37 Как мужчине сохранить спокойствие во время родов жены, есть ли жалость?54:35 Что было самым сложным для Дениса в моральном и физическом плане в родах?55:54 Первые мысли и чувства после рождения Миры"
"gxeyC1cPJsA","TREASURE - 'BONA BONA' M/V","2023-07-28T09:00:09Z","UCx9hXYOCvUYwrprEqe4ZQHA","TREASURE (트레저)","24","23.30.07","YG Entertainment|YG|와이지|K-pop|트레져|트레저|TREASURE|CHOI HYUN SUK|JIHOON|YOSHI|JUNKYU|YOON JAE HYUK|ASAHI|DOYOUNG|HARUTO|PARK JEONG WOO|SO JUNG HWAN|최현석|지훈|요시|준규|윤재혁|아사히|도영|하루토|박정우|소정환|TREASURE MOVE|T5 MOVE|MOVE|트레저 무브|T5|T5 무브|REBOOT|트레저 REBOOT|트레저 리부트|트레저 정규2집|TREASURE REBOOT|TREASURE 리부트|BONA BONA|I WANT YOUR LOVE|RUN|MOVE (T5)|G.O.A.T|멍청이|STUPID|어른|THE WAY TO|WONDERLAND|B.O.M.B|LOVESICK","10540660","514099","0","142293","https://i.ytimg.com/vi/gxeyC1cPJsA/default.jpg","False","False","TREASURE – BONA BONA낮에 타는 태양새벽의 별 같아내 세상 속엔 네가매일 떠오르니까Baby don’t cry 꽉 잡아 여길 떠나너와 내가 영원할 곳으로Cuz I can’t stop 도망가자 여긴 폭탄우릴 파괴하는 것들뿐이야You are magic in my mind정해진 운명은 없다고 하지만수만 번 생각해 봐도눈을 뜨고 태어났을 때부터 난Born to born to born to love yaYeah yeahBorn to born to born to love yaOhBorn to born to born to love ya홀린 듯이뒤꽁무니쫓아가지홀린 듯이더 빠져 DeepFollow your lips네 맘에 문 열어 Door파고들어 너의 CoreForever ever all long갈 수 있게AbracadabraBorn to love ya 널 원해 전부 다거절은 거절해 난너 말고 아무것도 안 담아네 품에 난 갇혀감싸줘 Xs and Os널 반복되는 매 생마다Born to love ya 찾았어Again & again 돌고 돌아서마침표 팍넌 내 마지막영원히 놓지 않아No doubt눈이 번쩍 뜨여졌어 너란 보석너를 갖고 싶어 훔쳤으니까나를 던져 너를 건져Come closer우리 사랑의 시작일 뿐이야You are magic in my mind정해진 운명은 없다고 하지만수만 번 생각해 봐도눈을 뜨고 태어났을 때부터 난Born to born to born to love yaYeah yeahBorn to born to born to love yaOhBorn to born to born to love ya아침 해가 뜰 때까지Let’s speed it up let’s speed it up달아나 지구 끝까지Let’s speed it up let’s speed it up둘만의 섬으로 가자다른 사람은 안 돼 Baby you’re all that I needNo넌 내 삶의 Climax뜨거워져 Burning in love하얗게 불태워 You’re my adrenaline넌 내 삶의 Climax뜨거워져 Burning in love하얗게 불태워 You’re my adrenalineBorn to born to born toOh oh oh oh ohLove ya love ya love yaOh oh oh oh oh oh oh ohBorn to born to born toOh oh oh oh ohLove ya love ya love yaOh oh oh oh oh oh oh ohBorn to born to born to love ya#TREASURE #트레저 #2NDFULLALBUM #REBOOT #MV #BONABONA #OUTNOW #YGAvailable @ https://treasure.lnk.to/REBOOT_More about TREASURE @https://yg-treasure.comhttps://www.youtube.com/OfficialTreasurehttps://www.facebook.com/OfficialTreasurehttps://www.twitter.com/ygtreasuremakerhttps://www.instagram.com/yg_treasure_official"
"-kL7YtpluA0","Я выкинул ЛЯМ РУБЛЕЙ(((","2023-07-26T16:00:50Z","UCWnqnojAgMdN0fQpr_xByJw","MORGENSHTERN","10","23.30.07","[none]","796376","52919","0","563","https://i.ytimg.com/vi/-kL7YtpluA0/default.jpg","False","False",""
"ZWKb9K1bGmE","Первый раз в жизни оформил кредит на персонажа","2023-07-28T14:01:18Z","UCC5XKrWbGyKnSaFE313K7OQ","BY STEP","20","23.30.07","[none]","359564","39887","0","427","https://i.ytimg.com/vi/ZWKb9K1bGmE/default.jpg","False","False",""
"dladf2_oEEk","МАКСИМ ФАДЕЕВ. ГАДАНИЕ НА ТАРО. РАБОТА ЧЕРЕЗ ПОСТЕЛЬ. ОТ КОГО СЫН? ЖЕНА ШИРМА. СЕРЬЁЗНЫЕ ОБВИНЕНИЯ","2023-07-29T06:25:57Z","UCF1aTvgB53z-vkuu5LD-dKw","Anton S","22","23.30.07","значение карт таро|значение старших арканов таро|расклад на картах таро|как читать карты таро|гадание на картах таро максим фадеев|максим фадеев и олег майами|ольга серябкина и сын от макса фадеева|максим фадеев и шоу голос|конфликт между наргиз и максом фадеевым|фадеев и алена блин|реальные отношения макса фадеева и его жены|темникова и макс фадеев|malfa проект максима фадеева|певица линда и макс фадеев|обвинения против макса фадеева|макс фадеев и кремль","127987","7979","0","951","https://i.ytimg.com/vi/dladf2_oEEk/default.jpg","False","False","🔴 ЛИЧНО ПООБЩАТЬСЯ С АНЖЕЛИКОЙ - телеграм ассистента Анжелики, Екатерины: https://t.me/j_voitehhBoosty: https://boosty.to/anzelikataro------------------------------------------------------------------ВИДЕО НА КАНАЛЕ ДОЖДЬ Сколько осталось Путину и чем закончится война: как тарологи заменили политиковhttps://www.youtube.com/watch?v=CXrZBugx8Kk&t=536sТЕЛЕГРАМ https://t.me/antonspletniТВИТТЕР https://twitter.com/suvorkinИНСТАГРАМ https://www.instagram.com/suvorkin/ПОДДЕРЖИ СПЛЕТНИКОВ И СТАНЬ СПОНСОРОМ!https://www.youtube.com/channel/UCpQWh9JggVV9ZKz7IWrHAEA/joinзначение карт таро, значение старших арканов таро, расклад на картах таро, как читать карты таро, гадание на картах таро максим фадеев, максим фадеев и олег майами, ольга серябкина и сын от макса фадеева, максим фадеев и шоу голос, конфликт между наргиз и максом фадеевым, фадеев и алена блин, реальные отношения макса фадеева и его жены, темникова и макс фадеев, malfa проект максима фадеева, певица линда и макс фадеев, обвинения против макса фадеева, макс фадеев и кремль, как работают с максом фадеевым, Сотрудничество/collaboration: norgesboy@gmail.com Оформить подписку на канал и стать спонсором!https://www.youtube.com/channel/UCF1aTvgB53z-vkuu5LD-dKw/join-------------------------------------ПОДПИСЫВАЙТЕСЬ!МОЙ ВЛОГОВЫЙ КАНАЛ https://www.youtube.com/channel/UCpQWh9JggVV9ZKz7IWrHAEAПОЛУЧИ СКИДКУ €25 НА ПЕРВУЮ КВАРТИРУ AirBNB  https://www.airbnb.com/c/antons5139ПОЛУЧИ СКИДКУ 20% НА ПОКУПКУ В ЛАЙМ КРАЙМ Lime Crime  https://www.talkable.com/x/39yX1AПолучи $5 скидки на секретную коробку KAWAIIBOX! https://www.kawaiibox.com?raf=ref2496925Предыдущее видео https://youtu.be/6cj-wu3y1w0МОЙ ИНСТАГРАМ https://www.instagram.com/suvorkin/-------------------------------------НЕ ЗАБЫВАЙТЕ ДЕЛИТСЯ МОИМ ВИДЕО! #antons  #антонс #"
"H9d5ohiZfLA","Сбиваю цену таксистам  Пранк Антон Теляков","2023-07-27T10:47:54Z","UC6JKB6HH7mQP-iI1N0bGYsg","Склад Телякова","23","23.30.07","пранк|пранки|prank|прикол|розыгрыш|шутка|юмор|смех|смешно|теляков|антон теляков|воркутинский|анатолий воркутинский|реакция людей|бродяга|угар|ржач|ржака|странные вопросы|такси|эконом|бизнес класс|антон голд|сбиваю цены|сбиваю цену","204446","6231","0","280","https://i.ytimg.com/vi/H9d5ohiZfLA/default.jpg","False","False","Смотри больше контента на основном канале «Telyakov TV» 👉 https://www.youtube.com/c/%D0%A2%D0%B5%D0%BB%D1%8F%D0%BA%D0%BE%D0%B2%D0%A2%D0%92Инстаграм https://www.instagram.com/anton_telyakov/Всё, что за кулисами у меня в телеграм 👉 https://t.me/+E9-UhoZKEEAzYTBi По реклама в ролике👉 telyakovtv@mail.ruПодписывайтесь💪 Обнял приподнял)"
"ocueiNCZiQE","НИКТО НЕ ПРИШЕЛ НА ДЕНЬ РОЖДЕНИЯ","2023-07-26T18:35:22Z","UCkEiEd4fV3pvUmcoJYacDqA","Эдисон Перец","22","23.30.07","эдисон|едисон|edisonpts|Эдисон Перец|влог|эдисон влог","1544257","157586","0","18951","https://i.ytimg.com/vi/ocueiNCZiQE/default.jpg","False","False","Никто не пришел на день рождения Эдисона!★ Мой магазин ОДЕЖДЫ: https://edisonfamily.vsemaykishop.ru/● Мой Телеграм: https://t.me/edisonfamilia● Мой Инстаграм: https://www.instagram.com/edisonperets/● Я в ВК: http://vk.com/eduard_perets● Группа ВКонтакте: http://vk.com/edfungroup● Мой основной канал: https://www.youtube.com/user/EdisonPts▰▰▰▰▰▰▰▰▰▰▰▰▰▰▰▰▰▰▰▰▰▰▰► Реклама и сотрудничество: peretseduard2207@hotmail.com#Эдисон #влог #деньрождения"
"OTPEUA2VBE0","Спартак vs АниЗоро🔥🗡️⚔️ @SJBody","2023-07-29T08:24:15Z","UCDqkPHZ4DMFLjxNJfm4_Y7g","AniZoro","24","23.30.07","АниЗоро|Аниме|Спорт|Анимешник|Сильнейший анимешник|Sjbody|200voltsw|200 вольт|Владос|Вызов спартака|Юрий СПАСОКУКОЦКИЙ|Сильнейший в мире|Сила аниме|Боец баки|Зоро|бицепс|vlados|Спина демона|Накачать спину|акимбо против анизоро|скорость армрестлинг|Стойка баки|нация анизоро|анизоро толян|Анизоро в москве|стойка баки|Танец венсдей|Венсдей|Сериал Венсдей|арген|сигма|гигачад|волк|кот в сапогах 2|волк из кот в сапогах|Акимбо анизоро|akimbo anizoro","44903","3527","0","172","https://i.ytimg.com/vi/OTPEUA2VBE0/default.jpg","False","False",""
"6kFAcrpvJ-k","СтопХам-Веселая тётя ПСБ","2023-07-28T07:00:07Z","UCii_gXGV-mto1bdKWKCk92g","СтопХам Мск","2","23.30.07","СтопХам|сх|стопхаммосква|москва|хамы|авто|машины|наклейки|Stop|стопхам2018|stopham|ham|stopxam|СХ|общественное движение|автомобили|стопхамспб|стопхам2020|стопхамкиев|стопхаммолдова|stop xam|движение|стоп хам|дорога|культура|помощь|топ|девушка|люди|выпуск|стопхам мск лайв|стопхам крым|#стопхам|стопхам|машина|питер|смех|Кирилл Бунин","38553","3064","0","692","https://i.ytimg.com/vi/6kFAcrpvJ-k/default.jpg","False","False","На поддержку нашей деятельности: 🟢 4276 3801 3202 3958 Сбербанк🟢 https://pay.mysbertips.ru/22527266 Сбербанк🟡 5536 9139 8233 3169 Тинькофф🟡 https://pay.cloudtips.ru/p/a8655826 Тинькофф🟣 410018375962755 ЯндексНаш телеграмм https://t.me/StopXamMoscow---------------------------------------------------------------------------------------------------------По поводу участия в рейдах и локациях по городу Москва :https://vk.com/hellmoneyhttps://vk.com/salveeegНаша группа в Вк https://vk.com/stopxam_msk_officialНаш инстаграм https://www.instagram.com/stopxammscОформить подписку - https://www.youtube.com/channel/UCii_gXGV-mto1bdKWKCk92g/join---------------------------------------------------------------------------------------------------------------------------По коммерческим вопросам  https://vk.com/zymixaiharaлибо stophammsc@gmail.com#СтопХамМск#УважайтеОкружающих#Москва#Россия#Авто#СтопХам---------------------------------------------------------------------------------------------------------------------------Предупреждаем о том, что содержимое данного видео является субъективным мнением авторов а так же сообщений и комментариев и в некоторых случаях может содержать ложную информацию, когда автор не разобрался полностью в ситуации . К сведению подписчиков и зрителей- администрация канала(сайта,страницы) не может проверить достоверность всей размещаемой информации, что необходимо учитывать при ознакомлении и размещении своих комментариев."
"3acuyv8RVSY","Зеленський нагородив Залужного іменною зброєю #shorts","2023-07-27T09:16:57Z","UCPY6gj8G7dqwPxg9KwHrj5Q","Суспільне Новини","25","23.30.07","Суспільне|Суспільне новини|новини|новини України|останні новини|Зеленський нагородив Залужного|нагородження Залужного|Залужний|Зеленський|Володимир Зеленський|Головнокомандувач Збройних Сил України|Валерій Залужний|Головнокоманувач ЗСУ|нагородження Залужного іменною зброєю|новини сьогодні|актуальні новини|новини 24|Зеленський новини|Залужний новини|дивитись Суспільне|Суспільне онлайн|Зеленський у Дніпрі|Дніпро|ЗСУ|головнокомандувач зсу|нагорода залужного","690744","50805","0","2090","https://i.ytimg.com/vi/3acuyv8RVSY/default.jpg","False","False","Президент Зеленський нагородив Головнокомандувача ЗСУ Залужного іменною зброєю. Напередодні, 8 липня, у Залужного був день народження.#новини #новиниУкраїни #війна #Зеленський #ЗалужнийПідписуйтесь на наш канал та тисніть дзвіночок https://www.youtube.com/c/1tvUkraine"
"Zv50N3YEVpw","ОН ВЕРНУЛСЯ! НОВАЯ СКАЗКА ПОЛЯРНОГО 😱🍂 ЕЩЁ БОЛЬШЕ «ПОСЛЕ», «МОЕЙ ВИНЫ» И ТРЭША С ВАТПАДА!","2023-07-29T09:00:22Z","UC4xZXizv7SCrct1j4IIzMzQ","Anthony Uly","22","23.30.07","момент|фрагмент из фильма|сцена|отрезок из фильма|сцена из фильма|энтони юлай|anthony uly|что почитать|книжная новинка|буктьюб|саморазвитие|книжные покупки|отношения|психология|книжный обзор|юмор|подростки|книги|антон ульянов|психология отношений|booktube|буктьюбер|книга|обзор книги|Полярный|Моя вина|После|Ватпаде|Книжные новости","176382","25421","0","1630","https://i.ytimg.com/vi/Zv50N3YEVpw/default.jpg","False","False","🩵 Психологу из Ясно можно доверять. Скидка 20% по промокоду ANTHONY на первую сессию: https://bit.ly/40YZEvU❖❖❖ТАЙМКОДЫ:00:00 — начало видео00:50 — спонсорская пауза03:08 — дисклеймер03:16 — книжные новости22:33 — прощаюсь с вами!❖❖❖МЕРЧ «АР Ю ЛОСТ БЕЙБИГЕРЛ» В ПРОДАЖЕ:— https://mamcupy.com/catalog/anthony-uly/МЕРЧ МОЖНО КУПИТЬ НА ВАЙЛДБЕРИС:— https://www.wildberries.ru/seller/95835?sort=newly&page=1ЛИМИТИРОВАННЫЙ МЕРЧ «УМЕЕШЬ ДУМАТЬ? ПОДУМАЙ!»• Мам, Купи! – https://mamcupy.com/catalog/anthony-uly/• Wildberries – https://www.wildberries.ru/brands/mam-kupi• Ozon – https://www.ozon.ru/brand/mam-kupi-100100207/                  ❖❖❖• ИНТЕРВЬЮ У ЮЗЕФОВИЧ — https://youtu.be/SDZFVqIWyug• ИНТЕРВЬЮ ДЛЯ ВМЕСТЕ — https://youtu.be/TN3AGy2WYXs• ИНТЕРВЬЮ ДЛЯ БОМПЕР — https://youtu.be/ksWRUOLAVKU• ЛИТЕРАТУРНЫЙ ПОДКАСТ — https://podcast.ru/e/4~zd41ZPQ0I• ПОДКАСТ С ПОПКОРН БУКС — https://youtu.be/s615rfM2Kkw• ПОДКАСТ С BUBBLE COMICS — https://youtu.be/Tr2vLz1ktWE                  ❖❖❖Если вы хотите поддержать меня материально, то вы можете задонатить мне на сбербанк (2202203646714628)), спасибо!                  ❖❖❖МОИ КНИЖНЫЕ ОБЗОРЫ — https://www.youtube.com/playlist?list=PLwXSaMiSfKo-UBWida28hNsiA_TUtxfqM                  ❖❖❖ЛЕТСПЛЕИ КЛУБА РОМАНТИКИ— https://www.youtube.com/playlist?list=PLwXSaMiSfKo-qdevyuvzaZJyHmCTqsfLnЛЕТСПЛЕИ НА SIMS 4— https://www.youtube.com/playlist?list=PLwXSaMiSfKo9hGaHPP9EPbnathc1_82lv                  ❖❖❖Музыка из видео:Jung Kook — Seven (slowed & reverb)Lotus (soft indie acoustic (no drums) x indie folk type beat)                   ❖❖❖Мои другие видео можно посмотреть здесь: «ОРЛЕАН» 🤬 ХАЛТУРА ИЗ ВАТПАДА ОТ ЗВЕЗДЫ ТИК ТОКА (как это выпустили?) — https://youtu.be/oFiK5QXR6Ik «ЛЕТО В ПИОНЕРСКОМ ГАЛСТУКЕ» ❗️ И ОТ ЭТОГО ВСЕ В ВОСТОРГЕ?— https://youtu.be/EWxRv6jc9jgПОЧЕМУ ЭТО ВСЕМ НРАВИТСЯ? 🦊 «ЛИСЬЯ НОРА» БЕЗДАРНО ИЛИ НЕТ? // ОБЗОР ТРИЛОГИИ «ВСЁ РАДИ ИГРЫ» — https://youtu.be/pwXGB8C-Y1E                   ❖❖❖ССЫЛКИ НА СОЦ. СЕТИ:➜ Тик ток ◍ https://www.tiktok.com/@anthonyuly96➜ В той самой запрещённой ◍ @anthonyuly ➜ Телеграмм канал ◍ https://t.me/anthonyuly➜ Присоединяемся к группе в ВК ◍ https://vk.com/anthonyulyofficial➜ Почта ◍ ulianovanton96@gmail.com➜ Кинопоиск ◍ https://www.kinopoisk.ru/user/14012384/➜ MyShows ◍ https://myshows.me/anthonyuly➜ Ask ◍ http://ask.fm/AnthonyUly96"
"CyWVWz3SqIg","Десятилетняя малышка пришла к женскому доктору. Сказала всего пару слов и врач потеряла дар речи","2023-07-28T10:05:00Z","UCSf79_HsfdJ2W4pDK6qto3Q","Лесная опушка💕","22","23.30.07","[none]","80114","2461","0","41","https://i.ytimg.com/vi/CyWVWz3SqIg/default.jpg","False","False","Десятилетняя малышка пришла к женскому доктору. Сказала всего пару слов и врач потеряла дар речи"
