video_id,title,publishedAt,channelId,channelTitle,categoryId,trending_date,tags,view_count,likes,dislikes,comment_count,thumbnail_link,comments_disabled,ratings_disabled,description
"RLOsklAo35s","Майнкрафт, НО Я СПАЛИЛ ЛИЦО 😎 | WICSUR #shorts","2023-07-28T16:40:00Z","UCqPSpViOkFJPodlL7wV8WNA","Бискас","20","23.30.07","Бискас|Вискас|wicsur|tiktok|клей|клекс|майнкрафт|Котизтиктока|рыжийкот|clexxd|верниаву|невернуаву","1745783","176985","0","4412","https://i.ytimg.com/vi/RLOsklAo35s/default.jpg","False","False","🌌Телеграм канал: https://t.me/ttwicsur💎ТикТок: https://www.tiktok.com/@wicsur?💟Инст: https://www.instagram.com/wicsur_re/?...🔮Группа ВК: https://vk.com/ttwicsur👾Наш дискорд - https://discord.gg/k3fMtng8Ya"
"eF-82sCUyhQ","Современные девушки 😂","2023-07-28T12:32:50Z","UCgvPE_DC9Q-ZJNAaXbppNVA","КАРЕНА МАКАРЕНА","22","23.30.07","[none]","1228300","116746","0","1995","https://i.ytimg.com/vi/eF-82sCUyhQ/default.jpg","False","False",""
"btLL3GLrIXE","НА БМВ ХВАТИЛО! А НА ЗАПРАВКУ - НЕТ","2023-07-27T14:10:00Z","UCUEScivF2b3SbT226laiEBw","Абрам TV","2","23.30.07","Бмв|Bmw","548722","13635","0","294","https://i.ytimg.com/vi/btLL3GLrIXE/default.jpg","False","False",""
"muuD-1XqIVs","ТАКТИЧЕСКИЙ МИНИ НОЖ ИЗ ХЛАМА С АЛИЭКСПРЕСС!","2023-07-28T11:00:43Z","UCnvziEmoKHOi4X9um0ydKBg","TheVovkaCom","24","23.30.07","самодельный нож|как сделать нож|нож с алиэкспресс|обзор ножей|мини нож|самый маленький нож|самоделки|лайфхаки|эксперименты|DIY|вовка|вовкаком|зевовка|как сделать|переделали нож","245816","12623","0","468","https://i.ytimg.com/vi/muuD-1XqIVs/default.jpg","False","False","Голосовой перевод видео в Яндекс Браузере: https://clck.ru/356kRuВ этом видео я купил очень дешевый нож с Али всего за 5 долларов! Мне понравилась его форма, но качество было удручающее, поэтому решено полностью его переделать и исправить все недочеты!------------------------------------Следи за мной в ВК - http://vk.com/g.vovkaИ Инстаграм - https://www.instagram.com/thevovkacom——————————————На канале присутствует реклама. - http://vk.com/topic-64091802_31055554---------------------------------------------------TheVovkaCom НЕ НЕСЕТ ОТВЕТСТВЕННОСТИ за людей, которые повторяют действия, представленные в видеоРекламодатель ООО Яндекс. ИНН 7736207543. Erid:LdtCJzFoS"
"We1gO0AhYM4","НАМ СНОСЯТ КАНАЛЫ из ЗА СЕКТЫ! уже минус один...  2 часть","2023-07-29T09:13:00Z","UCF0yfUFQlNS67JpGIh_9ApA","Паша Пэл","1","23.30.07","паша пэл|пел|криминал|Маньяк|страшный|Сериал 2023","640328","68771","0","3675","https://i.ytimg.com/vi/We1gO0AhYM4/default.jpg","False","False","► СКАЧАТЬ HASSLE на Андроид - https://play.google.com/store/apps/details?id=com.hassle.online►  СКАЧАТЬ с IPHONE - https://apps.apple.com/app/hassle-online/id1624507378?l=ru► ИГРАЙ УЖЕ СЕЙЧАС на ПК ► https://goo.gl/eakUiT___________________________‼️МОЯ ТЕЛЕГА ►► https://t.me/pel_video - ЭКСКЛЮЗИВ только для подписчиков ___________________________ПОДПИШИСЬ на этот канал чтобы не пропустить ЭКШЕН! ►► https://www.youtube.com/channel/UCkioI_uNCtHQwdE0gUINRqQ/?sub_confirmation=1___________________________МОЙ ИГРОВОЙ КАНАЛ - https://youtube.com/channel/UCjAGPS_TWab7fVMZqze2PsQ___________________________● Мой инстаграм ► https://www.instagram.com/pasha_pel/● МОЯ ГРУППА ►► https://vk.com/pasha_pel● МОЙ ВК ► https://vk.com/pasha__kalinin___________________________Исполнитель многих треков из этого видео - MujuiceРолик у Олега на канале - https://youtu.be/UpikUm1A6nQ___________________________● Прошлое видео - https://youtu.be/xqDgEpqjG8U"
"HwvntFjtedQ","TOUAREG NF 3.6 БЕНЗИН ПО НИЗУ РЫНКА. Сломалась ПНЕВМА. Что мы имеем за 1.4🍋 Поставил на учет. ОБЗОР","2023-07-28T13:22:53Z","UCvEl9YMLDRqFAdMAN9Cfr2w","ЮТУБ ХАТА","2","23.30.07","Touareg NF 3.6|Туарег NF по низу рынка|ПНЕВМА Touareg NF","126984","5448","0","492","https://i.ytimg.com/vi/HwvntFjtedQ/default.jpg","False","False","🔥 СКАЧАТЬ GRAND MOBILE - https://grnd.gg/?ref=hataМОЙ ПРОМОКОД НА 5 СЕРВЕРЕ: hata💰 ДАЁТ ГЕЛИК + 30.000 РУБЛЕЙ И VIP НА 7 ДНЕЙ!  НАШ ТЕЛЕГРАММ https://t.me/grandroleplay————————————Мой INSTAGRAM: https://www.instagram.com/usmanov.denisАктуальные и новые новости в моём телеграмм канале: https://t.me/YOUTUBEXATACHATПо рекламе на почту: fantomas5600@gmail.com"
"M0_WHulD4JY","Полянский в ООН ОШАРАШИЛ всех своим выступлением об УПЦ на Украине","2023-07-29T03:00:24Z","UC5Z2ZmwAJhPLRIBUVkQljMg","Россия - Украина","25","23.30.07","Россия Украина|срочные новости|Зеленский|Путин|политика сегодня|россия сша|украина сша|россия украина новости|политика новости","119185","7119","0","728","https://i.ytimg.com/vi/M0_WHulD4JY/default.jpg","False","False","✅Подписаться на канал https://www.youtube.com/channel/UC5Z2ZmwAJhPLRIBUVkQljMg?sub_confirmation=1💲💲💲 ПОДДЕРЖАТЬ канал https://www.donationalerts.com/r/russiaukraine-----------------------------------------------------------------------------------------------------------------------------------------✅ Подписывайтесь на канал ВНИМАТЕЛЬНО https://www.youtube.com/channel/UCqXYVoDf5Fzj9vUoC8jEHeQ?sub_confirmation=1Уважаемые подписчики. Поддержите канал ПОДПИСКОЙ в других соц сетях⭕Яндекс дзен https://dzen.ru/vnimatelno⭕Рутуб https://rutube.ru/channel/29771531⭕Бусти https://boosty.to/vnimrusСамые актуальные темы и новости. Самое важное что происходит в России и в мире на сегодняшний деньНе давайте себя обманывать... Думайте и Анализируйте Внимательно!ПОДПИСЫВАЙТЕСЬ НА КАНАЛ!https://www.youtube.com/channel/UCqXYVoDf5Fzj9vUoC8jEHeQ?sub_confirmation=1#РоссияУкраина #Новости #Внимательно #Политика #Политикасегодня #Россия #Украина"
"ZqhfIWaCgHU","МОЙ СЫН ПОДРАЛСЯ. РАЗБИРАЕМСЯ С ОТЦОМ ШКОЛЬНИКА. КТО ВИНОВАТ?","2023-07-29T12:00:02Z","UCqtzZMiZ5Bng7HCxI6154gg","Макс Ващенко","22","23.30.07","школьник|школьник подрался|разборки со школьником|школьники|отец школьника|подрался|фильм|сериал|ващенко|макс ващенко|РАЗБОРКИ|РАЗБОРКИ СО ШКОЛЬНИКОМ|ШКОЛЬНИК|ОТЕЦ ШКОЛЬНИКА|РАЗБОРКИ С ОТЦОМ ШКОЛЬНИКА|ШКОЛЬНИК ВИНОВАТ|РАЗБОРКИ ШКОЛЬНИКОВ","252336","28539","0","1279","https://i.ytimg.com/vi/ZqhfIWaCgHU/default.jpg","False","False","Купил две Машины - https://youtu.be/QOglg9-4uZ8ссора с сыном – https://t.me/vashchenko_maxМОЙ СЫН ПОДРАЛСЯ. РАЗБИРАЕМСЯ С ОТЦОМ ШКОЛЬНИКА. КТО ВИНОВАТ?► ПРОМОКОД (/pcode) на 16 сервере - VASHENKO (Мой ник - Max_Vashenko)► ИГРАЙ В RADMIR С КОМПЬЮТЕРА ► https://radmir.online►ЧТОБЫ ИГРАТЬ С ТЕЛЕФОНА ► https://hassle.online/ ► ЧАТ ПО ИГРЕ ВК: https://vk.me/join/AJQ1d3u7QyWwrHdCsGfqDIvKмой проект – https://t.me/+m8CZJlDinPNhNzZiВконтакте : https://vk.com/max.vashchenkoофициальная группа вк: https://vk.com/vashchenkopubвторой канал: https://www.youtube.com/@vashchenko_live тик ток: https://www.tiktok.com/@vashchenko_maxВидео не является реальным. Вся ситуация постановочная и носит исключительно художественный характер. В видео присутствуют актеры.Реклама/Сотрудничество: k1noman@mail.ru"
"MfO9Ws_m7JU","Kyrgyzstan laghman 🇰🇬 Кыргызстан #kyrgyzstan #кыргызстан #abirzkitchen","2023-07-28T19:48:08Z","UCgoKH0e1n5II305aJamUnWA","Abirz Kitchen","22","23.30.07","[none]","302294","21566","0","575","https://i.ytimg.com/vi/MfO9Ws_m7JU/default.jpg","False","False",""
"XZ8ShBuX_xY","КАК ДАЛЕКО САМЫЙ ДЛИННЫЙ ЛИМУЗИН СМОЖЕТ ПРОЕХАТЬ ПОД ВОДОЙ ДО ФИНИША? ЭКСПЕРИМЕНТЫ ГТА 5","2023-07-29T11:00:20Z","UC8j5GsMc0pjInklm4DfwCZQ","Джел","20","23.30.07","гта|гта 5|гта 5 онлайн|гта 5 online|gta|gta 5|gta 5 online|gta online|гта онлайн|джелл|джэл|jell|прятки гта онлайн|джел гта 5|джел|новое шоу|новая рубрика|скилл тест гта 5|эксперименты|гта 5 эксперименты|ступеньки гта 5|гта 5 ступени|сможет ли|сможет ли гта 5|бигфут|гта 5 моды|моды в гта 5|джел лестница|сломанная дорога|джел новые серии|подводные горки|под водой|водные горки джел|эксперименты гта 5|читерские|лимузин|самый длинный|мега","270863","17142","0","715","https://i.ytimg.com/vi/XZ8ShBuX_xY/default.jpg","False","False","🎮Сегодня поиграем в GTA 5 Online с рубрикой ЭКСПЕРИМЕНТЫ или же ПОДВОДНЫЕ ГОРКИ, в которой мы должны как можно дальше проехать под водой до финиша, чтобы заработать как можно больше баллов, безумно трудный и веселый эксперимент в gta 5 online! Кто победит сегодня в видео?​📮Мой телеграм: https://t.me/prostojell📘Я в вк: https://vk.com/jel_re📓Я в тикток: https://tiktok.com/@prostojell🤠Чуваки из видео:🔹​ Flazin - https://www.youtube.com/c/Flazin🔔Надеюсь вам понравилось видео и вы оцените его лайком👍 а также подпишитесь на мой канал✅, чтобы не пропустить новые видео :D🌚Битва воров: https://youtu.be/aZ5lR9_pNLk🌊Водный эксперимент: https://youtu.be/irqAVA3FAs8🚠Битва за контейнеры: https://youtu.be/JVqCg9l8ncQ🎲Битва рандома: https://youtu.be/8cyuo3ozMkw#эксперименты​​ #джел​​ #гта5​​ #gta5"
"A3tQpki0yd4","[MIX & MAX] TXT YEONJUN & HUENINGKAI (연준&휴닝카이) 'TEMPTED + The Devil I Know' (4K)","2023-07-28T14:00:06Z","UCEIi7zFR_wE23jFncVtd6-A","STUDIO CHOOM [스튜디오 춤]","24","23.30.07","M2|엠투|스튜디오 춤|스춤|Studio choom|COVERS|커버스|DANCE THE X|댄스 더 엑스|댄스|DANCE|비 오리지널|BE ORIGINAL|커버|COVER|Artist Of The Month|AOTM|Drop the dance|드롭더댄스|Mix & Max|믹스앤맥스|믹앤맥","957084","199346","0","11967","https://i.ytimg.com/vi/A3tQpki0yd4/default.jpg","False","False","[MIX & MAX] TOMORROW X TOGETHER YEONJUN & HUENINGKAI 'TEMPTED + The Devil I Know'[믹스앤맥스] 투모로우바이투게더 연준&휴닝카이 'TEMPTED + The Devil I Know'연준&휴닝카이 퍼포먼스합 미쳤다😈🔥(1:13) 연주니즈 분위기 반전 레전드임..2023.8.4 'Choreo-Record' Coming Soon* Original Track: TEMPTED Produced by MAIZ & Will Bowes ‘The Devil I Know’ * Choreographer & Performance Director: SUBIN KIM / HYUNWOO WOO / JAEPY / KAIN* Dancer: Kyungmin / Larf / Than Kim / Kori / Cobaltblue / HyunWoo / Hwi gun / Veri / Hiro / Daejun / Heonbin / Hoho[MIX & MAX] A collaborated pair performance showing the synergy of two K-POP artists, and a peek into their inner thoughts about dance.Welcome to the new K-POP Dance journey of STUDIO CHOOM with your favorite K-POP Artists!'MIX & MAX' present by 스튜디오 춤K-POP 아티스트의 시너지가 담긴 페어 퍼포먼스와 춤에 대한 깊은 이야기를 들어보는 시간#MIXandMAX #믹스앤맥스Stream various performance video on #STUDIOCHOOM!👉SUBSCRIBE👈YouTube: https://www.youtube.com/STUDIOCHOOMFacebook:  https://www.facebook.com/StudioCHOOMInstagram: https://www.instagram.com/studio_choom/Naver TV: https://tv.naver.com/cjenm.STUDIOCHOOM"
"it41tCtxCJE","Крупнейшая авиакатастрофа на райском острове","2023-07-28T11:06:12Z","UC3yjMTYgk-OUslwfq6J2Jog","GEO2","24","23.30.07","канарские острова|катастрофы|выживание|авиакатастрофа|самолеты|боинг|история|Geo2|Гео2","123321","9410","0","362","https://i.ytimg.com/vi/it41tCtxCJE/default.jpg","False","False","ПОДДЕРЖАТЬ КАНАЛ:● Boosty: https://clcr.me/Boosty_GEO● Патреон - https://www.patreon.com/GEOSHOW_______● Телеграм Канал: https://t.me/GEOSHOW_______Другие мои каналы и друзья:● TANI -  @TANISHOW  ● GEO -   @GEOSHOW  _______●  Группа ВК: https://vk.com/geeeo"
"OVNl3bABW1U","ГОТОВИМ МОТИ - РЕЗУЛЬТАТ УБИЛ 😲 ОЖИДАНИЕ vs РЕАЛЬНОСТЬ","2023-07-28T13:01:07Z","UCuOWD7F10U_TdT1O7UiDb9g","Наталья Володина","24","23.30.07","моти|рецепт моти|как приготовить моти|готовим моти|моти рецепт|моти дома|курник|как приготовить курник|курник рецепт|рецепт курник|пицца|школьная еда|пицца тилька|тилька пицца|обзор еды|еда|обзор фастфуда|готовлю|готовим|готовим дома|рецепт|пробуем рецепт|сосиски в тесте|сосиски в тесте рецепт|рецепт сосиски в тесте|наталья володина|тилька плей|tilka play|тилльняшка|тилька курник","84332","16374","0","596","https://i.ytimg.com/vi/OVNl3bABW1U/default.jpg","False","False","Признавайтесь, захотелось попробовать новый BIGBON WOK?! Он вдохновлен вкуснейшим  блюдом азиатской кухни  за 5 минут. Мои фавориты это «Курица в соусе терияки» и «Якисоба в соусе по-японски» - https://clck.ru/3578S9🧡🧡🧡🧡 Готовлю шарлотку: https://youtu.be/sihcG7VYdl8💜 Готовлю сосиски в тесте https://youtu.be/SuNeYZgjPWg🧡 Готовлю курник: https://youtu.be/HtRD41dl_Zw►►►►► Мои Соц.Сети ►►►►►🧡 ТикТок: https://www.tiktok.com/@tillnyaschka💜 НАШ ТЕЛЕГРАМ: https://t.me/tilkaplayTG💙 Я в ВК: https://vk.com/tillnyaschka►►►►► Мои Контакты для сотрудничества ►►►►►💖 Реклама и сотрудничество - reklama@tilka.su► Для Хакеров: Просьба не тратить мое и свое время на письма на мой рабочий email адрес. На почте работает мой менеджер, у которого нет доступа до моего канала. Я не устанавливаю никаких приложений и не перехожу по ссылкам из писем. Ведем переписку только с официальными под доменными почтами. ►►►►► Прочая информация ►►►►►Всем привет) Это мой второй канал, на котором я буду выкладывать видео каждую неделю. Эти видео я снимаю в основном для себя и людей, которым меня мало на основном канале :))) Так что, наслаждайтесь)))Реклама. Рекламодатель. ООО МАРЕВЕН ФУД СЭНТРАЛ. ИНН 5077018948. Erid: LjN8KATKo"
"XNxf58DYQ7c","What Drains a Woman? 💔🪫","2023-07-28T12:00:33Z","UC5gxP-2QqIh_09djvlm9Xcg","Alan Chikin Chow","23","23.30.07","Alan chikin chow|Alan chikin show|Alan chicken chow|Alan chickin chow|Alan chicken show|Alan chikin chow what drains you|Alan chikin chow battery|Alan chikin chow energy|Alan chikin chow drains woman|Alan chikin chow fan fics|Alan chikin chow and friends|Alan chikin chow maid|Alan chikin chow instagram|Alan chikin chow tiktok|Alan chikin|Alan army|Alan chikin chow prince|Alan chikin chow princess","5036057","134405","0","130","https://i.ytimg.com/vi/XNxf58DYQ7c/default.jpg","False","False","Hey Alan Army, this is Alan Chikin Chow! Thanks for watching my video 😍#Shorts Follow me on IG for your daily dose of Chikin 🐥IG: https://www.instagram.com/alanchikinchowMY GIRLFRIEND IS OBSESSED WITH BRIDGERTON  ➡️  https://youtube.com/shorts/tIvd7UZJg3YSubscribe and hit the bell notification so you never miss a video! 😉🔥 WHO AM I 🔥Hey Alan Army, I'm Alan Chikin Chow!I'm a creator, actor & writer. My mission is to inspire a universal audience to unite through laughter and storytelling. 🤍#AlanArmy"
"3toy0Wi6MpE","У МУЖА ЧАСТО НАЧАЛИСЬ НОЧНЫЕ ДЕЖУРСТВА! Тест на беременность 2. ВСЕ СЕРИИ. Мелодрама","2023-07-28T15:40:03Z","UCu57WEkY0uhxTPtT-UAfA5w","Movie Lab","1","23.30.07","Тест на беременность 2|Тест на беременность 2 все серии|лучшие мелодрамы|мелодрамы|фильмы 2023|мелодрама 2023 новинки|сериалы 2023 года|кино 2023 новинки|мелодрама|мелодрамы 2023|kino filme 2023|кино 2023|фильмы|сериалы|фильмы 2023 которые уже вышли|новые фильмы 2023|мелодрама про любовь|мелодрами 2023|лучшие русские мелодрамы","152207","774","0","13","https://i.ytimg.com/vi/3toy0Wi6MpE/default.jpg","False","False","ТЕСТ НА БЕРЕМЕННОСТЬ 2. МелодрамаРежиссеры: Олег Асадулин, Антон Сиверс, Клим Шипенко (уч.)Сценаристы: Маргарита Удовиченко, Татьяна Соломатина (уч.), Анна Пронина (II)Операторы: Андрей Иванов (VI), Михаил ВерийскийКомпозиторы: Дарин Сысоев, Анатолий ЗубковХудожники: Софья Сладкова, Мария ЗолинаПродюсеры: Юрий Сапронов, Наталия Лазарева, Авдей Кирьянов (иcп.), Лолита Халикова (иcп.)Кастинг-директор: Анжела ТимерхановаАктеры: Светлана Иванова, Кирилл Гребенщиков, Данила Дунаев, Лянка Грыу, Александр Яцко, Артур Ваха, Татьяна Рассказова, Анна Каменкова, Кирилл Варакса, Александр Нестеров (II), Юлия Галкина, Владимир Кошевой, Маргарита Адаева, Серафима Огарёва, Юлия Горшенина, Агния Кузнецова, Ольга Дибцева, Андрей Ургант, Анна Пескова, Ольга Кузьмина, Диана Манукян, Алина Алексеева (II), Михаил Клепиков, Сергей Мигицко, Полина Ауг, Юлия Ауг, Никита Косточко, Анастасия Уколова, Стелла Ильницкая, Ола Кейру, Наталья Коренная, Татьяна Кузнецова, Мария Аниканова, Мария Кроль, Егор Лучишкин, Иван Щенин, Диана Писаренко, Вячеслав Щенин, Татьяна Чердынцева, Олег Тилькин, Мария Козакова, Юлия Марченко, Юлия Акимова, Елизавета Нилова, Александр Строев, Андрей Лёвин, Мария Шумакова, Анна Бреннер-Вартаньян, Лаура Кеосаян, Максим БелбородовПроизводство: Всемирные Русские Студии (RWS)Премьера: 2 декабря 2019 (Первый канал)Cерий: 16Жанр: мелодрамаМеста съемок: Москва, Санкт-Петербург (Стрелка Васильевского острова, Дворец Великого князя Владимира Александровича, Политехнический университет), Середниково (Усадьба Середниково)Связанные проекты: Тест на беременность (2014), Тест на беременность-3 (2022), Тест на беременность-4 (2022)После того, как год назад Наташа Бахметьева родила сына Мишку, она решила полностью посвятить себя материнству. Однако ее муж Андрей все чаще стал пропадать на ночных дежурствах, что еще больше отдалило супругов друг от друга.Однажды Бахметьева узнает, что в медцентре за несколько дней по неизвестным причинам умерло семь новорожденных. Эта информация дошла до журналистов, после чего в заведение приезжает специальная комиссия. В ее состав входит и уволенная когда-то Наташей Инга Елизарова. Благодаря ее стараниям вместо главврача Саморядова назначают Колмогорова, который хочет вернуть Бахметьеву и сына. Он просит ее выйти на работу в медцентр, иначе сделает всё, чтобы его закрыли. Одновременно с этими событиями в Андрея влюбляется помощница Колмогорова – Женя Митрич. Сможет ли Наташа спасти заведение, в которое вкладывала столько сил, и сохранить отношения с мужем?Не забывайте подписаться!Приятного просмотра!#MovieLab #химия_сериалов"
