video_id,title,publishedAt,channelId,channelTitle,categoryId,trending_date,tags,view_count,likes,dislikes,comment_count,thumbnail_link,comments_disabled,ratings_disabled,description
"jBeXyKVvhb0","How England’s football league is breaking the sport","2023-07-25T12:00:27Z","UC7KbIaEOuY7H2j-cvhJ3mYA","Search Party","17","23.30.07","sam|ellis|johnny|harris|search party|vox|vox borders|vox atlas|vox explained|geopolitics|news|sports|politics|explainers|journalism|premier league|football|soccer|england|fulham|ffc|chelsea|cfc|fifa|europe|uk|british|teams","629420","31402","0","2688","https://i.ytimg.com/vi/jBeXyKVvhb0/default.jpg","False","False","And why the rest of Europe can’t keep upUse code SEARCHPARTY at the link below to get an exclusive 60% off an annual Incogni plan: https://incogni.com/searchpartySince 1992, the English Premier League has enjoyed some of the most remarkable growth in sports history. Today, its clubs collectively generate more than Є6.5 billion in revenue each year.  But Europe’s other leagues make far less, and their disadvantage is starting to make the sport less competitive.Check out all our sources here: https://docs.google.com/document/d/1Y0uOga8hYh5tZhqB8BWZZkPijm9Vpyf4bIHvP3jYbls/edit?usp=sharingWelcome to Search Party!Search Party is a new, independent, video news show that combines experienced journalism and visual design to decode the most complex stories in international sports and geopolitics.Subscribe and turn on notifications 🔔  so you don't miss any videos: https://www.youtube.com/@Search-PartyBecome a Search Party Original member today: https://www.youtube.com/channel/UC7KbIaEOuY7H2j-cvhJ3mYA/joinAbout:Search Party is led and produced by Sam Ellis, a journalist, director, editor, and animator based in New York City. For more than 6 years, Ellis produced the hugely popular video series, Vox Atlas, for which he earned an Emmy nomination. He specializes in breaking down the most complex new stories and presenting them with a refreshing, accessible, and engaging visual style. He’s produced explainers on some of the world’s thorniest geopolitical stories; from corruption scandals in Latin America, conflict in the Middle East, and the rise of China, to the world of sports; the Monaco Grand Prix, the FIFA corruption scandal, and the 100-foot waves of Nazaré, Portugal.  Ellis has also directed multiple episodes of TV; notably on Netflix’s ‘Explained’ and HBO Sport’s ‘Level PLaying Field’. Got story ideas or tips? Reach out to the team at:Twitter: https://twitter.com/swellis_Email: sam@searchparty.ch"
"z8WsygwTiLU","When loan sharks turn into regular businessmen.","2023-07-25T22:17:40Z","UCI1XS_GkLGDOgf8YLaaXNRA","CalebCity","23","23.30.07","CalebCity|comedy|you laugh you loose|tiktok|ylyl|Caleb|City|business men|rdc","707333","93392","0","3627","https://i.ytimg.com/vi/z8WsygwTiLU/default.jpg","False","False","He was never in danger-MusicOddwin - 19-When loan sharks turn into business men."
"Bb1o58OQ6lQ","Why Guitar Players Don't Play Yamaha","2023-07-25T16:31:02Z","UCCJ56k8nBeqWLoxNa6DToAQ","Rhett Shull","10","23.30.07","[none]","630270","14731","0","6677","https://i.ytimg.com/vi/Bb1o58OQ6lQ/default.jpg","False","False","So, I've decided to bring back the Gear Talk series. I've been missing it for a while, and I'm excited to get back to some classic reviews. Again, this series is sponsored by Sweetwater and I really want your input on what you'd like me to check out in the series. Anything goes, guitars, gear, recording equipment, mics, whatever you want to see, let me know! Links to gear used (affiliate links)Yamaha Revstar (Hot Merlot)https://sweetwater.sjv.io/WqNvYXAEA R92 Ribbon Mic https://sweetwater.sjv.io/6eEQGGZoom H6https://sweetwater.sjv.io/q4ED6yRode Camera Michttps://sweetwater.sjv.io/vNV92j————————————GET ACCESS TO ALL MY VIDEO COURSES HERE (The Inner Circle)https://rhettshullguitarcourses.com/p/inner-circleMY VIDEO COURSES:The Alternate Tuning Course (NEW):https://rhettshullguitarcourses.com/p/alternate-tuning-courseCowboy Chords Breakout Coursehttps://rhettshullguitarcourses.com/p/breaking-out-of-cowboy-chordsPentatonic Breakout Coursehttps://rhettshullguitarcourses.com/p/breaking-out-of-the-pentatonic-boxFretboard Fundamentals Slide Guitarhttps://rhettshullguitarcourses.com/p/slideChords and Rhythm Coursehttps://rhettshullguitarcourses.com/p/fretboard-fundaments-rhythm-editionFretboard Fundamentalshttps://rhettshullguitarcourses.com/p/ffThe Complete Nashville Number System video coursehttps://rhettshullguitarcourses.com/p/nashville-number-systemThe Tone Coursehttps://rhettshullguitarcourses.com/p/the-tone-course"
"m5cxXmbSIks","I played Armored Core 6... my thoughts","2023-07-25T15:00:23Z","UC477Kvszl9JivqOxN1dFgPQ","Iron Pineapple","20","23.30.07","armored core|armored core 6|souls like|soulslike|iron pineapple|dark souls|elden ring|gameplay|review|guide|commentary","814489","39323","0","3215","https://i.ytimg.com/vi/m5cxXmbSIks/default.jpg","False","False","I played Armored Core 6: Fires of Rubicon for 6 hours, and as someone previously unfamiliar with Armored Core, I have a lot of thoughts.twitter: https://twitter.com/IronPineapple_TIMESTAMPS0:00 Intro0:36 FromSoftware Souls Fan Perspective1:43 Quick Review2:16 Basic Overview2:53 Movement & Boosting4:24 Targeting/Shooting5:32 Weapons6:30 Scanning & Healing6:44 Combat and STAGGER8:10 Attack Power and Impact8:45 More Weapons (sword and shield too)9:42 Boost Kick and Core Expansion10:15 Movement is important 10:51 Combat Difficulty 11:23 SOULS-LIKE???12:16 Mech Customization16:32 Missions Overview18:01 Desert Mission18:44 Operation Wallclimber Mission19:26 Mission 1119:41 FINAL BOSS20:52 Interview with Director Masaru Yamamura21:53 Interview Questions/Answers26:12 Conclusionalso big thanks for help from:Onua for creating the SFM pose of the knight in the thumbnail: https://twitter.com/Odynom"
"HfO8ABZBf9k","LACKADAISY Season 1 Teaser","2023-07-25T16:45:11Z","UCHpyAufyq1-igTlgA9XjbcQ","Lackadaisy","24","23.30.07","[none]","1092712","184988","0","7246","https://i.ytimg.com/vi/HfO8ABZBf9k/default.jpg","False","False","You heard right! Lackadaisy SEASON ONE is now up for funding on BACKERKITClick the following linkhttps://www.backerkit.com/c/iron-circus-comics/lackadaisy-bookset-and-plushes?ref=youtube_teaserand help fund season one by purchasing plushies, books, pins, and more! Ends on August 24th 8pm Central"
"VgEvWRV8k4w","Doctor Reacts to Bronny James Cardiac Arrest - What Happened?","2023-07-25T22:49:53Z","UCHlBaw2X5iYQGJhd5v718Zw","Brian Sutterer MD","17","23.30.07","bronny james|cardiac arrest|lebron james|bronny james cardiac arrest|bronny james collapse|bronny james cardiac|doctor explains|bronny james health|nba news|nba|bronny james usc","364761","10569","0","3169","https://i.ytimg.com/vi/VgEvWRV8k4w/default.jpg","False","False","Thank you Tommy John for sponsoring this video. Click here https://bit.ly/tommyjohn_brianmd3 to try Tommy John and get 25% off plus free shipping within the US on orders over $75 when you use my code BRIANMD3Bronny James suffered cardiac arrest last night. In this video, Doctor Sutterer reviews what this means for the buddy star and son of LeBron JamesMY MUSIC:Epidemic Sound - Sign up with this link for a FREE 30 day trial!https://www.epidemicsound.com/referral/2m1bb5/Follow Me on Twitter!https://twitter.com/briansuttererMDI'm a doctor and a sports fan and this channel is dedicated to exploring the unique medical side of the world of sports, including NBA, MLB, NFL, UFC, and many more! Breaking down the biggest what ifs, historical injuries and stories, and making learning about medicine fun and relevant for all sports fans!Anatomy images: https://www.biodigital.comDISCLAIMER: Content not intended to be taken as medical advice. Opinions are my own and do not represent those of my employer. I have not personally treated or evaluated the individual(s) discussed in this video. Content used with educational and transformative intent within Fair Use GuidelinesContent owned and produced by Brian Sutterer LLC 2023"
"DAOZJPquY_w","Post Malone - Mourning (Official Music Video)","2023-07-24T15:00:09Z","UCOhtMAg7xh8wv_wUHMgFc-Q","PostMaloneVEVO","10","23.30.07","Post|Malone|Mourning|Mercury|Records/Republic|Records|Pop","4563878","235427","0","6212","https://i.ytimg.com/vi/DAOZJPquY_w/default.jpg","False","False","Music video by Post Malone performing Mourning. © 2023 Mercury Records/Republic Records, a division of UMG Recordings, Inc.http://vevo.ly/Zmtdg4"
"W-lV-VaQkQ0","This Ruined My Life","2023-07-24T21:01:26Z","UCV9_KinVpV-snHe3C3n1hvA","shane","23","23.30.07","Shane|Dawson|conspiracy|theories|journalism|investigative journalism|docuseries|documentary","975234","44816","0","4945","https://i.ytimg.com/vi/W-lV-VaQkQ0/default.jpg","False","False","WE MOVED! HOUSE TOUR! https://www.youtube.com/watch?v=ggxFSoVmUAs2000’s CONSPIRACY THEORIES! FRIENDS & MANDELA EFFECTS! https://youtu.be/fIXkHsRIjO8OUR ANNOUNCEMENT VLOG https://www.youtube.com/watch?v=Wqwn12ahOUwNEW MERCH! https://www.shanedawsonmerch.com/  My IG https://www.instagram.com/shanedawson/?hl=enAlso follow me on Threads! Produced by Spencer Bernard Cinematography by ChrisBstation  @ChrisBstation   Ryland  @Rylandvlogs @RylandAdams  Rylands Podcast   @thesipwithrylandadamsandli5476 Morgan @morgansvlogs @MorganAdams1 Vicki https://www.instagram.com/vickiadams26/?hl=enBruce https://www.instagram.com/bruceadams26/?hl=enIn this special birthday video I paid bakers $1000 each to bake my face! I also give updates on life and spend some very interesting quality time with my family. Enjoy!! Rosanna Pansino - I PAID Bakeries $800 EACH to BAKE MY FACE!https://www.youtube.com/watch?v=utoVftQ_4zsTrixie Mattel - I ordered life-size Trixie cakes from 3 LA bakeries | Blind Reactionhttps://www.youtube.com/watch?v=ugk3nDLpoGUMusic by LYRE  - CLICKBAIT - https://thmatc.co/?l=198CE167Music by Free Arlo - 2 far gone - https://thmatc.co/?l=86757B3FMusic by LYRE - WANNABES - https://thmatc.co/?l=237A9D19Music by Lillian Hepler - Baddie - https://thmatc.co/?l=1E2E250CMusic by LYRE  - CRY WOLF - https://thmatc.co/?l=FA48B40FMusic by Jennifer Zhang - Love You Like Me - https://thmatc.co/?l=9567A6EEMusic by Elli Moore - Romeo - https://thmatc.co/?l=E3EFB01A"
"ii-PdBemO4s","*NEW* FUTURAMA Update in Fortnite","2023-07-26T13:58:24Z","UCTgQTM6B97Tk5FPNOWZMB1Q","x2Twins","20","23.30.07","x2twins|x twins|twins|fortnite|oce|battle royale|x2jesse|jesse|x2jordan|jordan|chapter 3|season 3|chapter 3 season 3","205411","7051","0","402","https://i.ytimg.com/vi/ii-PdBemO4s/default.jpg","False","False","Join for custom games & more!► https://discord.gg/x2twinsFollow us here!► TWITCH -  https://www.twitch.tv/x2twins► TWITTER - https://twitter.com/x2twins► TIKTOK - https://vm.tiktok.com/cQgdDd/► INSTAGRAM - https://www.instagram.com/x2twinss"
"dZrgAMWvIBA","【#holoAdvent】WANTED!【hololive English New Unit Debut PV】","2023-07-26T02:57:09Z","UCotXwY6s8pWmuWd_snKYjhg","hololive English","24","23.30.07","[none]","778225","58145","0","2745","https://i.ytimg.com/vi/dZrgAMWvIBA/default.jpg","False","False","hololive English ‐Advent‐ debuts on 7/29-30 PDT!👁‍🗨 @ShioriNovella  (Debut: 7/29 @ 8:00 PM PDT)Debut stream: https://www.youtube.com/watch?v=EwGAcKnE-y4🗿 @KosekiBijou  (Debut: 7/29 @ 8:45 PM PDT)Debut stream: https://www.youtube.com/watch?v=rpAQib0T5v0🎼 @NerissaRavencroft  (Debut: 7/30 @ 8:00 PM PDT)Debut stream: https://www.youtube.com/watch?v=gg3SrFzHn9M🐾 @FUWAMOCOch (Debut: 7/30 @ 8:45 PM PDT)Debut stream: https://www.youtube.com/watch?v=Kttt7pb5o6I====================CREDITS:[Editors]Ni-c (https://twitter.com/gokinjocat)よし (https://twitter.com/yoshi_8900)[Key Visual]Chyan (https://twitter.com/qleleldhcks)[Music]az sound====================Follow the official hololive English accounts!▶Official YouTube channel: @hololiveEnglish   ▶Official Twitter: https://twitter.com/hololive_En▶Official Facebook: https://www.facebook.com/hololivetv/▶️Official Reddit: https://www.reddit.com/r/Hololive/▶Request from hololive production to underage viewers:Please be sure to check the link below before viewing our content.https://en.hololive.tv/request-to-minors"
"u1sGH4xX89c","A Sicko Serial Killer and NEVER CAUGHT ?!? Jack the Ripper pt 1 | Mystery & Makeup | Bailey Sarian","2023-07-24T19:00:21Z","UCtNdVINwfYFTQEEZgMiQ8FA","Bailey Sarian","24","23.30.07","Bailey sarian|youtube bailey sarian|bailey sarian youtube|bailey|mystery makeup monday|monday mystery makeup|mystery makeup|mystery makeup mondays|new makeup tutorial|makeup and story time|story time and makeup|story time|grwm|grwm and makeup|get ready with me and makeup|makeup grwm|flawless foundation|mystery monday|mystery|monday story time|dark history|history story|hilarious|true crime story|true crime|tiktok|tattoo tour|tattoos|90s makeup|grunge","1208588","50800","0","2991","https://i.ytimg.com/vi/u1sGH4xX89c/default.jpg","False","False","Treat yourself to a new case and go to http://www.casetify.com/baileysarian today to save 15% off your order! Thanks to Casetify for sponsoring this video!Hi friends, happy Monday! Today’s story is about one of, if not the most, famous serial killer ever- Jack the Ripper. Yes, we’re talking about Jack the Ripper. There is so much information out there about this guy, and his story still sends shivers down my spine. Stay tuned for a part two coming soon!Also, let me know who you want me to talk about next time. Hope you have a great rest of your week, make good choices and I'll be seeing you very soonxoBailey Sarian________:  :    F O L L O W    M E     :  :Discord: http://discord.gg/baileysarianTik Tok: https://bit.ly/3e3jL9vInstagram: http://bit.ly/2nbO4PRFacebook: http://bit.ly/2mdZtK6Twitter: http://bit.ly/2yT4BLVPinterest: http://bit.ly/2mVpXnYYoutube: http://bit.ly/1HGw3OgSnapchat: https://bit.ly/3cC0V9dRECOMMEND A STORY HERE : cases4bailey@gmail.com Business Related Emails : Baileysarianteam@wmeagency.comWanna Send Me Something?Bailey Sarian4400 W Riverside Dr Ste 110-300,Burbank, CA 91505_________:  :    P R O D U C T S     U S E D    :  :FACEPat McGrath Labs Skin Fetish Sublime Perfection Foundation https://howl.me/ckcxA3xPBeIDose of Colors 08 Light Concealer https://howl.me/ckcxA24l6A0Danessa Myricks Prism FX Hydrating Lotion Peach https://howl.me/ckcxA3nMIjIGucci Bronzing Powder 03 https://howl.me/ckcxA29xAW2Hourglass Ambient Lighting Edit Sculpture Palette https://howl.me/ckcxA20Ic1WMAC Fix+ https://howl.me/ckcxA2MWiK1Laura Mercier Translucent Loose Setting Powder https://howl.me/ckcxA2Ug8xQUrban Decay All Nighter Makeup Setting Spray https://howl.me/ckcxA2LjQjYEYESRare Beauty Eye Primer https://howl.me/ckcxA2WiFJITarte Shape Tape Corrector Yellow https://howl.me/ckcxA3pHrtKEssence Lash Princess Mascara https://howl.me/ckcxA3x7RmANARS Radiant Creamy Concealer Cafe Au Lait https://howl.me/ckcxA3FfEIJNARS Radiant Creamy Concealer Madeleine https://howl.me/ckcxA32kMmULash Couture Super Strong Strip Lash Adhesive https://howl.me/ckcxA4t4x8GSalon Perfect Winged Lash 692 https://howl.me/ckcxA4UJA0PKelley Baker Brow Defining Pencil Dark Brown https://howl.me/ckcxA30eyZXABH Norvina Collection Pro Pigment Palette VOL. 5 https://howl.me/ckcxA31Wl0hLIPSBuxom Plumping Lip Cream Vanilla Bean Bourbon https://howl.me/ckcxA4nCGeeColourPop Lippie Pencil Cool BFF https://howl.me/ckcxA30Bwh6NARS Honolulu Honey Lipstick https://howl.me/ckcxA393ZMDMAC Aute Couture Liquid Lip Color Jalea DISCONTINUED https://howl.me/ckcxA3Qf4Ov♡ *These links are affiliate links. Which means, if you click on the link and purchase a product, a small percentage comes back to me. It helps me keep on keepin on with my videos, and I appreciate you if you choose to support. If you don’t, that’s ok too."
"pYwgLNQDNyU","DETECT MY LOVE - MYSTA RIAS (prod. Camellia)","2023-07-25T12:50:10Z","UCIM92Ok_spNKLVB5TsgwseQ","Mysta Rias 【NIJISANJI EN】","10","23.30.07","にじさんじ|NIJISANJI EN|vtuber|envtuber|english vtuber|English|male vtuber|Luxiem|Ike Eveland|Mysta Rias|Shu Yamino|Luca Kaneshiro|Vox Akuma|LazuLight|OBSYDIA|Ethyria","1800534","179912","0","18955","https://i.ytimg.com/vi/pYwgLNQDNyU/default.jpg","False","False","It's finally released huh? Please don't take my singing so seriously, I made this a fun little project for myself! I'm no singer, rapper or song writer but I for sure had fun with what was produced and I think that is clear to see!Hope you all enjoy and thanks so much to Camellia for making this happen!Vocals by Mysta RiasMusic produced/arranged by CamelliaLyrics by Camellia & Mysta RiasArt by GurepyonArtTwitter: https://twitter.com/Mysta_RiasLYRICS: (Woah-oh) (Ah ah)(Woah-oh)De-De-DeDetect my-(Woah-oh) (Ah ah)(Woah-oh)De-De-DeDetect my-I wanna feel your heat against my skin (uh-huh)These feelings I've been trying to hold in (uh-huh)Oh won’t you please just let me in (uh-huh)I want you baby just let me inyou know i can see it in your eyesDon't sit and act like you're surprisedI'm so tired of playing niceI know you want my love tonightI knew you were the one when i laid sightGive me a chance to impress you with all my mightOkay I’m rapping while this song is bumping, Swing those arms yeah get them pumpingI'm gonna just keep saying words to make you think I’m saying somethingIn reality i put this part here for essentially nothingBut i sound coolNow can you feel my heartDetect my loveIt’s something you don't know you missLa-lee-luh-loveHow many words before youDetect my loveYou know that i love you (Yeah)Only one option to choose (Yeah)Hey I won't let you stay shyWhen you’re in front of this mysterious guy(Woah-oh)De-De-DeAnd i'm back forAnother rap yourGonna tell me how to make you want me back yeahI live inside your head everyday rent freeMy influence be getting bigger everyday i needSome competition cause I’m tired of being in this positionGetting told to disappear like I’m a fucking magicianBut i don’t listen, making numbers like a fucking mathematicianyou do nothing with your life for years its fucking tradition so yeahI'll be over in this corner going fucking insaneIn my room alone writing these words inside my brainThe only outlet that i have since i rose to fameWhen I’m sitting in my home it doesn't feel the sameI need eyes on me now that i need constant attentionHow the fuck can i live life when I’m not looking at mentionsGoing crazy looking at my stats for viewer retentionI’m here stuck at my desk like I’m at detention  Don't panic, look at me (okay)To calm down your stare is all i needBut I just want you to make me freeI’ll try to match your paceYou won't forget my tasteSo cant i end the night in your embraceNow can you feel my heartDetect my loveYou know you just can't get enoughLa-lee-luh-loveBaby i caught your bluff  Detect my loveI know that u love me (Yeah)Only one option i see (Yeah)Hey I won't let you stay shyWhen you’re in front of this mysterious guyHooked on this case i know i just can't stay away                   This trails been hot i really like the way you playThese pictures in my office your my prime suspectAfter our fun I'll make sure you will detectGonna wanna take a moment just look a little deeperYou’re the one that’s going to save me just like a goalkeeperPlaying your game dodging bombs its feeling like its minesweeperCan you please just realise through these bars you’re a gatekeeperFOR MY HEARTIf you now feel my heartDetect my loveYou can finally just accept this blissLa-lee-la-lee-loveYou don’t need any more words toDetect my loveYou burn bright but i'm flameproofOnly one option to chooseHey I won't let you stay shyLook at the sky, the stars so highFeel comfort now that i'm nearbyYeah you’re in front of this mysterious guy(Woah-oh) (Ah ah)(Woah-oh)De-De-DeDetect my-(Woah-oh) (Ah ah)(Woah-oh)De-De-DeDetect my love.▽　Guidance for minorshttps://www.anycolor.co.jp/notice-for...▽　For Business and PR Inquiries https://www.anycolor.co.jp/en/contact"
"BcgmfsL9gLw","No power, no water, no food! Rags to Ranches (Part 2)","2023-07-25T15:00:15Z","UC65SbK7DTllBxF7Uzinkgdg","James Turner","20","23.30.07","thesimsupply|flabaliki|the sim supply|james turner|the sims 4|bigwallet|ranch|the sims 4 horse ranch|horse ranch|rags to riches|rags|riches","330162","17747","0","1291","https://i.ytimg.com/vi/BcgmfsL9gLw/default.jpg","False","False","We have absolutely nothing at our cabin, we have to produce it all ourself!➤ Become a member to get exclusive videos & more! https://james.yt/join➤ Visit my website for my Twitter, Twitch, other channels and more!My Website: https://jamesturner.yt"
"pyAkHBjNLS8","2024 Ford Mustang GT Review // $50,000 V8 Champion","2023-07-25T10:00:43Z","UCyXiDU5qjfOPxgOPeFWGwKw","Throttle House","2","23.30.07","2024 ford mustang gt review|2024 mustang vs challenger|2024 mustang vs camaro|2024 mustang vs charger|2024 mustang exhaust|2024 mustang sound|mustang launch control|mustang quarter mile|2024 mustang drift|mustang drift button|mustang burnout|new mustang|ford vs dodge|ford vs chevy|coyote engine sound|best muscle car|mustang throttle house|turbo mustang|mustang ecoboost|2024 ecoboost|mustang fastback|mustang gt vs porsche|mustang gt vs supra","1028654","36050","0","3869","https://i.ytimg.com/vi/pyAkHBjNLS8/default.jpg","False","False","The 2024 Ford Mustang GT ($44,090 starting in the US, $50,595 in Canada) has seen many updates and styling changes in what Ford calls the all-new Mustang. With new dual air intakes and dual throttle bodies, the 2024 Mustang GT makes more power and torque from its beloved 5.0 L Coyote Engine - pushing the numbers up to 486 hp and 415 lb ft respectively. But is it really all-new? And how does it compare to the previous generation? Thomas and James are eager to get behind the wheel of the latest pony car from Ford. We hope you enjoy the episode. Subscribe! Editors: Karston Chong and Daniel MasonSound: Harrison Dickson and Karston ChongMagical Genius Logistics Planner: James Engelsman EXTRA THROTTLE HOUSE!https://www.youtube.com/c/ExtraThrottleHouseThrottle House Merch!https://www.thethrottlehouse.com/merchandise/ Instagram! https://www.instagram.com/thethrottlehouse/Facebook! https://www.facebook.com/ThomasHollandProductions/#Ford #Mustang #V8"
"yhFjZVUkCyk","Sarina Bolden gives Filipinas historic first-goal | 2023 FIFA Women's World Cup","2023-07-25T06:15:02Z","UCXDG9ue-emCN8Ad3h7lERqQ","One Sports","17","23.30.07","Sports5|ESPN5|One Sports","571302","8562","0","1231","https://i.ytimg.com/vi/yhFjZVUkCyk/default.jpg","False","False","HERSTORIC GOAL! 🇵🇭😤Golden moment for Sarina Bolden after giving the Filipinas their first-ever GOAL in the FIFA Women's World Cup!#FIFAWWC #BeyondGreatnessSubscribe to One Sports channel! http://bit.ly/OneSportsPHLWebsite: https://www.onesports.ph/Facebook: https://www.facebook.com/OneSportsPHLTwitter: https://twitter.com/OneSportsPHLInstagram: https://www.instagram.com/onesportsphlTiktok: https://www.tiktok.com/@onesportsphl"
"XNnD9IiGTdQ","Destroyed Bonnie Found in FNAF Ruin","2023-07-25T21:30:03Z","UCaoW8eKXVifyuVAD_5BgYoA","HorrorScoped","20","23.30.07","fnaf|fnaf security breach|five nights at freddy's|five nights at freddy's security breach|fnaf boundary break|security breach hacking|fnaf hacking|fnaf off camera|horrorscoped|fnaf horrorscoped|swankybox|fnaf sb|freddy fazbear security breach|fnaf security breach ruin|fnaf ruin|fnaf security breach boundary break|fnaf security breach sequence break|fnaf dlc|fnaf dlc hacking|fnaf ruin dlc|fnaf ruin bonnie|bonnie found ruin|ruin glamrock bonnie","366116","11246","0","871","https://i.ytimg.com/vi/XNnD9IiGTdQ/default.jpg","False","False","Glamrock Bonnie has finally been found within FNAF Ruin, the DLC for Sister Location. This iconic character has been missing for a while in the original release of this Five Nights at Freddy's game, but now it looks like he may have been here all along just behind Bonnie Bowl!#fnaf #fivenightsatfreddys #fnafruin #fnafsecuritybreach #securitybreachWritten and filmed by SwankyBox.Voiceover by SwankyBoxMusic from Detalrune, Zardy's Maze, and FNAF 6"
"NBQbysM1-p8","FNAF Security Breach RUIN Part 1 - GLITCHTRAP RETURNS","2023-07-25T07:00:18Z","UC5enhS5tdXhHNbj8s_kdBUw","FusionZGamer","20","23.30.07","fnaf security breach ruin|five nights at freddy's security breach ruin|fnaf security breach ruin gameplay|fnaf security breach ruin walkthrough|fnaf security breach ruin ending|fnaf secuirty breach ruin fusionzgamer|five nights at freddy's security breach ruin gameplay|five nights at freddy's security breach ruin walkthrough|fnaf|glamrock freddy|fnaf security breach|fnaf ruin|fnaf ruin dlc|security breach dlc|fnaf security breach ruin dlc","2128152","70707","0","11718","https://i.ytimg.com/vi/NBQbysM1-p8/default.jpg","False","False","FNAF Security Breach Ruin Gameplay Walkthrough Part 1 We play as Cassie who was mysteriously contacted by Gregory to return to the pizza plex and save him from the glamrock animatronics..Game: https://store.steampowered.com/app/747660/Five_Nights_at_Freddys_Security_Breach/#FNAF #FNAFSecurityBreach #fnafruin #fnafsecuritybreachruin Five nights at Freddy's Security Breach Ruin Part 1"
"Kw51fkRiKZU","The Smartest NPCs in Gaming","2023-07-24T19:30:02Z","UCsvn_Po0SmunchJYOWpOxMg","videogamedunkey","20","23.30.07","dunkey|ai|vaudeville|talking to ai|dunkey talk to ai|npc|smartest npc|npc in gaming|smartest npcs in gaming|ai npc|elden ring 2|mario odyssey 2|npc ai|npcs","1745095","100716","0","2347","https://i.ytimg.com/vi/Kw51fkRiKZU/default.jpg","False","False","dunkey hats are back in stock at https://dunkeyscastle.com/"
