video_id,title,publishedAt,channelId,channelTitle,categoryId,trending_date,tags,view_count,likes,dislikes,comment_count,thumbnail_link,comments_disabled,ratings_disabled,description
"G5bs-MmWqHg","😴Мои мысли в 3 часа Ночи #shorts","2023-07-29T07:35:05Z","UCRTPvo_rgGG8go3Yvhju20A","King jr ","20","23.30.07","king dm|кинг дм|игры|gta 5|гта са|гта 5|GTA мифы|gta 5 мифы|самый|cамое|интерсное|лучшее|лучший|топ|топ 5|топ 10|games 2023|gta|КИНГДМ|kingdm|гта 6|gta 6|2022|таный|#Short|#Shorts|games|kingjr|king jr|эксперимент|интересно|падение|гта 5 онлайн|shorts|сон|мысли вслух|мысли в 3 часа ночи|мои мысли|спать|как уснуть быстро|не могу спать|мои мысли в 3 часа ночи|для сна|асмр","1247382","96177","0","1161","https://i.ytimg.com/vi/G5bs-MmWqHg/default.jpg","False","False","😴Мои мысли в 3 часа Ночи•••••••••••••••••••••••••••••••••••••••••••••••••••Я ВК- https://vk.com/id311136869Мой Тик ток - https://www.tiktok.com/@kingjr_officialСотрудничество - king@adisom.comМоя Группа ВК - https://vk.com/public175394198•••••••••••••••••••••••••••••••••••••••••••••••••••Права на фоновую музыку:Production Music courtesy of Epidemic Sound!#shorts #ИГРЫ #ИГР #king_dm #кинг_дм #Short #2023  #gta  #gta5  #смешно  #чтобудет #приколы #гта #гта5  #мифы #разрушителимифов #разрушаем_мифы #как #выживание #моимысли #сон #мысли"
"T369mNO-tHY","BMW M5 Asco vs. Aventador. Гонка Тамаева! Ключ на Ключ","2023-07-29T11:10:30Z","UCE_1WegCXL1GATlK2WiefgQ","Асхаб Тамаев","22","23.30.07","тамаев ламба|асхаб тамаев|асхаб тамаев челендж|асхаб тамаев гонки|асхаб тамаев вызов|асхаб тамаев lamborghini aventador|lamborghini aventador против|lamborghini aventador vs bmw m5|lamborghini aventador vs bmw|бмв аска|проиграл потерял авто|уничтожение авто|тамаев уничтожил авто|мма|тамаев|тамаев влог|ключ на ключ|илон маск|наказать ламбу|lamborghini aventador потив бмв|бмв vs lamborghini|авто|заезд|bmw m5 f90|bmw m5|asca|bmw asca|bmw аска|асхаб|влог","1074960","68704","0","19276","https://i.ytimg.com/vi/T369mNO-tHY/default.jpg","False","False","Булат - https://instagram.com/ageev_bizАслан - https://instagram.com/asco.collector?igshid=MzRlODBiNWFlZA==Асхаб - https://instagram.com/tamaaev?igshid=NTc4MTIwNjQ2YQ==Мага - https://instagram.com/mahotbro?igshid=NTc4MTIwNjQ2YQ==Это Асхаб Тамаев и я приветствую вас в Москве. Это будет то, о чем вы давно просили, плюс я сам давно хотел организовать заезды здесь. Моя Lamborghini против самой быстрой BMW в мире! Мне кинули очень интересный вызов и я никогда не отказываюсь от своих слов. Говорят, что эта БМВ M5 Аска - самая быстрая. Я этому не верю. Поэтому мы решили договориться на гонку, но в этот раз мы поедем на 5 000 000 рублей. Я переосмыслил свои ошибки на прошлых заездах и готов к состязанию. А еще я много думал и хочу сказать, что Ламборджини Авентадор это уже не моя цель. Моя цель - новый проект, новая машина, машина, которая после тюнинга станет самой быстрой. Спойлер - серьезно рассматриваю Huracan, Mercedes. Но это позже, а сейчас будет то, ради чего вы пришли ко мне на канал. Смотрите, как прошли очень жесткие состязания с самой быстрой БМВ и кто взял кэш по итогу.PS я еще покажу, как я со своей семьей устроился в Москве, рум-тур и даже мой холодильник покажу!.."
"TH8XYmodeb8","Чунга Чанга и АЛИСА😂","2023-07-29T11:47:22Z","UCbMa4OByYMCGeOgyLujB8iw","Дима Сивчик","10","23.30.07","[none]","757867","42968","0","2083","https://i.ytimg.com/vi/TH8XYmodeb8/default.jpg","False","False",""
"mt-yj33cwe0","Поменяй МАТИЗ на СПОРТКАР за 60 мин: Булкин, Касаткин, Никита Ефремов, Goody","2023-07-29T17:38:35Z","UC9XJvt8OT-9_8QHDBdqocaw","Жекич Дубровский","2","23.30.07","[none]","879359","107507","0","4312","https://i.ytimg.com/vi/mt-yj33cwe0/default.jpg","False","False","Поучаствуй в реально честном конкурсе — https://l.tinkoff.ru/dubrovskiyjull🔥 *Заказать фото-конструктор Mozabrick:* https://mozabrick.ru/?utm_source=jekich&utm_medium=0723 🔥 *Промокод: JEKICH - скидка 20% на все наборы* Открой расчетный счет с бесплатным обслуживанием на полгода в Тинькофф — https://l.tinkoff.ru/dubrovskiyjulyhttps://l.tinkoff.ru/dubrovskystjul — забирай 30% кэшбэк на супермаркеты с картой Тинькофф Black. Промокод: MARKET30ООО «КЕХ еКоммерц». АО «Тинькофф Банк», лицензия ЦБ РФ № 2673. Реклама. 0+, erid: Kra23aNsxРеклама. ООО «БИБИЭЙ ГРУПП» ИНН: 7702834240, erid: Kra23utduРеклама. АО «Тинькофф Банк», лицензия ЦБ РФ № 2673, erid: Kra23wELPРеклама. АО «Тинькофф Банк», лицензия ЦБ РФ № 2673, erid: Kra23tXoDПо вопросам рекламы, сотрудничества: DubrovskiySyndicate@mail.ru👉 КАК ЗАБРАТЬ Dodge Challenger - https://challenger.dubrovskiy.gamesАренда авто: https://dubrovskiy-syndicate.com/rent---ВКонтакте: http://vk.com/zheki444Телеграм: https://t.me/dubrovskiy_444---Основной канал: http://youtube.com/c/ЖекичДубровскийАвтосалон: http://youtube.com/c/АвтосалонСиндикатаМастерская: http://youtube.com/c/МастерскаяСиндикатаДжентльмены: http://youtube.com/c/ДжентльменыСиндикатаДевчонки: http://youtube.com/c/ДевчонкиСиндикатаВертикальный: http://youtube.com/c/ВертикальныйСиндикатИгры: http://youtube.com/c/ИгрыСиндикатаФОРСАЖ: https://www.youtube.com/@forsazh---Музыка из видео: https://vk.com/motorheartstudio#ДубровскийСиндикат"
"DUTkzL1CCXM","Птицы переиграли систему #shorts","2023-07-29T11:00:14Z","UCPT9_sNLoBLjH1uea7zpVIA","This is Хорошо","24","23.30.07","this is хорошо|Стас Давыдов|и это хорошо|это хорошо|обзор видео|выпуск|новый|НОВЫЙ|новый выпуск|лучшее|за неделю|на ютубе|на youtube|реакция|РЕАКЦИЯ|смешное видео|приколы|угар|новости|НОВОСТИ|Новости|события|События|СОБЫТИЯ|шортс|забавные факты|птицы|нидерланды|бельгия|антверпен|shorts","398990","36792","0","202","https://i.ytimg.com/vi/DUTkzL1CCXM/default.jpg","False","False","🧦👕Наш мерч: https://mamcupy.com/catalog/this-is-khorosho/ 💘 Поддержать нас на Boosty: https://boosty.to/thisishorosho 🎮 Twitch Сержа: https://www.twitch.tv/serzh 👓Twitch Кости: https://www.twitch.tv/egelloff 🎞 Монтаж: https://www.instagram.com/1slava13/ 📣 Tik-Tok: https://vm.tiktok.com/s6wvx8/  📣Яндек.Дзен: https://zen.yandex.ru/orangebrains   📣 Instagram: https://www.instagram.com/orangebrained/• Discord: https://discord.gg/tix • По вопросам сотрудничества: business@vidoe.pro   #shorts #шортс #новостиМузыка взята chttps://player.epidemicsound.com/ Дополнительные звуки взяты с http://www.freesound.org"
"UH5dWJ23uJQ","ВОТ ЧТО МЫ КУПИЛИ НА ALIEXPRESS","2023-07-29T12:19:14Z","UCU_yU4xGT9hrVFo6euH8LLw","SlivkiShow","24","23.30.07","[none]","827565","52537","0","1727","https://i.ytimg.com/vi/UH5dWJ23uJQ/default.jpg","False","False","Танк - https://ali.ski/8PqYOjВинтовка - https://ali.ski/OlHwMAПодвес для кота - https://ali.ski/lnetoСиликоновая бутылка - https://ali.ski/r99rLПодушка для велосипеда - https://ali.ski/dJe7CЛазерный ошейник - https://ali.ski/Am1QnМногоногое существо - https://ali.ski/r04kQPСотрудничество - slivkivideos@gmail.comTelegram - https://t.me/slivkishow_youtubeInstagram - https://www.instagram.com/slivki_kuki/"
"GDc5PTyyNOo","Пройди Безумное Испытание - Получи 300.000 (Бустер, Хазяева и др.)","2023-07-28T16:49:55Z","UC6JRrn_7Qe1CZBcQDMieadw","ExileShow","24","23.30.07","Эксайл|ЭксайлШоу|Хазяева|Банда Ютуб|испытание|для|друзей|найди|сокровище|на|острове|получи|деньги|бустер|хазяева","2115491","190580","0","8031","https://i.ytimg.com/vi/GDc5PTyyNOo/default.jpg","False","False","Открывай город по-новому с Тинькофф — https://tinkoffbank.onelink.me/1923863684/nfytexileshow0723Ищи realme 11 Pro и Pro+ здесь: https://ozon.ru/t/Bp2Y82PА также не забывай, что при покупке до 13 августа, ты получишь 3 года подписки Изи Иви в подарок!________________________________________________________________________Сегодня я раздам 5 испытаний своим друзьям, где они должны меня выиграть!◦ Мой телеграмм: https://t.me/exilemusic13Испытание Парадеича1) Парадеич - @paradeevich 2) Андрюха -  https://t.me/mister_kokoshkaСпасибо Усадьбе Гребнево за предоставленную локацию для съемок: https://usadbagrebnevo.com/Испытание Гориллы1) Горилла - https://t.me/danila_gorilla2) Элдос - https://t.me/eldosbigИспытание ФреймТеймера1) FrameTamer - https://t.me/oieieiИспытание Кореша1) Лёша Кореш - https://t.me/koreshzyИспытание СлавыКоманда Exile1) Данон - @danoneflexing 2) Стопбан - https://t.me/stopbaba3) Блатов - @PAPABLAT22 4) Пича - https://t.me/picha455) Витя 55х55 - @55x55 Команда Бустера1) Бустер - @slavabuster 2) Герман - @GermanElClassico 3) Карат - https://t.me/karat_224) Кузя - https://t.me/kyz9_tm5) Дилблин - @dilbliin 6) Прокофьев - https://t.me/iapizdatРеклама. АО «Тинькофф Банк», лицензия  РФ № 2673erid: Kra23ZLm5Реклама. ООО РМ КОММЬЮНИКЕЙШНerid: Kra243FQT"
"hfg7NTV372M","15 КРУТЫХ ГАДЖЕТОВ И АНТИСТРЕССОВ ИЗ КИТАЯ ДЛЯ МЕДВЕДЯ ВАЛЕРЫ","2023-07-29T15:29:01Z","UCXTMoE1XgvxN4iCt5-gZzCw","Познаватель","24","23.30.07","желейный медведь|валера желейный медведь|медведь валерка|валера желейный|валера серия|познаватель|валера|медведь валера|антистрессы из Китая|антистрес|15 крутых антистрессов|15 гаджетов","482035","14150","0","799","https://i.ytimg.com/vi/hfg7NTV372M/default.jpg","False","False","МАГАЗИН от медведя Валеры: https://cutt.ly/YF5KCA4  Сегодня у нас целых 15 очень крутых антистрессов из Китая. Эти анистрессы прислали медведю Валере. Но некоторые из них оказались полезными гаджетами.*****************************Подписывайтесь на канал: http://goo.gl/ZT5Ibn15 КРУТЫХ ГАДЖЕТОВ И АНТИСТРЕССОВ ИЗ КИТАЯ ДЛЯ МЕДВЕДЯ ВАЛЕРЫ: https://youtu.be/hfg7NTV372MМузыка → Kevin MacLeod (incompetech.com)Licensed under Creative Commons: By Attribution 3.0 Licensehttps://creativecommons.org/licenses/by/3.0/*****************************************************Все права защищены © Павел Алексеев, 2017Персонаж Желейный медведь Валера и его образ, является охраняемым объектом интеллектуальной собственности, права на которого принадлежат его автору. Регистрационные документы №72461, №72462, №244640, №75451, №73000, №75454, №75455, UK Copyright Registration Certificate № 284717467 , UK Copyright Registration Certificate № 284717470, UK Copyright Registration Certificate № 284713886.Использование персонажа Желейный медведь Валера, использование его образа, копирование материалов с данного Youtube канала и перевод на другие языки запрещается."
"LekDN9eIMZM","Какое существо выживет если отрезать ему голову? Отрывок из нового выпуска «4 закона долголетия»","2023-07-29T15:29:44Z","UC2Ru64PHqW4FxoP0xhQRvJg","ТОПЛЕС","28","23.30.07","[none]","109248","7044","0","127","https://i.ytimg.com/vi/LekDN9eIMZM/default.jpg","False","False","Смотрите полный выпуск: Почему СОБАКИ ЖИВУТ так МАЛО? 4 закона ДОЛГОЛЕТИЯ#топлес #янтоплес #факты"
"MdbUmmPnMCg","24 часа в НОВОМ ГЕЛИКЕ ! *Ночь в багажнике*","2023-07-28T09:00:15Z","UC2tsySbe9TNrI-xh2lximHA","A4","24","23.30.07","24 часа в НОВОМ ГЕЛИКЕ ! *Ночь в багажнике*|24 часа в новом гелике ! *ночь в багажнике*|24 часа в машине|а4|24 часа в машине челлендж|влад а4|влад бумага|ночь в машине|24 часа на машине|а4 24 часа|гелик|а4 24 часа машине|24 часа в гелике|кто последний покинет машину|новый гелик|сплю в машине|кто последний выйдет из машины|челлендж 24 часа|челлендж в машине|а4 новый гелик|а4 новый гелик зелёный|а4 новая машина|24 часа в багажнике|ночь в багажнике","9028578","582587","0","45950","https://i.ytimg.com/vi/MdbUmmPnMCg/default.jpg","False","False","Официальный мерч А4 : https://a4shop.ruЯ купил новую машину ! И мы решили с друзьями провести 24 часа в НОВОМ ГЕЛИКЕ ! Мы заедем на новый наш ангар, покажем склады ЛаваЛава, встретимся с подписчиками и будем даже ночевать в багажнике гелика ! ПОДПИСЫВАЙСЯ ЧТОБЫ УВЕЛИЧИТЬ МОЮ САМООЦЕНКУ !) ● VK - https://vk.com/a4● Telegram - https://t.me/A4omg● Instagram - https://www.instagram.com/a4omg● MediaCube :  https://goo.su/9U8c"
"B77LZWrEMlQ","Как я зарабатываю лазая по мусоркам ? Dumpster Diving RUSSIA #62","2023-07-29T13:52:41Z","UCVeIZ3mYEkQzjKVowqgeGTA","ШТРЭБУХ","26","23.30.07","помойки|свалка|находки|штрэбух|штребух|мусорки|как я зарабатываю|заработок|находка|нашел|нашли|нашла|топ|топ 10|неожиданные|неожиданно|неожиданные находки|неожиданная находка|нашел айфон|айфон|Нашел кучу денег|нашел доллары|нашел деньги|деньги|доллары|нашел авто|автомобиль|нашел кольцо|нашел золото|золото|золотое кольцо|кольцо с бриллиантом|бриллиант|нашел телефон|неожиданно нашел|обзор находок из помойки|помойки от первого лица","132022","8688","0","415","https://i.ytimg.com/vi/B77LZWrEMlQ/default.jpg","False","False","🔴 Гель для стирки и другие товары SHIMAWildberries - https://www.wildberries.ru/catalog/145836324/detail.aspx?targetUrl=MS&size=245647929Ozon - https://www.ozon.ru/product/gel-dlya-stirki-belya-3-l-120-stirok-universalnyy-neytralnyy-zapah-gipoallergennyy-shima-home-870133580/?advert=vHqJETC7Y49GY1HL0MBKUtvbdjbV395BUKLvfXJ98nGErn4dEUwj8snok6lQIepvOE7NTwsBCn0bNaQnC0vq2SPttArIH3d_u6pKKesg0At_izGBITD_SPIMuV_Gtl05EXdYbntSu04KlVVoH4s7OtzjQlnHS74q&avtc=1&avte=2&avts=1690370120&from_sku=838354981&from_url=https%3A%2F%2Fwww.ozon.ru%2F&oos_search=false&sh=P4UlIqGPlwМагазин SHIMA на Ozon: https://www.ozon.ru/seller/shima-ofitsialnyy-magazin-622469/products/?miniapp=seller_622469Магазин SHIMA на Wildberries: https://www.wildberries.ru/seller/360170〰〰〰〰〰〰〰〰〰〰〰〰〰〰〰〰〰〰〰〰〰〰〰〰〰〰〰〰〰〰〰〰🔴 Секретный ЭКСКЛЮЗИВНЫЙ материал по ссылке - https://livestream.onelink.me/ZYcM/shtrebukh〰〰〰〰〰〰〰〰〰〰〰〰〰〰〰〰〰〰〰〰〰〰〰〰〰〰〰〰〰〰〰〰🔴 Канал КОКА КРЫМ - https://www.youtube.com/@user-dc3mf1rv3y/videos〰〰〰〰〰〰〰〰〰〰〰〰〰〰〰〰〰〰〰〰〰〰〰〰〰〰〰〰〰〰〰〰🔵 Дизайн для футболок присылайте сюда - https://t.me/+n0IyWJoB1r9iZDEy〰〰〰〰〰〰〰〰〰〰〰〰〰〰〰〰〰〰〰〰〰〰〰〰〰〰〰〰〰〰〰〰2 КАНАЛ  (где стримы) https://www.youtube.com/@ShtrebuhStreamГруппа ВК (сюрприз боксы и ПРОПУСКИ тут) https://vk.com/shtrebuhgroupЗа боксами и другими вещами пишите в лс Группы Мой телеграм канал https://t.me/ShtrebuhПоддержите меня ПОДПИСКОЙ, нажмите на КОЛОКОЛЬЧИК Этим вы меня МОТИВИРУЕТЕ снимать больше и качественней.#DumpsterDiving"
"ENOut_87u84","Беременный влог 🤰🏼 : ремонт в моем доме в деревне 🏡🌳","2023-07-28T12:20:46Z","UCVvCYgY2YFpgXrbDUHSPyQA","Ная 😈👼🏻","22","23.30.07","[none]","1186262","111959","0","642","https://i.ytimg.com/vi/ENOut_87u84/default.jpg","False","False",""
"VZEXnjjWCSI","Candy 🍭 / Eva Miller TikTok #evamiller #tiktok #shorts #video #trending #ytshorts #short","2023-07-29T12:00:31Z","UCiUz8kxpIG1Zb4IoOUcudGQ","Miller Eva","24","23.30.07","new|tiktok|tik tok|trend|2023|sound|best|funny|moments|team|cute|dance|school|Fancy TikTok|tiktoks|tiktok battle|tik tok dance|tiktok drama story|tiktok school love|evamiller|millereva|eva|evamillersha|miller|unicorn|pink|Los Angeles|America|American girl|blonde girl|love|lovely|hot|cooking|unpacking|unboxing|life|blonde|my life|my day|asmr|food|foods|lol|haha|wow|omg|spring|outfits|outfit|ytshorts|shorts|short","1339168","75056","0","363","https://i.ytimg.com/vi/VZEXnjjWCSI/default.jpg","False","False",""
"vQqVFbgpmII","МОЙ ДЕНЬ РОЖДЕНИЯ (жесть мне 21)","2023-07-29T10:57:56Z","UCGrzKEXqpIX-SCStZs77o-A","karrambaby","22","23.30.07","[none]","315842","33838","0","1127","https://i.ytimg.com/vi/vQqVFbgpmII/default.jpg","False","False","давайте мы проигнорируем что мой день рождения был месяц назад 21 июня……..лучше поздно чем никогдадрузья столько произошло тут в китае так задолбали меня простите что так долго делалось видеообнимаю вас🤕МОЯ ТЕЛЕГА У У УУ  https://t.me/karrambamby👹ИН СТА МОЯ ЛОЛ https://www.instagram.com/karrrambaby/🦟МОЙ ВК https://vk.com/karrrambaby🐡моя ГРУППА ВК https://vk.com/karrrambabymaybeмой канал для shorts 🫠🫠🫠https://youtube.com/@karrambobсотрудничество: pr.karrrambaby@gmail.com +7 (999) 983-33-39 Анна"
"gViSvexdQjw","АЛИСА и ДимДимыч😁","2023-07-29T12:29:05Z","UCbMa4OByYMCGeOgyLujB8iw","Дима Сивчик","10","23.30.07","[none]","403188","53489","0","5810","https://i.ytimg.com/vi/gViSvexdQjw/default.jpg","False","False",""
"Milum25TaME","САМЫЙ КРИНЖОВЫЙ ТРЕК🔥","2023-07-29T09:02:44Z","UCHzBaTCxVW-en659mec_eOg","Ульяна Столярова","10","23.30.07","[none]","283654","19957","0","1409","https://i.ytimg.com/vi/Milum25TaME/default.jpg","False","False",""
"CVO2hLGZ_Go","ДОБАВЬ, УРОВНЯЙ ИЛИ УМЕНЬШИ ЧЕЛЛЕНДЖ!","2023-07-29T09:13:48Z","UCJwQn49LutwtR0wHaZ5QI_g","Дюшес Team","22","23.30.07","ДОБАВЬ УРОВНЯЙ ИЛИ УМЕНЬШИ ЧЕЛЛЕНДЖ!|добавь уровняй или уменьши челлендж!|ДОБАВЬ|УРОВНЯЙ|УМЕНЬШИ|ЧЕЛЛЕНДЖ|дюшес|дюшес team|дюшес тим|дюшес челлендж|еда|еда челлендж|самый острый перец в мире|перец каролина рипер|самый жгучий перец в мире|рандомный челлендж|вытяни правильную бумажку|кто первый|кто последний|задания|жесткие задания","288684","32170","0","1034","https://i.ytimg.com/vi/CVO2hLGZ_Go/default.jpg","False","False","Переходите на портал программы «Профессионалитет» и стройте маршрут к профессии мечты: https://vk.cc/cpN1Pw• НАШ ТЕЛЕГРАМ КАНАЛ - https://t.me/duchess_official• НАШ ОСНОВНОЙ КАНАЛ -  ​⁠​⁠​⁠ ​⁠@OffDuchess • НАШ ИГРОВОЙ КАНАЛ -  ​⁠​⁠​⁠ ​⁠@DuchessOffGames • НАША ГРУППА В ВК - https://vk.com/duchessofficialПо вопросам РЕКЛАМЫ И СОТРУДНИЧЕСТВА - duches@avtormedia.ruДОБАВЬ, УРОВНЯЙ ИЛИ УМЕНЬШИ ЧЕЛЛЕНДЖ!Всем привет!) Сегодня мы с ребятами будем соревноваться в очень жестком челлендже! У нас есть 3 бумажки: добавь, уровняй и уменьши! Перед участниками будет ставится какое то мерзкое или же хорошее блюдо! И как раз таки бумажки решат, кому сколько есть и есть ли вообще! Ролик получился очень эмоциональным и интересным)"
