video_id,title,publishedAt,channelId,channelTitle,categoryId,trending_date,tags,view_count,likes,dislikes,comment_count,thumbnail_link,comments_disabled,ratings_disabled,description
"wRfTw22pPoU","Getting Every Armor in Minecraft (it took 800 days)","2023-07-29T13:30:08Z","UCvt0HYxX34vUvqu66HLXeUw","rekrap2","20","23.30.07","rekrap|lifesteal|Minecraft","901930","66206","0","6297","https://i.ytimg.com/vi/wRfTw22pPoU/default.jpg","False","False","Where I get my music: -Epidemic Sound-   https://www.epidemicsound.com/referral/hdky6e/-Artlist-   https://artlist.io/Parker-2274364"
"f7tinZd0xAE","My 1st Hollywood Red Carpet Movie Premiere with SALISH!","2023-07-29T14:15:08Z","UCv-lQ2yyKXQkdjBrgSS9gxw","Payton Delu","24","23.30.07","[none]","574747","13652","0","1771","https://i.ytimg.com/vi/f7tinZd0xAE/default.jpg","False","False","I went to my first ever Hollywood Movie Premiere with one of my Best Friends Salish Matter!  Thanks to Mattel for the Barbie Premiere and Awesome Party!Check out the video we did on her channel!https://www.youtube.com/@jordanmatter/featuredNinja Kidz Gummy Vitamins! https://ninjakidznutrition.com/👚 New NINJA MERCH 👕 ➡️ http://www.ninjakidz.store🤩 Request a personalized video: https://www.cameo.com/ninja_kidz_tv🥷 Join the Ninja Club and become a Ninja!  https://www.ninja-kidz.com/Follow Payton:📸 INSTAGRAM → https://www.instagram.com/payton_delu/📘 FACEBOOK (Ninja Kidz) → https://www.facebook.com/NinjaKidzTV/💌 FAN MAIL ADDRESS 📦Ninja KidzP.O. Box 123Draper, Ut. 84020"
"pjMUimKq3Jg","SMG4: THE NEW CASTLE!!","2023-07-29T16:00:07Z","UC8LcA3grYZg0GNpxlXh8owg","SMG4","24","23.30.07","Nintendo|Super|Mario|gaming|video game|Super Mario|Super Mario 64|SM64|SMG4|Supermarioglitchy4|Hobo|Bros|Hobo Bros|bloopers|sm64 bloopers|funny|comedy|lols|Luigi|Peach|Bowser|Toad|switch|nintendo switch|fortnite|minecraft","1246985","81593","0","20377","https://i.ytimg.com/vi/pjMUimKq3Jg/default.jpg","False","False","After all this time the new castle's finally here!!!Check out my FULLY ANIMATED SHOWS!! 👉@GLITCH Grab some MERCH to help support the channel 😃 ► http://smg4.storeSUBSCRIBE or Mario will steal your spaghetti 😡► http://bit.ly/2mcYfnh----------------------------------------------------------------FOLLOW ME ON SOCIAL MEDIA -- best way to get in contact with us!• Twitter ➤ https://twitter.com/smg4official•  Instagram ➤ https://www.instagram.com/smg4official•  TikTok ➤ https://www.tiktok.com/@smg4official"
"O27I_g_xqLI","LEO - Glimpse of Antony Das | Thalapathy Vijay | Lokesh Kanagaraj | Anirudh Ravichander","2023-07-29T10:30:02Z","UCn4rEMqKtwBQ6-oEwbd4PcA","Sony Music South","10","23.30.07","Sony Music South|Sony Music|Latest Song|Tamil song|Tamil Latest Song|Tamil Latest Songs 2023|Latest songs in Tamil|Songs in Tamil|Latest Tamil Movies|Tamil Movie Songs|Latest Video Songs Tamil|latest Tamil Love Songs|Latest Tamil Hit Songs|New Tamil Songs|LEO|vijay|thalapathy song|leo sonngs|anirudh songs|Lokesh Kanagaraj|Thalapathy Vijay|Naa Ready|naan ready","5580876","526501","0","14311","https://i.ytimg.com/vi/O27I_g_xqLI/default.jpg","False","False","Movie : LeoStarring - Thalapathy Vijay, Sanjay Dutt, Trisha, Arjun, Gautham Vasudev Menon, Mysskin, Mansoor Ali Khan, Priya AnandWritten & Directed by Lokesh KanagarajMusic : Anirudh RavichanderProducer : Lalit KumarCo Producer : Jagadish PalanisamyBanner : Seven Screen StudioDirector of Photography : Manoj ParamahamsaAction : Anbariv Editor : Philomin Raj Art Direction : N. Sathees Kumar Choreography : DineshCostume designers - Pallavi Singh, Eka Lakhani, Praveen RajaDialogue Writer : Lokesh Kanagaraj, Rathna Kumar, Deeraj VaidyPRO :  Riaz K Ahmed  Publicity Designer : Gopi PrasannaaSound Designer : SYNC Cinema Sound Mixing : Kannan Ganapat Production Controller : KTS SwaminathanExecutive Producer : Ramkumar BalasubramanianAssociate Director : Santhosh Krishnan, Sathya, Immanuel Prakash, Rohith SuryaColorist : Glen Castinho   Assistant Colorist : Nesikaa RajakumaranDI ; IGENEColorist ; Glen Castinho, Siva SankarMusic Label - Sony Music Entertainment India Pvt. Ltd.© 2023 Sony Music Entertainment India Pvt. Ltd.Subscribe Now: http://bit.ly/SonyMusicSouthVevoSubscribe Now: http://bit.ly/SonyMusicSouthYTFollow us: https://www.instagram.com/sonymusic_south/Follow us: Twitter: https://twitter.com/SonyMusicSouthLike us: Facebook: https://www.facebook.com/SonyMusicSouth"
"_CxG-9LMVTc","$1 vs $1,000 Curling Iron!","2023-07-29T14:30:20Z","UCAM2fyCjEdROyELretVTiiw","HopeScope","26","23.30.07","[none]","653080","29783","0","2171","https://i.ytimg.com/vi/_CxG-9LMVTc/default.jpg","False","False","Testing EVERY curling iron price from $1 - $1,000 to find the BEST one!Watch these videos next!I Bought Satisfying Tiktok Beauty Products:https://www.youtube.com/watch?v=cwcdGBmqd5E&t=1sI Bought UNREALISTIC Beauty Products:https://www.youtube.com/watch?v=buKcergt4dA&t=25sWigs: from https://mhotonline.com/Pink Hair Dye: from https://xmondohair.com/collections/shop-all-colorHope's FAVORITE Curling Irons:The Beachwaver: (this one is only $100!)https://amzn.to/3QjL3K8T3 1.25 inch:https://amzn.to/47aIoIpDyson Corrale Straightener:https://amzn.to/3rT5J16SteamTech Curler: (for CHEAP lol)https://go.magik.ly/ml/1ven6/Hot Tools Tapered Wand:https://amzn.to/3Yk8oNBSubscribe to my secret second channel for EXTRA content!https://www.youtube.com/channel/UCnk1idRUmwhdpy_5Il1unfw@HopeScope on INSTAGRAM and THREADS for Giveaways and more!https://www.instagram.com/hopescope@HopeScope on TIKTOK for some laughs"
"SXYshpRZS0k","TikTok's Most Unlikely Superstar","2023-07-28T19:01:30Z","UC7zsxKqd5MicTf4VhS9Y74g","Kurtis Conner","23","23.30.07","kurtis conner|kurtis connor|james chapeskie|tiktok|musician|documentary","1262200","147213","0","9321","https://i.ytimg.com/vi/SXYshpRZS0k/default.jpg","False","False","Thank you to Opera for sponsoring this video! Download the new Opera One browser today for free here: https://opr.as/Opera-One-Kurtis-ConnerLast year, I stumbled upon a mysterious musician on TikTok, and I became a massive fan of his music. This year, I met up with him...here's what happened.Check out James Chapeskie: YouTube ► https://www.youtube.com/@jameschapeskieTiktok ► https://www.tiktok.com/@jameschapeskieFOLLOW ME:► https://instagram.com/kurtisconner/► https://twitter.com/kurtisconnerNEW MERCH ► https://shop.kurtisconner.com/PODCAST:► https://patreon.com/veryreallygoodLISTEN TO MY PODCAST:► https://open.spotify.com/show/3nGVLHpNXo6MiHQmotIAHG?si=T9Q-NAIOQG6BpWL_7oUvDA► https://podcasts.apple.com/ca/podcast/very-really-good/id1335843384TWITCH:► https://www.twitch.tv/kurtisconner  MY GAMING CHANNEL: ► https://www.youtube.com/channel/UCG1CpMuKazt5wJxy3AwMfpwthanks for watching!comment those are some mad beats yo” ur reading this#kurtisconner Feeling of VictoryMusic and lyrics by James ChapeskiePerformed by James Chapeskie & Kurtis ConnerGuitar - Kevin ChapeskiePiano - Ben RedwoodProduced by James Chapeskie© 2023 J Music Records"
"NSGEGXSzU9M","Breaking Minecraft with your Dumb Ideas","2023-07-29T14:00:13Z","UC3wXNek0WLlrsirz2oz-UEQ","Knarfy","20","23.30.07","Knarfy|Knafy|Minecraft|Mods|Funny|Showcase|family|clean|safe|minecraft|mods|funny|breaking|break|breaking minecraft|minecraft chaos|chaos mods|immersive portals|modded minecraft|minecraft popular mods|showcase|minecraft update|minecraft mod|minecraft mods|mod showcase|minecraft meme|minecraft funny|funny commentary|best minecraft mods|mod|minecraft fabric|minecraft memes|java|chaos|minecraft custom|no swearing|family friendly|memes|challenge","232719","12415","0","2691","https://i.ytimg.com/vi/NSGEGXSzU9M/default.jpg","False","False","We're back with more chaos, attempting to break the game again! Can I finally defeat the comments section?This is episode 6 of my Breaking Minecraft with your Dumb Ideas series! Check out the others on my channel if you haven't seen them already!Mods included in this video:► Essential Mod (Zooming & Multiplayer): https://essential.gg/► Carpet Mod: https://modrinth.com/mod/carpet► WorldEdit: https://www.curseforge.com/minecraft/mc-mods/worldeditThanks to @syszee for the chaotic cameo!== Internal PC Specs ==► EVGA Nvidia RTX 3070 Ti► AMD Ryzen 9 5900X (12 Cores, 24 Threads)► 64 GB DDR4 RAM► NZXT N7 B550 Motherboard▶️ Subscribe to be officially amazing!! ► https://www.youtube.com/knarfy🎙️ Join my Discord Server!! ► https://discord.knarfy.com/👕 Check out the Legendary Merch Store!!► https://store.knarfy.com/🪙 Join my channel as a Member to Directly Support me and Gain some Special Perks:https://www.youtube.com/knarfy/join💸 Got some random money you want to throw at me? Please don't throw it too hard 😢https://streamelements.com/knarfy/tip📧 BUSINESS INQUIRIES (Sponsors and Collaboration): business@knarfy.com*= Social Media =*► Threads: https://www.threads.net/@itsknarfy► Twitter: https://www.twitter.com/itsknarfy/► TikTok: https://tiktok.com/@itsknarfy► Instagram: https://www.instagram.com/itsknarfy/_Please note that our comments are moderated. We will be removing inappropriate comments as we see fit for our community!__We will not silence opinions as long as they are respectful, but inappropriate language, blatant disrespect, and offensive discussion will not be tolerated!_#knarfy #minecraft #mods"
"vZpOTzxpJ3c","TEAM JIDION VS TEAM MARK 5V5 BASKETBALL GAME! Ft. Duke Dennis, Jesser, Cam Wilder, MMG and MORE!","2023-07-29T01:35:31Z","UC5qUhMoqke0mnJtgVoEn0aw","Creator League","17","23.30.07","jidion|mark|mark vs jidion|creator league|dreamcon|dreamcon basketball|creator league 5v5|5v5|team mark vs team jidion|duke dennis|amp|jesser|d'aydrian harding|ypk raye|flightreacts|creator basketball|rdcworld1|rdc|kai|kai yourrage","1019828","38543","0","1732","https://i.ytimg.com/vi/vZpOTzxpJ3c/default.jpg","False","False","TEAM MARK VS TEAM JIDION LIVE FROM DREAM CON 2023TEAM JIDION: Jidion, Jesser Cam Wilder, YPK Raye, Deshae Frost, D'Ayrdian Harding, D'Vontay Friga, Jordan BentleyTEAM MARK: Mark Phillips, Duke Dennis, MMG, ImDavis, Cam Kennedy, Peyton Hardin, Marcelas Howard, Ipi @JiDion @RDCworld1 @Jesser @DukeDennisAMP @ypkraye @CamWilder @ItsDavisss @MMG69@daydrian @MarcelasHoward @DeshaeFrost @youshouldknowpodcast @DVontayFriga @JordanBentleyVlogs"
"UJeSWbR6W04","Tesla Solar Roof Review: Was it Worth It?","2023-07-29T00:56:53Z","UCBJycsmduvYEL83R_U4JriQ","Marques Brownlee","28","23.30.07","Tesla|Tesla roof|Tesla solar|Tesla solar roof|solar roof|solar tiles|solar panels|MKBHD|Solar roof review|solar panels review|cost|price|worth it|solar worth it|solar tiles worth it|solar roof worth it|solar roof review|solar roof cost|solar roof price","2834187","152510","0","11108","https://i.ytimg.com/vi/UJeSWbR6W04/default.jpg","False","False","1 year with the Tesla solar roofGet $200 off the Pod Cover with code MKBHD at https://www.eightsleep.com/mkbhd/MKBHD Merch: http://shop.MKBHD.com Get discounts off any Tesla product with my affiliate link: http://ts.la/marques8135Tech I'm using right now: https://www.amazon.com/shop/MKBHD Playlist of MKBHD Intro music: https://goo.gl/B3AWV5 ~ http://twitter.com/MKBHD http://instagram.com/MKBHD http://facebook.com/MKBHD0:00 I have not paid for electricity in a year1:15 How does  solar work4:56 Why I picked the Tesla solar tiles7:28 Numbers/specs time!11:06 Summer13:01 Fall13:59 Winter16:25 Spring17:17 Eight Sleep18:39 The money question22:35 Quirks and Features27:11 Conclusion"
"365svb1KnyA","Champions 2023 Skin Reveal Trailer // VALORANT Champions Los Angeles","2023-07-29T14:00:02Z","UC8CX0LD98EDXl4UYX1MDCXg","VALORANT","20","23.30.07","VALORANT|valorant|valorant champions|valorant champions tour|valorant esports|first strike valorant|valorant live|valorant cinematic|valorant gameplay|valorant montage|valorant tournament|valorant trailer|valorant tournament highlights|valorant esports news|valorant esports highlights|valorant esports best moments|valorant esports teams|valorant competitive|SKINS|2023|2023 champions skins|Reveal Trailer|Los Angeles|Los|Angeles|Champions","566995","27516","0","1754","https://i.ytimg.com/vi/365svb1KnyA/default.jpg","False","False","The Champions skin line gets even better. Celebrate Champions 2023 with the all-new, limited edition Vandal and melee. Available in the in-game store starting August 4th. Learn more about VALORANT Champions at https://VALORANTEsports.comFollow the VALORANT Champions Tour on socials for more action:Twitter:  https://twitter.com/valorantesportsInstagram: https://www.instagram.com/valorantesportsFacebook: https://www.facebook.com/ValorantEsportsTikTok: https://www.tiktok.com/@valorantesportsVALORANT - Free Sign Up, Download & Playhttps://playvalorant.com/#VALORANT #VALORANTChampionsTour​ #VALORANTChampions"
"NPQZXUQomXo","Offset & Cardi B - JEALOUSY (Official Music Video)","2023-07-28T04:00:09Z","UCT_izFjZKafqwgZPsqigoBw","OffsetVEVO","10","23.30.07","Offset|Cardi|JEALOUSY|Motown|Records|Hip|Hop|MIGOS|Rap|Hip Hop|Jealousy","5734990","324597","0","21267","https://i.ytimg.com/vi/NPQZXUQomXo/default.jpg","False","False","Watch the official video for Offset & Cardi B's JEALOUSYStream // Download Offset & Cardi B's JEALOUSY here: https://offset.lnk.to/jealousyFollow Offset Everywhere: Facebook: https://www.facebook.com/91OFFSETYRN TikTok: https://www.tiktok.com/@offsetyrn Instagram: https://www.instagram.com/offsetyrnTwitter: https://www.twitter.com/offsetyrnLyrics:Offset VerseHating ass nigga cuz I got it out the mudHating in the family Nigga be ya own bloodScreaming Fuck 12 to the DA and the judgeNever been a dubNever been a scrub45 glock now , oh you want the judgeBetter than who must be high on them drugs.Cooling in the mansion with the bubbles in the tubHeard you undercover you a bitch, you was a studSet, yes Nigga don’t try meIn a lamb, I be damned if a Nigga try meGetting ham wit the fam man a nigga gotta eatShawty nothing I’ma bust ima trick for a treatFor I bought the lamb I was riding in a jeep500 horses with a stick on a seatFuck that nigga he’ll fold when it’s heatGo against the code for the dough boy you weak.Go against the grain man you kno a nigga lameCartier frames I can see a nigga brainCartier bracelet it’s matching with the chainDirt up on my name man you niggas should be ashamed.Knock off her bootsWhen I’m throwing up gangDiamond fruit loopsIn this watch and it’s plainMy dog got the juiceAnd I’m smoking propaneI’m gunning I run to the money UsainWho talking Who telling Who SangIM selling prescription cocaineShe fuck with my pimpingMy caneI’m Micheal I’m not no Jermaine.Jealousy that shit gon eat yo heart outIt’s a AR sawed off we’ll slow your squad out.it’s the beast you brought outIt’s a feast we ball outI’ll eat ya heart outI’ll pull ya card outIt’s simple, put wholes in his face like it’s dimplesNew Kimbo new bop bop bop bop make it limp himHe play with me blowing me rising my temperI got millions of racks in my mansion my templeI’m gangsta but wit yo bitch I get gentleWanksta, take out yo teeth like it’s denturesI’m blanking , you eat this glock I’m Mrs winners.Cardi Talking“What the fuck these bitches talking bout man, I mean.... Who’s telling us what?!”BARDI!Cardi VerseAin’t no bitch Finna front on meBad body bitch with the jumbo teethYellow Lamborghini like a bumblebeeGirl nobody listen to you unless you talking bout meIt’s always a bird tryna tweet shitYou offended when I be on defenseThey too worried bout me and my niggaYou should worry bout that nigga yours sleep withFace is given and never not gaveBeen to Atlanta but bitches ain’t braveHow bitches mad I’m the number 1 pickIt’s funny your nigga the one that’s a tradeBitches is mad stupid they get to the bag and lose itI’m still in the bed I live on headWater n Gas includedBitches don’t wanna go birkin for birkinBitches ain’t got enough hits for verzuzBitches be acting so different in personCartier frames I can see why she nervousThis shit is a circusI’m dipped in detergentI’m sick get the nursesMy whip got the curtainsI’m dripped out in HermesA bitch say my name then she number 1 trendingI did you a service bitchLike huh“Man what the fuck these hoes talking bout hold on hold on hold on”Look let’s keep it bean let’s keep it a buckIf I had a dick it need to be suckedAll of my opps is running they jibsStomach too big it need to be tuckedAll of that crying be keeping me upWhen Bardi’s around they see me and duckWhen I make a post I’m leaving it upThey came from the hood but they leave in the trunk bitchMusic video by Offset, Cardi B performing JEALOUSY. Motown Records; © 2023 UMG Recordings, Inc.http://vevo.ly/UcGPGm"
"k3YX2Yv9ShQ","I spent a day with RHETT & LINK","2023-07-28T18:00:21Z","UCPJHQ5_DLtxZ1gzBvZE99_g","AnthonyPadilla","27","23.30.07","anthony padilla|padilla|anthony|i spent a day with|interview","957094","57044","0","1467","https://i.ytimg.com/vi/k3YX2Yv9ShQ/default.jpg","False","False","⭐️ Become a member and watch this series UNCENSORED & AD FREE: https://www.youtube.com/anthonypadilla/join. I spent a day with Rhett & Link  to learn the truth about their friendship and good mythical morning. ▸This episode is sponsored by Betterhelp - go to http://betterhelp.com/padilla to get 10% off your first month.▸ Go to http://rocketmoney.com/padilla to cancel your unwanted subscriptions with Rocket Money. 🎙THE PODCASTSpotify ▸ https://open.spotify.com/show/5aOLuPenneHbhLh05fmkeu  Apple ▸ https://podcasts.apple.com/us/podcast/i-spent-a-day-with/id1550213250  💥NEW YOUTOOZ FIGURE: https://youtooz.com/products/anthony-padilla 🧨HUGE thank you to Rhett & Link:▸ RHETT’S INSTAGRAM - https://www.instagram.com/rhettmc/▸ LINK’S INSTAGRAM - https://www.instagram.com/linkneal/▸ MYTHICAL’S INSTAGRAM - https://www.instagram.com/mythical/🗯MORE EPISODES…▸ IAN HECOX - https://youtu.be/Jmws_bNRG6Q▸ LEGENDARY OG YOUTUBERS - https://youtu.be/Jb-179F-uyI▸ VIRAL MEME STARS 2 - https://youtu.be/4PK-HN9Oyn4🎥Crew▸ Creator, Director, Writer, etc - Anthony Padilla▸ Executive Producer - Alessandra Catanese▸ Producer/ Social Media Manager - Mallory Myers▸ Production Coordinator - Joshua Dozier▸ Director of Photography/Gaffer - Matthew Faulkner▸ Camera Operator - Macy Armstrong▸ Post Supervisor - Mike Criscimagna AKA Mork Crispy▸ Head Editor - Patrick Horba▸ Editor - Ash Duckworth▸ Editor - Nikki Blacklock▸ Sound Mixing - Major Latimer▸ Sound Supervisor - Gareth Hird ▸ Sound Editor - Jandre van Heerden▸ Assistant Editor - Levi Villalpando▸ Social Media Editor - Cassie Korn▸ Captions - Davy Gerichten🎵Theme Music Composer - Matt Good AKA The King of Emo 🖼Portrait painted by: Rhianna Robles - https://instagram.com/zerogattsu🦥Slade mascot built by: The Pastel Prince - https://youtube.com/channel/UC7wq2U4FF2NyZD1o_P8QP0g 📢BE ON THE SHOW▸ If you are part of an underrepresented subculture or live a lifestyle you feel is not widely understood and would like to be interviewed by me, email inquiry[at]pressalike.com with your subculture in the title of the email.❗️You dug this deep into the description. You owe it to yourself to subscribe ▶ https://youtube.com/subscription_center?add_user=AnthonyPadilla or get more at http://instagram.com/anthonypadilla & http://twitter.com/anthonypadilla0:00 INTRODUCTION0:55 HOW THE DUO CAME TO BE3:59 SOLIDIFYING THE FRIENDSHIP5:10 THE START OF IT ALL9:13 CREATING GMM13:34 THE HARDSHIPS22:05 THANKING RHETT & LINK27:15 SPONSOR28:18 RHETT & LINK TOGETHER34:04 BLOOPER"
"NbsFDx4Ridg","FNAF Security Breach Ruin speedruns are terrifying","2023-07-28T23:00:11Z","UCQSEAbOs6vsJfy7WN7iYaGQ","EazySpeezy","20","23.30.07","EazySpeezy|fnaf|security breach|fnaf ruin|security breach run|five nights at freddy's|full game|fnaf dlc|security breach dlc|speedrun|speed run|speedrunning|speedrunner|world record|wr|speedruns|fnaf security breach ruin|fnaf security breach|fnaf ruin ending|ruin full game|ruin no glitches|ruin glitchless|security breach ruin|ruin dlc|eazyspeezy security breach|eazyspeezy speedrun","519590","16679","0","913","https://i.ytimg.com/vi/NbsFDx4Ridg/default.jpg","False","False","Today we're doing a glitchess speedrun of the FNAF Security Breach Ruin DLC. It's a pretty fun timeCheck out FNAF Ruin's speedrunning page: https://www.speedrun.com/fnafruinMy 2nd channel (WEEKLY UPLOADS): https://www.youtube.com/eaziestspeezyWatch live at: https://twitch.tv/EazySpeezy▶ Twitter: https://twitter.com/EazySpeezy▶ Instagram: https://instagram.com/EazySpeezy/▶ Merch: https://eazyspeezy.comWatch the world record speedrun here: Not exactly sure right now, will update in a couple days when the speedrunning page gets more clearMy channel generally focuses on a more casual side of speedruns. With these videos I want to show off cool speedruns, explain how they work, and entertain. Hopefully you enjoy the content and maybe even take up speedrunning yourself, because it is truly a lot of fun!#EazySpeezy #FNAF #Speedrun #FNAFSecurityBreach #FNAFRuin"
"mY2blQc1bE8","Travis Scott's UTOPIA..","2023-07-28T18:47:26Z","UCu0r_ub9cXm7UaMMK8fSlrg","Shawn Cee","10","23.30.07","travis scott utopia|shawn cee|first reaction|hidden features|meltdown|drake|the weeknd|21|astroworld","380180","21875","0","2436","https://i.ytimg.com/vi/mY2blQc1bE8/default.jpg","False","False","5 year wait is over"
"_lDM1nAmPHI","VFX Artists React to Bad & Great CGi 111","2023-07-29T16:00:23Z","UCSpFnDQr88xCZ80N-X7t0nQ","Corridor Crew","24","23.30.07","Anime Rock Paper Scissors|Rock Paper Scissors|Mission: Impossible|mission impossible vfx|mission impossible|tom cruise|beirut|beirut explosion|the creator movie|beauty and the beast|beauty and the beast live action|beauty and the beast 2017|speed|speed 2|keanu reeves|sandra bullock|speed 2 cruise control|vfx|visual effects|hollywood","536414","29742","0","2356","https://i.ytimg.com/vi/_lDM1nAmPHI/default.jpg","False","False","Our videos are made possible by Members of CorridorDigital, our Exclusive Streaming Service! Try a membership yourself with a 14-Day Free Trail ► http://corridordigital.com/Niko, Wren, and Jordan break down some of the best (and worst) visual effects in some of your favorite Hollywood films!Instagram ► http://instagram.com/corridordigitalMerch ► https://corridordigital.store/Creative Tools ►Puget Computers: https://bit.ly/Puget_SystemsAputure Lights: https://bit.ly/Corridor_LightsB&H Photo: https://bhpho.to/3r0wEntActionVFX: https://bit.ly/TheBest_ActionVFXCinema4D: http://bit.ly/Try_Cinema4DNuke: https://bit.ly/Nuke_CompositingHoudini: https://bit.ly/HoudiniSimsOctane Render: http://bit.ly/Octane_WrenderEpidemic Music: http://bit.ly/Corridor_MusicChapters ►00:00 Welcome to VFX Artists React00:38 Anime Rock, Paper, Scissors 200:58 Mission: Impossible Masks05:17 Beirut Explosion (The Creator)08:29 Beauty and The Beast (2017)13:08 Speed 2: Cruise Control18:24 CorridorDigital.com"
"kd-ABokZCkA","The Survivor Games","2023-07-29T14:00:03Z","UCRijo3ddMTht_IHyNSNXpNQ","Dude Perfect","17","23.30.07","dude perfect|dude perfect stereotypes|dude perfect water bottle flip|bottle flip|water bottle flip|dude perfect bottle flip|dude perfect basketball|dp|dude perfect world record|edition|nerf|trick shots|trick shot|family|ping pong|bowling|clean|family friendly|bubble wrap|soccer|football|spinner|spinners|fidget spinners|dude|alone|survivor|survival|games|the|wild|nature|wilderness|archery|fire|floating|swim|snake","2110716","99779","0","3192","https://i.ytimg.com/vi/kd-ABokZCkA/default.jpg","False","False","Can we SURVIVE for 24 HOURS in the wild!? Epic competitions and crazy animal encounters! This video is absolutely INSANE! Special thanks to Bass Pro for sponsoring this video! Click HERE to get all your outdoor needs ► http://basspro.com► Thanks for subscribing! - http://bit.ly/SubDudePerfectNEXT LEVEL STUFF -------------------------------------------🎒 NEW Merch - http://bit.ly/DPStore📱 Text us - (469) 205-7005🔔 Hit the bell next to Subscribe so you don't miss a video!👨🏻‍💻 Watch our newest vids! - http://bit.ly/NewDPVids📕 Read our Book - 101 Tips, Tricks and Cool Stuff - https://bit.ly/NewDPBookFollow our Instagrams so we can be best friends -------------------------------------------🏆 http://Instagram.com/DudePerfect🧔🏻 http://Instagram.com/TylerNToney👱🏻‍♂️ http://Instagram.com/Cody_Jones_🙋🏻‍♂️ http://Instagram.com/CobyCotton👨‍🦰 http://Instagram.com/GarrettHilbert⛹🏻‍♂️ http://Instagram.com/CoryCotton-------------------------------------------Bonus points if you're still reading this! Comment: Who's team were you cheering for?Click here to learn more about Dude Perfect:http://bit.ly/AboutDudePerfectAs always...Go Big and God Bless!- Your friends at Dude PerfectBusiness or Media, please contact us at: Dude@DudePerfect.com------------5 Best Friends and a Panda.If you like Sports + Comedy, come join the Dude Perfect team!Best known for trick shots, stereotypes, battles, bottle flips, ping pong shots and all-around competitive fun, Dude Perfect prides ourselves in making the absolute best family-friendly entertainment possible! Welcome to the crew! Pound it 👊🏻 Noggin 🙇🏻‍♂️ - Dude Perfect"
